id,description,scrapetimesdescription0e3ae39c02886902,"Job Description Are You Ready to Make It Happen at Mondelēz International? Join our Mission to Lead the Future of Snacking. Make It With Pride. You will help our business react to changing business conditions with excellent data analysis. You will define the requirements, perform the analysis and identify patterns in large amounts of data. How you will contribute You will: Define requirements for analysis in a given business area and perform detailed analysis and identify trends defined in the requirements Identify patterns and help the business react to changing business conditions Perform root-cause analysis and interpret data Work with large amounts of data such as facts, figures, and mathematics/formulas and undertake analytical activities and delivers analysis outputs in accordance with customer needs and conforming to established standards Understand and be involved with aspects of the data science process As the investigator on the data science team, you will apply your knowledge of languages and pull data out of SQL databases, using Tableau/Power BI type tools, and producing basic data visualizations and reporting dashboards What you will bring A desire to drive your future and accelerate your career and the following experience and knowledge: Knowledge of Microsoft Excel, Power BI, SQL,R, Python, SAS software, Google Analytics, Google Tag Manager, Tableau, Google AdWords, statistical software Moderate knowledge in math and statistical skills, strong business acumen, moderate computer science/coding skills Develop key performance indicators and create visualizations of the data Utilize business intelligence and analytics tool Join our Mission to Lead the Future of Snacking. Make It Uniquely Yours. You are part of a new, extended team that is going to build capabilities on the fly, delivering solutions revealed as a result of the testing and learnings, and developing strong partnerships to enable growth through innovation and agile methodologies. How you will contribute You will be the center of excellence regarding Digital (Sales) Data within the team. You are bringing the outside in with relevant experience with the technical part of online sales, building your knowledge of actual proof-of-concept cases, and scope, align, adopt and leverage technology for respective learnings and pilots. With your data science experience, you will be the sparring partner for cross functional teams, customers and partners in specific projects. You know how to collect, structure and model data into strong usable insights to support decision making. What you will bring A desire to drive your future and accelerate your career. You will bring experience and knowledge in: Experience in digital data analytics Experience with search optimization Proficient in Windows and analytic tools as Google analytics and SEO key word ranking tools Curious, not content without understanding the “why” behind the “what” Technical expertise and a passion for innovation, understanding a variety of disruptive technology products and services Technical and business acumen to evaluate opportunities with internal and external partners Machine learning/artificial intelligence programming languages Familiarity with the fast-moving consumer goods or related sector Purpose of role In this role you will be responsible for collecting and structuring Digital (Sales) Data and modelling the data into strong usable insights of the digital shopper journey in order to drive online business growth. Main responsibilities Collect, track, mine and analyze Digital (Sales) Data Translate multiple data sources data in reports and actionable recommendations to stakeholders Drive success through traffic and data driven decision culture Implement Digital (Sales) Data reporting in existing dashboards and deliver monthly updates Regularly interface with stakeholders and wider analytics team, to establish yourself as the expert data advisor on Digital (Sales) Data Participate in (test&learn) project teams Operating environment Benelux peers in Category Planning and Marketing Benelux E-commerce/OOH team MEU ecommerce team Business Analytics and Sales Systems Qualifications & Leadership competencies 5+ years relevant working experience Experience in digital data analytics Experience with search optimization Proficient in Windows and analytic tools as Google analytics and SEO key word ranking tools Curious, no content without understanding the “why” behind the “what” Ability to influence stakeholders across functions, markets and cultures Strong analytical skills Strong communication skills Strong drive for results and ability to get things done Strong business acumen Ability to deal with ambiguity Problem solving mindset Fluent English / Dutch Location To be located in either: Breda (NL) (per July 1st 21, current Oosterhout) or Mechelen (BE). You will report to the Digital Sales Activation Manager Benelux The responsibilities of this position are performed within the framework of a regional business model that is defined and managed by Mondelēz Europe GmbH, Switzerland . No Relocation support available Business Unit Summary At Mondelez Europe, we are proud, not only of the iconic brands we make, but also of the people who make them. Our delicious products are created in 52 plants across Europe by more than 28,000 passionate people. We are the top maker of chocolate and biscuits and a leading maker of gum and candy. We make sure our powerful global brands and local jewels like Cadbury , Milka and Alpen Gold chocolates, Oreo , belVita , LU and Tuc biscuits, and Stimorol and Dirol gums get safely into our customers hands—and mouths. Great people and great brands. That’s who we are. Join us on our journey to continue leading the future of snacking around the world by offering the right snack, for the right moment, made the right way. Mondelēz International is an equal opportunity employer and all qualified applicants will receive consideration for employment without regard to race, color, religion, gender, sexual orientation or preference, gender identity, national origin, disability status, protected veteran status, or any other characteristic protected by law. Job Type Regular Data Science Analytics & Data Science",2021-03-17 17:49:56
4bb979e12a53e832,"At AH Technology, we aim to grow, and that’s only possible if you grow with us. That’s why you get access to best-in-class guidance and inspiring training to shape your development and career. As we work together to build on our brand and your career, you can count on (based on 40 hours per week): A competitive salary Flexible working hours and the possibility to work from home An excellent pension plan with a personal contribution of 5.3% A travel allowance for traveling to and from Zaandam 20 vacation days A budget choice in which you can decide whether you spend it on extra days (+12,5 days), discounts or pay-outs Courses from our Albert Heijn Data Academy A bonus on top of your salary Attractive discounts on various insurance policies A laptop and telephone 10% discount on your grocery shopping in our Albert Heijn stores, up to € 300 per year Regularly fun promotions and delicious tastings with free products",2021-03-17 17:49:59
229cd63869168926,"Key Tasks and Responsibilities The duties relate to Mission Science support to the definition and implementation of future Copernicus 2.0 terrestrial optical Sentinel missions and other optical missions, including support to mission requirements consolidation and the development of geophysical algorithms and preparing products. You will have the following responsibilities: Help to the management of mission requirements for optical Earth observation missions; Support convening and running of relevant CHIME and Next Generation Sentinel Mission Advisory Group and Expert Group activities, including associated organisation and administration; Coordinate the definition and development of algorithms to be used in the conversion of calibrated Top of atmosphere Radiance/Reflectances (Level 1) to geophysical parameters (Level 2); Initiate, manage and monitor the development of the Level 2 prototype processor, including: the definition of the scientific retrieval algorithms the implementation of the prototypes of the scientific retrieval algorithms the assessment of Sentinel mission performance on the basis of Level 2 products derived by prototype Level 2 processors Support and monitor the development of mission specific performance simulators; Provide support for the running of the Hypersense campaign activities, including associated satellite acquisitions by PRISMA and DESIS; Support the definition of the ground segment requirements and interface requirements, regarding Level 1 / Level 2 processor implementation and data distribution to the end users; Contribute to the preparation, planning and execution of the instrument commissioning and routine operations activities including the In-orbit Verification Phase and Calibration and Validation activities; Monitor the Sentinel mission performance during commissioning phase; Support the coordination of collaborative efforts with similar missions from other, national Space Agencies (e.g. SBG/NASA, EnMAP/DLR, PRISMA/ASI, Landsat NG/USGS+NASA); Support the generation of project level internal and external reporting (e.g., Quarterly Status Reports); Continue strong partnership with internal (e.g. EOP/TEC-departments) and external entities (e.g. NASA, ASI, DLR). Skills & Experience You will have the following qualifications and relevant experience: PhD and a minimum of 6 years scientific experience; Specialised in terrestrial Earth observation remote sensing and optical bio-geophysical variable retrieval; Demonstrated experience in terrestrial science, with strong knowledge in radiative transfer and vegetation variable retrievals; Knowledge on remote sensing principles, retrieval techniques, error assessment, data assimilation principles; Strong fundamental background in optical remote sensing, and in particular in hyperspectral remote sensing; Familiarity with the Copernicus Space Component Programme; Familiarity with EC’s directives and policies and services related to vegetation and soil monitoring and related operational Land monitoring services; Familiarity with Level 1 and Level 2 processing of vegetation and soil observations and related atmospheric corrections; (Strong) Experience in the development of Algorithm Theoretical Baseline Documents (ATBDs) and in setting up (pre-)operational processing systems; Able to work independently and in teams; Demonstrated autonomy and good organisation, planning, management and communication skills; Fluency in English is mandatory; knowledge of another European language is an advantage. This job is located in Noordwijk. We welcome applicants who are available as soon as possible. If you think you have what it takes for this job, please send your CV together with a letter of motivation (both in English and in Word) to Ms Chiara Grossardi, by clicking on the button “Apply for this job” quoting job NL-HP-4492 before 30-Mar-20. An exciting and dynamic international working environment awaits you!",2021-03-17 17:50:01
ade8036e57e17ce5,"Data Scientist - Media Analytics - 76541 Data Science - Netherlands Rotterdam, South Holland Data Scientist - Media Analytics  What is the role? You work in (small) teams on challenging modelling projects using a great variety of exciting analytical skills and tools. Our clients are big well-known companies from around the whole world operating in a great variety of markets. You help them understand the effect of their marketing effort and what they can do to improve this. In addition, you are equipped with knowledge and expertise in the field of quantitative techniques such as econometric modelling and simulation. You will apply your developed methods and models to different challenges in the field of media & marketing, such as the allocation of advertising budgets or campaign effectiveness analysis.  You comprehend complex problems quickly, are creative in finding solutions and you are results-oriented. You are part of a diverse team that consists of people with similar backgrounds, experts from the concerning work field and professional IT-staff. Being part of Nielsen, you will be able to work with major clients from all around the globe and have access to huge amounts of data.  What will I do? Processing, analysing and modelling data from various sources within a small project team working towards a client delivery Making decisions about data, methodology, and modelling within a project to ensure the quality of the outcomes, and discuss progress and issues with the project lead Contributing to technical improvements of existing solutions, as well as to the development of new analytical product offerings for (future) clients in the field of media. Instructing more junior project members in their tasks, and reviewing their work. Taking the (technical) lead of project teams.  Is this for me? Master’s degree with an emphasis on analytics & statistics such as Econometrics, (Technical/Applied) Mathematics or a related study; 2-3 years of experience; Excellent understanding of statistics and econometric modelling; Strong communication and presentation skills, with a keen eye for detail; Strong technical skills, coding experience, preferably Python; Knowledge of probabilistic programming or Bayesian modelling techniques is a plus; Interested in quantitative marketing; Good understanding of the English language, both verbally and in writing. Residing in The Netherlands or willing to relocate.  Why do I want to work here? As the arbiter of truth, Nielsen Global Media fuels the media industry with unbiased, reliable data about what people watch and listen to. To discover what’s true, we measure across all channels and platforms⁠—from podcasts to streaming TV to social media. And when companies and advertisers are armed with the truth, they have a deeper understanding of their audiences and can accelerate growth.  Do you want to move the industry forward with Nielsen? Our people are the driving force. Your thoughts, ideas and expertise can propel us forward. Whether you have fresh thinking around maximizing a new technology or you see a gap in the market, we are here to listen and take action. Our team is made strong by a diversity of thoughts, experiences, skills, and backgrounds. You’ll enjoy working with smart, fun, curious colleagues, who are passionate about their work. Come be part of a team that motivates you to do your best work!  #LI-MJ1 ABOUT NIELSEN As the arbiter of truth, Nielsen Global Media fuels the media industry with unbiased, reliable data about what people watch and listen to. To discover what’s true, we measure across all channels and platforms⁠—from podcasts to streaming TV to social media. And when companies and advertisers are armed with the truth, they have a deeper understanding of their audiences and can accelerate growth. Do you want to move the industry forward with Nielsen? Our people are the driving force. Your thoughts, ideas and expertise can propel us forward. Whether you have fresh thinking around maximizing a new technology or you see a gap in the market, we are here to listen and take action. Our team is made strong by a diversity of thoughts, experiences, skills, and backgrounds. You’ll enjoy working with smart, fun, curious colleagues, who are passionate about their work. Come be part of a team that motivates you to do your best work! Job Type: Regular Primary Location: Rotterdam,South Holland Secondary Locations: , , , Travel: No",2021-03-17 17:50:03
cad0b36d034fc061,"Jouw nieuwe baan en werkplek Do you want to make big impact, work for over 10 international brands within Ahold Delhaize (e.g. Albert Heijn, Bol.com. Delhaize, Stop & Shop and Food Lion) and work within our newly formed European Data Science & Analytics team? Then we are looking for you.  As Senior Data Scientist at Ahold Delhaize, you are an experienced data scientist who will work closely together with our data science and analytics teams from our brands (Albert Heijn, Delhaize, Etos etc.) and the regional US team. We seek mutual opportunities, work together on implementing state-of-the-art data solutions and help them taking data science and analytics to a higher level. You are experienced in identifying, implementing and improving data solutions driving sustainable value for our customers and businesses. You participate in the cross functional teams with the lead brands. As a senior data scientist you will create impact at scale, as we want to scale and leverage these solutions across the brands.   In this European team we are organized around three domains within data science: forecasting, search and personalization & relevance. In the team you will be working with data scientists, data analysts, data governance experts, experimentation experts and ML engineers. As a senior data scientist you will take projects from idea through proof of concepts to release as live products, together with our data platform teams. Within these domains we are looking for Senior Data Scientists. You will be mentored by a principal data scientist.  We work in an omni-channel context, where we focus on improving the customer experience and driving sustainable business value. E-commerce is a high strategic priority in this. Examples of products you will be working on are developing and scaling recommender systems (like cross sell, substitutes, personalized offers), personalized customer journeys (like personalized content and nexst-best-action engine), improving our search functionality for our websites and apps and improving demand forecast for e-Commerce.  As our Senior Data Scientist you will lead data science projects. You will build connections with the data scientists within Ahold Delhaize to build solutions together, such that knowledge and algorithms can be shared to other brands. To do so we have a global data science community with ~70 data experts, enhancing transparency, collaboration and developing together.  You’re a pragmatic scientist who likes getting his/her hands dirty. Because of your good communication skills you collaborate well with the team of data analysts, ML engineers and IT. Together you will improve numerous processes and the experiences of millions of customers every single day.   ?As Senior Data Scientist at Ahold Delhaize you: Provide guidance and coaching to business stakeholders on how data science techniques can support business decisions and/or solve business challenges creating business value Translating analysis into scalable algorithms in order to minimize repetitive work and to drive a data-driven, real-time and personal customer experience. Build, train and validate data science techniques using a process which ensures proper methodology, choices in solutions and architecture. You understand the importance of fairness and ethical use of AI Build a network of relevant people (internal and external) to gain access to cutting edge data methodologies and share knowledge and best practices. Explore new data science options for our brands and keep developing business driven data science solutions. Have a pragmatic mindset; you understand the larger data science picture, the dot on the horizon, and have a very pragmatic approach to this. Use your experience and knowledge to mature our Data Science team and perfect our agile way of working. ? Your Office As a Senior Data Scientist you will work at and across Ahold Delhaize where approximately 370,000 employees worldwide serve over 50 million customers a week. Locally, you’ll be working with 1,500 colleagues in Zaandam, the Netherlands. We improve and innovate every day, supporting our trusted local brands and reinforcing our role as a leader in retail and e-commerce.  You will be joining the newly formed Data Science & Analytics team. In this team we deliver scalable data products and building bridges between the different data science & analytics teams from our brands.  Covid-19 Our main priority continues to be the health and safety of our employees and customers. Due to the Covid-19 pandemic, this position will be remote until further notice. We will continue monitor the circumstances and when we feel comfortable, this position will return to our Headquarters in Zaandam, where you will have the opportunity to collaborate face-to-face with a talented and diverse group of colleagues. This also means that all job interviews for this position will take place via video calls. Dit bieden we jou At Ahold Delhaize we want to grow. That is only possible if you grow with us. That is why you get access to best in class guidance and inspiring training, to shape your own development and career. As we work together to build on our brand as well as your career, you can count on (based on 40 hours per week): a gross yearly salary up to €76k + 8% vacation pay, so you can enjoy a well-deserved rest. a bonus on top of your salary. a very good pension plan with a personal contribution of 6.2%. 20 vacation days. A budget choice which you can decide whether you spend it on extra days (+12,5 days), discounts or pay-outs. the possibility to attend training courses at our expense.? attractive discounts on various insurance policies. a laptop and telephone. 10% discount on your grocery shopping in our Albert Heijn stores, up to € 300 per year. flexible working hours and the possibility to work from home. a travel allowance for traveling to and from Zaandam, when we return to office. A new role in a new team, where you can add a lot of value. Dit breng je mee At Ahold Delhaize, you'll be working for one of the world's biggest retailers, and we know you are bursting with the ambition to keep up with us. You supplement this ambition with: A Master in Data Science, Mathematics, Econometrics, Computer Science or other relevant (technical) studies. If no relevant study, demonstrably relevant experience and results. 4-7 years of experience as Data Scientist, preferable in a retail or tech company. Great communication skills; you explain complex matter in an easy and enthusiastic way to business stakeholders and connect (to) people. being proficient in programming tools like Spark, python, pandas, scikit-learn, Pytorch/Tensorflow. have good knowledge of tech stack elements including git, Visual studio code/Pycharm, python,databricks. knowing and using open-source eco-system of algorithms and tools. good knowledge of models – linear models, non-linear models, neural networks, optimization techniques, time series modeling. practical knowledge of demand forecast models, recommendation systems, search algorithms. statistical knowledge of hypothesis testing, A/B testing, ANOVA, correlations, similarity measures, factors of variations, different various probability distributions. Lots of examples of successfully implemented data science projects.  Apply.? Do you want to play an active role in changing the food retail landscape as we know it? Then hop onboard and join us on our expedition. Apply now via the button on this page. We ask you not to send a standard motivation letter, but to formulate an answer to the following questions: ? Why would you like to work for Ahold Delhaize? Why do you think you will be successful in this position and what kind of technical skills do you bring with you for this role? What?is one of your personal strengths and one skill you wish to improve or develop?  Want to learn more first, before you apply? Caroline Fluit, hiring manager and Micha Lekawael, Talent Acquisition Partner are happy to tell you everything about this vacancy via caroline.fluit@aholddelhaize.com or micha.lekawael@ah.nl  WO Senior Data-science NLD-Zaandam, Provincialeweg 11 Je gaat werken bij",2021-03-17 17:50:06
