id,description,scrapetimesdescription2851671484ddaf4a,"Company Information Dashmote is an AI technology scale-up headquartered in Amsterdam, The Netherlands. We connect the offline and online worlds by decoding the digital footprint of locations, allowing companies including in the F&B industry to understand the on-trade market and make smarter and data-driven decisions. Today, our company has offices in Amsterdam, Shanghai, Vienna, and New York. Over the past few years, our teams have solved a wide variety of cases, such as analyzing beer drinking and hairstyle trends by utilizing our Visual Recognition Tools, as well as identifying prospective leads by generating intelligence dashboards.  Role Description As our Data Scientist in the Data Operations you are fundamental to scaling our data deliveries across the world, you participate with the data delivery team to automate the world we know today and invent solutions for the problems our clients face tomorrow. We are looking for a technical expert and someone who is able to lead a delivery team confident towards successful deliveries of complex data driven projects. You are our special forces elite data scientist that we can deploy at our most challenging client projects. You have a genuine interest in the business applicability of data and help us on our mission to drive sales actions through big data and ai. Qualified candidates have a track record of superior data science projects and have proven leadership capabilities. You understand the limitations of various data science approaches and you are able to communicate this with our clients. You will work with our rockstar team consisting of Designers, Data Scientists, Data Engineers and Data Analysts.   Main Responsibilities Driving adoption of data science at scale in our project portfolio; Develop data science models from POC to production; Collaborate with a group of experts with a clear focus on automation and scalability (both technical and organisational); Work with our current data pipeline and data components and continuously look for ways to improve the workflow; Using statistical analysis techniques to understand patterns in large volumes of data, identify relationships and data clusters, detect data anomalies, and classify data sets. Make Quality and Assurance an integral part of data science delivery;  Your Background: MSc in Computer Science, Electrical Engineering, Statistics, or equivalent fields. Ability to drive a project and work both independently and in a team. Excellent verbal and written communication. Minimum of 1-3 years’ of data science experience. Minimum 1 year experience with Python is compulsory. Experience with SQL and ML toolkit is a huge plus! Full time time availability.  What’s in it for you Great office location right in the city centre of Amsterdam. We mostly work from home for now but you can have access to the office if you prefer it! Efficient virtual communication channels to work from home Working within an international team of over 65 people that truly values your contribution Growing company full of opportunities & awarded by Google, McKinsey and Rocket Internet for best B2B startup in Europe An awesome culture of responsibility and the freedom to turn your ambition into reality - regardless of your role and level Exciting work atmosphere with no shortage of birthday treats, monthly team events and weekly Friday company catch-ups, even though most of the fun is virtually for now! If this sounds like a match, we would love to hear from you! Please note that to be considered for this role you will need to hold a valid NL Work Visa or NL Residency or NL Citizenship.",2021-03-17 17:50:34
eb7e91b93c9136b5,"Summary An exciting opportunity for an experienced Optical Scientist to join the Telespazio UK team, working on site at ESTEC, to support Optical mission requirements and activities for future Sentinel missions. Objective The duties of this post relate to Mission Science support to the definition and implementation of future Copernicus 2.0 terrestrial optical Sentinel missions and other optical missions, including support to mission requirements consolidation and the development of geophysical algorithms and preparing products. Ideally, the successfull individual will also monitor the system performance budget up to and including the commissioning phase. In performing these tasks, the individual will report to the relevant Study/Project Manager and, maintaining close coordination with the relevant Mission Scientist and other members of the Study/Project team. For the mission simulator activities, the successful candidate will work closely with the Study Team/Project, but also with experts from the technical directorate. Responsibilities / Duties Typical duties for the successful candidate will be; Helping to manage the mission requirements for optical Earth observation missions Supporting, convening, and running relevant CHIME and Next Generation Sentinel Mission Advisory Group and Expert Group activities, including associated organisation and administration Coordinating the definition and development of algorithms to be used in the conversion of calibrated Top of atmosphere Radiance/Reflectances (Level 1) to geophysical parameters (Level 2) Initiating, managing and monitoring the development of the Level 2 prototype processor, including Definition of the scientific retrieval algorithms, Implementation of the prototypes of the scientific retrieval algorithms, Assessment of Sentinel mission performance on the basis of Level 2 products derived by prototype Level 2 processors. Supporting and monitoring the development of mission specific performance simulators Providing support for the running of the Hypersense campaign activities, including associated satellite acquisitions by PRISMA and DESIS Supporting the definition of the ground segment requirements and interface requirements, regarding Level 1 / Level 2 processor implementation and data distribution to the end users Contributing to the preparation, planning and execution of the instrument commissioning and routine operations activities including the In-orbit Verification Phase and Calibration and Validation activities Monitoring the Sentinel mission performance during commissioning phase Support the coordination of collaborative efforts with similar missions from other, national Space Agencies (e.g. SBG/NASA, EnMAP/DLR, PRISMA/ASI, Landsat NG/USGS+NASA) Support the generation of project level internal and external reporting (e.g., Quarterly Status Reports) Continue strong partnership with internal (e.g. EOP/TEC-departments) and external entities (e.g. NASA, ASI, DLR) Supporting the definition of Level-2 information products guaranteed by the SAR missions. Preparing documents and technical notes as required in support of the Project Qualifications / Experience Ideally PhD (or minimum University Master’s degree) (or equivalent) in Remote Sensing, SAR or related Scientific/Engineering discipline. Essential Skills Specialised in terrestrial Earth observation remote sensing and optical bio-geophysical variable retrieval Demonstrated experience in terrestrial science, with strong knowledge in radiative transfer and vegetation variable retrievals Knowledge on remote sensing principles, retrieval techniques, error assessment, data assimilation principles Strong fundamental background in optical remote sensing, and in particular in hyperspectral remote sensing Familiarity with the Copernicus Space Component Programme Familiarity with EC’s directives and policies and services related to vegetation and soil monitoring and related operational Land monitoring services Familiarity with Level 1 and Level 2 processing of vegetation and soil observations and related atmospheric corrections Development of Algorithm Theoretical Baseline Documents (ATBDs) and in setting up (pre-)operational processing systems Qualities Proactive and analytical attitude to solving problems Good English language skills Good organizational, communication and management skills Able to work independently and in international teams Benefits Competitive Package covering salary, generous holiday allowance, training plan and more Security In line with Asylum & Immigration Legislation, all applicants must be eligible to live and work in the EU. Documented evidence of eligibility will be required from candidates as part of the recruitment process. Furthermore, in view of the nature of the work the company is in, all potential employees will undergo stringent reference and identity checks.",2021-03-17 17:50:36
274f19c552b39470,"Is het jouw passie om op basis van data analyse waarde toe te voegen voor zowel de klant als jouw collega’s? Ben jij een topper in het bouwen van voorspellende modellen? Wil jij direct resultaat zien van jouw acties? Dan ben jij de Data Scientist die wij zoeken! Deze functie biedt je een salaris van minimaal €3.566,- tot maximaal € 6.009,- (obv 36 uur per week). Inschaling is afhankelijk van kennis en ervaring Functie Als Data Scientist werk je binnen het zakelijke schade bedrijf en ben je verantwoordelijk voor het data-driven managen van de Volmacht portefeuille. Het volmacht kanaal bedient zowel zakelijke als particuliere klanten en heeft een premievolume van 1 miljard euro. Samen met onze volmacht partners stuur je het rendement en ontwikkel je nieuwe producten en tarieven. Daarnaast ga je informatie uit verscheidene systemen samenbrengen en bruikbaar maken van monitoring en analyse doeleinden. Bij dit alles maak je gebruik van de nieuwste tools en technieken. Wat je gaat doen Het analyseren van volmacht portefeuilles Het ontwikkelen van tooling en modellen om de volmacht afdeling te ondersteunen Het opstellen en verbeteren van voorspelmodellen gerelateerd aan instroom, uitstroom en rendement Het onderhouden en verbeteren van de datastromen voor de monitors in PowerBI Het ontwikkelen van nieuwe tarieven in samenwerking met Volmachten Met wie je werkt Het Data Driven Underwriting team wil pro actief vanuit data op de kwaliteit en rendement van de portefeuille sturen. Het team bestaat uit 9 mensen waaronder product managers, business analisten en een data scientist. Het team heeft een centrale rol binnen volmachten en is verantwoordelijk voor het maken van de transitie van reactieve portefeuillemanagement naar proactieve portefeuillesturing. Dit doen we door product kennis te verbinden met data science technieken en analytics tools. Daarnaast zorgen we ervoor dat we altijd leveren wat onze partners vragen, veelal in samenwerking met product managers, marketeers, de operatie en IT. Wat je meebrengt Een afgeronde (technische) WO opleiding in de richting econometrie, wiskunde, natuur/sterrenkunde, informatica of een gerelateerde studie Kennis van programmeertalen, zoals SQL, R, Python en bij voorkeur ervaring met Azure Ervaring in het maken van de vertaalslag van big data naar commerciële toepasbaarheid Kennis van BI software, zoals PowerBI Je bent communicatief vaardig en beschikt over consultancy skills, bent pragmatisch ingesteld en beschikt over implementatiekracht, hebt een pro-actieve houding en bent besluitvaardig Blijf je ontwikkelen Wij vinden het belangrijk dat jij je kunt blijven ontwikkelen. We geven je de ruimte en het vertrouwen om te groeien in je carrière en als mens. Wij helpen je hierbij met: Volop training- en opleidingsmogelijkheden in ons Learning & Development Centre Een groot (internationaal) netwerk van collega’s die graag hun kennis met je delen De autonomie om je eigen ontwikkelroute te bepalen Over NN Wij helpen mensen zorgen voor wat zij echt belangrijk vinden. De wereld waarin we leven mag dan veranderen, wat er echt toe doet voor mensen, blijft hetzelfde. Familie, vrienden, liefde, gezondheid, thuis en werk natuurlijk ook. Met jouw inzet maken we onze dienstverlening persoonlijker en relevanter. Zo kunnen we als organisatie echt het verschil maken vanuit al onze merken: Nationale-Nederlanden, NN Investment Partners, ABN AMRO Verzekeringen, Movir, AZL, BeFrank, Zicht en OHRA. Arbeidsvoorwaarden die bij jou passen Jij bent meer dan alleen een collega en dat snappen we bij NN heel goed. Je hebt verschillende rollen in het leven en daar horen keuzes bij. Wij stellen jou in staat arbeidsvoorwaarden te kiezen die voor jou belangrijk zijn en aansluiten bij jouw privésituatie. Denk aan het bijkopen van vakantiedagen en flexibele werktijden. Je vakantiegeld en 13de maand ontvang je maandelijks bij je salaris, daar hoef je niet op te wachten. Word jij onze nieuwe collega? Ben jij enthousiast over deze vacature en denk je dat je goed past in het team en bij NN? Dan nodigen wij je uit om te solliciteren. Wij zijn erg benieuwd naar wie jij bent, wat jou beweegt en wat jij kunt bijdragen in deze functie bij NN. Solliciteer direct! Heb je nog vragen over de vacature of de procedure? Bel of stel je vraag via WhatsApp aan Dante van de Kerke, Mananger Data Driven Underwriting Volmachten via 0611835918 of via Jan.Orthmann@nn.nl of via Jordi Spijker, Recruiter, via 06-215 875 92 of Jordi.Spijker@nn.nl Het gaat hier om een permanente positie. Een kandidaat ontvangt een contract van NN en we staan niet open voor interim/freelance opdrachten en/of kandidaten of acquisitie door bureaus. Alvast bedankt voor uw begrip.",2021-03-17 17:50:38
2260ca34b00cd9bf,"Your job will be We are looking for a Data Scientist that will help us implement new features into our product, and help us make smarter data-driven decisions to deliver even better services. Your primary focus will be in applying data mining techniques, doing statistical analysis, developing internal A/B testing procedures and building high quality prediction models integrated with our services. You will also be focused on: Data mining using state-of-the-art methods Improving and extending the features used by our existing systems Processing, cleaning, and aggregating data used for analysis Performing ad-hoc analysis and presenting results in a clear manner Creating automated systems and constantly tracking its performance Selecting features, building and optimizing prediction systems using machine learning techniques Collaborating with other teams within the company to improve decision making and drive product development Communicating results and ideas to key decision makers Experimenting with different tools and technologies, and evaluate new data science approaches for the business   What you bring to the table: 4+ years industry experience Experience in deploying at least one data science project to a production environment Experience with common data science toolkits, such as Pandas, Numpy, Matplotlib, Scikit-learn and Jupyter Notebooks Experience with data visualisation tools, such as Dash, Seaborn, D3, etc Good applied statistics skills, such as distributions, statistical testing, regression, etc. Good scripting and programming skills using Python Familiarity with stream processing is a huge advantage. Experience in using one or more of the following tools and technologies is a plus: Google Cloud Platform, Github, Docker, Kubernetes, MongoDB, Elasticsearch Data-oriented personality Excellent written and verbal communication skills for coordinating across teams. A drive to learn and master new technologies and techniques Being part of an early stage startup we sometimes need you to wear multiple hats just to keep things going, hence being a team player is a must have.  What Are We Doing Kaizo aims to actively guide employees towards achieving their goals and making an impact at their companies. We are building a performance development platform for customer support teams that leverages gamification and AI to improve operational efficiency, elevate teams' performance and retention with actionable goals. We are a product-led, fast-growing SaaS company with a diverse team and a globally active customer base.  Kaizo is leveraging gamification and machine learning to make the daily work experience for customer support agents more engaging, fun and productive. We run a microservice-based stream processing platform which processes 200+ million events every day using Akka Streams and Kafka. Those services are deployed to Kubernetes on Google Cloud and feed data into Elasticsearch and Mongodb. Our systems are designed to be reactive, e.g. responsive, resilient, elastic, and message-driven. We are building a real-time Machine Learning engine to continuously adjust the gamification parameters that keep our users motivated and productive. We are always scaling up to handle more data with lower latencies.  What We Bring to the Table You will work with some of the best global talent to build a tool used by great companies like Booking.com, OLX, Marleyspoon, Footlocker, Soundcloud, Tripaneer or WeTransfer. You will be part of a team of diverse and passionate people with a culture that empowers great work. We do everything to make sure you feel motivated and supported by offering: Teamwork & fun perks when full remote work is required (weekly team games & drinks, morning coffee chats and more) Investment into your personal development using our network of internal and external mentors New laptop & tools Free lunch (even while working from home) Flexible working hours and unlimited holiday policy Workations (2019: Tuscany, 2020: Dahab, 2021: ???)",2021-03-17 17:50:40
c55dff332ddb21aa,"Scientist Virological Assays (GMP) Location: Leiden Contact: Nicol Heijtbrink Job type: Contract Contact phone: +31 (0)20 406 97 50 Industry: Pharmaceutical , Life Sciences, Biotechnology Contact email: nicol_heijtbrink@oxfordcorp.com For an innovative research oriented international company we are looking for skilled scientists with experience in leadership and solid hands-on experience with development and validation of analytical & biochemical assays. Job Description Within this company we are looking for an experienced scientist with a background in pharmaceuticals. You will work in a multidisciplinary and dynamic environment on various projects such as Corona Vaccine, polio vaccine, etc. You will work with state-of the art technology with systems / techniques such as: qPCR, ELISA, SDS-PAGE, VNT, TCID 50, etc under GMP conditions. You will be involved in designing studies, writing protocols and reports, training technicians, optimizing methods and analyzing samples.  Responsibilities Design, setup, perform and analyze experiments on a regular basis, to support the assay development processes; Generating high-quality scientific reports Maintaining technical prowess by following relevant literature and knowledge in the field; Activities must be executed according to Good Clinical Laboratory Practice (GCLP) quality requirements. Remain aware and tackle any assay-related issues and potential areas of improvement in the laboratory. Responsible for instructing associate and assistant scientist on the scientific fundamentals of the assays you are responsible for; Critical review of generated data; Requirements Relevant experience in a biotechnology or biopharmaceutical industry environment involving techniques such as ELISA, (q)PCR, cell-based and virus-based assays; GMP experience and pharmaceutical technology transfer skills; Experience/knowledge of HPLC, SDS-PAGE and Western blotting is favorable; Good command of the English language (written and spoken). Benefits Contract: start with a contract of one year, directly at the company, with outlook on a permanent position Salary: €4000 - €4800 gross per month Holidays: 25 Hours: Full time,32h discussable Region: Leiden Vacancy number: 17040 Oxford Global Resources is het grootste recruitmentbureau binnen de vakgebieden Science, Engineering en IT. Al onze recruiters hebben zelf een relevante achtergrond binnen deze gebieden en helpen je graag bij het vinden van de perfecte baan in ons uitgebreide netwerk. Als gespecialiseerde partij hebben wij een groot aanbod aan laboratorium vacatures op het gebied van Quality Control (QC) en Research &Development (R&D) binnen diverse sectoren, waaronder de Farmaceutische industrie, Biotechnologie, Contract Manufacturing, Contract Research, Voedingsmiddelenindustrie, Chemie, Milieu en Plantensector. Oxford is altijd op zoek naar talent met expertise op het gebied van Biotechnologie, Immunologie, Biochemie, Virologie, Microbiologie, Moleculaire Biologie, Life Science, Analytische Chemie, Fysische Chemie, Polymeerchemie, Petrochemie en Diagnostiek. Wij komen graag in contact met kandidaten die ervaring hebben met een of meerdere van de volgende technieken: USP (Upstream Processing) DSP (Downstream Processing), Bioprocesses, viruskweek, celkweek, ELISA, FACS, Western Blot, SDS-page, PCR, RT-PCR, qPCR, kloneren, sequencing, eiwit zuivering, purificatie, HPLC, UPLC, chromatografie, fysische chemie, viscositeit, smeltpunt, pourpoint, pH, XRF, GC, GC-MS, LC, LC-MS, ICP ICP-MS, AAS, UV, titraties, Karl Fisher, formuleren, steriliteit, determinaties, bioburden, environmental monitoring, LIMS, GMP, GLP, GCP, GDP, ISO17025. Vind je deze vacature interessant? Of ben jij op zoek naar een functie op MLO, HLO, BSc, WO, MSc of PhD en heb je interesse in de vacature laboratorium Assistent, Laborant, Laborant monstervoorbereiding, Analist, Technician, Assistant Scientist, Associate Scientist, Scientist, Manufacturing Specialist, Process Engineer, Validatie Engineer, QA (Quality Assurance) Officer, RA (Regulatory Affairs) Officer, Supervisor, Teamleider, Afdelingshoofd, Hoofd Laboratorium, Manager, Director, etc. Neem dan direct contact met ons op! Apply Now",2021-03-17 17:50:42
eedc7b5c1199efb7,"For this project we're looking for a talented data scientist who will help shape the data platform of our up and coming start-up in the cloud industry. This start-up is developing an innovative solution to democratize multi-cloud management (Azure/AWS/GCP). Comparable products are: relay.sh workato.com We currently have a web application set up with functionality in our development stack of choice. Your task will be to contribute to the development of the core components of the data platform: Assist and advise in developing data science solutions for multiple applications (software & systems infrastructure) Research, analyse and prototype quantitative modelling challenges Implement data science solutions in development and production environments Contribute to the visual identity and the culture of the start-up This project is managed according to Agile principles. The intent is to collaborate on a day to day basis. Our approach is relaxed and your input, creativity and insight will be greatly appreciated. You like conceptual challenges, intellectual depth (engineering mentality) and enjoy working with the latest techniques that are currently being applied within the ICT industry. Our start-up offers a lot of freedom to explore and design thinking is a fundamental part of our DNA. In-depth training in cloud computing will be provided and you'll come into contact with various aspects of entrepreneurship. Qualifications Bachelor’s degree in Applied Mathematics, Computer Science or Econometrics. Master’s preferred. Experience programming in Python & R Experience working with SQL Experience working with software libraries PyTorch, TensorFlow, Numpy, Scikit Learn, Pandas and Matplotlib Understanding of machine learning techniques and algorithms including kNN, regression (linear/logistic), clustering, decision trees, Naïve Bayes, Markov chains and Monte Carlo Strong mathematical background with course work in Statistics, Linear Algebra, Calculus & Discrete Mathematics Creative ability to invent solutions and think autonomously Passion to learn continuously and take peers along the journey Affinity with cloud computing and track record working with Azure, AWS or GCP to develop and deploy data science models to production The internship has a duration of 4 months and is paid €1000-1250 monthly with the intent to offer a full time position if all parties involved are positive. Job Type: Internship Pay: Up to €1,250.00 per month COVID-19 considerations: The internship is entirely remote. Experience: SQL: 2 years (Preferred) Machine Learning: 2 years (Preferred) R: 1 year (Preferred) Research: 2 years (Preferred) Python: 3 years (Required) Pandas: 3 years (Preferred) Jupyter Notebooks: 1 year (Preferred) Linear Algebra: 4 years (Preferred) PyTorch: 1 year (Preferred) Cloud Computing: 1 year (Preferred) Microsoft Azure: 1 year (Preferred) TensorFlow: 3 years (Preferred) Language: English (Preferred) COVID-19 Precaution(s): Remote interview process",2021-03-17 17:50:44
