id,description,scrapetimesdescription43e2bc0b1f160b45,"Laat jij data voorspellen in plaats van een glazen bol? Kan de uitdaging voor jou niet complex genoeg zijn?  Royal FloraHolland is al een paar jaar bezig met het opzetten en verder uitbouwen van de grootste online marktplaats ter wereld: Floriday. Wij zoeken een innovatieve Data Scientist met affiniteit met de sierteelt, die een bijdrage wilt gaan leveren aan de verdere uitbouw van dit platform. Het bedrijf Het is onze ambitie om ons te ontwikkelen tot dé internationale marktplaats voor bloemen en planten. We investeren in onze fysieke en digitale marktplaats, ons logistieke- en financiële dienstenpakket om onze kwekers en overige klanten maximaal van dienst te kunnen zijn. Daarnaast zetten in op ontwikkeling, opleiding en duurzame inzetbaarheid zodat we samen in staat zijn elke dag een stap extra te zetten, onze meerwaarde voor de klant te bewijzen en onze ambitie waar te maken.  De afdeling De afdeling Data & Data Science is het Data Operation Center van Royal FloraHolland. Hier wordt op hoog niveau data uit de hele organisatie geanalyseerd en geïnnoveerd met state of the art technologieën en technieken zoals Deep Learning, Spark, Big Data en Artificial Intelligence. De afdeling ontwikkelt innovatieve oplossingen voor Royal FloraHolland en haar klanten en in het bijzonder voor het unieke project Floriday. Alle nieuwe technieken en technologieën komen hierin terug. Floriday is hét digitale handelsplatform van de sierteeltsector waar een omzet van 5x meer dan Bol.com of Coolblue wordt verhandeld.  Wat brengt de Data Scientist met zich mee? Je kent als geen ander alle technieken en technologieën op het gebied van Big Data oplossingen, deep learning en artificial intelligence. Je begrijpt hoe je data naar geavanceerde modellen en analyses omzet om klantgericht te innoveren en onze IT visie realiseren. Je weet het management met casussen en business cases te overtuigen van de toegevoegde waarde. Je werkt implementatievoorstellen uit en stelt plannen van aanpak op. Vanuit je expertrol, adviseer en begeleid je stakeholders bij de toepassing van de ontwikkelde modellen en het vertalen van vraagstukken naar slimme data oplossingen. Je werkt zowel samen in scrum teams als met je collega Data Scientists. Je begrijpt wat Royal FloraHolland doet en waar zij als grote Nederlandse handelsonderneming naar toe wil. En jij wil daar met jouw ondernemende geest deel van uitmaken! Je houdt alle ontwikkelingen op je vakgebied in de gaten en kunt ons jouw visie hierover vertellen. Je hebt een aantal jaren in een soortgelijke functie gewerkt en bent toe aan een vervolgstap in je loopbaan. Ervaring in een Agile/Scrum werkomgeving is een pré. Je deelt graag je kennis met anderen en beschikt over goede communicatieve vaardigheden. Je hebt - en dit is een must – een Master in de exacte wetenschap; Econometrie, Artifical Intelligence, Wiskunde of vergelijkbaar. Je hebt aantoonbare ervaring met Advanced Analytics, R/Python en cloud based Big Data oplossingen, zoals Spark. Je beheerst de Engelse taal, in woord en geschrift.  Wij bieden Een goed salaris (o.b.v. 38 uur per week) van € 4.000 tot €5.688 en de mogelijkheid om jezelf te ontwikkelen binnen een internationaal speelveld. Je werkt met nieuwste technologieën, waarbij je kennis en kunde wordt uitgedaagd om met vernieuwende ideeën te blijven komen. Niets staat je ontwikkeling in de weg, alleen jezelf. Je komt te werken bij de grootste bloemenveiling, internationale marktplaats én kennispartner ter wereld! Bij Royal FloraHolland wordt je inzet gewaardeerd. In allerlei opzichten. Je mag een goede werk-privé balans verwachten met volop mogelijkheden om ook na de Coronacrisis vanuit huis te werken. Verder krijg je 27 vakantiedagen per jaar en de mogelijkheid tot het bijkopen van extra dagen. Je kunt flexibel werken en jezelf blijvend ontwikkelen via de Royal FloraHolland Academy en/of het Young Professional programma. Op onze website vind je meer informatie over de arbeidsvoorwaarden en onze organisatie. Tot slot willen wij je meegeven dat de functies bij voorkeur fulltime (38 uur/week) worden ingevuld. Als je ruime ervaring meeneemt, is een 32-urige werkweek bespreekbaar.  Contact Wij verbinden kwekers en kopers aan elkaar om samen verder te groeien. Doe je mee? Reageer online, dan krijg je zo snel mogelijk een inhoudelijke reactie op je sollicitatie! Heb je inhoudelijke vragen over de vacature waar de vacaturetekst je geen antwoord op geeft? Neem dan contact op met Bart Jansen via recruitment@royalfloraholland.com. Screening is onderdeel van de sollicitatieprocedure In deze procedure geldt dat interne kandidaten voorrang krijgen ten opzichte van externe kandidaten.  Acquisitie op basis van deze vacature wordt niet op prijs gesteld",2021-03-17 17:49:37
ade8036e57e17ce5,"Data Scientist - Media Analytics - 76541 Data Science - Netherlands Rotterdam, South Holland Data Scientist - Media Analytics  What is the role? You work in (small) teams on challenging modelling projects using a great variety of exciting analytical skills and tools. Our clients are big well-known companies from around the whole world operating in a great variety of markets. You help them understand the effect of their marketing effort and what they can do to improve this. In addition, you are equipped with knowledge and expertise in the field of quantitative techniques such as econometric modelling and simulation. You will apply your developed methods and models to different challenges in the field of media & marketing, such as the allocation of advertising budgets or campaign effectiveness analysis.  You comprehend complex problems quickly, are creative in finding solutions and you are results-oriented. You are part of a diverse team that consists of people with similar backgrounds, experts from the concerning work field and professional IT-staff. Being part of Nielsen, you will be able to work with major clients from all around the globe and have access to huge amounts of data.  What will I do? Processing, analysing and modelling data from various sources within a small project team working towards a client delivery Making decisions about data, methodology, and modelling within a project to ensure the quality of the outcomes, and discuss progress and issues with the project lead Contributing to technical improvements of existing solutions, as well as to the development of new analytical product offerings for (future) clients in the field of media. Instructing more junior project members in their tasks, and reviewing their work. Taking the (technical) lead of project teams.  Is this for me? Master’s degree with an emphasis on analytics & statistics such as Econometrics, (Technical/Applied) Mathematics or a related study; 2-3 years of experience; Excellent understanding of statistics and econometric modelling; Strong communication and presentation skills, with a keen eye for detail; Strong technical skills, coding experience, preferably Python; Knowledge of probabilistic programming or Bayesian modelling techniques is a plus; Interested in quantitative marketing; Good understanding of the English language, both verbally and in writing. Residing in The Netherlands or willing to relocate.  Why do I want to work here? As the arbiter of truth, Nielsen Global Media fuels the media industry with unbiased, reliable data about what people watch and listen to. To discover what’s true, we measure across all channels and platforms⁠—from podcasts to streaming TV to social media. And when companies and advertisers are armed with the truth, they have a deeper understanding of their audiences and can accelerate growth.  Do you want to move the industry forward with Nielsen? Our people are the driving force. Your thoughts, ideas and expertise can propel us forward. Whether you have fresh thinking around maximizing a new technology or you see a gap in the market, we are here to listen and take action. Our team is made strong by a diversity of thoughts, experiences, skills, and backgrounds. You’ll enjoy working with smart, fun, curious colleagues, who are passionate about their work. Come be part of a team that motivates you to do your best work!  #LI-MJ1 ABOUT NIELSEN As the arbiter of truth, Nielsen Global Media fuels the media industry with unbiased, reliable data about what people watch and listen to. To discover what’s true, we measure across all channels and platforms⁠—from podcasts to streaming TV to social media. And when companies and advertisers are armed with the truth, they have a deeper understanding of their audiences and can accelerate growth. Do you want to move the industry forward with Nielsen? Our people are the driving force. Your thoughts, ideas and expertise can propel us forward. Whether you have fresh thinking around maximizing a new technology or you see a gap in the market, we are here to listen and take action. Our team is made strong by a diversity of thoughts, experiences, skills, and backgrounds. You’ll enjoy working with smart, fun, curious colleagues, who are passionate about their work. Come be part of a team that motivates you to do your best work! Job Type: Regular Primary Location: Rotterdam,South Holland Secondary Locations: , , , Travel: No",2021-03-17 17:49:40
cad0b36d034fc061,"Jouw nieuwe baan en werkplek Do you want to make big impact, work for over 10 international brands within Ahold Delhaize (e.g. Albert Heijn, Bol.com. Delhaize, Stop & Shop and Food Lion) and work within our newly formed European Data Science & Analytics team? Then we are looking for you.  As Senior Data Scientist at Ahold Delhaize, you are an experienced data scientist who will work closely together with our data science and analytics teams from our brands (Albert Heijn, Delhaize, Etos etc.) and the regional US team. We seek mutual opportunities, work together on implementing state-of-the-art data solutions and help them taking data science and analytics to a higher level. You are experienced in identifying, implementing and improving data solutions driving sustainable value for our customers and businesses. You participate in the cross functional teams with the lead brands. As a senior data scientist you will create impact at scale, as we want to scale and leverage these solutions across the brands.   In this European team we are organized around three domains within data science: forecasting, search and personalization & relevance. In the team you will be working with data scientists, data analysts, data governance experts, experimentation experts and ML engineers. As a senior data scientist you will take projects from idea through proof of concepts to release as live products, together with our data platform teams. Within these domains we are looking for Senior Data Scientists. You will be mentored by a principal data scientist.  We work in an omni-channel context, where we focus on improving the customer experience and driving sustainable business value. E-commerce is a high strategic priority in this. Examples of products you will be working on are developing and scaling recommender systems (like cross sell, substitutes, personalized offers), personalized customer journeys (like personalized content and nexst-best-action engine), improving our search functionality for our websites and apps and improving demand forecast for e-Commerce.  As our Senior Data Scientist you will lead data science projects. You will build connections with the data scientists within Ahold Delhaize to build solutions together, such that knowledge and algorithms can be shared to other brands. To do so we have a global data science community with ~70 data experts, enhancing transparency, collaboration and developing together.  You’re a pragmatic scientist who likes getting his/her hands dirty. Because of your good communication skills you collaborate well with the team of data analysts, ML engineers and IT. Together you will improve numerous processes and the experiences of millions of customers every single day.   ?As Senior Data Scientist at Ahold Delhaize you: Provide guidance and coaching to business stakeholders on how data science techniques can support business decisions and/or solve business challenges creating business value Translating analysis into scalable algorithms in order to minimize repetitive work and to drive a data-driven, real-time and personal customer experience. Build, train and validate data science techniques using a process which ensures proper methodology, choices in solutions and architecture. You understand the importance of fairness and ethical use of AI Build a network of relevant people (internal and external) to gain access to cutting edge data methodologies and share knowledge and best practices. Explore new data science options for our brands and keep developing business driven data science solutions. Have a pragmatic mindset; you understand the larger data science picture, the dot on the horizon, and have a very pragmatic approach to this. Use your experience and knowledge to mature our Data Science team and perfect our agile way of working. ? Your Office As a Senior Data Scientist you will work at and across Ahold Delhaize where approximately 370,000 employees worldwide serve over 50 million customers a week. Locally, you’ll be working with 1,500 colleagues in Zaandam, the Netherlands. We improve and innovate every day, supporting our trusted local brands and reinforcing our role as a leader in retail and e-commerce.  You will be joining the newly formed Data Science & Analytics team. In this team we deliver scalable data products and building bridges between the different data science & analytics teams from our brands.  Covid-19 Our main priority continues to be the health and safety of our employees and customers. Due to the Covid-19 pandemic, this position will be remote until further notice. We will continue monitor the circumstances and when we feel comfortable, this position will return to our Headquarters in Zaandam, where you will have the opportunity to collaborate face-to-face with a talented and diverse group of colleagues. This also means that all job interviews for this position will take place via video calls. Dit bieden we jou At Ahold Delhaize we want to grow. That is only possible if you grow with us. That is why you get access to best in class guidance and inspiring training, to shape your own development and career. As we work together to build on our brand as well as your career, you can count on (based on 40 hours per week): a gross yearly salary up to €76k + 8% vacation pay, so you can enjoy a well-deserved rest. a bonus on top of your salary. a very good pension plan with a personal contribution of 6.2%. 20 vacation days. A budget choice which you can decide whether you spend it on extra days (+12,5 days), discounts or pay-outs. the possibility to attend training courses at our expense.? attractive discounts on various insurance policies. a laptop and telephone. 10% discount on your grocery shopping in our Albert Heijn stores, up to € 300 per year. flexible working hours and the possibility to work from home. a travel allowance for traveling to and from Zaandam, when we return to office. A new role in a new team, where you can add a lot of value. Dit breng je mee At Ahold Delhaize, you'll be working for one of the world's biggest retailers, and we know you are bursting with the ambition to keep up with us. You supplement this ambition with: A Master in Data Science, Mathematics, Econometrics, Computer Science or other relevant (technical) studies. If no relevant study, demonstrably relevant experience and results. 4-7 years of experience as Data Scientist, preferable in a retail or tech company. Great communication skills; you explain complex matter in an easy and enthusiastic way to business stakeholders and connect (to) people. being proficient in programming tools like Spark, python, pandas, scikit-learn, Pytorch/Tensorflow. have good knowledge of tech stack elements including git, Visual studio code/Pycharm, python,databricks. knowing and using open-source eco-system of algorithms and tools. good knowledge of models – linear models, non-linear models, neural networks, optimization techniques, time series modeling. practical knowledge of demand forecast models, recommendation systems, search algorithms. statistical knowledge of hypothesis testing, A/B testing, ANOVA, correlations, similarity measures, factors of variations, different various probability distributions. Lots of examples of successfully implemented data science projects.  Apply.? Do you want to play an active role in changing the food retail landscape as we know it? Then hop onboard and join us on our expedition. Apply now via the button on this page. We ask you not to send a standard motivation letter, but to formulate an answer to the following questions: ? Why would you like to work for Ahold Delhaize? Why do you think you will be successful in this position and what kind of technical skills do you bring with you for this role? What?is one of your personal strengths and one skill you wish to improve or develop?  Want to learn more first, before you apply? Caroline Fluit, hiring manager and Micha Lekawael, Talent Acquisition Partner are happy to tell you everything about this vacancy via caroline.fluit@aholddelhaize.com or micha.lekawael@ah.nl  WO Senior Data-science NLD-Zaandam, Provincialeweg 11 Je gaat werken bij",2021-03-17 17:49:42
abb4c83f82315e0d,"Lucht is om ons heen, elke dag en elk moment. Een schone lucht is van groot belang voor ons allen. Het RIVM heeft veel data op het gebied van luchtkwaliteit. Maar zonder een goede data scientist / analist kunnen wij deze data niet voldoende duiden. Bij ons mag je met onze data aan de slag om een goede duiding te geven van onze data, data te extrapoleren en modellen te bouwen. Jij gaat in deze functie in ieder geval aan de slag met data voor de concentratie- en depositiekaarten voor luchtkwaliteit (GCN/GDN), het Nationaal Samenwerkingsprogramma Luchtkwaliteit (NSL) en het Schone Lucht Akkoord. Maar je gaat waarschijnlijk ook werken voor vragen van gemeenten en provincies. Met jouw werk lever je een belangrijke bijdrage aan het luchtkwaliteitbeleid en luchtkwaliteitonderzoek in Nederland en daar buiten. Jouw werkzaamheden zullen variëren van het structureren en analyseren van luchtkwaliteitsdata, het bijdragen aan de interpretatie en duiding van de onderzoeksresultaten tot data extrapolatie en modellenbouw. Je selecteert kritisch en systematisch juiste en relevante gegevens uit verschillende informatiebronnen en toetst dit bij collega’s. Je komt met analyses van onderzoeksvragen vanuit verschillende invalshoeken en je legt hierbij de juiste verbanden. Kwaliteit en transparantie van de producten zijn daarbij essentieel. Binnen deze functie vragen we van je om mee te denken over innovatie in je werk waarbij je data op een andere manier toegankelijk maakt en visualiseert. De werkzaamheden blijven in beweging. Wat bieden wij? We bieden een interessante en uitdagende baan op een dynamisch dossier Een grote hoeveelheid luchtkwaliteitsdata De mogelijkheid om de diepte in te gaan en de vraag achter de vraag op te zoeken Een bijdrage aan een gezonde en veilige leefomgeving Ons kantoor grenst aan een prachtig bosrijk gebied De bekroonde RIVM Corporate Academie Een divers team met als collega’s gedreven onderzoekers, datamanagers, modelleurs en projectleiders Functie-eisen Je bent een resultaatgerichte en zorgvuldige HBO’er of WO’er met een technische / natuurwetenschappelijke opleiding met affiniteit voor statistiek en luchtkwaliteit Je hebt brede programmeerervaring met bijvoorbeeld R of Fortran en affiniteit met GIS software en databases Je hebt ervaring met data analyses en visualisaties Je bent analytisch, nauwkeurig en pragmatisch Je kunt goed samenwerken Je bent stressbestendig Zowel net afgestudeerden als mensen met werkervaring nodigen we uit om te reageren Arbeidsvoorwaarden Salarisniveau schaal 10 Maandsalaris Min €2.756 – Max. €4.430 (bruto) Dienstverband Arbeidsovereenkomst voor bepaalde tijd Contractduur 18 maanden Minimaal aantal uren per week 32 Maximaal aantal uren per week 36 Overige arbeidsvoorwaarden Naast het salaris ontvang je een Individueel Keuzebudget (IKB). Het IKB bestaat uit geld (16,37% van je bruto jaarsalaris) en tijd. Met het IKB maak jij de keuzes die bij jou passen en kun je een deel van je arbeidsvoorwaarden zelf samenstellen. Je kunt er bijvoorbeeld voor kiezen om een deel van je maandinkomen te laten uitbetalen wanneer jij dat wenst. Ook kun je dit budget omzetten in verlof en andersom of besteden aan fiscaal vriendelijke doelen. De Rijksoverheid hecht sterk aan persoonlijke groei en loopbaanontwikkeling en biedt daarvoor tal van mogelijkheden. Tot de secundaire arbeidsvoorwaarden behoren onder meer verschillende studiefaciliteiten, bedrijfsfitness, volledige vergoeding van je OV-reiskosten woon-werkverkeer en gedeeltelijk betaald ouderschapsverlof. Bijzonderheden We ontvangen graag je digitale sollicitatie waarbij je je motivatiebrief mag richten aan Kitty de Bruin. Acquisitie naar aanleiding van deze vacature wordt niet op prijs gesteld. Meer over de functiegroep Onderzoeksmedewerker Door het Functiegebouw Rijk worden medewerkers en leidinggevenden geholpen bij het maken van resultaat- en ontwikkelafspraken in functioneringsgesprekken en krijgt men inzicht in de loopbaanmogelijkheden binnen de Rijksoverheid. Meer informatie op Functiegebouw Rijksoverheid Meer over jouw toekomstige afdeling De afdeling Luchtkwaliteit en Geluid (LKG) is verantwoordelijk voor kennis voor het beleid op het gebied van geluid en lucht. Wat speelt er op dit gebied, wat is nu en de komende jaren urgent en wat is dus het beleid en moet er gemeten en gemonitord worden? LKG richt zich op wetenschappelijke kennisvragen met een beleidsmatig karakter voor de thema’s geluid, lucht en de koppeling van EU lucht- & geluidbeleid. Deze kennisvragen kennen vaak een samenhang met gezondheid, waarbij we nauw samenwerken met andere afdelingen binnen het RIVM. Bij lucht staat de monitoring, duiding en het genereren van de vele data op het gebied van luchtkwaliteit centraal. Diverse luchtmodellen nemen hierbij een belangrijke plek in waarbij we werken aan doorontwikkeling en toekomstbestendig maken van de (afgeleide) producten, zoals het Nationaal samenwerkingsprogramma luchtkwaliteit, de concentratie- en depositiekaarten voor luchtkwaliteit (GCN/GDN). Ook dragen we bij aan gezondheidsgerelateerde producten als het Schone Lucht Akkoord. Rijksinstituut voor Volksgezondheid en Milieu (RIVM) RIVM: deskundig, betrouwbaar en onafhankelijk Als Rijksinstituut voor Volksgezondheid en Milieu (RIVM) zijn we een deskundige, betrouwbare en onafhankelijke adviseur voor overheid, professionals en burgers. Ons doel: een gezonde bevolking en een duurzame, veilige en gezonde leefomgeving. We bewaken gezondheid, ziekten, de kwaliteit van de leefomgeving én het milieu. Daarvoor doen we onderzoek en we verzamelen kennis voor toegankelijke informatie en toepasbare adviezen. Het RIVM zorgt voor een goede geboortescreening, het bestrijden van infectieziekten en heeft een centrale rol bij het Rijksvaccinatieprogramma en de bevolkingsonderzoeken. We onderzoeken wat er nodig is voor goede zorg, een gezonde leefstijl, veilige producten en een veilige en gezonde leefomgeving. Ook dragen we bij aan het voorkomen, bestrijden en beheersen van incidenten en crises. Vanuit ons hoofdkantoor in Bilthoven en vanaf 2021 vanuit een prachtig nieuw gebouw op het Utrecht Science Park, werken we met ongeveer 1800 collega’s aan al onze adviezen, rapporten, factsheets en publicaties. Daarbij laten we ons leiden door de vragen van vandaag én morgen. We doen ons werk midden in de maatschappij. Trots zijn we op onze organisatie waar iedereen welkom is. Als kennisinstituut van de overheid willen we een afspiegeling van de samenleving zijn. Naast talent, ervaring en motivatie maken ook aspecten van identiteit zoals leeftijd, geaardheid, culturele achtergrond of arbeidsbeperking, onze organisatie rijker, innovatiever én leuker. Met deze verschillende achtergronden, perspectieven en inzichten werken wij samen aan een nog beter resultaat! RIVM – De zorg voor morgen begint vandaag Rijksinstituut voor Volksgezondheid en Milieu (RIVM)",2021-03-17 17:49:44
