id,description,scrapetimesdescription
de2982ae1af7fd82,"We are looking for Data Scientists to join WCC’s Data Science group! WCC’s software solutions – powered by our unique search & match platform – see 1/3 billion people every day. Through our solutions, these people are impacted in important aspects of their daily lives, ranging from establishing their identity and keeping them safe to finding the job of their dreams. Moreover, our solutions enable businesses to operate more effectively and efficiently by aligning data within and between databases. Our solutions process vast amounts of data to make this happen.  At WCC, we are focused on making data work for our customers through software that matters. We enable our customers to seamlessly capture, generate, and analyze big data from multiple sources, thus gaining valuable insights paramount to effective decision-making. In order to make our game-changing technology excel and evolve, we heavily rely on our world-class data and analytics talents. These professionals turn our clients’ data into actionable knowledge by combining domain expertise and human intelligence with artificial intelligence. As a Data Scientist at WCC, you work in an innovative, international environment where you are challenged to develop analytical methods that constantly improve our products, as well as to contribute to technology that truly impacts and improves the lives of people around the world. Data Science professionals play a crucial role WCC's business processes, both in product development and in project execution. Data Engineers are challenged to preprocess imperfect real-world data and set-up infrastructures that allow for our products to make optimal use of this data. These infrastructures also enable our Data Analysts to uncover how our delivery teams can best model data, represent domain knowledge, and fine-tune our products to get the most value out of our customers' data. Data Scientists oversee the whole process in close collaboration with architects and other leaders across the broader organization. Furthermore, Data Scientists are involved in RFI, RFP, and project execution phases to help understand and shape our customers' requirements and expectations, and to subsequently transform these into concrete analytical approaches, business cases, and roadmaps. This requires not only technical skills and ingenuity, but effective communication with internal and external stakeholders as well. We are looking to expand our team with Data Scientists who: Have a completed Ph.D. degree in a quantitative field like Data Science, Artificial Intelligence, Machine Learning, Computer Science, Statistics, Mathematics, or Econometrics Have at least 3 years of professional experience in quantitative analysis on large volumes of data, for instance by using Spark/Hadoop in combination with statistics and machine learning packages like MLlib or Weka; Have a deep understanding of the state-of-the-art, strengths, and pitfalls of Data Science methods and techniques; Are experienced in optimizing analytical methods for robustness and scalability in environments with large amounts of imperfect real-world data; Balance their strong analytical mindset with a pragmatic approach to identifying the most appropriate and effective Data Science concepts for real-world problems; Can explain complex concepts in an understandable way, so that the insights obtained through Data Science can be capitalized on by a broad audience; Are able to think independently and act as a team player; Have excellent oral and written communication skills in English. Do you have what it takes to make an impact on people’s lives through the power of data? Then let’s meet! please upload your CV in English via the ""Apply"" button. You will hear back from us within the blink of an eye. Click here for the application process. Questions? Contact Janine Hilbrandie, hrm@wcc-group.com. For more information call +31(0)307503200",2021-03-17 17:49:12
9464ddafc2199e9c,"Janssen Research & Development is recruiting an iPSC expert (Scientist) to join the Neuroscience Discovery Therapeutic Area to work in the field of drug development for neurodegenerative diseases. At the Janssen Pharmaceutical Companies of Johnson & Johnson, we are working to create a world without disease. Transforming lives by finding new and better ways to prevent, intercept, treat and cure disease inspires us. We bring together the best minds and pursue the most promising solutions to address important unmet medical needs in neuroscience, oncology, immunology, infectious-, cardiovascular- and metabolic diseases. Please visit http://www.janssenrnd.com/ for more information.  The recruited scientist will join the iPSC platform within the Neuroscience team in Beerse (Belgium) and contribute to the development of novel preventive- and disease modifying-therapies for Neurodegenerative disorders as Alzheimer’s disease and Parkinson’s disease.  As part of a multidisciplinary team, the candidate will independently manage, design and perform high quality experiments aligned with overall strategy of the company. As a scientist in our team, you will contribute to adapt novel iPSC-based assays to support screening, high content imaging and functional assays for drug development. The successful candidate will work with cross-functional groups and perform in-depth analysis to put meaningful outcomes in disease context. Data integrity, accuracy and timely reporting to project team leads is critical. The successful candidate needs to have substantial experience in stem cell biology (hiPSCs/ES), gene editing and in bioinformatics (eg transcriptomics, biostatistics, etc). The scientist will focus on modeling human biology and disease by generating and evaluating gene edited iPSC lines and differentiating them into relevant cell types to perform molecular/functional phenotyping. Key responsibilities: Regular quality controls and characterization of pluripotent stem cells, progenitors & terminally differentiated cells by image-, biochemical- and molecular-based methods and in functional assays. Design and execute scientific experiments using cell types relevant to neurodegeneration such neurons, astrocytes and microglia, among others. Generate complex cell culture models combining genetically manipulated differentiated cells. Integrate methods to scale-up production of pre-differentiated cells amenable for drug development. Supply high-quality, iPSC-derived cells according to departmental needs for target validation and screening purposes. Work as part of a team in a pharmaceutical laboratory setting as well as contribute individually to meet project timeline and objectives. Record and analyze experimental data according to established procedures, verify data integrity and accuracy, and report/summarize findings to the team. Project management skills and experience: designing and executing strategic plans, assessment and evaluation of projects progression, manage communications internal and externally (CROs, SMEs, international collaborations) and provide project updates in a timely and concise manner.  Qualifications Candidate should have a PhD in neuroscience, cell biology, stem cell biology, molecular biology, developmental biology or related discipline with 4+ years of highly productive working experience (preferably in biotech/pharma companies). Candidates with less than 4 years of experience will not be considered. Proven track-record of scientific excellence as evidenced by a strong publication and/or patent record. Background in bioinformatics applied to high-throughput analysis (transcriptomics, high-content imaging, screenings, etc) Experience and Skills: iPSC technology: Deep knowledge of Good Cell Culture Practices using human pluripotent stem cells (banking, culture, characterization, QC, differentiation and co-culturing). Gene editing/genetic manipulation: experience with gene editing technologies such as CRISPR (KO, targeted KI, multiplexed gene editing, or base editing), and hands on experience in genetic manipulation using siRNA, lentivirus or AAVs systems. Cell biology: Proven hands-on experience with a variety cell-based and molecular biology readout technologies, such as FACS, flow cytometry, qRT-PCR, ELISA, immunostaining, high-content and confocal imaging, and genetic assessment. Critical thinking: Acknowledge technology limitations, and critically design strategies to overcome them with the goal of addressing key biologic and clinical questions. Dynamism: Fast learning, intellectually curious, and well-informed on the latest scientific advances in the field. Pro-active and creative thinking in solving scientific problems. Ability to process new information, work independently and structure qualitative/quantitative data to draw insightful conclusions. Perspective: looking beyond short-term readouts, and ability to plot reductionist readouts of iPSC-based assays in disease context (clinical and pre-clinical data integration from gene expression, biochemical and functional assays). Teamwork: Excellent interpersonal skills with the ability to interact effectively with people, putting the goals of the larger team first. Ability to work in international environments, eager to cooperate with team members, reach out and interact with CROs and external suppliers. Integrity: Detail-oriented, with excellent record-keeping skills according to established procedures. Flexibility: Strong organizational skills including the ability to independently manage several experiments simultaneously and to lead projects. Communication: Excellent oral and written communication skills with the ability to convey clear ideas and opinions. Able to effectively present scientific data and concepts to international standards.  What we offer:  Professional environment driven by scientific questions oriented towards the development of new medicines. Opportunities to engage into national/international collaborations and build up a professional career in the field. Possibility to independently lead projects aligned with department/company strategies. Contributing to our mission to continue to bring transformational new medicines to patients for a world without disease. Being part of a motivated and experienced global research team in an innovative and diverse working environment. A competitive salary, health promotion and energy programs and other benefits for you and your family.  Primary Location Belgium-Antwerp-Beerse- Other Locations Europe/Middle East/Africa-Netherlands, Europe/Middle East/Africa-Switzerland, Europe/Middle East/Africa-Italy, Europe/Middle East/Africa-Portugal, North America-United States, Europe/Middle East/Africa-Germany, Europe/Middle East/Africa-Spain, Europe/Middle East/Africa-France, Europe/Middle East/Africa-United Kingdom Organization Janssen Pharmaceutica N.V. (7555) Job Function R&D Requisition ID 2105906560W",2021-03-17 17:49:15
de4c43cba838785c,"Purpose of the role  This position is responsible for executing data analytics activities in the EMEA Production Research department. You will develop models and algorithms for different Production Research activities and provide Data/Statistical support to the Vegetable Production Research team. This position will train, support, promote and assure data practices and statistical rigor in cross-functional disciplines within Bayer such as Seed Technology and Production. This position will be based in Bergschenhoek, the Netherlands.  Key tasks & Responsibilities Build solid reports connected to process maps and internal data collection initiatives to allow decision making processes in the Production Research & Seed Technology organisation and identify research opportunities. Identify and initiate projects, support data management and analysis opportunities within Bayer that can lead to a higher quality and more secure processes. Data and Statistic analysis – Prepare solid (historical) data analysis reports to measure performance of processes to identify improvement opportunities and research subjects. Support Production, Production Research and Seed Technology department in solid reporting of (project) performance. Consolidate, monitor and communicate to leadership statistical indicators to support data compliance and reliability; Support KPIs build up and follow up with action plans to team members; Provide data management technical expertise & support, as needed, in solving critical business issues. Cross-functionally participate and support root cause analysis and corrective action processes. Develop models and algorithms to predict and improve quality of seed, plants or Production or Operations processes based on plant, environmental and/or seed (quality) data Serves as a trainer to train people in basic statistics, and basic modelling to execute protocols developments from research to practical application. Prepares presentations and promote the value and benefits of the work at key stakeholder meetings. Adheres to Company HSE , Business Conduct and human rights policies. Meets expectations related to ISO certification, Six Sigma and LEAN activities. Quality Management Systems & Audits assure documentation, auditing and improvement systems related to ISO and other accreditation requirements are met, both for own work as well for departments connected.   Qualifications & Competencies You have a master in Statistics, mathemathical modeling or other data related study combined with multiple years of commercial working experience. Experience in data management and analysis; data mining and visualization. Predictive analytics experience is a plus. Hands-on experience in research environment, experimental design and execution of field trials. Knowledge of seed production or related crop production experience will be beneficial but not a must. Excellent human relation skills, effective oral and written communication skills required. Demonstrated project management skills. The ability to communicate with different reporting levels in multi-national and cultural organization as an individual or a team. Decision making and problem-solving skills. Challenging the status quo to improve processes and the way things are done. Experience in algorithmic and programming skills in scripting languages (R and Python). Processing, analyzing and visualizing large multivariate datasets. Experience in pulling data from the data lake (AWS S3 Bucket) with meta data. Knowledge of how to apply Time Series to your data. Experience with Github and Domino. You are elible to work within the Netherlands and hold a the needed documents.  What Bayer offers you At Bayer you have the opportunity to be part of a culture where we value the passion of our employees to innovate and give them the power to change.  Bayer Crop Science employees benefit from good employment conditions, such as: Excellent competitive salary. An additional 8,33% holiday allowance. 25 days of annual leave A solid retirement plan Plenty of challenges and international opportunities to learn and develop yourself. An informal and professional atmosphere.  Interested in this position? Reach out to us by clicking the ‘Apply’ button! In case of any questions you can contact Luuck van Kooten via Luuck.vankooten.ext@bayer.com. We kindly request you to apply through our career page.  Do you want to know more about what our people do at Bayer? Check our social wall via www.career.bayer.be/en/sociall-wall/ and follow us on social media via #TeamBayerBenelux!  #LI-BNL",2021-03-17 17:49:16
d4d6606b8b0b9c56,"FULLTIME (40 HOURS/WEEK) The Interfood Group is a leading global dairy trading company (milk powders, butter, cheese, dairy blends etc.). The Group consists of 14 offices in all continents with over 300 employees. Interfood's accounts are dairy producers and processors, government institutions and importers / distributors all over the globe. Interfood's success is founded in its pro-active & service oriented market approach, its global presence and its extensive market and product knowledge and its strive for excellence,  To sustain and further grow our success we are looking for a Data Scientist.  Job description This new role is created to sustain and grow the success of our Global Commercial Analytics team (United States, The Netherlands, Singapore). This team acts as innovation center on advanced analytics and data science, supporting the strategic agenda set by the board of directors. In this role you will report to the global Commercial Analytics Manager. In a trade-driven organization you will furthermore, as Data Scientist, deliver a significant contribution to the decision-making process. Through your knowledge, skills and experience you are, together with your team, able to combine data analytics with creating new business opportunities. This new role is created as a result of growth of the business and innovation in our approach. For a complete overview of the job, please click the button below. Learn more  Our Office",2021-03-17 17:49:19
abb4c83f82315e0d,"Lucht is om ons heen, elke dag en elk moment. Een schone lucht is van groot belang voor ons allen. Het RIVM heeft veel data op het gebied van luchtkwaliteit. Maar zonder een goede data scientist / analist kunnen wij deze data niet voldoende duiden. Bij ons mag je met onze data aan de slag om een goede duiding te geven van onze data, data te extrapoleren en modellen te bouwen. Jij gaat in deze functie in ieder geval aan de slag met data voor de concentratie- en depositiekaarten voor luchtkwaliteit (GCN/GDN), het Nationaal Samenwerkingsprogramma Luchtkwaliteit (NSL) en het Schone Lucht Akkoord. Maar je gaat waarschijnlijk ook werken voor vragen van gemeenten en provincies. Met jouw werk lever je een belangrijke bijdrage aan het luchtkwaliteitbeleid en luchtkwaliteitonderzoek in Nederland en daar buiten. Jouw werkzaamheden zullen variëren van het structureren en analyseren van luchtkwaliteitsdata, het bijdragen aan de interpretatie en duiding van de onderzoeksresultaten tot data extrapolatie en modellenbouw. Je selecteert kritisch en systematisch juiste en relevante gegevens uit verschillende informatiebronnen en toetst dit bij collega’s. Je komt met analyses van onderzoeksvragen vanuit verschillende invalshoeken en je legt hierbij de juiste verbanden. Kwaliteit en transparantie van de producten zijn daarbij essentieel. Binnen deze functie vragen we van je om mee te denken over innovatie in je werk waarbij je data op een andere manier toegankelijk maakt en visualiseert. De werkzaamheden blijven in beweging. Wat bieden wij? We bieden een interessante en uitdagende baan op een dynamisch dossier Een grote hoeveelheid luchtkwaliteitsdata De mogelijkheid om de diepte in te gaan en de vraag achter de vraag op te zoeken Een bijdrage aan een gezonde en veilige leefomgeving Ons kantoor grenst aan een prachtig bosrijk gebied De bekroonde RIVM Corporate Academie Een divers team met als collega’s gedreven onderzoekers, datamanagers, modelleurs en projectleiders Functie-eisen Je bent een resultaatgerichte en zorgvuldige HBO’er of WO’er met een technische / natuurwetenschappelijke opleiding met affiniteit voor statistiek en luchtkwaliteit Je hebt brede programmeerervaring met bijvoorbeeld R of Fortran en affiniteit met GIS software en databases Je hebt ervaring met data analyses en visualisaties Je bent analytisch, nauwkeurig en pragmatisch Je kunt goed samenwerken Je bent stressbestendig Zowel net afgestudeerden als mensen met werkervaring nodigen we uit om te reageren Arbeidsvoorwaarden Salarisniveau schaal 10 Maandsalaris Min €2.756 – Max. €4.430 (bruto) Dienstverband Arbeidsovereenkomst voor bepaalde tijd Contractduur 18 maanden Minimaal aantal uren per week 32 Maximaal aantal uren per week 36 Overige arbeidsvoorwaarden Naast het salaris ontvang je een Individueel Keuzebudget (IKB). Het IKB bestaat uit geld (16,37% van je bruto jaarsalaris) en tijd. Met het IKB maak jij de keuzes die bij jou passen en kun je een deel van je arbeidsvoorwaarden zelf samenstellen. Je kunt er bijvoorbeeld voor kiezen om een deel van je maandinkomen te laten uitbetalen wanneer jij dat wenst. Ook kun je dit budget omzetten in verlof en andersom of besteden aan fiscaal vriendelijke doelen. De Rijksoverheid hecht sterk aan persoonlijke groei en loopbaanontwikkeling en biedt daarvoor tal van mogelijkheden. Tot de secundaire arbeidsvoorwaarden behoren onder meer verschillende studiefaciliteiten, bedrijfsfitness, volledige vergoeding van je OV-reiskosten woon-werkverkeer en gedeeltelijk betaald ouderschapsverlof. Bijzonderheden We ontvangen graag je digitale sollicitatie waarbij je je motivatiebrief mag richten aan Kitty de Bruin. Acquisitie naar aanleiding van deze vacature wordt niet op prijs gesteld. Meer over de functiegroep Onderzoeksmedewerker Door het Functiegebouw Rijk worden medewerkers en leidinggevenden geholpen bij het maken van resultaat- en ontwikkelafspraken in functioneringsgesprekken en krijgt men inzicht in de loopbaanmogelijkheden binnen de Rijksoverheid. Meer informatie op Functiegebouw Rijksoverheid Meer over jouw toekomstige afdeling De afdeling Luchtkwaliteit en Geluid (LKG) is verantwoordelijk voor kennis voor het beleid op het gebied van geluid en lucht. Wat speelt er op dit gebied, wat is nu en de komende jaren urgent en wat is dus het beleid en moet er gemeten en gemonitord worden? LKG richt zich op wetenschappelijke kennisvragen met een beleidsmatig karakter voor de thema’s geluid, lucht en de koppeling van EU lucht- & geluidbeleid. Deze kennisvragen kennen vaak een samenhang met gezondheid, waarbij we nauw samenwerken met andere afdelingen binnen het RIVM. Bij lucht staat de monitoring, duiding en het genereren van de vele data op het gebied van luchtkwaliteit centraal. Diverse luchtmodellen nemen hierbij een belangrijke plek in waarbij we werken aan doorontwikkeling en toekomstbestendig maken van de (afgeleide) producten, zoals het Nationaal samenwerkingsprogramma luchtkwaliteit, de concentratie- en depositiekaarten voor luchtkwaliteit (GCN/GDN). Ook dragen we bij aan gezondheidsgerelateerde producten als het Schone Lucht Akkoord. Rijksinstituut voor Volksgezondheid en Milieu (RIVM) RIVM: deskundig, betrouwbaar en onafhankelijk Als Rijksinstituut voor Volksgezondheid en Milieu (RIVM) zijn we een deskundige, betrouwbare en onafhankelijke adviseur voor overheid, professionals en burgers. Ons doel: een gezonde bevolking en een duurzame, veilige en gezonde leefomgeving. We bewaken gezondheid, ziekten, de kwaliteit van de leefomgeving én het milieu. Daarvoor doen we onderzoek en we verzamelen kennis voor toegankelijke informatie en toepasbare adviezen. Het RIVM zorgt voor een goede geboortescreening, het bestrijden van infectieziekten en heeft een centrale rol bij het Rijksvaccinatieprogramma en de bevolkingsonderzoeken. We onderzoeken wat er nodig is voor goede zorg, een gezonde leefstijl, veilige producten en een veilige en gezonde leefomgeving. Ook dragen we bij aan het voorkomen, bestrijden en beheersen van incidenten en crises. Vanuit ons hoofdkantoor in Bilthoven en vanaf 2021 vanuit een prachtig nieuw gebouw op het Utrecht Science Park, werken we met ongeveer 1800 collega’s aan al onze adviezen, rapporten, factsheets en publicaties. Daarbij laten we ons leiden door de vragen van vandaag én morgen. We doen ons werk midden in de maatschappij. Trots zijn we op onze organisatie waar iedereen welkom is. Als kennisinstituut van de overheid willen we een afspiegeling van de samenleving zijn. Naast talent, ervaring en motivatie maken ook aspecten van identiteit zoals leeftijd, geaardheid, culturele achtergrond of arbeidsbeperking, onze organisatie rijker, innovatiever én leuker. Met deze verschillende achtergronden, perspectieven en inzichten werken wij samen aan een nog beter resultaat! RIVM – De zorg voor morgen begint vandaag Rijksinstituut voor Volksgezondheid en Milieu (RIVM)",2021-03-17 17:49:21
