,id,title,company,location,postingdate,today,summary,salary,url
774,218a254a7e6eafa7,Math Analyst - Netherlands,Gaming Laboratories International,Haarlem,22 dagen geleden,2021-03-13,"Conducting and interpreting statistical testing on game simulation results and on RNG data.
Writing programs or scripts to manipulate, parse or reorganize large…",,https://nl.indeed.com/rc/clk?jk=218a254a7e6eafa7&fccid=f90702677a49de6f&vjs=3
775,fea1cc3d3d491d42,Solution Analyst - Global Energy Perspectives,McKinsey & Company,Amsterdam,Meer dan 30 dagen geleden,2021-03-13,"GEP is part of Energy Insights, the data, analytics, and technology arm of McKinsey’s Global Energy (GEM) practice, covering proprietary market outlooks, asset…",,https://nl.indeed.com/rc/clk?jk=fea1cc3d3d491d42&fccid=6576e7250aa78c3c&vjs=3
776,abfa960a18f84211,Lead Business Analist Finance,Bol.com,Utrecht,16 dagen geleden,2021-03-13,"Wel, als je 6+ jaar werkervaring hebt op het gebied van Finance, Control, big data, business intelligence en/of data science.
Hoe maak jij onze klanten blij?",€5.000 - €6.000 per maand,https://nl.indeed.com/rc/clk?jk=abfa960a18f84211&fccid=38c84708b80970a7&vjs=3
777,1e25a1580fe35fa5,Senior Fraud Analyst,Recharge,Amsterdam Zuid,17 dagen geleden,2021-03-13,"Working closely with cross-functional teams of data, Product owner, backend engineers, analysts, payment specialists, business teams.",,https://nl.indeed.com/rc/clk?jk=1e25a1580fe35fa5&fccid=dfd75c6c8aa801a9&vjs=3
778,f26211bdd9027644,Data Analist,Wiertz Company,Nuth,1 dag geleden,2021-03-13,In de rol als data analist ga je in kaart brengen welke onderdelen het vaakst stuk gaan (en wat je dus het meest op voorraad moet hebben).,€2.200 per week,https://nl.indeed.com/pagead/clk?mo=r&ad=-6NYlbfkN0DP61Qo4f67Rc1NrGWD7j8FOblyzq3lAdtUDdRV0PLnFXbKb8bryHJbTfC--PVecuS72PGNjJoa5or6LhJg8SpN60bNeerCs9XjCii0WpKClzTvCP81ORZC01IboK2S1rttDLM2pUrZtosx0MY3Tg7GcfGjJ6aCSUcGNzLOCGKrD9eeQOZEoHoYCCZJ4NNaZZhgNl-PYKtD6AIPDB3136SSPJ4tq6Ft-RCf_RTbalcfoEDYpT46CtpDWnPmyhP-NpuguYu4dMyjbEtQcjab0iL6SOeCrF8Qnq1y7yhaAgL4kYGA0-ze8X-8sGoyJeGs1CEBf4HKaYDkRNdAgf8AzgAYuU6um8tneveFLtnXLqAM0AbjM36VCIedPWGkc29Yfe3yOCp5jjGXwZGxnVkLu6xWA0yDbgGBWJALwCLPLsmrBoTBz2vuD3pErnhMTokW5-t1ivrUwYSx6KkFMzeE3bMLaHxiYMOxIJZfHC2lv9emZeradNYBBYDPJ6MIhUSSaVAgIQ8MItTrY9OR4t1Y6IAdTIFYBrJYiO0jg1ZL04WZgr6aVcctpMtoAJCA_I4HfJCXgH8TKJs6KpUk3-mrddRc4FhIZTnhHiWplhXvk72kvdVHLNeZYpFnH8yA9pm97wOYqt2VPghzo9qpyHsKmxld&p=13&fvj=0&vjs=3
779,83be5c1f9a6938ae,BI Data Analist - Architect,Start People,Middelburg,Meer dan 30 dagen geleden,2021-03-13,"Ervaring met data analyse en architectuur;
Rol van (data) architect kunnen vervullen.
Kennis en ervaring met werken onder data-architectuur;",,https://nl.indeed.com/rc/clk?jk=83be5c1f9a6938ae&fccid=57a9d19861bdaac9&vjs=3
780,c43433b633c8a504,Data Analyst Scoober,Takeaway.com,Amsterdam,Meer dan 30 dagen geleden,2021-03-13,"Acquire data from primary or secondary data sources and maintain the data warehouse.
We are looking for a data analyst highly skilled in all aspects of data…",,https://nl.indeed.com/rc/clk?jk=c43433b633c8a504&fccid=a7f7ef4951d63c7c&vjs=3
781,ec7a9e64da2d2f02,Business Analyst,Orderchamp,Amsterdam Centrum,22 dagen geleden,2021-03-13,"As our business analyst, you are the go to person with regards to data-driven actionable insights.
High-growth startup looking for a data insights & analytics…",,https://nl.indeed.com/company/Orderchamp/jobs/Business-Analyst-ec7a9e64da2d2f02?fccid=e4e54f0bb419a640&vjs=3
782,d430d6baaefe2ae1,Data Engineer,IKEA,Delft,19 dagen geleden,2021-03-13,"Experience with data pipelines, data warehousing and Big Data processing.
As a Data engineer you work to enable the analysts, data scientists and insight…",,https://nl.indeed.com/rc/clk?jk=d430d6baaefe2ae1&fccid=af17ea0d1d6bbbba&vjs=3
783,218a254a7e6eafa7,Math Analyst - Netherlands,Gaming Laboratories International,Haarlem,22 dagen geleden,2021-03-13,"Conducting and interpreting statistical testing on game simulation results and on RNG data.
Writing programs or scripts to manipulate, parse or reorganize large…",,https://nl.indeed.com/rc/clk?jk=218a254a7e6eafa7&fccid=f90702677a49de6f&vjs=3
784,8acc98084b2b2d55,Configuration Management Analyst,Vanderlande Industries,Veghel,Meer dan 30 dagen geleden,2021-03-13,Strong analytical and problem-solving skills with the ability to analyze data within limited timeframes and recommend alternatives.,,https://nl.indeed.com/rc/clk?jk=8acc98084b2b2d55&fccid=9b9f0bf4b54e4b3d&vjs=3
785,4eac804a6024c6d8,Salesforce Administrator - Europe,Fleet Complete,Utrecht,16 dagen geleden,2021-03-13,"Manage Salesforce data feeds and other integrations.
This role is part technical project manager, part administrator and part Salesforce analyst.",,https://nl.indeed.com/rc/clk?jk=4eac804a6024c6d8&fccid=c0b5558e336243b3&vjs=3
786,96b4674abf619053,SOC Analyst - IBM CISO,IBM,Amsterdam,17 dagen geleden,2021-03-13,"Passion for information security and data security.
Analyze detections and alerts and respond to security threats from Firewall (FW), Intrusion Detection…",,https://nl.indeed.com/rc/clk?jk=96b4674abf619053&fccid=de71a49b535e21cb&vjs=3
787,18fb0c7f3110ad29,Expert Data Scientist,Webfleet Solutions,Amsterdam,Meer dan 30 dagen geleden,2021-03-13,"As a data scientist you are on the forefront driving business results by generating data-based insights.
Close collaboration with data engineers and analysts to…",,https://nl.indeed.com/rc/clk?jk=18fb0c7f3110ad29&fccid=0681a5d0c57a9e6b&vjs=3
788,4592804db4d1867f,Informatie Analist,Centric,Zoetermeer,Meer dan 30 dagen geleden,2021-03-13,"Combineer kennis en kunde met oog voor de klant!
Als Informatie Analist ben jij verantwoordelijk voor het in kaart brengen van de wensen en eisen vanuit de…",,https://nl.indeed.com/rc/clk?jk=4592804db4d1867f&fccid=89083eaa845d12f7&vjs=3
789,9c3b9f3e1dcb42f8,MuleSoft Consultant,SynTouch,Eindhoven,Meer dan 30 dagen geleden,2021-03-13,"MuleSoft is je focus als je begint maar je kunt jezelf later verder ontwikkelen in andere data- en integratie oplossingen.
Wat wij jou kunnen bieden.",,https://nl.indeed.com/rc/clk?jk=9c3b9f3e1dcb42f8&fccid=5e36364b51608c12&vjs=3
790,3ae6abccf0d2089e,Data & Analytics consultant,Artefact,Utrecht,Meer dan 30 dagen geleden,2021-03-13,"Artefact is a new generation of a data service provider, specialising in data consulting and data-driven digital marketing, dedicated to transforming data into…",,https://nl.indeed.com/rc/clk?jk=3ae6abccf0d2089e&fccid=0f5477dfb7d07060&vjs=3
791,190e67d98f308dc6,Data Analyst / Credit Risk (SQL),HamlynWilliams,Amsterdam,Meer dan 30 dagen geleden,2021-03-13,"Working with large and diverse data files - with relatively low data quality.
At least 2 years’ experience in writing database queries and merging, cleaning,…",€80.000 per jaar,https://nl.indeed.com/rc/clk?jk=190e67d98f308dc6&fccid=ab7c67e2cdbc0ed5&vjs=3
792,f4c2c143e8580f4f,Python/Data Engineer,Matrixian Group,Amsterdam,Meer dan 30 dagen geleden,2021-03-13,"Collaborate with domain experts, analysts and data scientists to solve data challenges.
Knowledge of data modeling and data warehousing concepts.",,https://nl.indeed.com/rc/clk?jk=f4c2c143e8580f4f&fccid=0afb9e8563394fda&vjs=3
793,66728ed175f010a1,Treasury and Insurance Analyst (part-time),KWS Group,Wageningen,Meer dan 30 dagen geleden,2021-03-13,"Collect and report risk and exposure data to insurers.
We are currently looking for a part time permanent position (estimated 20 hours a week) to be based in…",,https://nl.indeed.com/rc/clk?jk=66728ed175f010a1&fccid=9f3083d57395942b&vjs=3
794,fdd6a0e5e65cb34b,Applicatie Architect,Louwman Group,Raamsdonksveer,Meer dan 30 dagen geleden,2021-03-13,"Je bent een analist en een echte verbinder en je kan hiermee expertise en inzichten op het juiste moment samen brengen.
De beste versie van jezelf worden?",€5.000 - €6.500 per maand,https://nl.indeed.com/rc/clk?jk=fdd6a0e5e65cb34b&fccid=bd23e405276e2b4c&vjs=3
795,d004264235e9b696,Product Analyst: Back Office,Takeaway.com,Enschede,Meer dan 30 dagen geleden,2021-03-13,"Working knowledge of another data analytics tool, e.g. R, Python.
You'll also assist your team members in getting the most out of data and analytics tools.",,https://nl.indeed.com/rc/clk?jk=d004264235e9b696&fccid=a7f7ef4951d63c7c&vjs=3
796,3e359b46056c6387,Product Owner,Talespin,Utrecht,Meer dan 30 dagen geleden,2021-03-13,"Our spatial computing products deliver a new standard for learning and workforce data, empowering organizations, and individuals to make better talent and…",,https://nl.indeed.com/rc/clk?jk=3e359b46056c6387&fccid=6f20aa87134ae95b&vjs=3
797,fa31d50e5f23df68,Data Analyst - Accommodations - Pricing,Booking.com,Amsterdam,Meer dan 30 dagen geleden,2021-03-13,"Experience in data management, data visualization and quality.
Is familiar with the larger data ecosystem at Booking and how it relates to their data and the…",,https://nl.indeed.com/rc/clk?jk=fa31d50e5f23df68&fccid=62ee2fabbf8c93c5&vjs=3
798,eb92745e60ed163f,Customer Support Specialist,LOGEX,Amsterdam Zuid,8 dagen geleden,2021-03-13,"Advanced data analytics and ‘big data’ issues in healthcare excite you;
Our team of over 300 international experts – managers, consultants, data scientists,…",,https://nl.indeed.com/rc/clk?jk=eb92745e60ed163f&fccid=eeed833f589a51f4&vjs=3
799,99c31e10cadcaf0d,SOC Analyst Level I,Verisure Sàrl,Amsterdam-Zuidoost,Meer dan 30 dagen geleden,2021-03-13,"Deputise for the Level 2 analyst as required.
As required, assist in the production of reports and data extracts.
Advise on initial response activities.",,https://nl.indeed.com/rc/clk?jk=99c31e10cadcaf0d&fccid=ed8ba7520e3f6ae5&vjs=3
800,f1d758b9fdc36c12,SAP FICO Analyst,Topcon Positioning Systems,Capelle aan den IJssel,21 dagen geleden,2021-03-13,"Whether cultivating the earth or building upon it, Topcon brings innovation in workflow automation and seamless connectivity of data to construction,…",,https://nl.indeed.com/rc/clk?jk=f1d758b9fdc36c12&fccid=eee22c2d4637c046&vjs=3
801,1f1dab484b196074,Data Analyst,Octagon Professionals,Den Haag,11 dagen geleden,2021-03-13,Working with the data to help the customer improve their Cold Chain through ad hoc and scheduled reports consisting of data visualizations and written…,,https://nl.indeed.com/rc/clk?jk=1f1dab484b196074&fccid=bf159e14940c1f37&vjs=3
802,920e075a749791b9,Business Project Manager,Θέσεις Εργασίας,Amsterdam,7 dagen geleden,2021-03-13,The perfect candidate will bring exceptional strategic and communication skills but also the know-how to interact with diverse stakeholders and the ability to…,,https://nl.indeed.com/rc/clk?jk=920e075a749791b9&fccid=8bb0034d10cf5e3c&vjs=3
803,2185148b0ae4e225,Cyber Security Analyst,Epson Europe,Zeist,Meer dan 30 dagen geleden,2021-03-13,"Broad hands-on knowledge of firewalls, intrusion detection systems, anti-virus software, data encryption, and other industry-standard techniques and practices •…",,https://nl.indeed.com/rc/clk?jk=2185148b0ae4e225&fccid=2da00ff91b007477&vjs=3
804,c8b071614237d624,Chemical Insights Analyst - Energy Insights,McKinsey & Company,Amsterdam,15 dagen geleden,2021-03-13,"Energy Insights’ dedicated specialists apply proprietary tools and methodologies and a data-driven approach.
Background in consulting, strategy and/or research…",,https://nl.indeed.com/rc/clk?jk=c8b071614237d624&fccid=6576e7250aa78c3c&vjs=3
805,3958f384b4069d96,Data Optimisation Engineer,Optiver,Amsterdam,Meer dan 30 dagen geleden,2021-03-13,"Understand the impact that moving large amounts of data can have on production networks, and develop strategies to ensure that data arrives in a timely manner…",,https://nl.indeed.com/rc/clk?jk=3958f384b4069d96&fccid=8ef4fa42d160b676&vjs=3
806,827f42b61b16e75f,Data Analist Business Intelligence Personal Banking,ABN AMRO Bank,Amsterdam,23 dagen geleden,2021-03-13,"Je bent een vakinhoudelijke ijzersterke Data Analist met een visie op data.
CoE BI is het eerste aanspreekpunt voor alle data gerelateerde vraagstukken en…",,https://nl.indeed.com/pagead/clk?mo=r&ad=-6NYlbfkN0A_cWh5ufxJCEatf9FOtgdwl-LajcKrnY3NwdklpeSDnu3zP8nC49W8vdwlFzj2GRlaTDHJiTPERxnGUIdi0wH8UR0jF1YchQqAWxzhngXHfS6drChf0BN0XPAwg8JIOunMHGyV7G3GStAJhN6ycjWZoSZ8BsNNLuAVS5iwE5KF5FzMTXmEXE7yY-cCaQt9jTWvQfaGxAt3CfAv4ZL5EAbkvTgGGKIofFd5DntdPMZvN1zs7V_F1xS2uGMnrSkYTYf6vLFHM3lEFXR97H_exT60uSHRqnQ9AoVaPnBsmBu20nhXh5aywFzoocelfFCvVBCYycfCuAJz7R9ixI0cw9OaDru8Zr3HNvJHDZS5HK3k6PlU6Y5X8_kdfatl8VfpCXaRrY1GsagYW20w3n7pNeVzvUA0W5ICgpcQ9QaBRMhKwRsHwFoMp19Y7SdKjAYr1kkeHo7Uf_LHGTOYOXatqZsdfRLHqN2juWowWrqmWHHvDmgHIqHfxbYX32s2MkkNQSD49Ch8b8x8GQgFMNQg--Z6Y-VP8bA_IR8_VUcegzeyoaXdogq9PXRxnEFFsN3ngpyxRn_MSJwmbTuOtZvDhRGyKzRk1BVd--bbZdv34t4kdG2g-R7YRqRxp-_A2ZPXcEbIYfsqvfGmwConXvQRIwyPqFYXbwu5CwN4TT37qvEGR4LRCd9BaXYCD1LnodGJLpI=&p=11&fvj=0&vjs=3
807,ee4fe99ec2211822,UX Researcher,Picnic,Amsterdam,19 dagen geleden,2021-03-13,"Analytical Eye: You're not a data wizard, but you're familiar with Excel and know how to visualize and interpret data.
The UX Research Lab is your focal point.",,https://nl.indeed.com/rc/clk?jk=ee4fe99ec2211822&fccid=9ca7c1c1cfaa481c&vjs=3
808,223d14241ae2709a,Vendor Performance Controller,Office Depot,Venlo,26 dagen geleden,2021-03-13,Identify any gaps in the available data and request data sets or analytical documents on any items needed to have a thorough understanding of the BPO's…,,https://nl.indeed.com/rc/clk?jk=223d14241ae2709a&fccid=8b1c86c1fb98e9ed&vjs=3
809,185d8ae25ed75c58,Traineeship Data & Risk,Joust,Randstad,Meer dan 30 dagen geleden,2021-03-13,Dit zorgt voor een versnelde ontwikkeling en directe inzetbaarheid van jou als professional in functies op het data en risk gebied.,,https://nl.indeed.com/rc/clk?jk=185d8ae25ed75c58&fccid=53d29e1b974742b3&vjs=3
810,68c80a9df7594f4b,Senior Data Analyst - Payments,Ridedott,Amsterdam,11 dagen geleden,2021-03-13,"Analytics Engineering: Collaborate with data engineering to bring analytical data models into production.
Experience working with Payments data is a big plus.",,https://nl.indeed.com/rc/clk?jk=68c80a9df7594f4b&fccid=7dc39f756fa199d7&vjs=3
811,a0ec138dbc9b5fae,ambitieuze BI analisten,Centennium,Den Haag,Meer dan 30 dagen geleden,2021-03-13,"Minimaal 4 jaar werkervaring in de rol van informatie/data-analist;
Ben jij een enthousiaste en ambitieuze BI professional en ben je toe aan een ‘next step’ in…",€55.000 - €75.000 per jaar,https://nl.indeed.com/rc/clk?jk=a0ec138dbc9b5fae&fccid=cd943ee9c6af163b&vjs=3
812,dfacc9a28d706bb5,Fleet Analyst,Tesla,Amsterdam,Meer dan 30 dagen geleden,2021-03-13,"Responsibility for importing and maintain data within our internal systems.
Present data in a clear format for presentations and regular KPI reviews.",,https://nl.indeed.com/rc/clk?jk=dfacc9a28d706bb5&fccid=86e9be6ce380173e&vjs=3
813,d3c8523dce01bb5c,Keuringsdienst (Bio) – Chemicus,Halal Feed and Food Inspection Authority (HFFIA),Den Haag,Meer dan 30 dagen geleden,2021-03-13,"Reporting of data relating to Halal to the Decision Committee.
Higher education (HBO / Academic) in food technology, (bio) chemistry, micro biology, Laboratory…",,https://nl.indeed.com/rc/clk?jk=d3c8523dce01bb5c&fccid=24bfa38ba5de69b3&vjs=3
814,6286a71da06f184c,Online Marketeer Video & Audio,Coolblue,Rotterdam,11 dagen geleden,2021-03-13,"Samen met de business analist zorg je ervoor dat alle data en inzichten beschikbaar zijn om de beste beslissingen te kunnen maken.
Dit vind je leuk om te doen.",,https://nl.indeed.com/rc/clk?jk=6286a71da06f184c&fccid=7b02d5128f6957de&vjs=3
815,58a2420eecf38f18,Global Procurement Analyst,Liberty Global,Schiphol,Meer dan 30 dagen geleden,2021-03-13,"Knowledge in data modelling in order to support data linkage and data quality initiatives.
Drive the detailed data analysis supporting the execution of Tenders …",,https://nl.indeed.com/rc/clk?jk=58a2420eecf38f18&fccid=7380376c66dfe540&vjs=3
816,fa4325e996593b6e,Analyst Advisory,BNP Paribas,Amsterdam,Meer dan 30 dagen geleden,2021-03-13,"We are looking for a experienced analyst to strengthen us in:
Analyze financial data of public / private records of companies and develop financialmodels for…",,https://nl.indeed.com/rc/clk?jk=fa4325e996593b6e&fccid=1392500f835bba92&vjs=3
817,edd833ebd5304b19,manager financial planning & analysis,citizenM,Voorschoten,Vandaag,2021-03-13,"Recognizing trends in data and performance and creating sound analyses.
Experience in leading and mentoring a team of associates/analysts and work independently…",,https://nl.indeed.com/rc/clk?jk=edd833ebd5304b19&fccid=98ff78e7fd5ab8ba&vjs=3
818,809b1403c481d297,GRC Consultant,Yellowtail Group,Naarden,Meer dan 30 dagen geleden,2021-03-13,"A finished Master's study and 2 to 5 years of experience as GRC or business consultant, business analist or similar roles;
Role: Medior (2-5 years).",,https://nl.indeed.com/rc/clk?jk=809b1403c481d297&fccid=4042e03c7869ff89&vjs=3
819,ba6071f4b26e257b,Junior Operations Manager,GO Sharing,Nieuwegein,15 dagen geleden,2021-03-13,"Analyseren (samen met onze data analist) van grote hoeveelheden data, trends en ontwikkelingen, zowel in- als extern;
Wat krijg je ervoor terug?",,https://nl.indeed.com/rc/clk?jk=ba6071f4b26e257b&fccid=75f280289be0e54a&vjs=3
820,d9a4be00118e6d35,BUSINESS ANALYST,Nabuurs,Haps,Meer dan 30 dagen geleden,2021-03-13,"Ontwerpen en opstellen van rapportages op het gebied van data-analyse;
Als Business Analyst heb je een passie voor het vertalen van data naar inzichten door…",,https://nl.indeed.com/rc/clk?jk=d9a4be00118e6d35&fccid=2523b1aa6435b76b&vjs=3
821,e5fbdb0e6efe6c62,QC Manager,Kiadis Pharma,Amsterdam-Zuidoost,17 dagen geleden,2021-03-13,"As the QC Manager, you are responsible for the management of the Amsterdam quality control laboratories, QC data review, method validations, equipment…",,https://nl.indeed.com/rc/clk?jk=e5fbdb0e6efe6c62&fccid=11b20d7f7bee7aa9&vjs=3
822,fad629a34cfa7098,Market Intelligence Intern,Irdeto,Hoofddorp,14 dagen geleden,2021-03-13,"Interact with external analysts and Senior Management.
Gather/cleanse data, build analysis models and run scenarios.
What you will be working on:",,https://nl.indeed.com/rc/clk?jk=fad629a34cfa7098&fccid=46c644705d3bbe7a&vjs=3
823,ce2ca44243ffc939,Senior Data Scientist Search,Bol.com,Utrecht,Meer dan 30 dagen geleden,2021-03-13,"You will be working with software engineers, other data scientists, product owners and data/business analysts to optimize every step of the search journey, from…",,https://nl.indeed.com/rc/clk?jk=ce2ca44243ffc939&fccid=38c84708b80970a7&vjs=3
824,920e075a749791b9,Business Project Manager,Θέσεις Εργασίας,Amsterdam,7 dagen geleden,2021-03-13,The perfect candidate will bring exceptional strategic and communication skills but also the know-how to interact with diverse stakeholders and the ability to…,,https://nl.indeed.com/rc/clk?jk=920e075a749791b9&fccid=8bb0034d10cf5e3c&vjs=3
825,604aba8f9120180b,Business Analyst Store Checkout & Payments,Action,Zwaagdijk-Oost,Meer dan 30 dagen geleden,2021-03-13,"You enjoy working with large amounts of data and you have an affinity with store processes.
You use the data to make analyzes in which you look for…",,https://nl.indeed.com/rc/clk?jk=604aba8f9120180b&fccid=68dc87b026f0a6e2&vjs=3
826,2608fc348a5f42d2,Finance Analyst Global Functions Controlling,coty,Amsterdam,18 dagen geleden,2021-03-13,"Aggregate various sources of data while maintaining data integrity and accuracy.
Excellent excel modelling skills with high attention to details and ability to…",,https://nl.indeed.com/rc/clk?jk=2608fc348a5f42d2&fccid=7ad46606e93080a6&vjs=3
827,6776058b4d570410,"Assistant Vice President, ETL Developer",MUFG,Amsterdam,Meer dan 30 dagen geleden,2021-03-13,"Demonstrated knowledge of data warehouse concepts (data normalization, star schema, etc).
Good understanding of physical and logical data modelling.",,https://nl.indeed.com/rc/clk?jk=6776058b4d570410&fccid=3b98171e4a0fd997&vjs=3
828,6f9622ca1a183bb0,Business-/Informatieanalist,Nederlandse Voedsel-en Warenautoriteit (NVWA),Utrecht,11 dagen geleden,2021-03-13,"Als Business-/ Informatie analist kom je te werken bij de directie Handhaven, de divisie Regie & Expertise op de afdeling Proces-en Productontwikkeling (PPO).",,https://nl.indeed.com/rc/clk?jk=6f9622ca1a183bb0&fccid=74099bbe66da4039&vjs=3
829,a739fa4ecabb2841,Analytics Business Consultant,KANTAR,Amsterdam,4 dagen geleden,2021-03-13,"You’ll be working close together with the marketeers and market data analysts of our clients.
Understand both survey and non-survey-based research data and…",,https://nl.indeed.com/rc/clk?jk=a739fa4ecabb2841&fccid=fc0eeff012676923&vjs=3
830,bae6a87ba68f4178,Analytics Business Consultant,Kantar TNS,Amsterdam,4 dagen geleden,2021-03-13,"You’ll be working close together with the marketeers and market data analysts of our clients.
Understand both survey and non-survey-based research data and…",,https://nl.indeed.com/rc/clk?jk=bae6a87ba68f4178&fccid=fc0eeff012676923&vjs=3
831,fea1cc3d3d491d42,Solution Analyst - Global Energy Perspectives,McKinsey & Company,Amsterdam,Meer dan 30 dagen geleden,2021-03-13,"GEP is part of Energy Insights, the data, analytics, and technology arm of McKinsey’s Global Energy (GEM) practice, covering proprietary market outlooks, asset…",,https://nl.indeed.com/rc/clk?jk=fea1cc3d3d491d42&fccid=6576e7250aa78c3c&vjs=3
832,753621742bcb09b5,Sr BI Developer,VodafoneZiggo,Utrecht,Meer dan 30 dagen geleden,2021-03-13,"By adding sources to our data warehouse, and integrating them in our company-wide data model.
Together with your squad members, you work on complex and…",€3.800 - €5.380 per maand,https://nl.indeed.com/rc/clk?jk=753621742bcb09b5&fccid=bfa7e8ccb0aba44d&vjs=3
833,48ab8f75c354b56b,Junior Consultant,PMT Groep BV,Randstad,Meer dan 30 dagen geleden,2021-03-13,"Onze ervaren consultants zijn bijvoorbeeld actief als projectmanager, business consultant, teammanager, bestuursadviseur, pensioenadviseur, data-analist,…",,https://nl.indeed.com/rc/clk?jk=48ab8f75c354b56b&fccid=7babc595d0c9457f&vjs=3
834,5575beeac5d38d9d,Business Analyst,Adyen,Amsterdam,Meer dan 30 dagen geleden,2021-03-13,"Be the owner for any data interfaces such as Looker, Zendesk and Salesforce to help our Support teams with relevant data insights.
We can't wait to meet you.",,https://nl.indeed.com/rc/clk?jk=5575beeac5d38d9d&fccid=b5c24474d328dbc6&vjs=3
835,d004264235e9b696,Product Analyst: Back Office,Takeaway.com,Enschede,Meer dan 30 dagen geleden,2021-03-13,"Working knowledge of another data analytics tool, e.g. R, Python.
You'll also assist your team members in getting the most out of data and analytics tools.",,https://nl.indeed.com/rc/clk?jk=d004264235e9b696&fccid=a7f7ef4951d63c7c&vjs=3
836,4183dc426553b0d1,Vulnerability Management Analyst,PwC,Amsterdam,Vandaag,2021-03-13,"Deliver inventory data and/or vulnerability data and/or metrics to other NIS team and IT operations;
By minimizing the internal and external IT security risks,…",,https://nl.indeed.com/rc/clk?jk=4183dc426553b0d1&fccid=5e964c4afc56b180&vjs=3
837,40dde8965838a7de,Financial Risk Reporting Specialist with SAS,ING,Amsterdam,16 dagen geleden,2021-03-13,"We are looking for a data analyst with credit and market risk knowledge, who performs well in a fast-paced and dynamic environment.",,https://nl.indeed.com/rc/clk?jk=40dde8965838a7de&fccid=5b16841c3468a10d&vjs=3
838,38e52d10f6f162ce,Business Analyst,wehkamp,Zwolle,Meer dan 30 dagen geleden,2021-03-13,"Als analist ben je de schakel tussen de data en de business en werk je naast de business teams ook nauw samen met BI en Data Science.
Hoe maak jij het verschil.",,https://nl.indeed.com/rc/clk?jk=38e52d10f6f162ce&fccid=8ee03ff44561e4a7&vjs=3
839,b1ec790f9c0a6684,IT Subject Matter Expert Warehousing,Refresco,Rotterdam,Meer dan 30 dagen geleden,2021-03-13,"Define the right master data strategy relevant for Warehousing;
Train key users, business analysts and local trainers;
IT Subject Matter Expert in Warehousing.",,https://nl.indeed.com/rc/clk?jk=b1ec790f9c0a6684&fccid=9b02e15b238599b7&vjs=3
840,bdcc6b92da2bdf5f,Marketing Intelligence Analyst,Sana Commerce,Rotterdam,Meer dan 30 dagen geleden,2021-03-13,As a Marketing Intelligence (MI) analyst you support the commercial team of Sana Commerce to accelerate their results through a data driven approach.,,https://nl.indeed.com/rc/clk?jk=bdcc6b92da2bdf5f&fccid=e39808dc8e4dff1d&vjs=3
841,63936386041bc9cc,Local Trainer,Cargill,Sas van Gent,Meer dan 30 dagen geleden,2021-03-13,"Maintain and update required analytical data.
You will support the development and monitoring of key data to drive a positive customer experience, focused on…",,https://nl.indeed.com/rc/clk?jk=63936386041bc9cc&fccid=d7d9a8241ba2f3ec&vjs=3
842,b1d23683b23b2700,HRIS Analyst-Workday,Stryker,Amsterdam,Meer dan 30 dagen geleden,2021-03-13,"Understand proper use, storage and transmission of sensitive employee data and actively participate in system and data quality compliance activities.",,https://nl.indeed.com/rc/clk?jk=b1d23683b23b2700&fccid=9d4dbca3ed8b9cdf&vjs=3
843,6ef75047fb24c4e1,BI Specialist,AgroVision,Deventer,Meer dan 30 dagen geleden,2021-03-13,"You work closely together with the business analysts and data engineers to realize successful projects.
You like structuring and modelling data;",,https://nl.indeed.com/rc/clk?jk=6ef75047fb24c4e1&fccid=a67880b97c016206&vjs=3
844,372925d55765f70f,Analyst,Annual Insight,Amsterdam,Meer dan 30 dagen geleden,2021-03-13,"Affiniteit hebt met financiële data.
We geloven in de kracht van data en in onze mensen.
Een kans om na je studie te starten bij een succesvolle data gedreven…",,https://nl.indeed.com/rc/clk?jk=372925d55765f70f&fccid=3d8625072a10995e&vjs=3
