,id,title,company,location,postingdate,today,summary,salary,url
354,8e7205343590efa4,Digital Web Analist,WeKnowPeople,Den Bosch,Meer dan 30 dagen geleden,2021-03-13,"Solliciteer dan voor web analist via deze pagina.
Weet jij het data driven marketing team naar een hoger niveau te tillen?
Waarom wil jij hier werken?",€4.000 per maand,https://nl.indeed.com/rc/clk?jk=8e7205343590efa4&fccid=d187429d6f430a1a&vjs=3
355,fed9c325ebc7e49d,Associate Finance Analyst,Medtronic,Heerlen,Meer dan 30 dagen geleden,2021-03-13,"§ Administration and validation of performance data, including manual adjustment and manual metric governance.
A Day in the Life.
Help us shape the future.",,https://nl.indeed.com/rc/clk?jk=fed9c325ebc7e49d&fccid=f06a4d05bf5510ec&vjs=3
356,c9996ad66bf51f47,Netherlands Open Opportunities,Flex,Venray,Meer dan 30 dagen geleden,2021-03-13,"We will process your data in accordance with our Recruitment Privacy Notice .
If you have any queries about the processing of your data, please contact:",,https://nl.indeed.com/rc/clk?jk=c9996ad66bf51f47&fccid=b4ab9735c58e3972&vjs=3
357,77f42539f55abc98,Research Analyst,FrieslandCampina,Wageningen,24 dagen geleden,2021-03-13,"Managing data sets and performing (some) data analyses.
Skills on managing data and data analyses are highly appreciated.",,https://nl.indeed.com/rc/clk?jk=77f42539f55abc98&fccid=bb9c97a740367a36&vjs=3
358,d3973981023f6ddb,Working Student / Bijbaan,Picnic,Amsterdam,Meer dan 30 dagen geleden,2021-03-13,"Good Excel and data analysis skills.
You will be part of Picnic's fleet team, and work together with analysts, area managers, hub managers, and Runners.",,https://nl.indeed.com/rc/clk?jk=d3973981023f6ddb&fccid=9ca7c1c1cfaa481c&vjs=3
359,59e32789eec50c80,Spotfire Analyst,Kryptos Technologies limited,Werk van thuis,10 dagen geleden,2021-03-13,"Experience in data aggregation & integration via data.
Warehouses, cross-functional data flow and process improvement, data quality oversight capability and…",,https://nl.indeed.com/rc/clk?jk=59e32789eec50c80&fccid=af74abfd208fabb5&vjs=3
360,4ccce65fa7afe4d8,Data Analist,Brunel,Amsterdam,Vandaag,2021-03-13,"Je bent een Data Analist die zelfs ‘the human factor’ nog in data inzichtelijk maakt (je weet wel, X-data).
Die kaders zijn uiteraard gebaseerd op data.",,https://nl.indeed.com/pagead/clk?mo=r&ad=-6NYlbfkN0Br9Jn0n-9lL-KuX2NkXt9g2eIzDwrC5RwAnAq9S41qR99NTxTrhDAM-CL6cg_j_nfxmgrOTDqZXVLq0oQ6mT83F6_CHenKyISUDHIDYQ8OLOFuv5Gz8jDeZMvT9qalLXIKxYjFStlDgl6aDdVq3Wf3qALYc5hQ37_dC8C_WmLDYBrCCr2rfSgpItnpVbYWKoyESCZsgVUU4Nj8M8ZK7wCENM0twmTAtqyD7kz03JekT2f4rb0WK1nfEAHYNrxLpIgBGMMmYx3DK5YDU7EkriXA_bAygqYINTj4p-2344HEG0yqi-UNlwMHt7a22NqDgos7U2QuoQUatVFTSm1maETu5CYCdQgBQwbwRcX_mhT8alDp92agkCRL1IhvNZF8oaM6cOgwmj_vnSgOr_GdeFUUxDFJO5x_o1Zfmsig55dF2xNdbx7CBqX2v6O30Asi4fDmn7I_hzboGrWdtvAKrpzO0tI8O5z0pa5iKMJaXQW-ZKaLruo7tUK0JYQWN4AtITc5g86ilZgRHQ4vCx-uRMFXH7JoP_hjwUd6TP70wPjBWLG7yldcydDjVNd0Bhg5YVN2t-O2RVYbXna4CHFk77Ja-MddpF6wcInpsqB4xzl5PVBqssCuX0fq&p=9&fvj=0&vjs=3
361,48949d10ffba2727,Supply Chain Data Analyst,Action,Zwaagdijk-Oost,17 dagen geleden,2021-03-13,"Manage to get the right data from different data sources.
SC Analytics is responsible for operational and data-based analyses in the expanding European supply…",,https://nl.indeed.com/rc/clk?jk=48949d10ffba2727&fccid=68dc87b026f0a6e2&vjs=3
362,707d37797ae3890b,Data Developer ETL,LOGEX,Deventer,Meer dan 30 dagen geleden,2021-03-13,"Experience in pulling data from a variety of data source types and standarized data structures/protocols (like FHIR, HL7, ZIBs);",,https://nl.indeed.com/rc/clk?jk=707d37797ae3890b&fccid=eeed833f589a51f4&vjs=3
363,ad8ae4a44d58e5fd,KYC Analyst,STX Group,Amsterdam,7 dagen geleden,2021-03-13,"Analyzing fast-changing rules and regulations, contacting clients, reviewing and researching their data are all examples of the responsibilities a KYC Analyst…",,https://nl.indeed.com/rc/clk?jk=ad8ae4a44d58e5fd&fccid=ed167baadede775c&vjs=3
364,4816d8abd78a1879,Risk Analist,Volkswagen Pon Financial Services,Amersfoort,Meer dan 30 dagen geleden,2021-03-13,"Ben jij de financieel analist die het leuk vindt om je analytische kwaliteiten bij ons in te zetten en veel te leren?
Kom werken bij ons Risk team!",,https://nl.indeed.com/rc/clk?jk=4816d8abd78a1879&fccid=28e718eaceaf7505&vjs=3
365,bdd13f9a4aa33edf,Sterility Assurance Expert,GE Healthcare,Eindhoven,29 dagen geleden,2021-03-13,"Managing, motivating, guiding and coaching the people in your QC Microbiology team of 4 (senior) analysts.
We enable clinicians to make faster, more informed…",,https://nl.indeed.com/rc/clk?jk=bdd13f9a4aa33edf&fccid=65b5f2aba4dbd31f&vjs=3
366,7390761cfc2491d4,Data Analyst,WCC Smart Search & Match,Utrecht,3 dagen geleden,2021-03-13,Data Engineers are challenged to preprocess imperfect real-world data and set-up infrastructures that allow for our products to make optimal use of this data.,,https://nl.indeed.com/rc/clk?jk=7390761cfc2491d4&fccid=e1e297056244573b&vjs=3
367,f1a7a46175bb317b,Informatie analist - Utrecht,NS,Utrecht,Meer dan 30 dagen geleden,2021-03-13,"Dit ga je doen als Informatie analist BI.
Daarom wil je als Informatie analist BI bij NS werken.
Kennis van data-analyse en DWH/BI ontwikkelprocessen.",€5.149 per maand,https://nl.indeed.com/rc/clk?jk=f1a7a46175bb317b&fccid=bd44ce396eb05e22&vjs=3
368,aafbd8e1d7dc93a0,Data analist - Telecom en Media,CGI Inc,Utrecht,9 dagen geleden,2021-03-13,"Je ontwerpt en bouwt data pipelines, data streams, reporting tools, dashboards, data API’s, data generators en allerlei andere informatieportals en tools.",,https://nl.indeed.com/rc/clk?jk=aafbd8e1d7dc93a0&fccid=d2841a5c0380b93d&vjs=3
369,7e402807eb1ef287,Internship Financial Planning & Analysis (Center of Expertise),Signify,Eindhoven,Meer dan 30 dagen geleden,2021-03-13,Signify FP&A is an exciting place to learn the basics of Financial Planning & Analysis (FP&A) and to be part of a highly talented team of analysts.,,https://nl.indeed.com/rc/clk?jk=7e402807eb1ef287&fccid=508609a1a9ea1ca9&vjs=3
370,76e31f1533238711,Medior Quantitative Risk Analist,Hermes Partners,Amsterdam,1 dag geleden,2021-03-13,"Adviseer je andere afdelingen op basis van data.
Zorg je ervoor dat de bank goed onderbouwde en data driven decissions maakt.
Neem dan snel contact met ons op!",,https://nl.indeed.com/rc/clk?jk=76e31f1533238711&fccid=927532087f5e7645&vjs=3
371,4e992b6d4ee05630,Compliance Risk Data Analyst,FastForce,Amsterdam,10 dagen geleden,2021-03-13,"Ervaring met data-analyse binnen de financiële sector.
Je vertaalt compliance vraagstukken en thema’s door naar data analyses, je laat de data vertellen wat er…",€4.500 per maand,https://nl.indeed.com/company/FastForce/jobs/Compliance-Risk-Data-Analyst-4e992b6d4ee05630?fccid=0dce2a04d008a15d&vjs=3
372,3b16b722fc992aec,Organon – Data and Analytics specialist,MSD,Amsterdam,2 dagen geleden,2021-03-13,Act as subject matter expert and data analyst for global-supported sales and activity/CRM reporting dashboard (ComPAS) and process sales data from data…,,https://nl.indeed.com/rc/clk?jk=3b16b722fc992aec&fccid=3c0bf511b4a29309&vjs=3
373,9a347b94c9c81da8,Financieel Analist Retouren,Bol.com,Utrecht,18 dagen geleden,2021-03-13,"Wel, als je het gaaf vindt diep in financiële stromen/data te duiken om de betrouwbaarheid en begrijpelijkheid ervan te vergroten.
En dat blijven we doen.",,https://nl.indeed.com/rc/clk?jk=9a347b94c9c81da8&fccid=38c84708b80970a7&vjs=3
374,f078473b4eb4c3ca,Market Research Analyst Healthcare,SKIM,Rotterdam,3 dagen geleden,2021-03-13,"Execution of all phases of a market research study: questionnaire design (and programming), analysis of the data and preparation of client presentation in line…",,https://nl.indeed.com/rc/clk?jk=f078473b4eb4c3ca&fccid=75e090a26d6b562d&vjs=3
375,839a3efedf27e44f,Integratie Analist,ANWB,Den Haag,Meer dan 30 dagen geleden,2021-03-13,"Je bent een gedreven, leergierige analist/ontwerper.
Door het sterk toenemen van web- en app gebruik, door de komst van Cloud, door de alsmaar groeiende…",€3.264 - €5.440 per maand,https://nl.indeed.com/rc/clk?jk=839a3efedf27e44f&fccid=42c33b1b7d8142de&vjs=3
376,03e1087e9dacff07,BUSINESS ANALIST,ALLSAFE,Nederland,Meer dan 30 dagen geleden,2021-03-13,"Minimaal 5 jaar relevante werkervaring als bijvoorbeeld business analist, data analist, BI Specialist of informatieanalist binnen een commerciële en…",,https://nl.indeed.com/rc/clk?jk=03e1087e9dacff07&fccid=fcca745c8970b87e&vjs=3
377,3c1aaba501431347,PowerBI Specialist,Berkvens,Someren,Meer dan 30 dagen geleden,2021-03-13,"Je hebt kennis over data extractie en transformatie tools, data warehouses en data modellen.
Het ontwikkelen van datastromen voor gestructureerde en…",,https://nl.indeed.com/rc/clk?jk=3c1aaba501431347&fccid=b5c2191f14573eaf&vjs=3
378,048f7de6ee4908e4,Quant Analyst,DA VINCI DERIVATIVES,Amsterdam,Meer dan 30 dagen geleden,2021-03-13,"Analysing market data to build new trading strategies.
Improving and refining the data infrastructure and setup.
In this role you will be responsible for:",€80.000 per jaar,https://nl.indeed.com/rc/clk?jk=048f7de6ee4908e4&fccid=bed24f857b7521e3&vjs=3
379,c9996ad66bf51f47,Netherlands Open Opportunities,Flex,Venray,Meer dan 30 dagen geleden,2021-03-13,"We will process your data in accordance with our Recruitment Privacy Notice .
If you have any queries about the processing of your data, please contact:",,https://nl.indeed.com/rc/clk?jk=c9996ad66bf51f47&fccid=b4ab9735c58e3972&vjs=3
380,a7363be4855ea130,Account Executive- Installed Base,IFS,Eindhoven,3 dagen geleden,2021-03-13,"Position IFS solutions to existing customers through strategic value-based selling, business case definition, ROI analysis, references and analyst data.",,https://nl.indeed.com/rc/clk?jk=a7363be4855ea130&fccid=34ef20d09a3b10f6&vjs=3
381,8437878fc2f3b55b,Freelance Data analist (qlikview/BigData),StarApple,Rotterdam,3 dagen geleden,2021-03-13,"Minimaal 5 jaar ervaring als analist.
Het adviseren over een data-architectuur.
Voor mijn klant ben ik op zoek naar een freelance Data Analist.",,https://nl.indeed.com/rc/clk?jk=8437878fc2f3b55b&fccid=e9f71ecf64b10d24&vjs=3
382,5ce469a565f7348b,Data Analist,Exact personeelsintermediair,Den Haag,15 dagen geleden,2021-03-13,"De Data analist stelt de exacte wensen van de organisatie en ziekenhuizen vast op het gebied van data.
Je bent sterk in zowel data analyse als functionele…",€3.200 - €4.000 per maand,https://nl.indeed.com/pagead/clk?mo=r&ad=-6NYlbfkN0DB0Ek-WWRY1C7GzilxVvrTwEfBUMzggtobeoG-tyfAfErNBoT5c5wW2Qx1Ui7MezeE-6KVKZJkRRaTJOlXvlo_VfvaHHbapAwKjedVOI-Zhl0J7GzIASM0r4xFO82ZCjXkj7durkY5aBBnBfSUbHUMSZXEpV5g2bew0b9U0K23OipTIYu2AC9t754cKX5Frg_3C3gGKeByoNYFS12OZe9jcb91pUCweo6fFMA8bQ7dZsttv-tYxiA32lyFVMRwX01enHPPN7uK2jm9N6-GCBGQy47MWM_KIter3BOXW93WiM7H9QJR32mQI2jwvNsCbzkgFM99t2NeKBioNllmb5SeOf-cf1qid2KWZjGFfpsMl-XQ3mZ_G5HfGe4w4_e7RkDIM_DbmwX8LAmrxje2Xi6vEfcg9X4VIFgKz0NdAoB5tXDUR2Z4jW3cdjcIC0mFCrDz4WyHYR6ZK3iQync8G7nAi5B9P7SnWDWWDVdbBxXwycDYSOTLVPVTiZqJuXKlxj8MLVpQJPF4bv9CKN7UaBS2pDFVMjpJfPt2N9XvDYtbfiUPaLLnZs0uGev5AFFsYNWUG57OAL8slw==&p=1&fvj=0&vjs=3
383,73a85516c45c054d,Junior Financial Analyst NN Life & Pension,NN Group,Rotterdam,1 dag geleden,2021-03-13,"You drive changes proactively with new ideas and you are looking for improvements in the data flow landscape.
NN Life & Pension is looking for finance talents!",,https://nl.indeed.com/pagead/clk?mo=r&ad=-6NYlbfkN0Cf2-BOmr3c2VKeii1JueqOUBDRwRNe0OcilknBmF7EJx7YjYp0UNOO1OvRWFziT9aLXEK0BgOJKYdRHjWs4M_c_JVzXWae_KYY2uUDXHpNThua6Pws2z7Yc2ZILIqd8I_Mhl-2ymAaqbYsH9HbqdB2Ngj3GY5R8db4aikAoMa4Mu8m3HoRWgs9tJPSK7NQ2fNfKuS0__-fhIFFP5k0UlpjXt1iCiMfLPWgsW8qA2EDJVGZPoFx_OJAFAvLt8xr801SzUfOR6-DDO1kBXrxw_5MSh1z7OT3OW2OJ3bwaSJ3pGOYsV7vH2W4x0S7dTdPKuLR0rIn7eQ3xI2IBdRSTckmL7dW-7pnlqX10vk8UO_gdK_p-SmdBsHO1BIUyB6XbLsaJkESMW87SUC81qV4N-hn831y112jAEOZTqAJ93cPWeeBfnJuLiicPoCQ9XUbMGUnE6kKhxd_6afNW0gU9s9T4TdTjeJNFK0hi1YeRQkjyYGDKUsLhQ445QSKKxqkZs4RjQu6rVXwQOJDsaFjy-NEPvbCC7NAGrk4PqE6-qgcjd095H7HYX96-Y7Sw0KkbYobPc-Y7LQr1_CXfySUoAcF&p=2&fvj=0&vjs=3
384,ceb224daf6daf868,Associate Financial Analyst – Controlling - European Operating Center,Medtronic,Heerlen,23 dagen geleden,2021-03-13,"Excellent in handling high amounts of data in a dynamic environment;
Excellent and advanced skills in Excel, Access, and/or other data spreadsheet programs;",,https://nl.indeed.com/rc/clk?jk=ceb224daf6daf868&fccid=f06a4d05bf5510ec&vjs=3
385,b5aeb8f6dc773594,Data Scientist,YER,Veldhoven,Meer dan 30 dagen geleden,2021-03-13,"Experience in applying big data techniques, analysis tools and statistics.
Do you enjoy deep-diving in (BIG) data, turn data into information (doing statistics,…",€60.000 per jaar,https://nl.indeed.com/rc/clk?jk=b5aeb8f6dc773594&fccid=1a620804436aa753&vjs=3
386,1b5429bcc61acae0,Corporate IT Trainee (DA),Philips,Eindhoven,17 dagen geleden,2021-03-13,"You can be a project manager, a data analyst, a platform analyst, in the PMO, etc.
In this role, you have the opportunity to.
You are a part of.",,https://nl.indeed.com/rc/clk?jk=1b5429bcc61acae0&fccid=e4af9ca5b6d3a604&vjs=3
387,d8f39fd37913ca79,Manager | Data Analist,iSense ICT Professionals,Randstad,Meer dan 30 dagen geleden,2021-03-13,"Heb jij ervaring op het gebied van data analyse en ben je klaar voor een volgende stap?
Daarnaast zal je de analysten aan gaan sturen en zorg jij ervoor dat zij…",€5.500 per maand,https://nl.indeed.com/rc/clk?jk=d8f39fd37913ca79&fccid=1b526d4f995493fe&vjs=3
388,9a347b94c9c81da8,Financieel Analist Retouren,Bol.com,Utrecht,18 dagen geleden,2021-03-13,"Wel, als je het gaaf vindt diep in financiële stromen/data te duiken om de betrouwbaarheid en begrijpelijkheid ervan te vergroten.
En dat blijven we doen.",,https://nl.indeed.com/rc/clk?jk=9a347b94c9c81da8&fccid=38c84708b80970a7&vjs=3
389,8f1018dd10e01420,Traineeship data specialist overheid,Driessen,Roermond,Meer dan 30 dagen geleden,2021-03-13,"Een afgeronde hbo/wo opleiding in de richting van data-science , data-analist, business intelligence.
Start dan met dit traineeship data specialist overheid?",,https://nl.indeed.com/pagead/clk?mo=r&ad=-6NYlbfkN0BTIx5FafpGEBCsrw7mDOKcB6A_6g7ORuFZlWYT9AnFt_glc-KCStD4FYgyFPCjMvkAUhdzgoBlnDfwsE5Lzyx4eDKSasY9lo_gKcipyP0BzgoiZLWflsaTLpxBLleKrIJ2B6dNx2Wpyrr1yPRisRYf6sDq-UCFMDaAmeW-j68B_BPH9R9kRsofxHReY5y2PNtOtjz3_jNDcbxNC_O-ASfsjF-KBBp99ZyVbwcXNoBSNbtRbqIBCTUsg3UcOOvrss3dXp7mwD_ozwYcnINgS7WTR-EY6BNanrIFdGCDkxJNEj46Tt3ncQAkI59_Vi26jtwlO8blOJsp_r3q6KxkVBYgjUf8iVKhexIYc6YR-zYtJvXvsVy_iJiFEhom5oqLvYrypehIT_0lTM_HgYPYlkK0UdCmLKaKUMV0xI1J_-ff88bmrK-MU6L_PQdWfPGf6ZUnzhrcEz8BZrUCB25qNIKv795b9yB_wcrQEMyp4SDiXXTYxR5MTup6K5lIdLcq1odxFt1GGx8v3Lbn85uyE4xL9oeaxTzdyNTPvYGoCZ1mt9a0Sn9DtTmR18qBPWP8jBvN9nha2EFwcfzPsJo1mOVHVBjc4JGJU8iG9Nk-kWPXBau1i2lhehukVrAJjeEo2-WM39KuT0F0eZBUEdln-OTYERUeoNhgWUIf1lycLKYgoCdk6egpA2-AGsiHwsb0ib1X5Akz2wyJu50_7WtAQ0t-&p=8&fvj=0&vjs=3
390,9d1129a9a5636654,Marketing Data Management Architect,Omron,Den Bosch,29 dagen geleden,2021-03-13,"Proficient in data analytics (data management, data Libraries architecture, data formats, data standards).
Participate, consult on, and organize PIM activities…",,https://nl.indeed.com/rc/clk?jk=9d1129a9a5636654&fccid=74863a92805aacc3&vjs=3
391,f5cb77a61c0fb7ee,Junior Treasury Analyst EMEA,Abbvie,Hoofddorp,2 dagen geleden,2021-03-13,"Working knowledge of SAP Treasury module, including understanding of master data, PTP, OTC, & RTR.
AbbVie’s mission is to discover and deliver innovative…",,https://nl.indeed.com/rc/clk?jk=f5cb77a61c0fb7ee&fccid=a3b51ece17c02aae&vjs=3
392,bafedea1a18c0bd2,Data Scientist,Bright Cubes,Nederland,Meer dan 30 dagen geleden,2021-03-13,"Creëren van data visualisaties/ business intelligence dashboards t.b.v. data analyses.
Als data scientist helpt dit jou de beschikbare data rondom de processen…",,https://nl.indeed.com/rc/clk?jk=bafedea1a18c0bd2&fccid=6323f36f9f9de9ea&vjs=3
393,4ccce65fa7afe4d8,Data Analist,Brunel,Amsterdam,Vandaag,2021-03-13,"Je bent een Data Analist die zelfs ‘the human factor’ nog in data inzichtelijk maakt (je weet wel, X-data).
Die kaders zijn uiteraard gebaseerd op data.",,https://nl.indeed.com/pagead/clk?mo=r&ad=-6NYlbfkN0Br9Jn0n-9lL-KuX2NkXt9g2eIzDwrC5RwAnAq9S41qR99NTxTrhDAM-CL6cg_j_nfxmgrOTDqZXVLq0oQ6mT83F6_CHenKyISUDHIDYQ8OLOFuv5Gz8jDeZMvT9qalLXIKxYjFStlDgl6aDdVq3Wf3qALYc5hQ37_7AkEvk7LPiw1uBoaGE2GzcawEpwkEEwgNArfqJBaTTUSC9Qsp7pd-_wPFAHIwFl8oLN0E1BKgPsWDdpVMM2TYByNmYetQ-KS7rP2nFXyjf82lZhOHE9l0AuevAh5ahqbP0_lTvve0pyeVz_T0pdXCJhpQTaUHTnXrJY1Unpe9-fRvjuy0A_FgPoV9AvGlNjVdYkLndEcqAxubU1AL4BURX3pjTm2JjQke-vHGHB7EOGoC9YVNoRTyjNnJhr9eucs6bfTB9l7FoTOPuS2gie6h8DPAt0bqf7tB1P_crE3YxYecF-ppuhPcITj7CqACteykWeRd7nM89a4lDWSjMHCx_QjitOCPZ377Vk6ADmVSJ0Y-ktqItUu7GuSslIcYEb0t-rU_670a3KlBsqUFcsY08tlXogBEXaB8jg770CtXYx26PUlOsbSWa2yrJyeNZa0HS9J6al1O-OCSIquDqnDM&p=12&fvj=0&vjs=3
394,090ea71f38a739d4,Data Analyst,Mendix,Rotterdam,Meer dan 30 dagen geleden,2021-03-13,The COE is supported by a technical data engineering team who are responsible for the Mendix’s data landscape (think datalake & data warehouse).,,https://nl.indeed.com/rc/clk?jk=090ea71f38a739d4&fccid=d906a35a8b5e576b&vjs=3
395,a5211b9ef2c51e03,Data Engineer,Coöperatie VGZ,Arnhem,Meer dan 30 dagen geleden,2021-03-13,"Als data engineer sta je aan de basis van ieder succes dat we met data kunnen bereiken.
Ben jij gek op data?
Deze data moet betrouwbaar én beschikbaar zijn.",,https://nl.indeed.com/pagead/clk?mo=r&ad=-6NYlbfkN0B79Mrppt_L_jFil9z0-KOxGP3YOZQJcMBU7sI8Uu2ZIsRlxNuBEapyD2JRJYRUna0DQ1TL74G8thj9ZRUq-YROEqjzzkohqvWd8VVZnqJDD4NiMPi69Hg7PHPxVOIEU6ouL-NUwWIsAOXi0fZIqofZFIZ-m36E0B_0y3UlCc4S9q2SNQ0jSvJ4WCY6lTcxZNiN6In9DYaTrcXm4stmDfiMMJZd7Yp4claX3z3HXs9cGlSq4rcZJXMuXxlsYhlyUE3mmc8U6YJ7W35BtmZcFcVZnTeG_hg1rDTHnC3EWkwByHfDQZQm3FXM1fJbgC6g_AocjJdBP2XeqZfZZtlB3sIkalgsAdrn_9kLycm1ab9D1iozBio4b_ddhgPhDpd19Tj1kjqber8lPSkf5a69I3Hk-0qRET6zOaGlsTrh_rm--tEYXZhVHlNiR04LFgMG_5r6gD6x5BHgb9KgntTMgMcIa3cCjf0tmRJfknGdlGGLJA==&p=14&fvj=0&vjs=3
396,6d8ab12df192f58a,Performance Data Analyst,Takeaway.com,Amsterdam,8 dagen geleden,2021-03-13,"You conduct analyses using multiple data sources to develop audiences testing.
You will be a Data Analyst in the Performance Measurement team, who will look…",,https://nl.indeed.com/rc/clk?jk=6d8ab12df192f58a&fccid=a7f7ef4951d63c7c&vjs=3
397,3c1e0afdfba80165,Junior Business Analist Stock,Bol.com,Utrecht,15 dagen geleden,2021-03-13,"Je combineert procesanalyses, IT en data om tot optimalisatie en oplossingen te komen.
Hoe maak jij onze klanten blij?
COVID-19 en het sollicitatieproces.",,https://nl.indeed.com/rc/clk?jk=3c1e0afdfba80165&fccid=38c84708b80970a7&vjs=3
398,8437878fc2f3b55b,Freelance Data analist (qlikview/BigData),StarApple,Rotterdam,3 dagen geleden,2021-03-13,"Minimaal 5 jaar ervaring als analist.
Het adviseren over een data-architectuur.
Voor mijn klant ben ik op zoek naar een freelance Data Analist.",,https://nl.indeed.com/rc/clk?jk=8437878fc2f3b55b&fccid=e9f71ecf64b10d24&vjs=3
399,483ea6f05bfc4d97,Junior Trader,STX Group,Amsterdam,Meer dan 30 dagen geleden,2021-03-13,"Working with transactional and analytical data.
0-2 years of experience in a trading company as a trader/analyst/researcher.
In your daily work you will be:",,https://nl.indeed.com/rc/clk?jk=483ea6f05bfc4d97&fccid=ed167baadede775c&vjs=3
400,3c1aaba501431347,PowerBI Specialist,Berkvens,Someren,Meer dan 30 dagen geleden,2021-03-13,"Je hebt kennis over data extractie en transformatie tools, data warehouses en data modellen.
Het ontwikkelen van datastromen voor gestructureerde en…",,https://nl.indeed.com/rc/clk?jk=3c1aaba501431347&fccid=b5c2191f14573eaf&vjs=3
401,07c2d61c1e5fb0b8,Business Data Analist,Jelling,Lisse,Meer dan 30 dagen geleden,2021-03-13,"Uitvoeren van complexe data-analyses;
Voor een populaire opdrachtgever in de omgeving van Lisse, zijn wij op zoek naar een data analist die ook affiniteit heeft…",€4.300 per maand,https://nl.indeed.com/pagead/clk?mo=r&ad=-6NYlbfkN0BTnVIaIhUgcJiDOHDjRNiMUazFZPQ2SlmEdySOKsBhBcYjefhce325Er3TNtgJshUD_QfMGBr_b1vJwVxJAPnQ2ewfzu30ya636Djlds2HXD9TmxtINuDof6WqMzQYx5dfxgspb6691VJy1pzhNpT66801YGpUG0ISUf2Pmwds9TSOw29q178FM92CqjahuVPuL6No9BD-54fnzrPJadPLRm_u20GiLZ2HkO_Y3TDKM-9onteeLKRWdnG5agzf01nS6yCtzaHMy2EaW-sQynj9nYbUZLQA2XpeluxW6xNJ2bIf1uGTa0Xe24MsQNUKO07W14yiSXYTcdgIwtuLlsa6B4COVeYMaxEosF0bU6QYG6cLRouEvlcevtHkF1SdQR7zBPxASyBjTprswjeBGW2GFCN6B6F9Gu0OReqCAfXeaQToXD60gUpvz7A1nXAD16L0tn0e5lc75-CTs88b_c2xPWq4rnkcQ5kRjjpFL5lsRTgc8CG1N1qGCpZ18uvS84JSPdyCBl13C-lWzeOZIEkTkjo6B5Im-XluPi9P70w-EW4NMT4bhAJGK_Oc3EUs28ejj4v9kIdSc-8e6RkpCS268cS2_b4Z6mGgU9-F8V2SJqtlm9UHe-zB0M-c2RBM5qvoML_MNQ2njvpppKmSnhlzx3E5VYrB0_bF55n3uHnAnj829TUdqTcC-PwzBnneVlmvAGGjEAlMqXAUd7h5D05lC8VzYH5_tkhPeEvtI1yx8MGpR3OdOtqSJqUjLhIhaUzFXaO_6j2FSVQGyltngTZhuh9xpyNaFev5mpdYEsdVLQ==&p=5&fvj=0&vjs=3
402,b0e8941240bc1bac,Junior Sales Analyst,Rubrik Job Board,Amsterdam,Meer dan 30 dagen geleden,2021-03-13,"Extract data (from a variety of sources including BI systems, and SalesForce.com) and perform detailed data analysis on internal processes and productivity.",,https://nl.indeed.com/rc/clk?jk=b0e8941240bc1bac&fccid=ba03cd038fd30855&vjs=3
403,0344f30a53c65f87,Data Engineer,Oodit - Risicomanagement SaaS Software,Amsterdam,1 dag geleden,2021-03-13,Jij bent een kei in het analyseren van data en maakt inzichtelijke rapporten en je bent prima in staat om de inzichten uit data te presenteren.,,https://nl.indeed.com/company/Oodit---Risicomanagement-Software/jobs/Data-Engineer-0344f30a53c65f87?fccid=db3cec638379de18&vjs=3
404,cbae61b549a2237a,Experienced Data Analyst,GamePoint,Den Haag,9 dagen geleden,2021-03-13,"Collects terabytes of data from different platforms, merges it into data sets, and identifies actionable insights.
“Gaming Together, Wherever You Are!”.",,https://nl.indeed.com/rc/clk?jk=cbae61b549a2237a&fccid=73956eef780c77a1&vjs=3
405,80c712c28187f572,Senior Analist NGS laboratorium,Hartwig Medical Foundation,Amsterdam Oost,11 dagen geleden,2021-03-13,Hartwig Medical Foundation* genereert DNA-data van patiënten met uitgezaaide kanker en integreert deze met klinische- en behandelgegevens voor een…,,https://nl.indeed.com/company/Hartwig-Medical-Foundation/jobs/Senior-Analist-Ngs-Laboratorium-80c712c28187f572?fccid=4306d9d38a164d7f&vjs=3
406,9ef591cbbdbf9282,Agile Informatie Analist,Codeclan B.V.,Groningen,7 dagen geleden,2021-03-13,"Agile werken zit in jouw DNA en zaken als data modellering en UML zijn voor jou gesneden koek.
Herken jij verschillen in synchrone en asynchrone communicatie en…",,https://nl.indeed.com/rc/clk?jk=9ef591cbbdbf9282&fccid=a74ffc91ec409808&vjs=3
407,4ddcd49a7e5f3e83,Research Analyst,B2BEUROPE,Amsterdam,Meer dan 30 dagen geleden,2021-03-13,"Advanced understanding of how the data is represented.
The research analyst will be responsible for supporting the team’s efforts to produce company and…",,https://nl.indeed.com/rc/clk?jk=4ddcd49a7e5f3e83&fccid=9e15dda28d35d344&vjs=3
408,fa3a9749f4937182,(Technical) Business Analist,Denkavit,Voorthuizen,5 dagen geleden,2021-03-13,"Je hebt kennis van (big)data-analytics ontwikkelingen en data-gedreven processen en kunt business en techniek op dit vlak verbinden.
In deze rol ben je;",,https://nl.indeed.com/company/DENKAVIT/jobs/Business-Analist-fa3a9749f4937182?fccid=226c85dfcc142f26&vjs=3
409,6380b0bbe6ede2f0,Data Analyst,Spinnin' Records,Hilversum,Meer dan 30 dagen geleden,2021-03-13,"The specialist with regard to data within Spinnin’ Records;
Data is the lifeblood of today’s record business, and in this role you’ll get a chance to apply your…",,https://nl.indeed.com/rc/clk?jk=6380b0bbe6ede2f0&fccid=43ee4d02d5813a01&vjs=3
410,fe8958adef03d617,Data / BI-Analist,Rekroet Werving & Selectie B.V.,Delfgauw,7 dagen geleden,2021-03-13,"Ervaring met data analyse en functionele analyse;
Je taken en verantwoordelijkheden zullen bestaan uit het ondersteunen van de bedrijfsvoering door middel van…",,https://nl.indeed.com/company/Rekroet-Werving-&-Selectie-B.V./jobs/Data-fe8958adef03d617?fccid=da4404aa838fb97f&vjs=3
411,3000e6afb9d1bf91,Logistiek Analist,Alliance Automotive Services,Ede,24 dagen geleden,2021-03-13,"Je leest data in en controleert gegevens uit verschillende bronnen en overzichten.
Jouw persoonlijke administratie is piekfijn in orde.",,https://nl.indeed.com/rc/clk?jk=3000e6afb9d1bf91&fccid=2bb676241414829c&vjs=3
412,cc2f4dc4d72a58c3,CSR Analyst,Takeaway.com,Amsterdam,Meer dan 30 dagen geleden,2021-03-13,"Distil complex information and data and translate it into clear, understandable language for a wide range of stakeholders.
Our story (the bitesize version):",,https://nl.indeed.com/rc/clk?jk=cc2f4dc4d72a58c3&fccid=a7f7ef4951d63c7c&vjs=3
413,bdd13f9a4aa33edf,Sterility Assurance Expert,GE Healthcare,Eindhoven,29 dagen geleden,2021-03-13,"Managing, motivating, guiding and coaching the people in your QC Microbiology team of 4 (senior) analysts.
We enable clinicians to make faster, more informed…",,https://nl.indeed.com/rc/clk?jk=bdd13f9a4aa33edf&fccid=65b5f2aba4dbd31f&vjs=3
414,eb9fd5fa81b7f8f0,Data analist,Wolters Kluwer,Alphen aan den Rijn,Meer dan 30 dagen geleden,2021-03-13,"Ervaring met het vertalen van data naar toepasbare inzichten.
Kom dan ons Customer Intelligence & Insights team versterken als Data analist!",,https://nl.indeed.com/rc/clk?jk=eb9fd5fa81b7f8f0&fccid=f46e2fd6ab3f5a72&vjs=3
415,22ab60fbab1e845d,Data Analist,jansen en van der zee,Leusden,Meer dan 30 dagen geleden,2021-03-13,"Bij MarketResponse hebben we bakken met data.
Deze bakken met data an sich zijn waardeloos.
We analyseren deze data en bieden waardevolle inzichten.",,https://nl.indeed.com/rc/clk?jk=22ab60fbab1e845d&fccid=4c5c5e872260c9f1&vjs=3
416,2e1c9b5dadfe5c39,Business analist,Vakmedianet,Utrecht,9 dagen geleden,2021-03-13,"Je hebt een afgeronde WO-opleiding en 2 tot 4 jaar ervaring als data analist, of vergelijkende functie.
Het analyseren van interessante trends in de data en…",,https://nl.indeed.com/rc/clk?jk=2e1c9b5dadfe5c39&fccid=f20273bac9ccba9d&vjs=3
