"X","Title","Company","Location","Date","Scrape.Date","Summary","Salary","Url"
"335",334,"Data Science Intern - Digital Marketplace","Orderchamp","Amsterdam Centrum","Meer dan 30 dagen geleden","2021-03-05","High-growth startup looking for a tech data-driven student.
Understand our data, analyze behavior and build algorithms to improve performance;","","https://nl.indeed.com/company/Orderchamp/jobs/Data-Science-Intern-5a344575bc0b2795?fccid=e4e54f0bb419a640&vjs=3"
"336",335,"Data Analyst","Spinnin' Records","Hilversum","Meer dan 30 dagen geleden","2021-03-05","The specialist with regard to data within Spinnin’ Records;
Data is the lifeblood of today’s record business, and in this role you’ll get a chance to apply your…","","https://nl.indeed.com/rc/clk?jk=6380b0bbe6ede2f0&fccid=43ee4d02d5813a01&vjs=3"
"337",336,"Research Analyst","B2BEUROPE","Amsterdam","Meer dan 30 dagen geleden","2021-03-05","Advanced understanding of how the data is represented.
The research analyst will be responsible for supporting the team’s efforts to produce company and…","","https://nl.indeed.com/rc/clk?jk=4ddcd49a7e5f3e83&fccid=9e15dda28d35d344&vjs=3"
"338",337,"Manager Data Science & Engineering","DAF","Eindhoven","9 dagen geleden","2021-03-05","You understand the business needs, are data savvy to be able to “talk tech” with data scientists, and are able to distill advanced analytics concepts in an easy…","","https://nl.indeed.com/rc/clk?jk=9f6aaa1da3e9c26a&fccid=d10121115426893b&vjs=3"
"339",338,"WO Traineeship Overheid richting Data Analytics in omgeving Den Bosch","trainee.nl","Den Bosch","Meer dan 30 dagen geleden","2021-03-05","Tijdens dit data analytics traineeship ontwikkel jij je tot junior data scientist / data analist en help je organisaties om de pareltjes aan informatie in Big…","","https://nl.indeed.com/pagead/clk?mo=r&ad=-6NYlbfkN0Cm0HwNgLougAl8cDbfboVQS84oLdKNnR9UtuUo9-H5uViRcO7VMHkhKGrLR8sf0vpjJflEOMBEOP6Vq40gooKxWI06xAZlbqeZ2F-Wm82o5alRwpj5mIe1PZH0g6MxbzTCNLdVUrxfBFOhevYXc2fhrEsmHG3oXF8ShWASGONso4-aCSTTvaBkkhhfxlbil2FYIrWQ-muT7utSGLLNH1DtxTTIizBh6xcbxbb8rYabZc6BJdiWV69pntNeuVIJYdos0XlRFDWxP-oZbkrIxSDpkqT9tYjw740xeC2Xplk30AVT2t7w_9tra0E8fHlIqTjyoUZxL1DaFFqaRlh7VVTIpt491RLMamu-0uI2ONzq2TD9yJN6ZH-eAQa-A2VYO4GSf51kndnS_ZEzQDNT2_PvmzHUNDdTh4BeantYfRd39ll0vpmylZQuK1oHtGi4n2l3J6-gYrkIQw6EwxziMKLXyyMyScBk_Q7_yeRlJhbWW_beBttHS0C1oFtYLlR_IrPaTkPWDz7P14CYWwFLH9-NParWEO6w0wSjvVgApltmWr1jrqRUO_yvUK1M5WlGEL--ZWCQx4-Jcsbb1C_aOq-kGBQfBofC0uBZPZ13NASgEVqOGWJkCCuWgalqesHrY9TWdnaMPzFNrA==&p=4&fvj=0&vjs=3"
"340",339,"Principal Data Scientist Forecasting/ Personalization & Relevance","ahold","Zaandam","24 dagen geleden","2021-03-05","In the team you will be working with data scientists, data analysts, data governance experts, experimentation experts and ML engineers.","€90.000 per jaar","https://nl.indeed.com/rc/clk?jk=837a5b4257d758c5&fccid=c3f215f3f2d5561b&vjs=3"
"341",340,"Business Analist","CCS","Woerden","Meer dan 30 dagen geleden","2021-03-05","Om op lange termijn relevant te blijven, moeten verzekeraars een excellente klantervaring bieden, hun data optimaal benutten en nieuwe technologieën en diensten…","","https://nl.indeed.com/rc/clk?jk=e1e2e45314fd8196&fccid=a59b6728b2f2552c&vjs=3"
"342",341,"Hotel Data & Distribution Specialist","Van der Valk Diensten centrum","Breukelen","Meer dan 30 dagen geleden","2021-03-05","Een digital savvy business analist die vanuit een data gedreven blik collega’s meeneemt in de koers van rooms distribution.","","https://nl.indeed.com/rc/clk?jk=009f98f0157b1c41&fccid=8b74e9d580fc2f45&vjs=3"
"343",342,"Benelux Analyst 1","Deutsche Bank","Amsterdam","3 dagen geleden","2021-03-05","Support the senior bankers by producing accurate and timely analysis of clients’ capital structures, due diligence, compiling competitor data, producing pitch…","","https://nl.indeed.com/rc/clk?jk=76f9cae1dba85828&fccid=f1d8e147024abb3f&vjs=3"
"344",343,"Data Analist Pon Equipment","Equipment & Power Systems","Almere","2 dagen geleden","2021-03-05","Dit willen we graag gaan doen aan de hand van data gedreven beslissingen.
Je gaat deze disciplines helpen inzicht te geven in verbetermogelijkheden op basis van…","","https://nl.indeed.com/rc/clk?jk=5c7ab7358843570d&fccid=28e718eaceaf7505&vjs=3"
"345",344,"(business) Data Analyst","12Build","Nijverdal","15 dagen geleden","2021-03-05","Kennis van data modellering (data science) is een pré.
Als (business) data analyst ben je bij 12Build op het goede adres.
Arnoud de Munnik, Teamlead data:","","https://nl.indeed.com/rc/clk?jk=3d9389ddaf879d17&fccid=171bf3a1d824a555&vjs=3"
"346",345,"Aanmelden vacature alert","Gemeente Almere","Almere","Meer dan 30 dagen geleden","2021-03-05","Werken bij de snelst groeiende gemeente van Nederland?
Een dynamische omgeving vol vrijheid en ruimte om je als professional verder te ontwikkelen.","","https://nl.indeed.com/rc/clk?jk=4425db441dedbeb2&fccid=23aed11d973ae5a4&vjs=3"
"347",346,"Data Analist Business Intelligence Personal Banking","ABN AMRO Bank","Amsterdam","15 dagen geleden","2021-03-05","Je bent een vakinhoudelijke ijzersterke Data Analist met een visie op data.
CoE BI is het eerste aanspreekpunt voor alle data gerelateerde vraagstukken en…","","https://nl.indeed.com/pagead/clk?mo=r&ad=-6NYlbfkN0A_cWh5ufxJCEatf9FOtgdwl-LajcKrnY3NwdklpeSDnu3zP8nC49W8vdwlFzj2GRlaTDHJiTPERxnGUIdi0wH8UR0jF1YchQqAWxzhngXHfS6drChf0BN0XPAwg8JIOunMHGyV7G3GStAJhN6ycjWZoSZ8BsNNLuAVS5iwE5KF5FzMTXmEXE7yY-cCaQt9jTWvQfaGxAt3CfAv4ZL5EAbkvTgGGKIofFd5DntdPMZvN1zs7V_F1xS2pWzSuKfCGjCktk1ewRJlvRQK7BUboRZmKzKMF_OjpO8_lLEkDw_H8YkS_R5VR2-YwmKOxWXUD79gsc8nUECrQe3k1yI-ufjFc3eA4gJF7-i05s1JvE6uiMkqiwszpGlXQnE5VwQKnl8tngM2F_MQeKS3A3ACaR3otphQL-hoElHIxAFbmTqtAPJ_8tsf0W8L0Gyd--wB5M-I0jyUSkFo9ZUB3yW5fFbhxFn42CKKRCTX3hkp4-VO4UhtS49B1tcdFaBNOiEolA4xcgz6_Fl2iBaY3Y90psIYleu70zBc-IT7xKFmLPBCMIkp3aCk3X9Km0gKwI9UdYcBDSK2kps0dl5F0ox-ODEbiyJbyObjMzeVPsJZbXlcukaqoazxIQ5Sq9HomRdfDc_IrK6GHCMlimNUmttpYIvRlQ0VOtJOkanuv1bUPJRBh8T-yZbWlgEsKYkc6YOyr7fSb2EE2ytS3o0lJrK4rfPwtat1fqEvY_zy9-FnoZ22Tcqx9w4TmPlXZgETc9MKJF4FhpSpzqtlScTYN4Nq-IoPFs9L8AgaKKI=&p=12&fvj=0&vjs=3"
"348",347,"Software Engineer, Data","Everon","Amsterdam","3 dagen geleden","2021-03-05","Experience building and optimizing 'big data' data pipelines, architectures and data sets.
Your role will heavily focus on data extraction, transformation and…","","https://nl.indeed.com/rc/clk?jk=3cb37b48b000863f&fccid=3b06cd97fd7dbb0f&vjs=3"
"349",348,"Informatie-analist","Medux","Den Hoorn","Vandaag","2021-03-05","Je bent daarnaast een zelfstandige, data gedreven, empathische en kritische sparringpartner.
Voor de rol van Informatie-analist is Medux op zoek naar een…","","https://nl.indeed.com/rc/clk?jk=89d68d1dae524a47&fccid=71f97ec80a8f8c74&vjs=3"
"350",349,"KYC/CDD Analist","Cyber & Mason","Amersfoort","6 dagen geleden","2021-03-05","Word jij onze KYC/CDD analist?
Voert administratief klantmutaties door in de systemen naar aanleiding van geconstateerde data-issues of veranderde gegevens bij…","","https://nl.indeed.com/rc/clk?jk=0024c53d58a0e57c&fccid=24b7df3e17852dd7&vjs=3"
"351",350,"Lead Business Analist Fulfilment Center","Bol.com","Waalwijk","13 dagen geleden","2021-03-05","Wel, als je op zoek bent naar een rol waarin je je solide data skills afwisselt met functionele begeleiding: je wilt trajecten ‘van papier naar praktijk’…","","https://nl.indeed.com/rc/clk?jk=649660ebe82f0c7b&fccid=38c84708b80970a7&vjs=3"
"352",351,"Business Insight Analyst","Kyocera Senco Netherlands B.V.","Lelystad","20 dagen geleden","2021-03-05","Ervoor zorgen dat alle zakelijke beslissers gebruik maken van standaard data en inzichten.
_Kyocera Senco is een bekende naam in de internationale bouwwereld.","","https://nl.indeed.com/company/Kyocera-Senco-Netherlands/jobs/Business-Insight-Analyst-46f26dbfc14219dc?fccid=4611c5dfa5243730&vjs=3"
"353",352,"Business Proces Analist","Heuschen & Schrouff Foods Group BV","Landgraaf","3 dagen geleden","2021-03-05","Je hebt ervaring met data-analyse.
Is logistiek helemaal jouw ding?
Ben je op zoek naar een 2e stap in je carrière in een functie waar je veel mag leren,…","","https://nl.indeed.com/rc/clk?jk=1b8ade5d9d4bca39&fccid=a3799f6d14c295d3&vjs=3"
"354",353,"Senior Analist NGS laboratorium","Hartwig Medical Foundation","Amsterdam Oost","2 dagen geleden","2021-03-05","Hartwig Medical Foundation* genereert DNA-data van patiënten met uitgezaaide kanker en integreert deze met klinische- en behandelgegevens voor een…","","https://nl.indeed.com/company/Hartwig-Medical-Foundation/jobs/Senior-Analist-Ngs-Laboratorium-80c712c28187f572?fccid=4306d9d38a164d7f&vjs=3"
"355",354,"Business Analyst","Orderchamp","Amsterdam Centrum","14 dagen geleden","2021-03-05","As our business analyst, you are the go to person with regards to data-driven actionable insights.
High-growth startup looking for a data insights & analytics…","","https://nl.indeed.com/company/Orderchamp/jobs/Business-Analyst-ec7a9e64da2d2f02?fccid=e4e54f0bb419a640&vjs=3"
"356",355,"Data Analytics Consultant","RIFF","Den Bosch","Meer dan 30 dagen geleden","2021-03-05","3 jaar ervaring als web analist of meer;
Je bent een expert op het gebied van web analytics en data analyse.
Samen met je team zorg je ervoor dat RIFF de beste…","","https://nl.indeed.com/rc/clk?jk=3dc94dca41b9efa2&fccid=edb2590ae3c273f9&vjs=3"
"357",356,"Benelux Analyst 1","Deutsche Bank","Amsterdam","3 dagen geleden","2021-03-05","Support the senior bankers by producing accurate and timely analysis of clients’ capital structures, due diligence, compiling competitor data, producing pitch…","","https://nl.indeed.com/rc/clk?jk=76f9cae1dba85828&fccid=f1d8e147024abb3f&vjs=3"
"358",357,"Data Analyst","Bugaboo","Amsterdam","Meer dan 30 dagen geleden","2021-03-05","You visualize the data using the latest tools and technology, like Salesforce dashboards, Google Data Studio or Qlik Sense.","","https://nl.indeed.com/rc/clk?jk=de090c5a258b23cb&fccid=cbc70e216440daf1&vjs=3"
"359",358,"Business Analist","CCS","Woerden","Meer dan 30 dagen geleden","2021-03-05","Om op lange termijn relevant te blijven, moeten verzekeraars een excellente klantervaring bieden, hun data optimaal benutten en nieuwe technologieën en diensten…","","https://nl.indeed.com/rc/clk?jk=e1e2e45314fd8196&fccid=a59b6728b2f2552c&vjs=3"
"360",359,"Data Scientist bij Transavia","Transavia","Schiphol","22 dagen geleden","2021-03-05","Je hebt een WO-diploma in een business analytics of data science gerelateerde studie en/of relevante ervaring in een data science positie;","€3.202 - €6.120 per maand","https://nl.indeed.com/rc/clk?jk=da71b63427c818e5&fccid=9693bb0696b7a117&vjs=3"
"361",360,"Data Modeller","Royal HaskoningDHV","Amersfoort","2 dagen geleden","2021-03-05","Love and passion for data and data modeling.
Experience with data warehouse, and/or enterprise big data platforms in cloud environment.","","https://nl.indeed.com/rc/clk?jk=19f01f8a6dea3215&fccid=260f71831c1bd09f&vjs=3"
"362",361,"Data Scientist – Marketing Analytics","IKEA","Amsterdam","1 dag geleden","2021-03-05","Enjoy figuring out how to use math, code and data to solve business problems.
Have experience in developing data and statistics-driven solutions for real-life…","","https://nl.indeed.com/rc/clk?jk=f1d470380fdfa2cd&fccid=af17ea0d1d6bbbba&vjs=3"
"363",362,"Data Scientist / Software Developer","Tessella","Den Haag","22 dagen geleden","2021-03-05","Using data science, analytics and a variety of analytical, statistical or machine learning techniques to interpret client data, helping them to make better…","","https://nl.indeed.com/rc/clk?jk=6a32b325c9dd8434&fccid=212af5778aa7175d&vjs=3"
"364",363,"Senior Customer Journey Excellence Analist","Bol.com","Utrecht","Meer dan 30 dagen geleden","2021-03-05","Omdat je een WO achtergrond, 5+ jaar data-analytische ervaring en bewezen coachende skills inbrengt.
Dus als jij wilde hypotheses op basis van data-gedreven…","€3.600 - €4.750 per maand","https://nl.indeed.com/rc/clk?jk=6836cc67c005ac49&fccid=38c84708b80970a7&vjs=3"
"365",364,"Data Engineer","Mollie","Amsterdam","6 dagen geleden","2021-03-05","As a Data Engineer, you will take ownership of complex projects to support our software developers, data analysts, and data scientists on their data initiatives…","","https://nl.indeed.com/rc/clk?jk=129ad180c15984b8&fccid=c923e739678abf07&vjs=3"
"366",365,"Data Engineer","Coöperatie VGZ","Arnhem","Meer dan 30 dagen geleden","2021-03-05","Als data engineer sta je aan de basis van ieder succes dat we met data kunnen bereiken.
Ben jij gek op data?
Deze data moet betrouwbaar én beschikbaar zijn.","","https://nl.indeed.com/pagead/clk?mo=r&ad=-6NYlbfkN0B79Mrppt_L_jFil9z0-KOxGP3YOZQJcMBU7sI8Uu2ZIsRlxNuBEapyD2JRJYRUna0DQ1TL74G8thj9ZRUq-YROEqjzzkohqvWd8VVZnqJDD4NiMPi69Hg7PHPxVOIEU6ouL-NUwWIsAOXi0fZIqofZrAkjrf4IL2QL-f_Tp-bFMM2xQqufbUuq2YcBX_SsMkrcl4LYtSB_a7v2nZdb8-X0oomLaaYG9ZZRJKGOqACgszDCn8QITArNMe2o91sw-_UDTueGkhfgtFQOk5t8iwimZwjHdd1Du2Nnbg43Tgh-uLTITSOMhp-NMK8N57W5UNJp-1rWFjZYlL9Ip99vXli_kplUwRjo19Stmsn9Ka_c2Kj48SetA8HYw_ORMq-DDGNQnpwEtLBqPIFvSoOfv11jJwuvbuCu3pb09uJ40UdAZP512YcD32vT1OB9v1PzLhidHRahduYjyVZmL3DXRbF9rj50g2IqietPNE4--ChYrQ==&p=1&fvj=0&vjs=3"
"367",366,"CONSULTANT DATA SCIENCE & ANALYTICS","M3TCH B.V.","Utrecht","Meer dan 30 dagen geleden","2021-03-05","Je hebt 3 tot 5 jaar relevante werkervaring als data scientist of data analist;
Data analytics of data science: 3 jaar (Vereist).
Wat krijg je ervoor terug?*.","€3.500 - €5.000 per maand","https://nl.indeed.com/company/M3TCH-B.V./jobs/Consultant-Data-Science-Analytics-a54ab18a4ae6f3c3?fccid=83494e98e8bc6226&vjs=3"
"368",367,"Collection Analyst","Molex","Eindhoven","16 dagen geleden","2021-03-05","Aggregate and analyze collections data.
We are looking for someone who will be responsible for ensuring Molex’ collection processes as effectively as possible…","","https://nl.indeed.com/rc/clk?jk=3d6e9365237d5978&fccid=735667c8ff2f1a48&vjs=3"
"369",368,"Logistiek Analist","Alliance Automotive Services","Ede","16 dagen geleden","2021-03-05","Je leest data in en controleert gegevens uit verschillende bronnen en overzichten.
Jouw persoonlijke administratie is piekfijn in orde.","","https://nl.indeed.com/rc/clk?jk=3000e6afb9d1bf91&fccid=2bb676241414829c&vjs=3"
"370",369,"Data Analyst","pontmeyer","Zaandam","Meer dan 30 dagen geleden","2021-03-05","Het is je missie om de organisatie data gedreven te laten werken.
Als Data Analyst bij PontMeyer wil je met de beste data het E-Commerce succes voorspellen!","","https://nl.indeed.com/rc/clk?jk=87c1a4089d081a84&fccid=c0fa8e866ccb2f8f&vjs=3"
"371",370,"Data analist","Voort","Amersfoort","16 dagen geleden","2021-03-05","Professional die graag met Nederlands werkt.
Je beheert, volgt en rapporteert gegevens van ontwerpbeoordelingen.
Je analyseert gegevens uit design reviews.","","https://nl.indeed.com/rc/clk?jk=124de79bf9cf08f9&fccid=4e64fca8168203da&vjs=3"
"372",371,"Manager | Data Analist","iSense ICT Professionals","Randstad","Meer dan 30 dagen geleden","2021-03-05","Heb jij ervaring op het gebied van data analyse en ben je klaar voor een volgende stap?
Daarnaast zal je de analysten aan gaan sturen en zorg jij ervoor dat zij…","€5.500 per maand","https://nl.indeed.com/rc/clk?jk=d8f39fd37913ca79&fccid=1b526d4f995493fe&vjs=3"
"373",372,"Data Analyst","Orange Quarter","Eindhoven","Meer dan 30 dagen geleden","2021-03-05","Nice to haves include maintaining some data engineering capabilities and previous gaming industry experience.
Their current data stack includes Python, SQL, GCP…","","https://nl.indeed.com/rc/clk?jk=91848589ec7f2800&fccid=7f9f2b3c5ddde775&vjs=3"
"374",373,"Financieel Analist / Financieel Controller","Vollenhoven Olie B.V.","Tilburg","Meer dan 30 dagen geleden","2021-03-05","Je analyseert beschikbare data, presenteert deze data middels bruikbare rapportages op basis waarvan de business kan worden ontwikkeld.","","https://nl.indeed.com/rc/clk?jk=77fb042d469529c3&fccid=40fa2dd54ffdc51a&vjs=3"
"375",374,"Data Scientist","Tripaneer","Amsterdam Centrum","Meer dan 30 dagen geleden","2021-03-05","Facilitate a data-driven culture (Eg: by presenting your analyses, finding areas for improvement in data and explaining those, empowering stakeholders to find…","","https://nl.indeed.com/rc/clk?jk=529c16338f601319&fccid=ef2465c0ca6461c6&vjs=3"
"376",375,"Junior/Medior Supply Chain Analist","Page Personnel","Rotterdam","1 dag geleden","2021-03-05","Improvement of order parameters and other data inputs to the system through process development and increased awareness in the organization.","","https://nl.indeed.com/rc/clk?jk=4530018e0766fde2&fccid=e5ea1ff710ce39ca&vjs=3"
"377",376,"Data Analist","LEF Recruitment","Zaltbommel","Meer dan 30 dagen geleden","2021-03-05","Deze data kun jij vervolgens gebruiken in je onderzoek.
Jouw afdeling maakt de commerciële vertaling van de data die ingevoerd worden.","€2.000 per maand","https://nl.indeed.com/rc/clk?jk=d1ef56018deda9da&fccid=ba064b9fb183f561&vjs=3"
"378",377,"Digital Web Analist","WeKnowPeople","Den Bosch","24 dagen geleden","2021-03-05","Solliciteer dan voor web analist via deze pagina.
Weet jij het data driven marketing team naar een hoger niveau te tillen?
Waarom wil jij hier werken?","€4.000 per maand","https://nl.indeed.com/rc/clk?jk=8e7205343590efa4&fccid=d187429d6f430a1a&vjs=3"
"379",378,"Data Analyst","USP Marketing Consultancy","Rotterdam","Meer dan 30 dagen geleden","2021-03-05","DATA - RESEARCH ANALYST | Rotterdam | 40 uur per week | €2222 - € 3478.
USP zoekt GEEN schaap met 5 poten!
Wat verwachten we van jou?.","€2.222 per maand","https://nl.indeed.com/pagead/clk?mo=r&ad=-6NYlbfkN0CraaXEUtviYOfTEBZGldda6AP5YAjOpzXzny0t_gVC2_AYC7pOp1UwSjICQtGzsdZDk2mSGThGeHPGAhAGH6rI5V-1mAtFqyrk6pWtIlU2ZYeAGWktAv8hczYtnn3HlMfFH-ccRadjlli9zqCljB0FsiyfrnJdc5fvJXdkXRozuPWe1rhtkY2aMSiTdof48BKFKQ8oP7OlxRjyhiTJLOjMhhuSfjY4xsQhOzt6eGFX6ySHBVlxzlvK6_WRPagbjibg5UA3yxVl-t1rxcaRDNke3Fse6wQmN0ws46pl48B3n0rMz7TPjo4pLbaf8cJjBAVuADwHFAgQ_gt6Yey8Qj0QkLWYR7_84Rwfb_GwdDEifh9iQ-32kgWaqUZxw0IXuvXyQKwSmkBqlOJDunEQjyjk0mK0ZbXpbtalHmgkQLCzfBN5d5M8Ihj76DXVHqI8xHqweL55j2pFdA==&p=14&fvj=1&vjs=3"
"380",379,"VIE ANALYSTE QUANTITATIF – AMSTERDAM, H/F","BNP Paribas","Amsterdam","Zojuist geplaatst","2021-03-05","A la fin de son VIE, l’analyste quantitative sera capable de prétendre à un poste d’ingénieur quantitatif au sein d’une équipe d’investissement dans le domaine…","","https://nl.indeed.com/rc/clk?jk=bdeacc3cbc722bbc&fccid=1392500f835bba92&vjs=3"
"381",380,"Telecom - Data Analytics engineer","NI Network Infrastructure","Den Haag","Meer dan 30 dagen geleden","2021-03-05","As a system integration specialist, you will interface with customers to perform data analytics on the customer network; setting up templates to capture data,…","","https://nl.indeed.com/rc/clk?jk=673e0dc1a12d5232&fccid=484b97f92f5d004d&vjs=3"
"382",381,"Data Analyst","Catawiki","Amsterdam","Meer dan 30 dagen geleden","2021-03-05","All this data is being collected and stored, and used extensively by our team of 10 analysts and data scientists that want to build a better company by using…","","https://nl.indeed.com/rc/clk?jk=9f38b349ac220b5c&fccid=3797ff6c7536ee5e&vjs=3"
"383",382,"Informatie analist / Projectleider","iSense ICT Professionals","Eindhoven","17 dagen geleden","2021-03-05","Ook komen er steeds meer cloud oplossingen bij die moeten integreren met het huidige ERP systeem en wil men een nieuwe master data management tool gaan kiezen.","","https://nl.indeed.com/rc/clk?jk=4cea16b9395bee1f&fccid=1b526d4f995493fe&vjs=3"
"384",383,"Business Analyst Customer Happiness","Bol.com","Utrecht","14 dagen geleden","2021-03-05","Maar hoe kunnen we data leveragen om customer happiness te borgen?
Hoe maak jij onze klanten blij?
Bol.com verandert retail om het dagelijks leven van 12…","€3.200 - €4.000 per maand","https://nl.indeed.com/rc/clk?jk=5d4a692fbf5cb0f4&fccid=38c84708b80970a7&vjs=3"
"385",384,"Stagiair Merchant Operations","Arvato Finance B.V.","Amsterdam-Zuidoost","Meer dan 30 dagen geleden","2021-03-05","Further information on data protection can be found at https://jobsearch.createyourowncareer.com/content/Privacy-Policy/.
Enthousiast team van ruim collega’s.","","https://nl.indeed.com/pagead/clk?mo=r&ad=-6NYlbfkN0DI1egDVTuK4LBR178qZIYELrrK-wvgKjH83TSpYNhsFrfIkGB1uGY5PjzPyEV9Ite2FWxZUY8Buqbepednm6EN9MC5jzKG8aP-4MBoQhVtewzK6dKm8ZUS8DgVYHh3IY7wz4LJ0UaKvvA7H35dk2Os2INOXphpBMGwLOoebPjIefZfQBC8ZB_MPHZipuztDynn9dBqvgm3XbCHKzsYWwTpCWf-mLrXfnzLORN5OiJ9DKJaMrFZVHecn1wUGfehujk71it0JfraxAdgtNM6RYrkHjRvKtRjiObsv6iBV6oIlcKiruJJk3v3mZoB9xf5tWSaf36iOTo3kmjFDO92UNHy4O5StI-7urdHg0YHIJ6NKhNCXopdM3tDzLUpPLq5ivEGXthtVZv-mzoBK50dBU1C4uhilx3CP-VMHMuHZh_pMWI62Ung2qfJjGYME-B2_19IdWeNLTcu6BIvWa51BaX-PZ255bvGV1Whac1NB7ejQiSnIJwFsZGFmJqNu2RkPkcu_BBiE9kC-Mhkn96VGrHF0qEPRlYUD8_nUYLJ3PRcz0H1oXfJJGtAxZgrFgcMCQXjFUkMzsOsFuMNoDo41J1Rpjz4JDLWvc9b4UVqhz15cAdkw0LNy17vOaurACPMnI-hi_IkPxg128jEYzTfoLbee4JAuJ00WM5zP2i_uziny58SfIlUPTElBrir32jycXSxFHUeinfxn9UcOSF3ZRYodzT260LbAfAmouTp9_ZZHlmocvgbgZN9&p=5&fvj=0&vjs=3"
"386",385,"Data Scientist / Data Analist","Krutzen Support","Randstad","22 dagen geleden","2021-03-05","Minimaal 3 jaar relevante ervaring als data scientist, data analist, data engineer, business analist, software engineer o.i.d.
Het bouwen van data pipelines.","€3.500 - €5.500 per maand","https://nl.indeed.com/company/Krutzen-Support/jobs/Data-Scientist-54cbdfbd1721837b?fccid=2635f10b3bd3ddf8&vjs=3"
"387",386,"Data Analyst","BESTSELLER","Amsterdam","Meer dan 30 dagen geleden","2021-03-05","Managing data systems and writing technical requirements.
Leading new analysis initiatives to get more from our data.
Why should you join us?","","https://nl.indeed.com/rc/clk?jk=4d53a0d76e58e598&fccid=701245b9eb1c6517&vjs=3"
"388",387,"Data Analist","Independent Recruiters","Amsterdam","Meer dan 30 dagen geleden","2021-03-05","Je hebt ervaring met verschillende data analytics en data visualisatie tools (zoals PowerBi);
Vraag jij je regelmatig af waarom waardevolle data niet of…","€2.900 - €3.500 per maand","https://nl.indeed.com/rc/clk?jk=294402a91d5b67a9&fccid=5b5d5a4463a5ac7c&vjs=3"
"389",388,"Audit Analyst Pricing and Deal Compliance","Sealed Air Corporation","Nijmegen","Vandaag","2021-03-05","Control complex and data intensive deals at our top accounts to achieve our target margins and profitability at any new or existing deals.","","https://nl.indeed.com/rc/clk?jk=aca31630f3ebedba&fccid=66c010dc97a69d7c&vjs=3"
"390",389,"DevOps Engineer - Business Analist met een focus op Data Management","APG","Amsterdam","9 dagen geleden","2021-03-05","Als analist raak je betrokken bij alle fasen waarin jouw verantwoordelijkheid bij elke fase verschuift.
Deze twee onderwerpen zijn zeer data gedreven en hebben…","","https://nl.indeed.com/pagead/clk?mo=r&ad=-6NYlbfkN0D6OtgUXHy4XJwSwh2eIxn7Urs8NClmYBsl29eSxQalLPuqx62WCBHlYepgvnYwzfY5BH8nsstyNAWbsZBTbkUUp-0YH1TSU_aI9UkBA9p6AsWg1bkK7EmahhjKxLmI_kYiFlvjgL_sZDSftl4xFQwErchPb3IQf_seziCwsndDBMiXOX8ZxV1KkkGzfE6YVKgoPx2N0hiGWQMZJvNFlXdULTbd-pW19sSofOU-FnqZjhYHid289zTZ7zO0RKQWdCz2HFtbQ9bRvrbO0DyOS5iDLNmbHXCXjKYUVoe7s0HW7S5aNRjNStDKhwWNM3R6eYkSGPKC-bLaBu8l_vmTtxZKi9rHM_6hVC5Tjd2e34VVbHVZKZ-N-1rEAPioPWcOtj9qq6r6f8h5ofjDOf3prnwd08zepXs7SCc1vBUDF35HKlu0nsKK6_76OK_i2948rfeNSvULdHUaSMYMraxajVO-u6Spbs_xF35gUrff44vh0vcWGdh-ssUQZVG1_qowKXauz0IIlDnGi-pHj8f_e5exP6g11g8mHsst2vIpk-Oo5ZCDNa2zmJvOJhFzaPSTiI1pQHznYqdzyY01plIasfUjr32xppm6VR_rig02GDcMLqv5udNzwpXtKP5_sgH0MFJKwjQJ2_e-VqrNfG7tSyj50__Y9SNI8jlTHoT5yM99-WPZP6H--q8AVhRuoigjVIjXr3UbA2YI05yFCsIMPYu9kWpgOmfCRbTpSB5TFR9K9q826-jkmPkEI9gFZqSJzson2j4_G4FawxG3TnkXJpU9qs2HiEoFgHo=&p=10&fvj=0&vjs=3"
"391",390,"Communicatief vaardige Data Analist(en)","StarApple","Breda","Meer dan 30 dagen geleden","2021-03-05","Universitaire opleiding op het gebied van bijvoorbeeld wiskunde of data science.
Binnen dit bedrijf specialiseren zij zich op de volgende generatie platformen…","€2.500 - €4.000 per maand","https://nl.indeed.com/rc/clk?jk=0d9a86698afb4786&fccid=e9f71ecf64b10d24&vjs=3"
"392",391,"Business Analist Finance","Bol.com","Utrecht","Meer dan 30 dagen geleden","2021-03-05","Wel, als je het gaaf vindt om diep de data in te duiken.
Je onderzoekt bij onverwachte incidenten de oorzaak door diep de data in te duiken.","€3.200 - €4.800 per maand","https://nl.indeed.com/rc/clk?jk=29c84ba555131bab&fccid=38c84708b80970a7&vjs=3"
"393",392,"Data Analyst","pontmeyer","Zaandam","Meer dan 30 dagen geleden","2021-03-05","Het is je missie om de organisatie data gedreven te laten werken.
Als Data Analyst bij PontMeyer wil je met de beste data het E-Commerce succes voorspellen!","","https://nl.indeed.com/rc/clk?jk=87c1a4089d081a84&fccid=c0fa8e866ccb2f8f&vjs=3"
"394",393,"Integrated Inventory Analyst, EMEA","Brooks Sports, Inc","Nederland","1 dag geleden","2021-03-05","Experience in analyzing data and building reports, charts and presentations.
Able to analyze raw data, draw conclusions, and develop actionable strategic…","","https://nl.indeed.com/rc/clk?jk=15329aa816fe3181&fccid=64f9ec9618aa764d&vjs=3"
"395",394,"Data Analyst","Orange Quarter","Eindhoven","Meer dan 30 dagen geleden","2021-03-05","Nice to haves include maintaining some data engineering capabilities and previous gaming industry experience.
Their current data stack includes Python, SQL, GCP…","","https://nl.indeed.com/rc/clk?jk=91848589ec7f2800&fccid=7f9f2b3c5ddde775&vjs=3"
