"X","Title","Company","Location","Date","Scrape.Date","Summary","Salary","Url"
"1",0,"Data Analist","TreeHouse","Rotterdam","9 dagen geleden","2021-03-05","Dit team is verantwoordelijk voor het verzamelen en waarborgen van de de kwaliteit van onze data en ons als organisatie helpen om deze data inzichtelijk te…","","https://nl.indeed.com/pagead/clk?mo=r&ad=-6NYlbfkN0BbOies5qPN1BgKwdkTD8LtNSbl3vQGA32DWrLLWCjoLzVAWZwBSsl5ZoP9TMWGTon7uEA1ujWF9BV1O6X46CjsgekV17gmvPRwqz2bu8JBySiI6EfE5lT_Yna2NjSbpaF-1hgJ21d6yAUOA97_HZDiFqYs6m_mEKg6jqEZSeC6jfxxRmwVcyFE8N9jQ6zdLLstF4sLDYxxBIiKDLcovuOcG91da1sCjJ_WUE0cVZrlPsyg0upGJLhJaF6_Xbgdsp-y4chBx8ba-0oyBLbq47OS42Wf1bMPVCqCTxfjWa7BfkOBVrws0NMpe3Muoa3arYUAGI85mbG_K5eQLoWOp2K0ZMyTFCUxByZghWvkukBstUlQD4haMJLPMFcDfNa68uJQmeP_AmjRojcIveKp1wtInAyhA_MHEtmC0cJL-keYj4X_KiHGLs_R_UzJidnM8FI=&p=0&fvj=1&vjs=3"
"2",1,"Data Analist Sociale Zekerheid","Aon","Rotterdam","Meer dan 30 dagen geleden","2021-03-05","Data Analist Sociale…","€2.900 - €4.500 per maand","https://nl.indeed.com/pagead/clk?mo=r&ad=-6NYlbfkN0BUr1ih89J8xlxnhfvrvaSPyfeHEUaTmnzB_AydzFDKnIiZ_IebOX6YqBg3HhWjqsvLYdBMllfluWYNSinSxvVzZuTqC-wIeneBQv7gsmOlldH-883T2mDzowXLByP9ZO5WzCurSNNqTF8WDshFfeqFjIO-_WVObUg0Lu07HGLdM22WNJRJ6kJreygrL0n4WrCiomx-hMiZmVQxM2yKmJHNhthlF4U6YPserS7gDa3JrxSB3YGs1xbjGdBJuIZCoDfWxmvwjw1vYOkMecQevS0zhuAwo7pPuDMOqa2QIoZFISHc5F2H9sRTvC5pmLFlLwrXTWEW_MlrsIRKjwciU1qqgL1LTr39hFkCbLdTdVe2tQobADq6jb8msl4p8iRWD2tnNSUMTcZH9zBCc6aH-0MSURC7By2mMwCAdcchHkHOrZOG6nSFhgoLem5C9AL2aCwqLk8c2hOeyTuVzYyTk0XVUnn3u-OLlR6eiO1atEY2rv306YKsQvKzLT7vJ8w21XskimK9oXLPYlT6nXYsDOQ73H-csT3Sur-LdceDQgm25xy_DXAML4YXHcjagdi9tKL-Q45Sc6wjc8wyevXUSltSq7fSxhvFeWotES5faBA7w2Y4uZORvRG3&p=1&fvj=0&vjs=3"
"3",2,"Traineeship: Data Analist","Createment","Eindhoven","2 dagen geleden","2021-03-05","De data-wereld ligt aan jouw voeten.
Ervaring in data-analyse is niet nodig, wél breng je mee.
Gewoon omdat je hard werkt, IT, online marketing en data gaaf…","€2.500 per maand","https://nl.indeed.com/pagead/clk?mo=r&ad=-6NYlbfkN0BQVpz0dABwcJxPL6ZF89l8aMZ4ujW6gW5aOiSkCGD8kFV8HXpgi727Omxjhihm0EipkcS3-z-sPOCnggwUtodXRHTnFvhTaezc0CL9YbpLO8q7F_4VL8cADy53OexmiVjyGk-BqxjpLnY4l7blENZlG_B-vU3dJLI_tJUKh0shmhbuyuLxjS2a9cX-BRgNRa3Znu0dZQjCyRoqOyEyX061OzPDgThVZu0UKCVPCHJArRlz6XWAKJMWnGrXFlWafTewu-WqvOUrUQbfcUS1FaX42t2AES9F0jkSrsETgtv1Jy_XWaxrFyMpgC3VWGp5cbGFQL_z-ePS375JZv93WQ6l5fD5x43OAL0FUZOHZ6q9-chtALyEbGsYQiKMjczt1cMjaCU7fkyJn-206xLafFSH8PJMjPPxqlxEDLvEcGWTnGyyMsoyO3NU7szGU8ws4H4Zj3vBVDbSWf8ImaEPyUIg9y7FKxHU_4cJVk8KALu8Qkr4edhg5m6E1zilz2fEoaPDemwWQdHsALV6_iL4N5CtZ9D_B7o7fmwiZHJaiHKDF1-N4wUneEak4UWrrbvUq7ODvGh6HTPDTkLxZnlP5lQTOR93MuJ2Ts6DY3IzAmi2Sk4T6KwFNZDA18Camht8506QVxZQnGa1WQ==&p=2&fvj=0&vjs=3"
"4",3,"Data Analist","Aon","Eindhoven","Meer dan 30 dagen geleden","2021-03-05","Data…","","https://nl.indeed.com/pagead/clk?mo=r&ad=-6NYlbfkN0BUr1ih89J8xlxnhfvrvaSPyfeHEUaTmnzB_AydzFDKnIiZ_IebOX6YnjJSMiF7dRLn9puMMVtEjWmhzpOVn_3hDp8cIFVXzTAYKweJColTCEpTwGwYCi6oDI3fy3ehYQTqneslOaS-XtBKDfnTdVm9z23scPAq9apbHfs-_gsCkGhdIrdIl8xKGuPTHXLsJWSqthOo1z_X7tC7EIyUjbm3wuabUbyPk15qohKuIcqnNYQz9P_uTZhYVimeFyQq0VA07k9ZFTDV3MlT9eSQnlh2uCICOIeKTnh0p76PsKYhZ1tX5yDZHREbts4imW6zF7fA02pUxWYWOlN-MH-t1NUeWFZdquXiqKL9lRF8SYPzh5eRriRACqX5INiWY7rkuffQwTwmOmU_-NeXWUXJ7DiaiHHU1zzCvnMG0vuQPlyKtVqiOrWfteU6Wn9Zvnssx-g8FkvIyQkn67sx9M0Fr6r_4lUVnuPLwnakq2SiWkKEQheVSid0nLciPydrZR1f-73j4fmqGqCq5tiq8vuHEIMw6o-3iGlbpXLOApYjH4BQcY3-7WQsvYL5B31u_IXZE2-LXIkh-Iy7FWcP8zrM3C3iuqXIaZudTvPS0w4BF6Yi5x5jvxcAou-tOv_VwouthXM=&p=3&fvj=0&vjs=3"
"5",4,"Data Analist","Enexis","Den Bosch","9 dagen geleden","2021-03-05","MI bestaat momenteel uit een data analist, web analist, marktonderzoeker en een senior marketing intelligence medewerker.
Ervaring met web analyse is een pré.","€3.404 - €4.863 per maand","https://nl.indeed.com/pagead/clk?mo=r&ad=-6NYlbfkN0Anhk1jJoJlLLH4x9OTW8szen6xJ4VD6sIavLZrBTsL2Dzxavgw6cdIBayY9YzcYeN89FiyY3nWsNBRV3DpG3MBoaUmZddpcQi6yjBc_t_a5WJq9O9mRQ-_qUfhBi8a7EYXt059zcaJpzlTwFQpn_VcX2DMC9Sb1CVzfP9d3D9skR6eOBN_LUsO7z_l0zQCHJXx5Zx64XFO-izEEYZqVM1_r6Ix2q9o0znK7y4ckjgQhP8MfmjVag6uWDBCPmqipGBqND66h0J7cTCPWwS77MefnAlqI6XEi8EUcy-DPavlD7_Qr00tEVqbLk8-Cnfh1IdXsvUQBUyfTloTWxWMd-K3UephDC-M5FfT1J3OocSLrq4bZa6EEq6V0Gn7v1U204k8gbA5sG-l1rKXRtb9eeS7_rpo-7NSrYBCqheoGY7OIuf6mOSE8w2vslIL6t4y2VTukIQy17pONrHOs5il9a-Egp2CI-rz9CuP8n0cONlGneAgyGeFyp10a1ENYm1OUB7p9p01An-1PJkKtOy50mlvHyX1sBuCSqSwN37bhHZKc9mtsHf5wr-CtqDi9TTvnzqncqLlVmB5rc7S6iCHBjPiGoYh-00zjvu3UXrpa_QgZ5rBcqCQSvjZQebtOQUoVx8sQhcCvtnQNjLl-FLpgrFJa5SJbVrd0Njh24Dcqhv9ysx45_2Bx7J4_-nuXZUOpQpl8sBlIK6yE1t2YsFtyCLsyMtVhCs_qmP8cwLGK_kZ6MPs9ogZTUErVK9nCDoaFJ3J2-zeAdzJk3i4Aq_6LBSwuos88ZnZ5a4jgdG8zbv6ivVaIbSj4mqGlmgb_I_jLx3eJdfbAipqLQNjZLmoebrvNTYOSFurOGdrqQVBOC8oFvxQeDo4ncBRXVaAsmqtlYaoanmXI-YsryCAc7K0SaXWMMrby2lc8mWE992TN0XDrl3--T0UlKwJjKZnwI_HRSekPfmyTq3N8uqJoK1bfxoEENMI1QdW9HoCGwWe19-9__xkwjNeozu_1bed6g8Xo7t9S5HedzR19fz2g7rNTIpp8roOiSjRyyxGXL-afYfWeU0oVMFEwlgB&p=4&fvj=0&vjs=3"
"6",5,"Data Analist","Essent","Den Bosch","23 dagen geleden","2021-03-05","Ben jij de enthousiaste analist die veel energie krijgt om onze klantbeleving op basis van NPS data te verbeteren?
Een positie waar we trots op zijn.","€3.152 - €4.902 per maand","https://nl.indeed.com/pagead/clk?mo=r&ad=-6NYlbfkN0BQOBUdm9lgaCgkWLItaF_p8-3W8GeSKzFHLrNalKuDYVpbS65g9hCoOmfOuwbfukgAEnpHmvUbRB-sBlm7CmLWfkpW6F6M82gxigMA7ZfkpU72FDXBNQgC1Qfpj6phs6HKSiiUXn5jnTiE-kZICQkM_nnOLhHak4SF9bS-1MUSrfQcl94B4D6Fgs8lJrSqI-ILSl2EBTqpbnTaQLLvwAmei_Our2eYQA7NfTCw2QPH2qiH-344GC_IwrCNAMUAbiqnEP1z8ZKcYZxXAtRG9IMvlXc5q2IgjIAVjdqvCwapxjT8DkxwoaV9-BJZqiqj-tE1FWCrzpSUmLXBnia3nwaHJaQPmxiBdahpoRap41J2_mQ7va3p3GCx_JbLx70cZLTkGLE-lRPV2PVlvpLf-knbOeZvE8z9FDaw8swPgwH5gbXu3n0uRRqSYnprTO9fuFm0UkI5BgvlZ5i6zNvQNlvR0gYDRK9SRUyllKbDxPVRtl_TQt_AmhcNSMqCXgnONLNVDX_2GGr6wAYaKsTs_qY2lkxMAY01_WEIn0ZsTtTm3y2mytCgXN4xvjGOU-FuUG3wevPAtBGnT25wSq6Ss0begpOoFV2XLFv8yH-8dVbEkYozDW7Pi9eOZ9f2Yx1o5Z41i775qSUrEA==&p=5&fvj=0&vjs=3"
"7",6,"CRO / Marketing Data Analist","Rotom Nederland B.V.","Best","7 dagen geleden","2021-03-05","Als CRO / marketing data analist word je onderdeel van een jong en dynamisch team met daarin drie directe collega’s en een teamleider.
Wat vragen wij van jou?*.","","https://nl.indeed.com/pagead/clk?mo=r&ad=-6NYlbfkN0AIc4BrRAsVe3RSkDVo-za-HAUPmuCgbStg4LwmkcnEQuxc0c8N1QliRrvUKzd4uoUP_9J0MKqhNps4aw9hdJHMqIILiwlr4uaq411JxNW3oG6S78tSXVYjet66dER4tlfYTu9iYWPfsgTAwrDOC7_LoNzCs_FakuJ0qTikxGZF3UiS7Y_MLr4oGYIR36tJ5fEdcfd7o37K8bx4sCHZo3yttrgoRo7hdeRCtZenuDj2bvu3YA-XcCzTr9WGmMnQxNZAtzpHIHk70vHFuz71SVnlu-pCd3saeh3j-cOoOdnSruwdVRLnxnGc46UMbwwwAy0gnaMnr825puRHrknllRfsxSCbxulCZDjrQDB823bgA5NPJgZAZyY9MZI9-mUOjTsVtXMnNSZKFCqZWaoZHghaApJSEbVGSj_b5C7_kzUM2EN3ZcaTk0SEKVwlqo9wl1-Pzm7BHBPCLIaSK_-CtovE&p=6&fvj=1&vjs=3"
"8",7,"Senior Business Analist","De Wever","Tilburg","Meer dan 30 dagen geleden","2021-03-05","Je neemt een initiërende rol in het opstellen en uitvoeren van de data- en informatiestrategie.
Als Senior Business Analist analyseer je de impact van nieuwe …","€3.557 - €4.744 per maand","https://nl.indeed.com/pagead/clk?mo=r&ad=-6NYlbfkN0AtaeNKxVTkAha_7T0xi11zZbMDGPH5fpbvSOTf1yxiDdgD61DH9iSMqvgzZfhGwPOm65-cdYQSAoATE7DzV5m8Gf_zfU6bpQxwltdeXcwFiUDVqGbBw6zUnue5nZt95OlVenql-R2EUZw0cesKtYFjjDVF-_Nr6Q2keDiwrB1NfdXvvaeGbYr4sl9WHVEV9dEWbugT3_wi8WsGIgDt1quPYKXmkGyidFf-wNRpysC1JKaOqTsYLbLieUHnerKMIFJhtIVJOxyZUwnWp71m_aRq1txU4X48WXjx5pnRuX1smH8blbzKYC4wF91WtDfRM1j2LivhDz5w96sG8k6Nj4oV_Ydk-mBowXE2cXpPD73kzrVMD6EXTnUUSk23UP9ydrjgz1WvFpVRD5tNDXUmexuglqkPeTVp3ePS8RXyG2ukEClEZaFlwlxr45bc-99t-feJtDHMV-fcgQkjxWt5RFJH&p=7&fvj=1&vjs=3"
"9",8,"Data Analist","Shoeby","Rosmalen","9 dagen geleden","2021-03-05","Jezelf blijven ontwikkelen binnen jouw vakgebied als data analist vind je belangrijk.
2-3 jaar ervaring als data analist binnen een commerciële omgeving;","","https://nl.indeed.com/pagead/clk?mo=r&ad=-6NYlbfkN0BFnuepSSMTg12-smkzjRqjHJkb_qFMzDGKJBpjwM66X2lghSBR4UOmAzfZhapdHpQ03gkr7_g5Df5nGGWwwvDbx_eGIu9sFzzKaCR7g3HlfCPwp9jULx13w6CvQMd2qZGJRWO5Ac__CTIUHZu7Sv5rQknnAEi-HeUfY7L6zZrevDoyGA241buX4v0bK74vVmhwgQDcCcjRFr4rw9-uF_HXUCvF-rZxLkmqMbXNemJBh-OxbHEibKUByGs2ylJST_CAmnpp4XYkB_D9zHbgdID8WE6kHxQNACEiXBR1YDJRsmw-BNr4Mz0pcujGPK1s4PiEpfF4CLrpP5K6KWA5SKZEyuTVp6ElRvhNIGnsbb2WIO1P5hx8sU5G4pr1yhq7YICDRq2QFq7PRbCdyW00qhF7xL48Vs8dJCbbTGvk60ydCFTdjmW7kqisIHf-4tuA9rrSZHBG6DVigEGbsawMGW685T1N2YjkvMC_Ju-WxMh8JqJ4kClpzoa4uXfS8lDcOuwJ8wQFwv_RyHJGYvpKGpCsekMBW-ufL-50sDYmMtenhElvr750fxcRA20GS-U2XuwOBb48bAi-ZOH2sfQloHvqxgpauKsIo0vJLS2iiA9UckUocshgKuprbQ5QXsxjCWE_-Pd0b9laHNlXejEN1f_Lkp71CU3UtxU09-30ZSe-AalPxfF8W9JeL_RAMWhHZ_LnnW_2B9PByD3D0jbyGN70&p=8&fvj=0&vjs=3"
"10",9,"(Junior) Data Analist 36-40 hours per week","BouwKennis","Werk van thuis","13 dagen geleden","2021-03-05","You visualize data and information.
You help develop intelligent/advanced ways of (automatically) analyzing data.
A typical day at the (home) office:","","https://nl.indeed.com/rc/clk?jk=fea9b49357181e96&fccid=a8eff02f7b97406b&vjs=3"
"11",10,"Data Analist","HalloStroom","Gouda","8 dagen geleden","2021-03-05","Je neemt tactische beslissingen aan de hand van data.
Voor deze rol zoeken we een ervaren analist.
Jouw focus ligt daarnaast op waardevolle inzichten en…","","https://nl.indeed.com/company/HalloStroom/jobs/Data-Analist-f718684f28f31ff4?fccid=923e2776b829025b&vjs=3"
"12",11,"Customer Intelligence Analist","DELTA Fiber Nederland","Schiedam","Zojuist geplaatst","2021-03-05","Jij bent het data geweten van dit team!
Hiervoor gebruik je (de nieuwste) geavanceerde analyse en big data technieken.
Jouw nieuwe werk en afdeling*.","€3.200 - €4.500 per maand","https://nl.indeed.com/company/Delta-Fiber-Nederland/jobs/Customer-Intelligence-Analist-db8a9499759e316e?fccid=74a2751fd6ac91d4&vjs=3"
"13",12,"Data analist","Eneco","Nederland","6 dagen geleden","2021-03-05","Je het 3-5 jaar werkervaring als data analist;
Voor jou als data analist is hier een belangrijke rol weggelegd.
We doen dit voor de gehele Eneco organisatie.","€70.000 per jaar","https://nl.indeed.com/rc/clk?jk=9b8b8e70f8af0681&fccid=0f752a0010ef00e0&vjs=3"
"14",13,"Data-Analist","Gemeente Valkenswaard","Gemeente Valkenswaard","7 dagen geleden","2021-03-05","Minstens drie jaar ervaring als data-analist, businessanalist of in een soortgelijke functie.
Eugenie kan je in contact brengen met de huidige data-analist voor…","€4.494 per maand","https://nl.indeed.com/rc/clk?jk=7f8fe03c5484706b&fccid=96bb5fdb07fcd616&vjs=3"
"15",14,"Data analist | Zwolle","Teleperformance Benelux","Zwolle","13 dagen geleden","2021-03-05","Spotter, opgraver én duider van data-pareltjes.
Omdat je gelooft in de voorspellende kracht van data en dat geloof uitstraalt.
Liefst met een gouden randje.","","https://nl.indeed.com/pagead/clk?mo=r&ad=-6NYlbfkN0CnUmFDJx9Oif53EHg4peBlrsbvJFgQ4TDd1rAdS1A9_LKioEsQjmuA348M7TUgEo3ikT7oY_eWjwrLNqLMEoZ0v_GbF4MQTT_F3w00BQ27RlozKR4emVcG4RvjH1bukq3CnAQDDKkP99gN8diCCwh45Z219xwc18c-wYt60jdhbMQx5yzkDYWtwJo8L6ebVAu0Nrs7paIUQE4VWcte3xUD9rOXFlgeLE7ILdtuY2g-QyuJl7LIMcOZ_poR6VZc3SHe17TlP8hwqwfS7Eo_6xcb1WwTP2tmdnRAqZYgg25skaufaBGG0EJ2eGeD3z8vyRNhz2Yh0P8zMrtonQp2c1qVLmtMrs6B2Di9716uLuioZCrf_0tCW8QxXUMW7IiD8PPzYxQKS0MBctZRc5mmec_HHIa6Y46q99IXlgVloOxZm000LJR4WmL4ZjugpzV-xU_rd3DzbUcYTDTTMgN-BClZkPlTLzyd67kV3n34S_T-PJWkB2tpZn2hbTJIuagrQRbWwFXVKX-KzzrWUD8i6AutYjYbAqziofugQIHLmnuCjFaOslYRWfyRJq3nABkvvm9SInYbSzzw1PLi6eUX12S9at8YNPv-MfP--0tQJrn_tSbx56DiNbyIN261kKA65PWW4N8ydEHWuiRZ7Jjc3z4FxSvwm0-xmhXsNoJXZH-e2ldkV-5cNX7_XqBnPbAWzMYprUZ61N7f2pjKXtQ5sled6MFUd29RqW_8ilNBIxkcRA==&p=14&fvj=0&vjs=3"
"16",15,"Junior Data-analist","YoungConsult","Boxtel","1 dag geleden","2021-03-05","Momenteel zijn zij op zoek naar een Junior Data-analist om het team te versterken.
Je hebt een controlerende rol bij de verwerking van WOZ-data en waarde…","","https://nl.indeed.com/company/YoungConsult/jobs/Junior-Data-Analist-2b6365b42d370df2?fccid=f7fb131ca591f592&vjs=3"
"17",16,"Data Analist Commercie","Ahold Dellhaize","Zaandam","13 dagen geleden","2021-03-05","Een data-gedreven organisatie, waar de stakeholders het belang van data-gedreven werken erkennen.
Een uitdagende functie met de mogelijkheid om te werken met…","","https://nl.indeed.com/rc/clk?jk=36dbec7ae3b622d5&fccid=237b07f71d39adc8&vjs=3"
"18",17,"Data analist Autoriteit woningcorporaties","Inspectie Leefomgeving en Transport","Utrecht","7 dagen geleden","2021-03-05","Als data analist maak jij heldere analyses van een grote hoeveelheid data over woningcorporaties, waarmee de inspecteur, het management én de corporaties aan de…","","https://nl.indeed.com/rc/clk?jk=96560c4edd6b8e8b&fccid=9ac242948bd47f26&vjs=3"
"19",18,"Data Analist","Exact personeelsintermediair","Den Haag","7 dagen geleden","2021-03-05","De Data analist stelt de exacte wensen van de organisatie en ziekenhuizen vast op het gebied van data.
Je bent sterk in zowel data analyse als functionele…","€3.200 - €4.000 per maand","https://nl.indeed.com/pagead/clk?mo=r&ad=-6NYlbfkN0DB0Ek-WWRY1C7GzilxVvrTwEfBUMzggtobeoG-tyfAfAzGSz7-umD45Jg_QdRO1QUilscPo85Ctc0bXNBRLa38D9ISYgOid4ToPKdfeVUOp1fhVtnUYmvZQ8EgTYsrW3z6ya0cphA3WdoZRtHrAJZM577FeI0PCk6HGigEcZId5oarKP9UJOs4EqpIMyCH0btXLAisWALr2S6xUCihu8sBVsEEvsp6r5YHc1rr3ifTXr4hPJyyyLmsdBgXSfZqzFp3EebfTnOhdkDhkjRGn80nKifRl91-jCcG-mWZWewJVeJKpw6LnYWywnZygQ-4Z0t5DrH3a2cKLvqcjsdOLRfXrQB4kp67rKIqdhcoWziSsBmn3VoA3S_IXBTfXSCP8_eRvizTan-ewhKi4wHVA1xl_T2NoG8hgOPAJnBdQ68IUIsmXSH5HSiNUf9HUr9xcpTjNjzWiqrjpr2QQMS1aIJ1okmDiC66ZDmMCg9jHBTG0jP9p0pPQhg5bWPRuZ1ad3FvFlxyBsULg55H7BdBqO60Eb3GKKLi2nVc8rwge5Ctc8EkB0Mi8BNGsYJCtLy3sIq6Gk0XC5vt1A==&p=3&fvj=0&vjs=3"
"20",19,"Data analist | Zwolle","Teleperformance Benelux","Zwolle","13 dagen geleden","2021-03-05","Spotter, opgraver én duider van data-pareltjes.
Omdat je gelooft in de voorspellende kracht van data en dat geloof uitstraalt.
Liefst met een gouden randje.","","https://nl.indeed.com/pagead/clk?mo=r&ad=-6NYlbfkN0CnUmFDJx9Oif53EHg4peBlrsbvJFgQ4TDd1rAdS1A9_LKioEsQjmuA348M7TUgEo3ikT7oY_eWjwrLNqLMEoZ0v_GbF4MQTT_F3w00BQ27RlozKR4emVcG4RvjH1bukq3CnAQDDKkP99gN8diCCwh45Z219xwc18c-wYt60jdhbMQx5yzkDYWt3w9rEUkLW0kt5ZHDXyMEHlB3JRdwLW-liFjpCIV5fWu-u_JHrC5rctQFnKBRq2SpAGQ40V-gERi_dCCWlwl1u_D8CkcYbRCmgac5OM_V72IlvVaHpEQHQzzw_Tb4CBSDIO6WPLTQpn-lO792HGeW4XoG59_DAa8HaJcm_L59ow-B1Y0IJEh78a9aqgpbkZNRtUC27RLY2jDFQImZ3VuFrdZIyIeAFTJSzRg0zSZfE28CdyV0Risp7eaNlxrQ-1couaoICoA6iNWzx6gbyLYqJcDMyp7O_MQTwkBL6zvdDmJeifHIJFa8pXXXF6FV-Pmbxw9p-zTd3Zgtsxt8K1s2ZBbAFQz-SPGKu3hf2_AUFTCLUp-oCESOZxAniYvNIdcWKS3FhL6U48wA9afj44UbCNmaHodA6F8lcti1z5mKOLaJla6gHAYm3un3Wpx0txafnI2p5sA-5HKG8LuOE6f32yYjZmc2XtJdwg5FmjQvIfZPJCT2GyETKBGeE7ryuKofADjgYEUQxYadjsV0ckX6IYCoMeSi-nVnT1_OOV-j4hLHca3yFSom3w==&p=4&fvj=0&vjs=3"
"21",20,"Junior Data Analist, Dordrecht","ENGIE","Dordrecht","Meer dan 30 dagen geleden","2021-03-05","Je kan data vraagstukken makkelijk structureren en helder visualiseren in dashboards.
Door jouw sterke analytische vermogen weet je op basis van onze data…","","https://nl.indeed.com/rc/clk?jk=233094a5fbe87200&fccid=bcbba984fec63461&vjs=3"
"22",21,"Assortiment Data Analist","Plieger","Nederland","9 dagen geleden","2021-03-05","Jij bent de data analist die de feiten boven tafel krijgt en de commissies gevraagd en ongevraagd advies geeft over het assortiment en de totale Product…","","https://nl.indeed.com/rc/clk?jk=d8da9cf6841ff789&fccid=4e5f062a0ab5bff4&vjs=3"
"23",22,"Data Analist","Dynagroup","Nuth","16 dagen geleden","2021-03-05","Het verwerken van beschikbare data en het omzetten ervan naar concrete inzichten om onze processen te verbeteren en ons efficiënter te laten werken.","","https://nl.indeed.com/company/Dynagroup/jobs/Data-Analist-f525346a1e0593f4?fccid=754c550af6fe6bf0&vjs=3"
"24",23,"Data Analist Capacity Management","Bol.com","Utrecht","Zojuist geplaatst","2021-03-05","Dat is meteen een van jouw uitdagingen: Met jouw unieke data-skills ontwikkel en verbeter je deze processen, IT services en/of (data science) modellen bestaande…","€3.000 - €4.400 per maand","https://nl.indeed.com/rc/clk?jk=07f6edef3ab12339&fccid=38c84708b80970a7&vjs=3"
"25",24,"Data Analist (Seed Production)","Enza Zaden","Enkhuizen","2 dagen geleden","2021-03-05","Je verzamelt, ordent en controleert relevante data, en zet deze data om in managementinformatie.
Je weet specifieke data om te zetten in managementrapportages,…","","https://nl.indeed.com/rc/clk?jk=b1f3f720f77324f7&fccid=8961def4409a4e5d&vjs=3"
"26",25,"Junior data analist vermogensbeheer","De Werkstudent","Utrecht","13 dagen geleden","2021-03-05","Zoekkenmerken Vacature Junior data analist Vermogensbeheer.
Onze ideale 'Junior data analist Vermogensbeheer'.
Utrecht MBA / WO student bewaar vacature.","€14 per uur","https://nl.indeed.com/pagead/clk?mo=r&ad=-6NYlbfkN0CxAV0cA5VsoRmsA4FQK4hLlEj2aYb-Ffbbw2t5Cjw-B3OPu2BniKV17mOlmdDhkX7qTIMzgCWy-VadQ4_7LeF7JrQBfQI6f5yjFtdkGqvUcvgoZwB2SC2mZkf6-xyI4NW1FrpA1_9vqd6CTfK5Ri4l3p-Ylfl2noAdCfGvg2se6gsFfRg1Au-MMZwTUlATLMm3LypYR6WeStSIAj9mfkM4gA4w1ilWcsKwE9YB_NIZ-8afsCrewABsZiuW3EBA5jfS3CdzduMV7MWTFa8ChE9f_VhAOlX6vdp9YVzIIT0hCffUzaRggyA8IijJ7MxbcgIEZW0n9ets_T5Zuuo2fV0V0CDLZGZrD_joUPwWtkzFuKqJBd2PnL2ICxoGpOyudtraWZtZ-aGWFkYAd6hV_YTWNYQYQpEEgie8hdGz8hNSQMp9lvqTqt-bUjMQkAkPEalYlrFyHog_3GjGyeOksyTYlvPMw-DdYjyiHJoRDEh6EXhlmeExornyt6YKtIvNAVXY1s2WGlWOMFO5H8ZCaNf4ycthakK8_g5dtnk2fXtA7OeiQZby3g6ls7xaPCQAhpsD8vtx-SBfLjIa2EBU_A8hFdj8J19_cbAULhZ7gHLMcIvPtf8VKq-efomhPYoMusmnzjl5UbG7bW1dY2vGCuq4KEjasFmogOU_vH2GA4XVskm9mZfwzMTKsAe3FOQE35j0owXQf5tD1F7Uhrj2dW9z55vB_YEe_VM2TPwUzbY-kRhQ6mIgprAf0aAjw3R9b54=&p=10&fvj=0&vjs=3"
"27",26,"Data Analyst","USP Marketing Consultancy","Rotterdam","Meer dan 30 dagen geleden","2021-03-05","DATA - RESEARCH ANALYST | Rotterdam | 40 uur per week | €2222 - € 3478.
USP zoekt GEEN schaap met 5 poten!
Wat verwachten we van jou?.","€2.222 per maand","https://nl.indeed.com/pagead/clk?mo=r&ad=-6NYlbfkN0CraaXEUtviYOfTEBZGldda6AP5YAjOpzXzny0t_gVC2_AYC7pOp1UwSjICQtGzsdZDk2mSGThGeHPGAhAGH6rI5V-1mAtFqyrk6pWtIlU2ZYeAGWktAv8hczYtnn3HlMfFH-ccRadjlli9zqCljB0FsiyfrnJdc5fvJXdkXRozuPWe1rhtkY2aesKVWwonqyYTuZE-ZaQXJihISciZre6-8xR_dPbsmMcav2O0N4QjEc5zNiv2vMrSc8pW2Hi9y7jkiL6q0xOjTVYjC7Um8iEo5bd1XqVwEq1zbarMt-bU2j0ux4opN_tFQzryGeu_n9ILhm73NXo_RWXtZ7ngA3FxSnvzZv98pBn952yffiw5EGNcxOoL7fQqtbRYNOdqg3xg2L_KZEDSvaKvQUEgh0bffzWANHh8F5y1OipwoFmf-JuJnMrse1o46uaPlP2vfYlI5Fv84zwO1A==&p=11&fvj=1&vjs=3"
"28",27,"Data Analist – Record to Report","Bol.com","Utrecht","Meer dan 30 dagen geleden","2021-03-05","Daarnaast help je jouw team om steeds data-gedrevener te werken door hun data-savviness te vergroten en de voordelen van data-gedrevenheid te demonsteren.","€3.800 - €5.000 per maand","https://nl.indeed.com/rc/clk?jk=fa71ae46453cd11e&fccid=38c84708b80970a7&vjs=3"
"29",28,"Adviseur (data-analist)","Ministerie van Defensie","Nederland","15 dagen geleden","2021-03-05","Je hebt kennis en ervaring op het gebied van data.
Hier ondersteun je bij het werken met en toepassen van data.
Het belangrijkste kapitaal van Defensie?","€4.400 per maand","https://nl.indeed.com/rc/clk?jk=64825b9e741e8a60&fccid=0ae1208eb28c7486&vjs=3"
"30",29,"Data analist","Tempo-Team","Son","3 dagen geleden","2021-03-05","Voor de afdeling Supply Chain zoeken zij een data analist die in staat is om data uit excel om te zetten in rapportages in Tableau.
KPI's bij te houden.","€2.800 - €3.200 per maand","https://nl.indeed.com/rc/clk?jk=6f88c3b37ffc3fad&fccid=43cb1310be8d8577&vjs=3"
"31",30,"Data Analist Customer Service","Bol.com","Utrecht","8 dagen geleden","2021-03-05","Als data analist gebruik je jouw data mining expertise om ons veranderprogramma vorm te geven, te analyseren, te evalueren en te verbeteren.","€3.100 - €4.200 per maand","https://nl.indeed.com/rc/clk?jk=01a0671e66695deb&fccid=38c84708b80970a7&vjs=3"
"32",31,"Data Analyst","USP Marketing Consultancy","Rotterdam","Meer dan 30 dagen geleden","2021-03-05","DATA - RESEARCH ANALYST | Rotterdam | 40 uur per week | €2222 - € 3478.
USP zoekt GEEN schaap met 5 poten!
Wat verwachten we van jou?.","€2.222 per maand","https://nl.indeed.com/pagead/clk?mo=r&ad=-6NYlbfkN0CraaXEUtviYOfTEBZGldda6AP5YAjOpzXzny0t_gVC2_AYC7pOp1UwSjICQtGzsdZDk2mSGThGeHPGAhAGH6rI5V-1mAtFqyrk6pWtIlU2ZYeAGWktAv8hczYtnn3HlMfFH-ccRadjlli9zqCljB0FsiyfrnJdc5fvJXdkXRozuPWe1rhtkY2aXnP8OL9y6l9mnN5lcZc3pj3uMAxJQ6_XS3QGun-_H7I4isxpvSwFpsuyOmCMqgJLjjjwuCzMJyPeORGdacx_mD8W-kavz_BZQMa_qHhzNsJLrdoPtwmqiGJjgpt4IQDaJg-nJgvMsaFOpg_R_9CxVNZwldbOykdWVALlGMDf1l_lg6FzhTPX6kQA8QmHtPvnPXuox9T8sFtVeP-kJ10aFGp2hZntFZr9Nk7BkRyltbaYbxWJisMQqgCPcIgiuE55nh2yqLEGsVFnDRUX6pR2cA==&p=1&fvj=1&vjs=3"
"33",32,"Data Analist","IPG Mediabrands","Nederland","27 dagen geleden","2021-03-05","Als Data Analist ben je verantwoordelijk voor het overzichtelijk maken van immense hoeveelheid data.
Je bent nauwkeurig, creatief en gaat geen data-uitdaging…","","https://nl.indeed.com/rc/clk?jk=9760b7a59ebdce54&fccid=bcc67c9d86a19ca1&vjs=3"
"34",33,"Junior data analist vermogensbeheer","De Werkstudent","Utrecht","13 dagen geleden","2021-03-05","Zoekkenmerken Vacature Junior data analist Vermogensbeheer.
Onze ideale 'Junior data analist Vermogensbeheer'.
Utrecht MBA / WO student bewaar vacature.","€14 per uur","https://nl.indeed.com/pagead/clk?mo=r&ad=-6NYlbfkN0CxAV0cA5VsoRmsA4FQK4hLlEj2aYb-Ffbbw2t5Cjw-B3OPu2BniKV17mOlmdDhkX7qTIMzgCWy-VadQ4_7LeF7JrQBfQI6f5yjFtdkGqvUcvgoZwB2SC2mZkf6-xyI4NW1FrpA1_9vqd6CTfK5Ri4l3p-Ylfl2noC00zQh3yBgJPCydMaBvcO9sFewoF-d3I78gD0yebX1sDBz7yZ-7XK_dyo2wz_NREi65aXqZ01p0B47M6fSW4vw_ogyG8QUqArcFqeqrJGHpgZ6jVL_jhtqxpI8NOXly0AvabMtCFDqizz06K6mh0vesNDveu_4HMq2ErJao1DLinBE1GEkSontyrOmjoodWmXvqw4K5BoO9ncW-D7J4o5hCuf0coEz5X2QYjmyv3K7YAmEjvPc_Ze47ttsIQeqaR0Kkx-EpQN2CIczd7H7YXR3hr79mpn_v5iVLyc-YeDblpC8Wi-rDLmuHKD8dAb7AgeZQFqahXkrheiF3ovrXpjCtOMQ5p-obeR44RcHWj9zrcF5RRO7lwnovZA8uP_mdBRf7CEGfZJVbg2V9YJfacb1CPKnpmx-cl2h8-kHNxyU1dlCFlM0SzUJKWGHsQ6zR6-pJOfdgD9oUfpJh-4N2X9padekeAY1M8l1o1BU96IiPfzJK1xSfw4-NfUQ_IvOSkoWadtsSaxe3w2Evt9MeFEHNkSXTQQ2DRjOrC0hFjZbneZjdAztPLzCdDUWm3mPGuewG94Lz_D1i03lDWT7f6my9gv-zNgDKoc=&p=3&fvj=0&vjs=3"
"35",34,"Data Analist","Exact personeelsintermediair","Den Haag","7 dagen geleden","2021-03-05","De Data analist stelt de exacte wensen van de organisatie en ziekenhuizen vast op het gebied van data.
Je bent sterk in zowel data analyse als functionele…","€3.200 - €4.000 per maand","https://nl.indeed.com/pagead/clk?mo=r&ad=-6NYlbfkN0DB0Ek-WWRY1C7GzilxVvrTwEfBUMzggtobeoG-tyfAfAzGSz7-umD45Jg_QdRO1QUilscPo85Ctc0bXNBRLa38D9ISYgOid4ToPKdfeVUOp1fhVtnUYmvZQ8EgTYsrW3z6ya0cphA3WdoZRtHrAJZM577FeI0PCk4JbCOUmLBBkrosIcUTqJW0MpPJ9ypeftHvTU3Ixr-Y0uDft-pvtsW18a0OEVDTfQnqnJbfD-bD7Oh_Md8i8eVjSSrkdtPfsAvBFVg7bzj3DOClks2E_Y33AbUQo35GuHf6vOKXQSZT-lxeCCX9370LuklfKFAIgqk46jd3L64tpEC8r6Irh7Wu0OJsgIZXFZv_224AgsMtJWivvW7H63Jm-un7CGas4e-lZQ2SBSPNAwtyycyEF3Au4Ke8aVrnxb463zZteAOjqsr0lEl0gZWV9IrlG5NrFHgrTFkqX0W4sevrU_dXANV2stWplExwtpZzPD_SPUEIT7U-qZnI3EoAiE8-pleKpUL9o4tXHfwrOBXUvnVN-dpwuYDo8E3UdtkbRxBbj9nyN_h7RwadzeDjJcAm8lW-XNhsVU6Z8vzILg==&p=4&fvj=0&vjs=3"
"36",35,"Data Analist","Rabobank","Utrecht","27 dagen geleden","2021-03-05","Kunnen toepassen van de eisen rondom data privacy;
Ervaring met het omzetten van data requirements naar factbased en actionable inzichten;","€3.720 - €5.300 per maand","https://nl.indeed.com/rc/clk?jk=d26d17251519b8aa&fccid=db0b8cca1616eafb&vjs=3"
"37",36,"Data analist | Zwolle","Teleperformance Benelux","Zwolle","13 dagen geleden","2021-03-05","Spotter, opgraver én duider van data-pareltjes.
Omdat je gelooft in de voorspellende kracht van data en dat geloof uitstraalt.
Liefst met een gouden randje.","","https://nl.indeed.com/pagead/clk?mo=r&ad=-6NYlbfkN0CnUmFDJx9Oif53EHg4peBlrsbvJFgQ4TDd1rAdS1A9_LKioEsQjmuA348M7TUgEo3ikT7oY_eWjwrLNqLMEoZ0v_GbF4MQTT_F3w00BQ27RlozKR4emVcG4RvjH1bukq3CnAQDDKkP99gN8diCCwh45Z219xwc18c-wYt60jdhbMQx5yzkDYWt1x7y4NoHmO19EzJI0eQirzQYPTYvvXpimv9TnAZ4VM6dy0yzk9JR-i5M_ibCthQ1Wwzuy1wIVgXOabh-YnLnS2Pu7BCpY-xplfuNI5aR0_V3I4_whuSoCoh5LCU5eIaOzgeE6yFP5prCjzrSl-Y0Edqn5ADuAkFNf0s3avMaXlXqmC6ytGPJhIGDYynqtsiSSizBt4N3oovGAAGG7kDOQKvSUYlMxYtw0cTjGdBQoAJHYl_63sgXmXSCD0dKSLpetTinI0P0apDh4Rgzqr6hjbca2A-ymv8STA5q0bzkDrqDzV8t_6-BGGif_ODlW4-4yEDwQpHw77bvkCKH1FpeQkLBITDp5NbL4vkFoMLCLdMmNINKJeiGmiCJAPuI4rFouGje7vzd-eqgZqL8r_gRS2ReXxqR503C1dG9i7bz1x-wtMzQKD3HFAhtEeQTtoR0Up2UqlSQ8ckeM-clN-7RAB25Cpddp3diMZv1EsIXTh66_BjScWRfjIKWQpHCGv9N-aoFgdlzXvc2tOGMkviNXzE7rOwP8yqCYp_wkf4PLwQ0g9t-9bygqw==&p=6&fvj=0&vjs=3"
"38",37,"Data Analist","America Today","Diemen","2 dagen geleden","2021-03-05","De business helpen bij het oplossen van complexe vraagstukken door middel van data analyse en data modellering;
Dan verwelkomen wij jou graag in ons team!","","https://nl.indeed.com/rc/clk?jk=485e76375d11d6a0&fccid=8e01be40635ef088&vjs=3"
"39",38,"Adviseur (data-analist)","Ministerie van Defensie, Defensie Ondersteuningsco...","Utrecht","15 dagen geleden","2021-03-05","Je hebt kennis en ervaring op het gebied van data.
Hier ondersteun je bij het werken met en toepassen van data.
Het belangrijkste kapitaal van Defensie?","","https://nl.indeed.com/rc/clk?jk=3e801927b789228a&fccid=ac26b5f43d10107a&vjs=3"
"40",39,"Data Analist","Telegraaf Media Groep","Nederland","Meer dan 30 dagen geleden","2021-03-05","Als data analist waan jij je bij ons in een data jungle.
Ervaring in verzamelen en analyseren van (consumenten)data.
Ons verhaal, in het kort.","","https://nl.indeed.com/rc/clk?jk=9e7363bfa414ca82&fccid=de4d4c9c817bb2dc&vjs=3"
"41",40,"Data-analist","Provincie Utrecht","Utrecht","15 dagen geleden","2021-03-05","Als data-analist voer je binnen een aandachtsgebied de regie op de data ontwikkeling en data analyses.
Minimaal 2 jaar aantoonbare werkervaring als data-analist…","€3.506 - €5.009 per maand","https://nl.indeed.com/rc/clk?jk=eb140ac4bda73c91&fccid=2598e04099dbe094&vjs=3"
"42",41,"Data-analist","Bieze Food Group","Nijkerk","10 dagen geleden","2021-03-05","Als onze Data-analist ben je verantwoordelijk voor de analysefase.
Bovenal haal je vanuit je data-analyses nieuwe kansen en denkrichtingen naar boven.","","https://nl.indeed.com/rc/clk?jk=b97549c7014e0158&fccid=ab97d0c62af22fdc&vjs=3"
