"X","Title","Company","Location","Date","Scrape.Date","Summary","Salary","Url"
"697",696,"Cyber Security Analyst","Epson Europe","Zeist","Meer dan 30 dagen geleden","2021-03-05","Broad hands-on knowledge of firewalls, intrusion detection systems, anti-virus software, data encryption, and other industry-standard techniques and practices •…","","https://nl.indeed.com/rc/clk?jk=2185148b0ae4e225&fccid=2da00ff91b007477&vjs=3"
"698",697,"Senior Data Engineer","RNHB","Nederland","Meer dan 30 dagen geleden","2021-03-05","The analytics team has experienced data scientists, business controllers and 1 senior data engineer.
Own the full stack of data operations for RNHB:","","https://nl.indeed.com/rc/clk?jk=4b466b842ca2c07a&fccid=8bb5d8de7167e3e8&vjs=3"
"699",698,"Data (Warehouse) Engineer","TripActions","Amsterdam","Meer dan 30 dagen geleden","2021-03-05","Define best practices in data models and development and coach our analysts and data scientists on how to be effective data modellers.
What We're Looking For:","","https://nl.indeed.com/rc/clk?jk=841ada945976114d&fccid=d4cf7525b2141ef1&vjs=3"
"700",699,"Market Research Analyst Healthcare","SKIM","Rotterdam","21 dagen geleden","2021-03-05","Execution of all phases of a market research study: questionnaire design (and programming), analysis of the data and preparation of client presentation in line…","","https://nl.indeed.com/rc/clk?jk=21dff900abd9f8ff&fccid=75e090a26d6b562d&vjs=3"
"701",700,"Information Security Analyst","CBOE","Amsterdam","14 dagen geleden","2021-03-05","You will monitor and analyze our logs and other data inputs using threat intelligence-based detection and attacker behavior analysis.","","https://nl.indeed.com/rc/clk?jk=bdaebeab75c6672a&fccid=538508a696477a24&vjs=3"
"702",701,"Expert Data Scientist","Webfleet Solutions","Amsterdam","Meer dan 30 dagen geleden","2021-03-05","As a data scientist you are on the forefront driving business results by generating data-based insights.
Close collaboration with data engineers and analysts to…","","https://nl.indeed.com/rc/clk?jk=18fb0c7f3110ad29&fccid=0681a5d0c57a9e6b&vjs=3"
"703",702,"Data analyst","Royal HaskoningDHV","Amersfoort","Meer dan 30 dagen geleden","2021-03-05","RHDHV is recruiting a talented Data Analyst who can easily extract actionable insights from data and is eager to help us to implement our data analytics &…","","https://nl.indeed.com/rc/clk?jk=91cb7b1d4d6f44e5&fccid=260f71831c1bd09f&vjs=3"
"704",703,"Data Engineer","Knab","Amsterdam","Meer dan 30 dagen geleden","2021-03-05","The Expert Center Data consist of 24 young professionals with a big heart for Data, covering domains data science, data engineering, data management & data…","","https://nl.indeed.com/rc/clk?jk=ce33dc56e08da043&fccid=459ca6a30f461e8e&vjs=3"
"705",704,"Innovation Analyst Internship","Dealroom.co","Amsterdam West","22 dagen geleden","2021-03-05","You are very comfortable playing with numbers and data to discover interesting trends and angles in our user-friendly data platform and turn them into a…","","https://nl.indeed.com/rc/clk?jk=f7eb0137224e986e&fccid=1d1eab7058278fb5&vjs=3"
"706",705,"Business-/Informatieanalist","Nederlandse Voedsel-en Warenautoriteit (NVWA)","Utrecht","3 dagen geleden","2021-03-05","Als Business-/ Informatie analist kom je te werken bij de directie Handhaven, de divisie Regie & Expertise op de afdeling Proces-en Productontwikkeling (PPO).","","https://nl.indeed.com/rc/clk?jk=6f9622ca1a183bb0&fccid=74099bbe66da4039&vjs=3"
"707",706,"Keuringsdienst (Bio) – Chemicus","Halal Feed and Food Inspection Authority (HFFIA)","Den Haag","Meer dan 30 dagen geleden","2021-03-05","Reporting of data relating to Halal to the Decision Committee.
Higher education (HBO / Academic) in food technology, (bio) chemistry, micro biology, Laboratory…","","https://nl.indeed.com/rc/clk?jk=d3c8523dce01bb5c&fccid=24bfa38ba5de69b3&vjs=3"
"708",707,"Manufacturing Data Analyst","CLS Services","Leiden","10 dagen geleden","2021-03-05","Janssen Biologics creates, acquires and markets unique biopharmaceutical therapies.
Their innovative products focus on the management of three major disease…","","https://nl.indeed.com/rc/clk?jk=43f65a3a3dad0c14&fccid=c686c3d827925954&vjs=3"
"709",708,"SENIOR CONSULTANT DATA SCIENCE & ANALYTICS","M3TCH B.V.","Utrecht","Meer dan 30 dagen geleden","2021-03-05","Heb je een afgeronde Master of PhD in Data Science, Econometrie, Marketing Intelligence, Artificial Intelligence of vergelijkbare studie en minimaal vijf jaar…","€4.300 - €6.200 per maand","https://nl.indeed.com/company/M3TCH-B.V./jobs/Senior-Consultant-Data-Science-Analytics-4d51f6c480d8331e?fccid=83494e98e8bc6226&vjs=3"
"710",709,"ambitieuze BI analisten","Centennium","Den Haag","Meer dan 30 dagen geleden","2021-03-05","Minimaal 4 jaar werkervaring in de rol van informatie/data-analist;
Ben jij een enthousiaste en ambitieuze BI professional en ben je toe aan een ‘next step’ in…","€55.000 - €75.000 per jaar","https://nl.indeed.com/rc/clk?jk=a0ec138dbc9b5fae&fccid=cd943ee9c6af163b&vjs=3"
"711",710,"Data analyst and E-commerce specialist","JUSTIN Recruitment","Amsterdam","8 dagen geleden","2021-03-05","The positon of data analyst and e-commerce specialist summarized:
We are looking for somebody who has 1-3 years relevant and recent working experience in…","","https://nl.indeed.com/pagead/clk?mo=r&ad=-6NYlbfkN0DveKNiBFqBLYRKHcY6VmO5kcdT87dqEPw7T2QDqWb86k8PrzqdHfZbgo3qTv4i-lxxTU3y41edJr45e3hUQV7Qh15lyHAVClO472P2qP-rolGRmNTaLJJ9bLdEdqyCoq7jnYyU3LzVAb-o6YcPdY0c6hy26ntmLS_oYTjmJp3qzHJIVXUeArdJUfqsUMsMindDCt9mU9Mgi3Ih-b1VqW3dvGVubdRsuMPgSK_dLniyWXlPwNULkdkjS1hirXMBhw3jf3tH-CFzOXM6DwrkFjIygbWhBvRV0DtDurw0jgM4y0N-7v1pMOYhxyCJeDKxJa7QkC3nUQYTW7dDWBfmYXbqVqkElAfmIvroenbUAQ_iOu-1C32seYqm52lJnLshLoehAOY22XUYILN4h_aubdVMZ3q-AfcaRqycdTpNAeadn88D8MFHOBrUEHEptcbT4lyRJqlf6NdydIf-Z1h529BOH-6WaQpk3nRUFXoxyFJyT1E7_mWNQlO7d1M9km0bLdrJxIkTqjdKNm5h_xzhTy7IMDsGljtKdmou6ywzAD74z6QhehW4s9MworcmaYq-EcU97xdkoUuepbu0-1kj3YgsJJ9AyW-1OPw_wS12-7fUXSGFnkrAo-3aimKopO82C6L1NnIP_YecAnSAQkfHq4B4Miduzc2wJ3WkxNzPXoozG7vIEItf57USWp7Ceaf1VWg=&p=14&fvj=0&vjs=3"
"712",711,"PowerBI Specialist","Berkvens","Someren","Meer dan 30 dagen geleden","2021-03-05","Je hebt kennis over data extractie en transformatie tools, data warehouses en data modellen.
Het ontwikkelen van datastromen voor gestructureerde en…","","https://nl.indeed.com/rc/clk?jk=3c1aaba501431347&fccid=b5c2191f14573eaf&vjs=3"
"713",712,"BI Specialist","Vion Food Group","Boxtel","Meer dan 30 dagen geleden","2021-03-05","Interest in data analysis and a drive to take a leading role to translate data into understandable analysis by using data analyses tools;
No 9 to 5 mentality.","","https://nl.indeed.com/rc/clk?jk=61ba13b74211f0c3&fccid=6d946835dd903506&vjs=3"
"714",713,"Lead Business Analist Inbound","Bol.com","Utrecht","22 dagen geleden","2021-03-05","Bol.com gelooft in zelforganiserende teams, data-gedreven pionieren en samen successen vieren.
Je pakt projecten gestructureerd aan, waarbij je data-gedreven…","","https://nl.indeed.com/rc/clk?jk=6c13870b20086c3d&fccid=38c84708b80970a7&vjs=3"
"715",714,"Hardware Product Manager","Hudl","Den Bosch","Meer dan 30 dagen geleden","2021-03-05","Validate Product decisions through research, data, and in-field testing.
You love data, and know how to interpret and think critically about results.","","https://nl.indeed.com/rc/clk?jk=d9faee6b2e81561b&fccid=76cfca1cf33fc977&vjs=3"
"716",715,"Applicatiebeheerder Apotheek (onbepaalde tijd)","Máxima Medisch Centrum","Eindhoven","16 dagen geleden","2021-03-05","Deze applicaties beheer je samen met je collega applicatiebeheerder en de data analist.
Zorg jij voor soepel lopende ICT processen in onze apotheek zodat…","€3.774 per maand","https://nl.indeed.com/rc/clk?jk=fd6b20d3eaf41da6&fccid=c2f74c92f1420e6f&vjs=3"
"717",716,"Data Scientist","Θέσεις Εργασίας","Amsterdam","Meer dan 30 dagen geleden","2021-03-05","Mentor other data analysts and data scientists within the team.
Work with structured and semi-structured data from different data sources and different products…","","https://nl.indeed.com/rc/clk?jk=d01a3ad4970e13fa&fccid=8bb0034d10cf5e3c&vjs=3"
"718",717,"Python/Data Engineer","Matrixian Group","Amsterdam","Meer dan 30 dagen geleden","2021-03-05","Collaborate with domain experts, analysts and data scientists to solve data challenges.
Knowledge of data modeling and data warehousing concepts.","","https://nl.indeed.com/rc/clk?jk=f4c2c143e8580f4f&fccid=0afb9e8563394fda&vjs=3"
"719",718,"Online marketeer: SEA Specialist / Data Analist","Sparklet B.V. | Digital Commerce Agency","Barneveld","Vandaag","2021-03-05","Dit diepgaande inzicht in data maakt voor onze klanten echt hét verschil.
Ben jij een ervaren marketeer: specialist digital advertising / web analist?","€2.800 - €4.500 per maand","https://nl.indeed.com/pagead/clk?mo=r&ad=-6NYlbfkN0AuCEqub_JsXkbFN8Ei6vgtGMu4WMBAaqTIU-BQ85loTCbm-01MLpT7_eGJy66kRrr7E90aDcLoLm2N3cxXdMT9L3-xFQGfY9EDdUJMrRyy_7Rv_OXh203esJ8IFtgbKF9Pmukt-jlP4jHoBDU1VDucvf4UCmWvwPQTEKDXBxYEiYyK0uV6-88WaI-eD8Axvm5A1TzYRM_hIo54WjD6zsLoqRTPH1nuzqXZJw_XSkSVVbASAfOGbbqECvQl6PxfLOJa2f8Vo2PIEbwL9s8RrzmERYBWMOnsAjQq3HeWJAniPnkeC3ogRK23A6pzeC8wShamqMBQfmwNFlbXTjnJqJEIoMvIazTUDcp8ENzc-XVSnbtYNEOc2re0BxO_Gi3wNQR9ONXKS1lrX48Vf0jdxIOz86pyEwRuBe-I9XvjwNJSY6uhWXrjgWqTx6cn2lMCUqgLdd1m_3f8Cw==&p=7&fvj=1&vjs=3"
"720",719,"Data Engineer","Funda","Amsterdam","Meer dan 30 dagen geleden","2021-03-05","You have experience with workflow orchestrator tools (e.g. Airflow), data modelling and the best practices of data warehousing;
This is what we offer.","","https://nl.indeed.com/rc/clk?jk=51cd72e0d063be37&fccid=5a374cafe877c425&vjs=3"
"721",720,"Backend Engineer, Data","Framer","Amsterdam","11 dagen geleden","2021-03-05","You'll also build and operate an event delivery system, as well as a data warehouse that enables the entire company to make data-driven decisions.","","https://nl.indeed.com/rc/clk?jk=cc7221b00fff98fb&fccid=e353ce30fec21404&vjs=3"
"722",721,"Sterility Assurance Expert","GE Healthcare","Eindhoven","21 dagen geleden","2021-03-05","Managing, motivating, guiding and coaching the people in your QC Microbiology team of 4 (senior) analysts.
We enable clinicians to make faster, more informed…","","https://nl.indeed.com/rc/clk?jk=bdd13f9a4aa33edf&fccid=65b5f2aba4dbd31f&vjs=3"
"723",722,"Medior Business Analist","Capgemini","Utrecht","Meer dan 30 dagen geleden","2021-03-05","Mede dankzij innovaties op het gebied van intelligence, linked data, BPM, robotisering en blockchain.
Ben jij een gedreven Business Analist en ben jij toe aan…","","https://nl.indeed.com/rc/clk?jk=cc792183d58038c9&fccid=105ecfd0283f415f&vjs=3"
"724",723,"Senior Data Scientist","Werkspot","Amsterdam Centrum","7 dagen geleden","2021-03-05","You will also be part of the data guild, collaborating with other data scientists, data engineers and data analysts across the company to align on the data…","","https://nl.indeed.com/rc/clk?jk=d1a20484d57d6c74&fccid=57e94a353dfb70db&vjs=3"
"725",724,"CRO Specialist","Holland & Barrett","Amsterdam","22 dagen geleden","2021-03-05","Je bent data driven en gebruikt deze mindset in de besluitvoering.
Het identificeren van verbeteringen via voornamelijk eigen analyses maar ook extern onderzoek…","","https://nl.indeed.com/rc/clk?jk=dba8aab9659f6b0b&fccid=344344dda6e83d9f&vjs=3"
"726",725,"Financieel analist / financial controller","Rijksdienst voor Ondernemend Nederland (RVO)","Den Haag","Meer dan 30 dagen geleden","2021-03-05","Projectmanagers onderzoeken wat de mogelijkheden van big data zijn.
Jouw corebusiness als financieel analist bij de afdeling Financiën en Control van de…","","https://nl.indeed.com/rc/clk?jk=e30c81b78eb0698c&fccid=6e98ca1d61cb235c&vjs=3"
"727",726,"Junior Marketing Analyst","wehkamp","Zwolle","Zojuist geplaatst","2021-03-05","Je hebt affiniteit met data.
Je vindt het uitdagend om inzichten te verwerven uit de enorme hoeveelheid beschikbare data.
Zo willen wij het verschil maken.","","https://nl.indeed.com/rc/clk?jk=2daa46ecca1d675f&fccid=8ee03ff44561e4a7&vjs=3"
"728",727,"Intern FP&A","Stryker Corporation","Amsterdam-Zuidoost","22 dagen geleden","2021-03-05","Assist the Divisional FP&A analyst in the coordination of the projection and budgeting process including all elements that are part of it (eg. set up of the…","","https://nl.indeed.com/rc/clk?jk=5320c4eef1fa2a98&fccid=9d4dbca3ed8b9cdf&vjs=3"
"729",728,"Market Intelligence Intern","Irdeto","Hoofddorp","6 dagen geleden","2021-03-05","Interact with external analysts and Senior Management.
Gather/cleanse data, build analysis models and run scenarios.
Who are we looking for:","","https://nl.indeed.com/rc/clk?jk=fad629a34cfa7098&fccid=46c644705d3bbe7a&vjs=3"
"730",729,"Data Engineer","Accenture","Utrecht","Meer dan 30 dagen geleden","2021-03-05","You will support software developers, database architects, data analysts and data scientists on data initiatives and will ensure optimal data delivery…","","https://nl.indeed.com/pagead/clk?mo=r&ad=-6NYlbfkN0CAfPLtvSc0KF_eHWGwkC81c5LTWPQKH5CJewu4hvDuCoJBV246NxyXR2SwCbDAExqocbs4O9N0jXqWjrU73e0iJO3AXYy9eDKpxmpXayIFr5G0wRVP5V3nXxTs4VOaThVffpvIpjMh7z-fOa7jyU4WZa3PIcSgMq1_2UrRwixzlk1no8JQJfUiRmIwxPNS-E1pr8xdWnyeXnh3BT-xUUHvaO_iOeQfT5S-Dil5IZw3u6Hdhi4Z6dyDPdYhO_nrrwi1dHs9tEsv4o5VyUI6mVc689j1ksGczGIPOsM3gcJO2eZDojy4-3SixuXnQNZ7ogtpJHzEg_2KfNVZoSyS3zb2fuLuUbb6YDqvLychEJkwmFVAP1xXS1aPo-CvB2gCrz1IpCgex05myikrPEgl5OwwiccUR_B5YdWuc7bvao2l0dUt2V_yvhDP4RItI9JOR_pGsrEDECWySw==&p=3&fvj=0&vjs=3"
"731",730,"Functioneel Beheerder Metacom","Boskalis","Rotterdam","Meer dan 30 dagen geleden","2021-03-05","Je maakt vergelijkingen en signaleert trends in de data van onze werken.
Ervaring met Excel, VENA, Power BI en big data.
Wat je gaat doen als Business Analist:","","https://nl.indeed.com/rc/clk?jk=9d52bb52566278c7&fccid=3002afa2a4b3c5ca&vjs=3"
"732",731,"Software Data Analyst and Automation Engineer","Templeton and Partners","Eindhoven","Meer dan 30 dagen geleden","2021-03-05","Do you want to apply data visualization and data mining techniques to support the software quality organization for further data analysis and upstreaming the…","","https://nl.indeed.com/rc/clk?jk=fc13289d87990672&fccid=9dfcd754d9d29a36&vjs=3"
"733",732,"Jr Data Engineer","Vye Professionals","Utrecht","Meer dan 30 dagen geleden","2021-03-05","The team has experienced data scientists, business controllers and 1 senior data engineer.
Support the Senior Data Engineer in the data operations:","","https://nl.indeed.com/rc/clk?jk=dea7faf723334f1c&fccid=aff710da749dd887&vjs=3"
"734",733,"Registry Services Manager","RIPE NCC","Amsterdam","24 dagen geleden","2021-03-05","Experience with formal audits to ensure compliance with organisational standards for activities, processes, data, products and services.","€84.000 - €120.000 per jaar","https://nl.indeed.com/rc/clk?jk=b1f56c710a78e2a3&fccid=97d3d88ff207a5ce&vjs=3"
"735",734,"BI Specialist","Thales Group","Hengelo OV","Zojuist geplaatst","2021-03-05","Together with the data engineer and data manager, you investigate which data is required to build the dashboard and together you determine how much time it will…","","https://nl.indeed.com/rc/clk?jk=170525e32fa73641&fccid=b920aab5fd60595d&vjs=3"
"736",735,"Information Security Analyst","EuroCCP","Amsterdam Zuid","15 dagen geleden","2021-03-05","You will monitor and analyze our logs and other data inputs using threat intelligence-based detection and attacker behavior analysis.","€4.000 per maand","https://nl.indeed.com/company/EuroCCP/jobs/Information-Security-Analyst-85b29b3f8bc9057a?fccid=9867cb90a8bfe28f&vjs=3"
"737",736,"Researchanalist Diabetes Type 2 & Bioinformatica","LUMC","Leiden","16 dagen geleden","2021-03-05","Als data analist doe je onderzoek met RNA-sequencing data die we verzameld hebben bij deelnemers middels de Hoorn Diabetes Zorgsysteem-cohortstudie.","€3.280 per maand","https://nl.indeed.com/rc/clk?jk=7c0677445b12106b&fccid=6e752e820f67e3eb&vjs=3"
"738",737,"Consultant QRM","ITSync","Amsterdam","Vandaag","2021-03-05","Experience with ALM data processes.
Improve and simplify data loads and ETL processes, despite of differences and variety in country data.","","https://nl.indeed.com/rc/clk?jk=15d2053162f4c242&fccid=d5c3bb28ade61aba&vjs=3"
"739",738,"Informatie Analist","Eurofins Central Laboratory","Barneveld","Meer dan 30 dagen geleden","2021-03-05","Daarnaast bereid je de testscenario’s en test data voor, documenteer je de testresultaten en los je de knelpunten op doormiddel van troubleshooting.","","https://nl.indeed.com/rc/clk?jk=83bddaf49a3aa141&fccid=da33f48dbeb2e889&vjs=3"
"740",739,"Ervaren Chatbot Content Ontwikkelaar","ING","Leeuwarden","15 dagen geleden","2021-03-05","Hierin werk je nauw samen met de data analist in het team.
Naast de Productowner bestaat het team op dit moment uit een data analist en een aantal content…","","https://nl.indeed.com/rc/clk?jk=d6252be92635b7dc&fccid=5b16841c3468a10d&vjs=3"
"741",740,"Analyst Continuous Service Improvement","NTT MSC","Barneveld","Meer dan 30 dagen geleden","2021-03-05","Collects data to identify root cause of problems.
Develops metrics that provide data for process measurement, identifying indicators for future improvement…","","https://nl.indeed.com/rc/clk?jk=0210d1d56b68280b&fccid=4d65a0b81feab968&vjs=3"
"742",741,"Traineeship: Data Analist","Createment","Eindhoven","2 dagen geleden","2021-03-05","De data-wereld ligt aan jouw voeten.
Ervaring in data-analyse is niet nodig, wél breng je mee.
Gewoon omdat je hard werkt, IT, online marketing en data gaaf…","€2.500 per maand","https://nl.indeed.com/pagead/clk?mo=r&ad=-6NYlbfkN0BQVpz0dABwcJxPL6ZF89l8aMZ4ujW6gW5aOiSkCGD8kFV8HXpgi727Omxjhihm0EipkcS3-z-sPOCnggwUtodXRHTnFvhTaezc0CL9YbpLO8q7F_4VL8cADy53OexmiVjyGk-BqxjpLnY4l7blENZlG_B-vU3dJLI_tJUKh0shmhbuyuLxjS2ayjl9MlwGO76g_2qMHnqls_RPYQHd-xopvSKWXn0Eqj3iZRwXfjDCFIK9E3HZ-r6zsfUZiOOWvlRGVsC2ewvNmOgdFWvhqgUT5VwO-KbBLcZBFYBN9hYOKTdnq_TMUVhK6yNtLMS5NuPgAkFtEV-7g_WlZaIQnkM3lsDSJVJ_ncYnCY7BmWtrt2qqZAqDhmOgAnCPbDqyWOL-8SR-OiN6icZXG0nWC-JFlT9_Fo7Oi-crJuLNFF6G64oHil_Hq6B-aHL0hTh6yDWQvlBQEDaeA7GMmJ8UzAXVWxa4t0jK3DOcOW9g8BtZh_AboNWFNl0hZIcesTBkk_PIqdB8b-Zj-ISmQNNq6Pf_IdzqiplzGIPMIFfQIRW2xB8CizaAYtXBmZc8KgzAuq3AWkItgIesDA1T15KXHg9zUtoaIE_EmQ1b0spCk374ZdokTM0t7E61AqwMS5yctFle7dvg0f_qdg==&p=0&fvj=0&vjs=3"
"743",742,"Data Analist","Enexis","Den Bosch","9 dagen geleden","2021-03-05","MI bestaat momenteel uit een data analist, web analist, marktonderzoeker en een senior marketing intelligence medewerker.
Ervaring met web analyse is een pré.","€3.404 - €4.863 per maand","https://nl.indeed.com/pagead/clk?mo=r&ad=-6NYlbfkN0Anhk1jJoJlLLH4x9OTW8szen6xJ4VD6sIavLZrBTsL2Dzxavgw6cdIBayY9YzcYeN89FiyY3nWsNBRV3DpG3MBoaUmZddpcQi6yjBc_t_a5WJq9O9mRQ-_qUfhBi8a7EYXt059zcaJpzlTwFQpn_VcX2DMC9Sb1CVzfP9d3D9skYN3YSmwPTvmPAQwyEsPkkbH4yMsN4lyrmkKPoh92XyZsMkNC76sevPGg1lqXcL34aGj-YitF4nT-bWj6QSU78Ra6qPU7l5EeDBYR7Fp3H6ew-NoTG2f-zHPEoHeeR_Xc9Ots__9BWoLab-eNcCFqTxj33ZgvT1NdcJvfCLyRBXf9v1ai6c9CPWmKMm1VLgOyVKgDlkqoHZoV37mc6JK2s7CRRTmvNvuybuxoezWZCoJTlm1ELhTifDbACkfZOOJt6Ta4tj9OO5FdjjR1nTPsmommrIm_UWgiDNHox5S-AFXS0Se444J7yk9PrCUYe3hCYBUpBCe8iOUUmjTWvKlz75Qg71XNANedOXO593I1aF3q96ZBsb3e_LVamRSRURN_Fk0wB3kQGOODFccF_M5C48z2J4Hl4rMrlGaU5ci-8IiLZHp7Erg0nUcln5P2oc09xbjINE8BU9E989DbMeI1TAaR5NscC2mDmNbOvoynHO8wj1c6vNO8yL5GymWxC86LQTNbnp8V7aPAVQ2D3T102EdbsRgWNpMWTujlCXYnP06Tup4k0Wz1IdGzGZXS_SsnADoTqvVqpKS_xu94PNuLwgulgUpLS9loLE0lpDwLneSxe23-9ooge10e60Vc5yJ8LmdvMnZO-5ZK619Nc74pvrudgZhdVpoBYKsQMx88ZIyKmR9Ww9VOLgB-u3DlllS0aWuL5z7Lrr30rXXWYyF1sUq0etVsNmBP3Vv8_eJrfZ6q4yKMDibjdB6lLhIHA47FAl5PssVMNs7-BuyZ5XKrjX802BrfP0YmqGejmb9b4CqLkv5xyrLvKJeBHc6LCReIxl3ILIFHh84R0jDzcpjBps-NQ1ou7GvAPXoEjJmcBHs0OLVdVJHzDCiSF-y6kSWhP9if0rD1-v2&p=1&fvj=0&vjs=3"
"744",743,"Senior Data Analyst","NN Group","Den Haag","Meer dan 30 dagen geleden","2021-03-05","The team has the core objective to ensure that all data users throughout the company have access to relevant, timely and high quality comprehensive data, in a…","","https://nl.indeed.com/rc/clk?jk=f1c885476433df19&fccid=b80e50fd47bd0849&vjs=3"
"745",744,"Business Analist","Pipelife","Enkhuizen","Meer dan 30 dagen geleden","2021-03-05","Zo dragen we actief bij tot de duurzame distributie van water, energie en data.
Een belangrijke rol binnen Pipelife waarbij je midden in de organisatie staat.","","https://nl.indeed.com/rc/clk?jk=787683096855dd1f&fccid=7e701957402f8a69&vjs=3"
"746",745,"Data Analyst - User Growth","Poki","Amsterdam","13 dagen geleden","2021-03-05","We’re looking for a data-savvy individual to join our User Growth team.
As an analyst on a rapidly growing team, you’ll have lots of ownership and the chance to…","","https://nl.indeed.com/rc/clk?jk=863505e836d10791&fccid=1dc6e346b5dfffb5&vjs=3"
"747",746,"Business analyst","L&G Recruitment solutions Limited","Amsterdam","Meer dan 30 dagen geleden","2021-03-05","A passion for turning data into valuable information.
Experience in Leasing company and Leasing domain as a strong Business Analyst.","€400 - €420 per dag","https://nl.indeed.com/company/L&G-Recruitment-solutions-Limited/jobs/Business-Analyst-abbcf894e44b373e?fccid=574ff7c76f5f4ac5&vjs=3"
"748",747,"Audit Analyst Pricing and Deal Compliance (fulltime, m/v)","Sealed Air","Nijmegen","10 dagen geleden","2021-03-05","In het team van Pricing en Deal analysts zal de Audit analyst verantwoordelijk zijn voor de uitvoering van specifieke audit procedures en audit projecten van…","€35.000 - €52.000 per jaar","https://nl.indeed.com/company/Sealed-Air/jobs/Audit-Analyst-Pricing-Deal-Compliance-fa023e501d829489?fccid=66c010dc97a69d7c&vjs=3"
"749",748,"Data Engineer","Picnic","Amsterdam","Meer dan 30 dagen geleden","2021-03-05","Collaborate with domain experts and analysts to solve data challenges.
Apply data modelling methodologies and contribute to a robust data platform.","","https://nl.indeed.com/rc/clk?jk=8614e62e2466a9eb&fccid=9ca7c1c1cfaa481c&vjs=3"
"750",749,"Dairy Market and Competitive Intelligence Analyst","FrieslandCampina","Amersfoort","Vandaag","2021-03-05","You have at least 3 years of experience in a role of market analyst or intelligence analyst.
Business support with data, analyses and methodic advise.","","https://nl.indeed.com/rc/clk?jk=ad68470ab3560a08&fccid=bb9c97a740367a36&vjs=3"
"751",750,"Medior/Senior SOC Analist","CTAC","Den Bosch","24 dagen geleden","2021-03-05","Naast het analyseren van alerts ga je ook zelf op zoek naar kwetsbaarheden, bijvoorbeeld door het gebruik van threat hunting, maar ook door het combineren van…","","https://nl.indeed.com/rc/clk?jk=eec09030fcad4cae&fccid=12837457148799aa&vjs=3"
"752",751,"Informatie analist","Centraal Orgaan opvang asielzoekers","Den Haag","Meer dan 30 dagen geleden","2021-03-05","Als Informatie analist vragen we het volgende van je:
Ben jij een ervaren informatie analist en heb jij de kwaliteiten in huis die nodig zijn om de link tussen…","€3.273 - €4.575 per maand","https://nl.indeed.com/rc/clk?jk=6d4c35f307476fba&fccid=7b3aa142d7792a53&vjs=3"
"753",752,"Cyber Reservist - Threat Intell & Analytics","Ministerie van Defensie","Nederland","Meer dan 30 dagen geleden","2021-03-05","Big-data security analytics uitvoeren.
Jij kunt als analist of data scientist het verschil maken in een organisatie van en door cyberreservisten die onze…","","https://nl.indeed.com/rc/clk?jk=46c33511290508a1&fccid=0ae1208eb28c7486&vjs=3"
"754",753,"Data Analist","Aon","Eindhoven","Meer dan 30 dagen geleden","2021-03-05","Data…","","https://nl.indeed.com/pagead/clk?mo=r&ad=-6NYlbfkN0BUr1ih89J8xlxnhfvrvaSPyfeHEUaTmnzB_AydzFDKnIiZ_IebOX6YnjJSMiF7dRLn9puMMVtEjWmhzpOVn_3hDp8cIFVXzTAYKweJColTCEpTwGwYCi6oDI3fy3ehYQTqneslOaS-XtBKDfnTdVm9M352T4LY1sItadkbln3REmntuSnGC6mo2XPuEuBYU8lEiGnnb6GyBcXg5Huh47D6aOtWsXcATqjYV87cFOqeEqYkrXjydI3_yuz_jfcUuf1z3tQ7BovAp4AgPsfNY9WUH74B3Mwgs-c6QR1DV4ml0xIQ0Yyj07Cp6aglkYeKNy-4nYaDsYx2sb0vLmZTZtX_mFyk9y96hGOITxDjVMivDJJaXPBD5YK1V3c65Pq5KXCuRy3E2fmMOx_vvYoTKGaftuuZZAf9hXNPZ_wOwmEL9bf8uBFXCOzrdsL3LgfOvt0zVJwHb_syCGa4zdkGLnB77ep6V7BgVySjqEMCTlTGumsyYIiXz9GlBjv-rnqFAe0YWQFl7BR1apdcYRiebMoVCz9AZoEgIsGBzqrxFN_Ic1IdLxp215tZEccsZzw3gFNmbN5_P0_xQBl-87rgFvtFoY25om203YkZjBLl9GdYxAambrA-rL-PZHGKEvki8Ic=&p=12&fvj=0&vjs=3"
"755",754,"Data Analist Sociale Zekerheid","Aon","Rotterdam","Meer dan 30 dagen geleden","2021-03-05","Data Analist Sociale…","€2.900 - €4.500 per maand","https://nl.indeed.com/pagead/clk?mo=r&ad=-6NYlbfkN0BUr1ih89J8xlxnhfvrvaSPyfeHEUaTmnzB_AydzFDKnIiZ_IebOX6YqBg3HhWjqsvLYdBMllfluWYNSinSxvVzZuTqC-wIeneBQv7gsmOlldH-883T2mDzowXLByP9ZO5WzCurSNNqTF8WDshFfeqFJoiTlc5y42c7-Hcpctgx0vkwRNhXMmHYJj673eiX8YP_MKGZwszJZ_oM4HMTlKID-7QsWEEjVSrzTtq9VZ-rlplGVouZ6aeeAOGNpsch7WxYtiSyAG7zOBrgUveRingJP5SIMj5l7Vni392ZkWNf829lT2haNMpqPC7MrujPIVx-TZeOE3is9dGuuWZBmFtrV9fuh9qaLBAcREhENDYtstcePUiMjcsGrk2EaLLJl8qy8vikEe20hh1w1iiKmwmaz74Hv-oKB5bNOrAa51bO3pCQdMm8Rp7NsbZTg6RYEsJ3BFY81hymsu_NuoZmdkkvVUSDard-5uWysw8woOmmMzcXapTovh9ncHEqWfTqAAKuV4mDaAueUMUOjVZ8mie5Ra7CQyQ-x1xlfTdyB4YouK7eK9CO5dFDWCsbfl6WgIT9vStYhFfBeYXD8fozjoF0jJBqeTTIn0mZ-KlcQrNtH58ZKd0-fdz2&p=13&fvj=0&vjs=3"
"756",755,"Data Analist","TreeHouse","Rotterdam","9 dagen geleden","2021-03-05","Dit team is verantwoordelijk voor het verzamelen en waarborgen van de de kwaliteit van onze data en ons als organisatie helpen om deze data inzichtelijk te…","","https://nl.indeed.com/pagead/clk?mo=r&ad=-6NYlbfkN0BbOies5qPN1BgKwdkTD8LtNSbl3vQGA32DWrLLWCjoLzVAWZwBSsl5ZoP9TMWGTon7uEA1ujWF9BV1O6X46CjsgekV17gmvPRwqz2bu8JBySiI6EfE5lT_Yna2NjSbpaF-1hgJ21d6yAUOA97_HZDiFqYs6m_mEKg6jqEZSeC6jfxxRmwVcyFExyQG8souAPVypM2nwPMQNEiBCz5ms-tynVoBxcDswO7iCn8tUDgMxn0v4xcC-jV0QLVWKHV0gnWk1ZJpBuZuYbj0aDNZ8a9abuI3BDl7knRIFYHAZ8dQ6pdohI-PxZqPPWqwQZVEZ_5YNI2_PYK-kQJfxBXy13aa0FHmchiVSlwv3lOeUY0K47ze82Zz6Ec12hASlnwCeLbG2cfXpPhj_y4aY2AkpoC6s-EyAysgRemWJyGw-KQ9_KLGpMmhfXkOPQDcVC_RPfZ073JOUKRd1w==&p=14&fvj=1&vjs=3"
