id,description,scrapetimesdescription
10ed26bf34fc93e4,"Omschrijving Je komt in een team van Data Scientists, Customer Success Consultants en Developers, waarbij jij mede verantwoordelijk bent voor de (door) ontwikkeling van het Data Managent Platform en ons Marketing Automation Platform. Vanuit jouw vakgebied lever je een essentiële bijdrage aan een leading – next generation – business intelligence en data analyse oplossing voor een breed scala aan toonaangevende opdrachtgevers. Jij vult het team aan met jouw kennis van o.a. Machine Learning e/o Deep Learning, e/o Artificial Intelligence. Omdat het toevoegen van de eerder genoemde expertise nodig is voor het realiseren van onze plannen, zal je veel ruimte krijgen om dat zelf vorm te geven en wordt jouw eigen inbreng hierin gewaardeerd. Je past in deze functie verschillende geavanceerde technieken toe om data om te zetten in inzichten. Deze inzichten worden door klanten gebruikt om gedrag te verklaren, voorspellen en/of te beïnvloeden. Naast het (door)ontwikkelen en de reactieve werkzaamheden ga je ook proactief op zoek naar kansen die verscholen liggen in ruwe data vanuit diverse in- en externe databronnen. Je draagt actief bij aan de ontwikkelingsrichting en de technische strategie van de organisatie. Wat wordt er gevraagd Naast de profielschets hierboven wordt er verwacht dat je eigen initiatief en verantwoordelijkheid neemt en dat je breder kijkt dan alleen je eigen takenpakket. Het kantoor is open tijdens reguliere kantoortijden, maar het is mogelijk dat er in het weekend hoog urgente zaken binnen komen. Daarin wordt flexibiliteit verwacht. Het ambitie niveau ligt hoog, DATANEXT groeit graag door totdat ze een echte topspeler zijn op het gebied van ‘Big Data’, processen en Business Intelligence oplossingen. Ze zoeken daarom (aankomende) topspelers met dezelfde ambitie, die binnen hun vakgebied een actieve en ondernemende bijdrage leveren aan het succes van de DATANEXT Group. – WO werk- en/of denkniveau; – Brede kennis van datamodellen en -typen; – Ruime ervaring met SQL; – Ervaring met data-analyse tools (als Tableau, Rapidminer, R of Python); – Studie- of professionele achtergrond in Machine Learing, Deep Learning en/of Artificial Intelligence of Computer Science; – Minimaal 2 jaar ervaring in een soortgelijke functie. Wat wordt er geboden DATANEXT is een groeiende, maar solide werkgever. De teams bestaan o.a. uit Data Scientists, AI/ML specialisten, en developers. Humor speelt een grote rol. Er is veel vrijheid en ze stimuleren en faciliteren ieder lid van het team om door te groeien. Het is een open en platte organisatie, waarin men elkaar respecteert, support én stimuleert. Ze hebben goeie koffie, verzorgen je lunch en zorgen voor vers fruit op de werkplek. Allemaal in een fijn kantoor in Groningen Zuid. Salarissen zijn marktconform en er is een uitstekende regeling voor een persoonlijke oudedagsvoorziening. Bedrijfsprofiel De DATANEXT Group bestaat uit een aantal labels, allen gebaseerd op haar eigen Customer Data Platform ‘DNX’. De uitingsvormen variëren in vorm en functie per klant, maar data staat altijd centraal, al dan niet gecombineerd met AI en Machine Learning. De verschillende labels richten zich o.a. op Customer Data, Marketing Automation, Quality Monitoring in klantcontact, AVG-ondersteuning en Lead Management. Om al deze data te kunnen verwerken is het van essentieel belang dat onze databases, datastromen en systemen goed worden ingericht en gemonitord. PLAY_GRND werkt voor deze vacature samen met DATANEXT. Heb je interesse? Solliciteer dan direct via onderstaande button of neem gerust contact met ons op voor meer info!",2021-03-17 18:13:09
39a852399f0d365d,"At Booking.com, data drives our decisions. Technology is at our core. And innovation is everywhere. But our company is more than datasets, lines of code or A/B tests. We’re the thrill of the first night in a new place. The excitement of the next morning. The friends you make. The journeys you take. The sights you see. And the food you sample. Through our products, partners and people, we make it easier for everyone to experience the world. The Customer Insights department is looking for data savvy professionals to join our team of data scientists. You will have the opportunity to build data products that will be used across various departments of our business to help us predict and understand our customers’ behaviour, enabling us to offer them the most relevant personalised experience. The NITS team (No-Intent-To-Stay) works on our machine learning models that predict the probability of a cancellation. As a Data Scientist Insights in the NITS team, you’ll have the chance to work with one of the most established and widely used ML models at Booking.com and play an integral role in taking it to the next level! You’ll have the chance to collaborate closely with other Analysts, Developers, Product Managers and various business stakeholders and take full ownership of your work - from the initial idea generation phase to the implementation of the final product. You will thrive at Booking.com if you are result-focused, innovative, and with a solid quantitative background, but most of all by understanding our complex business model and the logic behind it. B.RESPONSIBLE Utilize ML and other statistical techniques, to continuously generate insights related to the performance of the model and advise the team on potential improvements. Generate cancellation related insights to influence the model development. Communicate regularly with the model’s stakeholders and assist with answering their questions. Develop insightful metrics, dashboards, reports. Continuously evolve your craft by keeping up to date with the latest developments. Actively contribute to the Data Science Insights craft at Booking.com through training, exploration of new technologies, interviewing, onboarding and mentoring colleagues. B.SKILLED At least 2 years of relevant work experience. Masters, PhD, or equivalent experience in a quantitative field (Computer Science, Mathematics, Engineering, Artificial Intelligence, etc.) Fluency in at least one programming language, with a strong preference for Python. Strong working knowledge of Spark and SQL. Strong knowledge of reporting/visualization techniques (e.g., Tableau, Graphite, Power BI, etc.) Excellent English communication skills, both written and verbal; the ability to convey your message to team members and other stakeholders. Good understanding of fundamental machine learning concepts. Experience with forecasting techniques is a plus. Team player with strong interpersonal skills. Solution oriented and result driven. Excellent organizational skills, attention to detail and analytical reasoning. What’s in it for you? The DSI role is open to worldwide candidates. We provide assistance for you and your family with a generous relocation package, ensuring a smooth transition to working and living in Amsterdam. We have successfully relocated 300+ technology professionals to Amsterdam in the last year. Headquarters located in one of the most vibrant cities in Europe: Amsterdam Performance-based company that offers 29 vacation days, career advancement, and lucrative compensation, including bonuses and stock potential Discount on Booking.com accommodations with the “Booking Deal” including other perks and benefits Company-sponsored family and social activities to help our employees become integrated with each other and Dutch culture Diverse, unique colleagues from every corner of the world Booking.com is proud to be an equal opportunity workplace and is an affirmative action employer. All qualified applicants will receive consideration for employment without regard to race, colour, religion, gender, gender identity or expression, sexual orientation, national origin, genetics, disability, age, or veteran status. We strive to move well beyond traditional equal opportunity and work to create an environment that allows everyone to thrive.",2021-03-17 18:13:21
562808aa14602e21,"The Vaccine Generation group is part of the Viral Vaccines department of Janssen Vaccines & Prevention (JVP) and focuses on the research and development of vaccines against viral infectious diseases. The group is responsible for the design, generation, production, and characterization of recombinant viral vectors, for applied research in the vaccine field. Interaction with R&D groups in the organization is an important aspect of our work. You will join a stimulating group of researchers in a very collaborative environment. We are looking for an Associate Scientist to strengthen our team in developing innovative vaccine candidates aimed to prevent and treat life-threatening diseases. As an experienced Associate Scientist (Technician), you will be working under the supervision of a (senior) Scientist to support programs by generating, characterizing our (adeno) viral vectored vaccines, and improving our assays and procedures. Work within our team is dynamic and requires a flexible attitude. You will analyze and interpret data, propose the next steps, and report/present to (senior) colleagues. Cooperation and communication are important to all levels within the department. This job requires you to be an expert in techniques like (q)PCR, sequence analysis, standard DNA cloning, western blot, and cell culture. An interest in keeping up-to-date with relevant scientific literature is a plus. Expected activities include but are not limited to: Cloning of viral vectored vaccines using molecular techniques Generation and characterization of viral vectors Plan, design, conduct, and troubleshoot complex experiments Present results to team members and senior colleagues  Qualifications Minimum Qualifications: Education: you have finished an HLO or master's education with significant molecular, (bio)chemical, and virology training with more than 5 years of working experience in a relevant position. Furthermore, proven experience in molecular biology showing a good understanding of the matter is required. Required skills: (q)PCR, standard DNA cloning techniques, sequence analysis, cell culture, western blotting Preferred skills: Experience working in ML-2 laboratory with viral vectors. Specific Knowledge: Experience with adenoviral vectors is a plus. Competences: Organized and highly accurate Experiment design and data analysis skills Written and oral communication skills in English Dynamic, flexible, and open demeanor Digital literacy Johnson & Johnson Family of Companies are equal opportunity employers, and all qualified applicants will receive consideration for employment without regard to any characteristic protected by law. We will ensure that individuals with disabilities are provided a reasonable accommodation to participate in the job application or interview process, to perform essential job functions, and to receive other benefits and privileges of employment. Please contact us to request an accommodation.   Primary Location Netherlands-South Holland-Leiden- Organization Janssen Vaccines & Prevention BV (8852) Job Function R&D Requisition ID 2105898963W",2021-03-17 18:13:23
f50f99288bc4c25c,"It wasn’t so long ago that booking a trip to see the Eiffel Tower, stroll down New York’s iconic Madison Avenue or feel the sand between our toes on Copacabana Beach was simply a matter of a few taps on our smartphone. In fact, that’s what we do at Booking.com. We make it easier for everyone to experience the world. And while that world might feel a little farther away right now, we’re busy preparing for when the world is ready to travel once more. Across our offices worldwide, we continue to innovate. To solve for some of the most complex challenges in travel and technology, and to plan for the exciting developments that lie ahead. With strategic long-term investments into what we believe the future of travel can be, we are opening up new career opportunities that will have a strong impact on our mission.We are united in the belief that our very human desire to explore the planet’s beauty and discover more about other people and cultures will endure. The world is waiting for us. Together, we will be ready. At Booking.com, data drives our decisions. Technology is at our core. And innovation is everywhere. But our company is more than datasets, lines of code or A/B tests. We’re the thrill of the first night in a new place. The excitement of the next morning. The friends you make. The journeys you take. The sights you see. And the food you sample. Through our products, partners and people, we can empower everyone to experience the world. With over 1.6 million room nights booked every day, accommodation represents the largest share of our business to date. We are responsible for accommodation growth, with clear ownership of all marketing, product and supply related to accommodations. Our mission is to deliver the best customer experience and most varied selection of properties.  In order to support the objectives of focusing on the customer, personalisation is key to the augmented customer support and enhancing the post-booking experience. This requires the building of a personalisation engine, and the deep integration of this engine into a complex systems landscape. The Product Foundations & Help Technologies department is in the process of bootstrapping a team specifically for this building, with a machine learning scientist being at the centre of this team. The heavy lift of the modularisation of the b.com homepage and addition of personalised content requires a deep skill-set that this MLS position will bring.  B.Responsible Work in a multi-disciplined team where you’ll take full ownership of turning discoveries and ideas into products through machine learning (incl. understanding product requirements, data discovery, model development and evaluation, to implementation of a full production pipeline for both batch and stream-based deployment). Use the model’s output to deliver both short-term commercial impact and longer-term differentiated business value and customer experience. Define and build proof-of-concepts to test new ideas and demonstrate their potential value to relevant stakeholders. Document and share the findings, and identify when these technologies can be generalised into reusable frameworks. Continuously evolve your craft by keeping up to date with the latest developments in ML/AI and related technologies, and upskilling on these as needed. Actively contribute to Machine Learning at Booking.com through training, exploration of new technologies, interviewing, onboarding and mentoring colleagues. B. Skilled At least 3 years of relevant work experience. Masters, PhD, or equivalent experience in a quantitative field (Computer Science, Mathematics, Engineering, Artificial Intelligence, etc.) Prior experience with classification and regression algorithms and an excellent understanding of the specifics of those algorithms. Experience with deep learning is a plus. Solid understanding of fundamental machine learning concepts. Fluency in at least one programming language, with a strong preference for Python. Strong working knowledge of Spark and SQL. Experience with putting machine learning models in production is a plus. Excellent English communication skills, both written and verbal; the ability to convey your message to team members and other stakeholders. B.Offered Living and working in Amsterdam, one of the most cosmopolitan cities in Europe Contributing to a high scale, complex, world renowned product and seeing real-time impact of your work on millions of travellers worldwide Working in a fast-paced and performance driven culture Opportunity to utilize technical expertise, leadership capabilities and entrepreneurial spirit Promote and drive impactful and innovative engineering solutions Technical, behavioural and interpersonal competence advancement via on-the-job opportunities, experimental projects, hackathons, conferences and active community participation Competitive compensation and benefits package and some great added perks of working in the home city of Booking.com Booking.com is proud to be an equal opportunity workplace and is an affirmative action employer. All qualified applicants will receive consideration for employment without regard to race, colour, religion, gender, gender identity or expression, sexual orientation, national origin, genetics, disability, age, or veteran status. We strive to move well beyond traditional equal opportunity and work to create an environment that allows everyone to thrive.",2021-03-17 18:13:29
1478f7d1ed9079b6,"Is het jouw passie om op basis van data analyse waarde toe te voegen voor zowel de klant als jouw collega’s? Ben jij een topper in het bouwen van voorspellende modellen? Wil jij direct resultaat zien van jouw acties? Dan ben jij de Data Scientist die wij zoeken! Deze functie biedt je een salaris van minimaal €3.065,- tot maximaal €4.379,- (obv 36 uur per week).  Als Data Scientist ben je verantwoordelijk voor de vertaalslag van grote databestanden naar businesstoepassingen. Door middel van programmeercodes maak jij van ruwe databestanden heldere overzichten voor productmanagers en commerciële afdelingen, en maak je voorspellende modellen ter verbetering van bijvoorbeeld onze bedrijfsprocessen. Wat je gaat doen Ontwikkeling van nieuwe pricing en automatiseren van het pricing proces Ontwikkelen van BI dashboards Analyse van ervaringscijfers Toepassen van nieuwe pricing technieken Onderzoek naar effecten nieuwe ontwikkelingen Met wie je werkt Jij bent onderdeel van één van de teams binnen Product Management & Expertise. Hierbinnen focussen we ons op de pricing en met een team van 15 enthousiaste en gedreven actuarissen, data scientists en data analisten. Gezamenlijk zorgen we voor de beste prijzen in een zeer competitieve markt. Dat doen we door actuariële kennis te verbinden met data science technieken en analytics tools. Daarnaast zorgen we ervoor dat we altijd leveren wat onze partners vragen, veelal in samenwerking met product managers, marketeers, de operatie en IT. Wat je meebrengt Een afgeronde (technische) WO opleiding in de richting econometrie, wiskunde, natuurkunde of engineering Bij voorkeur 1 of 2 jaren werkervaring in het vakgebied Kennis van programmeren, bij voorkeur in SQL en Python Je vindt het leuk om diep in de data te duiken en die te structureren als het nodig is Ervaring in het maken van de vertaalslag van big data naar commerciële toepasbaarheid Kennis van BI software Je ben communicatie vaardig en beschikt over consultancy skills Je bent pragmatisch ingesteld en beschikt over implementatiekracht Je hebt een pro-actieve houding Blijf je ontwikkelen Wij vinden het belangrijk dat jij je kunt blijven ontwikkelen. We geven je de ruimte en het vertrouwen om te groeien in je carrière en als mens. Wij helpen je hierbij met: Volop training- en opleidingsmogelijkheden in ons Learning & Development Centre Een groot (internationaal) netwerk van collega’s die graag hun kennis met je delen De autonomie om je eigen ontwikkelroute te bepalen Over NN Wij helpen mensen zorgen voor wat zij echt belangrijk vinden. De wereld waarin we leven mag dan veranderen, wat er echt toe doet voor mensen, blijft hetzelfde. Familie, vrienden, liefde, gezondheid, thuis en werk natuurlijk ook. Met jouw inzet maken we onze dienstverlening persoonlijker en relevanter. Zo kunnen we als organisatie echt het verschil maken vanuit al onze merken: Nationale-Nederlanden, NN Investment Partners, ABN AMRO Verzekeringen, Movir, AZL, BeFrank, Zicht en OHRA. Arbeidsvoorwaarden die bij jou passen Jij bent meer dan alleen een collega en dat snappen we bij NN heel goed. Je hebt verschillende rollen in het leven en daar horen keuzes bij. Wij stellen jou in staat arbeidsvoorwaarden te kiezen die voor jou belangrijk zijn en aansluiten bij jouw privésituatie. Denk aan het bijkopen van vakantiedagen en flexibele werktijden. Je vakantiegeld en 13de maand ontvang je maandelijks bij je salaris, daar hoef je niet op te wachten. Als Data Scientist werk je vanuit ons mooie kantoor in Den Haag. Direct naast de A12, maar ook goed bereikbaar met het openbaar vervoer. Liever even uitwaaien? Pak de tram of (ov-)fiets en in een klein half uurtje ben je op het strand. Word jij onze nieuwe collega? Ben jij enthousiast over deze vacature en denk je dat je goed past in het team en bij NN? Dan nodigen wij je uit om te solliciteren. Wij zijn erg benieuwd naar wie jij bent, wat jou beweegt en wat jij kunt bijdragen in deze functie bij NN. Solliciteer direct! Heb je nog vragen over de vacature of de procedure? Bel of stel je vraag via WhatsApp aan Jan Orthmann, Head of Pricing & Underwriting ZS via 06-25682468 of via Jan.Orthmann@nn.nl Het gaat hier om een permanente positie. Een kandidaat ontvangt een contract van NN en we staan niet open voor interim/freelance opdrachten en/of kandidaten of acquisitie door bureaus. Alvast bedankt voor uw begrip.",2021-03-17 18:13:32
7532f5c083787082,"Dit wordt je functie APG verzorgt de pensioenuitvoering van zo’n 4,7 miljoen Nederlanders. Daarmee beschikt APG over een schat aan data waarmee we van waarde willen zijn voor pensioendeelnemers in heel Nederland. Daarmee help je wellicht zomaar je buurvrouw, ouders of opa en oma. Data helpt ons met het creëren van overzicht in financiën voor nu, straks en later, maar ook met het digitaliseren en personaliseren van onze dienstverlening. APG wil daarin niet onderdoen voor de meest innovatieve partijen in de markt. Bijvoorbeeld door anyplace, anywhere, anytime met de juiste informatie via de juiste weg de juiste mensen te bereiken, zelfs voordat ze ons opzoeken.  Het datateam waarin je komt te werken is gepositioneerd binnen Deelnemer en Werkgever Services – het client facing gedeelte van APG waar we ons bezig houden met alle vormen van klantbediening, klantbeleving, innovatie en marketing en communicatie.   Als senior data scientist zie je kansen om data in te zetten voor onze pensioendeelnemers, en benut je die proactief. Je snapt wat onze pensioendeelnemers nodig hebben, en gaat samen met de business opzoek naar mogelijkheden om data in te zetten. Je weet een business vraag feilloos om te zetten in een concreet data project, dat je vervolgens managet. Je begrijpt wat er nodig is om een project tot een goed einde te brengen.  Je gaat met vragen aan de slag zoals: Wat leren we van beschikbare historische data om de toekomst beter te voorspellen? Wat zijn dan de “next best actions”? En hoe kunnen we onze dienstverlening nog innovatiever maken? Je zet je vakmanschap en creativiteit in om tot inzichten te komen, maakt die inzichten op een pakkende manier visueel en bent in staat die meerwaarde duidelijk te communiceren. Je succes wordt bepaald door de mate waarin je analyses, algoritmes en applicaties worden toegepast zowel binnen als buiten de organisatie.  Je dagelijkse werkzaamheden bestaan onder andere uit: pro actief initiëren van nieuwe data science projecten om waarde te creëren voor onze pensioendeelnemers; coördineren en/of executeren van data science projecten als onderdeel van een agile team; feature engineering, data exploratie en analyses van verschillende databronnen om actionable insights te genereren; kort cyclisch, iteratief ontwikkelen, testen en in productie nemen van machine learning toepassingen; het creëren van schaalbare, future proof solutions voor succesvolle experimenten, samen met collega’s van de Data Intelligence en IT afdeling; afstemming met stakeholders uit andere teams en business units, zoals architecten, developers, business managers, etc.; glashelder communiceren van (de uitkomsten van) actionable insights en machine learning toepassingen; doorontwikkelen van de data science capability; begeleiden van junior data scientists en vormgeven van het nieuwe datateam. Dit breng je mee Als data scientist ben je creatief, resultaatgericht, proactief, innovatief, gedreven, nieuwsgierig en communicatief zeer vaardig. Je bent zelfstandig, enthousiast en een teamspeler. Je bent daarnaast in staat je snel nieuwe technieken en ideeën eigen te maken. Daarnaast ben je zeer oplossingsgericht. Er is namelijk sprake van een hoge sense of urgency. Het pensioenlandschap is aan het veranderen en APG wil op basis van data snel beslissingen kunnen nemen. Onze producten en diensten kunnen niet zonder data. APG zoekt daarom een doorpakker, die goed werkt onder druk en zich verantwoordelijk voelt voor het snel boeken van resultaten.  Verder neem je mee: Een afgeronde exacte WO / PhD opleiding, bij voorkeur informatica, wiskunde, natuurkunde, econometrie, operations research of artificial intelligence; Minimaal 5 jaar relevante werkervaring in het vakgebied big data / advanced analytics. Waarbij je voorbeelden kunt laten zien van door jou gerealiseerde business waarde; Kennis en ervaring met statistische modellen; Kennis en ervaring met machine learning technieken; Uitgebreide ervaring met programmeertalen Python en/of R, andere talen en tooling zijn een pre; Ervaring op het gebied van natural language processing is een pre. Hier ga je aan de slag Afhankelijk van opleiding, ervaring en achtergrond bieden we een salaris van maximaal € 6.862,- bruto per maand o.b.v. 38 uur per week en mooie arbeidsvoorwaarden gericht op flexibiliteit.  Voor pensioenuitvoerder APG gaat pensioen over mensen, leven en samenleven. Met zorgvuldig vermogensbeheer, pensioenadministratie, communicatie en advies wil APG meehelpen aan een leefbare toekomst waarin we welvaart en welzijn eerlijk en duurzaam samen delen. Voor huidige en toekomstige generaties. Voor nu, straks, en later.",2021-03-17 18:13:34
