id,description,scrapetimesdescription
d77ec315524d7347,"Bedrijfsomschrijving  Janssen Vaccines & Prevention B.V. is part of Johnson & Johnson, one of the biggest and most respected health care companies in the world. They are dedicated to bringing meaningful innovation to global health. Their teams focus on the discovery, development, manufacturing and marketing of novel vaccines to prevent some of the most devastating and complex infectious diseases. These range from respiratory infections like respiratory syncytial virus (RSV) to human immunodeficiency virus (HIV) and pathogens of global concern such as Ebola and COVID-19.  In their organization, entrepreneurial people are working in a dynamic culture in which innovation and a 'can do' state of mind are of crucial importance. We are continuously looking for enthusiastic, talented people who have the ambition to develop themselves and can be of value to Janssen. The offices of Janssen Vaccines & Prevention are located in Leiden, The Netherlands.  Functieomschrijving  Job description: Yacht Life Sciences has a vacancy for an Associate Scientist USP. We are looking for a motivated Associated Scientist within the field of upstream process (USP) development. Under limited supervision, but as part of our lab team you will support the preparation and execution of scientific studies. These will be part of a project plan, and you will be responsible for practical execution of experiments, support of data analysis and reporting main conclusions. Next to this, there is room to work on continuous improvement topics to increase safety, efficiency in workflow and support of scientific projects. Experiments will be performed in bioreactors or in a reduced-scale shaker flask model.  The USP department is responsible for the development of scalable, pharmaceutical-grade production processes for viral vaccines using mammalian cell lines as a production platform. Novel technologies are used to make sure that the processes are safe, reliable, scalable and cost-effective, so that the vaccines can be produced in large quantities at low costs. The developed production processes are transferred into GMP production facilities for the production of clinical batches and scaled-up for commercial production. All activities are performed in close collaboration with other departments. Within the department, a lab team is responsible for performing all hands-on experimental activities, data processing and documentation, whereas a team of scientists is responsible for the overall scientific approach and progress within our projects.  Functie-eisen You have a Master, or Bachelor with 3 years of experience, in a relevant environment like biotechnology or pharmacy. Candidates with a PhD (background) will be considered as overqualified for this role. You have demonstrated work experience with mammalian, bacterial, or other cultivation techniques, hands-on experience with bioreactors, preferably at lab scale You have a strong affinity with upstream process development You have good communication skills in English  Arbeidsvoorwaarden  We offer a challenging position which allows you to work in a dynamic and international environment, ensuring diversity in your work and creating plenty of opportunities for personal development. This concerns a full-time secondment contract for 1 year (extension is anticipated). Salary between 2600 and 3600 gross per month. Start date: as soon as possible. We will offer a competitive benefit package in line with the seniority of the position. You will become a member of a strong professional network who shares your education, ambitions and competencies. This will enable you to interact with your colleagues and to become a member of the YACHT network, which stretches the Life Science industry. You will be challenged by your peers, you will be able to follow courses and training via our Yacht Academy in order to keep your knowledge and skills up-to-date, i.e. boosting your career through personal and scientific growth.",2021-03-17 18:14:37
24dcca860068706d,"Wat wij bieden een voorbeeldfunctie als ‘thought leader’ i.c.m. een divers takenpakket; een groep gepassioneerde vakgenoten met brede kennis en ervaring; kunnen bijdragen aan de verdere ontwikkeling van onze unit, proposities en marktbenadering de focus op het werken in teamverband bij gerenommeerde klanten; een omgeving waarin ondernemerschap en eigen initiatief worden gestimuleerd; een cultuur waar collegialiteit, kennisdeling en samenwerking centraal staan; veel mogelijkheden voor opleiding, ontwikkeling en doorgroei; een budget om arbeidsvoorwaarden aan te passen aan jouw wensen; flexibiliteit en oog voor jou als persoon; Wat jij meeneemt minimaal een afgeronde HBO studie; minimaal 5 jaar relevante werkervaring; uitgebreide ervaring met R of Python; uitgebreide ervaring met SQL en databases; uitgebreide ervaring met machine learning algoritmes; ervaring met het ontwerp en de implementatie van meerdere modellen; kennis van aanverwante domeinen t.o.v. Data Science; De uitdaging Het is allang geen geheim meer dat organisaties enorme stappen kunnen zetten door slim gebruik van hun data. Hoe je daadwerkelijk tot waardevolle inzichten komt is een ander verhaal. Digitale transformatie staat dan ook hoog op de agenda bij veel bedrijven. In een dynamische markt met alsmaar groeiende datasets en nieuwe technologieën, weet jij hierin het verschil te maken. Dit is jouw topbaan Als ervaren Data Scientist ben jij voor zowel klanten als collega’s het aanspreekpunt. Je bent een drijvende kracht in projecten, zowel technisch als adviserend. Met jouw uitgebreide kennis van de markt en aanverwante domeinen kijk je verder dan slechts de antwoorden op een vraagstuk. Je hebt een visie, kijkt verder en weet anderen daar in mee te nemen. De breedte van jouw functie hoeft niet uitsluitend te gelden voor bij de klant. Ook binnen Ordina kan je een belangrijke rol spelen m.b.t. het verder brengen of uitdragen van de Data Science expertise. Denk aan pre-sales, spreken op events, coachen van collega’s, schrijven van blogs/artikelen en propositieontwikkeling. Dit ben jij Een vakman met passie voor zijn werk. Iemand die gaat voor kwaliteit en klanttevredenheid. Positief ingesteld en niet bang om fouten te maken. Communicatief vaardig, lef, proactief, resultaatgericht en een sterk analytisch vermogen typeren jou. Je vindt ontwikkeling belangrijk en kijkt daarin verder dan alleen jezelf. Een collegiale teamspeler, die goed zelfstandig kan werken indien nodig. Waar ga je aan de slag In een unit met tientallen betrokken en vakkundige collega’s. Je werkt op projectbasis voor gerenommeerde klanten in branches als Energie, Logistiek & Transport, Publieke Sector, Retail, Finance en Industrie. Professionaliteit en gezelligheid gaan hand in hand. Kenmerkend zijn thema’s als diversiteit, kennisdeling, ondernemerschap en samenwerking. Zowel sociaal als vakinhoudelijk zijn er daarom veel contactmomenten en initiatieven. Zo helpen wij elkaar én klanten om klaar te zijn voor de data vraagstukken van morgen.",2021-03-17 18:14:40
ef1e2f73281ebfb1,"ABOUT THE TEAM Deliver the product and technical roadmap with agility and pace to create quality experiences in reliable timelines at manageable cost. Provide technical innovation of the services platform. Support the perpetual evolution of the future roadmap.  ABOUT THE ROLE As a Data Scientist, you will be improving shopping experiences by leveraging AI technologies. We use several deep learning models to improve search results by exploiting image, text, and user activity data. You will be looking for opportunities to improve the accuracy and performance of such models, as well as bringing in new ideas for data products and features.  WHAT YOU WILL BE DOING Proposing architecture solutions to novel data science problems Developing and improving machine learning models Technical knowledge and understanding of Attraqt machine learning platform technologies Understanding data architecture and data sources Taking part and contributing to knowledge sharing sessions with the immediate and other teams Doing ad-hoc analysis and presenting results in a clear manner where necessary Maintaining and updating automation affected by changes made Documenting work and reviewing documentation of more junior team members Testing and reviewing the junior team members’ testing QUALIFICATIONS AND EXPERIENCE YOU NEED TO THRIVE IN THIS ROLE MSc in AI/Data Science/Computer Science or related scientific field Proficiency in Python High degree of familiarity with at least one widely used deep learning package such as Pytorch, Tensorflow Proven ability to propose/architecture solutions to novel data science problems, as evidenced by Kaggle competition entries, thesis research, blog posts, publications or similar In depth understanding of core machine learning concepts and latest deep learning methodology Experience working with big data processing technologies such as Hadoop technologies Proficiency in cloud computing/ high performance computing used to experiment with Statistical/AI models Experience with structured and/or unstructured databases such as SQL Familiarity with standard data science libraries such as pandas, numpy, scipy, etc. Experience with version control tools such as Git  ABOUT YOU Self-starter Pragmatic and results driven Team player with a passion for AI and innovation Adaptable to change and able to drive change Personable, open and approachable  ABOUT ATTRAQT Attraqt powers exceptional shopping experiences for over 300 of the world’s leading brands, manufacturers and retailers with a set of API-enabled, algorithm-driven, intelligent SaaS services covering personalisation, search, navigation, merchandising, recommendations and internationalisation. E-commerce is an exciting growth business, part of a wave of retail digital transformation.  We pride ourselves on our core values of pioneering, better together and data-led and you can see them in action in all aspects of our everyday work. We foster an open, trusting and collaborative working environment where everyone has the opportunity to succeed and shine, and where excellence is rewarded.  Attraqt is packed with motivated, creative and commercially minded people from a wide variety of backgrounds. With a large global footprint, you could bump into a member of our team in London, Paris, Amsterdam, Sofia or even all the way over in Sydney! Our team is diverse and cosmopolitan with a finger on every pulse when it comes to industry knowledge and global developments across the e-commerce space, it's in our DNA. If this excites you, then you’ve come to the right place.  By applying for this position, you are agreeing to our Candidate Privacy Notice.",2021-03-17 18:14:42
61f4588980744093,"What will you be doing? Our society, including the energy sector and the (chemical) industry is in a transition towards the use of renewable feedstock and energy, introduction of circularity and carbon capture and re-use. The group Sustainable Process & Energy Systems (SPES) based in Delft, the Netherlands, works on these transitional topics with a fast-growing diverse and international team of about 65 employees. We work for and with (renewable) energy and chemistry companies and in a network of international knowledge partners. In order to achieve the 2050 European energy and climate sustainability goals for renewable energy, a multi-energy approach on energy generation and conversion is required. In our lab and offices in Delft a dedicated and highly motivated team of researchers, domain experts and consultants is working on accelerating the market uptake of innovative technologies to support the transition towards a Sustainable Industry. We are currently looking to expand the team with a highly motivated innovator, someone with a strong scientific and/or engineering background.  You will work in various and diverse projects working towards a sustainable chemical industry, and support the acquisition thereof. Projects may vary from co-funded innovation projects with national and international consortia to business client assignments. You will work on diverse assignments that may vary from data gathering and analysis, industry research, writing reports, participating in proposal writing, presenting to clients, making technical or economical models or conceptual design of pilots for novel sustainable technologies. What do we require of you? You are an enthusiastic person and able to combine the analytical focus of a scientist with the problem-solving capacity of an engineer, with a drive to develop innovative solutions to technically challenging problems, by combining the right mix of intellectual curiosity and a pragmatic approach. You are a strong team player, and are highly motivated to work in a diverse international team working towards innovative solutions for a more sustainable economy. You are proactive, solution-oriented, result-driven, communicative, and have excellent interpersonal and reporting skills. You are flexible and able to adapt and integrate different approaches in order to solve the challenges of the industry.You have a growth mindset and are prepared to follow a steep learning curve and develop yourself. Other knowledge and skills you bring to TNO: M.Sc. in e.g. chemical engineering, process technology or equivalent; a PDEng or PhD degree would be an advantage; Domain knowledge of the energy transition, processes in the chemical industry such as refining operations, production of base/ bulk chemicals, and sustainability issues; 3 to 6 year of working experience in the chemical industry; Hands on experience with one or more of the following processes or technologies: hydrogen production, electrochemistry, CO2 capture and utilisation, biomass conversion, plastics recycling, renewable power production, energy storage, energy efficiency, (synthetic) fuels, chemicals production; Experience in the evaluation of technologies, analyzing results, using various software tools to support analysis of technology options based on economics and environmental indicators, presenting and reporting; Experience/enthusiasm to work in an international and multidisciplinary environment; Good mastery of the English language, both verbal and written. Willingness to learn Dutch. What can you expect of your work situation? At TNO, we innovate for a healthier, safer and more sustainable life. And for a strong economy. Since 1932, we have been making knowledge and technology available for the common good. We find each other in wonder and ingenuity. We are driven to push boundaries. There is all the space and support for your talent and ambition. We are an equal opportunity employer and recognize the value of a diverse workforce.You work with people who will challenge you: who inspire you and want to learn from you. Our state-of-the-art facilities are there to realize your vision. What you do at TNO matters: impact makes the difference. Because with every innovation you contribute to tomorrow’s world. Read more about TNO as an employer. What can TNO offer you? Challenging and varied work with a real impact. And plenty of opportunities as, at TNO, you are in charge of shaping your career. We offer a gross monthly salary between € 3800,- and € 5800,- (based on your knowledge and experience), 8% holiday pay, a 13th month bonus of 8.33% and a flex budget (5.58% + € 180). In addition, you will be given every opportunity to develop yourself.  TNO offers optional employee benefits, enabling you to tailor your benefits package to match your personal situation. You may also expect: An extremely professional, innovative working environment where colleagues are leading experts in their field; Being part of a highly skilled team, working in close collaboration with a large number of colleagues with different expertise; Support for personal growth; A challenging work environment with ample opportunity to learn and develop, as well as to shape one’s role; The opportunity to contribute to the energy transition and work towards system changes at large scale; 28 days annual leave and 5 compensation days under the reduction in working hours scheme (ATV, arbeidstijdverkorting) on a full-time basis; Great social events with your team and other TNO colleagues. That’s how you will get to know a lot of people really quickly; Flexible working hours and the possibility of working from home; The opportunity to attend courses, workshops and conferences, and to receive training and coaching based on your needs; A good pension scheme; Travel allowance or a bike; Extensive relocation package for international candidates. Read more about tailoring your benefits package Application process You can apply till the 5th of April. The first round of interviews is scheduled on the 16th of April. The second round of interviews is scheduled for the 21st of April. The process comprises at least two (selection) rounds. First two interview rounds and after a positive selection, we will finish off the process by discussing terms and conditions of employment. We try to complete the interviews and assessment within 4 weeks. Has this vacancy sparked your interest? Then please feel free to apply on this vacancy! For further questions don’t hesitate to contact us.  Recruiter: Anne-Maartje Uijl- Meijman, den Mobile phone: +31 (0)6-469 66067 LinkedIn: https://nl.linkedin.com/in/annemaartjedenuijlmeijman  Hiring manager: Bastian Bes, de Phone number: +31(0)6-29906808    Note that applications via email and third party applications are not taken into consideration.",2021-03-17 18:14:44
8c51d44a3ac3bdac,"Genmab is focused on the creation and development of innovative and differentiated antibody products, with the aim of improving the lives of cancer patients. Role The Bioanalytical Science team develops bioanalytical strategies to support the pre-clinical and clinical development of Genmab’s formats and compounds. We design, execute, interpret, and validate bioanalytical methods (Pharmacokinetic, Pharmacodynamic and Immunogenicity assays) and perform bioanalysis activities for both regulated (GLP, GCP) and non-regulated (mouse studies, exploratory toxicology, and dose range finding) studies. As such, we provide a strong foundation for informed decision-making at critical points throughout our entire drug development program. As a (Senior) Scientist Non-Clinical Bioanalysis within the Bioanalytical Science team, you will work on compounds in pre-clinical development stages. You will be part of the cross-organization Non-Clinical Safety sub-team for several programs and be responsible for the bioanalytical method strategy, mainly focusing on PK and binding ADA (bADA) methods. As such you lead the development and validation of ligand binding assays used by internal and external parties such as Contract Research Organizations (CROs). You will work closely together with a team of technicians to coordinate and report the sample assessment of regulated (GLP) and non-regulated studies. To achieve this, you keep yourself up to date with latest developments in the field, such as novel technologies and regulatory requirements within the bioanalytical field. You will collaborate with CROs and internal stakeholders, transfer methods, write protocols and record scientific results in publications, regulatory documents, product development records and patents. Responsibilities You oversee development and validation of ligand binding assays to measure pharmacokinetic (PK) and anti-drug antibody (ADA) responses in biological matrices. These methods are used in support of Genmab’s preclinical studies enabling IND filing. You will coordinate and report the sample assessment of non-clinical studies. You take responsibility for bioanalysis within multi-disciplinary project teams. You will author necessary documentation and transfer methods to external parties (CROs). You will ensure compliance with regulations and guidelines, i.e. GLP, FDA, EMA and ICH. You act as a primary contact for external parties (validation, managing timelines, troubleshooting, analysis, etc.). You will keep the department up to date with the latest relevant scientific information regarding immunology, bioanalysis, and regulatory documents. Requirements You have a finished PhD degree and at least two years relevant experience in bioanalytical method development and validation. Alternatively, you hold a MSc degree with at least five years relevant experience in bioanalytical method development and validation. You have a proven track record in the development and troubleshooting of immunological and bioanalytical assays. You have experience in method development to evaluate unwanted immunogenicity. You have experience with regulatory bioanalysis and knowledge of relevant guidance documents as well as GLP experience. You are flexible, well-organized and can lead several projects at once, and you are able to work to tight deadlines. You have experience in managing Contract Research Organizations. You have excellent relational and communication skills in English (Dutch is an advantage, but not required). In case you have any questions, please feel free to reach out to Recruiter Mark Stickland at ext-fts-mst@genmab.com Genmab employees work with determination and with respect for each other, consistent with our core values, to achieve our common goals. We give individuals and teams the autonomy to drive development of innovative products and solutions, knowing that integrity is a core value throughout our company. Genmab will offer the successful application a challenging position, where the right candidate will have the opportunity to work with highly specialised people across functions in an informal, multicultural culture, all aiming to make a difference for cancer patients.  Teamwork and respect are central pillars of Genmab’s culture and we therefore ensure an inclusive, open, and supportive professional work environment across our international locations. We believe that fostering workplace diversity across social, educational, cultural, national, age and gender lines is a prerequisite for the continued success of the company. We are committed to diversity at all levels of the company and strive to recruit employees with the right skills and competences, regardless of gender, age, ethnicity, etc. Please note that if you are applying for a position in the Netherlands; Genmab’s policy for all permanently budgeted hires in this location is to offer a temporary agreement for one year, followed by a contract for indefinite time regardless of seniority. Genmab A/S is committed to protecting your personal data and privacy. Please see our privacy policy for handling your data in connection with you application on our website https://www.genmab.com/privacy .",2021-03-17 18:14:46
