id,description,scrapetimesdescription
32f4bff334d107a2,"Founded in 2012 and based in Amsterdam, Owlin turns news into actionable intelligence. Our international client base is growing rapidly, and more prospects come knocking at our door every day. That is why we need a best-in-class Applied Data Scientist to join our team. Instead of sitting in a cubicle in a corporate environment, working at Owlin means that you will be making a visible impact while working in an ambitious, fast-growing team and bringing exciting products to the global financial market.  About the job You will be working in a young and dynamic Data Science Team that aims to deeply understand our clients’ business challenges and build solutions that answer those needs. We leverage cutting edge technologies from NLP and other areas of ML or develop entirely new techniques in-house if need be. Even though deep learning definitely has its place within Owlin, we also particularly value models that can be introspected and adjusted on the spot by data analysts.  About you You are not the type of person that needs or asks for instructions. You are expected to proactively engage with what is already in place and pitch ideas for improvement. You will make sure your ideas are understood, validated, and implemented in practice as well. You have a passion for technology and the way it is changing traditional markets and institutions. You want to be part of that revolution and are looking for an adventurous job where you can make a real difference.  Responsibilities As part of the Data Science Team, you have a central role in extracting value and insights from our data (mostly structured and unstructured text as well as time series data of various kinds) and translate this into new tools and resources for our clients. As an Applied Data Scientist with a Data Engineering Focus, your core objective is to support the team in turning ideas into production-ready models, infrastructure and code. You’ll get your hands dirty on the command line of Linux servers, and help us develop data pipelines both on and off the cloud. If you also possess bona fide research skills, you are more than welcome to let it show. How you develop yourself within Owlin is limited only by your own ambitions and capabilities.  Hard skills 3+ years of professional experience as a Data Scientist / Engineer Problem solving and analytical thinking Demonstrable programming proficiency Ability to implement algorithms in Python / NumPy Numba / Cython / C(++) / JavaScript (NodeJS) / GO are a bonus Solid understanding of data structures and algorithmic complexity Experience in Deep Learning and ML general (PyTorch / TensorFlow, Scikit-learn, SciPy, ...) Experience in NLP Experience with deploying data-processing pipelines Experience using Linux Familiarity with relational and non-relational databases Familiarity with REST APIs and their deployment (Flask, FastAPI, Nginx, passenger) English: full professional working proficiency We also really appreciate: Strong mathematical and statistical background An intuitive understanding of business problems  Soft skills Authentic and ambitious Entrepreneurial and pragmatic mindset High degree of personal motivation Ability to manage your own schedule Deep care for end users and their experience  Benefits We offer a wide array of perks to help our employees find an ideal work-to-life balance. We’re all about increasing productivity by maximizing joy. Here are some of the benefits that we have to offer: Competitive pay: good primary and secondary benefits Great place to work: a beautiful office with a view right in the city center of tech hub Amsterdam. Great WFH-support to make sure you have all you need to “get shit done”. International team Personal development: surrounded by the best and brightest tech talent Flat hierarchy where your work will directly touch our clients Fun(virtual) company-wide events. Daily lunch and Friday afternoon drinks when things are back to normal! In a (post-)COVID world, we are flexible and accommodating when it comes to working remotely. The office is available for those who need to use it (within limits in line with governmental public health safety guidelines), but the infrastructure and routines are in place to facilitate working remotely for everyone, all while staying engaged, motivated and productive.  If you think this position has your name written all over it, we sincerely hope to hear from you. If so, please submit your resume and motivation letter.",2021-03-17 18:13:50
4d3199f05df91eb3,"Are you an experienced Full Stack Data Scientist looking to make your mark on a platform that touches the hearts of millions of people? Then you’re at the right place. We designed a social dating experience that brings people together and changes the course of their life.  Inner Circle helps busy, life-loving singles meet their match in real life. Since its inception in 2012, Inner Circle has rapidly expanded and is currently active in more than 40 cities across the world with more than 3 million members and thousands of amazing love stories to tell. Inner Circle brings singles together in real life through the app and website.  We are a small but mighty team of 27 who are passionate about dating, tech, and getting people together. Inner Circle won the Deloitte Fast 50 in 2018, as the fastest growing technology company. The company is profitable and healthy and we take good care of our team. Our offices are in Amsterdam (HQ), London, Dnipro and São Paulo.  What you’ll be doing We pride ourselves on being data-driven decision-makers here at Inner Circle.  As the first Data Scientist at Inner Circle, you will get ownership of the data domain, maximizing the value of our matching platform as well as enabling teams to make the best decisions based on data and insights.  From start, you will get your hands dirty, build business cases and make an impact across all customer touchpoints, from the earliest touchpoint in the marketing funnel, to the core Inner Circle apps on web and mobile, down to CRM. Over time you will Lead and Expand your Data & BI team to meet the growing challenges of a scale-up.  With hundreds of millions of likes, messages and images exchanged monthly, there is an incredibly exciting opportunity to further develop your data science skills, while at the same time shaping the way people get together, and with that change the course of their lives! The Role: You proactively drive and deliver (advanced) analytical solutions for complex growth or product-related challenges (e.g. behavioral clustering, pattern mining, revenue/churn predictions, business-models quantitative assessments, argumentation for new pricing strategies, etc.) You drive improvements to the recommender systems by coordinating, building and deploying effective (auto) ML/AI models (e.g. one of the key challenges is to efficiently determine who should be recommended to match together - to find the best matches that satisfy both requirements). You drive automation and optimization of the key business processes as well as core improvements of the end-user experience through the use of computer vision, NLP, and ML models (automated detection of scam and fake profiles, rude and inappropriate behavior in conversations, etc). You take the lead on data and BI, working closely with product, engineering, marketing and other teams to make sure they have accurate self-service analytics and are able to leverage those tools to make the right decisions. You work closely with our engineers to build out a scalable data infrastructure that acts as a single source of truth.  What will make you successful Hard skills: You are excited about leveraging data to bring people together. You have at least 5+ years of professional experience as a full-stack data scientist. You have solid technical knowledge and confidence in terms of programming, scripting, querying, and working with large data sets (strong Python and SQL essential). You have demonstrable experience ML models from initial conception right through to the final production model. You have strong knowledge in additional areas of data science such as computer vision and NLP. You have hands-on experience setting up and working with data visualization and analytics tools (Tableau, Looker, Google Analytics, Amplitude, etc). Soft skills You communicate clearly, listen, and show empathy as a foundation for effective collaboration. You have strong prioritization and project management skills, understanding of business impact for various solutions. You are able to turn complex business problems and data insights into clear business cases that are easy to understand and practical to act on for cross-functional teams. You are goal-oriented and driven by making an impact. You are humble, organized, ambitious and always looking to learn.  What we offer A chance to make a positive, life-changing impact on people's lives, by leveraging our data A competitive salary matched with your experience and ambition The fun and hustle of a tech scale-up, inside a small but profitable company Monthly Bring Your Own Device compensation Monthly Stay Healthy allowance A Macbook or other hardware of your choice to be able to do your job Training and development budget An annual trip with the whole company (when COVID-19 restrictions are lifted again) Frequent team get-togethers (when COVID-19 restrictions are lifted again) Monthly Inner Circle events to meet all the cool members IRL (when COVID-19 restrictions are lifted again) Free Inner Circle VIP membership for you and your single friends An amazing work environment in our own 400 m2 office at Prins Hendrikkade, at the heart of Amsterdam Sounds like your dream role? Apply today with a short cover letter and your resume (in English, please). Note: You must have to have permission to work in the EU. We are unable to provide relocation for this position.",2021-03-17 18:13:52
bae728a986284f44,"You are the right person to share your vision and make people enthusiastic about data. Besides that, you like working with the latest technology in a young and fast-growing organization.  What are you going to do? Allianz Direct is building an awesome global insurance platform, that you built and run. We are looking for an experienced hands-on Business Intelligence (BI) & Data Warehouse (DWH) architect, for developing end-to-end DWH solutions and with a strong focus on the data preparation, modelling and transformations (‘ETL’, ‘ELT’ , ‘LETS’). This is How you do it: As an architect you will set the blueprint to for a data management framework; You share your vision and make people enthusiast about using the data; You will be part of the Direct architecture chapter with specific responsibility for our data architecture and work with our data team to deliver your vision; Constantly you’re looking for opportunities to register the right data in the right place to feed data engineers, data scientist and Business intelligence experts to improve the use of data in our decision-making processes; With your deep understanding of data modelling, transformations and reporting you ensure the architecture used is future proof and trusted; We live Dev-Ops! You run what you build! What do you bring? Preferably experience in working with insurance data and background in analysis and understanding information from a usage perspective, Information / Business Analysis; Experience working with conceptual, logical and physical model design, translating conceptual designs to physical implementation; Experienced and deep understanding of modelling techniques (3NF, Data Vault, Kimball, Imon); Experience and strong skills in SQL (including T-SQL or equivalent); Understanding of coding and scripting, specifically using .Net or Java and with Visual Studio and Data Tools (BIDS); Experienced in data visualization; Understanding of data science concepts and development cycle; Experienced in Big data solutions; Ideally, experience working with the Microsoft data stack, including Azure, SQL Server and Power BI, including strong SQL skills and understanding of database administration concepts; At least 3 years of experience in a Data Architect role; MCSE certification or equivalent is preferred, including components of managing / optimizing databases; Familiar with DevOps concepts including automated unit testing, deployment. Experience & Key skills Strong problem solving and delivery capabilities coupled with attention to detail and the ability to work independently; Good communications skills and helpful attitude towards business users so that they can get access to the data to do their job; Flexible mindset and hands-on / can-do attitude; Strong analytical skills. About Allianz Direct Allianz Direct is the fastest growing car insurance company in the Netherlands. In ten years' time we have grown to become the online market leader and have managed to gain a leading position in the market. In addition to car insurance, we also offer home and liability insurances and we are investigating other options to expand our range. Furthermore, Allianz Direct is part of Allianz, one of the largest insurance groups in the world. At Allianz Direct you have the best of both worlds: a flexible organization that can respond quickly to innovations with a solid, sustainable parent organization that guarantees continuity. Allianz Direct is a European project in which several European direct labels work together to offer the same products throughout Europe: a unique company to work in. The cooperation with other countries gives us the opportunity to respond faster and better to changing customer requirements. Our ambition is to become the best European insurer, with the best products, prices and customer experiences. What do you get in return? You are part of an international team where you get the freedom to shape things. We offer a versatile and challenging position with broad development opportunities in an international organization. A challenging role, with high visibility and impact, and excellent perspectives to get acquainted with the different departments, products, people and entities in Allianz Direct; Working in a dynamic environment that encourages you to take initiative, where you can grow and actively contribute to strengthening our position as world leader; (Partly) work from home – also after Covid; Be part of an enthusiastic, experienced and ambitious team; Working with the latest technology in a young and fast-growing organization; Excellent learning & development opportunities and an attractive salary package. Does the above function appeal to you? Then apply via the button below and find out what your options are at Allianz! Questions? Contact our recruiter: Dion van Alphen T: 06 42 54 84 02 (preferably by Whatsapp) M: recruitment@allianz.nl To guarantee the integrity of our employees, a positive result of the Pre-Employment Screening will be a precondition for employment.",2021-03-17 18:13:54
86501222f4bffb69,"The adidas Digital Data Science team is looking for talents. We are a diverse team of data scientists that is passionate about data and algorithms lifting insights and actions hidden in large data sets. We work on a variety of use cases, from forecasting to product recommendations, from pricing to allocation. We help our digital customers, managers, business analysts - everyone - to benefit from their data and drive their strategic and day-to-day decision making.  We are looking for data science talents who are as passionate, curious and dedicated as we are and who want to contribute to the sustained growth of our eCom business.  What you'll do  Guide a team of highly skilled Data Scientists from diverse backgrounds like statistics, mathematics, economics and computer science in developing and factorizing complex data science solutions.  Support the analysis of stakeholder objectives, assess the problems to be solved and what internal or external data sources to use or acquire.  Specify and apply appropriate mathematical, statistical, predictive modelling or machine-learning techniques to analyze data, generate insights, create value and support decision-making.  Design, code, verify, test, document, amend and refactor complex programs/scripts and engage in mutual code reviews.  Seek to fully address client needs, enhancing the capabilities and effectiveness of client personnel, by ensuring our data science solutions are properly understood and appropriately exploited.  Support the review of the benefits and value of our data science solutions and recommend improvements.  Actively contribute to our Communities of Practice and knowledge sharing events and thereby shape our analytics policies, standards and guidelines.  Who you are  You are an expert in Machine Learning (in particular tree-based models, NLP, image processing) who is strong in exploratory data analysis and feature engineering.  You should have a solid understanding of statistics/ statistical inference, linear algebra, optimization and time-series modeling.  Python and its state-of-the art analytical libraries (e. g. , pandas, scikit-learn, PySpark, plotly) are your second nature. Hands-on experience in Deep Learning (TensorFlow, PyTorch) is not a must but would be a plus. Solid knowledge of R (including tidyverse) is an advantage.  You are set up for success if you effortlessly work in a Jupyterlab/ Notebook environment and know how to use Bitbucket/ GIT for version control and collaborative coding. Familiarity with the AWS ecosystem/ cloud environments would be a plus.  You have a solid understanding of relational databases and the ability to efficiently query large databases (e.g., via SQL, Hue, Spark).  You know what it takes to factorize data science solutions as you stick to basic software engineering principles (e.g., integration/ unit testing) and are familiar with the concept of continuous integration and the use of Jenkins.  You have a proven track record in at least one of our focus areas (i.e., recommender and ranking systems, website personalization, search engine optimization, demand forecasting, image processing, social media listening, customer lifetime value).  You know the principles of agile development and have already worked as a member of an agile development team.  You hold a Master's degree in Computer Science/Statistics/Econometrics, or related field with a strong quantitative focus (Mathematics/Physics), PhD welcome but not required  You have at least 5 years experience as Data Scientist outside academia, ideally in online retailing or sporting goods industry with expertise in developing data-driven products end-2-end.  You have excellent professional communication skills (English, written and oral), German would be a strong plus.  You interact confidently with developers and stakeholders alike and can present your work to technical and non-technical audiences.",2021-03-17 18:13:57
12d98d5f016044da,"Complexe data van grote omvang met behulp van algoritmes omzetten naar oplossingen. Dat is de basis van jouw uitdaging. Jouw doel is het verbeteren van klantoplossingen, business modellen en operationele processen door het geautomatiseerd vertalen van data naar informatie. Ben jij een ervaren data scientist met ruime kennis van het ontwikkelen van algoritmes? Dan maken we graag kennis met jou!   Wij zoeken voor ENGIE Digitaal Nederland in Bunnik een Data Scientist.  Dit ga je doen als Data Scientist Als data scientist bij ENGIE ben je verantwoordelijk voor het ontwikkelen van algoritmes en het beantwoorden van digitale vraagstukken met behulp van data. De basis voor jouw werkzaamheden is relevante data. Je bent verantwoordelijk voor het verkrijgen en selecteren van relevante data en het vertalen van deze data naar informatie om betere beslissingen te kunnen nemen, te differentiëren in klantoplossingen, operationele efficiëntie te verbeteren en toekomstige business modellen te ontwikkelen.  De digitale vraagstukken waarmee je aan de slag gaat, hebben betrekking op data waarvan de omvang erg groot en complex is. Data komt real-time binnen en moet vaak real-time toegepast worden. Je benadert vraagstukken vanuit verschillende invalshoeken en komt met diverse mogelijkheden om een probleem op te lossen. Je bent gewend om een grote hoeveelheid aan informatie snel om te zetten in een eenvoudig concept.  In jouw functie als data scientist werk je veel samen met zowel interne als externe stakeholders. Intern zijn dat je collega’s binnen IT zoals solution en domain architecten, maar ook product managers. Jouw externe contacten zijn met name gesprekken met opdrachtgevers. Je maakt deel uit van het Digital Business Center en rapporteert in deze functie aan de Directeur ENGIE Digitaal Nederland.  Dit zijn je belangrijkste taken en verantwoordelijkheden: Je draagt zorg voor het verkrijgen en ontsluiten van de relevante data. Je behandelt vraagstukken die leiden tot toegevoegde waarde uit beschikbare data, mitigerende maatregelen of een hogere performance (KPI’s). Je zorgt voor een professionele ontwikkeling, executie en beheer van algoritmes. Dit doe je op basis van de gewenste IT architectuur, waargenomen trends in de markt en ervaringen uit grote projecten. Je levert input voor het centrale datamodel. Je vertaalt complexe materie naar een business context voor ENGIE. Je werkt samen met verschillende interne en externe partijen voor het verkrijgen van relevante data en het opstellen van predictieve modellen. Beiden met aandacht voor de data kwaliteit en het datamodel. Je werkt volgens geformuleerde kwaliteitseisen voor producten en diensten. Je vormt de brug tussen data en de opdrachtgever door het toepassen van onder andere machine learning. Je volgt de nieuwste ontwikkelingen op het gebied van technologie en processen binnen data science.  Dit breng je mee Als data scientist breng je de volgende ervaring en competenties met je mee:  een afgeronde WO opleiding in een bèta richting of met een stevige basis in statistiek; minimaal 5 jaar werkervaring op het gebied van data science; ruime ervaring in projectmatig werken; kennis van wiskunde en statistiek, machine learning en optimalisatie algoritmes; kennis van databases, het inladen van data uit verschillende bronnen (oa SQL), opschonen, verrijken en transformeren van onbewerkte data en toepassen van statistiek met Python/R; kennis van visualisatiemogelijkheden binnen Python/R; in staat om duidelijk en to-the-point te communiceren en daarin complexe materie te kunnen vertalen in begrijpelijke boodschappen; van nature ben je nieuwsgierig, oplossingsgericht en creatief in ideeën en oplossingen die niet altijd voor de hand liggen; gewend aan zelfstandig werken: van een eigen planning tot afstemming met stakeholders; competenties als klantgericht, analytisch, integer, resultaatgericht en verantwoordelijk zijn onmisbaar in deze functie; open, respectvol, gedreven en gedurfd? Eigenschappen die jou aanspreken en – niet toevallig – ook de kernwaarden van ENGIE.  Wat bieden wij je Als data scientist bij ENGIE werk je aan meerdere projecten tegelijk voor verschillende onderdelen van ENGIE, waardoor je werk heel afwisselend is. Je maakt deel uit van een team van data scientisten met ook een actieve internationale data science community binnen ENGIE. Je leert van elkaar, daagt elkaar uit én kan tegelijkertijd zelf het verschil maken voor collega’s en opdrachtgevers.  Naast aandacht voor persoonlijke (door)groei bieden we je een goed salaris en aantrekkelijke secundaire arbeidsvoorwaarden. Van ons krijg je natuurlijk een laptop en telefoon. Maar ook een goede pensioenregeling, een collectieve zorgverzekering en personeelskortingen op o.a. uitjes en producten. En wist je dat je bij een dienstverband van 40 uur per week maar liefst 38 vrije dagen per jaar hebt? Zo kun je werk en privé extra goed in balans houden.  Wij zijn ENGIE ENGIE Nederland is onderdeel van de beursgenoteerde ENGIE Groep. ENGIE is actief in 70 landen, met wereldwijd 150.000 medewerkers. Als groep is het onze missie om bij te dragen aan de verduurzaming van de wereld. ENGIE Nederland bestaat uit ENGIE Services en ENGIE Energie. Samen voorzien we onze klanten van energie en technische oplossingen. Van B2B en B2C, van kleine tot grote klanten, van Terneuzen tot Delfzijl.  ENGIE Digitaal Nederland versnelt de digitale transformatie van ENGIE Nederland. De afdeling bestaat uit IT Services, een Digital Business Center en een CIO Office. Het CIO Office bepaalt de landelijke richting op het gebied van onder andere security, architectuur, licentiemanagement en IT-strategie. Binnen het Digital Business Center is de kennis verzameld om de business te ondersteunen in het digitale transformatieproces, zoals enterprise portfolio management, agile werken en data science.  Zo kun je solliciteren Heb je interesse en spreekt deze vacature je aan? Reageer dan via de button 'solliciteren'. Graag ontvangen we behalve een cv ook een motivatiebrief. Voor vragen kun je contact opnemen met Janneke van Nunen via janneke.van.nunen@engie.com of telefonisch op 06 – 83 09 36 79.",2021-03-17 18:14:00
