id,description,scrapetimesdescription
6cfe4e0224478fb1,"postdoc single-molecule studies of DNA replication Apply Now Job description In recent years, it has become possible to reconstitute the activity of eukaryotic replisome in biochemical experiments. Here, you will take on the exciting challenge of understanding the dynamics of DNA replication by studying this key biological process at the single-molecule level, both on bare DNA and on chromatin substrates. This includes examining replisome composition, replisome dynamics, and the interplay between these two quantities; as well as examination how these change in the chromatin context, among other topics. To do this, you will utilise our fluorescence imaging and single-molecule force spectroscopy systems. You will be involved in the purification and labelling of proteins as necessary. You will analyse resulting datasets using biophysical modelling, and discuss extensively with collaborators in the Diffley Lab (Francis Crick institute) in the areas of molecular biology and biochemistry.  The Nynke Dekker Lab is a highly successful single-molecule biophysics research lab within the Department of Bionanoscience at the TU Delft. Our lab focuses its studies on understanding DNA and RNA replication both in vitro and in vivo. We quantitatively characterize replication processes individually and in the cellular environment. To do so, we employ cutting-edge techniques including advanced single-molecule fluorescence, magnetic and optical tweezers, and microfluidics. Studying the dynamics of molecular processes at the single-molecule level requires broad expertise; as such, our lab is composed of a multidisciplinary team of international scientists with training in biophysics, biochemistry, or cell biology. You will be part of this group and will interact actively with current members. Requirements We are looking to hire an outstanding experimentalist for this exciting NWO-funded collaborative project at the interface of biochemistry and biophysics. We have an opening for a post-doctoral researcher keen to participate in probing different aspects of DNA replication from a mechanistic perspective. While our preference is for a post-doctoral researcher, we will also consider applications from talented prospective PhD students. As a researcher on this project, you will be responsible for planning and carrying out experiments and for analysing data. You will be expected to contribute to the interpretation of biophysical experiments on the basis of detailed analysis, to acquire an in-depth knowledge of the background literature, and to integrate the results of your data with those of ongoing molecular biology and biochemistry experiments in the field. A strong background in biophysics or biochemistry is a necessity. A good command of spoken and written English is a must. Conditions of employment Salary and benefits are in accordance with the Collective Labour Agreement for Dutch Universities. The TU Delft offers a customisable compensation package, a discount on health insurance and sport memberships, and a monthly work costs contribution. Flexible work schedules can be arranged. For international applicants we offer the Coming to Delft Service and Partner Career Advice to assist you with your relocation. An International Children's Centre offers childcare and there is an international primary school. TU Delft (Delft University of Technology) Delft University of Technology is built on strong foundations. As creators of the world-famous Dutch waterworks and pioneers in biotech, TU Delft is a top international university combining science, engineering and design. It delivers world class results in education, research and innovation to address challenges in the areas of energy, climate, mobility, health and digital society. For generations, our engineers have proven to be entrepreneurial problem-solvers, both in business and in a social context. At TU Delft we embrace diversity and aim to be as inclusive as possible (see our Code of Conduct). Together, we imagine, invent and create solutions using technology to have a positive impact on a global scale. Challenge. Change. Impact! Faculty Applied Sciences With more than 1,000 employees, including 135 pioneering principal investigators, as well as a population of about 3,400 passionate students, the Faculty of Applied Sciences is an inspiring scientific ecosystem. Focusing on key enabling technologies, such as quantum- and nanotechnology, photonics, biotechnology, synthetic biology and materials for energy storage and conversion, our faculty aims to provide solutions to important problems of the 21st century. To that end, we train students in broad Bachelor's and specialist Master's programmes with a strong research component. Our scientists conduct ground-breaking fundamental and applied research in the fields of Life and Health Science & Technology, Nanoscience, Chemical Engineering, Radiation Science & Technology, and Engineering Physics. We are also training the next generation of high school teachers and science communicators. Click here to go to the website of the Faculty of Applied Sciences. Application procedure Are you interested in this vacancy? Please apply before May 15th 2021 via the application button and upload your motivation and CV. A pre-employment screening can be part of the selection procedure. Applying for an exemption for specific research and educational areas is an obligatory part of the selection procedure for this vacancy. This exemption must be obtained from the Ministry of Education, Culture and Science (OCW) before an employment contract is agreed upon. Click here for more information. You can apply online. We will not process applications sent by email and/or post. Acquisition in response to this vacancy is not appreciated. FACULTY/DEPARTMENT Faculty of Applied Sciences JOB TYPE Postdoc Positions SCIENTIFIC FIELD Natural sciences HOURS PER WEEK 38/40 SALARY € 2.790,00 - € 4.402,00 DESIRED LEVEL OF EDUCATION Doctorate VACANCY NUMBER TUD00915 Apply Now",2021-03-17 18:14:13
b28e84d722b2c607,"About us: We are Fixico, a fast-growing car damage repair marketplace, backed by world-class Silicon Valley-based investors. Trusted by fleet owners, leasing, rental, and insurance companies. Fixico has managed hundreds of thousands of repairs for companies ranging from the world's biggest brands to local players. Fixico is on a constant upward trajectory and rapidly expanding throughout Europe. To continue our success we are looking for a Data Engineer who will strengthen our Data team.  What you will be doing: Fixico is a data-driven company. In this role, you will play a vital part in ensuring that each team in our company is supported with accurate data. You are responsible for setting up the entire data pipeline architecture from scratch and create new and scalable workflows. This means you'll have the unique opportunity to determine the technologies that will be used.  By working towards a robust and reliable data pipeline, you will allow other teams to analyse this data, spot trends, and take action. Data engineering will be your main focus, but analysing, inquiring, and promoting your findings will also be part of the role. You will be collaborating with industry experts; you'll be uncovering unique industry insights and trends that will further entrench our position as a data-driven company. Your responsibilities: Designing, implementing, and maintaining a scalable data pipeline architecture Building completely new and scalable workflows from scratch Collaborating closely with our Data Scientist to run and manage the ML/Analytics models in production Collaborating with other teams to solve data problems and needs Developing unique industry insights, advanced data reporting, and visualizations Solving various interesting data engineering tasks as you wish   What are we looking for: We are looking for an A-player engineer who is ready to solve complex tasks proactively. Someone who's looking forward to applying the newest technologies and who is always prepared to learn and use any necessary new tool. You have at least two years of experience with data warehousing and/or data engineering Excellent SQL skills, ability to create and optimize scripts Experience with one or more programming languages (Python preferred) Strong understanding of data models and data warehouses in general Experience with data processing platforms like Snowflake, Hadoop, Spark, Snowplow, Airflow, Dataproc, etc Experience with the Google Cloud Platform and CI/CD deployment is a plus Experience using BI tools like Looker, Tableau, PowerBI, Qlik, etc is a plus You are fluent in English; Dutch is not a requirement  What’s in it for you: The rare opportunity to be in the first row in building a world-leading platform in the automotive world A young, talented, and extremely driven team An open, transparent working environment Plenty of responsibility and opportunity to grow A roller coaster experience you’ll never forget A lot of flexibility An inspiring office view overlooking the Rijksmuseum in the heart of Amsterdam",2021-03-17 18:14:15
e89f815ff9d28b19,"Ben jij ondernemend en barst je van ambitie? Kan jij bedrijven maximaal laten groeien door hun data strategie te ontwikkelen en executeren? Dan zoeken we jou! Elevator helpt klanten als KPN, CheapTickets, Essent, scale-ups en corporate start-ups om hun ambities te verwezenlijken d.m.v. data driven marketing. We combineren data met onze jarenlange marketing ervaring zodat de beste keuzes gemaakt kunnen worden om de klantbeleving in campagnes, product, site en app te verbeteren. Alles staat bij ons in het teken van samen inzicht creëren en resultaten neerzetten. Wij zoeken een energieke collega die ons data science team kan verstevigen, leiden en uitbouwen. Je werkt samen met ons team van leergierige, talentvolle data analisten, online marketeers en conversie specialisten. Wij bieden een inspirerende en ambitieuze werkomgeving, waar veel mogelijk is als je er maar voor gaat! En natuurlijk hebben we een professioneel espresso apparaat, compleet verzorgde lunch, een VanMoof fiets en een kantoortuin die je doet denken aan de jungle van Borneo. Onze droomkandidaat ziet er zo uit: Je bent gek op je vak en deelt je passie en de nieuwste innovaties graag met collega’s en klanten. Je bent ondernemend; spot kansen in de markt, in ons bedrijf en bij de klant en weet deze ook te verwezenlijken Je hebt minimaal 8 jaar ervaring en bent bedreven in data analyse, data strategie, predictive modelling, conversion attribution en revenue optimization Je bent een serieuze gesprekspartner, zowel vanuit inhoud als persoonlijkheid, voor de CTO’s en CMO’s van deze wereld Je vindt het leuk om mensen zowel inhoudelijk als persoonlijk te coachen Je bent zowel gericht op de klant als de eindgebruiker en weet hiervoor uit de juiste tools, de juiste data te crunchen en helder te presenteren Je bent niet vies van wat gezelligheid. Op dinsdag heb jij de playlist voor de vrijmibo al klaar. Kortom, jij brengt de fun in de funnel. Vloeiend in Engels en Nederlands Soort dienstverband: Fulltime Arbeidsvoorwaarden: Bedrijfsfeesten Bedrijfsfitness Budget voor professionele ontwikkeling Fietsplan Flexibele werkuren Kerstpakket Lunchkorting Pensioen Reiskostenvergoeding Telefoonplan Vrijdagmiddagborrel Werk vanuit huis Werkschema: ma-vr Thuiswerken: Ja",2021-03-17 18:14:17
7c09642aa893b3d0,"Genmab is focused on the creation and development of innovative and differentiated antibody products, with the aim of improving the lives of cancer patients. The Quality Manager supports head Lab Operations NL. This individual supports two Quality Management employees  Responsibilities You will be responsible for managing the research Quality Management process, overseeing the quality of the research processes run in the Research and Innovation labs in the Netherlands. This includes management of the procedural framework, document control, training oversight, archivist role for GLP lab and quality contol activities (spot checks, data review) of research processes requiring a high quality standard due to eg strong relation with GxP processes. You oversee a team of two sr. Quality Management Associates, responsible for the routine work. Furthermore you are expected to identify, plan and lead improvement initiatives and projects, aligned with stakeholder requirements, to support our ever growing organisation.  Requirements Moreover, you meet the following professional requirements: Bachelor’s degree or equivalent and 6+ years of industry related experience Excellent knowledge and understanding of Quality Management processes in a research environment Extensive knowledge and understanding of Data integrity and GxP requirements (GLP, GMP, GCP) Proven experience working in teams Ability to work successfully under pressure in a fast-paced environment and with tight timelines Ability to be proactive, enthusiastic and goal orientated A team player with demonstrated ability to collaborate with a diverse group of internal stakeholders (e.g. Scientists, research associates, lab operations expert, etc.) Strong communication skills - both oral and written. In case you have any questions, please feel free to reach out to Recruiter Ninotska Edelenbosch niko@genmab.com Genmab employees work with determination and with respect for each other, consistent with our core values, to achieve our common goals. We give individuals and teams the autonomy to drive development of innovative products and solutions, knowing that integrity is a core value throughout our company. Genmab will offer the successful application a challenging position, where the right candidate will have the opportunity to work with highly specialised people across functions in an informal, multicultural culture, all aiming to make a difference for cancer patients.  Teamwork and respect are central pillars of Genmab’s culture and we therefore ensure an inclusive, open, and supportive professional work environment across our international locations. We believe that fostering workplace diversity across social, educational, cultural, national, age and gender lines is a prerequisite for the continued success of the company. We are committed to diversity at all levels of the company and strive to recruit employees with the right skills and competences, regardless of gender, age, ethnicity, etc. Please note that if you are applying for a position in the Netherlands; Genmab’s policy for all permanently budgeted hires in this location is to offer a temporary agreement for one year, followed by a contract for indefinite time regardless of seniority. Genmab A/S is committed to protecting your personal data and privacy. Please see our privacy policy for handling your data in connection with you application on our website https://www.genmab.com/privacy .",2021-03-17 18:14:19
117089af3ffbae6d,"What will you be doing? The department of Metabolic Health Research (MHR) develops technology, models and knowledge in the area of biomedical health. Together with (international) collaborators from academia, research institutes, public bodies and food, cosmetics and pharma industry we directly implement our innovations in industrial applications and projects. In this way we help companies to innovate. Within the team Accelerator Mass Spectrometry (AMS) & Biomarkers we perform advanced analytical research and measurements in clinical samples from drug development studies. For the analysis we use AMS, chromatographic techniques and accurate mass spectrometry in our new Good Laboratory Practice-compliant facility in Leiden. We focus on microtracer and microdosing applications in early clinical studies and determine absolute bioavailability and mass balance for new drugs. Our measurement technology is so sensitive that the dose of tracers that are needed is so low, it does do not pose any risk for human health. This approach was found to be safe even for small children. This enables pharmaceutical companies to use microtracers in earlier stages of the research and collect data on pharmacokinetics but also on efficacy of new drugs in development. What do we require of you? Our team is growing to match the growing interest of our customers. Currently we are looking for a study director. The study director is responsible for the scientific conduct of his/ her study at TNO. The study director ensures successful method development, method qualification and supervises the analysis of clinical samples once these are received from collaborating clinical Contract Research Organisations. The study director is in charge of a study starting with the writing of the study plan until reporting to the sponsor. Together with the project manager, the study director communicates directly with the sponsors and the clinical research organizations involved in the study. You preferably have a degree in life sciences, (bio) analytical chemistry experience is considered a plus. You have experience in working in (multidisciplinary) project teams and also at least 3 years of experience as a study director, science lead or project leader. You have experience with leadership and coaching of technicians in projects. You have excellent communicating skills in English and enjoy writing plans and reporting your work internally and to your collaborators (clients). You enjoy keeping up with new developments in analytical chemistry that can be applied in this area of work. You have experience with quality systems, such as ISO 9001, GLP and or GCP. What can you expect of your work situation? You will join the dynamic team AMS & Biomarkers which is part of the department Metabolic Health Research. We are an international mix of approximately 20 technicians, study directors, scientists and project managers lead by a team leader. We are open, customer oriented, support each other and are also in for fun together. During the current pandemic, the study directors balance their work between working at home and in the office. Our lab facilities are state-of-the art, with currently two AMS systems and two accurate mass spectrometers, number of UPLC systems and growing. For our team members, TNO offers various personal and technical development possibilities, such as courses, training on a job or conference participation. What can TNO offer you? Work enjoyment means something different for each employee. This is why we offer a-la-carte terms and conditions of employment that you can switch around on a monthly basis. Flexible working hours (like 4 days x 9 hours) and different leave schemes mean that you can create a package attuned to your specific wishes. TNO attaches great value to both your personal and your professional development. Many opportunities exist for you to develop: conferences, courses, workshops, coaching, intervision, mentoring and job rotation. At TNO you can orchestrate your own career. The salary for this position is in scale 10 and depends on your expertise and experience. Visit this page to find out more about our flexible terms of employment. Application process You can apply till the 22nd of March. The first round of interviews is scheduled on the 25th of March. The second round of interviews is scheduled for the 30th of March. The process comprises at least two (selection) rounds. First two interview rounds and then an assessment OR presentation. After a positive selection, we will finish off the process by discussing terms and conditions of employment. We try to complete the interviews and assessment within 4 weeks. Has this vacancy sparked your interest? Then please feel free to apply on this vacancy! For further questions don’t hesitate to contact us.  Recruiter: Heleen Stork Mobile phone: +31 (0)6-515 34922 LinkedIn: https://www.linkedin.com/in/heleen-stork-a30a121/  Hiring manager: Han Sandt, van de Phone number: 08886 61833    Note that applications via email and third party applications are not taken into consideration.",2021-03-17 18:14:21
4cf0a6696266b28e,"Philips challenges you to use your analytical and project management skills to create growth for our business and yourself. The goal is to turn data into information, information into insight and insight into global business decisions. You will be responsible for conducting full lifecycle analysis to include requirements, activities and design; develop analysis and reporting capabilities; and monitor performance and quality control plans to identify improvements.   Your responsibilities As a Digital Data Lead, you will : Support the growth and development of our Coffee Digital platforms (web, app, appliance) Interpret data, analyze results using statistical techniques and provide ongoing reports Develop and implement databases, data collection systems, data analytics and other strategies that optimize statistical efficiency and quality Acquire data from primary or secondary data sources and maintain databases/data systems Identify, analyze, and interpret trends or patterns in complex data sets Work with management to prioritize business and information needs Locate and define new process improvement opportunities Build predictive models and define machine-learning needs  Your team You will be part of the Coffee team in Amsterdam a dedicated group of Marketers, business developers digital Managers within the Business Group Domestic Appliances. As a Digital Data Lead, you will be the key contact between Coffee and all relevant ""data"" partners across the company (e.g. I&D team and supplier, Marketing Intelligence, Business Group & Commercial Organization Market 2 Order teams, Strategy etc.) and outside (e.g. ecosystem partners etc.).  Our offer We welcome you to a challenging, innovative environment with great opportunities for you to explore.  We are looking for Experience & Qualifications & Knowledge Proven up to 5 years working experience as a Data scientist / Analyst Technical expertise regarding data models, database design development, data mining and segmentation techniques Strong knowledge of and experience with reporting packages (Business Objects etc.), databases (SQL etc.), programming (XML, Javascript, or ETL frameworks) Knowledge of statistics and experience using statistical packages for analyzing datasets (Excel, SPSS, SAS etc.) Strong analytical skills with the ability to collect, organize, analyze, and disseminate significant amounts of information with attention to detail and accuracy Adept at queries, report writing and presenting findings BS in Mathematics, Economics, Computer Science, Information Management or Statistics  Personality Characteristics Confident communicator capable of inspiring strong collaboration in an organization Very organized and good at planning Entrepreneurial with creative nature Results driven and pro-active Ability to identify and solve problems Self-reliant and Change leader",2021-03-17 18:14:24
