id,description,scrapetimesdescription62bf5fcf070ffb54,"Wil jij klanten helpen om de optimale treinlengte te bepalen voor personenvervoer op elk moment van de dag? De personeelsplanning analyseren van de duur dat een mammoettanker voor bevoorrading gemiddeld in de haven zal liggen? Voor een groot retail bedrijf voorspellen hoeveel werknemers ze per dag in moeten zetten op elke vestiging? Maar bijvoorbeeld ook bedrijven hun marketing & sales te vergroten door een klantwaardemodel voor het op te zetten? The best way to predict the future is to Invent it! Wij helpen klanten met het beantwoorden van belangrijke en complexe vraagstukken. Dat doen we onder andere door het bouwen van concrete Minimum Viable Products en door klanten ‘the art of the possible’ te laten zien.  Naar vacatureoverzicht Senior Consultant Data Science Zet in favorieten Deel deze vacature Zet in favorieten Deel deze vacature IDE Data Business Data Strategy | Telecom, Transport & Distributie, Publieke sector, Aerospace en Defensie, Automotive, Consumer Products en Retail, Banken en Kapitaalmarkten, Utilities, Verzekeringen, Electronics en High Tech, Gezondheidszorg en Life Sciences, Manufacturing en Industrial Products, Media & Entertainment, Natural Resources | Full time Wij helpen klanten met het beantwoorden van belangrijke en complexe vraagstukken. Dat doen we onder andere door het bouwen van concrete Minimum Viable Products en door klanten ‘the art of the possible’ te laten zien. Wil jij klanten helpen om de optimale treinlengte te bepalen voor personenvervoer op elk moment van de dag? De personeelsplanning analyseren van de duur dat een mammoettanker voor bevoorrading gemiddeld in de haven zal liggen? Voor een groot retail bedrijf voorspellen hoeveel werknemers ze per dag in moeten zetten op elke vestiging? Maar bijvoorbeeld ook bedrijven hun marketing & sales te vergroten door een klantwaardemodel voor het op te zetten? Dan is de rol als Senior Consultant Data Science wat voor jou! Jouw uitdaging als Senior Consultant Data Science Als Senior Consultant Data Science bij Capgemini Invent help je klanten op basis van analyse, kennis en creativiteit, een toekomstbeeld te schetsen dat de grondslag vormt voor verandertrajecten. Met behulp van modellen en op analyse gebaseerde technieken los je klantvragen op die onderdeel zijn van een grote business transformatie. Je hebt het vermogen om op inzichten en verbeteracties te sturen door interne en externe data te combineren met grondige analyses. Verder werk je met en ontwikkel je zelf risico-, optimalisatie-, simulatie- of predictieve modellen en staan resultaten hoog in het vaandel door inzichten in data te verbeteren en structuur en governance aan te brengen. Je geeft klantervaringen (Customer Experience) gerichter vorm en verbetert dienstverlenings- en handelskanalen. Daarnaast ben je in staat om mogelijkheden te zien en verder uit te breiden. Je integreert en optimaliseert verschillende kanalen op het gebied van marketing performance. Verder streef je ernaar om bij klanten operationele processen en businessmodellen verder te verbeteren. Waar houd jij je verder mee bezig? Als Senior Consultant Data Science: Ben je de lead data scientist op een project: jij zet de lijnen uit en bedenkt de analyses voor het data science deel van het project. Ben je de sparringspartner voor de junior data scientist. Test je hypotheses met data en maakt modellen om voorspellingen te doen. Help je bij het identificeren van potentiële problemen en verbetermogelijkheden. Interpreteer je de resultaten van de analyses samen met je collega business analist. Vervolgens definieer je vervolgacties op basis van je eigen marktexpertise en de kennis die wordt opgehaald bij de klant. Kijk je naar de structurele verandering in het proces bij de klant bijvoorbeeld het gebruik van een dashboard en hoe dit dashboard in lijn kan worden met de KPI's van de afdeling of organisatie. Heb jij een passie voor data maar versta jij ook de business en ben je goed in het slaan van bruggen tussen Data Science en de taal van de business? Dan past de rol van (Senior) Data & Analytics Consultant wellicht bij jou. Wat breng jij ons? Ten eerste vinden wij het erg belangrijk dat je goed in ons team past. Uit jouw motivatie komt naar voren dat je nieuwsgierig ben ingesteld en anders durft te denken met een visie op het vakgebied. Bovendien heb je het vermogen om complexe vraagstukken snel te analyseren en nieuwe, scherpe inzichten en oplossingen te genereren. Ondanks dat je al de nodige ervaring bezit, ben je nooit uitgeleerd. Verder ben je instaat om in een team te werken en deins je niet terug om initiatief te nemen. Daarnaast heb je het vermogen om met zelfstandigheid om te gaan en ga je altijd voor het beste resultaat. Wat je nog meer brengt? Een afgeronde WO-opleiding met uitstekende studieresultaten bij voorkeur in de richting van (Toegepaste) Wiskunde, (Toegepaste) Natuurkunde, Econometrie, Marketing intelligence. Minimaal 2 jaar relevante werkervaring in een ‘data driven’ omgeving. Relevante kennis van Excel en ruime ervaring met modellering en analyse-instrumenten zoals SAS / SPSS / R / Matlab. Een uitstekende beheersing van de Nederlandse en Engelse taal. Beheers je ook Duits? Dan is dit een pré. Een flexibele instelling en bent bereid om opdrachten in het buitenland te vervullen. Heb je al meer dan 5 jaar werkervaring in een data-driven omgeving, bij voorkeur als Data Scientist? Dan is het ook mogelijk om te solliciteren als Managing Consultant. Hier werk je mee aan het definiëren van nieuwe projecten en je geeft hierbij richting aan het Data Science gedeelte samen met collega’s uit andere teams die zich richten op specifieke werkgebieden, bijvoorbeeld van het Supply Chain Team, het HR Transformatie team of in de retail sector. Verder ben je de sparringpartner voor de Senior Data Scientist. Wat je naast bovenstaande punten nog meer meebrengt? Je hebt ervaring opgedaan als leidinggevende, je stuurt bijvoorbeeld de Data Scientisten aan op grote projecten. Jij zet de lijnen uit en bedenkt de analyses voor het Data Science deel van het project. Je hebt een groot netwerk en je breidt deze graag verder uit. Je bent een expert op het gebied van Data Science. Hoe wil jij je carrière binnen Capgemini Invent vormgeven? Ga je bij ons aan de slag? Dan krijg je alle vrijheid om je eigen carrière vorm te geven. Of je al een duidelijke visie hebt over hoe je je loopbaan wilt vormgeven of niet, we geven je vanaf dag één graag alle support om jezelf te ontwikkelen. Daarom start je je carrière bij Capgemini met een introductie van ons bedrijf en een driedaagse training waarin alle facetten van het vak van consultant voorbijkomen. Daarnaast kun je verschillende trainingen volgen via de Capgemini University op een unieke locatie bij Parijs of via onze Capgemini Academy. Denk aan een training Facilitating Interactive Workshops of een training in Stream Management. Laat ons vooral weten wat jou motiveert en waar jouw ambities liggen. Wat bieden we jou? We hebben allemaal een grote passie voor advies en technologie, maar vinden een fijne open sfeer en plezier op de werkvloer (en daarbuiten) ook enorm belangrijk. Zo worden er regelmatig leuke activiteiten georganiseerd door onze personeelsvereniging. Wees gerust, deelnemen is natuurlijk vrijblijvend. We snappen heel goed dat je soms ook even lekker tijd voor jezelf of met familie en vrienden doorbrengt. Het consultancy vak is turbulent en van tijd tot tijd intensief. We willen graag dat je een baan hebt die goed in te passen is in jouw leven, die je energie geeft en bovenal bijdraagt aan de ontwikkeling van jouw talent. Samen met het team werk je in een dynamisch werkveld dat volop in ontwikkeling is. Je werkt aan uitdagende projecten, complexe vraagstukken om kwantificeerbare waarde toe te voegen bij een klant. Het project stopt niet bij het aanleveren van inzichten: je helpt de klant echt transformeren zodat ze klaar zijn voor de toekomst. Binnen het team Data Science and Data Strategy houden we elkaar scherp, maar we staan ook altijd voor elkaar klaar om te helpen en voor kennisdeling. Het team is grotendeels zelf organiserend en is bereid om samen nét dat beetje extra te leveren bij de klant. Het mooie is dat we binnen ons team en in samenwerking met de ‘AI Garage’ alle capaciteiten in huis hebben om de oplossing ook echt te maken. Op die manier heeft Capgemini Invent een goede reputatie opgebouwd voor data science opdrachten en heeft zo grote klanten aan zich weten te binden met interessante vraagstukken. Wat we verder nog bieden? Uitstekende faciliteiten om flexibel om te gaan met je werk, inclusief een laptop en een telefoonabonnement. De positie is in principe voor 40 uur p/w, maar in overleg is een 32 of 36-urige werkweek mogelijk. Direct een vast contract, een marktconform salaris en een bonusregeling op maat. 26 vakantiedagen met de mogelijkheid om in overleg vakantiedagen bij te kopen of een sabbatical op te nemen. Een naar eigen keuze te besteden mobiliteitsvergoeding. Je kunt er bijvoorbeeld voor kiezen om de vergoeding volledig uit te laten betalen, maar je kunt ook een auto naar keuze leasen en/of gebruik maken van een NS-businesscard. Een premievrij pensioen met de mogelijkheid om zelf extra in te leggen. Diversiteit Capgemini Invent moedigt sollicitaties aan van kandidaten die gekwalificeerd zijn en in aanmerking komen, ongeacht hun geslacht, gender, ras, werkcapaciteit, leeftijd, seksuele gerichtheid, religie of geloofsovertuiging, burgerlijke staat, zwangerschap of moederschap/vaderschap. Wij streven naar het selecteren, ontwikkelen en behouden van de beste talenten om onze klanten innovatieve resultaten van wereldklasse te kunnen leveren. Wij koesteren een inclusieve cultuur die iedereen in staat stelt om te groeien naar hun volledige potentieel en te genieten van een carrière die voldoening geeft. Onze uitgebreide en flexibele arbeidsvoorwaarden en leefstijlbeleid stellen onze werknemers in staat om een goede work-live balance te vinden. Ben jij de nieuwe Senior Consultant Data Science? Deins jij niet terug voor een uitdaging en help jij organisaties graag bij al hun complexe vraagstukken? Dan zien wij jouw sollicitatie graag tegemoet. Benieuwd naar meer informatie over Capgemini en onze mensen? Dat lees je op werken bij Capgemini.",2021-03-16 14:54:08
d9318604abd4fb64,"Currently our client, active in the international construction world, has a vacancy for a: Business Analyst  You get energy from collecting and analyzing relevant data. As a Business Analyst you identify and generate key analytics to support the commercial and financial operations in order to meet the company goals such as margin and volume improvement. You make different recurring analyses in the SAP Analytics Cloud tool and Excel. You create dashboards, reports and analyses in order to highlight the results of the company’s activity and its market. You report to the Commercial Finance Manager EMEA. Your tasks: Generate daily sales reports and market information reports; Create, manage and present dashboards for internal customers and key stakeholders; Gain insight into the numbers and identify important insights; Translate business challenges to analytical questions; Constantly looking for improvement of reporting systems; Ensuring that all business decision-makers use standard data and insights; Support the periodic forecasting process, both for operational planning and financial planning; Price / margin / volume analysis; Reference prices; Monitoring cost and market price developments; Participation in (international) group projects.  Vacancy for a Business Analyst in Lelystad Profile candidate: A completed Bachelor degree in a Business, Marketing or Economics; Has excellent analytical skills, in order to master the reports produced by computersoftware and to understand their meaning in business terms; Excellent production and reporting skills (Excel / Powerpoint); Prior experience with data visualization tools is a plus; Good command of the Dutch and English language, both written and spoken (German is a plus). Personal Characteristics: Accurate and Solution-oriented; “Change mindset”; Flexible; Stress resistant; Communicative; Persuasiveness; Sense of humor.  Our client distributes high quality industrial nail, staple and screw systems and fasteners for the construction and wood processing industry to all European countries, the Middle East and Africa (“EMEA”). Our client is a well-known name in the international construction world. In addition to the EMEA head office located in Lelystad, it has offices in 15 countries within Europe.  Interested?If you are interested in making a substantial contribution to a purpose driven international company, this is an interesting opportunity for you! Our client offers an attractive salary package and opportunities for personal development and growth.You can apply to this vacancy via the button 'direct solliciteren'. If you would like more information about this vacancy, please contact Vincent van Middelaar of Employment Services (06-22423197/ v.vanmiddelaar@employmentservices.nl) or Hendrik Roeleveld, (06-57679413 / h.roeleveld@employmentservices.nlEmployment Services is responsible for the recruitment & selection of suitable candidates for this vacancy. You can find more information on www.employmentservices.nl#Vacancy, #Lelystad, #Reporting, #Dashboards, #Finance, #Marginanalysis, #Economics, #Marketing, #Business",2021-03-16 14:54:10
d5fd1cd4c98f0718,"Stel je eens voor dat we voor zowel interne sturing als regelgevers binnen no-time data om kunnen zetten in betrouwbare rapportages. Jij kan dit verschil maken door als Credit Risk Data Analist de aanlevering van financiële informatie ten behoeve van de externe en interne verslaggeving van de opdrachtgever te verzorgen. Over deze functie  Binnen het Finance & Risk domein zal jij je als Data Analist bezig houden met het oplossen van verscheiden data gerelateerde uitdagingen. Daarbovenop zul je werken aan wereldwijde en cross-functionele projecten om verschillende soorten processen en systemen te verbeteren. Denk hierbij aan bijvoorbeeld het verzamelen van de juiste data om zodoende tot een verbetering van credit risk modellen te komen. Recente marktontwikkelingen en de toenemende wettelijke eisen maken dit een zeer boeiende en uitdagende job voor iemand die geïnteresseerd is om te werken in een internationale en continue veranderende omgeving.  Over jou  Natuurlijk ben jij klantgericht, overtuigend, pro actief en resultaatgericht. Juist die eigenschappen maken jou tot een goede Credit Risk Data Analist. Zeker in combinatie met: Minimaal een afgeronde hbo- of wo-opleiding in een Quantitatieve richting, aangevuld met de juiste werkervaring In staat om technische data issues te vertalen naar praktische portfolio oplossingen Sterke analytische vaardigheden om data te analyseren en om problemen/inconsistenties te kunnen identificeren Diepgaande kennis van Credit risk Een grote interesse in data-infrastructuur en bedrijfsanalyses Ervaring met Basel regelgeving En ben je in staat om Nederlandse documentatie te ontcijferen Daarnaast is het heel fijn als je al kennis hebt van SQL, SAS Enterprise Guide, Excel, Python, Power BI, Business Objects en datawarehouse-concepten en data-modelleringstechnieken. Wat wij bieden  Terwijl jij je als Credit Risk Data Analist inzet bij onze opdrachtgever, zetten wij ons in voor jou. Gedetacheerd worden door Brunel betekent namelijk dat je bij ons in dienst treedt. Bij ons draait het om jou, dus houden wij altijd een oogje in het zeil. Hoe uit zich dat? Je hebt een eigen Brunel-Consultant die jou begeleidt, check-ups doet, nieuwe projecten voor je vindt en jouw carrière en ontwikkeling vooropstelt. Daarnaast, want daar blijft het niet bij, stellen we diverse opleidingsmogelijkheden aan je voor waardoor jij je zowel op zakelijk als op persoonlijk vlak kunt blijven ontwikkelen. Je ontvangt een goed salaris en dan hebben we het nog niet eens over al die bonuskansen gehad. Ook met de secundaire arbeidsvoorwaarden zit het wel snor. Wij hebben tenslotte ook een reputatie hoog te houden.  Over ons Je kent Brunel als zakelijk dienstverlener; wereldwijd actief en gespecialiseerd in projectmanagement, detachering en consultancy in de vakgebieden Finance & Risk, Engineering, IT, Legal, Marketing & Communicatie, HR en alle disciplines in de olie- en gasindustrie. Dit doen we samen met zo'n 14.500 collega’s in 44 landen. Brunel Finance & Risk is gespecialiseerd in het detacheren van vakspecialisten binnen de financiële dienstverlening. Dankzij onze medewerkers en onze manier van werken onderhouden wij goede relaties met alle gerenommeerde financiële spelers in de branche, met wie we jou graag in contact brengen. Onze kernwaarden zijn terug te zien in onze deelname aan en sponsoring van de Volvo Ocean Race: ambition, teamwork and operational excellence. Vandaar ook ons motto: Navigate The Future. Herkenbaar? Welkom aan boord!  HBO",2021-03-16 14:54:12
c11814d045596b71,"Organisatie Promovendum is onderdeel van de CAK Groep: een succesvolle speler in de verzekeringsbranche, met verschillende producten, merken en platformen. Met ruim 250 collega\u2019s zijn ze elke dag bezig om het leuker en beter te maken voor haar 300.000 klanten. Functie Wat ga je doen in de functie van Marketing Automation Specialist? Jij gaat ervoor zorgen dat ze bij Promovendum meer uit hun marketingdata gaan halen! Dit zowel uit de online als offline data en zowel uit interne als externe data. Naast het doen van analyses, dashboards maken en machine learning toepassen, ga je ook (online) marketingacties automatiseren! Een voorbeeld Waar ze al wel conversiekansen voor ontvangers van e-mailings kunnen voorspellen, moeten ze bij Promovendum nog handmatig e-mailingselecties importeren in het-mailingsysteem. Dat zien ze graag anders! Daarom ga jij met collega's het maken van de selecties automatiseren. Hoe? Via de api koppeling van het e-mailingsysteem kunnen ze automatisch e-mailings gaan verzenden, naar de juiste ontvangers op het juiste moment. Daarna volgt uiteraard het verbeteren van de voorspelmodellen en selecties. Een ander voorbeeld Om goed gevonden te worden in Google zetten ze blogartikelen en ander webcontent in en adverteren ze op zoekwoorden in Google. Over zoekwoorden is veel data beschikbaar. Ook waar ze nog niet op adverteren! Denk aan maandelijks zoekvolume, zoektrends, concurrentie (organisch en betaald), conversiepercentages en advertentiekosten. Op dit moment doen de contentmarketeers en campagnespecialist via online tools nog \u2018handmatige zoekwoordanalyses'. Dat kan natuurlijk slimmer! Als ze data uit diverse tools combineren en er marketinganalyses op los laten, kun je veel beter kansen spotten en hiermee effectiever adverteren en de websites uitbreiden. Voor de verdere automatisering kunnen ze via scripts in Google Ads automatisch gaan adverteren op zulke zoekwoorden en automatisch biedingen aanpassen. Uiteraard kunnen bij zulke analyses conversieattributiemodellen niet ontbreken. We kunnen nog vele andere voorbeelden noemen, maar als je inmiddels al een glimlach op je gezicht hebt, dan wordt het tijd om verder te praten met een kop koffie (of thee)! Functie-eisen Ervaring met Tableau, Power BI of vergelijkbare visualisatietools; Ervaring met R of Python (grote pre); Afgeronde hbo- of wo-opleiding in Marketingdata; Minimaal 2 jaar ervaring als Marketing Intelligence Analist, Marketing Data Analist of een vergelijkbare functie; Passie voor marketingdata en automatisering; Commercieel inzicht om snel kansen te spotten; Sterk analytisch vermogen; Uitstekende beheersing van de Nederlandse taal; Ervaring met Google Ads scripts en/of Javascript (pre). Aanbod Een prachtuitdaging binnen een informele organisatie; Een inspirerende en informele werkomgeving met leuke collega\u2019s; De mogelijkheid om je verder te ontwikkelen.; De vrijheid om mee te denken en idee\u00ebn aan te dragen; Zelfstandigheid en verantwoordelijkheid; Extra voordelige verzekeringen, reiskostenvergoeding en een goede pensioenregeling; Gevulde koelkasten en elke dag vers fruit. Een rooftop restaurant waar je voordelig kan (avond)eten; Salarisindicatie: \u20ac 2.500,- tot \u20ac 4.000,- (afhankelijk van ervaring); Functie voor 32 - 40 uur per week. Sollicitatie Wil jij onderdeel uitmaken van een leuke en informele organisatie en helpen data verder op de kaart te zetten? Neem dan contact op met Melvin Lindeman, Recruitment Consultant op 06 50 64 89 09 of per mail op m.lindeman@cmotions.nl.",2021-03-16 14:54:13
