id,description,scrapetimesdescription4ffe71f074cf6277,"Make a difference by using your knowledge of supply chain processes in an international environment by working in multi-disciplinary teams which are responsible for the development of new products, systems, and processes including the implementation. You achieve succes by your understanding of the supply chain and the customers' needs and your capability of coming up with solutions for short-mid-and long term purposes. As a Senior Business Consultant you are positioned within the Digital Development team of the International IT department. In your day to day work you are part of a multi-disciplinary team and you work on the design of business processes and IT solutions in the supply chain. You are able to identify/understand the IT needs of the supply chain and customers and together with your colleagues, you think of ways in how to achieve the strategic themes which lie ahead. You are able to identify the gaps between supply chain and IT and translate the business needs into solutions. As a Digital Consultant you give guidance in decision making for short term and long term solutions. You also play an important role in the development of the supply chain roadmap. You operate comfortably in a very complex stakeholder environment with many levels of users (from operational to executive) and (international) suppliers and you maintain relationships and interact with managers, process owners, suppliers, customers and partners in Europe, North America and Asia. Furthermore you understand the IT architecture and are able to identify the strenghts and weaknesses of different solutions.  We want to be the favourite logistics company by delivering special moments every day. Our employees and customers are key. We are always looking for ways to improve. As a Digital Consultant in our supply chain you want to contribute to the digitalization of our organization. And you also contribute to new end-to-end solutions where shallow and fast delivery and a flexible architecture are very important. We want to work on solutions that will contribute to a more data driven organization. You discuss with business development, customers and/or partners and product management, new business opportunities and provide input with regard to the opportunities provided by potential IT solutions. PostNL IT is the central IT organization of PostNL and is responsible for the specification, development and running of the IT services of PostNL. Cross Border Solutions is an International Business Unit that combines products and services for both mail and eCommerce for international customers.  A University degree (BSc/MSc) in business informatics or proven equivalent experience plus fluency in English (working language within CBS), working knowledge of Dutch is a real pre; 3-5 years’ experience in either a postal/logistics or e-commerce environment preferably including Cross-Border business processes and IT solutions; Affinity with business development, product management, logistics and marketing in an e-commerce environment Experience with design methods and techniques for applications and data; Working knowledge of SAFe methodolgy working is a benefit; Experience with multiple functional domains and the corresponding functional specifications, architecture and current guidelines; Well developed socials skills in guiding various teams, giving presentations for decision makers/ users and transferring knowledge; Strong network and relationship building skills and ability to thrive in an international environment with a variety of users and suppliers and complex stakeholder management Open to social, commercial and cultural differences.  To be successful in this role excellent analytical and solution driven skills, advanced technical writing skills, good interpersonal, connecting and communicating skills, and an in-depth understanding of business procedures and objectives are required. Your entrepreneurship and realisation skills help you to achieve results.  Gross salary indication between€ 4.416,- tot € 6.420 based on a fulltime contract (37 hours) (level 12) of the PostNL Collective Labour Agreement); 25 vacation days and 8% holiday pay and attractive Pension and health insurance benefits; Flexibility and freedom to perform your job effectively; Laptop, mobile phone and compensation towards your travel costs/home-office. Read more about our remuneration package here; A challenging position within a dynamic and International Department; Room for personal development through education and training in PostNL learning environment, content driven and knowledge sharing sessions; Great office location in The Hague with easy public transport access.  As Senior Business Consultant you are the linking pin between the business and IT. You have an important role in the digital future of PostNL International. You are part of a team of savvy analysts and you get the chance to influence the development of many international topics steered by regulations but also trending digital changes in the market. A good working knowledge of Dutch is a real advantage for this role. Interested? Please apply with your resume and compelling cover letter in English.  PostNL aims to be the favorite logistics company for everyone. Therefore, everyone is welcome to join us irrespective of where you were born, what your beliefs are and who you love. We are just looking for great talent. A pre-employment screening is part of the application process. This entails providing a positive Certificate of Good Conduct (VOG) on joining the company.  Heb je vragen over deze vacature? Neem dan gerust contact met mij op via WhatsApp, telefoon of e-mail. Georgina Broeken - Wilson T: 0620439986",2021-03-16 14:44:41
93c94f3e6517f8cf,"Full-time, Nijmegen, the Netherlands Hurry up! We’ve got a dream to build! BlueConic is a fast-growing SaaS startup in search of that unique individual who blends a customer service attitude with technical problem solving. Do you have a passion for building world class products with a top tier team? We’re looking for an ambitious Product Owner that drives the execution of our vision into the best product there is. About BlueConic BlueConic is the market-leading customer data platform, which gives marketers the power to liberate their data and use it to improve marketing outcomes. Our clients use BlueConic to unify individual-level data and then use that single view across channels. Our SaaS platform is the solution for challenges marketers haven’t been able to solve for years. We’re headquartered in Boston and our development team works from the Netherlands. With more than 300 brands currently using the platform, our work is experienced by millions. About the job We’re looking for an ambitious Product Owner who will be responsible for our product and its implementation from start to finish. You will manage the backlog and sprint definitions and communicate with our internal stakeholders – customers, prospects, analysts and partners – to deeply understand our target market and buyer’s needs. You are responsible for all functionalities of the BlueConic platform and for the product’s success. On a daily basis you will work with BlueConic’s team of highly experienced software Engineers. The incredible success of our software product is largely due to the vision and the implementation of the technology, as well as timeliness to hit the market! You’re a fit if you are deeply interested in marketing, architecture, and technology. You are patient and exceptionally smart, have an eye for details, and are a great communicator. A sense of humor and an enthusiasm for participating in discussions about random things on Slack are also a must. Your activities will consist of: Managing and refining the product backlog. Clearly expressing and prioritizing product backlog items to best achieve goals and delivering value. Working closely with a team of Software Engineers and a QA Engineer. Working closely with the Product Manager to understand the roadmap and translating roadmap items into user stories. Participating in Refinement sessions, Sprint planning meetings, Sprint Reviews and Retrospectives. Understanding and internalizing the product vision, and being available and approachable for your team at all times. Ensuring the quality of the releases by testing, validating, and accepting the work done. Having a proactive role in continually improving the process. We are looking for someone with the following skills: You have a bachelor’s or master’s degree or equivalent working experience. Technical proficiency for tools in marketing technology, advertising technology, and/or customer analytics. Deeply familiar with Web and mobile technologies. At least 5 years of experience in software design. Deep experience with Scrum. Impeccable organizational and time management skills. Have superlative communication skills. You will be a great fit if you: Are eager to drive the creation the best marketing technology product in the world. Are a strong team player with a “can do’’ attitude. Are passionate, enthusiastic, and eager to learn. Are fascinated with all things technical. Are equally fascinated by software design. Have got a mind for asking questions and synthesizing information that turns into results. Don’t ever think “good enough” is good enough. Do enjoy going into the nitty gritty details if necessary, but still see the big picture. See patience as a virtue. Reasons to join us: Work in an international fast growing start-up with the opportunity to come over and work at our headquarters located in “Title Town,” USA (Boston) and share our love for US sports. Be part of a dynamic and professional, very seasoned team (most of our engineers have more than ten years’ experience). Take advantage of great opportunities for career progression. You want to work with the very latest tools and tech. Help build the best marketing technology product there is. Enjoy competitive salary, 28 days off, a MacBook, travel expenses and a good retirement pension. Do you think this is the perfect job for you? To join our team, please apply through the link below and we will get in touch with you very soon to talk about a future at BlueConic! Acquisition for this vacancy is not appreciated.",2021-03-16 14:44:42
fa504ddeaefe68ae,"In fast changing markets, customers worldwide rely on Thales. Thales is a business where brilliant people from all over the world come together to share ideas and inspire each other. In aerospace, transportation, defence, security and space, our architects design innovative solutions that make our tomorrow's possible. Business Intelligence Analyst Marketing closely works together with the product teams in Standard Solution Management (including Technical innovation) and the Sales teams in the Customer Account Teams (CATs) in order to define the marketing strategy, support these teams with operational marketing support and provide the intelligence required to win business. About the job As Business Intelligence Analyst you will contribute to improve the Thales Netherlands Naval information position on markets and competitors, in order to improve efficiency and effectiveness of our Customer Account Teams (CATs) and Product Teams (PTs) to improve our position in the market. You will be tasked with the following activities: Structuring methods & processes for information gathering from both Thales and external sources on customers and competitors, based on the articulated needs Marketing, Sales and Product Management; Analyse the data and create business analysis reports on customers, markets and competitors; Participate in the Thales Group Strategic Business Analysis activities, with an emphasis on the Thales global Naval business; Support the Strategic Business Plan, Sales plan and Product plan with trend analysis and customer profiles; Contribute to develop and strengthen the digital BI framework (methods, tools) Maintain the market & competitor databases. About you relevant Master Degree and preferably 5 to 7 years of experience in the defence industry; like to search for pieces of information and combine them into a relevant business analysis report; a team player, good communication skills, able to lead conversations with sales and product management and understand their business needs; ability to create and maintain effective information networks. What's in it for you Become part of a great marketing team (consisting of Marketing, Operational Business Development and Business Intelligence) in a high tech, innovative international organization (International) opportunities for growth in tech-, management- and commercial roles Attention for personal development and own initiative A nice workplace in a modern building, where we value a good work-life balance and flexibility 40 leave days per year, travel expenses and a flexible benefits à la carte package with options like purchase/sale of leave hours, internet costs, bicycle plan, company fitness, trade union contribution or relocation costs Interested? Apply now! Click on the button below to upload your profile and show your interest. As part of the process we might ask you to take a skills and competencies assessment. At Thales we provide CAREERS and not only jobs. With Thales employing 80,000 employees in 68 countries our mobility policy enables thousands of employees each year to develop their careers at home and abroad, in their existing areas of expertise or by branching out into new fields. Together we believe that embracing flexibility is a smarter way of working. Great journeys start here, apply now!",2021-03-16 14:44:44
f1cce9981c0ddbe5,"Takeaway's Customer Intelligence team is seeking for a business-minded marketing intelligence specialist. The Customer Intelligence team is a new team within the Global Retention Marketing department which further consists of a Loyalty Program, CRM and Customer Activation team. The goal of the Global Retention team is to grow the order frequency of our customers. The goal of the Customer Intelligence team is to uncover insights through advanced analytics and test opportunities to do exactly so. The Customer Intelligence team lives at the intersection of Marketing, Data & Analytics and Product departments. The team consists of 2 pillars: customer analytics and customer excellence deployment. The analytical focus of the team is the customer. Everything starts with digging into customer data to define problems and hypotheses and refine and enrich data when necessary. To understand the ‘why' behind the data, the team also derives customer insights, by blending data with a deep understanding of user needs, habits, and perceptions developed through targeted interviews, usability studies, and customer feedback. The role of the lifecycle analyst is to bring the next level of data sophistication to the team. You will build statistical models to better understand and predict customer behavioural patterns and work with the entire retention team to define campaign triggers on critical points in the path to loyalty. Besides the more in depth projects you will also have a supporting role on more basic analytics for the entire Global retention team. The Customer Lifecycle analyst resides in the Retention Marketing Team and has a very strong link to the central data scientists and analysts, who will give you an extensive onboard training, support you in your daily work and provide you with regular training as if you were part of the central team. Your responsibilities: Deepdive into big retention challenges such as new customer churn, prediction of purchase paths and reengagement triggers Develop statistical models and reports and tools on top of our Amazon Redshift Datawarehouse using languages such as SQL, Python or R. Quantify overall return on investment generated from a customer post considering all possible touchpoints and product interactions over his lifetime. Implementing cross functional projects across analytics, product and CRM teams with objectified goals of customer retention Handle large volume of data, and be responsible for maintaining, modifying and owning the relevant CRM data schemas and segmentation models along with the central data engineering and full stack tech teams. Identify specialized customer segments and increase discoverability and targetability via multi channel marketing promotion. Facilitate the teams setting up and analyzing A/B tests using statistical best practices and evaluate incrementality from campaigns. Provide actionable insights to business from engagement and transactional data Proactively propose business actions that result from your analysis data to stakeholders, so that they can take an innovative approach to efficiently and effectively improve their business; By training your fellow team members on the usage of the various data & analytics tools available you will contribute to Takeaway.com's goal to work as data-driven as possible through the entire organization. Aligning with the central BI Team to define goals and follow up on ongoing and future projects. Your profile: 6+ years of experience working in Marketing Intelligence and/or data science Solid experience in a number of the following technologies/programming languages R, Python, Julia, Spark, Hadoop, Tensorflow, Amazon AWS Knowledge of SQL and Business Intelligence tools like Tableau or any other visualization tool; Being able to do in-depth analysis, for example, performance analysis of retention team, CLV, cluster, churn analysis, forecast and modelling Excellent communication, teamwork, and stakeholder management skills. Hands-on and flexible in personality, structured and solution-oriented thinking, critical questioning and focusing on ongoing development. Experience in defining and calculating KPIs. Experience working in an agile environment. Preferably an academic quantitative degree (MSc) in Econometrics, Mathematics, Statistics, Data Science or another related field with a strong emphasis on advanced quantitative analysis. Understanding and experience on AWS/GCP data offerings. You have a positive mindset and enjoy working in an international and multicultural environment We offer: Work in a fast growing eCommerce company; Being part of a new, young, professional and international team; A competitive salary including 8% holiday allowance; Travel costs 1st class public transportation; Pension plan 60% paid by Takeaway.com; 26 holidays a year on a full-time basis; An office location within the heart of Amsterdam (5 min. from Central Station); Hackathons and prototyping of new solutions; Variety in your work and a fantastic, informal work atmosphere. Mentoring and personal development opportunities in an international team of experts. A challenging environment that will stimulate you to grow as a professional. Awesome company events (e.g. summer party and yearly snow trip). A dynamic work environment with a culture that is open, innovative and performance-orientated.",2021-03-16 14:44:48
6c8c8a73316b1f8d,"DATA - RESEARCH ANALYST | Rotterdam | 40 uur per week | €2222 - € 3478 USP zoekt GEEN schaap met 5 poten! Wij zijn op zoek naar starters voor de functie Research Analyst. Wat verwachten we van jou? - HBO/WO werk- en denkniveau - Ervaring met SPSS en Microsoft Office - Affiniteit met marktonderzoek - Doorzettingsvermogen, analytisch inzicht, stressbestendigheid Wat doet een Research Analyst in 40 uur bij USP? · 12 uur programmeren · 8 uur analyseren · 8 uur rapporteren · 6 uur veldwerk monitoren · 4 uur intern overleggen · 2 uur klantbezoeken Wat mag jij van USP verwachten? Van USP mag je verwachten dat je de kans krijgt om veel te leren en je door te ontwikkelen. USP is een fullservice marktonderzoeksbureau dat gespecialiseerd is in de bouw- en woonwereld. Een bedrijf dat trots is op de Rotterdamse mentaliteit, want USP’ers zijn doorpakkers! Dit leidt ook tot de nodige successen in het buitenland, 70% van de omzet is afkomstig van grote internationaal erkende merken. Bij USP heb je zelf je carrière in de hand, dus als jij ons laat zien wat jouw ambities zijn geven wij jou de kans om deze waar te maken. Soort dienstverband: Fulltime, Onbepaalde tijd Salaris: Vanaf €2.222,00 per maand Opleiding: Master (Vereist) Locatie: Rotterdam (Aanbevolen) Taal: Nederlands (Vereist) Thuiswerken: Nee",2021-03-16 14:44:51
22d7a47bc22466d2,"Wat ga je doen? Als Projectmanager / ProductOwner neem jij de touwtjes in handen en leidt alle stakeholders naar de oplevering van een succesvolle oplossing waar iedereen blij van wordt. Je bent in feite het verlengstuk van onze opdrachtgevers en de schakel naar onze Scrum teams. Je zorgt voor een goede product backlog en stelt de juiste prioriteiten met je teams samen. Maar je neemt ook deel tijdens leuke strategische sessies die onze Strateeg organiseert in de Get Ready, houdt sprint refinements en bent verantwoordelijk voor een goede oplevering. Dat doe je met onze ervaren Scrum teams bestaande uit o.a. een Scrum Master, Developers en QA-ers. Ieder Scum team wordt natuurlijk bijgestaan door een Business Analist, Visual UX designer en een Strateeg. We werken in een internationale en professionele werkomgeving met (inter)nationale opdrachtgevers en een kantoor in hartje Rotterdam en Lviv (het Silicon Valley van Oost Europa). We ontwikkelen geen simpele websites maar praten over online platforms. High traffic oplossingen, portals met integraties, (inter)nationale corporate websites en e-commerce oplossingen. Verder zijn we bezig met de vertaling van onze ervaring en kansen die we zien in de markt, naar eigen producten die we met een nieuwe marketing afdeling gaan lanceren. We werken met hoogwaardige frameworks en wereldwijde standaarden. Ook maken we gebruik van de complete Atlasian suite en ondersteunende tools zoals Miro, Figma, test software en zeer geavanceerde en schaalbare cloud ontwikkelstraat (OTAP) met Docker en Kubernetes voor Continious Integration in onze projecten. Tot slot hebben onze klanten service contracten om de optimalisatie van onze oplossingen telkens naar een hoger niveau te tillen. Samen met onze opdrachtgevers zijn we namelijk constant in gesprek om met elkaar iets moois te maken en door te ontwikkelen.  Wat kunnen we voor elkaar betekenen? We bieden een goed marktconform salaris (maandelijks tussen 3.500 en 5.500 euro bruto) tegen een vast loon dat we in onze sollicitatieprocedure zullen bepalen aan de hand van jouw ervaring en kennis. Daarnaast bieden we uitstekende arbeidsvoorwaarden een tof kantoor op een fantastische plek in het centrum van Rotterdam. Je krijgt een MacBook Pro en eigen werkplek met twee schermen. Uiteraard horen 8% vakantietoeslag, reis- en pensioenkostenvergoeding en een mooie winstdeling ook tot de arbeidsvoorwaarden. Tot slot bieden we mogelijkheden tot een hybride vorm van thuis- en op kantoor werken.  Maar wat verwachten we van jou? Je hebt minimaal 3 jaar ervaring als Product Owner bij een online bureau. Je weet zaken voor elkaar te krijgen, legt de juiste prio’s, maar kunt ook ‘nee’ zeggen wanneer nodig. Een drukke, gezellige en dynamische werkomgeving geeft je energie Je weet op enthousiaste wijze je collega’s te motiveren en onze klanten te overtuigen van je ideeën en adviezen. Je kunt wensen van gebruikers of klanten goed vertalen naar kansen en oplossingen. Je werkt zelfstandig, gestructureerd, houdt graag overzicht en bent resultaatgericht. Je kunt sparren met andere ervaren collega’s. Je schakelt snel op tactisch en functioneel niveau. Je kunt – als je het leuk vindt – soms mee op kort werkbezoek van 2 of 3 dagen naar onze Lviv vestiging (niet noodzakelijk) en zodra we gevaccineerd zijn natuurlijk:) Je communiceert ook gemakkelijk in het Engels met zowel collega’s als externe stakeholders.",2021-03-16 14:44:52
