id,description,scrapetimesdescription5c1d6d1d9b5faa45,"Krijg jij energie van het (digitaal) transformeren van organisaties en processen? Daag jij klanten uit om op zowel IT als business aspecten scherpe doelstellingen te formuleren? Neem jij graag klanten mee in hun volgende stap naar e-commerce? Lees dan snel verder en word onderdeel van één van onze belangrijke strategie proposities.  Laat zien wat je kan als IT Business Consultant Als IT Business Consultant bij De Nieuwe Zaak is het aan jou de opdracht om samen met onze klanten de vertaalslag te maken van hun business vraagstukken naar de beste IT oplossingen. Jij weet wat de volgende stap is in digitale transformatie en je weet als geen ander de klant mee te nemen in het veranderproces dat nodig is om te groeien. Jij geeft gevraagd als ongevraagd advies en doorgrondt met een kritische aanpak de bedrijfsdoelstellingen en IT infrastructuur van de klant. Op deze manier ontstaat er een duidelijk beeld van het IT landschap en de informatiearchitectuur van de klant. Deze inzichten vertaal je naar realistische IT oplossingen en haalbare stappenplannen. Jij creëert bij de directie van de klant draagvlak voor de uitvoering van de roadmap en zorgt voor een duidelijke vertaalslag naar de development teams van De Nieuwe Zaak.  Je werkt voor klanten uit verschillende sectoren, die in de verschillende fases van digitalisering van hun commerce processen zitten. Zo helpen wij groothandels, retailers, merken en goede doelen de juiste stappen te maken die nodig zijn om online te groeien om hun business doelstellingen te realiseren.  Hoe ziet jouw team eruit? Het strategieteam van De Nieuwe Zaak is nieuw en bestaat uit een Marketing Strateeg en de IT Business Consultant. Het strategieteam is een belangrijk onderdeel van onze dienstverlening. We willen de strategie propositie en het team de komende jaren verder uitbreiden.  Naast je samenwerking met de Marketing Strateeg, werk je ook nauw samen met de Techniek Lead en de Account Directors. Samen zorgen jullie ervoor dat de juiste uitdagingen van de klant boven tafel komen. Bij een groot analyse traject haken ook de business analist, de projectmanager en het multidisciplinaire development team aan. Functievereisten Heb jij het in je? Wat we in elk geval van je vragen: Een HBO/WO opleiding afgerond op het gebied van IT; Je bent inhoudelijk sterk op het snijvlak van IT en Business; Je bent business gedreven en zit met vertrouwen aan tafel bij directies; Je hebt kennis van agile en weet welke rol agile denken speelt in digitale transformatie; Je hebt sterke communicatieve en analytische vaardigheden; Je bent een teamspeler die denkt in oplossingen; Je hebt ervaring als consultant; Goede beheersing van de Nederlandse en Engelse taal. Wat vinden we bonuspunten waard:  Je bent bekend met digital commerce oplossingen; Je hebt kennis van B2B bedrijven en weet welke specifieke IT uitdagingen daar spelen;  Bij De Nieuwe Zaak kan je rekenen op deze arbeidsvoorwaarden: Voor je inzet krijg je een goed salaris en 27 vakantiedagen. En natuurlijk krijg je van ons een laptop, een leaseauto en een telefoonvergoeding.  De Nieuwe Zaak is een Full Service Digital Agency en sinds 2005 uitgegroeid tot één van de meest gerenommeerde en succesvolle digital commerce bureaus van Nederland. Met 90 experts helpen wij groothandels, retailers en brands met het oplossen van vraagstukken op het gebied van strategie, creatie, techniek en marketing.  Naast dat ons werk al ontzettend leuk is, hebben we samen ook veel plezier. Dit vinden we erg belangrijk. De cultuur bij De Nieuwe Zaak is te beschrijven als open, eerlijk, innovatief, kwaliteit, gedreven, samen en afspraak is afspraak.  Binnen De Nieuwe Zaak krijg je veel ruimte voor persoonlijke ontwikkeling. Je leert van en met elkaar, want samen kom je verder. Daarnaast neem je 5 keer per jaar deel aan onze Academy. Samen met jou werken we aan kennisverbreding en persoonlijke ontwikkeling. Ambities zijn er om waargemaakt te worden!  Corona Hoewel we het liefst fysiek met elkaar samenwerken, staat veiligheid voorop tijdens deze Corona tijd. Daarom biedt De Nieuwe Zaak haar werknemers de mogelijkheid om thuis te werken.  Word je na jouw sollicitatie uitgenodigd voor een eerste kennismaking, dan doe we deze online via Google Meet. We begrijpen ook heel goed, dat je nieuwsgierig bent naar hoe jouw toekomstige werkplek eruit gaat zien en hoe de sfeer is bij De Nieuwe Zaak. Daarom is de tweede ronde bij ons kantoor op in Zwolle. Hoewel er dan minder collega's zijn, krijg je toch een beetje een indruk hoe leuk het hier is ;)  Word je aangenomen? Dan vragen we nieuwe collega's om een aantal dagen op kantoor te komen, zodat je gelijk een goede start bij ons hebt.  Wil je graag meer weten? Dan kun je terecht bij onze recruiter Marjan van der Veen via 06 - 47 300 243 of marjan@denieuwezaak.nl.  Word jij onze nieuwe collega? Stel je aan ons voor door te solliciteren.",2021-03-16 14:45:58
4d2a1923147852b0,"This is Adyen We took an unobvious approach to starting a payments company, building a platform from scratch. Today, we're the payments platform of choice for the world's brightest companies. Our unobvious approach is a product of our diverse perspectives. This diversity, of backgrounds, cultures, and perspectives, is essential in helping us maintain our momentum. Our business challenges are unique, we need as many different voices as possible to join us in solving them - voices like yours. So no matter where you're from, who you love, or what you believe in, we welcome you to be your true self at Adyen. Business Analyst - Commercial We're looking for a hands-on experienced Business Analyst - Commercial for our Commercial Enablement team. As a Business Analyst - Commercial you will work with different teams (sales, marketing, partner management & finance) to ensure that the commercial teams have the insights to create focus and know how to get the most out of their efforts. Whether it is identifying the most impactful lead sources, providing regions with direction on industry & customer size focus, helping sales teams with quantifying their success; the role includes the full spectrum. From analysis and building scalable data tools to embedding them in the commercial processes. A large part of the job will be related to analytics, but the ability to translate analyses into action with broad adoption across our global teams is required. What you'll do Full funnel insights; working with our commercial teams to help them identify the most successful commercial flows (from lead to relationships) Market & customer insights; helping our commercial teams focus on the right merchants Sales effectiveness insights; helping our commercial leads to grow their team capabilities Create scalable reports that showcase commercial success for various parts of the business Data; whether it is cleaning (Salesforce) data, connecting data or analyzing it in order to create insights, the role includes it all Help other team members leverage our insights in their work (such as optimizing our commercial operations or trainings) About you You have +4 years of experience from an analytical role in a commercial environment You have experience with delivering analytical projects from beginning to end You have the ability to work in a high pace environment where you need to prioritize and continuously evaluate how to maximize your impact You have the skills to convert insights into tangible output such as optimized processes, tools, programs, reports & dashboards or trainings You are experienced in in telling compelling and actionable data driven narratives You have experience in follow up actions based on insights and driving change within a commercial organization You have experience with SQL Preferably you have experience in full funnel analyzes Preferably you have experience in Looker, Python or other data tools Who we are Adyen is the payments platform of choice for many of the world's leading companies, providing a modern end-to-end infrastructure connecting directly to Visa, Mastercard, and consumers' globally preferred payment methods. Adyen delivers frictionless payments across online, mobile, and in-store channels. With offices across the world, Adyen serves customers including Facebook, Uber, Spotify, Casper, Bonobos and L'Oreal. Ready to meet us? If you are excited about this role and looking for a next step, apply by clicking the below link. We can't wait to meet you!",2021-03-16 14:46:00
7c23a3db6dc849e3,"Salary range: 30-60k (depending on experience) The mission. The world does not need a slightly better website or app. What it does need, is an amazing Veriteer product manager that understands how to make consumers' lives better by crafting incredible interactions across all channels. Our product managers don't just wrangle stories and mindlessly go through the motions of Agile , they pull out all the stops to connect brand value to consumer value, drive product development and deliver measurable outcomes. Above all, like every Veriteer they have a clear passion for what they do and they raise the bar in every piece of work. If this sounds like you, we'd love to speak to you. In practical terms, here's the kind of thing you might get up to: As a product manager at Veriteer you will work on a variety of transformational projects to manage the vision of digital products for our partner brands. Practically, this means that you will do some or all of the following: Collaboratively develop product vision and direction for global brands; Create and refine detailed stories and requirements across multi-disciplinary Agile teams; Coordinate teams of business analysts, functional and technical experts and create amazing team culture; Plan and prioritise feature backlog and development of the products; Workshop and meeting facilitation; Test solutions to accept developed stories; Work closely with Product Leadership to integrate your product roadmap into programme and company objectives; Advise on eCommerce, Marketing or Customer Service capability best practices; Coach clients in product and agile methodologies; Engage senior executives to provide visibility of programme/project status; and Be an advocate for more effective ways of getting things done. In addition, you will get to be part of Veriteer's exciting adventure. We want to walk the talk, and demonstrate what good really looks like. This means bringing a range of project management skills to help our partner brands achieve better performance. You will be working both independently or as part of a project team depending on the project at both client sites and in our offices. The dynamic nature of our work means that your tasks can vary, sometimes day-to-day, and include workshop facilitation, preparation of documents and presentations, delivery of training and more. Our work often requires us to co-locate with our partner brands on their sites. We need passionate and ambitious product managers that can being the tip of the arrow on all of our work, both internally and for partner brands. The bit about you. As a product manager at Veriteer, you will have: Practical experience working with Agile methodologies in multi-team agile environments; Ideally, experience working with system integrators and technology vendors; Ideally, experience working with databases and APIs; Ideally, experience working in a consulting capacity on client-based projects; Ability to work under pressure whilst delivering against many conflicting priorities; A knack for communicating to executive stakeholders; and View of the big picture and an ability to develop effective business strategies. All Veriteers strive to achieve the incredible, and we believe that diversity will help us achieve this: Current capability is more important than background. It doesn't matter where you've come from if you can bring aptitude and experience to your role. Personal impact is more important than academic attainment. You can have demonstrated this in one or more of a business, creative or technology discipline. Teamwork is more important than individual skills. Although Veriteers will work in different ways, these must be compatible with, and tolerant of, all of your colleagues. We value people joining Veriteer from another career. This could be from the retail or FMCG industries, a strategy consultancy, a software development lab, project management or something completely different...just be clear about what you bring. Experience aside, we know what it takes to be a Veriteer. If the following sounds like you and the people you want to work with, then Veriteer will feel like home, so get in touch: You are honest You are collaborative You commit to the incredible You want everyone to value the time they spend with you The bit about us. Veriteer is a customer experience consultancy on a journey of rapid expansion. We partner with the world's biggest brands and high-growth startups to set customer-focused strategies, create successful customer experiences, and enable the delivery of ground-breaking initiatives. It's not easy to be a Veriteer, we're doing the stuff that no one else can do. So bringing someone new into the family is always our biggest decision, and our biggest investment. We come in all shapes and sizes, but we all back each other in our quest for the incredible. This means we share a number of key characteristics: We always believe that there is a better way; We are the calm in the storm; and We have a redoubtable will and an indomitable spirit. The small print. You must be able to work in the EU with no visa requirements or restrictions, and have no existing preclusion from working in the USA. You must be flexible to travel, including internationally. You will be provided with all technology, insurances and expenses to enable you to perform your duties as expected. Membership of a professional body is not required, but all professional certifications and memberships should be detailed in your application for this post. You must declare up front, any restrictions on the nature of work that you can perform, including any client-specific covenants in place that would limit your ability to work for them. Please note that have locations across Europe and the UK, so if this role is not in the right location for you, then contact us anyway, and see what we can offer.",2021-03-16 14:46:01
863505e836d10791,"Do you want to help take our brand to the next level?  Hey - we're Poki. Every day, 2 million users and 200 game developers come together on our web platform to play and create games. In the upcoming years, we want to establish our brand as the ultimate online playground and welcome players from all over the world. We’re looking for a data-savvy individual to join our User Growth team. You’ll pioneer our User Growth analytics projects around topics ranging from attribution, LTV, segmentation, and much more with the goal of helping us uncover insights that allow us to effectively grow our worldwide player base to 10M daily players and beyond. As an analyst on a rapidly growing team, you’ll have lots of ownership and the chance to have a big impact on our business. Is this you? Then read on!  Do you recognize yourself in the following? I’m self-motivated and highly responsible – I thrive on freedom I enjoy working fast, in a dynamic and agile environment  I'm always open to new ideas, perspectives, and solutions  I’m eager to learn and love to share  I'd love to work with a fun, informal, and diverse group of people Then we're looking for you! TL;DR:  We are looking for an analytical thinker who knows how to extract insights to build a connected story. You’re good at distilling complex information into digestible thoughts, and breaking down complicated topics in ways that make them understandable for diverse stakeholders. You keep a curious mind, always striving to understand more about the patterns that we see and are excited about testing those theories as a means to learn more and drive our goal to build the number one global brand in a sustainable way. Your challenge: #1: Generate insights - Looking into user behavior, you generate tactical and strategic recommendations to improve effectiveness of our User Growth efforts. From running experiments and creating user segments to deep diving into the journey of a single user, you’re eager to understand how we can consistently improve. #2: Present insights - Taking the team along in the insights you find. From presenting general user insights to the company to presenting dashboards with actionable campaign opportunities for the User Growth team, you know who to involve and how to present your findings. #3: Data enrichment - Connecting the dots in a smart and efficient way. From technically setting up tracking for new traffic sources to improving the logic we use for attributing value to those sources, you get that most value is in making the right connections. #4: Alignment - Aligning with the team that works on data infrastructure and key metrics, you help out with creating a unified structure that enables speed, agility, and alignment across the organization—one that reduces fragmentation. #5: Strategy - Checking in with the other analysts on a weekly basis, you understand the growth dynamics of a multi-sided platform like ours. You’re aware of our product strategy, experimentation, and the latest product releases. You: Have 4+ years work experience in an analytical role involving data extraction, reporting, analysis, and helping your team take action based on the analysis  Have experience in a user-centered digital product  Have exceptional analytical skills and attention to detail, with the ability to clearly communicate results and to define next steps  Have the ability to work independently and with a team in a fast-paced and dynamic environment  Have experience being accountable for and leading analytical projects  Have experience with marketing analytics concepts like LTV, segmentation, ROI analysis, etc. Have a strong background in SQL, basic proficiency in programming/scripting and knowledge of statistical packages like R or Python Are already based in The Netherlands, preferably around Amsterdam.  Bonus experience Have experience working in user growth (marketing) teams Have affinity with analytics for playful experiences or brands Have experience using: BigQuery, Data Studio, Google Adwords, DBT  We offer: A chance to build your career with our fast-growing tech company Deep understanding of how a multi-sided platform works, opportunity to broaden your knowledge/skills through education A diverse, talented and self-motivated team A full-time contract (32-40 hours/week) A competitive salary No formal hierarchy and a lot of personal responsibility and freedom Direct impact on the experience of our 30 million+ users, on our community of 200+ game developers, and on our network of brands",2021-03-16 14:46:03
9a09aa9aea2ab2b0,"Overview: InDomo designs together with clients a bespoke in-house marketing performance solution that drives business and brand performance.  Core of the solution is to progressively increase ROI by daily optimizing audiences, channels, media and content focusing on digital performance channels.  This is possible thanks to clearly defined E2E strategy with KPI's for each phase of the consumer journey linked with business KPI's, supported by the right in-house capabilities in one integrated team, an agile way of working and processes supported by an efficient tech stack.  Senior Campaign Performance Analyst Data gathering, structuring and dash-boarding. Drawing insights from the data analysis , reporting those & ensuring the quality of the data across the campaign is consistent. She/ He will work closer with the Campaign Performance Managers and the Data Managers. Responsibilities: Understand business requirements and provide data solution enabling insights driven action; Provides insights with business / channel specific performance metrics including: Revenue, customer satisfaction, visits, conversion, campaign impact, consumer insights, product insights etc.; Build actionable insights to optimize the consumer journey based on search and navigation behavior. Measure effectiveness of online solutions , and determine how to reach our customer segments in the best way by finding behavioral patterns and personalize their journey and offering; Create high-quality customer insights on existing customer base, identify opportunities for cross and upsell to existing base and find opportunities to reach new high value customers. Integrate data from CRM, search advertising, R&R, to define local market customer segmentation as basis for activation strategy; Drive increased adoption of data-driven decision-making and agile working; Analysing and identifying business opportunities to set data-driven priorities regarding the Strategy and Roadmap to drive strategy realisation; Proficient with analytic tools such as google analytics, power BI, Qlik, etc. Qualifications: 4 years’ experience in digital marketing analytics and optimization, preferably at multinational companies with brand, marketing and e-commerce experience; Understanding importance of data and analytics on continuous improvement of business results; Do whatever it take mentality , problem solving skills; Knows their way around data visualization tools such as Qlik, Tableau, PowerBI, Datorama; Hands-on experience with advertising platforms and web analytics tools; Experience with marketing mix modeling is considered a pre; Excellent communication and collaboration skills. What we offer As part of the WPP network, our benefits are incredibly comprehensive and you’ll have plenty to choose from. We’ve listed a few below - and there are many more on offer: Superb development opportunities and ongoing support throughout your career Light, open-plan office space with roof terrace, onsite bar and stunning views over central Amsterdam; Health insurance with Achmea and Zilverenkruis; Pension Scheme; WPP Group Discounts. WPP is an equal opportunity employer. We view everyone as an individual and we understand that inclusion is more than just diversity – it’s about belonging. We celebrate the fact that everyone is unique and that’s what makes us so good at what we do. We pride ourselves on being a company that embraces difference and truly represents the global clients we work with.",2021-03-16 14:46:05
