id,description,scrapetimesdescription86a228732baa77d3,"To get the best candidate experience, please consider applying for a maximum of 3 roles within 12 months to ensure you are not duplicating efforts. Job Category Products and Technology Job Details The Industry Cloud is a rapidly growing, strategic business for Salesforce. The Industry Product team is chartered to deliver deep vertical CRM products - disrupting each industry, one by one. We offer 12 Industry Clouds and many cross-industry products such as the recently launched Loyalty Management , Feedback Management and Scheduler . We bring the most innovative customer success platform that is designed and built for a specific industry. We are looking for a top Product Management professional to drive the growth of our cross-industry products. We are seeking a Product Evangelist for the Industry Common Layer Product team. As a member of this team, you’ll help grow the business for the product, enable Sales and Distribution teams, nurture the SI/ISV ecosystem. This role offers a unique opportunity to directly impact the product roadmap, vision, strategy and development. You have strong communication and people skills since you’ll be presenting in public, collaborating cross-functionally within Salesforce, and working side by side with developers every day.  Due to the breadth of responsibility, this role calls for a strong, proactive Product Manager capable of independently driving the product forward.  Responsibilities  Meet and exceed revenue and growth targets for Industry common layer products (Salesforce Feedback Management, Salesforce Scheduler & Loyalty Management) ACV as a quota carrier Work with PM and PMM to strategize key focus verticals and markets to meet the targets. Influence pipeline build/demand gen activities Orchestrate Sales enablement in the focus verticals markets Close the feedback loop with PMM, PM and Pricing Team to evolve product pricing, DAM, Solution plays to capitalize on the market opportunities and grow the Product AOV Work closely with vertical cloud Product Evangelist to ensure common layer products are positioned in their sales plays to achieve the targets Drive SICs and DSRs with strategic customers Be the Voice of the customer to influence product direction for the common layer products Build a pipeline of Reference Customers and the Business Impact (Value Study) from implementing the solution which will help drive revenue Influence product roadmap and participate in build/buy/partner strategy discussions based on the local and vertical market opportunities Collaborate with OU marketing teams to drive demand-gen activities for common layer products Conduct functional and technical deep-dives of common layer products with customers, prospects and partners Drive industry narrative for the common layer products thus winning external and internal mindshare Work with Demo Teams (supported by SEs and PMs) for packaged vertical demos in the landscape Maintain relationship with Sales leadership across different geographies to drive ACV, growth and AOV Jointly identify Sales plays with distribution for Industry products and industries and influence Sales strategy to ensure growth Identify, foster and manage relationships with top ISV partners to build on top of common Layer Products Represent Salesforce as a product expert at customer interactions, industry and corporate events, and through community sites and social media.  Key Competencies  Deep expertise in Salesforce platform and applications Industry/domain knowledge is preferred but not mandatory Leadership - proven ability to set a vision, excite and lead (directly and/or by influence) cross-functional multidisciplinary teams composed of account executives, sales engineers, product marketing managers, CSG, etc. Experience in scaling a nascent business to a multi-million dollar run rate 12+ years of product management or equivalent experience with demonstrated ability to discover opportunities, define and deliver impactful solutions for customers Strong technical abilities to hold your own in debates with technical architects and engineers. You are intimately familiar with modern software development practices used to build and deploy web and mobile applications. Effective communicator - Communicates well with engineering and cross-functional teams; can effectively present plans and roadmap to internal stakeholders and C-Level execs; comfortable pitching their product to diverse external audiences (customers, partners, and analysts); strong ability to convince and influence Entrepreneurial mindset, possess a high energy level to react to situations quickly and decisively, possessing self-confidence to be assertive when taking a position, not afraid to make decisions. Experience identifying and addressing customer needs, building relationships with customers, developing an awareness of relevant services, communicating with customers in an organized and knowledgeable manner, and delivering clear requests for information LI*Y Accommodations - If you require assistance due to a disability applying for open positions please submit a request via this Accommodations Request Form. Posting Statement At Salesforce we believe that the business of business is to improve the state of our world. Each of us has a responsibility to drive Equality in our communities and workplaces. We are committed to creating a workforce that reflects society through inclusive programs and initiatives such as equal pay, employee resource groups, inclusive benefits, and more. Learn more about Equality at Salesforce and explore our benefits. Salesforce.com and Salesforce.org are Equal Employment Opportunity and Affirmative Action Employers. Qualified applicants will receive consideration for employment without regard to race, color, religion, sex, sexual orientation, gender perception or identity, national origin, age, marital status, protected veteran status, or disability status. Salesforce.com and Salesforce.org do not accept unsolicited headhunter and agency resumes. Salesforce.com and Salesforce.org will not pay any third-party agency or company that does not have a signed agreement with Salesfore.com or Salesforce.org. Salesforce welcomes all.",2021-03-16 14:54:25
6c8c8a73316b1f8d,"DATA - RESEARCH ANALYST | Rotterdam | 40 uur per week | €2222 - € 3478 USP zoekt GEEN schaap met 5 poten! Wij zijn op zoek naar starters voor de functie Research Analyst. Wat verwachten we van jou? - HBO/WO werk- en denkniveau - Ervaring met SPSS en Microsoft Office - Affiniteit met marktonderzoek - Doorzettingsvermogen, analytisch inzicht, stressbestendigheid Wat doet een Research Analyst in 40 uur bij USP? · 12 uur programmeren · 8 uur analyseren · 8 uur rapporteren · 6 uur veldwerk monitoren · 4 uur intern overleggen · 2 uur klantbezoeken Wat mag jij van USP verwachten? Van USP mag je verwachten dat je de kans krijgt om veel te leren en je door te ontwikkelen. USP is een fullservice marktonderzoeksbureau dat gespecialiseerd is in de bouw- en woonwereld. Een bedrijf dat trots is op de Rotterdamse mentaliteit, want USP’ers zijn doorpakkers! Dit leidt ook tot de nodige successen in het buitenland, 70% van de omzet is afkomstig van grote internationaal erkende merken. Bij USP heb je zelf je carrière in de hand, dus als jij ons laat zien wat jouw ambities zijn geven wij jou de kans om deze waar te maken. Soort dienstverband: Fulltime, Onbepaalde tijd Salaris: Vanaf €2.222,00 per maand Opleiding: Master (Vereist) Locatie: Rotterdam (Aanbevolen) Taal: Nederlands (Vereist) Thuiswerken: Nee",2021-03-16 14:54:26
7bb6e1c36ead466e,"Urban Arrow zoekt een Product Owner IT Amsterdam, 32-40 uur Fasten your seatbelt and enjoy the ride! En dat bedoelen we letterlijk want we groeien hard door en zijn daarom dringend op zoek naar versterking. Heb jij ruime digitale ervaring in een productie/handelsbedrijf in een functie als bijvoorbeeld projectmanager/product owner. Heb jij aantoonbare stakeholder management skills en kennis van dealerportals en digitale marketing technieken? Dan dagen wij jou uit om te solliciteren op deze gave rol van Product Owner IT. Wie zijn wij? Urban Arrow is koploper in stedelijke mobiliteit en dat willen we blijven. We hebben de elektrische transportfiets internationaal op de kaart gezet. Maar we zijn er nog niet. We groeien in recordtempo daarom willen we onze processen verder automatiseren en ons IT landschap uitbreiden en vernieuwen. Wat zoeken we? IT is een belangrijke pijler in de groei van Urban Arrow. Met een beweging naar meer digitalisering van onze fietsen, groei van zowel consumenten als zakelijk gebruik van onze fietsen en de snelle groei van de organisatie wordt het steeds belangrijker dat onze dealers en klanten makkelijk informatie kunnen vinden over onze producten en services via nieuwe digitale kanalen (web, app, mobile) en dat interne platformen goed op elkaar aansluiten. Door de ambitie om meer fietsen de maken en leveren, om onze impact groter te maken, zoeken we nu een Product Owner IT die een helpt om digitale platformen te ontwikkelen. In deze rol rapporteer je direct aan de IT (Transformatie) Manager en werk je binnen IT samen met een Business Informatie Analist en een Product Informatie Manager. Daarnaast werken we intensief samen met collega’s van ons moederbedrijf Pon (voor integraties via Mulesoft, IT services en Software Architectuur voor ons dealerportal op basis van Mendix). We werken op dit moment op een aangepaste agile manier geïnspireerd door de Shape up methodologie van Basecamp. Welke verantwoordelijkheden vallen onder de Product Owner IT Je wordt in het IT team verantwoordelijk voor een selectie van bestaande IT producten zoals dealerportal, WMS en integratie laag (Mulesoft) en nieuwe producten zoals IOT, CRM en ERP; Je neemt eigenaarschap over jouw producten en ontwikkelt een visie (lange termijn) en tactiek (korte termijn) voor verdere doorontwikkeling; Hierbij betrek je actief en in de juiste mate alle stakeholders om tot gedragen oplevering van functionaliteiten te komen; Je zorgt voor een vlotte samenwerking binnen de verschillende ontwikkelteams (extern), interne stakeholders en externe consultants met een fail-fast, startup mentaliteit; Je neemt de leiding als belangrijke beslisser en stelt de juiste prioriteiten voor de verschillende teams rondom jouw producten; Ophalen en challengen van requirements en vertalen in epics, stories en acceptatie criteria; Je helpt als teamlid om het IT team betere resultaten te laten behalen en stimuleert de groei van het team;  Wat vragen we van jou: Wie zoeken we? Jij brengt mee: Een Bachelor of Master degree in Engineering, IT of business administration; 5-10 jaar digitale ervaring in een productie/handelsbedrijf in een vergelijkbare functie (projectmanager/product owner) Je hebt genoeg kennis om technische afwegingen te maken; Hebt ruime ervaring met business software. processen en product data structuren in maak/productie/supplychain bedrijven, zowel het analyseren als signaleren en implementeren van verbeteringen; Goede stakeholder management skills richting zowel business als IT; Specifieke kennis en/of ervaring met Dealerportal, digitale marketing technieken of CRM; Je brengt een combinatie van analytisch vermogen, teamgeest en overtuigingskracht met je mee; Het is een plus als je concrete ervaring hebt met Lean / Six Sigma / Value stream mapping. Je kan een afweging maken welke verbeter tools bij welke problemen passen; Kennis over het managen van agile development processen; Interesse, ervaring en kennis over nieuwe IT technologies; Je woont in Nederland bij voorkeur in en om Amsterdam; Sociaal, optimistisch en zelfverzekerd vormen een deel van jouw DNA.  Wat bieden wij: Wat bieden wij? Een kans om bij te dragen aan de stad van de toekomst; het terugdringen van busjes en auto's en het bereikbaar houden van de stad. Een team met zeer gemotiveerde en enthousiaste collega's waarbinnen we naast hard werken ook dagelijks een lolletje maken. Een open en eerlijke bedrijfscultuur waarbinnen we ruimte bieden voor jouw talent en ontwikkeling. Ook krijg je de vrijheid om je ideeën te delen. Gezamenlijk lunchen Wanneer het allemaal weer kan een toffe Vrimibo en gave team / bedrijfsuitjes. Een Urban Arrow family of Shorty lease fiets voor eigen gebruik; Een spiksplinternieuw kantoor met eigen dakterras en alle luxe van dien.  Iets voor jou? Ben je enthousiast geworden. Leuk! Laat ons weten wie je bent en stuur je cv en korte motivatie. Doe vooral niet te plechtig en laat jezelf zien. En deel vooral alles waarvan je denkt dat wij het moeten weten. Projecten waar je trots op bent, je favoriete hobby... Kom maar door! Wij kijken uit naar je sollicitatie!",2021-03-16 14:54:28
d1a20484d57d6c74,"Company Description  We are on a mission to be the easiest and most reliable way to arrange home services, connecting homeowners with qualified service professionals. We operate the market-leading brands in France (Travaux.com) and the Netherlands (Werkspot.nl) and expanding in Italy (Instapro.it). Our Product, Technology & UX department consists of approximately 100 talented professionals, deeply passionate about creating beautiful digital marketplaces.  Job Description  Team & Technology We are forming a new product team that will focus on improving our ‘paid acquisition’ efforts related to acquiring demand (a.k.a homeowners with jobs to be done) on our marketplace. An example of a paid acquisition is buying an advertisement on google (via google adwords) for upper funnel keywords such as “install an air conditioner”, “find a painter in amsterdam” etc. As a Data Scientist, you will be a part of the newly formed ‘Paid acquisition’ team, together with other backend and frontend engineers, a user experience specialist, an agile coach, a business analyst, and a product manager. Our marketing department will be a key internal stakeholder of this team. Within this team, you will use your analytics, advanced data science and machine learning skills to build effective models and measure their efficiency. You will also support the experiments from hypothesis to analysis and interpretation. You will also be part of the data guild, collaborating with other data scientists, data engineers and data analysts across the company to align on the data strategy, development standards, and exchange knowledge and experience. Your responsibilities Join a cross functional team that aims to support and boost our paid marketing strategy Contribute to build an automated campaign management system Use data intelligence (revenue prediction models, measure incremental performance of campaigns, identify the right keywords…) to improve the performance of our marketing campaigns Drive innovation by using recent advances in machine learning, imagining new experiment methodologies and statistical techniques Work with the product owner to understand user goals and requirements alongside stakeholders and customers Summarise and communicate conclusions and solutions to analytic and non-analytic stakeholders  Qualifications  Your skills and experience You have 4+ years of experience as a Data Scientist You have 2+ years of experience in marketing analytics with a proven track record of delivering projects from conception to production Advanced skills in analytics, statistics, building experiments and A/B testing You have advanced Python skills (including clean and well-tested implementations) You have an understanding of digital media (social, search, display) You have familiarity with marketing tracking platforms (mainly Google Ads) Advanced SQL skills You apply software engineering principles to your projects by writing maintainable, testable and documented code You are a team player who contributes to a collaborative atmosphere You are reliable, communicative and business-minded  What we offer We have offices in both Amsterdam and Aix-en-provence. We offer a great working environment in either of these offices (once we go back to the office) Flexible working hours and remote working to accommodate personal needs A competitive salary Personal growth budget and time for attending training courses and conferences Relocation budget if coming from abroad (once it is safe/possible) 25 days of annual leave Pension arrangement Lunch allowance (even with the current remote working situation) Free fitness in our building (once it is safe/possible) Frequent and fun events with the entire company to celebrate achievements and milestones  Additional Information  How we are organised: Our Product, Technology and UX department currently consists of 4 tracks and approximately 100 professionals, from all over the world: Brazil, Canada, India, France, Greece, Ireland, Israel, Italy, The Netherlands, South Africa, Paraguay, Poland, Portugal, Russia, Spain, Turkey, the UK, and the USA. Each track focuses on the most valuable opportunity within their given scope. Within the tracks, multidisciplinary product development teams collaborate on achieving the goals that they set and commit to each quarter. We approach our decisions in an experiment-guided and Agile way: we validate new directions using a variety of quantitative and qualitative research methods. Our shared values: We believe our success starts with sharing the same values when it comes to how we work. These values are the foundation of everything we do, and you’ll experience them on a daily basis. Our values are: Be stronger together; Aim high; Take ownership; Be transparent and respectful; Be open-minded and curious; Embrace diversity; Focus on our customers. The company culture in our organisation is very open and inclusive; we are committed to building teams that represent a variety of backgrounds, perspectives, and skills. Special note related to COVID-19 We will be hiring mostly through online video interviews. In-person interviews can be scheduled for candidates in the Amsterdam area, with the agreement of both parties. The position is based in Amsterdam and requires relocation to the Netherlands. Note that in-line with the current government (RIVM) recommendations, we are currently working from home. We will do our best to make the on-boarding as smooth as possible and help you get up-to-speed. Is this for you? Send your resume with a brief explanation of why you are highly motivated by this role. You can apply via the “Apply” button or by sending your information to Samy Bouras, Data Lead at Werkspot, Travaux and Instapro. We’re looking forward to meeting you!",2021-03-16 14:54:30
d9318604abd4fb64,"Currently our client, active in the international construction world, has a vacancy for a: Business Analyst  You get energy from collecting and analyzing relevant data. As a Business Analyst you identify and generate key analytics to support the commercial and financial operations in order to meet the company goals such as margin and volume improvement. You make different recurring analyses in the SAP Analytics Cloud tool and Excel. You create dashboards, reports and analyses in order to highlight the results of the company’s activity and its market. You report to the Commercial Finance Manager EMEA. Your tasks: Generate daily sales reports and market information reports; Create, manage and present dashboards for internal customers and key stakeholders; Gain insight into the numbers and identify important insights; Translate business challenges to analytical questions; Constantly looking for improvement of reporting systems; Ensuring that all business decision-makers use standard data and insights; Support the periodic forecasting process, both for operational planning and financial planning; Price / margin / volume analysis; Reference prices; Monitoring cost and market price developments; Participation in (international) group projects.  Vacancy for a Business Analyst in Lelystad Profile candidate: A completed Bachelor degree in a Business, Marketing or Economics; Has excellent analytical skills, in order to master the reports produced by computersoftware and to understand their meaning in business terms; Excellent production and reporting skills (Excel / Powerpoint); Prior experience with data visualization tools is a plus; Good command of the Dutch and English language, both written and spoken (German is a plus). Personal Characteristics: Accurate and Solution-oriented; “Change mindset”; Flexible; Stress resistant; Communicative; Persuasiveness; Sense of humor.  Our client distributes high quality industrial nail, staple and screw systems and fasteners for the construction and wood processing industry to all European countries, the Middle East and Africa (“EMEA”). Our client is a well-known name in the international construction world. In addition to the EMEA head office located in Lelystad, it has offices in 15 countries within Europe.  Interested?If you are interested in making a substantial contribution to a purpose driven international company, this is an interesting opportunity for you! Our client offers an attractive salary package and opportunities for personal development and growth.You can apply to this vacancy via the button 'direct solliciteren'. If you would like more information about this vacancy, please contact Vincent van Middelaar of Employment Services (06-22423197/ v.vanmiddelaar@employmentservices.nl) or Hendrik Roeleveld, (06-57679413 / h.roeleveld@employmentservices.nlEmployment Services is responsible for the recruitment & selection of suitable candidates for this vacancy. You can find more information on www.employmentservices.nl#Vacancy, #Lelystad, #Reporting, #Dashboards, #Finance, #Marginanalysis, #Economics, #Marketing, #Business",2021-03-16 14:54:31
aa3de36fe4d45f0c,"Functieomschrijving  Description: Philips challenges you to use your analytical and project management skills to create growth for our business and yourself. The goal is to turn data into information, information into insight and insight into global business decisions. You will be responsible for conducting full lifecycle analysis to include requirements, activities and design; develop analysis and reporting capabilities; and monitor performance and quality control plans to identify improvements.  Your responsibilities As a Digital Data Lead, you will : Support the growth and development of our Coffee Digital platforms (web, app, appliance) Interpret data, analyze results using statistical techniques and provide ongoing reports Develop and implement databases, data collection systems, data analytics and other strategies that optimise statistical efficiency and quality Acquire data from primary or secondary data sources and maintain databases/data systems Identify, analyse, and interpret trends or patterns in complex data sets Work with management to prioritize business and information needs Locate and define new process improvement opportunities Build predictive models and define machine-learning needs  Your team You will be part of the Coffee team in Amsterdam a dedicated group of Marketers, business developers digital Managers within the Business Group Domestic Appliances. As a Digital Data Lead, you will be the key contact between Coffee and all relevant ‘data’ partners across the company (e.g. I&D team and supplier, Marketing Intelligence, Business Group & Commercial Organization Market 2 Order teams, Strategy etc….) and outside (e.g. ecosystem partners etc).  Our offer We welcome you to a challenging, innovative environment with great opportunities for you to explore.  Functie-eisen  We are looking for Experience & Qualifications & Knowledge Proven up to 5 years working experience as a Data scientist / Analyst Technical expertise regarding data models, database design development, data mining and segmentation techniques Strong knowledge of and experience with reporting packages (Business Objects etc.), databases (SQL etc.), programming (XML, Javascript, or ETL frameworks) Knowledge of statistics and experience using statistical packages for analysing datasets (Excel, SPSS, SAS etc.) Strong analytical skills with the ability to collect, organise, analyse, and disseminate significant amounts of information with attention to detail and accuracy Adept at queries, report writing and presenting findings BS in Mathematics, Economics, Computer Science, Information Management or Statistics  Personality Characteristics Confident communicator capable of inspiring strong collaboration in an organisation Very organised and good at planning Entrepreneurial with creative nature Results driven and pro-active Ability to identify and solve problems Self-reliant and Change leader  Arbeidsvoorwaarden  If you want to be part of this project, please share: CV in English Motivation in English Availability Holiday planning",2021-03-16 14:54:33
