id,description,scrapetimesdescription
f38f8ab10231e0c3,"About Our Client My client is a leading global developer, manufacturer and marketer of innovative medical technology and consumables used for the diagnosis and treatment of pelvic health in the Urology, Gynecology, and Colorectal fields as well as gastrointestinal procedures. Job Description * Creating sales analytics using dashboards (Power BI) to understand the business in greater detail and ensuring the commercial team have granular targets that are consistent with the group's strategy. * Support the Commercial team to provide insights into the business and establish, implement and contribute to the achievement of commercial objectives. * Maintain and Update CRM tool and regular training and support of the commercial team as needed. * Maintain and improve existing commercial reporting on Power BI. * Work closely with Sales, Operations, Marketing to understand and challenge product sales forecast (including understanding all inputs and assumptions). * Involve Director of Finance Europe and other team members in areas of complexity, risk mitigation and strategic importance. * Lead continuous improvement of Commercial and financial tools, business models, Commercial planning, and processes that can scale with the company's growth. * Budget preparation and tracking of actuals vs budget by product line, business units and regions. * Prepare monthly forecast updates by region. * Track and support Finance KPI to management/board presentations. * Responsible for preparation and tracking of Opex budgets as well as analysis deployed to budget owners. * Analysis of gross margin by product - mix tracking. * Support the Director of Finance in ad-hoc Corporate analysis as needed Great Opportunity Exciting work place The Successful Applicant * BS/BA in Accounting, Finance or related field. * Highly proficient in excel and Power BI. * 2+ years in progressive commercial roles, preferably in medical device, consumer goods and/or pharmaceutical companies. * Experience in commercial analytics and budgeting, within an evolving commercial organization with global locations. * Excellent communication and presentation skills, both oral and written. * Proven ability to build strong partnerships across the organization, influence others, and work collaboratively within a team-oriented environment. * Able to effectively coordinate efforts across the organization (both internally and externally) to achieve key objectives; demonstrated ability to work effectively in a highly-matrixed organization. * Fluent in written and spoken English. What's on Offer The firm is focused on creating new and exciting career opportunities and professional challenges for existing and prospective employees. In addition to working with great people, we promote a supportive work culture and offer competitive compensation, comprehensive benefits programs, as well as many opportunities for career advancement",2021-03-16 14:44:03
fd0e0fe1bc009671,"Role/Responsibilities This role is responsible for working with other sales colleagues and internal stakeholders to drive the sales process for RDC solutions within the French and BeNeLux mid-market finance and corporate clients and prospects. Key activities include identifying and qualifying prospects, initiating new sales activity and managing sales cycles to closure. Additionally, the role requires the assessment of client needs and providing clients with strategic guidance and product overviews.  Responsibilities: Meet or exceed annual sales goals and targets that align with the company’s vision and objectives. Work with sales colleagues and other internal stakeholders to drive the sales process from beginning to end by identifying and qualifying prospects, initiating new sales activity and managing sales cycles to closure. Drive the development of business within assigned territories. Build relationships across client and prospect organizations to maintain desired pipeline levels. Partner with Solution Specialists to develop clear, concise proposals and deliver targeted client demos that address client needs. Collaborate with Product Management and Product Strategy to promote improvement in product quality and the development of new sources of revenue. Assess the needs of the client by identifying specific cause of underlying problems and proposes innovative solutions based on their business requirements. Identify additional products and services that clients may benefit from and introduce them appropriately into dialogue with clients. Begin development as a market expert and provide product/service use cases during the sales cycle. Serve as the main liaison between the client service team, the client and the implementation services organization on each services opportunity. Coordinate Moody's Analytics responses to requests for product and services information from prospects and clients. Assist in the preparation and circulation of market insight comments to create awareness of Moody's expertise internally and externally. Assist in the training of new team members. Provide current forecasts and pipeline information to management. Position requires travel (approximately 20% to 40% of your time Covid Permitting). Qualifications Undergraduate/first-level degree (e.g., Bachelor’s degree) required, with coursework in business, economics, finance, marketing or related fields. The role will be targeting French/BeNeLux speaking territory and require excellent verbal/written communication and presentation skills in both English and French or Dutch. Experience working in direct business-to-business sales roles with a focus on serving financial services and/or corporate treasury customers. Solid understanding of different parts of the global financial services industry, including market dynamics and customers’ business drivers. Ability to present high-level information as well as detailed demonstrations of products & services. Ability to work both independently and within a team environment, with focus and high attention to detail. LOB/Department RDC is now a Bureau van Dijk and Moody’s Analytics company!  RDC specialises in 3rd party screening and monitoring solutions for Anti-Money Laundering (AML), Know Your Customer (KYC), Anti-Bribery & Corruption, and Politically Exposed Person risk management.  As a data-driven technology business, RDC meets a client’s key challenge of reducing the time and effort taken to successfully assess and monitor all counterparties for pertinent risks, whilst improving the accuracy of decision  RDC’s AI Review solution allows clients to utilise a proprietary ML model, trained on over 12 million profiles curated over 20 years, then augmented to suit the client’s risk appetite, and reduces Line 1 analysts workload by as much as 80%  By improving the speed, consistency, transparency and scalability of 3rd party screening and monitoring processes, RDC is uniquely placed to help clients to make better, faster decisions, reducing the risk of financial and reputational damage in a fast-evolving regulatory landscape  Job Req ID 19868BR Entity Moody's Analytics (MA) Line of Business Bureau van Dijk (BvD) Regular/Temporary Regular City Amsterdam, Brussels, London Job Category Sales & Marketing Job Sub Category Sales Experience Level Experienced Hire Working at Moody's Moody's (NYSE: MCO) is a global integrated risk assessment firm that empowers organizations to make better decisions. Our data, analytical solutions and insights help decision-makers identify opportunities and manage the risks of doing business with others. We believe that greater transparency, more informed decisions, and fair access to information open the door to shared progress. With over 11,000 employees in more than 40 countries, Moody's combines international presence with local expertise and over a century of experience in financial markets. Learn more at moodys.com. Entity Moody’s Analytics provides financial intelligence and analytical tools supporting our clients’ growth, efficiency and risk management objectives. The combination of our unparalleled expertise in risk, expansive information resources, and innovative application of technology, helps today’s business leaders confidently navigate an evolving marketplace. EEO Policy Moody’s is an equal opportunity employer. All qualified applicants will receive consideration for employment without regard to race, color, religion, sex, national origin, disability, protected veteran status, sexual orientation, gender expression, gender identity or any other characteristic protected by law. Securities Trading Policy (STP) Candidates for Moody's Corporation may be asked to disclose securities holdings pursuant to Moody’s Policy for Securities Trading and the requirements of the position. Employment is contingent upon compliance with the Policy, including remediation of positions in those holdings as necessary.",2021-03-16 14:44:06
502f1644239f4d41,"Krijg jij energie van een dynamische werkomgeving waarin je veel schakelt met diverse stakeholders? Heb je een sterk commercieel inzicht en ben je een kei in het analyseren van data? Vind je het leuk om meerdere projecten naast elkaar te managen en om nieuwe kansen te spotten? Lees dan snel verder! Wat ga je doen? Als Commercial Strategy Analyst binnen Holland & Barrett heb je een afwisselende en uitdagende functie. Met jouw oog voor detail en uitstekende adviesvaardigheden ben je in staat om overtuigende ‘storylines’ te creëren richting jouw stakeholders (inclusief directieniveau). In deze functie ben je namelijk één van de belangrijkste sparringpartners voor datagedreven werken in de Benelux. Je houdt je voornamelijk bezig met het geven van advies op basis van omzet- en margeanalyses en customer insights (teneinde de klanttevredenheid en merkloyaliteit te kunnen verhogen). Verder houd je je onder andere bezig met: het analyseren van kansen, ontwikkelingen en trends het ondersteunen van category management, digital, marketing en merchandising teams voor besluitvorming en strategie, door middel van excellente datagedreven advies, inzichten en rapportages het bijdragen aan het verder optimaliseren van operationele processen in ons distributiecentrum en onze winkels het verbeteren van onze markt- en klantkennis Jouw scope zal echter breed zijn, met veel ruimte en vrijheid in je functie! Holland & Barrett groeit snel, waardoor je echt waarde zal kunnen vinden en toevoegen op veel plekken binnen de organisatie. In deze functie rapporteer je aan Jeroen, onze Finance & Data Business Partner (hij bekleedde de functie van Commercial Strategy Analyst hiervoor). Je zal ook nauw samenwerken met de (Benelux) directie en de collega’ in de UK (met name voor projecten). Profiel Je beschikt over wo werk- en denkniveau (Bedrijfskunde, Economie, Analytics) Je hebt circa 3-5 jaar relevante werkervaring opgedaan in een soortgelijke functie Je hebt een achtergrond in (strategie) consulting (bijvoorbeeld in de advisory tak) of retail, inclusief ervaring met commerciële-en klantgedreven analyses Je beheerst zowel de Nederlandse- als de Engelse taal goed in woord en geschrift Je beschikt over sterke analytische- en probleemoplossende vaardigheden Je bent behendig in het werken met (meerdere) grote datasets om hier hét inzicht uit te halen Je kunt goed overweg met het MS-Office pakket; met name Excel en PowerPoint kennen voor jou geen geheimen Je hebt ervaring (of je bent bereid om dit te leren) met ‘advanced analytics tools’ zoals Alteryx/Knime, SQL en Python/R met bijbehorende statistische technieken. Je kunt je bovendien vinden in de volgende eigenschappen: communicatief sterk, creatief, zelfredzaam, ondernemend en een uitstekend oog voor detail. Wat wij je bieden Dit is jouw kans om de strategie en tactics van de grootste health-&-wellnessretailer van de Benelux vorm te geven! Holland & Barrett biedt een interessante functie in een succesvolle en informele omgeving aan, waarbij er ruimte is om jezelf te ontwikkelen en nieuwe ideeën te realiseren. Binnen onze organisatie zijn doorgroeimogelijkheden een prioriteit. Verder bieden we een goed salaris welke afhankelijk is van jouw ervaring. Tevens hebben wij goede secundaire arbeidsvoorwaarden zoals personeelskorting, pensioenregeling, 28 vakantiedagen, een eigen training Academy, gratis fruit, een eigen gym op kantoor (maar momenteel werken we natuurlijk vanuit huis) en diverse collectiviteitskortingen op zorgverzekeringen. Sollicitatieprocedure Heb je interesse in deze functie? Solliciteer dan direct met jouw CV en motivatiebrief via de solliciteerbutton op onze website. Indien je positief bent geselecteerd dan word je uitgenodigd voor een telefonische screening met onze recruiter. Mocht je na deze screening positief worden bevonden, dan plannen we zo snel mogelijk een eerste sollicitatiegesprek met jou in. Je kunt maximaal twee gespreksrondes verwachten. Een case kan onderdeel uitmaken van de procedure. Over ons Holland & Barrett is een van de meest geliefde en vertrouwde merken in biologische voeding, vitaminen, supplementen en clean beauty, allemaal verkocht door goed opgeleide en gekwalificeerde adviseurs. Holland & Barrett heeft meer dan 1.300 winkels wereldwijd, waarvan meer dan 230 in Nederland en België. Met meer dan 1300 werknemers in de winkels en het hoofdkantoor in Amsterdam, is de Benelux de grootste van Holland & Barretts internationale markten én een van de meest concurrerende. Holland & Barrett is sterk gegroeid over de afgelopen jaren, en onze groei is de laatste tijd – om overduidelijke redenen – alleen maar versneld. Ondertussen hebben we onze operatie en cultuur versterkt om nóg klantgerichter te worden, en de wereldwijde leider in health en wellness. We nodigen jou uit om hieraan deel te nemen en om verdere groei als echte omnichannel retailer mogelijk te maken.  * Acquisitie naar aanleiding van deze vacature wordt niet op prijs gesteld. Aan CV's die ongevraagd worden aangeleverd kunnen geen rechten worden ontleend.*",2021-03-16 14:44:08
bad53955967899b1,"Sous la responsabilité du tuteur, vous devrez fournir un soutien analytique et apporter des recommandations aux départements marketing et au Customer Management Office, dans le but de d'augmenter les ventes et la satisfaction des clients aux Pays Bas. Votre domaine de compétences couvrira l'ensemble du parcours clients en ligne. Dans le cadre de cette mission, vous développerez des compétences techniques et comportementales dans les domaines suivants :  Marketing : Coordonner la préparation des business reviews Mesurer l'impact des campagnes marketing sur l'activité digitale et fournir des recommandations pour les campagnes à venir, Concevoir les objectifs online des campagnes en collaboration avec les équipes marketing, Fournir des analyses concernant le profil de nos utilisateurs/acheteurs,  Digital : Participer à la définition des objectifs digitaux pour les années suivantes en coordination avec les stratégies marketing, Analyser l'expérience client sur les sites et optimiser en mettant en place des A/B Tests, Mesurer quotidiennement les performances digitales et améliorer les dispositifs en coordination avec les différentes équipes et/ou prestataires, Développer des rapports et dashboards permettant de mesurer l'impact des campagnes marketing, Participer à la mise en place des nouveaux projets digitaux, Profil  Vous êtes diplômé(e) d'un Master en business administration/digital marketing/marketing ou autre domaine lié  Maîtrise avancée d'Excel, Powerpoint, Google Analytics, Power BI et Datastudio.  Vous faite preuve d'autonomie et de rigueur et savez présenter de manière ludique vos découvertes.  Vous aimez exploiter la donnée, avez une grande capacité d'analyse et savez traduire ces données en actions concrètes.  Vous parlez un Anglais courant, le Néerlandais est un plus. Durée du contrat 24 mois Poste à pourvoir le 01/07/2021 Localisation du poste Pays Europe, Hollande Ville Amsterdam Critères candidat Niveau de diplôme préparé Bac+5 Langues Anglais (C1 - Courant (3,5 - 4,4 Bright))",2021-03-16 14:44:10
50324b818d87621a,"Fancy the task of supercharging our App marketing strategy? Think you can decipher the data and perfect our implementations? Enjoy being part of an ambitious, cutting-edge team in our HQ in Amsterdam? Then you could be the App Tracking Specialist we're looking for… Our story (the bitesize version) We've grown from an attic start-up to become Just Eat Takeaway, a global food delivery powerhouse. With customers across 24 countries, we take millions of orders every day from Amsterdam to Auckland! What you'll do as a Performance App Tracking Specialist: Our measurement specialists are the experts at capturing all relevant data with a high accuracy in a GDPR compliant way., using a wide range of tools, platforms and strategies. This position is a varied role packed with exciting challenges. Data skills are a key part of this role. It's your job to help us in setting up, implementing and maintenance of App tracking and platform connections. You'll perform data analysis, validation and maintaining data quality of the app marketing workflow while working closely with our App Developers. You will implement and maintain our performance marketing app tracking setups. You perform data analysis, validation and maintaining data quality of the app marketing workflow. You co-develop and manage the app channel tracking strategy with the rest of the team. Maintain and further improve Universal / App Linking and App Deep Linking efforts. You perform campaign analyses and review and resolve current ad fraud detection and prevention efforts. Keep a close eye on new market developments; IOS14, SDK features, GDPR. You work closely with our App Development team. Your profile You have at least 2-3 years working experience as App Analyst, App Marketing or App Tracking specialist. You have the ability to collaborate with technical and non-technical teams. You're an expert in using Adjust, Firebase & GTM. You have a good understanding of Google Analytics, DV360, SA360, Facebook, mobile remarketing partners, SQL and dashboarding software like Tableau. You know exactly how data is gathered, processed by the different tools and are strong in deriving actionable insights. You know how to find improvement points and troubleshoot tracking implementations on App applications. A basic level of knowledge regarding specialisms (SEA, SEO, Display, App, Affiliate, etc) and related tools and technologies. You relish working in a team and enjoy collaborating and sharing knowledge with your peers You have a sense of ownership and pride in your performance and its impact on the company's success You are a critical thinker with outstanding problem-solving skills Knowledge of BigQuery or CDP/DMP implementation is a nice to have Our offer The freedom to go where no one in our company has gone before; Possibilities to strengthen your skills and grow in the role; Work in a fast-growing company; Being part of a young, professional and international team; A competitive salary; Custom workstations/laptops (Mac/Linux/PC); Opportunity to join native language courses; Traveling between the different office locations Awesome company events; Free drinks and fruits.",2021-03-16 14:44:13
297147be9875234c,"At 10x Genomics, accelerating our understanding of biology is more than a mission for us. It's a commitment. This is the century of biology, and the breakthroughs we make now have the potential to change the world. We enable scientists to advance their research, allowing them to address scientific questions they didn't even know they could ask. Our tools have enabled fundamental discoveries across multiple application areas, including cancer, immunology, and neuroscience. Our teams are empowered and encouraged to follow their passions, pursue new ideas, and perform at their best in an inclusive and dynamic environment. We know that behind every scientific breakthrough, there is a deep infrastructure of talented individuals driving the life sciences industry and making it possible for scientists, engineers, clinicians, computational biologists, and more to make new strides. We're dedicated to finding the best person for every aspect of our work because the innovations and discoveries that we enable together will lead to better technologies, better treatments, and a better future. Find out how you can make a 10x difference. Senior Financial Analyst, Commercial About the role: You will be providing financial analysis to help guide business decisions of the Senior Sales and Marketing Leaders. Dealing with the budgeting and forecasting process, including operating expense, headcount, and capital expenditures. What you will be doing: Establish solid business partnership with various teams in an assigned function, e.g. Sales, Marketing, Customer Support Work closely with the Manager, Commercial FP&A to develop and analyze sales compensation plans to drive targeted selling behavior. Manage commissions calculations and payments across the sales organization Manage, improve and streamline the annual budgeting and quarterly forecasting process for the team, including operating expense, headcount, and capital expenditures Responsible for the delivery of accurate and timely month-end variance and management reporting. Create standardized reporting packages to effectively communicate relevant information Provide analytical support and financial guidance to help with various business decisions. This includes developing new analyses and improving reports and metrics to better support business partners' decision-making process Develop in-depth knowledge of business partners' areas of focus and critical issues to provide value-add insight and guidance Develop ideas for process improvement for scaling the finance department and implement in collaboration with other FP&A team members To be successful in the role, you will need: Multi-year relevant experience in a financial planning and analysis role A Masters university degree (or equivalent) in preferably Finance, Accounting and/or Economics Excellent analytical and problem-solving skills/modeling Proven track record in business partner or corporate FP&A role Highly detail oriented and organized Ability to apply knowledge of Generally Accepted Accounting Principles (GAAP) Advanced Excel and PowerPoint skills Strong verbal, written, and interpersonal communication skills Demonstrated success working in a deadline driven and multi-task, fast-paced environment Business level English language skills (both written and spoken) It would be fantastic if you already had: Experience in the biotech or pharmaceuticals industry Experience with data science and visualization (BI-) tools (Tableau, Alteryx, ML, R, etc.) Experience within a multinational organization #LI-LN1",2021-03-16 14:44:15
