id,description,scrapetimesdescription8e3972abeefade8b,"Careers that Change Lives Contribute to offering Medtronic business units services to support their clinical operations at an outstanding quality and efficiency level, supporting their strategies for worldwide medical device approvals to introduce new products to market. In this role as a Senior IT Business Systems Analyst in MC2 Solutions development, your core responsibilities will be providing technical support for MC2’s core internal forecasting and demand management system, securing its stability, monitoring its performances, and partnering with the external vendor who owns the system to oversee its evolutionary maintenance interventions. In collaboration with key MC2 stakeholders, provide technical oversight as system changes are defined and implemented to ensure business operations remain unimpacted by changes to the system. In addition, you will have direct responsibilities supporting the rest of the Solutions Development team as a liason with the IT department in EMEA, securing data collectoin systems are correctly setup for study support, and contribuiting to shaping the evolution of your role to fit the ever-changing needs of our organization, in direct partnership with your managers and the functional leaders. Come for a job, stay for a career.  Our Department Medtronic Core Clinical Solutions (MC2) function offers support to clinical studies from all Medtronic Operating Units globally, offering to internal partners services that span across all stages of operation a clinical trial conduct, from designing and building data collection systems to partnering with statisticians in conducting analyses, through conducting monitoring activities at the hospitals and tracking adverse events and ensuring regulatory requirements on safety reporting are met. As part of MC2, Global Clinical Data Solutions (GCDS) offers Data Management, Solutions Development and Statistical Programming services to our partners, supporting the design and build of data collection systems, of reporting and dashboarding solutions, and statistical analysis routines. It also offers technical support and business analisys expertise in the technology and IT domain to other MC2 functions and Medtronic stakeholders. Tasks & Responsibilities The Senior IT Business Analyst main responsibilities are focused towards planning, conducting, and directing the analysis of complex business problems to be solved with automated systems. Analyzes production, inventory control, distribution, cost analysis, finance, marketing, human resources, and/or a variety of other business and technical problems to formulate and develop new and modified information processing systems. Provides technical assistance in identifying, evaluating, and developing systems and procedures, which are cost effective and meet user requirements. Configures system settings and options; plans and executes unit, integration, and acceptance testing; and creates specifications for systems to meet business requirements. Designs details of automated systems. May provide consultation to users in the area of automated systems. Work is performed under general direction. Participates in determining objectives of assignment. Plans schedules and arranges own activities in accomplishing objectives. Work is reviewed upon completion for adequacy in meeting objectives. Represents organization as a prime contact on contracts or projects. Interacts with senior internal and external personnel on significant matters often requiring coordination between organizations. Exerts some influence on the overall objectives and long-range goals of the organization. May assist with projects. Must Haves 6-9 Years relevant working experience with Bachelors degree; 4-7 Years relevant working experience with Masters degree; Knowledge of computer system capabilities, business processes and workflow; Good problem-solving skills; Good English language skills in reading, writing and speaking; Process oriented; Client and customer focused in all aspects; Team player skills; Good communication skills. Nice to Haves Medium SQL programming skills, and/or basic to intermediate knowledge of other programming languages (e.g. python, .NET, C#, java, R, SAS, etc.). We Offer In our 5th Tenet of our Mission we recognize the personal worth of employees by providing an employment framework that allows personal satisfaction in work accomplished, security, advancement opportunity, and means to share in the company's success. Also a competitive package is of course part of that. We offer a competitive salary and benefits package to all our employees: Flexible working environment; Annual Incentive Plan % depending on company results; Pension scheme and group discount on healthcare insurances; Training possibilities via Cornerstone/Harvard Manage Monitor/GetAbstract; Employee Assistance Program and Recognize! (our global recognition program). Your Answer Is this the position you were waiting for? Then please apply directly via the apply button! About Medtronic Together, we can change healthcare worldwide. At Medtronic, we push the limits of what technology, therapies and services can do to help alleviate pain, restore health and extend life. We challenge ourselves and each other to make tomorrow better than yesterday. It is what makes this an exciting and rewarding place to be. We want to accelerate and advance our ability to create meaningful innovations - but we will only succeed with the right people on our team. Let’s work together to address universal healthcare needs and improve patients’ lives. Help us shape the future. Founded in 1949 as a medical repair company, we're now among the world's largest medical technology, services and solutions companies, employing more than 86,000 people worldwide, serving physicians, hospitals and patients in over 155 countries. Whatever your specialty or ambitions, you can make a difference at Medtronic - both in the lives of others and your own career. Join us in our commitment to take healthcare Further, Together.",2021-03-16 14:53:43
8994865d86fb4248,"Pricing Manager | HBL Online B.V. | Tilburg | 32-40 hours per week | HBL Online, founded 11 years ago, is a very fast-growing e-commerce machine with webshops in the Netherlands (Gereedschapcentrum.nl), Belgium, France, Spain and Italy (Fixami.be/fr/es). We are market leader in selling professional tools. For 4 years in a row we are the fastest growing company in the south of the Netherlands. Since the beginning our only goal is to make customers happy! Competitive prices, great deals and TOP customer service that is available for you every day. With more than 190 people, we work hard every day to exceed our customers' expectations. We are continuously working on innovation and optimization of our technology and organization. We wouldn’t be able to manage this without the right people! Currently, we are looking for a Pricing Manager. What will you do in your role as Pricing Manager? In e-commerce, offering a product at the right price is of great importance to achieve maximum results. As a Pricing Manager you are responsible, both strategically and operationally, for determining and implementing the right pricing policy, finding that sweet spot in the field of P * Q that ensures optimal results. You will work closely together with the various purchase- and category managers, the business analyst and sales and marketing colleagues and your team of pricing analysts that you will set up and lead. By using competition- and data analysis you discover commercial opportunities for which you create winning price strategies. In addition to optimizing our automatic pricing methodology, you also analyze specific product and bundle prices and you come up with improvement plans for the pricing on our own websites in Europe and the market places where we offer our products. You carry out tests to discover what makes our customers buy. You do research on new pricing methodologies and you play an important role in the development of these techniques within our organization. You are our ideal candidate if: You have a Master in Econometrics (or comparable) You have 2-5 years of experience in a commercial data / pricing role You have great analytical skills. You are able to find the patterns in data and are able to explain in a clear and structured way You have an excellent helicopter view and you have a good process-oriented way of thinking You are innovative and creative in finding solutions You have strong communication skills and you are proficient in the English language You are ""eager to learn"" with an entrepreneurial mindset Experience with Python / R studio and SQL is an advantage What we have to offer: Above all, a very interesting and challenging job in a fast-growing, informal and inspiring international work environment We are very open for your vision and input, we would like you think along with us about new possibilities; Flexible working hours A competitive salary in combination with secondary benefits, including 25 vacation days (option to purchase extra), company fitness, attractive staff discount & great company parties! Send your CV + letter of motivation to [email protected]",2021-03-16 14:53:44
bcc349f62705b936,"Functie omschrijving Analyst - Real Estate/Offices Our client is an internationally recognized real estate fund in commercial real estate. In this position you will support in evaluating business opportunities in Europe, across commercial real estate (offices).  You will support the Asset Management department in the execution of portfolio management strategies for a portfolio of Office Real Estate in Western Europe. Responsibilities: Work closely with the asset management team on portfolio reporting, budgeting, asset management plans, and attending meetings, including marketing strategies to optimize income and realize the highest value of our assets, as well as operational work processes. Assist in the preparation and maintaining of financial variance analysis reports, prepare and monitor budgets. Assist with financial modelling at the asset and portfolio levels. Managing market intelligence, collating global market / industry information to ensure competitiveness of the Company’s products and services. Assisting in leasing activities (preparing leasing offers, financial analysis of prospects, maintaining and optimization of the leasing database, etc.).  Functie eisen Analyst - Real Estate/Offices Degree in Accountancy, Finance or its equivalent. 1 - 3 years’ relevant experience (preferably in the real estate industry) and advanced financial modeling and analytical skills. Hands-on, resourceful, a good team player, and possess a high level of initiative. Able to work independently in a fast-paced environment. Possess strong communication and interpersonal skills with good business and financial acumen. Good command of English to liaise with colleagues and partners across Europe and Asia. Next to English good knowledge/fluent Dutch or German is required. Good knowledge of Microsoft Excel is required, experience with MRI is an advantage. If you are interested in this position please send your application (in English) to Mandy van der Burght (burght@recruitment.nl). For other questions you can contact Mandy on +31(0)6 - 11725571.  Solid Recruitment (Netherlands) is an international recruitment agency which offers unique career opportunities in the real estate sector.",2021-03-16 14:53:46
3bcefae8e4cad089,"Functieomschrijving Ben jij een ervaren marketeer: specialist digital advertising / web analist? Dan zijn wij misschien wel op zoek naar jou! Wij zijn een razend ambitieus, enthousiast en groeiend digital marketing bureau in Barneveld met uitdagende opdrachten en interessante klanten. Functieomschrijving Zie jij het als een uitdaging om maximaal rendement te halen uit advertentiebudgetten? Ben jij altijd op zoek naar manieren om campagnes nog slimmer en effectiever in te zetten? Stuur jij als marketeer niet op je onderbuikgevoel maar op data? Dan ben jij wellicht die steengoede marketeer die wij willen toevoegen aan onze club van professionals. Sparklet is een Digital Commerce Agency. We streven altijd naar de beste online oplossingen en naar zeer tevreden klanten. In jouw rol als SEA Specialist / Web Analist wordt je de contactpersoon voor onze middelgrote en grote klanten. Dit zijn retailers, groothandelaren en fabrikanten. Door jouw ruime kennis en ervaring op het gebied van online marketing, zet je kanalen en budgetten zo in, dat er een optimaal resultaat voor onze klanten wordt behaald. Je achterhaalt diepgaande data voor onze klanten, waarmee we nog meer inzicht krijgen en waarmee we nog gerichter kunnen targetten. Dit diepgaande inzicht in data maakt voor onze klanten echt hét verschil. Jouw gevoel voor kwaliteit en je open manier van communiceren, zorgt dat je perfect past binnen onze no-nonsense bedrijfscultuur. Als echte teamplayer neem je je verantwoordelijkheid en samen met onze online marketing consultants, webdesigners, copywriters en developers vorm je de klantteams. We werken altijd samen met onze klanten aan de online projecten. Jouw analyserende vermogen, inlevingsvermogen, doordachte strategieen en jouw manier van communiceren zorgt dat de klant jou ziet als een vertrouwde en belangrijke gesprekspartner. Samen maken we online projecten tot een groot succes. Jouw profiel Minimaal een afgeronde HBO opleiding; Minimaal 1 jaar aantoonbare ervaring in een online (e-commerce) marketing functie; Uitgebreide kennis en ervaring met SEA, SEO, conversie optimalisatie, Google Analytics, Google tag manager en Data Visualisatie Tools; Je hebt eerder gewerkt voor retail, groothandel, fabrikant of marketing bureau; Je kan schakelen op zowel strategisch als operationeel niveau; Je bent goed in staat om analytisch, zelfstandig, creatief, resultaatgericht en projectmatig te werken; Proactief en sociaal en communicatief vaardig; Een goede beheersing van de Nederlandse en Engelse taal, in woord en geschrift; Het schrijven van (advertentie)teksten, daar draai je je hand niet voor om; Je woont in Barneveld of omgeving; Je bent minimaal 32 uur per week beschikbaar. Het is een pré als je: Kennis en ervaring hebt met WordPress en / of Magento; Ervaring hebt met platform marketing; Ervaring hebt met inbound marketing, e-mailmarketing en / of marketing automation. Taken en verantwoordelijkheden Meehelpen met het opzetten, monitoren en verbeteren van zoekmachine advertentie campagnes (SEA); Rapporteren van ontwikkelingen aan klanten van lopende campagnes; Meer leren over het gebruik en de inzet van Google Ads, trafficplannen, KPI dashboards, Google Analytics en Affiliate Marketing; Inrichten en optimaliseren van Google Analytics en Google Tag manager; Inrichten van dashboards met relevante KPI’s in Data Visualisatie Tools; A/B testen instellen voor conversie optimalisatie; Opstellen, uitvoeren en bewaken van online strategieën en concepten; Vergroten van traffic, het verbeteren van de conversie, sturen op retentie en meewerken aan het opbouwen van een merk; Verantwoordelijk voor het genereren van marketing qualified leads / e-commerce tegen een gezonde ROI voor jouw groep klanten; Coördineren van werkzaamheden van collega’s en externe partners; Het door ontwikkelen van je expertise en dit delen met collega’s en klanten. Wij bieden jou Een marktconform salaris; Goede arbeidsvoorwaarden; Een laptop van de zaak; Een afwisselende baan met afwisselende projecten; Goede doorgroei- en opleidingsmogelijkheden; Veel ruimte voor eigen inbreng; Een gezellig, hecht en jong team met een ongedwongen, informele sfeer waar je jezelf kan zijn; Een gezamenlijke en verzorgde lunch in onze kantine; Iedere pauze pingpongen, Playstation’en, tafelvoetballen of lekker wandelen buiten; Een prachtige werkplek met een sta-zit bureau en iedere dag heerlijke bonen koffie. We zijn gevestigd in een splinternieuw, modern en ruim kantoor op een prachtige plek tussen de landerijen van Barneveld; Leuke teambuilding activiteiten; Over Sparklet Sparklet is hét Digital Commerce Agency voor retail, brands en groothandel in Midden-Nederland. We zetten ons iedere dag voor 100% in om digitale successen te realiseren voor onze klanten. We helpen ondernemers binnen retail, brands en groothandel met het uitdenken van de online strategie, volledig gefocust op leadgeneratie, e-commerce en online branding. Slimme marketing, dat is waar wij als digital marketing bureau goed in zijn. We weten precies hoe we strategieën zo effectief en efficiënt mogelijk in kunnen zetten. Digital marketing kanalen laten we slim met elkaar samenwerken en we zoeken altijd naar de ultieme mix tussen marketing, techniek, data, design en content. Boven alles zijn we resultaatgericht, want een goede ROI is belangrijk voor onze klanten en dus ook voor ons. Constante optimalisaties van de verschillende kanalen is daarbij onze sleutel tot succes. Het Sparklet team is enthousiast en ambitieus, we dagen uit en blijven tegelijkertijd realistisch. We denken in stappen die haalbaar zijn, waarbij we ontzorgen waar nodig. Zo kunnen ondernemingen snel groei realiseren. Werken bij Sparklet Geïnteresseerd? Neem dan nu contact met ons op door een e-mail te sturen naar Sparklet of bel met 0342 – 40 56 37 en vraag naar Johan Van As. Acquisitie naar aanleiding van deze vacature wordt niet op prijs gesteld. Soort dienstverband: Fulltime, Parttime, Onbepaalde tijd Salaris: €2.800,00 - €4.500,00 per maand Aanvullende betalingen: Vakantiegeld Arbeidsvoorwaarden: Reiskostenvergoeding Vrijdagmiddagborrel Werkschema: Dagdienst ma-vr Opleiding: Bachelor (Vereist) Locatie: Postcode 3772 in Barneveld (Vereist) Thuiswerken: Tijdelijk vanwege COVID-19",2021-03-16 14:53:48
beabefc2251a836d,"Join us as we pursue our disruptive new vision to Turn Data Into Doing™. We are a company filled with people who are passionate about our technology and seek to deliver the best experience for our customers. At Splunk, we’re committed to our work, customers, having fun and most importantly to each other’s success. Responsibilities: Play an active role as part of the DevOps GTM leadership team Attend management calls/meetings/QBRs - contribute as a senior voice EMEA DevOps RSM teams. Contribute to the go forward DevOps RSM GTM and Engagement strategy. Work closely and align with the DevOps Theater leader to drive success in DevOps. Work with DevOps RSM Sales Leader to provide weekly forecasts as part of the Global Forecast process. Act as “Exec” level air cover/support and a proxy in region for DevOps exec presence with our most strategic, complex and impactful accounts. Support the DevOps regional EBC. Align with DevOps GTM stakeholders in Product Management, PMM, SE, Evangelist/Advocacy to enable effective communication of the DevOps strategy and roadmap to both Internal and External stakeholders/customers. Work with the Theater DevOps RSM leader to help identify, define and promote DevOps sales best practices. Source and define patterns and trends from the DevOps RSM field work. Work with the Theater DevOps RSM leader to feed these back into sales engagement process i.e. Big Bet reviews and Account Strategy & Planning process etc. Understand what’s working and where gaps exist and work with Theater DevOps RSM leader to package, reuse and scale. Act as “Tip of the Spear” for the roll out of new engagement motions/workshops working with wider DevOps RSM team Document learnings and recommendations gleaned from our most complex DevOps engagements/deployments so they can be scaled and packaged by the Strategist team. Align with Marketing and Customer Success to identify and maintain a robust framework of regional solution references. Stay current and across key developments and emerging trends in the DevOps domain - the goal for this role is to be ahead of where the wider Sales Specialist team are. Proactive communication of trends and changes in the domain and competitive landscape back into DevOps RSM team, Product and Competitive Intelligence team. Act as go to authority and guide for new emerging trends in the DevOps domain space for the wider DevOps RSM team. Work with DevOps RSM leaders on prioritization on how we evolve to take best advantage of these new patterns and trends.. Support Marketing and A&R teams for regional initiatives where required Support regional field marketing activities. Support the A&R team for regional Analyst meetings. Support global and regional Dev Ops PMM in developing sales and campaign messaging. Support and lead theater based M&A & NPI activities. Credible and active Internal & External evangelist. Contribution of blogs, whitepapers, webinars, presence at Splunk events etc. Requirements You will have 5-10+ years of direct sales experience selling enterprise software to mid-size to large enterprises (required), start-up experience welcomed! Strong cloud knowledge with a solid technical understanding, with the ability to conduct demos to startup organisations You have previous experience utilizing partners, channels and alliances to sell more successfully and overachieve your quota. You have sold a similar complex solution software and have experience in any of the following: IT systems, enterprise or infrastructure management, application development and management, security, business applications and/or analytics. You have a measurable track record in new business development and over achieving sales targets Experience in selling complex enterprise software solutions and ability to adapt in fast-growing and changing environments Experience in successfully selling during market creation phase Proven track record of successfully closing six and seven figure software licensing deals with prospects and customers in the defined territory. Experience in the “C” suite, strong executive presence and polish, and excellent listening skills. Experience with target account selling, solution selling, and/or consultative sales techniques; knowledge of MEDDIC and Challenger methodologies is a plus. Bachelor’s degree; MBA a plus or equivalent experience Modern application architecture (micro-services) understanding is key, along with the ability to understand and communicate technical challenges in business terms We value diversity at our company. All qualified applicants will receive consideration for employment without regard to race, color, religion, sex, sexual orientation, gender identity, national origin, or any other applicable legally protected characteristics in the location in which the candidate is applying. For job positions in San Francisco, CA, and other locations where required, we will consider for employment qualified applicants with arrest and conviction records.",2021-03-16 14:53:50
