id,description,scrapetimesdescription1fd804d1723a134d,"CCS enables insurers to play in the top of digital insurance and to make the step to embedded and real-time connected insurance. Thanks to our 35-year track record, we are able to understand and meet the challenges of the insurance industry. That is why over 2.000 organizations trust our expertise and software solutions. Headquartered in the Netherlands we are able to serve clients all over Europe with our Digital Insurance Platform. With our platform you can Integrate any technology and free data from silos so it’s shareable, usable and powerful. Orchestrate business processes from a central platform across the end-to-end insurance value chain, from marketing through underwriting and claims. And we make you Accelerate your digital transformation and future ready, innovating with OpenAPI technology and IoT connectivity. Presales Solution Consultant Due to our wide variety of digital solutions for the insurance market and our ambition for international growth, we endeavour to expand and strengthen our Presales department for the DACH region and we are looking for a Presales Solution Consultant. CCS´ goal is to deliver rapid, value-driven customer solutions for complex business problems. Our Presales Solution Consultants play a key role in determining how the CCS solutions optimally supports our customer´s business ambitions. Your responsibility will be together with the rest of the sales team to align the customer’s business requirements to the native CCS Digital Insurance Platform functionality and to construct a customer centric market message that articulates the benefits of the solution to the customer. You will have a deep knowledge of the core business processes and best practices in the insurance industry - and you’ll enhance that by acquiring an understanding of the specific business drivers for their program. A collaborative and empathetic relationship with the business stakeholders will be central to your role. Your commitment to their success should never be in doubt. You’ll also be working with developers, typically in Agile scrum teams, helping them convert the business requirements into technical activities and verifying that their deliverables satisfy the acceptance criteria. You’ll also be a key channel back to the CCS product management team as they look to drive innovation and improvements into future releases of the CCS products. What you will do: In order to be able to offer the best possible solutions, you will make an inventory of the wishes of our customers through interviews with various stakeholders, so that you best understand the customer needs. Sparring with colleagues from sales and product development to come up with a suitable solution for the customer. Provide support to Sales colleagues with solution-related questions. You are a sparring partner, knowledge expert and a source of information for customers and your colleagues in Sales and Product Development. Our solutions not only consist of our own development, but also those of our business partners. As part of the deal team, you ensure a qualitative interpretation of the sales process and an excellent structure from proposal to solution and price. In this position it is crucial to know the business of our customers, our services and software solutions and that of our business partners. To this end, you actively participate in on-the-job, internal and external training within your field in order to become an expert of our own solutions as well as those of our business partners. You You are a passionate and experienced presales professional, with knowledge of software solutions, preferably middleware solutions. You have a healthy level of entrepreneurship, decisiveness and analytical skills. You take responsibility for your work and are focused on achieving results together. You have: A completed BSc / MSc /WO high level education with a strong affinity with business administration or IT / information technology. At least 5 years of experience as a presales consultant, a business architect, a functional architect or a business analyst with the ability to present yourself to a C-level audience and an interest in transitioning into a more business development and sales-oriented role. Knowledge of the insurance industry is required. Excellent oral and written communication skills in the German and English language (Dutch will be an advantage). Ability to travel between the target territory and the HQ in Woerden, NL. Between 70 and 100 days of travel annually must be expected. You combine a strategic vision with a hands-on mentality to actually achieve set goals. In this you make optimal use of data, visualizations and presentations. You are a team player, customer-oriented and assertive. Strong technical skills related to Business Intelligence, Databases, software architecture, analytics is an advantage. You have the drive and interest to delve into technical developments. Our offer Our head office is in Woerden, while our customers are located all over the Netherlands and we are expanding further to other countries and at first the DACH region. You will be working in the DACH region. CCS practices and extensive working-from-home (WFH) policy and you will go to our offices in Munich, in Dusseldorf and from time to time to the head office in Woerden, NL. You will be part of the CCS international pre-sales team, reporting to the CCO and receiving business directions from the Regional Sales Director. We offer you: A full-time position for 40 hours a week. A good salary and fringe benefits. Even if you don't want to miss us, this function also includes 25 vacation days and 8.33% vacation pay. Enjoy sports, with or without colleagues: CCS has a company fitness scheme. Collective insurance Laptop + phone Lease car With us you get the space to be in charge and to determine your development. Of course this includes: Training and development opportunities; Opportunity to grow internationally with us. We are CCS We are CCS, an innovative IT company in the insurance industry. From our office in Woerden we work together with our teams in India and Poland on innovative software solutions. Not only do we find ourselves innovative, others notice it as well: we won the EFMA Innovation Award for our Marketplace. We know as much about insurance as we do about IT; we are convinced that we can offer our customers the best solutions possible. Our target group consists of insurers, MGA’s, insurance brokers, service providers and the intermediary. Our team consists of passionate professionals who work together in an informal working atmosphere. Witness the customer focus, personal initiative and knowledge transfer in all teams. Hard work is just as important as having fun with each other, which is why there are various company activities such as football quiz, tennis tournament and game and poker evenings. Let’s connect! Are you as excited about CCS as we are? Get in touch with us! We would like to receive your CV and motivation at recruitment@ccs.nl, via the form below or directly via LinkedIn. For questions about the procedure or further information about the position, please contact our recruiter Valeska Visser on +31 6 82321425 or email the above email address.",2021-03-16 14:45:20
251e646146ed0da7,"Webwinkel | Internationaal | Amsterdam | Informeel | Klantencontact | Doorgroeimogelijkheden | Test automation | Lead | Selenium | Agile | 70K | 38 vakantiedagen Bedrijf Houd je van muziek en zou je willen bijdragen aan de meest bekende webshop met producten die alles te maken hebben met licht en geluid? Deze organisatie groeit steeds harder en in Europa zijn ze bijna de grootste in hun branche. . In Nederland en België hebben zij diverse winkels, maar daarnaast zijn er jaarlijks miljoenen klanten die hun online services gebruiken. In Nederland hebben ze 3 vestigingen met in totaal ruim 400 medewerkers. Deze vacature gaat om een functie op het kantoor in Amsterdam en hier werkt ruim 60 man. Het is een informele organisatie met korte lijnen en veel flexibiliteit. Omdat er vaste dagen thuis kan worden gewerkt, komt het regelmatig voor dat er vanuit huis wordt ingebeld voor een scrum stand-up. Mocht je creatieve ideeën hebben dan is er de mogelijkheid om 10% van je tijd te besteden aan eigen projecten, en als je 40 uur per week werkt dan heb je recht op maar liefst 38 vrije dagen. Team Momenteel is er één senior PHP developer werkzaam waar je mee zult samenwerken. Daarnaast bestaat het team uit een aantal customer service medewerkers, 1 data analist en er werkt 3 man op de marketing afdeling. Op het hoofdkantoor werkt 15 man op de development afdeling en dat team zal je eens in de twee weken bijwonen. Naast deze meetings zijn de lijntjes met het team op het hoofdkantoor kort door veel telefonisch contact en stand-ups. Er wordt Agile gewerkt in twee-wekelijkse sprints. Op het moment is een transitie gaande van de web omgeving, waarin jij volop de vrijheid krijg om jouw ideeën in te brengen en bij te dragen aan vernieuwingen van het systeem. Functie Het is belangrijk dat je ervaring hebt met testautomatisering want dit kan nog naar een hoger niveau gebracht worden. Naast het opzetten van de testautomatisering zal je je bezighouden met het implementeren van nieuwe testtools en het uitbreiden van bestaande tools. Het opsporen en uitwerken van bugs zal ook tot je taken behoren. Je zal zelfstandig aan de slag gaan maar je zal ook veel in contact staan met de developers op de andere vestiging en je hebt regelmatig contact met klanten. Er zijn grote doorgroeimogelijkheden en ook de mogelijkheid om binnen te komen als test coördinator. Vraag HBO/WO werk- en denkniveau Minimaal 3 jaar werkervaring als software tester Kennis van testautomatisering Communicatief vaardig Beheersing van de Nederlandse taal Aanbod Inhouse Salaris tot € 70.000,- 8% vakantiegeld Mogelijkheid voor 32, 36 of 40 uur 38 vakantiedagen Flexibele werktijden Thuiswerken 10% van je tijd besteden aan eigen projecten/ideeën Besturingssysteem van jouw voorkeur kiezen (Linux/Max/Windows) Opleidingsbudget Informele sfeer, gezamenlijke lunches en uitjes Reiskostenvergoeding Bedrijfsfitnessregeling Personeelskorting op het assortiment Perfect bereikbaar met OV Interesse Lieke@layer.nl 06 82 90 97 04 / 020 238 6984",2021-03-16 14:45:22
ec6840afbfe8806a,"Stel je eens voor… je bent de data-spil om voor Know Your Customer (KYC)-processen informatie en inzichten te leveren door middel van rapportages en dashboards. Hiermee voed je de besluitvorming op deze processen en zorg je ervoor dat er gerichte klantcommunicatie kan plaatsvinden. Over deze functie  Als Data Analist voorzie je dus in de behoefte van de business met betrekking tot data-gerelateerde vragen. Je beheerst alle facetten om vanuit (complexe) data de juiste boodschap over te brengen om besluitvorming te ondersteunen. Je denkt mee over de business rules en bedenkt tegelijkertijd waar je de benodigde data vandaan haalt. Een voorbeeld hiervan is het identificeren van klantgroepen op basis van product en sociaal demografische kenmerken in het kader van KYC. Dat doe je door data uit verschillende bronnen te ontsluiten, samen te voegen en weer te geven in tabellen, visualisaties en actiegerichte werklijsten. Je bent verantwoordelijk voor zowel de ontwikkeling als het beheer van dashboards en rapportages. Verder denk je continu mee over de verbetering van onze KYC-datamarts.  Over jou  Ben jij klaar voor de volgende stap in je loopbaan als Data Analist? Check dan of je jezelf herkent in onderstaand profiel: Je hebt een afgeronde studie op hbo- of wo-niveau Je hebt minimaal 1 jaar ervaring als Data Analist Je bent bekend met de aanpak en methodieken van informatieanalyse Je bent bekend met data-bewerking, datawarehouses, data-kwaliteit en data-analyse Daarnaast is het heel fijn als je al kennis hebt van SQL, SAS Enterprise Guide, Excel, Python, Cognos Analytics, Power BI, Business Objects en datawarehouse-concepten en data-modelleringstechnieken.  Wat wij bieden Terwijl jij je als Data Analist inzet bij onze opdrachtgever, zetten wij ons in voor jou. Gedetacheerd worden door Brunel betekent namelijk dat je bij ons in dienst treedt. Bij ons draait het om jou, dus houden wij altijd een oogje in het zeil. Hoe uit zich dat? Je hebt een eigen Brunel-Consultant die jou begeleidt, check-ups doet, nieuwe projecten voor je vindt en jouw carrière en ontwikkeling vooropstelt. Daarnaast, want daar blijft het niet bij, stellen we diverse opleidingsmogelijkheden aan je voor waardoor jij je zowel op zakelijk als op persoonlijk vlak kunt blijven ontwikkelen. Je ontvangt een goed salaris en dan hebben we het nog niet eens over al die bonuskansen gehad. Ook met de secundaire arbeidsvoorwaarden zit het wel snor. Wij hebben tenslotte ook een reputatie hoog te houden. Over ons Je kent Brunel als zakelijk dienstverlener; wereldwijd actief en gespecialiseerd in projectmanagement, detachering en consultancy in de vakgebieden Finance & Risk, Engineering, IT, Legal, Marketing & Communicatie, HR en alle disciplines in de olie- en gasindustrie. Dit doen we samen met zo'n 14.500 collega’s in 44 landen. Brunel Finance & Risk is gespecialiseerd in het detacheren van vakspecialisten binnen de financiële dienstverlening. Dankzij onze medewerkers en onze manier van werken onderhouden wij goede relaties met alle gerenommeerde financiële spelers in de branche, met wie we jou graag in contact brengen. Onze kernwaarden zijn terug te zien in onze deelname aan en sponsoring van de Volvo Ocean Race: ambition, teamwork and operational excellence. Vandaar ook ons motto: Navigate The Future. Herkenbaar? Welkom aan boord!  WO Bachelor",2021-03-16 14:45:24
2a0813e0a553b943,"Appnovation helps brands thrive through innovative, people-inspired experiences and solutions. By embracing the powerful combination of technology and agility, we seamlessly integrate strategy, experience, design, development and analytics. We create standout digital experiences by collaborating with brands to understand the individual challenges and goals for every initiative. Focusing on our clients' customers, we effectively combine empathy, evidence and real-world insight so that solutions are derived from truth and meaning. Appnovation is an award-winning team dedicated to inspiring possibility. Working closely with project stakeholders, you will define the business requirements and functional specifications on each project. Excellence in customer service, along with a dedicated proactive attitude, is an essential component of this role. Our goal is to achieve a true balance between quality, client satisfaction, efficiency, success and profitability. YOU WILL HAVE AN OPPORTUNITY TO: Work with Account managers and Project Managers to determine the approach, deliverables and estimated effort necessary for the business analysis activities. Elicit client's requirements through various techniques such as interviews, workshops, document analysis, brainstorming exercises etc. Work within an agile environment, leading backlog grooming and sprint planning, estimations and story creation for Agile projects, including translating requirements into specifications in the form of Epics and Stories. Work in an international team, across projects. Provide professional client-facing documentation with excellence in version control. Facilitate communications between a wide range of individuals – creative / business / technical with various levels and departments within the customer's organization - executives / IT / marketing / customer service. Use other methods if required to support the requirements such as use cases, process diagrams and wireframes using industry standard software applications. Assist project manager to establish project scope & facilitate requirement clarifications, collaborating with the development team to troubleshoot problems/roadblocks throughout the development cycle. Interact with tech leads to align functional and technical requirements. Build and maintain good strong relationships with clients and stakeholders and act as a proxy for the client to the development teams. Provide client training when needed for areas such as for content administration or other utility functions developed for the client. WHO YOU ARE: The ideal candidate is expected to have proven experience in business analysis. You are comfortable collecting technical requirements and creating user stories for technical interfaces. Experience using JIRA 2+ years of BA experience, in Enterprise Web-Application, Website or Mobile Projects. You have a Bachelor degree in Computer Science, Business Management, related field or extensive work experience equivalent. You use these terms in everyday language – requirements, stakeholders, user stories, wireframes, process and user experience. Client facing background and experience partnering with multiple stakeholders is an absolute must have. Experience in organizing and presenting complex information in simple visual models Solid experience working with teams. Experience working in an agency or IT professional services environment. You're passionate about keeping up to date with the latest trends in technology, web and new media and improves domain knowledge through continual professional development. A proficient Dutch speaker WHAT DOES APPNOVATION HAVE TO OFFER? Competitive salary and vacation days Company pension Rocketing growth – yours and ours. Lots of opportunity for personal and professional growth. We are a culture of internal promotions A healthy working environment like a sit and standing desk, laptop stand and a large second screen, and our annual sports day A working environment in which there is a lot of attention for quality, help from others, learning at work Yearly fitness allowance Health benefits package Travel/commute allowance Home office allowance Nederlands Zit je vast in je huidige werk of werkomgeving? Wil je elke dag meer leren en deel uitmaken van een team met ambitie? Ben je toe aan een nieuwe uitdaging in een internationale omgeving? Appnovation Nederland is op zoek naar een ambitieuze business analist! Appnovation helpt merken te groeien door innovatieve, door mensen geïnspireerde ervaringen en oplossingen. Door de krachtige combinatie van technologie en flexibiliteit te omarmen, integreren we strategie, ervaring, design, ontwikkeling en analytics. We creëren opvallende digitale ervaringen door samen te werken met merken om de individuele uitdagingen en doelstellingen voor elk initiatief te begrijpen. Door ons te richten op de klanten van onze klanten, combineren we empathie, bewijs en inzicht in de echte wereld, zodat oplossingen worden afgeleid van waarheid en betekenis. Appnovation is een bedrijf dat zich inzet voor inspirerende mogelijkheden. In nauwe samenwerking met project stakeholders, definieer je de business requirements en functionele specificaties voor elk project. Uitmuntendheid in klantenservice, samen met een toegewijde proactieve houding, is een essentieel onderdeel voor deze rol. Ons doel is om een echte balans te bereiken tussen kwaliteit, klanttevredenheid, efficiëntie, succes en winstgevendheid. JE KRIJGT MOGELIJKHEDEN OM: Samen te werken met de Client Service Managers en Project Managers om de aanpak, deliverables en geschatte inspanning die nodig is voor de business analyse activiteiten te bepalen. De eisen van de klant te ontrafelen door middel van verschillende technieken, zoals interviews, workshops, documentanalyse, brainstormingoefeningen, enz. Te werken binnen een agile omgeving, leiding te geven aan backlog grooming en sprintplanning, schattingen en story creatie te maken voor Agile projecten, inclusief het vertalen van requirements naar specificaties in de vorm van Epics en Stories. Te zorgen voor professionele client-facing documentatie met uitmuntendheid in versiebeheer. Communicatie te faciliteren tussen een breed scala aan personen - creatief / zakelijk / technisch met verschillende niveaus en afdelingen binnen de organisatie van de klant - leidinggevenden / IT / marketing / customer service. Andere methoden te gebruiken indien nodig om de eisen te ondersteunen, zoals use cases, procesdiagrammen en wireframes met behulp van industrie standaard software applicaties. Interactie te zoeken met tech leads om functionele en technische eisen op elkaar af te stemmen. De projectmanager te ondersteunen om de scope van het project vast te stellen en om requirements te verduidelijken, Samen te werken met het ontwikkelingsteam om problemen/wegversperringen op te lossen gedurende de gehele ontwikkelingscyclus. Goede relaties te bouwen en onderhouden met klanten en stakeholders en op te treden als vertegenwoordiger van de klant naar de ontwikkelteams. WIE BEN JIJ? Van de ideale kandidaat wordt verwacht dat hij/zij aantoonbare ervaring heeft met business analyse. Comfortabel met het verzamelen van functionele eisen en het creëren van user stories. Ervaring met het gebruik van JIRA of vergelijkbaar ticketsysteem. 2+ jaar BA ervaring, in webapplicaties, websites of mobile apps. Je hebt een Bachelor diploma in Informatica, Business Management, aanverwante richting of gelijkwaardige werkervaring. Je gebruikt de volgende termen in dagelijks taalgebruik - requirements, stakeholders, user stories, wireframes, proces en user experience. Een klantgerichte achtergrond en ervaring met het samenwerken met meerdere stakeholders is een absolute must. Ervaring in het organiseren en presenteren van complexe informatie in eenvoudige visuele modellen Ervaring met het werken met teams. Ervaring met het werken in een agency of IT omgeving. Je bent gedreven om op de hoogte te blijven van de laatste trends in technologie, web en nieuwe media en verbetert je domeinkennis door voortdurende professionele ontwikkeling. WAT BIEDEN WE JOU? Door bij ons te komen werken, word je onderdeel van een snel groeiend internationaal bedrijf met grote ambities en geweldige collega's. Naast het werk dat we voor onze klanten doen, zijn we trots op onze open, diverse en inclusieve bedrijfscultuur. Wij geloven in openheid, oprechtheid en professionaliteit, richting onze klanten en collega's. Naast onze uitdagende projecten en onze familiaire werkomgeving bieden we uitstekende secundaire arbeidsvoorwaarden, waaronder: Concurrerend salaris en vakantiedagen. Bedrijfspensioen. Een gezonde werkomgeving zoals een zit- en stabureau, laptopstandaard en een groot tweede scherm, en onze jaarlijkse sportdag. Een werkomgeving waarin veel aandacht is voor kwaliteit, hulp van anderen en leren op het werk. Een explosieve groei - van jou en van ons. Veel mogelijkheden voor persoonlijke en professionele groei. We zijn een cultuur van interne promoties. Fitness-vergoeding. Reis-/ woon-werkvergoeding. Thank you for your interest in a career with Appnovation Technologies! Please note that only those selected for an interview will be contacted. Appnovation is an equal opportunity employer and committed to diversity and inclusion. We encourage applications from all qualified candidates and accommodations are available upon request throughout the recruitment process.",2021-03-16 14:45:26
272742935d61c1e1,"Are you a Creative Marketeer interested in working for a global Technology, Internet & e-Commerce firm? Do you want to work in ""Enterprise"" Marketing creating content for some of the largest companies in the BENELUX region? Well, we have a new team that is hiring c.5 DUTCH speaking Marketeers that is responsible for; Market Research of trends, technologies and competitors in their domain Preparing creative documents for Presentations, eBooks, Pitch Decks, Sales Aids, Product Guides and similar marketing brochures Supporting the Sales Organisation on preparing high quality presentations, bids, How To and ad hoc marketing content Outputs include landing pages, eBooks, pdf, ppt, google slides, video and more! The ideal candidates for this role will possess: Degree in Marketing, Design, Web development, Video or similar creative 2-5 years work experience in a hands on marketing role Experience in any of HTML, CSS, XML, Indesign, Illustrator, Photoshop, Adobe Premiere Pro, Acrobat or 3D design etc Native-Level Dutch This job is in DUBLIN and offers €2,000 relocation paid in your first months' salary. It cannot be performed from outside Ireland, but it is remote within Ireland. If you feel that you possess the Education, Technical Marketing creative skills and interest in working in Tech, and the role is of interest, APPLY NOW! Book a call with me using this link (COPY & PASTE TO YOUR BROWSER) https://calendly.com/engage-/marketing Reference ID: BH88888 Job Type: Full-time Salary: €35,000.00 - €45,000.00 per year Experience: Marketing: 1 year (Required) Education: Bachelor's (Required) COVID-19 Precaution(s): Remote interview process Temperature screenings Social distancing guidelines in place Virtual meetings Sanitizing, disinfecting, or cleaning procedures in place",2021-03-16 14:45:28
