id,description,scrapetimesdescription
05e416dcda805c45,"Het optimaliseren van de marketingdata, zodat alles uit de offline én online gegevens gehaald wordt. Dat is waar jij als Marketing Intelligence Analist energie uit haalt én verantwoordelijk voor bent! Je maakt analyses & dashboards, past machine learning toe en automatiseert (online) marketingacties. Als Marketing Intelligence Analist bij deze informele organisatie in Dordrecht ontwikkel je dashboards in Tableau, maak je analyses met R & Python, waarbij je continu op zoek bent naar het realiseren van groei. Nieuwsgierig? We vertellen graag meer! Organisatie Jouw nieuwe werkgever is actief in de zakelijke dienstverlening. Het is een informele organisatie waarin de medewerkers gestimuleerd worden en de ruimte krijgen om zichzelf verder te ontwikkelen. Met ruim 200 collega’s zijn zij elke dag bezig om hun klanten zo goed mogelijk van dienst te zijn.  In deze professionele en ambitieuze organisatie worden medewerkers gestimuleerd en krijgen de ruimte om zichzelf te blijven ontwikkelen. Er heerst een open & prettige werksfeer waar ook ruimte is om gezellig met elkaar te lunchen in de mooie bedrijfskantine en op vrijdagmiddag de week af te sluiten met een borrel op het dakterras met een prachtig uitzicht over Dordrecht!  Je komt als Marketing Intelligence Analist te werken met zeven enthousiaste collega’s, het team waarin je komt te werken is gedreven, leergierig en gericht op innovatie. Functie Het optimaliseren van de marketingdata, zodat alles uit de offline én online gegevens gehaald wordt. Dat is waar jij als Marketing Intelligence Analist energie uit haalt én verantwoordelijk voor bent! Je maakt analyses & dashboards, past machine learning toe en automatiseert (online) marketingacties. Daarnaast ga je je ook met verschillende projecten bezighouden. Eén daarvan is het slimmer inrichten van zoekwoordanalyses, zodat dit niet meer handmatig gedaan hoeft te worden én er effectiever geadverteerd kan worden. Hiervoor combineer je verschillende tools, laat je er marketinganalyses op los en richt je scripts in voor Google Ads. Uiteraard kunnen bij zulke analyses conversie-attributiemodellen niet ontbreken. Een ander project is het automatisch importeren van e-mailingselecties in het e-mailingsysteem. Waarbij je via de api koppeling automatisch e-mailings gaat verzenden naar de juiste ontvangers op het juiste moment. Daarna volgt uiteraard het verbeteren van de voorspelmodellen en selecties!  Al met al, datagedreven werken is helemaal jouw ding en jij gaat er met jouw expertise als Marketing Intelligence Analist voor zorgen dat jullie continu kunnen inspelen op de meest actuele trends & ontwikkelingen in dit mooie vakgebied. Functie-eisen Als Marketing Intelligence Analist heb je een passie voor marketingdata en automatisering, hierbij vind je ook de technische kant interessant. Natuurlijk breng je ook een groot analytisch vermogen en een commerciële instelling mee. Verder herken je jezelf in het volgende profiel: Een afgeronde hbo- of wo-opleiding in bijvoorbeeld de richting van Marketing, Commerciële Economie, Communicatie & Multimedia Design (CMD) of Marketingdata; Minimaal twee jaar ervaring als Marketing Automation Analist, Marketing Data Specialist, Data Analist of een andere vergelijkbare functie; Je hebt een uitstekende beheersing van de Nederlandse taal; Ervaring met Tableau en/of Power BI; Ben je bekend met Google Ads scripts en/of Javascript, dan is dat mooi meegenomen; Heb je ervaring met Python of R? Dit is een grote pre! Aanbod En wat bieden wij jou als toekomstig Marketing Intelligence Analist in Dordrecht? Een inspirerende en informele werkomgeving met enthousiaste en inspirerende collega’s, waar je de vrijheid krijgt om mee te denken en ideeën aan te dragen; Een mooi bruto maandsalaris tussen de €2500 en €4000, afhankelijk van jouw leeftijd en ervaring; Een uitdagende functie waarin je afhankelijk van jouw voorkeur 32, 36 of 40 uur per week werkt; 25 vakantiedagen; De mogelijkheid om opleidingen te volgen, jezelf verder te ontwikkelen en door te groeien; Een vitaliteitsvergoeding; Gezellige borrels en feestjes; En tot slot (voor later!) een goede pensioenregeling! Sollicitatie Je kunt via de button ‘solliciteer’ rechtstreeks reageren op deze functie. Vul jouw gegevens in op het invulformulier en stuur je CV (en eventuele motivatie) als bijlage(n) mee. Jouw sollicitatie wordt dan direct gekoppeld aan deze vacature en in behandeling genomen. #prio2",2021-03-16 14:53:10
08403b9558d04ee4,"Data Analytics bureau Cloud Nine Digital is per direct op zoek naar een Senior Consultant voor de Data & Analytics afdeling om onze klanten door middel van het beschikbaar maken en het benutten van data te ondersteunen met hun digitale groei. Heb jij een scherp oog voor details? Ben je kritisch en goed met verscheidene tools als Google Analytics 360, Adobe Analytics en Tealium IQ? Dan ben jij wat we zoeken! Wat ga je doen als Senior Data & Analytics consultant? Als Senior Data & Analytics consultant ga je in teamverband aan de slag met klanten om de (digitale) data operatie naar een hoger niveau te tillen. Dit doe je door ze te adviseren op strategisch en tactisch niveau en door operationeel de meest complexe zaken op te pakken. Hiervoor heb je kennis van en werk je met: Datalayer design Google Marketing Platform (GA & GTM) Adobe Marketing Suite (Analytics & Launch) Cloud diensten van Google (Firebase & BigQuery), Amazon en Microsoft Tag Management en CDP oplossingen als Tealium, Ensighten en Relay42 Visualisatie oplossingen zoals PowerBI en Tableau Als voornaamste bezigheid help je onze klanten bij de implementatie, de configuratie, en het gebruik van web- en app analytics tools. Dankzij jouw sterk ontwikkelende analytische vermogen kan je de wensen, propositie en situatie van de klant vertalen naar een concreet implementatie advies wat resulteert in waardevolle en betrouwbare data. Je houdt je daarnaast ook bezig met: Advies uitbrengen over het gebruik van (digitale) data in combinatie met andere databronnen; Het opzetten van rapportages en dashboards; Het geven van trainingen: dit vakgebied is immers jouw expertise en jij wil anderen daarin helpen groeien! Wie zoeken we? We zoeken een consultant die chaotische en complexe situaties weet te overzien en vertalen naar structurele verbeteringen en georganiseerde chaos ;). Je bent technisch sterk en kan door je ervaring werken met meerdere tools. Het implementeren hiervan is voor jou een tweede natuur. Daarnaast zoeken we een sterke analist. Jij kan door jouw opgedane kennis en werkervaring zelfstandig data analyseren en vertalen in verbeterpunten of verwerken in dashboards en rapportages. Verder is je werk nauwkeurig en gestructureerd, en ben je punctueel. Klanten zijn blij met jou: jij bent immers goed in het opbouwen en onderhouden van klantrelaties. Servicegericht is jouw tweede naam! Verder herken je jezelf hierin: Je hebt ervaring met Tagmanagement en bent bekend met tools als Google Tag Manager, Adobe Launch en Tealium IQ; Je hebt kennis van- en ervaring met het implementeren van nieuwe tools; Je hebt ervaring met het zelfstandig maken van analyses en dit omzetten tot een advies; Je hebt gewerkt voor/bij grote en complexe organisaties; Je hebt HBO- of WO werk- en denkniveau minstens 3 jaar relevante werkervaring; Je bent procesvaardig en zelfstandig. Het bijhouden van taken en deadlines gaat je gemakkelijk af en je communiceert hier goed over; Uitstekende beheersing van de Nederlandse taal en goede beheersing van de Engelse taal in woord en geschrift; Je bent 32 tot 40 uur per week beschikbaar. Wat bieden we? Bij Cloud Nine Digital kijken we wat jij nodig hebt om je zo goed mogelijk te kunnen ontwikkelen. Op goede, individuele begeleiding kan je rekenen. Daarnaast ontvang je bij ons: Een marktconforme beloning voor je harde werken; Een riante bonusregeling bovenop je salaris én 25 vakantiedagen; Een jaarlijks opleidingsbudget van €1500,- en goede doorgroeimogelijkheden; Volledige reiskostenvergoeding; Een uitdagende plek in een bedrijf waar feestjes, borrels en uitjes regelmatig plaatsvinden. Parttime uren: 32-40 per week Soort dienstverband: Fulltime, Parttime, Bepaalde tijd, Onbepaalde tijd Aanvullende betalingen: Bonusregeling Vakantiegeld Arbeidsvoorwaarden: Bedrijfsfeesten Budget voor professionele ontwikkeling Flexibele werkuren Lunchkorting Pensioen Reiskostenvergoeding Telefoonplan Vrijdagmiddagborrel Werkschema: Dagdienst Flexibel werkrooster ma-vr Ervaring: Data & Analytics: 3 jaar (Aanbevolen) Taal: Nederlands (Vereist) Thuiswerken: Tijdelijk vanwege COVID-19",2021-03-16 14:53:12
f6a47b8a45b45fe8,"Senior Marketing Data Analyst Do you have 4+ years of experience as a data analyst after you finished your Bachelor’s degree? Are you a master in SQL, (PostgreSQL and Big Query) combined with experience with programming in Python or R? Would you like to work for a ambitions growth organisation as CarNext.com in an exciting and constantly changing (online) market? If you answered yes to the above questions, please apply for this challenging position as our Senior Marketing Data Analyst in our international scale-up environment!  This is CarNext.com CarNext.com is a scale-up with a start-up mentality. We’re bold and have a passion to change the status quo. We’re building a transparent digital marketplace that customers can trust. And it’s the same at CarNext.com. We’re proud of our open culture, collaborative ethos, vibrant environment and can-do approach. As we grow our business, we’re keen to hear from people who understand what we’re about and can help us achieve our mission.  Help us build the future of mobility! As the Senior Marketing Data Analyst, you will make a crucial contribution to the insight and utilization of data within the company. Whilst being a valuable member of the Marketing Department, you will work with all parts of the company to help them give the right business decision. It’s important to us that our new Senior Data Analyst is someone who works with precision, is decisive, has a great set of analytical skills and loves driving business decisions coming from data.  In this role you will be: Identifying trends Analyzing patterns in measurement data, expanding validation options; Fixing the data issues and communications around it Creating new metrics after doing all the necessary checks Testing hypothesis Participate in project teams for custom measurements and data flows; Developing the data collection of new meters; Support in the daily activities of the Data team; Organizing imports and exports of data (APIs); Contributes actively to securing and transferring knowledge in the organization; Building knowledge meters and protocols;  Must haves for this role: Bachelor’s degree (undergraduate program completed), preferably in Engineering, Business, Marketing or other relevant fields, a Master’s degree is a nice to have 4+ years of experience as data analyst, which required good stakeholder management and communication skills Stakeholder Management and good communication skills Statistical knowledge and data modelling is required Really analytical mindset and eye for business needs Mastered in Excel Mastered in SQL, (PostgreSQL and Big Query) Have experience with Programming Languages – Python (or R) Statistical knowledge and good understanding of mathematical theorems English (fluent, verbally and written), and second language is a nice to have  Skills that you need in order to succeed in this position: Ambition and self-motivation Energetic, flexible and always looing to learn new things; An amazing team player and willing to go above and beyond in delivering great work; Have a proactive and flexible mind set, with an attitude to thrive in a dynamic, fast-paced, start-up like environment.  The team You will work in a small team in which you will get every opportunity to further develop yourself.  Grow with us CarNext.com provides ample opportunities for personal and professional growth. If you feel this is a great match with your skills, Go ahead, apply and send us your CV",2021-03-16 14:53:14
21a46a7902aed048,"At TreviPay, we help clients grow by streamlining B2B payments through a combination of innovative technology, service expertise, and working capital to improve their customer’s experience and free up funding for growth. We facilitate $6 billion in transactions per year in 18 currencies for customers in more than 27 countries. We specialize in payment and credit management for B2B companies across the globe, setting the stage for the future of omni-channel B2B payments by extending terms, handling invoicing and managing collections. We take care of our clients by taking care of their customers.  Every day, TreviPay employees are challenged and empowered in a supportive, collaborative, entrepreneurial environment.  Product Manager/Product Owner required by a rapidly expanding Fintech brand!  The Product Manager/Product owner is a pivotal, mid-level management role in the product management group at Multi Services Technology Solutions and is responsible for translating business ideas and vision into tangible deliveries using IT systems.  TreviPay provides net pay commercial billing services and payment solutions within closed loop merchant networks, including truck stops and service stations, worldwide aviation fuel and marine fuel locations, European tolls and tunnels, as well as retail merchants.  Reporting into the Director, European Product Management and Software Engineering, the Product Manager will oversee all major product strategies and development initiatives across the EMEA region in terms of innovative developments in the field of logistics, payment card technology platforms, telematics.  This is an exciting opportunity to collaborate with and support the EMEA senior management team and be part of the global IT management team.  Key success factors for the role are the natural abilities to: Develop and drive the product road map and product vision in alignment with the company’s near-term goals and long-term vision. Collaborate with internal and external stakeholders in developing key growth initiatives. Ability to prioritize. Manage all aspects of a successful product through its life cycle. Lead and inspire product development teams to push boundaries in building products focused on excellent customer experience.  Principal Responsibilities Determine new product requirements or existing product enhancement (functional) gathering relevant input from internal subject matter experts, internal stakeholder teams (e.g. Sales, Support, Operations, FP&A), customers and key partners. Collaborate with other product owners and the product manager to create the product road map. Create and Own a product backlog based on the product road map. Continuously groom the product backlog in collaboration with the technical leads. Create user stories from the backlog for the development team to develop the product. Accept user stories post development. Interact with the Technology team and drive the agile practices. Lead E2E implementation of new products and services: Define the real value proposition of the product. Co-Create the product launch plan in collaboration with Sales, Support, Finance and Marketing. Collaborate with multiple stakeholders within the organizations to ensure successful product launch. Develop and monitor post launch product KPIs. Produce product description document and any other documents relevant to the product launch. Act as POC to internal stakeholders for assigned product(s). Key stakeholders are the functional or departmental leads of other business functions. Contribute to the Product strategy by keeping abreast of market dynamics, competitor and partner activities in relevant industries, and building a robust view of the market landscape.  The Individual The successful candidate is likely to have in excess of 5 years’ work experience as a product manager/ product owner/ business analyst or similar role supporting web products/apps/sites in the areas of payment card technologies, logistics/fleet management technologies or telematics. Experience of owning the product development strategy is essential. Strong written and oral communication skills in English are essential. Strong business partnering skills and the ability to communicate product ideas to senior management and partner with technology teams to deliver the solution is essential. Strong analytical skills are essential. Strong team working skills are essential. Strong team leadership experience and skills are essential.  Why you will love working at TreviPay Competitive salary Casual environment and dress Employee referral program  At TreviPay we believe: in saying yes to unique and challenging requirements empowered team members are creative team members our products make the customer’s day just a little bit better work/life balance makes us all more effective  TreviPay is an Equal Opportunity and Affirmative Action Employer. We welcome all veterans and disabled applicants.",2021-03-16 14:53:16
b9e9810149891faf,"Wij zijn doorlopend op zoek naar ervaren Finance professionals die op zoek zijn naar een functie binnen de profit of de non-profit sector. Je hebt minimaal een financiële HBO opleiding afgerond en beschikt over tenminste 5 jaar relevante werkervaring, bij voorkeur op o.a. de gebieden (business)controlling, management rapportering, administratieve organisatie, planning & control. Denk hierbij aan de volgende functies: Controller| (senior) Adviseur P&C Medewerker AO Finance manager Business analyst. Profiel Als persoon ben je nieuwsgierig en zelfverzekerd en heb je altijd oog voor de vernieuwingen in jouw vakgebied. Aanbod Organisatie Pro-Link bemiddelt MBO+/HBO/WO professionals met de juiste persoonlijkheid. Met een jarenlange kwalitatieve ervaring in de werving & selectie / headhunting zijn wij DE recruitmentspecialist. op het gebieden: Techniek (maintenance, productie, kwaliteit, operations, supply chain, inkoop, engineering); Sales & Marketing; Finance. Wij brengen jou graag in contact met potentiële opdrachtgevers, pas je binnen ons profiel en ben je toe aan een volgende stap? Stuur dan je cv en dan nodigen wij jou uit voor een kennismakingsgesprek om de mogelijkheden en jouw wensen te bespreken. Contact Maak jij het verschil? Dan komen wij graag in contact met jou. Solliciteer via onderstaande button of mail naar Saskia Leenders-van der Linden. Mail: s.leenders@pro-link.nl of bel via: 06 43889347.",2021-03-16 14:53:18
262daa0d027e5491,"Uren: 40 uur per week | Contact: recruitment@dvep.nl| Internationale functie Voor ons internationale Supply team zijn we op zoek naar een market & product analyst die ons team wil komen versterken. Binnen de Supply afdeling van Energy Marketing zoeken en genereren we nieuwe kansen voor ons bedrijf. Dit doen we door gebruik te maken van onze expertise en innovatieve aanpak. We zijn sterk in groei, het beheersen van risico’s en het leveren van extra waarde aan de organisatie. In deze rol ben jij het eerste aanspreekpunt voor alle sales kantoren binnen de Energy Marketing groep. Vanuit de afdeling Supply ondersteun jij je sales collega’s op allerlei gebieden, zoals het afgeven van prijzen, productontwikkeling en wet- en regelgeving vraagstukken. Je krijgt veel vrijheid in de invulling van deze functie en wij verwachten dan ook dat je iemand bent met een ondernemende en ambitieuze instelling. Wat ga je doen? Dagelijks genereren van prijzen voor je sales collega’s van onze Europese verkoopkanalen voor gas, elektriciteit en GvO’s. Je houdt je bezig met contractontwikkeling, productontwikkeling en houdt de prijzen op de markt in de gaten. Onderhouden van contact met je interne collega’s van o.a. Supply, Sales en IT. Bijwonen en coördineren van voorkomende projecten. Contact met marktpartijen in verschillende landen over o.a. de regelgeving en lokale eisen op leverancier en PV gebied. Optimaliseren van tools en processen om onze klanten optimaal te ondersteunen en risico’s te minimaliseren. Verhandelen van groencertificaten (GVO’s). Eerste aanspreekpunt voor de sales kantoren in diverse landen. Wat breng je mee? Je hebt een HBO of WO afgeronde opleiding. Je bent commercieel en communicatief vaardig. Je bent cijfermatig sterk en werkt accuraat. Je hebt ervaring met projectmatig werken en haalt hier energie uit. Je bent goed in het stellen van prioriteiten en kan met deadlines werken. Je bent klantgericht, besluitvaardig, nieuwsgierig en innovatief. Goede kennis van de Nederlandse en Engelse taal in woord en geschrift. Franse kennis in woord en geschrift is een pre. Wie zijn wij? Binnen Europa opereren wij onder de vlag van Energy Marketing. Dit is een onderdeel van UGI International en wij werken o.a. in België, Frankrijk, Nederland en Engeland. Je zult binnen deze functie continu contact hebben met de verschillende bedrijven die vallen onder Energy Marketing. Zo werk je onder andere voor Antargaz (België & Frankrijk), Avantigas (Verenigd Koninkrijk) en DVEP Energie (Nederland). Het Energy Marketing team is ambitieus, internationaal en hecht veel waarde aan persoonlijke ontwikkeling van talent. Wat hebben wij te bieden? Je komt te werken in een internationale organisatie met betrokken collega’s en doorgroeimogelijkheden. Jij krijgt de vrijheid en mogelijkheid om deze functie verder uit te werken. Werken in een jong team binnen een snelgroeiend bedrijf. 26 vakantiedagen en de mogelijkheid tot het bijkopen van extra vakantiedagen. Korting op je energierekening. Heb jij interesse in deze functie? Stuur dan je sollicitatie via het formulier op deze pagina. We nemen dan zo snel mogelijk contact met je op. Wil je meer weten over de vacature? Neem dan contact op met Laura van den Berge via recruitment@dvep.nl of via 06-27858954.  Een VOG maakt onderdeel uit van de procedure.",2021-03-16 14:53:20
343931eb114e1d6c,"Ben jij er klaar voor om als Online Marketeer aan de slag te gaan bij een innovatieve scale-up? Ligo is een snelgroeiende legal tech bedrijf en is op zoek naar een ervaren marketeer die alle kansen krijgt om door te groeien en impact te maken!  Ligo Ligo is bestaat inmiddels 5 jaar en is het nummer 1 legal platform in Nederland. Wij maken ‘legal’ makkelijk, snel en betaalbaar. Met onze technologie zorgen we ervoor dat elk persoon onbeperkt gebruik kan maken van betaalbare juridische diensten. Een bedrijf oprichten, een contract op maat maken, bellen voor advies van topadvocaten, handige workflows om “legal jobs to be done” te tackelen, een testament of samenlevingscontract opstellen regelen, bij Ligo kan dit allemaal. Het team van Ligo groeit snel en we bieden jou een unieke kans om als Marketeer deel te nemen aan dit mooie avontuur. Je zal brede ervaring opdoen, samenwerken met een ervaren growth hacker/data analist en meebouwen aan een leading platform dat nu in Nederland al een hele industrie domineert.  Wat ga je bij ons doen? Als Online Marketeer heb jij een belangrijke rol in de verdere groei van Ligo. Jij zet de marketingstrategie uit en bouwt aan naamsbekendheid, de groei van leads en optimaliseert de conversie. Dit doe je door doelgericht te experimenteren met online marketingkanalen en strategieën, die je niet alleen bedenkt, maar ook uitvoert. Je krijgt hierin veel vrijheid en werkt samen met de growth hacker die van vele markten thuis is, scherpe developers en ons Customer Success team. Door jouw brede kennis weet je goed welke kanalen in te zetten om meer omzet te generen en de business uit te bouwen. Termen als SEA, SEO, CRO en Viral Marketing zijn voor jou aan de orde van de dag. Binnen deze functie met je zowel hands-on als strategisch verantwoordelijk om de juiste online doelstellingen te behalen en de juiste doelgroepen te bereiken. Je bent goed met (marketing)teksten, en weet ook hiermee de juiste klanten aan te spreken. Je rapporteert aan de CEO, je kan het Marketing Team gaan uitbreiden en je kan snel doorgroeien! Waar worden wij blij van? HBO- of WO-studie afgerond; 4 jaar werkervaring in een soortgelijke functie; Je hebt ervaring met Google Analytics, SEA en SEO; Je spreekt en schrijft uitstekend Nederlands en Engels; Je kan snel schakelen tussen strategie en executie; Je bent ambitieus, resultaatgericht en proactief; Je bent zelfsturend en houdt van verantwoordelijkheid; Je bent organisatorisch sterk en kan team members meekrijgen. Voor jou hebben wij: Een super enthousiast jong team dat er het maximale uit wil halen elke dag Een omgeving waar legio aan mogelijkheden zijn: voor jezelf en de groei van het bedrijf Mogelijkheid tot impact maken bij een leading B2B en B2C platform dat een hele industrie domineert Marktconform salaris Friday drinks, fruit, snacks & verse lunch elke dag! Hoe is het Ligo Team? Our team consists of enthusiastic enthusiasts who go the extra mile every day to make Ligo a great success! We love tackling, striving for a goal, making an impact and that is noticeable every day. It is not without reason that we want to become the largest in the market. If you get excited about this, then you certainly fit Ligo. Lijkt dit je wat? Solliciteer direct via de link hieronder. We kijken uit naar je reactie!",2021-03-16 14:53:22
