id,description,scrapetimesdescriptione9d29eeff3283f8b,"Stel je eens voor… dat je werkt op een innovatieve afdeling met grote hoeveelheden waardevolle data. Jij bouwt voor vooral ongestructureerde data de analytics producten die onze klanten en de bank écht verder helpen. En niet one-off producten, maar bouwt aan een modulair, schaalbaar platform.  Stel je voor dat je op een state-of-the-art Datalab werkt, waar je een dedicated data cluster hebt met alle open source tools die je nodig hebt om het verschil te maken. Vind jij het leuk om technisch complexe puzzels op te lossen? Om waarde toe te voegen door data en analytics écht te laten werken? Lees dan vooral verder! Impact creëren Het ontwikkelen van ons state of the art text-analytics platform van front to back; Het maken van oplossingen en architecturen die veilig en schaalbaar zijn; Het ontwikkelen, uitrollen en implementeren en gebruiken van de analytics producten; Het bouwen van databases, herbruikbare software en robuuste data pijplijnen; Het ontwerpen en opzetten van API’s en microservices; Met elkaar Samenwerken is de manier waarop we werken. Ons team Data Science & Business Consulting bundelt de krachten om de gehele organisatie te ondersteunen met data analytics toepassingen. Met jou erbij als Machine Learning Engineer staat de teller van het team op 45 diverse collega’s waaronder Data Scientists, Data Engineers en Business Consultants. Met jouw talenten Natuurlijk ben jij klantgericht, ben je gefocust op resultaat, kan je goed samen werken in teamverband en kijk je een outside-in naar de verschillende business puzzels. Juist die eigenschappen maken jou tot een goede Machine Learning Engineer. Daarbovenop is het belangrijk dat je alles op onderstaande checklist herkent: Relevante achtergrond in Computer Science of gerelateerde studies; Ervaring met Unix/Linux, GIT en Docker; Ervaring met Flask, Django, React, Angular of Vue; Database ervaring met PostgresSQL, Mongo, Elastic, Cassandra; Message queue engineering ervaring met Kafka, RabbitMQ; Ervaring met algemene programmeertalen zoals Java/C/C++/Python; Affiniteit met Machine Learning en werken in een analytics omgeving; Beheersing van de Nederlandse en Engelse taal. Bij de Rabobank Dat de Rabobank een financiële dienstverlener is voor meer dan 8,5 miljoen klanten in 40 landen, wist je vast al. Weet je ook dat we met elkaar werken aan een betere wereld? Dit doen we op 101 manieren, zoals: We zetten ons elke dag in om een duurzamere leefomgeving te creëren. We stimuleren bijvoorbeeld collega’s met het openbaar vervoer naar kantoor te komen en gebruiken groene energie. We hebben een samenwerkingsverband met het Rode Kruis waardoor je een bijdrage kunt leveren aan het verbeteren van de humanitaire hulp, bijvoorbeeld door het inzetten van data analyse. Wil jij dit ook? Wil je blijven leren en groeien? Wij helpen je er graag bij door jouw ontwikkeling centraal te stellen en te investeren in een omgeving waarin je blijft leren. We geven je de ruimte om te innoveren en ondernemen. Zo bieden we je volop groeikansen en helpen je verwachtingen te overtreffen en het goede buitengewoon goed te doen, zodat je kan groeien als professional. Daarbovenop kan je bij ons (o.b.v. een 36-urige werkweek) ook rekenen op: een salaris in schaal 8; een dertiende maand en vakantiegeld; een Employee Benefit Budget van 9% van je maandinkomen). Hoe jij dit budget inzet, is aan jou. Denk bijvoorbeeld aan het kopen van extra vakantiedagen, een extra storting in je pensioen of zelfs het maandelijks laten uitbetalen van dit budget; een persoonlijk budget, dat je kunt besteden aan activiteiten gericht op jouw ontwikkeling en loopbaan; flexibiliteit in werktijden en locatie onafhankelijk werken; 100% vergoeding van woon- werkverkeer als je met ov reist! Toch met auto of motor? Kies dan voor een woon- werkverkeervergoeding; een pensioenregeling waar je zelf maar 3,5% aan bijdraagt.  Laten we kennismaken Ben jij hem/haar? Onze nieuwe collega die de Rabobank wil versterken als Machine Learning Engineer? En zo het verschil wil maken voor jezelf, onze klanten én de maatschappij? We ontvangen graag jouw sollicitatie op deze vacature. Handig om te weten: Hila Leupen-Turabaz, Senior Recruiter, beantwoordt met plezier vragen over de sollicitatieprocedure via mail, hila.leupen-turabaz@rabobank.nl. Screening is onderdeel van de sollicitatieprocedure. We toetsen op basis van de screening procedures die binnen de Rabobank gelden of nieuwe medewerkers voldoende betrouwbaar zijn om werkzaamheden bij de Rabobank te verrichten. Voor deze vacature maakt een individueel assessment deel uit van de sollicitatieprocedure. Wij willen jouw talent in de breedste zin van het woord inzetten en kijken graag breder naar jouw reactie dan deze vacature. Jouw profiel wordt meegenomen in de Sourcing Board Data & Analytics. Mocht je hier bezwaar tegen hebben dan kun je dit per mail aangeven bij Data.analytics@rabobank.nl. Jouw privacy is belangrijk voor ons. Mocht je hier meer over willen weten, klik dan deze link. Iedereen is anders, en juist de verschillen in mensen helpen ons om een nog betere bank te zijn. Daarom zijn we zijn benieuwd naar wie jíj bent! Vergeet niet aan je sollicitatie je motivatie toe te voegen en vertel in je motivatie meer over je interesse in deze functie.",2021-03-17 18:49:24
9ce5e72a9dc0c31b,"As a data scientist/engineer you facilitate data-driven decision-making by making data available for analysis in an accessible format. You do this by leveraging your expertise and skills in computer science, applications and statistics. You build a detailed understanding of the data, and use this in collaboration with other teams to find valuable insights from and ensure the validity of the data managed by GRESB. You work in a team with other data scientists, and report to the Lead Data Scientist. As a data scientist/engineer, your tasks include:  ETL: extracting, cleaning, transforming, and analyzing data for internal and external stakeholders Contributing to development of internal R packages, performing code reviews, and writing documentation Improving data validation/quality processes Collaborating with software engineers to implement data science algorithms in production code and provide advice on data structures Collaborating with non-technical team members, acting as the technical expert for product development   The IT & Analytics Team As a data scientist/engineer, you will be part of the larger IT & Analytics team, which includes product owners and software engineers in addition to data scientists/engineers. Our team embraces Agile methodologies and values open communication and a collaborative spirit. We are looking for someone who has a growth mindset and is excited to learn, grow, and adapt over time. For this position we are looking for the right candidate to complement our team, and are flexible to experience. Both junior and medior candidates will be considered.  Tech Stack The tech stack across the full IT & Analytics team includes: R, PostgreSQL, Dash, Shiny, Ruby on Rails, Go, StimulusJS and React. We use Github to manage our code repository and AWS to host our software. Requirements To be eligible for this position you need to have 2 years of relevant work experience. Experience with the following is a must: R, Python, Julia or any other data science programming language SQL Git Experience with the following is a plus: Working with Github or similar to collaborate on shared code Developing and deploying applications Cloud technologies such as AWS Docker and web API framework Benefits 25 days of paid holidays Company pension plan Personal development budget of EUR 2,500 annually Involvement in a fast growing international organization that is globally recognized as the leading sustainability benchmark for real assets International environment - our team includes more than 15 nationalities Free public transport to and from work inside the Netherlands Free and healthy lunch at the office Live in Amsterdam, one of the world’s most international and sustainable cities A lot of [digital] fun things you can join such as zoom-drinks or participate in a company-sponsored Triathlon Work from home or work from the office: we have adopted a hybrid way of working that supports your preference (depending on COVID 19 regulations)   COVID-19 update  For the safety of our employees and following the measures implemented due to COVID-19, we currently work differently. Our hiring process is currently entirely remote via phone and video calls. New hires will have a remote onboarding since we care about the well-being of our employees. About GRESB  GRESB was launched ten years ago by a group of large pension funds who wanted to have a better engagement with their managers on sustainability issues. In the intervening years, we have grown to become the leading Environmental, Social and Governance (ESG) benchmark for real estate and infrastructure investments across the world. Our ESG data and benchmarks now cover over USD 5.3 trillion in real estate and infrastructure value and are used by more than 100 institutional investors to make decisions that lead to a more sustainable world. We have an engaged community of asset managers who are proud to participate in our annual benchmarking process and a group of inspirational industry partners and ESG service providers who amplify our reach. The GRESB team comes from diverse backgrounds with experience spanning climate, sustainability, data science, software development, real estate, infrastructure, and the capital markets. We’re passionate about tackling the sustainability challenge by providing the insights that will power the markets of the future and enable investors to allocate the world’s capital in a more responsible way. We are an energetic group of 35 people, covering many different nationalities, located in Amsterdam, with satellite offices in Washington DC and Sydney. We care deeply about creating a positive and inclusive working environment where everyone feels comfortable contributing their ideas. In the pre-COVID 19 period we had shared lunches, regular happy hours and team retreats.",2021-03-17 18:49:28
9620a9c91cd50998,"Do you want to develop a digital platform that will disrupt the consolidated logistics industry? The Twill vision is to create a world where products & services can flow freely for everyone – and we are just at the beginning of an exciting journey. We want to remove the logistical barriers of international trade (freight forwarding) for small to midsize customers. We need your help to smoothen the customer experience of getting a quotation and ensure that this quotation is what the customer will receive as an invoice. This includes working with the Twill pricing team and data scientist(s) to bring advanced pricing models and products to accelerate Twill’s growth. You are part of a cross-functional, self-managed team, building the product together with software engineers, UX/UI designers, and scrum masters. Moreover, as a data-driven Product Owner, you’ll work closely with business partners in sales, operations, and fellow Product & Tech colleagues. Here’s a little taste of your challenge…  1. Most of all you are responsible for your own domain in customer-facing product development and you will always push people to improve the user journey while making sure it is consistent, reliable, and scalable. 2. You are the front runner of moving a sales-driven industry to a digital sales-driven journey, together with your product owner colleagues. 3. Define and maintain your product backlog, prioritize features based on value, create your product domain vision and strategy, create transparency with stakeholders and development teams. 4. Refine business requirements with development teams: engage both designers and developers in defining and refining epics and user stories. 5. Engage with stakeholders, analyze user behavior and market trends to define what features to maximize value and innovate 6. Be creative in positioning Twill’s pricing strategy in the competitive market and find the right strategic partners and initiatives to accelerate.  WHAT YOU CAN EXPECT FROM US? You will have the opportunity to make a big impact, having the responsibility for providing an instant quotation to our customers it would be impossible to run Twill. Without you, customers would still need to wait days till weeks before they have negotiated a usually intransparent quotation. Next, we like to have fun at Twill. There is no sense in coming to work every day if you don’t like the people you work with. On top of that, you can expect: A wonderful opportunity to make a big impact on your domain by leading the product prioritization and roadmap. You will be “a spider in the web” and ""CEO"" of your product(s). Being part of an experienced Product team, which gives you the opportunity to develop yourself further. Daily fresh fruit, lunch, drinks, and the best coffee you could wish for. On Fridays there is breakfast. A great place to work, only 600 meters walking from The Hague Central Station, multiple meeting rooms, phonebooths, ping-pong table, canteen. The right laptop for you. Do you prefer a MacBook Pro or Windows/Linux laptop? You choose. Competitive salary, a performance-based bonus, 30 annual leaves, a mobile phone, travel allowance, home internet contribution, and contribution to your pension scheme.  WHAT WE EXPECT FROM YOU: A successful Product Owner at Twill can’t be defined. There is no one way to go about the work, and everyone is different. Probably you have experienced that yourself already over time. But to be successful in this role, this is the kind of profile we have in mind: More than 3 years (Scrum) Product Owner experience with developing high volume B2B or B2C e-commerce sites. An advanced Professional Scrum Product Owner certification is preferred. Passionate about product development, methodologies, and tools, plus constantly looking for ways to improve. Smart, hands-on, and creative individual who keeps the customer at the heart of everything you do, while having strong commercial awareness. A strong, well-supported opinion about the future of your domain. Data-driven. Base your decisions and prioritization on facts rather than opinions. Experience with Google Analytics is a must. Experience with user research and A/B testing are pré. Note: You are working, or are eligible to work as EU-citizen, in the Netherlands or Poland.",2021-03-17 18:49:30
ffa26d7c05a0b522,"Functie  We are looking for two (senior) technicians who are motivated to work in a multidisciplinary and international environment. Within a team you will be investigating the immunological response to new viral vaccine candidates using small animal models. These vaccine candidates may include vaccines against SARS-CoV2, HIV, or RSV.  Techniques that you will use include ELISA, neutralizing antibody assays to measure virus entry inhibition, ELISPOT, intracellular cytokine staining, in vivo imaging of small animals (bioluminescence and fluorescence), and other immunology and virology-related assays.  The position requires planning, independency, and performing of experiments, followed by data analysis and reporting and presenting of the data to the responsible scientist, and a broader audience.  Functie eisen  HLO or MSc degree in a life science related field  Holder of ""artikel 6 or artikel 12"" and hands-on experience required.  Experience with immunological and/or virological techniques is required.  Experience working with PBMCs is a nice to have.  Aanbod  A great job opportunity in a multidisciplinary and international environment.  Sollicitatie Procedure  Contactpersoon voor deze functie is Joost Storms, bereikbaar op telefoonnummer 023 55 78 529 of via e-mail: joost@xdes.nl Kenmerk: 9904.",2021-03-17 18:49:32
f70cb6470c997461,"Zonder de Data Engineer geen werkbare data-aanpak bij de bank. Een fascinerende functie die iedere dag het uiterste van je vraagt. Solliciteer nu en ervaar het zelf! Wat maakt deze functie aantrekkelijk voor jou? Je verdient een goed salaris op basis van kennis en kunde; Je komt te werken in een datawalhalla. Wat ga je doen? De Data Engineer is dé expert op gebied van data-infrastructuur. Om alle in- en externe databronnen die een bank gebruikt goed samen te brengen in een bruikbare database heb je heel veel kennis nodig van scripting en programmeertalen. De Data Engineer verzamelt data uit meerdere bronnen en integreert zo zoveel mogelijk in één database (een Data Warehouse). Zonder Data Engineering is het analyseren van alle beschikbare data uit een organisatie niet mogelijk. Het werk van een Data Analist of Data Scientist kan pas beginnen als de Engineer klaar is. Banken zijn voor hun kernprocessen afhankelijk van data. Met name in de Risk & Compliance zijn ze bovendien zeer afhankelijk van de integratie van verschillende databronnen. Om die reden zijn banken doorlopend op zoek naar Data Engineers. De Data Engineer is in zijn dagelijkse werk ook betrokken bij datavraagstukken. Denk aan problemen met datakwaliteit of datagebruik. Van een Engineer wordt doorlopend verwacht dat hij meedenkt over problemen en de daarbij behorende oplossingen op datavlak. Daarbij stelt de Engineer zichzelf regelmatig de vraag: wat heeft de eindgebruiker (de klant) hier uiteindelijk aan? De Data Steward en de Business Analist zijn de voornaamste bewakers van deze datakwesties, maar de Engineer denkt hier zeker in mee en heeft een signalerende rol op dit vlak. Waarom kies jij voor deze functie? Je hebt al een aantal jaren ervaring als Data Engineer. Je technische kennis van databases kent geen grenzen. Een uitdaging is welkom. Je zoekt een markt waar data zo rijkelijk vloeit dat de beheersing van deze stroom een serieuze klus is. Het bankwezen bijvoorbeeld. Door de toenemende hoeveelheid transacties wordt de afhankelijkheid van data met de dag groter. En de data-afdelingen worden met de dag belangrijker. Dit trekt zeer veel professionals aan en dit maakt data-afdelingen van banken tot inspirerende werkplekken waar de passie voor het vak door iedereen dag in, dag uit ervaren wordt. Klinkt aanlokkelijk? Reageer dan zeker! Over het algemeen zijn er een aantal terugkerende functie-eisen voor Data Engineers: Je hebt een HBO/WO diploma op ICT-gebied; Je hebt minimaal twee jaar ervaring als Data Engineer; Je hebt verregaande kennis van programmeertalen zoals SQL; Je hebt ruimte ervaring met ETL-tooling. Waarom kies jij voor Carrierecafe? Carrierecafe streeft naar werkgeluk op de lange termijn. We leren de persoon achter jouw CV graag kennen. Onze recruiters hebben jarenlange ervaring in de financiële wereld en daarom weten we waar jij het beste tot je recht komt. Mogelijk is dat bij de opdrachtgever van deze vacature. Misschien zien we een andere loopbaankans voor je. We helpen je om succesvol te worden op je eigen manier. Carrierecafe communiceert transparant naar jou. We zijn overal eerlijk en concreet over. Voor en ná je sollicitatie. Je toekomstige takenpakket, het beoogde salaris dat daarbij hoort en zelfs je kansen op een openstaande functie, we doen nergens geheimzinnig over. Carrierecafe gaat graag een lange reis met je aan. Eerlijkheid duurt het langst! Dus wil jij succesvol en gelukkig worden op de werkvloer? Kies dan voor Carrierecafe! En natuurlijk hebben we ook secundaire voorwaarden! #LI-DS1",2021-03-17 18:49:34
5cabb58e271ba45e,"Accenture Digital - Data Science Manager  Disrupt the way the world works by using your skills to transform Accenture clients in the digital businesses of tomorrow. Unleash your talent and bring business closer to the people they serve via cutting edge digital solutions developed by you. Leave your digital mark on the world.  Data science is in high demand. Accenture is currently looking for an outstanding Data Science Manager to complete the team.  Your impact As a Data Science Manager, you will lead a team of data scientists in delivering value to our clients while developing our business, skills and people. You align client business strategy, KPIs to impact, and data science use cases. You will propose new problem-solving solutions and methodologies; data modelling, analyses & interpretation. You apply the latest algorithms and techniques like deep learning and other machine learning techniques to create client value through insight generation and decision support –then turn these into action (eg. build a recommender system, determine customer segments through clustering, analyze a large text corpus to learn about the writers sentiment, predict the next best action).  You facilitate workshops/interviews to bridge the gap between data analytics and business outcomes. You provide advice to clients by translating analytical solutions into recommendations. You help achieve strategic goals and impact business results.  Your background Master’s degree in a quantitative field (Econometrics, Computer Science, Business Analytics, Quantitative Marketing) with a specific emphasis on data. 5+ years of hands-on experience in analyzing data through statistical modelling and machine learning to tackle business questions. Excellent communication and presentation skills: able to explain Analytics in non-technical terms to business users (C-level, line managers, etc.) You know your way around statistical software packages (R, SAS, SPSS, etc.), relevant programming languages (SQL, Python, R, C, VBA, etc.), machine learning techniques (Neural Networks, Random Forest, etc.), machine learning solutions (Google Tensorflow, IBM Watson, etc.) and visualization (Tableau, Qlik, D3, etc.) Sharp analytical capabilities combined with the ability to develop and transform concepts into pragmatic and innovative solutions Effective communication in Dutch and English Are you interested? Are your ready to join Accenture as Data Science Manager and change the world around you? Accenture cares about privacy and we process personal data in accordance with our privacy statement. In order to be compliant with our privacy policy, we kindly request you to apply for the position on the Accenture website. For more questions or information about the vacancy please contact Vera Klaasen via vera.klaasen@accenture.com. Innovation is about bringing different people, ideas and perspectives together. As an equal opportunities employer, Accenture welcomes all applications and does not discriminate.  About us Accenture solves the toughest technological challenges through standout strategy, consulting, digital, technology and operations. Working with over three-quarters of the Fortune Global 500, we drive innovation and shape world around us. With expertise in more than 40 industries and all business functions, we deliver ground-breaking outcomes for a new digital world.  Accenture Digital believes every business is a digital business. We use the power of digital to redefine how business serves connected customers and operate connected enterprises. With complete, integrated digital business and technology services Accenture digital delivers game-changing solutions in the real and virtual world. Do you want to know more about a career at Accenture Digital? Visit our website https://www.accenture.com/nl-en/careers/digital or follow us at www.Facebook.com/accenturenl.  We do not only want to impact our clients but also the people around us and the region we work and live in, for example via the local initiatives of our Corporate Citizenship Program. With the right personal coaching and the local and international projects, we offer you can be at your best and shape your career.",2021-03-17 18:49:37
