id,description,scrapetimesdescription001bc19bda86faa4,"Job Description  As a hands-on Senior Data Scientist within WAES' Data Science and Data Engineering Community, you design models and develop algorithms to create groundbreaking new products and solve fundamental high-impact problems of strategic importance. In close collaboration with our customer’s engineering teams and domain experts, you create value from data and transform companies to becoming data-driven organizations.  As a Senior Data Scientist at WAES you: Work on long-term projects at highly dynamic and fast-paced organizations in the Netherlands; Create digital products out of data that would have never been invented without you; Provide insights that allow multinational organizations to make data-driven strategic decisions; Have the opportunity to work at different organizations to solve different sorts of challenges; Continuously develop both yourself, the people around you and the data insight for the better;  Qualifications Practical MSc or Ph.D. with excellent results in the field of Computer Science, Mathematics, Engineering, Econometrics or similar; Deep understanding of neural networking, deep learning, data mining, artificial intelligence, and statistical model programming; 3+ years hands-on Python experience in the commercial project; Solid experience with open source big data technologies and platforms (i.e. Hadoop & Spark, MLFlow, Tensorflow). Working with graph databases and tools is an additional advantage; Excellent understanding of machine learning applications & algorithms, both supervised and unsupervised. Knowledge of Isolation Forest and/or NLP techniques is an additional advantage; Experience working with cloud solutions like AWS, GCP or Azure is a must; Native working in agile development environments, working cross-team and cross-project; Strong communicator, passionate about the field and your project, able to bring concepts and result clearly across to multiple stakeholders;  Additional Information  WAES is a Dutch Software consultancy company, specialized in large-scale cloud development. Our mission is to build a strong team of Senior Data Scientists, Data Engineers, Software Developers and QA Automation Specialists from all over the world who can solve our clients' toughest challenges. With 60+ talented consultants, we are helping our clients with high-quality tech solutions in healthcare, logistics, fin-tech, high tech, and several other domains.  WAES is a growing company, and we are striving to become the most well-known tech house in the Netherlands. As continuous learning and new technology is a part of our everyday life, you will work in a dynamic and fast-moving environment.",2021-03-17 18:20:41
ca1a9a1ff3cc8eb5,"Vacaturenr. 21-113 Functie-categorie PhD-posities Omvang (fte) 1.0 Extern/intern Extern Locatie Leiden Geplaatst op 4 maart 2021 Sluitingsdatum 31 maart 2021  Leiden Institute of Advanced Computer Science in collaboration with Leiden University Medical Centre is looking for a PhD candidate for “Machine learning to enhance temporal coding for cochlear implants” project Project description Over 5% of the world's population suffers from hearing loss. Today, for deaf and severely hearing impaired people, cochlear implants (CIs) are the standard treatment. However, CIs have a limitation in properly transmitting detailed temporal information from the sound to the auditory nerve. This manifests itself in difficulties with speech understanding with background noise, tonal languages, directional hearing and music perception. TEMPORAL is a joint project with the Leiden University Medical Centre (LUMC) that aims to develop improved speech coding strategies for the CI speech processor that better transmits temporal information to the auditory nerve. To do this, a combination of three techniques will be used: computer modeling, artificial intelligence (AI), and patient-centered research. These new speech coding strategies will lead to improved perception in the difficult listening situations. Key responsibilities You will focus on using state-of-the-art Machine Learning techniques for tuning configurable parameters of the CIs to better approximate the spike trains that normally transmit the information to the brain. You will use nonlinear optimization through evolutionary algorithms and develop suitable loss functions for spike trains and noise handling. Appropriate machine learning and cross-validation techniques will be developed in this research too, for assuring generalizability of the results. During the project, you are expected to write the research articles that together will form the basis of a thesis to attain a PhD degree (dr.) at Leiden University. The PhD student will participate in the education and supervision program of the Leiden Graduate School of Science. Selection criteria A MSc or equivalent degree in Computer Science, Computer Engineering, Artificial Intelligence or a similar field; Expertise through your field of study in particular in machine learning, evolutionary computation, nonlinear optimization, multiple criteria optimization, simulation, deep learning, and audio data analysis; Excitement about working in an interdisciplinary team with clinical experts and medical device experts; Excellent proficiency with Python and C++; Matlab will also be useful; Excellent communication skills and interest in the interdisciplinary character of the project and the required ability to communication between computer science and the medical side as well as the medical device production company; Creative thinking and highly motivated; Excellent proficiency in the English language. Our organisation This PhD position is part of the Health Holland TEMPORAL project that combines computational modelling, state-of-the-art Machine Learning techniques and patient testing, to develop a new speech coding strategy which allows for better neural encoding of temporal fine structures. This will lead to improved perception of music and tonal languages, improved speech understanding in (fluctuating) noise and enhanced directional hearing, with either two CIs or a CI and a contralateral hearing aid (bimodal hearing). In total, this project will be recruiting 2 PhDs to be based at LUMC (see open positions at the LUMC site) and 1 PhD to be based at LIACS as advertised here. LIACS supervisory team will consist of Prof. dr. Thomas Bäck and dr. Anna V. Kononova. Both are experts in evolutionary computation and machine learning. The Leiden Institute of Advanced Computer Science is the Artificial Intelligence and Computer Science Institute in the Faculty of Science of Leiden University. We offer courses at the Bachelor and Master of Science level in Artificial Intelligence, Computer Science, ICT in Business, Media Technology, and Bioinformatics. According to an independent research visitation, we are one of the foremost computer science departments of the Netherlands. We strive for excellence in a caring institute, where excellence, fun, and diversity go hand in hand. We offer a clear and inviting career path to young and talented scientists with the ambition to grow. For more information about LIACS, see the website. At the Leiden University Medical Center, we continuously work on improving patient care. We invest in ground-breaking, international research and work with the latest equipment. Together with our team of doctors, medical specialists, teachers, academic researchers and supporting staff, we aim for the best quality in health care, education and international research. And we need you to realize our goals! Terms and conditions We offer a full-time temporary position for initially one year. After a positive evaluation of the progress of the thesis, personal capabilities and compatibility the appointment will be extended by a further three years. Salary range from € 2.325,- to € 2.975,- gross per month (pay scale P in accordance with the Collective Labour Agreement for Dutch Universities). Leiden University offers an attractive benefits package with additional holiday (8%) and end-of-year bonuses (8.3 %), training and career development and sabbatical leave. Our individual choices model gives you some freedom to assemble your own set of terms and conditions. Candidates from outside the Netherlands may be eligible for a substantial tax break. All our PhD students are embedded in the Leiden University Graduate School of Science. Our graduate school offers several PhD training courses at three levels: professional courses, skills training and personal effectiveness. In addition, advanced courses to deepen scientific knowledge are offered by the research school. Diversity Leiden University is strongly committed to diversity within its community and especially welcomes applications from members of underrepresented groups. Information Additional information about the PhD position can be obtained from the member of the supervision team, Anna Kononova, email a.kononova@liacs.leidenuniv.nl Application You can apply for this PhD position no later than March 31th, 2021. Your application should include pdf-versions of a Curriculum Vitae, a Letter of Motivation, and an MSc diploma with transcripts (courses + grades). To apply for this vacancy, please send an email to jobs@liacs.leidenuniv.nl. When applying, please use the following subject: “vacancy number – your name”.",2021-03-17 18:20:44
f296cbaedd54cc6f,"This is Adyen We took an unobvious approach to starting a payments company, building a platform from scratch. Today, we're the payments platform of choice for the world's brightest companies. Our unobvious approach is a product of our diverse perspectives. This diversity, of backgrounds, cultures, and perspectives, is essential in helping us maintain our momentum. Our business challenges are unique, we need as many different voices as possible to join us in solving them - voices like yours. So no matter where you're from, who you love, or what you believe in, we welcome you to be your true self at Adyen. Data Analyst We are looking for an enthusiastic colleague to join our team in Amsterdam. In this role, you will be looking to leverage our Big Data infrastructure to deliver actionable insights both internally and externally. This is a very dynamic role that will have you wearing multiple hats throughout your week. You could be the technical master working side by side with data scientists on machine learning projects, the BI master that builds out dashboards for internal insights or the product master that helps shape the products we offer in a data driven way. We will try to help you find your most effective path that will leverage your skills and interests. What you'll do Optimize payment processing quality for the benefit of our full client base Building the backend for and delivering insights for your team or Adyen's merchants Collaborate with engineers, data scientists and product managers to test, iterate, and measure impact of proposed solutions Connect with a diverse set of merchants worldwide, and gain an in depth understanding of the most complex problems facing the FinTech world today Performing analyses for any internal team within Adyen if the need arises Provide our Sales and AM teams with relevant insights to close deals or drive new volume within existing markets. Who you are Have an entrepreneurial spirit Strike good balance between technical and commercial understanding Excellent in communication of complex data or technical functionality with commercial or client teams Familiar with data analysis languages such as Python (preferred), R or Matlab Feel comfortable writing queries in SQL Experience with big data tooling i.e. Pyspark / Hadoop / Airflow is a big plus Experience with BI tools, Looker specifically is a plus Experience in the FinTech industry is a plus Who we are Adyen is the payments platform of choice for the world's leading companies, delivering frictionless payments across online, mobile and in-store channels. It is the only provider of a modern end-to-end infrastructure, connecting directly to Visa, Mastercard, and consumers' globally preferred payment methods. With offices around the world, Adyen serves nine of the 10 largest U.S. internet companies and many worldwide retailers. Customers include Facebook, Uber, L'Oreal, Casper, Bonobos, and Spotify. Ready to meet us? If this role looks like your next challenge, apply by clicking the below link. We can't wait to meet you!",2021-03-17 18:20:48
31455f986c0f0e42,"Job Type Contract  Location Amsterdam  Area Netherlands  Sector Big Data & Analytics  Salary Market related  Start Date ASAP  Job Ref KW-Stat  Description Templeton and partners are seeking a Statistician for our global client in Amsterdam to work on: Subsidence-forecasting: Quality-checking and bug fixing of existing python code, development of new modules Corrosion modelling: Improvements to existing methodology New product development and R&D support: DoE and analysis, answering miscellaneous queries to support data scientists  Requirements Solid grounding in Maths/Stats – MSc at least, PhD preferred Ability to develop Bayesian stats methods Knowledge of Design and analysis of research experiments Coding experience, preferably Python, (but R or Matlab experience would give someone a head start), experience of Agile ways of working would help Ability to relate to customers, understand issues and communicate",2021-03-17 18:20:52
2a75175d69bfde30,"At Everon, we make expansion into EV charging easy and profitable, now and in the future. With a focus on the larger movers and forces in the industry, Everon is the world's premier cloud-native and multi-tenant Platform-as-a-Service. Built from the ground up to be global, future proof, API-first and highly scalable and secure.  EV Charging is becoming a bigger player within the public infrastructure of many countries around the world. The extensive amount and richness of EV data we have been collecting so far, when processed and analyzed properly, can greatly support our business decisions, and - if surfaced properly through our platform - can further shape the global EV charging market.  As Senior Data Engineer you will join our Data team which is composed of skilled engineers and data analysts focusing on expanding the data capabilities of the Everon platform. This team is making EV charging data driven, intelligent and more attractive by providing actionable insights.  Your role will heavily focus on design and building technically sound software systems in the ""big data"" domain. You will be responsible for extending and optimizing our data pipeline architecture, optimizing data flows, data extraction, transformation and processing. We expect you to work closely with all the stakeholders (in technology and product management) and collaborate efficiently within the team to identify existing and potentially new data sources, establish target architectures and deliver required initiatives and work in time and with high quality.  Main responsibilities: Design and implement large-scale software systems in a ""big data"" environment Optimise all stages of the data life cycle, from initial planning, to ingest, through final display and beyond Design, build and support data processing pipelines and APIs Architect and build data pipelines to optimize for performance, data quality, scalability, ease of future development, and cost Assemble complex data sets that meet functional / non-functional business requirements Design and build the infrastructure required for optimal extraction, transformation, and loading of data from a wide variety of data sources using GCP 'big data' technologies and beyond Work with stakeholders including the Executive, Product, Data and Design teams to assist with data-related technical issues and support their data infrastructure needs Collaborate closely with Data Analysts and Data Scientists to work out new and innovative solutions as well as develop plans to incorporate and enhance data science practices Display sense of ownership over assigned work, requiring minimal direction and driving it to completion Remaining up-to-date with industry standards and technological advancements that will improve the quality of your outputs.  Experience we expect you will bring: 4+ years of experience in Data Engineering role 7+ years of overall experience as a Software Engineer (you bring excellent software engineering skills and knowledge of the software development lifecycle and agile methodologies) Good experience programming in Java Deep experience in building highly scalable, distributed services, capable of handling large amounts of data Experience building and optimizing ""big data"" data pipelines, architectures and data sets Build processes supporting data transformation, data structures, metadata, dependency and workload management Experience in designing and building machine learning algorithms and systems Experience with relational SQL and NoSQL databases Experience with big data tools: Hadoop, Spark, Kafka, etc. Experience with GCP cloud services: Big Query, PubSub, Dataflow Experience with stream-processing systems: Storm, Spark-Streaming, etc. Experience in mentoring other team members in development best practice and methodologies Ability to work in a team environment that promotes collaboration Curiosity, open-mindedness, drive, and a proven ability to work independently or as part of a team  Our offer to you: In addition to collaborating with a dynamic group of top industry and subject matter experts, we will provide you a competitive salary and the following benefits: option to work from home partially, high-end laptop + related equipment, contribution to private pension fund, discounted health insurance, 25 days holiday (unpaid leave possible) and home-office travel compensation.  Our well-connected modern office in Amsterdam (in a super sustainable building) always has free fruit and great coffee available. We will actively encourage your growth in the business and will support you (mentoring, training budgets) to realize your goals whilst you make your mark on this evolving industry.  About us: We're building a team of problem solvers and makers. People with a proactive attitude and the drive to change the future of mobility. From developers to designers, managers and specialists; our office welcomes professionals from different backgrounds and values diversity as a strength. We currently have over 140 people working with us from 33 different nationalities. Together we make a global platform, powered by data-driven services.  Are you ready to join our mission? Build a platform, cut emissions, change the future.",2021-03-17 18:20:55
3d22e08bff1f8b6d,"Voor een van mijn klanten ben ik per direct op zoek naar een Lead Data Scientist. Verantwoordelijkheden – Het vertalen van business vraagstukken naar Data Science oplossingen – Het meehelpen bouwen aan voorspellende modellen. – Het presenteren van jouw ideeën en resultaten aan stakeholders – Het aansturen van een klein team van Data Scientists (3FTE) Eisen – Minimaal 7+ jaar relevant ervaring als Data Scientist – MSc of PhD in de richting van Wiskunde, Econometrie, AI, Natuurkunde etc. – Ruime ervaring met diverse methoden en technieken vanuit het analytics domeine (data mining, machine learning, deep learning, NLP etc.) – Ruime ervaring met data-gerelateerde software en technologie als; Python, R, SQL, Hadoop, Spark etc. – Communicatief vaardig – Ervaring met coaching/aansturing van specialisten – Teamplayer, Creatief, Ondernemend, Doorzetter Meer weten? kai@analysepeople.nl",2021-03-17 18:20:58
a5eba360d8fd0fdd,"Location: Amsterdam (Netherlands) Job category: AD - Product Analyt Dev't  uniQure is dedicated to bring innovative therapies or unmet medical needs to patients. In doing so each function in uniQure is directly or indirectly responsible for the lives of patients. This responsibility should be part of our day-to-day working life by (i) living up to high quality standards and (ii) recognizing the sense of urgency in areas of high medical need.  Purpose of the role  The Analytical Support Supervisor will be part of the Product Analytical Development (PAD) group. The Analytical Support Supervisor will focus on planning, execution and reporting of laboratory activities. The core tasks will be focused on planning, designing, executing and reporting experimental work, data analysis trending, and reporting, SOP/Documentation writing.  Place in the Organization  The PAD Group is embedded within the Analytical Development department, which also consists of Bio-Analytical Development (BioAD), and Drug Product Development (DPD). The Analytical Support Supervisor will be a contributor to the activities of PAD group with a specific attention toward the critical activities of the PAD group:  Developing, qualifying and transfer of product-specific assays to be used for release testing, stability testing, and extended characterization. Providing analytical support to DPD and PD (Process Development) activities by ensuring consistent and timely execution of standardized platform product characterization assays, including data review, storage and trending. Integrating new program products into uniQure analytical platforms, to ensure timely progress of transfer and regulatory filing efforts.  The Analytical Support Supervisor reports to the Analytical Development Senior Scientist /Team Lead.  Key result areas (major duties, accountabilities and responsibilities)  Independently plan own and team laboratory work to ensure maximum efficiency while ensuring alignment with overarching deliverables and laboratory resource utilization (e.g. use of lab equipment) Coordinate planning, scheduling activities of technicians within the team communication and alignment with internal stakeholders. Executes experiments and prepare data overviews and reports, including interpretation of results. Suggest next steps in experimental design including rationale for suggestions Drafts and reviews laboratory and technical documentation relevant to assay execution (Electronic Lab Notes, SOPs), assay development, qualification, transfer, troubleshooting or other PAD relevant studies (protocols, reports, position papers and memos) Collect, and store experimental data sets and document analytical results to ensure maximum traceability Prepare data overviews and reports, including interpretation of results. Suggest next steps in experimental design including rationale for suggestions Ensure training of technicians on relevant analytical methods and laboratory and data recording practice Ensure all laboratory activities are performed according to applicable protocols, and follow safety and quality procedures to ensure a safe working environment and high data quality Notify superior of all observed deviations in a timely frame and provide input on the possible cause of the deviation and proposed remediation plan. Improvement of skills and knowledge necessary to successfully support assigned tasks and projects through training and independently. Continuously improve and update her/his area of expertise. Provide improvement suggestions and support the improvement implementation.  Qualifications & Skills  Minimum of BSc in a Life Sciences-related field with 10 years or MSc with 4-6 years of working experience in a biotech or pharma company . Extensive knowledge and hands on experience with aseptic cell culture techniques (e.g. insect and human cells) Extensive knowledge and hands on experience with relevant molecular biology techniques (e.g. (q)PCR, DNA electrophoresis) Extensive knowledge and hands on experience with biochemical analyses (e.g. protein electrophoresis, western blotting, ELISA) Solid experience in supervising and motivating a team of technicians and organizing laboratory activities in a clear and structured way Experience in assay design and trouble shooting Solid experience in writing technical documentation (SOP, Protocols, Reports) and review of analytical data and laboratory notebooks (e.g. ELN) Working experience in a regulated setting (GxP) and awareness of GxP pharmaceutical regulations is highly recommended Experience in viral vaccines or gene therapy is a plus Computer software skills including Microsoft Office Strong interpersonal and communication skills in English, written and verbal including presentation of technically complex data  Core competencies  Detail oriented: strong analytical skills, high level of understanding of assay principles, ability to critically analyze and present complex data sets Thorough: ability to set up and carry out tasks with an eye for completeness (e.g. results achieved according to self-prepared protocols, results compiled in clear overview and proposal for follow up experiments) Analytical Thinking and Problem Solving: signals problems, recognizes important information, traces possible causes of problems, thinks about and implements new working methods or new applications, brings forward and implements original solutions for problems related to the department and function Planning and organizing: ability to plan own and other’s work to achieve results in a timely way while ensuring the highest standard of quality, discuss with others to align planning of multiple complex activities simultaneously, scheduling activities with technicians within the team and help team members with their planning. Ability to effectively adapt and support re-prioritization of activities and goals in a fast paced environment Co-operative: ability and drive to work within and across teams, good written and spoken communication skills, ability and willingness to work in a fast-paced environment. Self-aware. Soft Skills: dependable, proactive, motivated, flexible",2021-03-17 18:21:00
