id,description,scrapetimesdescription8a4444a9f39f1b17,"Als Logistiek Procesmanager & Data Analyst ben je het cijfermatig geweten van het logistieke team en lever je een impactvolle bijdrage aan het doel van het team, namelijk alle orders zo snel - en kostenefficiënt mogelijk verwerken. Jouw rol is het toepassen van tooling om data te analyseren, relevante inzichten te formuleren je bevindingen voor stakeholders te presenteren en te visualiseren. Uitdagend, want de analyses zijn uiterst complex en we willen dat de inzichten die je ontwikkelt impact hebben. Maar daar stopt het voor jou niet, want door jouw presentatie aan de stakeholders mg jij je project ook daadwerkelijk in de praktijk gaan uitvoeren, hoe tof?! De Logistiek Procesmanager & Data Analyst rol is niet een rol waar je gewoon analyses uitvoert op aanvraag. We verwachten meer dan dat. We hebben je nodig om voortdurend nieuwe hypothesen te formuleren en te testen. Duik op eigen initiatief in de gegevens, stel innovaties of projectverbeteringen en voorstellen voor. Je bent altijd op zoek naar wat beter kan in ons logistieke proces. Jij bent als Logistiek Procesmanager & Data Analyst 50% van je tijd bezig met het verbeteren van de processen in ons magazijn. De andere 50% ben je samenwerkend bezig met de logistiek manager, logistiek coördinatoren en andere afdelingen. Jij bent de schakel tussen de operatie en de business. Jouw taken bestaan o.a. uit:  Je analyseert een forse hoeveelheid logistieke data; waar gaat het goed en waar kan het slimmer/goedkoper/strakker/schaalbaarder? Je vertaalt inzichten naar verbeter- en innovatievoorstellen, inclusief krachtige, data-gedreven onderbouwingen; Je pakt warehouse overkoepelende onderwerpen op zodat synergie tussen logistiek en andere afdelingen wordt gevonden; Je presenteert je voorstellen aan alle stakeholders, zoals het MT, de diverse afdelingen en teams alsook onze logistieke partners; Je voert de projecten uit, van start tot finish en houdt daarbij alle stakeholders aan boord; Je ontwikkelt dashboards die zicht en grip op warehousing vergroten; Je inspireert, adviseert en challenged jouw omgeving binnen en buiten Smartphonehoesjes; Je bent vooruitziend en kleurt daarbij onze roadmap, zodat Smartphonehoesjes voorop blijft lopen in de markt.  Hoe ziet het logistieke team eruit? Je komt in een geweldig logistiek team te werken, samen met Wouter (Logistiek Manager), Berend, Dyon en Astrid (Logistiek Coördinatoren). Daaronder vallen 5 teamleiders, 8 voormannen en zo’n 100 magazijnmedewerkers.  Wat krijg je van ons? Geld; Je werkt bij één van de snelst groeiende e-commerce bedrijven van Nederland; Je krijgt, maar dan moet je wel écht op vakantie gaan en ons niet meenemen, 26 vakantiedagen op basis van 40 uur; Een aantrekkelijke pensioenregeling voor als je later oud bent; Veel ruimte voor eigen inbreng, heb je een tof idee? Bring it on! Tafelvoetbal, pingpong en FIFA; Drankjes op de vrijdagmiddag en legendarische bedrijfsuitjes.    Je hebt een HBO of universitaire opleiding; Minimaal 3 jaar relevante werkervaring in een soortgelijke functie binnen logistiek of Supply Chain, bijvoorbeeld als Data Scientist, Data Proces Manager, Data Consultant, Business Analist of een andere functie waarin je met data hebt gewerkt; Superskills in tools als spreadsheats, Tableau, BigQuery, Power BI en Data Studio; Kennis van R, Phyton, SQL en databases; Beschikt over analytisch vermogen om processen snel eigen te maken en te doorgronden; Je kunt snel schakelen binnen een organisatie die altijd in beweging is; Uitstekende communicatieve vaardigheden zodat je verschillende afdelingen bij jouw project weet te betrekken.",2021-03-17 18:21:18
3cb37b48b000863f,"At Everon, we make expansion into EV charging easy and profitable, now and in the future. With a focus on the larger movers and forces in the industry, Everon is the world's premier cloud-native and multi-tenant Platform-as-a-Service. Built from the ground up to be global, future proof, API-first and highly scalable and secure.  EV Charging is becoming a bigger player within the public infrastructure of many countries around the world. The extensive amount and richness of EV data we have been collecting so far, when processed and analyzed properly, can greatly support our business decisions, and - if surfaced properly through our platform - can further shape the global EV charging market.  As Data Engineer you will join our Data team which is composed of skilled engineers and data analysts focusing on expanding the data capabilities of the Everon platform. This team is making EV charging data driven, intelligent and more attractive by providing actionable insights.  Your role will heavily focus on data extraction, transformation and processing, building high quality and technically sound data solutions, whilst assisting data analysts in building and optimising our products. We expect you to work closely with all the stakeholders (in technology and product management) and collaborate efficiently within the team to identify existing and potentially new data sources, contribute to target architectures and deliver required initiatives and work in time and with high quality.  Main responsibilities: Implement complex software systems in a ""big data"" environment Create and maintain optimal data pipeline setup Work closely with multiple engineering teams on event sourcing and event streaming concepts and implementation Assemble complex data sets that meet functional / non-functional business requirements Build the infrastructure required for optimal extraction, transformation, and loading of data from a wide variety of data sources using GCP 'big data' technologies and beyond Work with stakeholders including the Executive, Product, Data and Design teams to assist with data-related technical issues and support their data infrastructure needs Create data tools for analytics and data scientist team members that assist them in building and optimizing our product into an innovative industry leader Work with data and analytics experts to strive for greater functionality in our data systems Display sense of ownership over assigned work Remaining up-to-date with industry standards and technological advancements that will improve the quality of your outputs.  Experience we expect you will bring: 3+ years of experience in Data Engineering role 5+ years of overall experience as a Software Engineer Good experience programming in Java Experience building and optimizing ""big data"" data pipelines Strong analytic skills related to working with unstructured datasets Build processes supporting data transformation, data structures, metadata, dependency and workload management Working knowledge of message queuing, stream processing, and highly scalable ""big data"" data stores Experience with relational SQL and NoSQL databases Experience with GCP cloud services: Big Query, PubSub, Dataflow Previous experience with: Stream-processing systems: Storm, Spark-Streaming, etc. is a bonus Big data tools: Hadoop, Spark, Kafka, etc. is a bonus Ability to work in a team environment that promotes collaboration Curiosity, open-mindedness, drive, and a proven ability to work independently or as part of a team  Our offer to you: In addition to collaborating with a dynamic group of top industry and subject matter experts, we will provide you a competitive salary and the following benefits: option to work from home partially, high-end laptop + related equipment, contribution to private pension fund, discounted health insurance, 25 days holiday (unpaid leave possible) and home-office travel compensation.  Our well-connected modern office in Amsterdam (in a super sustainable building) always has free fruit and great coffee available. We will actively encourage your growth in the business and will support you (mentoring, training budgets) to realize your goals whilst you make your mark on this evolving industry.  About us: We're building a team of problem solvers and makers. People with a proactive attitude and the drive to change the future of mobility. From developers to designers, managers and specialists; our office welcomes professionals from different backgrounds and values diversity as a strength. We currently have over 140 people working with us from 33 different nationalities. Together we make a global platform, powered by data-driven services.  Are you ready to join our mission? Build a platform, cut emissions, change the future.",2021-03-17 18:21:20
ffd442172aef70aa,"Het Nivel zoekt op korte termijn een (Senior) Data Scientist/Onderzoeker. Ben jij een ervaren onderzoeker en open-minded data scientist? Breed geïnteresseerd in vraagstukken in de gezondheidszorg, zoals de eerstelijnszorg, gezondheid en ziekte in de bevolking en het voorspellen van ziekte en zorggebruik in de toekomst? Je bent een teamspeler die om kan gaan met zeer diverse soorten data en mee wil denken bij het opzetten van nieuwe projecten met grote maatschappelijke relevantie. Je kunt zelfstandig opereren en op meerdere borden tegelijk schaken. Het Nivel Werken bij het Nederlands instituut voor onderzoek van de gezondheidszorg (Nivel) betekent dat je hoogwaardig onderzoek doet naar de kwaliteit en effectiviteit van de gezondheidszorg en het eraan gerelateerde sociale domein. Dat doet het Nivel met betrouwbaar en onafhankelijk wetenschappelijk onderzoek dat direct in de praktijk wordt gebruikt. Het Nivel vindt het belangrijk dat de kennis uit onderzoek bijdraagt aan het continu verbeteren en vernieuwen van de gezondheidszorg voor iedereen, het bevorderen van participatie in de samenleving en een duurzaam gezondheidszorgsysteem. ‘Kennis voor betere zorg’ is dan ook haar missie. Bij het Nivel werken circa 160 mensen, waarvan 90 onderzoekers. Kijk voor meer informatie op: https://www.nivel.nl/nl/het-nivel-2-minuten Het cluster Routine Zorgdata Je komt te werken binnen het cluster Routine Zorgdata met ICT-specialisten en relatie beheerders, maar werkt tegelijkertijd nauw samen in de projectteams met onderzoekers. Je bent de linking pin die het verwerken van Big Data en het doen van onderzoek begrijpt en verbindt. Binnen het cluster worden data van 1,7 miljoen patiënten verwerkt. Het gaat om data van huisartsen, huisartsenposten, fysio- en oefentherapie, diëtetiek en logopedie. De routinematig vastgelegde gegevens worden door ICT-specialisten beheerd en beschikbaar gesteld voor wetenschappelijk onderzoek. Per discipline zijn verwerkingsstraten ingericht. Jouw rol Je treedt op als schakel tussen technische en inhoudelijke experts en vertaalt de informatiebehoefte naar nieuwe handvatten voor data-gedreven onderzoek. Dit vraagt zowel technische als communicatieve (verbindende) kwaliteiten. Je bent betrokken bij het onderzoeksproces van verschillende Nivel onderzoeksprogramma’s, van projectacquisitie tot eindpresentatie en nazorg, het meeschrijven aan onderzoeksvoorstellen vanuit je data-science expertise, het verzamelen en verwerken van grote hoeveelheden gegevens uit patiëntendossiers van eerstelijnszorgverleners, het samenstellen van onderzoekbestanden, het opstellen en schatten van (voorspellende) modellen en herkennen van patronen in de data. Je kunt die rol nu al zelfstandig vervullen of je krijgt de mogelijkheid die rol binnen enkele jaren te vervullen, afhankelijk van je huidige ervaring. De projecten waar je samen met onderzoekers aan werkt, zijn afwisselend en divers. Je werkt in (multidisciplinaire) teams en bent in staat om resultaatgericht keuzes te maken over de benodigde data en technieken voor een breed scala aan onderzoeksprojecten. Je kunt effectief communiceren met verschillende partners intern en extern. Jouw achtergrond MSc of PhD op het gebied van data science, Machine Learning/AI, kwantitatieve sociale wetenschappen, econometrie of (toegepaste) informatica. Ook gerelateerde opleidingen met een gedegen basis in kwantitatief beleidsonderzoek behoren tot de mogelijkheden; ervaring met en goed kunnen werken in teamverband aan complexe problemen; uitstekende communicatieve vaardigheden en een brede interesse in de gezondheidszorg; kennis van en ervaring met een programmeertaal zoals Python en R, (kennis van SQL, C# of C++ is een pre); kennis van en ervaring met ML/DL, AI en NLP technieken en geavanceerde methoden en de wens je daarin (verder) te verdiepen; affiniteit met data uit elektronische patiënten dossiers; goede beheersing van de Nederlandse en Engelse taal; goede schriftelijke en presentatievaardigheden. Wat wij bieden een uitdagende baan met een goede mix van onderzoek en operationele, ondernemende en beleidsgerichte opdrachten; een informele werksfeer in verschillende multidisciplinaire teams; samenwerking met diverse partners, waaronder andere onderzoekers, universiteiten en (overheids)organisaties; een arbeidsovereenkomst voor de duur van een jaar, die bij gebleken geschiktheid en afdoende werkaanbod kan worden verlengd; een salaris, afhankelijk van opleiding en ervaring, van minimaal € 3.541,12 en maximaal € 4.419,98 bruto per maand op basis van 36 uur per week, en doorgroeimogelijkheden; een eindejaarsuitkering van 6,83%; een NS Business card tegen een geringe eigen bijdrage; deelname aan het POST Programma van het Nivel; een pensioenvoorziening. Interesse? Voor meer informatie kun je contact opnemen met Jeroen Hasselaar, afdelingshoofd eerstelijnszorg (j.hasselaar@nivel.nl) of Wouter de Kruijff, waarnemend hoofd datamanagement (w.dekruijff@nivel.nl). Reageren: Jouw sollicitatie kun je richten aan de Nivel sollicitatiecommissie t.a.v. Astrid Huijgen, Postbus 1568, 3500 BN Utrecht of per e-mail: vacatures@nivel.nl o.v.v. ‘Data Scientist/Onderzoeker’. Met deze vacature willen wij zelf onze nieuwe collega werven. Dit is dan ook géén oproep voor acquisitie.",2021-03-17 18:21:22
fcaf16cf1a48391e,"Janssen Vaccines & Prevention, one of the Janssen Pharmaceutical Companies of Johnson & Johnson, is dedicated to bringing meaningful innovation to global health. Our teams focus on the discovery, development, manufacture and marketing of vaccines and antibodies to protect people worldwide from infectious diseases. In our organization, entrepreneurial people are working in a dynamic culture in which innovation and a 'can do' state of mind are the central points. In order to strengthen our team we are continuously looking for enthusiastic, talented people who have the ambition to develop themselves and can be of value to Janssen. The offices of Janssen Vaccines & Prevention are located in Leiden. For our Viral Vaccines department, we are currently seeking a fulltime Senior Scientist/ Principal Scientist - Biomarker Lead Department/Project: The viral vaccine group is working on the discovery and early development of vaccines for viral infectious diseases. Candidates that pass the pre-clinical evaluation and fulfill criteria of manufacturability will be tested in humans for safety and immunogenicity. Job Description: Each vaccine development program is supported by a biomarker lead that heads an immuno team in which the required experts are present to execute the immuno strategy. The Biomarker lead will be: Responsible for maintaining excellent knowledge on immunology with emphasis on the fields relevant for vaccines Defining the immune parameters that should be measured in human trials Leading a multidisciplinary team that will provide go/no go and selection immune criteria for the next phase of clinical development Expected to maintain excellent knowledge of competition and maintain appropriate network relationships with experts in the field Responsible for the translation of preclinical data in expectations for clinical data Responsible for the clinical immunological content of regulatory documents Manages Biomarker scientists and project coordinators if applicable A member of the Compound Development Team.  Qualifications  Qualifications: Education: Ph.D. in (medical) biology or medicine on a research topic in Immunology.  Specific Knowledge: Excellent and state-of-the-art knowledge of immunology relevant for vaccine development. Experience: At least 2-5 years of experience working in an academic or biotechnology/pharmaceutical environment on immunological biomarkers.  Competences: Demonstrated written and oral communication skills in English Excellent analytical skills Problem-solving oriented Pro-active and “can do” mentality What’s in it for you…? “Caring for the world, one person at a time…” As an employee, we consider you as our most valuable asset. We take your career seriously. As part of a global team in an innovative environment your development is key and our day-to-day responsibility. Through e-university, on the job training, various projects and programs, we ensure your personal growth. Our benefits make sure we care for you and your family now and in the future.   Primary Location Netherlands-South Holland-Leiden- Organization Janssen Vaccines & Prevention BV (8852) Job Function R&D Requisition ID 2105906731W",2021-03-17 18:21:24
e9c297a9ccf4cf99,"De vacature De afgelopen tijd hebben we met een aantal python ontwikkelaars hard gewerkt om een AI model op te zetten. Het is ons gelukt om op basis van winkelverkopen (kassadata) de verkopen van de komende dagen te voorspellen. En het werkt, we hebben een bewezen effectief systeem dat klaarstaat om uit te rollen in verschillende markten. Na de experimentele fase is het tijd om nu een robuust proces op te zetten waar we nieuwe datastromen en klanten op aan kunnen sluiten. Daarnaast werken we aan het continu verbeteren van het model, en zoeken we toepassingen in andere markten. Help jij ons om te voorspellen welke vacature bij welke kandidaat hoort in de flexbranche? Help jij door exacte voorspellingen het gebruik van voedsel op een gecaterde locatie te voorspellen om zo verspilling tegen te gaan? Door de verkopen van een retail locatie te voorspellen een ideale voorraadgrootte te kunnen aanhouden. De mogelijkheden zijn eindeloos en de vraag bij huidige en nieuwe klanten groot. Ga jij deze uitdaging met ons aan? Functie eisen Je bent zelfstandig binnen je takenpakket, maar vindt het gezellig om samen met collega's op kantoor te werken. Je bent doortastend, probeert het tot het lukt! Je hebt een groot verantwoordelijkheidsgevoel. Je hebt de ambitie om de wereld te verbeteren. Je wil altijd beter, en een uitstekende kwaliteit opleveren. Jouw belangrijkste taken: 01 Verder bouwen aan bewezen code; 02 Monitoren en onderhouden van lopende processen; 03 Opzetten van pipeline en unittesting; 04 Kwaliteitscontrole van processen; 05 Toepasbaarheid in andere markten onderzoeken.",2021-03-17 18:21:26
4cf0a6696266b28e,"Philips challenges you to use your analytical and project management skills to create growth for our business and yourself. The goal is to turn data into information, information into insight and insight into global business decisions. You will be responsible for conducting full lifecycle analysis to include requirements, activities and design; develop analysis and reporting capabilities; and monitor performance and quality control plans to identify improvements.   Your responsibilities As a Digital Data Lead, you will : Support the growth and development of our Coffee Digital platforms (web, app, appliance) Interpret data, analyze results using statistical techniques and provide ongoing reports Develop and implement databases, data collection systems, data analytics and other strategies that optimize statistical efficiency and quality Acquire data from primary or secondary data sources and maintain databases/data systems Identify, analyze, and interpret trends or patterns in complex data sets Work with management to prioritize business and information needs Locate and define new process improvement opportunities Build predictive models and define machine-learning needs  Your team You will be part of the Coffee team in Amsterdam a dedicated group of Marketers, business developers digital Managers within the Business Group Domestic Appliances. As a Digital Data Lead, you will be the key contact between Coffee and all relevant ""data"" partners across the company (e.g. I&D team and supplier, Marketing Intelligence, Business Group & Commercial Organization Market 2 Order teams, Strategy etc.) and outside (e.g. ecosystem partners etc.).  Our offer We welcome you to a challenging, innovative environment with great opportunities for you to explore.  We are looking for Experience & Qualifications & Knowledge Proven up to 5 years working experience as a Data scientist / Analyst Technical expertise regarding data models, database design development, data mining and segmentation techniques Strong knowledge of and experience with reporting packages (Business Objects etc.), databases (SQL etc.), programming (XML, Javascript, or ETL frameworks) Knowledge of statistics and experience using statistical packages for analyzing datasets (Excel, SPSS, SAS etc.) Strong analytical skills with the ability to collect, organize, analyze, and disseminate significant amounts of information with attention to detail and accuracy Adept at queries, report writing and presenting findings BS in Mathematics, Economics, Computer Science, Information Management or Statistics  Personality Characteristics Confident communicator capable of inspiring strong collaboration in an organization Very organized and good at planning Entrepreneurial with creative nature Results driven and pro-active Ability to identify and solve problems Self-reliant and Change leader",2021-03-17 18:21:31
9b51cd42990bbb09,"Activiteiten binnen dit bedrijf zijn onder andere het certificeren van kwaliteitssystemen, het toezicht op private kwaliteitseisen en het uitvoeren van laboratoriumanalyses. Momenteel zijn zij op zoek naar een Data Scientist voor het team Innovatie & Business Development. Binnen deze functie zal je managementparameters voor de melkveehouderij en zuivelindustrie modelleren en nieuwe informatieproducten ontwikkelen. Dit gebeurt aan de hand van meetresultaten zoals infraroodspectrum en bedrijfsmetadata. Hiermee verklaar je de veiligheid, kwaliteit en duurzaamheid van processen en de zuivelketen. Deze data analyses vormen de basis voor het nemen van gedreven beslissingen. Vanuit deze functie kan een sleutelrol worden vervuld in data gedreven innovaties in managementinformatie voor ketenpartners, risicoanalyse, bedrijfsoptimalisatie en kwaliteitsborging. Tijdens deze werkzaamheden wordt er doorlopend overlegd met interne organisaties, klanten en leveranciers.  Functie-eisen  Academisch werk- en denkniveau;  Aantoonbare ervaring met grootschalige data analyse, in het bijzonder gebaseerd op MS SQL standaarden;  Ervaring met R en/of Matlab en PLS Toolboxing;  Je kan klantgericht, initiatief en projectmatig werken;  Affiniteit of belangstelling voor de zuivelsector en instrumentele analysemethoden;  Affiniteit met Big Data technologie, IoT, kwantitatieve risico analyse, economische impact en duurzaamheidsvraagstukken.  Aanbod  Marktconform salaris, op basis van jouw competenties en ervaring;  26 vakantiedagen;  Voldoende opleidingsmogelijkheden;  Flexibele werktijden en reiskostenvergoeding;  Collectieve pensioenregeling en bedrijfsfitness;  Je levert een belangrijke bijdrage aan de zuivelketen en de verdere groei van de organisatie;  Een positie in een professionele en informele werkomgeving",2021-03-17 18:21:33
31455f986c0f0e42,"Job Type Contract  Location Amsterdam  Area Netherlands  Sector Big Data & Analytics  Salary Market related  Start Date ASAP  Job Ref KW-Stat  Description Templeton and partners are seeking a Statistician for our global client in Amsterdam to work on: Subsidence-forecasting: Quality-checking and bug fixing of existing python code, development of new modules Corrosion modelling: Improvements to existing methodology New product development and R&D support: DoE and analysis, answering miscellaneous queries to support data scientists  Requirements Solid grounding in Maths/Stats – MSc at least, PhD preferred Ability to develop Bayesian stats methods Knowledge of Design and analysis of research experiments Coding experience, preferably Python, (but R or Matlab experience would give someone a head start), experience of Agile ways of working would help Ability to relate to customers, understand issues and communicate",2021-03-17 18:21:35
