id,description,scrapetimesdescription2057e6a8e28f38b2,"Hamifleurs Op zoek naar een uitdagende, afwisselende functie waarin je veel contact hebt met de eindgebruikers? Door de groei van complexiteit en wijziging in het bloemen IT landschap zijn wij nu op zoek naar een Technical Application Manager in Honselersdijk. Lijkt dit je leuk? Lees dan verder!  Even voorstellen We zijn dé meest persoonlijke en stipte leverancier voor verse snijbloemen die importerende groothandel en bloemisten wereldwijd helpt succesvol te zijn. Hamifleurs is onderdeel van Dutch Flower Group, marktleider binnen de sierteeltsector, en is gevestigd in het Westland. Met onze bloemen sta je stil bij het leven. Verras je je vrienden, vier je mijlpalen en maak je jouw bruiloft onvergetelijk. Bij Hamifleurs beseffen we ons élke dag hoe belangrijk deze gebeurtenissen zijn. En hoe buitengewoon mooi het verhaal is dat je hierbij creëert. Met meer dan 10.000 soorten topkwaliteit bloemen doen wij er alles aan deze bijzondere momenten nóg specialer te maken. De afdeling Je komt te werken op de IT afdeling, het team bestaat uit een technical application manager, functional application manager, data scientist en een data engineer. In nauw samenspel zorg jij voor de continuïteit van het IT landschap binnen de twee organisaties. Jouw manager wordt Coert, als leidinggevende geeft hij jou de ruimte en het vertrouwen om zo snel mogelijk breed inzetbaar te zijn. De sfeer binnen het team is informeel, gezellig en de collega’s zijn goed op de hoogte van elkaars privé. Wat ga je doen? Deze vacature is deels ontstaan vanuit de recente samenvoeging van Hamifleurs en OZ Export en de groeiende IT behoefte. Binnen Hamifleurs en OZ Export vindt steeds meer digitale communicatie plaats bijvoorbeeld tussen de webshop en buitenwereld. Daarnaast begint de klantenkring ook steeds meer te automatiseren, externe applicaties die communiceren met de IT techniek van Hamifleurs en OZ Export. Bij Hamifleurs zorgt een lopende band van enkele kilometers, dat de bloemen vanuit de koelcel uiteindelijk terecht komen bij de collega’s die de bloemen klaarzetten voor transport. Deze lopende band is onlosmakelijk verbonden met het ERP systeem, scanners, RFID en alle andere aanverwante logistieke processen. Kortom een hele uitdagende functie op het snijvlak IT en logistiek! Laat zien wat je kan als Technical Application Manager Als Technical Application Manager binnen het IT team ben je verantwoordelijk voor de technische inrichting van het applicatielandschap van productie en logistiek, bestaande uit o.a. een ERP-pakket (KBT-pro), Exact en Orbis. Daarnaast houd jij je bezig met de volgende werkzaamheden: Monitoren van de technische processen en bijsturen daar waar nodig. Het afhandelen van applicatie gerelateerde tickets uit het ticketsysteem. Meedenken en verder ontwikkelen van de technische oplossingen. Beheer in de breedste zin van het woord uitzoeken, inrichten en ondersteunen van de applicatie gerelateerde hardware maar ook alle printers, scanners en RFID. Wij vragen Hbo-werk en -denkniveau, bij voorkeur een opleiding richting Informatica, ICT of vergelijkbaar. Minimaal 2 jaar ervaring in een vergelijkbare rol in IT-beheer, en in het bijzonder in het technisch beheer van applicaties; Conceptuele/analytische capaciteiten om de applicaties waar je verantwoordelijk voor bent technisch te beheren, probleemanalyses daarop uit te voeren, problemen op te lossen en waar nodig verbeteringen voor te stellen en te implementeren; Uitstekende beheersing van de Nederlandse en Engelse taal in woord en geschrift; Wij bieden Een uitdagende en afwisselende fulltime functie in een groeiende internationale organisatie in de sierteelt. Verder bieden wij: Uitstekende primaire en secundaire arbeidsvoorwaarden, met uitzicht op een vast dienstverband; Een afwisselende baan met veel ruimte voor zelfstandigheid; Informele en prettige werksfeer in een geheel vernieuwde kantoorruimte; Ontwikkelingsmogelijkheden in de vorm van opleidingen, trainingen en coaching; Goede faciliteiten voor medewerkers, waaronder een bedrijfsmasseur en een bedrijfsrestaurant; Een leuke en actieve personeelsvereniging; Elke week een mooie bos bloemen voor thuis. Doorgroeimogelijkheden binnen de organisatie en/of Dutch Flower Group; Sollicitatieproces Ben jij onze nieuwe Technical Application Manager en heb je zin om deze uitdaging aan te gaan? Solliciteer dan via onderstaand formulier! Telefonische intake door de recruiter van Hamifleurs Eerste sollicitatiegesprek met IT manager en recruiter Tweede sollicitatiegesprek met IT manager en algemeen directeur Referentie check (optioneel) Een passend aanbod!",2021-03-17 18:48:35
e083f21e3558cc52,"Wat is vereist? WO werk- en denkniveau Minimaal 3 jaar relevante werkervaring Kennis van / ervaring met het ontwerpen, ontwikkelen en beheren van ETL-processen Kennis van / ervaring met Microsoft SQL Server en Azure Cortana Intelligence Suite Goede beheersing Nederlandse taal, zowel in woord als geschrift Als visionair ben je enerzijds op zoek naar innovatieve middelen en anderzijds ken je het belang van een stabiele inrichting van dataverwerking Wat krijg je? €3.500 - €5.800 bruto p/m 36-urige werkweek 13e maand, 8,59% vakantietoeslag, bruto maandelijkse vergoeding van 5,6% 199,5 vakantie-uren per jaar (bovenop je standaard wekelijkse roostervrije dag) Bijdrage voor een abonnement bij een sportschool (aangesloten bij Bedrijfsfitness Nederland) De AFM heeft het “World-class Workplace!”-keurmerk: dit geeft aan dat medewerkers graag bij de AFM werken Wat doe je? 40% Development, testing en monitoring 20% Scrumsessies en kennisdelingen 40% DevOps- en DataOps-werkzaamheden  Als Azure data engineer bij de AFM ben je verantwoordelijk voor het ontsluiten, structureren en prepareren van data. Je verwerkt data in het Managed Data Platform (MDP) van de AFM, dat bestaat uit verschillende databases voor domeinen zoals verzekeringen, pensioenen en beleggingsinstellingen. Jij richt deze (relationele) databases in, zorgt ervoor dat ze goed functioneren binnen de infrastructuur en maakt ze ‘gebruiksklaar’. Op deze manier kunnen toezichthouders en andere eindgebruikers meteen aan de slag met de data.  Daarnaast probeer je als technisch consultant de datakwaliteit binnen het MDP te verhogen, wat je alleen kunt realiseren als je de inhoud en betekenis van de data kent. Bovendien krijgt de AFM privacygevoelige data aangeleverd van interne en externe partijen, dus je houdt rekening met security-aspecten.  Verder verricht je DataOps- en DevOps-werkzaamheden, met als doel om changes op een geautomatiseerde manier zo snel en makkelijk mogelijk uit te rollen. Je werkt vooral met Microsoft Azure tools en programmeert ook in SQL, C# en Powershell.  Je bent onderdeel van het programma Datagedreven Toezicht (circa 30 collega’s), dat bestaat uit een Data Insights team (data analisten + data scientisten) en een platformteam. Jij bent onderdeel van dit laatste, samen met datamanagement specialisten, data engineers, data-infrastructuur specialisten, een solution architect en een security manager.  Als je het leuk vindt om je volledig onder te dompelen in data en hier secuur mee om te gaan, en je het een uitdaging vindt om je te verdiepen in de wondere (en complexe) wereld van Microsoft Azure, dan is dit een baan voor jou.  De AFM maakt zich sterk voor eerlijke en transparante financiële markten. De organisatie is gedragstoezichthouder van de gehele financiële marktsector: sparen, beleggen, verzekeren en lenen. Je vindt het kantoor van de AFM aan de Vijzelgracht in Amsterdam, waar ruim 650 hoogopgeleide professionals werken. De tramhalte en de metrohalte van de Noord-Zuidlijn zijn voor de deur; met het openbaar vervoer ben je binnen enkele stappen bij de AFM. Iedere collega is gedreven om een substantiële bijdrage te leveren aan het verbeteren van de financiële sector.  Om grip te houden op de financiële wereld is het noodzakelijk dat de AFM de markten goed kent om zo belangrijke risico’s te kunnen signaleren. Vervolgens moet daar slim op ingespeeld worden.  De AFM is trots op hun World-class Workplace!-keurmerk, dat aangeeft dat medewerkers bovengemiddeld graag bij de AFM werken. De score ligt boven de landelijke en sectorbenchmarks en is gebaseerd op zes elementen: werkgeverschap, organisatietrots, organisatierichting, waardering, werktrots en het benutten van talenten.  Hoofdkantoor in Amsterdam 50% / 50% Gem. leeftijd 42 jaar Tussen de 650 en 700 werknemers",2021-03-17 18:48:37
b24431e456576c3b,"Business Consulting Senior Data Scientist/ML Engineer Amsterdam, The Netherlands  Big Data & AI are booming and therefore, we are looking for an outstanding Data Scientist to join our Synechron team in Amsterdam!  You will be working on solving AI challenges for and with our clients. Your knowledge and skills will help shaping the future of banking.  Our challenge  Our Digital Innovation & Transformation team is working with clients to lead them through the digital revolution. Realizing their digital innovation strategies and programs is a key focus area. We are working with clients to help them set up their innovation labs and centers of excellence, gain value from innovation partnerships, develop proofs of concept and minimum viable products around new and emerging technologies, and implement digital solutions. Throughout this process, we serve as strategic advisors on how to innovation to domain-specific use cases for the financial services industry, with the business challenge always at the heart of the program. We partner with our digital and technology teams to deliver solutions from future state vision and concept to large scale implementation.  As a Data Scientist you will be leading client projects to solve AI challenges (Predictive Analytics, Statistical Analysis, Machine Learning & Deep Learning), translate analytical solutions into recommendations, build/improve data-driven models using statistical and machine learning techniques, assist our clients to understand the data science principles and provide an explanation for the model behavior and possible correcting actions, retrieve and preprocess, and train colleagues in our area of expertise  Your profile A master’s degree in Data Science At least 3 years of experience as a Data Scientist Excellent verbal and written communication skills in Dutch and English Affinity with the financial services industry Practical experience in solving complex challenges using data analysis and modelling Experience in explaining complicated analysis to a non-technical audience with your storytelling and data visualization skills Experience in projects using computer vision is a plus  Languages and Technologies Demonstrable programming experience in at least Python (Pandas, Sklearn, Tensorflow/Pytorch), and another programming language such as R, SQL and or SAS Experience with Big Data (Spark, Hadoop) Optional: Scala, API building, Docker/Kubernetes, Cloud (AWS/GCP/Azure), DevOps (CI/CD) At least significant experience in one specialty area being NLP or predictive analytics  We are Innovative: You’re interested in how new technological innovations can contribute to the data revolution Responsible: You are able to weigh the interests of our clients Limitless: You are willing to look beyond data science and learn from experience outside your own work area Ambition: You are driven to become the Synechron-expert in data science Empowered: You dare to stand for what you believe in  Our offer A competitive compensation and benefits package Possibility of assignments abroad in Singapore, London, Serbia, New York. Feel free to think global! Lease car or mobility budget, laptop and a mobile phone 30 days of paid annual leave An extensive training budget, focused on skills, substantive knowledge and personal development: o An internal training programme (NLP +Predictive analytics), in class trainings and trainings from partners like GCP, C3.AI and Quantexa. Also, Synechron partners with Udemy for Business, an online learning platform with 3,000+ top rated, engaging courses that are accessible anytime, anywhere, on-demand A Global Center of Excellence for Data Science with experienced colleagues across the globe with coaching and sparring possibilities Cutting edge data science projects at leading banks including not only building data science models for different domains like financial crime and risk but also whole pipeline development (data engineering, machine learning engineering, model life cycle management) A flat and approachable organization An excellent working atmosphere: Friday drinks, sports activities, trips (abroad) with a young, dynamic team A Great Place To Work – for the second consecutive year we are ranked top 10 best Multinational Workplaces in the Netherlands  Synechron makes personal growth and development a priority. This manifests itself in good, (partly) mandatory training and educational opportunities focusing both on skills and content knowledge. All our employees are guided by a designated team leader in their personal growth and development.  Interested in joining us? For further information, please contact our recruitment department via recruitment-AMS@synechron.com.  NOTE: only complete applications (with resume and cover letter) and candidates who speak and write fluently Dutch will be taken into consideration. You need to have a working permit in the Netherlands",2021-03-17 18:48:39
c2b14643e0f9c849,"MARKETING & BUSINESS DEVELOPMENT MANAGER Heb jij een (inbound) marketing achtergrond en gevoel voor Sales? Vind jij ook dat de zorg beter, effectiever en efficiënter kan door gebruik van digitale oplossingen? Wil je in een jonge dynamische startup omgeving werken en met jouw slimme marketing en sales activiteiten meebouwen aan de groei van een innovatieve health tech met een digitale oplossing die de zorg slimmer en beter maakt? Wil jij je doorontwikkelen op gebied van sales management, eHealth en BIG data? Dan zoeken wij jou. WIE ZIJN WIJ Wij zijn ConsultAssistent. ConsultAssistent is eHealth oplossing ontwikkeld door dokters voor dokters. Met slimme modules voor digitale anamnese, follow-up, PROMs en met beslisondersteuning en data inzichten die de zorg beter, effectiever en efficiënter maken leveren wij een bijdrage aan goede zorg. Dagelijks halen we het uiterste uit onszelf om oplossingen te realiseren die van waarde zijn voor de zorg. We zijn een startup, door onze omvang kunnen we snel innoveren en ons product continu optimaliseren. Afgestemd op de behoeften van de gebruikers. Dit doen we samen met ons uitgebreide netwerk van klanten en samenwerkingspartners. ConsultAssistent bevat een groot aantal digitale anamnese en follow-up modules. Dit zijn slimme vragenlijsten waarin een groot deel van de vragen die de arts aan de patiënt stelt al vooraf online gesteld worden. Dit helpt bij het triageren, patiënten zijn beter voorbereid en artsen komen sneller tot de kern. De data worden gebruik voor beslisondersteuning en analyse. WAT JIJ GAAT DOEN Jij bent continu bezig de waardepropositie van ConsultAssistent te vertalen in goede content. Deze content gebruik je om slimme inbound marketing campagnes op te zetten en zo gericht aan je pipeline van meetbaar geïnteresseerde klanten te werken. Samen moet je sales collega’s ben je verantwoordelijk voor het verder opzetten en uitbouwen van onze marketing en sales afdeling, het lanceren van succesvolle marketingcampagnes, het enthousiasmeren van nieuwe klanten, het geven van productdemonstraties, het opstellen en opvolgen van offertes en het begeleiding van klanten naar het verstrekken van de opdracht. Met jouw kennis, energie en persoonlijkheid heb je een cruciale rol hierin. Je stuurt jouw team aan en zorg voor een periodieke rapportage naar de aandeelhouders. Je wordt op termijn mogelijk lid van het managementteam van ConsultAssistent en denkt en werkt op operationeel, tactisch en strategisch vlak mee aan de verdere groei van ons bedrijf. WIE WIJ ZOEKEN Wij zoeken een enthousiasteling met gunfactor, iemand die kan luisteren en een goede gesprekspartner kan zijn voor een medisch specialist, medisch manager en IT-manager. Iemand die in oplossingen denkt en die een aantal jaar als marketeer, sales en/of business developer heeft gewerkt. Een agile scale-up werkwijze past bij jou. Je durft, bent ondernemend, professioneel overziet het grote geheel maar hebt zeker ook oog voor detail. Je hebt de drive om jezelf en jouw team te verbeteren. Je hebt een afgeronde HBO of universitaire opleiding en minimaal 5 jaar werkervaring als marketeer, sales en/of business developer bij voorkeur in de healthtech branche; Je hebt ervaring met Inbound sales & marketing tooling zoals HubSpot en Pipedrive Je bent creatief en ondernemend. Je ziet kansen en maakt deze waar. Je kan ons zo een aantal verhalen vertellen over jouw succesvolle campagnes Je hebt een zeer duidelijke en heldere Nederlandse schrijfstijl. Engels schrijf en spreek je ook vloeiend. Je bent analytisch, conceptueel sterk en ondernemend; Je bent klachtgericht, een goede gesprekpartner en kunt je goed inleven in patiënten en artsen. Je hebt oog detail én bent in staat de grote lijnen te zien. Je kan hier makkelijk tussen schakelen. Je bent een netwerker en hebt al een netwerk(je) in de ziekenhuiszorg; Je hebt een sterk persoonlijkheid en je hebt bewezen samenwerkingsvaardigheden voor verschillende persoonlijkheidstypen en functies. Je kan een team succesvol aansturen en medewerkers inspireren het beste uit zichzelf te halen; Je bent er niet vies van om met je voeten in de klei te staan en de handen uit de mouwen te steken; Ervaring met eHealth toepassingen is een pré. WAT WIJ JOU BIEDEN Ben jij onze nieuwe Marketing & Business Development Manager en kom jij werken in een ambitieuze en leerzame scale-up omgeving waar veel ruimte is voor initiatief en eigen inbreng? We bieden een afwisselende baan waarbij je direct verantwoordelijkheid draagt en volop ruimte krijgt voor ondernemerschap. Je werkt in een leuk, jong team en krijgt de ruimte om het werk op jouw eigen manier te organiseren en jouw eigen ontwikkeling en die van jouw team vorm te geven. Daarnaast bieden we je: Een aantrekkelijk salaris dat kan oplopen met bonussen op basis van persoonlijk- en bedrijfsresultaat; Een interessant trainingsbudget; NS business card en/of mobiliteitsvergoeding; Een gave kantoorlocatie in hartje Rotterdam Gezelligheid met onder andere borrels en bedrijfsuitjes; Na eerste tijdelijke contract doorgroei naar vast contract. Jouw standplaats is Rotterdam, we hebben een kantoor in het CIC bij het Groot Handelsgebouw direct naast het Centraal Station. Als je niet op kantoor werkt, ben je meestal bij onze (toekomstige) klanten, ziekenhuizen in geheel Nederland. Vanaf huis of elders werken wanneer dat kan is uiteraard geen probleem. OVER ONS ConsultAssistent is een product van Outcome Measurement BV dat is opgericht door Henk Blom (KNO-arts), Martijn Buitenhuis (Buitenhuis Advies) en Funatic (specialist in patiëntenportalen). Door het bundelen van krachten is er een geslaagde samenwerking ontstaan waarin uitgebreide kennis van zorg, strategische bedrijfsvoering, patiënt experience, zorg-ICT en security is geborgd. Bij ConsultAssistent hebben we alle benodigde disciplines in huis. Dagelijks zet wij ons in om voorop te blijven lopen in de markt en onze klanten het maximale uit ConsultAssistent te laten halen. Ons dagelijkse team bestaat onder anders uit: UX-specialisten, module-ontwikkelaars, technisch ontwikkelaars, data scientists en implementatiespecialisten. We zijn als bedrijf meer dan ons product, we zijn wendbaar en gaan voor aantoonbaar resultaat. Samen met onze oprichters hebben we de beschikking over een groot netwerk met veel expertise en invloed. HEB JE INTERESSE Laat het ons weten en neem contact op met Bert Mooij (commercieel manager van ConsultAssistent). Je kunt Bert bereiken op +31 6 10074853 of per mail op bert.mooij@consultassistent.nl.",2021-03-17 18:48:42
09e7c4e9e082a2ee,"Location: Amsterdam (Netherlands) Job category: Assay Development  uniQure is dedicated to bring innovative therapies or unmet medical needs to patients. In doing so each function in uniQure is directly or indirectly responsible for the lives of patients. This responsibility should be part of our day-to-day working life by (i) living up to high quality standards and (ii) recognizing the sense of urgency in areas of high medical need.  Purpose of the role  The Technician Analytical Development will be part of the Product Analytical Development (PAD) group. The Technician will be focusing on the planning, execution and reporting of laboratory activities. The core tasks will be focused on planning and performance of laboratory work, data analysis, assisting in SOP/Documentation writing, participation in troubleshooting and new technologies development, ordering and maintenance of laboratory according to best laboratory practices.  Place in the Organization  The PAD Group is embedded within the Analytical Development department, which besides PAD also consists of Bio-Analytical Development (BioAD), and Drug Product Development (DPD). The Technician will be a contributor to the activities of PAD group with a specific attention toward the core focuses of the PAD group:  Developing, qualifying and transfer of product-specific assays to be used for release testing, stability testing, and extended characterization. Providing analytical support to DPD and PD (Process Development) activities by ensuring consistent and timely execution of standardized platform product characterization assays, including data review, storage and trending. Integrating new program products into uniQure analytical platforms, to ensure timely progress of transfer and regulatory filing efforts.  The Technician reports to the Senior Scientist/Team Lead.  Key result areas (major duties, accountabilities and responsibilities)  Perform laboratory associated tasks (e.g. buffer preparation, aliquoting of materials, ordering, maintenance) according to best laboratory practices Plan and execute testing and data analysis (biological assays and physical/chemical testing) using pre-established methods Execute experiments in presence or absence of formalized and structured instructions (e.g. SOPs and protocols) to support assay development, optimization, qualification, and transfer Ensure all laboratory activities are performed according to applicable protocols, and follow safety and quality procedures to ensure a safe working environment and high data quality Collect, and store experimental data and document analytical results to ensure maximum traceability. Prepare data overviews, including interpretation of results. Suggest next steps in experimental design. Notify superior of all observed deviations in a timely frame and provide input on the possible cause of the deviation Independently plan own laboratory work to ensure maximum efficiency while ensuring alignment with the team overarching deliverables and laboratory resources utilization (use of lab equipment etc.) Draft laboratory and technical documentation relevant to or resulting from testing (SOPs), assist in development, qualification and transfer documentation generation (protocols, reports) under supervision of a scientist Execute activities within his/her area of expertise and experience. Develop new skills and knowledge necessary to successfully support assigned tasks and projects through training and independently. Support training of Jr technicians or as part of the technology transfer and qualification activities  Qualifications & Skills  MLO with 4 years of experience, BSc with 2 years of experience, or MSc in a Life Sciences-related field (biochemistry, molecular biology, biotechnology) Good knowledge of aseptic techniques and hands on experience with aseptic cell culture techniques (e.g. insect and human cells) Good knowledge and hands on experience with relevant molecular biology techniques (e.g. (q)PCR, DNA electrophoresis) Good knowledge and hands on experience with biochemical analyses (e.g. protein electrophoresis, western blotting, ELISA) Experience in viral vaccines or gene therapy is a plus Working experience in a regulated setting (GxP), technical documentation writing (SOP, Protocols, Reports), and awareness of GxP pharmaceutical regulations is preferred Computer software skills including Microsoft Office Strong interpersonal and communication skills in English, written and verbal including presentation of technically complex data  Core competencies  Integer: accurate, organized, dependable, proactive, motivated, flexible Detail oriented: strong analytical skills, ability to critically analyze and present complex data sets Thorough: ability to carry out tasks with an eye for completeness (e.g. results achieved according to agreed SOPs and/or protocols, results compiled in clear overview and discussed with team members) Analytical Thinking and Problem Solving: signals problems, recognizes important information, traces possible causes of problems, thinks about and implements new working methods or new applications Planning and organizing: ability to plan own workload to achieve results in a timely way while ensuring quality, ability to manage multiple tasks simultaneously balancing priorities to ensure timely delivery Co-operative: demonstrated ability and drive to work both independently and also as a team member, good written and spoken communication skills, ability and willingness to work in a fast-pace environment",2021-03-17 18:48:44
