id,description,scrapetimesdescription16e4bbac525c795d,"Justid wil zich continu verbeteren en zich ontwikkelen naar een data-gedreven, wendbare en slagvaardige organisatie. De functie van Chief Data Officer bij Justid is nieuw en geeft jou dus alle ruimte om de datastrategie én slimme oplossingen van morgen neer te zetten! Als strategische businesspartner ben jij als Chief Data Officer (CDO) onmisbaar om de organisatie te transformeren naar een data-gestuurde organisatie, in lijn met haar visie om betrouwbare informatie en slimme oplossingen te willen bieden. Justid beschikt over zeer veel data die wij maximaal willen inzetten voor onze ketenpartners. Data uit de samenleving gecombineerd met ketendata kan bijvoorbeeld, met innovatieve nieuwe diensten, nieuwe informatie of inzichten opleveren die bruikbaar zijn voor de professionals die werken in de ketens van Justitie en veiligheid. Dat vereist een heldere visie en strategie op het vlak van datamanagement, maar ook het belang van data moet in de organisatie gevoeld worden om data-gedreven te kunnen gaan werken. Daar ligt dus een uitdagende opdracht voor de CDO. De datastrategie op orde brengen, zodat we beschikken over duidelijke beleid, kaders, processen en richtlijnen. Daar ligt bij aanvang de uitdaging, zeker omdat je werkt in een dynamisch speelveld waarin je rekening moet houden met (inter)nationale kaders. Daarnaast aan jou nadrukkelijk de opdracht om nieuwe technologie te verkennen en te vertalen naar slimme oplossingen waarbij het vertrouwen van de burger in de overheid versterkt wordt. Dit doe je uiteraard niet alleen. Je werkt samen met de Chief Information Officer van de Justitiële Informatiedienst en een team van strategische adviseurs, data scientists, architecten, kennis- en onderzoekcoördinatoren. En voor toepassingen met innovatieteams. Naar de buitenwereld zorg je voor een goede vertegenwoordiging van Justid binnen het netwerk van ketenpartners zodat we binnen het Ministerie van Justitie en veiligheid zorgen voor een gezamenlijke besturing op de datalandschap en ontwikkeling en onderhoud van datastrategieën én slimme oplossingen. Functie-eisen Je beschikt over een afgeronde wo-opleiding; Je hebt al flinke ervaring opgedaan in organisaties waar je gewerkt hebt aan data-strategieën en innovaties. Je brengt kennis in van Data Science-toepassingen; Je hebt bij voorkeur ervaring in (politiek)-bestuurlijke omgevingen; Je het de juiste DNA om organisaties in beweging te krijgen en de souplesse om dit te doen in een dynamische omgeving met veel belangen; Je overtuigd, bent ondernemend en innovatief. Arbeidsvoorwaarden Salarisniveau schaal 13 Maandsalaris Min €4.281 – Max. €6.419 (bruto) Dienstverband Arbeidsovereenkomst voor bepaalde tijd met uitzicht op onbepaalde tijd Contractduur 1 jaar Minimaal aantal uren per week 36 Maximaal aantal uren per week 36 Overige arbeidsvoorwaarden Naast het salaris ontvang je een individueel keuzebudget (IKB). Het IKB bestaat uit geld (16,37% van je brutojaarsalaris) en tijd. Met het IKB maak jij de keuzes die bij jou passen en kun je een deel van je arbeidsvoorwaarden zelf samenstellen. Je kunt er bijvoorbeeld voor kiezen om een deel van je maandinkomen te laten uitbetalen wanneer jij dat wenst. Ook kun je dit budget omzetten in verlof en andersom of besteden aan fiscaalvriendelijke doelen. De Rijksoverheid hecht sterk aan persoonlijke groei en loopbaanontwikkeling en biedt daarvoor tal van mogelijkheden. Tot de secundaire arbeidsvoorwaarden behoren onder meer verschillende studiefaciliteiten, bedrijfsfitness, volledige vergoeding van je ov-reiskosten woon-werkverkeer en gedeeltelijk betaald ouderschapsverlof. Bijzonderheden Wij bieden een uitdagende werkomgeving. Kandidaten met een hands-on-mentaliteit zijn bij ons prima op hun plaats. Er is ruimte voor professionele ontwikkeling. We zetten de vacature zowel in- als extern uit. Bij gelijke geschiktheid geven wij de voorkeur aan rijkskandidaten. Acquisitie naar aanleiding van deze vacature wordt niet op prijs gesteld. Medewerkers als bedoeld in de Wet allocatie arbeidskrachten door intermediairs (Waadi) nodigen we uit om te reageren. Solliciteren? Mail je motivatie en cv naar vacatures@justid.nl. Vermeld hierbij het vacaturenummer. Standplaats is Almelo, maar wel bereid zijn om te reizen. Meer over de functiegroep Coördinerend / Specialistisch Adviseur Door het Functiegebouw Rijk worden medewerkers en leidinggevenden geholpen bij het maken van resultaat- en ontwikkelafspraken in functioneringsgesprekken en krijgt men inzicht in de loopbaanmogelijkheden binnen de Rijksoverheid. Meer informatie op Functiegebouw Rijksoverheid Meer over jouw toekomstige afdeling De justitiële ketens zijn continu in beweging. Ketenpartners ontwikkelen zich zowel individueel als gezamenlijk, onder invloed van programma’s en wetgeving. Steeds wordt de aansluiting op de samenleving gezocht. Te midden van deze ontwikkelingen staat Justid steeds weer voor de taak om ketenpartners van de juiste, volledige en actuele informatie te voorzien. De doelstelling van de directie Ketenstrategie is als volgt geformuleerd: Justid wil zich continu verbeteren en zich ontwikkelen naar een moderne, data gedreven, wendbare en slagvaardige organisatie. De Directie Ketenstrategie is daarin de in- en externe verbinder tussen strategie, programma’s/projecten en operatiën. Daarbij wordt tevens invulling gegeven aan het vertalen van de maatschappelijke opgave van de ketenpartners binnen de justitiële keten naar een ketenstrategie voor de Justitiële Informatiedienst welke zowel in- als extern gedragen wordt. De directie Ketenstrategie signaleert, analyseert, evalueert en doet dit op proactieve en transparante wijze en gericht op lerend vermogen. Dit alles vindt plaats in een turbulente omgeving met o.a. een ontwikkeling naar gedigitaliseerde (strafrecht)ketens. De directie Ketenstrategie denkt mee, draagt bij aan het bepalen van de strategische richting van de organisatie en realiseert de strategische doelen. De directie geeft daarmee richting aan de overige onderdelen van Justid. Ministerie van Justitie en Veiligheid - Justitiële Informatiedienst Een veiliger en rechtvaardige samenleving....Het klinkt zo simpel, maar het is wel dé uitdaging van het ministerie van Justitie en Veiligheid. Waarvoor staat Justid? Oké, de kans is aanwezig dat je onze organisatie nog niet kent. We zijn een slimme en unieke organisatie die zorgt dat de ene hand van justitie weet wat de andere doet. Met onze ICT-systemen zorgen we er voor dat zeer belangrijke gegevens duurzaam digitaal beschikbaar zijn voor onze klanten binnen het ministerie. De klanten waar we voor werken, ken je wel. Dat zijn de politie, het openbaar ministerie, de Rechtspraak, Raad voor de Kinderbescherming, IND, etc. Juist omdat wij met al deze klanten te maken hebben, spelen wij een cruciale rol in de informatievoorziening tussen deze partijen. Wat doet Justid? Vingerafdrukken, informatie over een strafverleden of de geldigheid van een verblijfsvergunning, informatie voor slachtoffers en burgemeesters wanneer een dader weer vrijkomt… slechts een handvol voorbeelden van informatie die wij, via onze slimme voorzieningen, beschikbaar stellen. Informatie die strikt vertrouwelijk is en met veel zorg moet worden behandeld. Het is namelijk van groot belang dat de juiste en volledige informatie tijdig beschikbaar is voor bevoegden. Door slim gebruik te maken van bestaande technologie en door innovaties en creativiteit te stimuleren, maken wij dit mogelijk. Natuurlijk in nauwe samenwerking met onze klanten -organisaties binnen Justitie en Veiligheid- die grote maatschappelijke belangen behartigen in de samenleving. Dat maakt ons werk extra uitdagend en uniek.",2021-03-17 18:49:05
c522e835e9854590,"What will your job be As an Assistant Scientist Analytical Chemistry you are responsible for characterization of viral and protein products using HPLC-MS/MS analysis. Your main responsibilities will include:  Characterization analysis of viral and protein products by LC-MS/MS Method maintenance including trending of critical method parameters and ownership of test procedures. Troubleshooting and flagging data inconsistencies Data processing and reporting Communication with requesters from different groups Presentation and discussion of findings in the scientific team meetings What are we looking for For the position of Assistant Scientist Analytical Chemistry we are looking for a candidate with relevant Analytical Chemistry experience in the field op protein characterization. HLO or MSc degree in Analytical Chemistry At least 1 year of hands-on experience with biomolecular mass spectrometry in the field of protein characterization Experience with HPLC-MS/MS is preferred Experience in GMP or at a ML-2+ laboratory or higher are considered highly advantageous You speak fluently Dutch and English You enjoy working in a multidisiplinar team and you are able to prioritize your work. Furthermore, you have a critical attitude and value accuracy in the execution of your work and that of others What do we offer Long-term position starting with a contract for 6 months via CheckMark Labrecruitment Salary indication starting at €2624,- gross per month based on fulltime Fulltime position (40 hours/week) Dayshift Where will you work A global biotech company that focuses on the development, production and marketing of vaccines, recombinant proteins and antibodies to prevent and combat infectious and other diseases. More information Jurjen Wilschut 088 00 211 22 jurjen@checkmark.nl Sebastiaan Loriaux 088 00 211 26 sebastiaan@checkmark.nl Ref.nr: 6787",2021-03-17 18:49:07
2f942dd1e516837b,"Site Name: Netherlands - Amersfoort Posted Date: Feb 10 2021  As Medical Scientific Expert (MSE), you will gain scientific insights and provide authoritative opinion within a therapeutic area on medical, scientific and ethical matters to support GSK NL, enabling the evidence-based use of GSK vaccines and compliance with the relevant requirements (e.g. CGR, Geneesmiddelenwet, and EU Directives). You will effectively develop strong strategic relationships with key experts and external organizations to ensure that GlaxoSmithKline is seen as a leading voice and important stakeholder within the specific therapeutic area of vaccines in the Dutch healthcare environment. You will co-ordinate and utilize specialist knowledge with brand aligned colleagues in formulating and implementing short- and long-term medical strategy to create optimal benefit for patients. Your responsibilities: Provide expertise to internal and external stakeholders to ensure their informed decision are based on latest scientific data & knowledge You have a key role in the planning and development of medical, promotional and educational campaigns and (multichannel) materials, including ensuring the medical accuracy and compliance with the product license and the relevant Codes of Practice You work closely with marketing, commercial, market access, regulatory, and clinical colleagues on pre-launch planning, including strategic evidence planning, evidence generation and external expert engagement plan. You are responsible for coordinating GSKs response to complaints from bodies such as the IGJ or CGR – this will typically involve engaging members of the extended brand team e.g. brand manager, regulatory affairs manager, pharmaceutical quality manager You provide analyses and reviews of GSK products, therapy areas and competitor products, making recommendations, which assist marketing in the determination of current and future strategic direction. Provide Medical advice and training in all aspects of GSK’s business for the vaccines area Be a spokesperson at external scientific events and provide compelling presentations on scientific know how in the field of vaccinology and infectious disease control. Maintain an open and trustful work environment where constructive feedback is used as a tool to support each individual and provide opportunities to develop and evolve. You develop scientific tools (eg scientific platform content, presentation of new data, therapy area reviews, product monographs, slide sets, training packages etc) as appropriate to business and customer needs. Input into the defense of complaints made by competitor companies, medical professionals or regulatory authorities against GSK promotional statements or activities. You prepare portfolios of data and input into product submissions for influential bodies such as the ZorgInstituut, Gezondheidsraad, RIVM, GGD. You ensure the medical information department is up to date on new products/campaigns and commercial issues by leading training and factsheet management and by giving advice on complex issues. You prepare and deliver presentations for sales force training programmes and other materials and briefing sessions, ensuring scientific data and medical concepts are understood and promotional strategy is consistent with scientific data. For vaccines sponsored studies, you serve as Local Medical Lead (LML) and provide local support to the study design; provide medical/scientific leadership to the local study conduct team and manage all local medical activities required before study start, during the study and after study completion and analysis; provides input on local risk management activities and medical oversight on study quality. Specific Activities Non-promotional Activities Develop networks in the therapeutic areas across the Netherlands and GSK as a whole. Contribute to the development, attend and present at appropriate meetings (advisory board meetings, scientific workshops, investigator meetings, expert meetings, and CME meetings). Develop and maintain up-to-date knowledge of the therapy areas by reviewing the literature, discussions with key opinion leaders and key stakeholders, participating in cross functional interactions, attending scientific congresses, etc. Supporting scientific research and clinical studies (GSK sponsored/supported). Ensure the right approval processes of GSK supported studies (ISSs), and the follow up during the life cycle of the research project. Leading the management of Grants&Donations Ensure the approval process and proper documentation, contracts and payments of G&Ds. Follow the procedures and follow up after the approval of the G&Ds. Medical review adverse events and pharmaceutical quality issues To provide relevant input into Area-specific clinical development strategies for regional Phase IV clinical plans or market access studies. When Medical Doctor: review of sentinel events in clinical studies. Participate in LIRCs to review the medical impact of the quality related issues. Key role in the areas of Scientific communication, Medical Governance, risk & issues management. Li-GSK Why you? Basic Qualifications: We are looking for professionals with these required skills to achieve our goals: Scientific Master required in Life-Sciences, Medical or Pharmacy degree or equivalent, with an advanced degree and/or certification preferred. Significant experience in a role successfully engaging in scientific exchange with external experts. Excellent presentation and teaching skills to represent the company in a professional manner at medical, scientific and public events. Fluent in Dutch & English Preferred Qualifications: If you have the following characteristics it would be a plus: Preferably a MD, BIG-registered, or life scientist with PhD and scientific expertise within specific therapy area and/or Pharmaceutical Physician NVFG. Experience in vaccinology, immunology and/or infectious diseases Medical background and a working knowledge of the legal and regulatory environment for medicines promotion & scientific communication. Clinical development of medicines experience is a plus. Why GSK? Our values and expectations are at the heart of everything we do and form an important part of our culture. These include Patient focus, Transparency, Respect, Integrity along with Courage, Accountability, Development, and Teamwork in a culture of Innovation, Performance and Trust. At GSK we value diversity and treat all candidates equally. We aim to create an inclusive workplace where all employees feel engaged, supportive of one another, and know their work makes an important contribution. We provide a supportive working environment, and a range of development challenges and opportunities. We also offer competitive benefits and compensation packages designed to attract and to retain the very best. If you require an accommodation or other assistance to apply for a job at GSK, please contact the GSK Service Centre at 1-877-694-7547 (US Toll Free) or +1 801 567 5155 (outside US). GSK is an Equal Opportunity/Affirmative Action Employer. All qualified applicants will receive equal consideration for employment without regard to race, color, national origin, religion, sex, pregnancy, marital status, sexual orientation, gender identity/expression, age, disability, genetic information, military service, covered/protected veteran status or any other federal, state or local protected class. Important notice to Employment businesses/ Agencies GSK does not accept referrals from employment businesses and/or employment agencies in respect of the vacancies posted on this site. All employment businesses/agencies are required to contact GSK's commercial and general procurement/human resources department to obtain prior written authorization before referring any candidates to GSK. The obtaining of prior written authorization is a condition precedent to any agreement (verbal or written) between the employment business/ agency and GSK. In the absence of such written authorization being obtained any actions undertaken by the employment business/agency shall be deemed to have been performed without the consent or contractual agreement of GSK. GSK shall therefore not be liable for any fees arising from such actions or any fees arising from any referrals by employment businesses/agencies in respect of the vacancies posted on this site. Please note that if you are a US Licensed Healthcare Professional or Healthcare Professional as defined by the laws of the state issuing your license, GSK may be required to capture and report expenses GSK incurs, on your behalf, in the event you are afforded an interview for employment. This capture of applicable transfers of value is necessary to ensure GSK’s compliance to all federal and state US Transparency requirements. For more information, please visit GSK’s Transparency Reporting For the Record site.",2021-03-17 18:49:09
75d49c173ccd897b,"Kom ons versterken als Lead Data Engineer Voor ons Strategy, Data & Intelligence team bij Transavia zijn wij op zoek naar een Lead Data Engineer. Dit centrale team leidt de transformatie naar het data-gedreven werken, adviseert afdelingen aan de hand van informatie en inzichten en bouwt aan data- en AI-oplossingen voor klanten en medewerkers van Transavia. Het team is opgericht om Transavia naar het volgende niveau te brengen in Data & Analytics, en dit biedt jou een kans om een leidende rol te spelen in deze transformatie. Wil jij onderdeel zijn van deze reis en het team begeleiden naar state-of-the-art engineering?  Jouw verantwoordelijkheid als Lead Data Engineer Als Lead Data Engineer bewaak jij de technische kwaliteit van al onze data en analytics oplossingen . Je speelt een belangrijke rol in de continue doorontwikkeling van het team en richt je op het verbeteren van zowel technische als procesmatige best practices. Je hebt een duidelijke visie op data en weet deze over te brengen op je collega’s. Daarnaast ben je op de hoogte van de laatste ontwikkelingen in de markt.  Samen met de Data Engineers ben je verantwoordelijk voor het beheren en verbeteren van het Azure data platform, bestaande uit onder andere: Data warehouse (Synapse); Data lakes; Machine learning pipelines (Azure ML); In-memory data modellen voor ad-hoc analyses en rapportages (Power BI). Je coacht en ondersteunt de Data Engineers in het team tijdens hun dagelijkse werkzaamheden en helpt hen te groeien in hun kwaliteiten.  Je zal onderdeel uitmaken van het Strategy, Data & Intelligence (SDI) team dat naast de Lead Data Engineer bestaat uit de Lead SDI, Lead Data Scientist, Analytics Translators, Data Scientists, Data Engineers, Data Analysts en Business Consultants. Je zal veel samenwerken met jouw SDI collega’s, de Enterprise Data Architect, het Cloud Platform Team en onze (data) collega’s bij Transavia Frankrijk. In deze positie rapporteer je aan de Lead SDI.  Wie ben jij?  Je herkent je in onze waarden daadkrachtig, bevlogen, verantwoordelijk en vriendelijk, én je hebt dat “tikkeltje lef”; Jij hebt een WO-diploma en ruime (5+ jaar) relevante ervaring in een data engineering positie; Je bent beschikbaar voor minimaal 32 uur per week; Je spreekt en schrijft vloeiend Nederlands en Engels.  Als Lead Data Engineer: Heb je uitgebreide data engineering kennis opgebouwd vanuit zowel de theorie als praktijk op het gebied van cloud engineering, data warehousing, data & machine learning pipelines, software engineering, coding standards, testing, version control, continuous integration en continuous deployment; Heb je ervaring met het ontwerpen en implementeren van cloud data platforms en het gebruik van SQL, Python, Airflow, Azure en PowerBI; Ben je een visionair op het gebied van data; Ben je in staat om deze kennis en kunde te demonstreren en daarmee vakmanschap bij jouw data engineer- en data scientist collega’s te stimuleren; Ben je in staat om nieuwe data engineering tools/oplossingen te onderzoeken en aan te dragen; Ben je gedreven om jouw kennis en skill set continu door te ontwikkelen. Je bent nieuwsgierig en hebt het gevoel nooit uitgeleerd te zijn; Krijg je energie van het coachen van mensen en organisaties; Speel je makkelijk in op verandering;  Wat kan je van ons verwachten? Werken voor dé nummer 1 budgetluchtvaartmaatschappij; De kans en verantwoordelijkheid om de functie naar eigen inzicht te vormen; Veel ruimte en initiatieven voor persoonlijke ontwikkeling; (afhankelijk van salaris) een eindejaarsuitkering; 22 verlof- en 4 adv dagen o.b.v. een fulltime dienstverband; Vriendelijke en bevlogen collega’s; Last but not least; ben je reislustig, dan is onze IPB regeling (tegen mooie tarieven vliegen indien plaats beschikbaar) zeker de moeite waard! Deze functie is ingeschaald in een functiegroep 11. Afhankelijk van kennis en ervaring doen wij een aanbieding van tussen de € 3.700,- en € 6.120,- euro bruto per maand op basis van een fulltime dienstverband.  Over Transavia Ons motto is: ‘We make low cost feel good.’ We zetten daarbij graag een stap extra voor onze passagiers en voor elkaar. De sfeer in de organisatie kenmerkt zich door bevlogen medewerkers met een groen hart! Elke dag werken we met elkaar samen om een gemeenschappelijk doel te behalen: een memorabele klantbeleving.  Transavia is een dynamische organisatie (never a dull moment) die continu probeert bij te blijven in een veranderende luchtvaartwereld. Wil jij graag werken in een omgeving met enthousiaste daadkrachtig collega’s die oog hebben voor elkaar? Krijg je energie van verandering en vernieuwing en voel jij je het prettigst in een omgeving waar je regisseur bent van je eigen werk? Dan komen we graag met jou in contact.  Is deze functie jou op het lijf geschreven en wil je solliciteren? Ben jij de Lead Data Engineer die wij zoeken en kom je ons team versterken? Solliciteer dan direct via onderstaande button. Heb je vragen over deze vacature? Neem dan contact op ons via recruitment@transavia.com.  Werk je bij een bureau en wil je een kandidaat voorstellen voor deze vacature als Lead Data Engineer bij Transavia? Bedankt, maar hier gaan we niet op in. We werven onze nieuwe collega graag zelf.",2021-03-17 18:49:11
