id,description,scrapetimesdescriptiona5eba360d8fd0fdd,"Location: Amsterdam (Netherlands) Job category: AD - Product Analyt Dev't  uniQure is dedicated to bring innovative therapies or unmet medical needs to patients. In doing so each function in uniQure is directly or indirectly responsible for the lives of patients. This responsibility should be part of our day-to-day working life by (i) living up to high quality standards and (ii) recognizing the sense of urgency in areas of high medical need.  Purpose of the role  The Analytical Support Supervisor will be part of the Product Analytical Development (PAD) group. The Analytical Support Supervisor will focus on planning, execution and reporting of laboratory activities. The core tasks will be focused on planning, designing, executing and reporting experimental work, data analysis trending, and reporting, SOP/Documentation writing.  Place in the Organization  The PAD Group is embedded within the Analytical Development department, which also consists of Bio-Analytical Development (BioAD), and Drug Product Development (DPD). The Analytical Support Supervisor will be a contributor to the activities of PAD group with a specific attention toward the critical activities of the PAD group:  Developing, qualifying and transfer of product-specific assays to be used for release testing, stability testing, and extended characterization. Providing analytical support to DPD and PD (Process Development) activities by ensuring consistent and timely execution of standardized platform product characterization assays, including data review, storage and trending. Integrating new program products into uniQure analytical platforms, to ensure timely progress of transfer and regulatory filing efforts.  The Analytical Support Supervisor reports to the Analytical Development Senior Scientist /Team Lead.  Key result areas (major duties, accountabilities and responsibilities)  Independently plan own and team laboratory work to ensure maximum efficiency while ensuring alignment with overarching deliverables and laboratory resource utilization (e.g. use of lab equipment) Coordinate planning, scheduling activities of technicians within the team communication and alignment with internal stakeholders. Executes experiments and prepare data overviews and reports, including interpretation of results. Suggest next steps in experimental design including rationale for suggestions Drafts and reviews laboratory and technical documentation relevant to assay execution (Electronic Lab Notes, SOPs), assay development, qualification, transfer, troubleshooting or other PAD relevant studies (protocols, reports, position papers and memos) Collect, and store experimental data sets and document analytical results to ensure maximum traceability Prepare data overviews and reports, including interpretation of results. Suggest next steps in experimental design including rationale for suggestions Ensure training of technicians on relevant analytical methods and laboratory and data recording practice Ensure all laboratory activities are performed according to applicable protocols, and follow safety and quality procedures to ensure a safe working environment and high data quality Notify superior of all observed deviations in a timely frame and provide input on the possible cause of the deviation and proposed remediation plan. Improvement of skills and knowledge necessary to successfully support assigned tasks and projects through training and independently. Continuously improve and update her/his area of expertise. Provide improvement suggestions and support the improvement implementation.  Qualifications & Skills  Minimum of BSc in a Life Sciences-related field with 10 years or MSc with 4-6 years of working experience in a biotech or pharma company . Extensive knowledge and hands on experience with aseptic cell culture techniques (e.g. insect and human cells) Extensive knowledge and hands on experience with relevant molecular biology techniques (e.g. (q)PCR, DNA electrophoresis) Extensive knowledge and hands on experience with biochemical analyses (e.g. protein electrophoresis, western blotting, ELISA) Solid experience in supervising and motivating a team of technicians and organizing laboratory activities in a clear and structured way Experience in assay design and trouble shooting Solid experience in writing technical documentation (SOP, Protocols, Reports) and review of analytical data and laboratory notebooks (e.g. ELN) Working experience in a regulated setting (GxP) and awareness of GxP pharmaceutical regulations is highly recommended Experience in viral vaccines or gene therapy is a plus Computer software skills including Microsoft Office Strong interpersonal and communication skills in English, written and verbal including presentation of technically complex data  Core competencies  Detail oriented: strong analytical skills, high level of understanding of assay principles, ability to critically analyze and present complex data sets Thorough: ability to set up and carry out tasks with an eye for completeness (e.g. results achieved according to self-prepared protocols, results compiled in clear overview and proposal for follow up experiments) Analytical Thinking and Problem Solving: signals problems, recognizes important information, traces possible causes of problems, thinks about and implements new working methods or new applications, brings forward and implements original solutions for problems related to the department and function Planning and organizing: ability to plan own and other’s work to achieve results in a timely way while ensuring the highest standard of quality, discuss with others to align planning of multiple complex activities simultaneously, scheduling activities with technicians within the team and help team members with their planning. Ability to effectively adapt and support re-prioritization of activities and goals in a fast paced environment Co-operative: ability and drive to work within and across teams, good written and spoken communication skills, ability and willingness to work in a fast-paced environment. Self-aware. Soft Skills: dependable, proactive, motivated, flexible",2021-03-17 18:21:48
06d611fed42860f2,"Junior/Medior Data Scientist Ben jij op zoek naar ‘een volgende stap’ in je carrière en wil je binnen de Data Science graag meer leren over Algoritmes, Machine Learning en Voorspellende Modellen? Dan komen we graag met je in gesprek! Jij bent gek op data, communiceert makkelijk en deelt verkregen inzichten graag met anderen. Je wilt graag betrokken zijn bij nieuwe Data Science projecten voor toonaangevende bedrijven in Nederland. Je toekomstige werkdag is nooit hetzelfde. Je zit vaak bij de klant en als Data Scientist maak je onderdeel uit ven een team van Data Scientists en Database Marketeers, die complexe data vertalen naar actiegerichte inzichten. Hiermee helpen wij onze opdrachtgevers bij het maken van meer data-gedreven beslissingen en dragen zo bij aan de commerciële doelstellingen van een groot aantal toonaangevende bedrijven. Je hebt zelf de kans binnen ons bedrijf je carrière vorm te geven. Je gaat methodes, modellen en algoritmes creëren ter verbetering van klantcommunicatie en CRM strategieën. Jouw input zorgt voor meer inzicht in de doelgroepen van de opdrachtgevers. Als Data Scientist houd je je bezig met projecten rondom customer segmentation, profiling, predictive modeling, next best offer etc. Kortom je maakt het verschil! Wij bieden naast waanzinnige collega’s en mooie projecten, een goed salaris en perfecte secundaire arbeidsvoorwaarden. Binnen een organisatie waar egen initiatief en nieuwe ideeën toegejuicht worden. Wat neem jij mee? Een HBO/WO diploma, bij voorkeur richting Data Science, Informatica, Econometrie of Wiskunde; 0-2 jaar werkervaring in een vergelijkbare functie; Basiskennis van SQL, Python, Python R en Google Analytics. Ervaring met of kennis van CRM, AI en Machine Learning is een pre; Goede communicatieve vaardigheden en een toegankelijke persoonlijkheid; De bereidheid om geregeld bij de klant op locatie te werken. Hebben we je interesse gewekt en wil je meer weten? Neem dan contact op met Jeroen Schipper. Jeroen@Onearrow.nl 06 19414934 Of solliciteer direct!",2021-03-17 18:21:50
f0729c265bc3a480,"Procesverbetering dankzij data-analyse. Jij trekt als Data Proces Analist de verantwoordelijkheid naar je toe om – vanuit een consultancyrol – bedrijfsprocessen van klanten een kwaliteitsimpuls te geven.  Alle digitale bewegingen van klanten en bedrijven laten hun sporen achter. Dat klinkt voor jou als Data Proces Analist als het begin van iets moois, want met die data leg jij het fundament voor betere bedrijfsprocessen. Dat doe je voor bekende corporate organisaties en grote spelers binnen het mkb-segment. Samen met de klant zoek je naar mogelijkheden om klanttevredenheid te verhogen, kosten te reduceren en doorlooptijden te verkorten. En je zorgt voor een kwalitatief sterk en gedegen proces. Dit ga je doen: bespreek vanuit jouw rol als consultant de verwachtingen met de klant. reconstrueer processen, verzamel data en kom tot inzicht over hoe processen lopen. vertaal data naar processen en zoek naar factoren waar je invloed op uit kunt oefenen.  Werken bij MLC MLC in Leusden heeft al 30 jaar een sterke eigen cultuur, die we omschrijven als sociaal ondernemend. Wij transformeren organisaties naar een optimale digitale procesomgeving waarbij de mens in zijn kracht staat. In een optimale digitale procesomgeving is het primaire proces zo efficiënt mogelijk ingericht om hiermee Operational Efficiency te bereiken. Daarnaast draagt iedere medewerker écht bij aan de behoefte van de klant om zo Customer Excellence te realiseren. Transparantie en duurzaamheid om aan te tonen dat je als organisatie daadwerkelijk In Control bent staat hierin centraal. Bij MLC werken zo’n 30 ’procesdenkers’. Jij werkt als Consultant in teams met wisselende samenstellingen voor toonaangevende klanten in verschillende branches, die meestal gevestigd zijn in de randstad. Denk aan woningcorporaties, overheidsinstellingen en zakelijke dienstverleners, zoals banken, verzekeraars en energiemaatschappijen. Vaak werk je samen met onze klanten aan meerdere projecten tegelijk, je bent dan ook meestal te vinden bij de klanten voor wie je een project draait.  Jouw verdienste Dat zijn in de eerste plaats de tevreden klanten waar jij als Data Proces Analist voor zorgt. Daarnaast krijg je op basis van een 40-urige werkweek het volgende: een marktconform bruto maandsalaris passend bij opleiding en ervaring. flexibele werktijden. een bijdrage aan je pensioen. de mogelijkheid om gedeeltelijk vanuit huis te werken. 28 vakantiedagen en extra vrije ‘loyaliteitsdagen’ als je langer dan 3 jaar bij ons werkt. een winstdeling aan het einde van het jaar, deze kan oplopen tot een dubbel maandsalaris. een mobiliteitsvergoeding die je kunt inzetten voor een leaseauto, OV-kaart of reiskostenvergoeding. volop doorgroeimogelijkheden om nog beter te worden in wat je doet.  Jouw profiel In deze baan als Data Proces Analist werk je op het snijvlak van data-analyse en consultancy. Dat vraagt om een bèta-achtergrond met de mindset van een consultant. Het betekent dat je inhoudelijk sterk voor de dag komt en op niveau met de klant kunt communiceren. Je hebt een resultaatgerichte drive waarmee je anderen overtuigt en meekrijgt. Laten we het houden op ondernemerschap, waarbij je de volledige verantwoordelijkheid over projecten hebt. Naar buiten toe geef jij het visitekaartje af voor MLC, intern zorg je voor een uitstekende propositie. Jouw profiel is compleet met: een hbo-diploma of hoger, richting een bedrijfskundige opleiding, waar wiskunde en statistiek kernvakken waren. minimaal 3 jaar werkervaring met data en proces analyse, bijvoorbeeld als Data Scientist, Data Proces Manager, Data Consultant, Business Analist of een andere functie waarin je met data hebt gewerkt. kennis van: o predictive analytics (tooling als R, Phyton) o BPM o process mining o RPA o SQL en nog beter Relationele Databases kennis van de basis van onze dienstverlening: o BPM o Lean o Six Sigma o Continu Verbeteren o Klantreizen  Stap binnen bij MLC Sta jij aan de wieg van kwalitatief goede bedrijfsprocessen? Reageer dan in ieder geval op de vacature van Data Proces Analist. Mail je cv en motivatie naar werkenbij@m-lc.nl, dan laten we je zo snel mogelijk weten of jij degene bent die we zoeken. Neem contact op via 035 548 65 65 als je nog vragen hebt over deze vacature.  Na jouw sollicitatie Om er zeker van te zijn dat we bij elkaar passen, leren we je graag in 2 of 3 gesprekken beter kennen. Het eerste gesprek heb je met onze directeur(en), de volgende gesprekken met directe collega’s. Tijdens de laatste gesprekken vragen we je om een presentatie te geven over resultaten die je eerder hebt behaald. Zijn we overtuigd? Dan volgt een arbeidsvoorwaardengesprek, waarin we jou een aanbod doen.  Acquisitie n.a.v. deze advertentie wordt niet op prijs gesteld. Solliciteer direct",2021-03-17 18:21:53
8ae132bc52aa70a2,"Are you looking for an exciting role as part of a global team of physicists, material scientists, engineers and software developers defining the new field of Quantum Computing? Microsoft is researching the future of Quantum Computing, including theory, hardware, and software. We are on the cusp of an accelerated effort in quantum computing and this position is an opportunity to get in at the start of this new intense phase. Position available in Delft (Netherlands). Responsibilities You will join a team of researchers and engineers dedicated to push the state-of-the-art materials development in epitaxy of heterostructures made of dissimilar materials at the nanoscale. The role includes hardware & maintenance, as well as process development. You will be responsible for hands-on hardware maintenance, in-vacuum hardware upgrades and establish most efficient work protocols for a unique, advanced, multi-chamber custom-designed molecular beam epitaxy cluster tool. You will work in close relations with vendors and technical support and be able to execute all necessary MBE maintenance and repairs tasks, both autonomously and as part of a group. You will systematically plan and execute and optimize calibrations and growth processes, using design of experiment principles and in-situ characterization/ monitoring. You will be able to generate, populate and maintain a complete growth database. Qualifications Min. MSc. in engineering, applied physics or materials science At least 3 years of proven hands-on experience operating and maintaining a molecular beam epitaxy system and independent UHV hardware maintenance. This includes demonstrated knowledge of materials science, cryogenics, UHV mechanical (design, installation, maintenance), electrical engineering (various sensors, PIDs), robotic process automation, plasma, electron guns, RHEED, mass spectrometer, ion/turbomolecular/cryo- pumps, sensors, leak-checking Ability to deliver products with strong emphasis on the satisfaction of customers’ performance requirements Proven successful design and implementation of specialized/customized UHV hardware supported by planning, scheduling, and controlling skillsets Knowledge and proven experience with contamination control, maintenance/ openings, repairs, fault diagnosis and resolution using, e.g. failure mode and effects analysis methodology Proven process engineer experience on a(n) MBE with a detailed track-record of successful growth process and calibrations, database management, design of experiment Knowledge and experience with some standard ex-situ characterization tools, as e.g. optical microscopy, SEM, AFM, XRD, PL, Hall measurements Experience with programming/scripting, e.g. using Python, for data extraction and analysis Ability to work in a diverse group and contribute to an inclusive culture, alongside other team members who have a wide range of technical skills Thrives in a collaborative environment The ideal candidate would also possess the following skills/experiences: Industry experience Experience in III-As, -Sb, -P or II/IV/VI crystal growth Experience with nanoscale compound semiconductor growth, plasmas and metal epitaxy Experience with 3D solid modeling, CAD Experience with Systems Engineering  To apply, please include CV and a list of three references. Microsoft is an equal opportunity employer. All qualified applicants will receive consideration for employment without regard to age, ancestry, color, family or medical care leave, gender, identity or expression, genetic information, marital status, medical condition, national origin, physical or mental disability, political affiliation, protected veteran status, race, religion, sex, (including pregnancy), sexual orientation, or any other characteristic protected by applicable laws, regulations and ordinances. We also consider qualified applicants regardless of criminal histories, consistent with legal requirements. If you need assistance and/or a reasonable accommodation due to a disability during the application or the recruiting process, please send a request via the Accommodation request form (https://careers.microsoft.com/us/en/accommodationrequest).  #quantum #QuantumHardware  MICROSOFT BACKGROUND CHECK:  Ability to meet Microsoft, customer and/or government security screening requirements are required for this role. These requirements include, but are not limited to the following specialized security screenings: Microsoft Cloud Background Check: This position will be required to pass the Microsoft Cloud Background Check upon hire/transfer and every two years thereafter.  Microsoft is an equal opportunity employer. All qualified applicants will receive consideration for employment without regard to age, ancestry, color, family or medical care leave, gender identity or expression, genetic information, marital status, medical condition, national origin, physical or mental disability, political affiliation, protected veteran status, race, religion, sex (including pregnancy), sexual orientation, or any other characteristic protected by applicable laws, regulations and ordinances. If you need assistance and/or a reasonable accommodation due to a disability during the application or the recruiting process, please send a request via the Accommodation request form.  Benefits/perks listed below may vary depending on the nature of your employment with Microsoft and the country where you work.",2021-03-17 18:21:55
171c4887605578e5,"As a Data Scientist at Avanade, you work with passion to solve complex business problems with machine learning and advanced statistical methods. You will be involved into development of real-life predictive solutions and algorithms as well as working with clients to resolve their advanced analytics requirements. As a consultant, you will also require business analyst skills, as you will be expected to analyze and scope client’s requirements to propose and design the solution.  In this role, you will have knowledge of machine learning, artificial intelligence, statistical algorithms and solutions using R and Python. You will work with our clients to define the analytics solution architecture from a pragmatic standpoint. You will prepare advanced data analyses and present results of these analyses to a business audience. Doing so, we engage with clients throughout the lifecycle of project on both advisory and delivery assignments. We build solutions for the largest companies in the Netherlands in various industries, which guarantees challenging work and variety.  On a typical project you work together in a team that usually consists of a SCRUM master, architect, and other data scientist consultants. Avanade is the perfect employer if you want to work at the highest level with Microsoft implementations and be part of an international team of experienced Microsoft professionals. Next to that, you will be able to take advantage of the experience and opportunities Accenture and Microsoft have to offer.  You make the difference because  * You have extensive commercial or academic experience of developing ML & AI solutions using R and Python with knowledge of the Microsoft (Azure) stack * You understand deep learning techniques and experience with deep learning environments (TensorFlow, Theano, Keras, PyTorch, etc.) is highly desirable. * You have experience with the big data stack (Spark, Hadoop, Storm, Hive & Pig), SQL and NoSQL stores * You have experience with distributed machine learning (Databricks, Spark MLlib, etc.) * You have programming skills in industrial languages (Java, C/C++, C# or Scala) * You have developed capabilities with data modeling and complex big data analyses * You are business facing with business analysis skills and a proven consultative approach  Why should you choose Avanade?  * Your future colleagues help you with questions and challenges. Moreover, there is a pleasant, informal working atmosphere * Knowledge development is central to us, and we guarantee this both by offering formal training opportunities and by means of informal evenings where peers share their knowledge among themselves * With your passion, you can make a daily difference for our customers in the enterprise market with the help of the latest Microsoft technology * We have a strong focus on the career and development opportunities. Every colleague will have a career advisor who works with you to create a plan and guides you through the many training opportunities we offer * We offer the opportunity to be socially involved during working hours and to work for a good cause * We have very attractive terms of employment, not unimportant to mention of course : -) Lease car, bonus scheme, telephone and laptop, good pension scheme, possibility to work part-time (min 32 hours) and many more extras  Do you feel the match?  Do you recognize yourself in this vacancy and would you like to meet us? Then apply immediately by submitting your CV via our website. It is not possible to apply by e-mail. If we also see the match, we will call you quickly for an introduction and you will have 2 job interviews. Do you have any questions, or do you want to know why we love working at Avanade? Then contact our recruiter Eline Rubertus.  For more information, visit [1] www.werkenbijavanade.nl, read the stories of our employees on [2] Be Orange and look for an impression on our [3] Instagram or on our [4] Facebook page.  References  Visible links 1. https://www.avanade.com/nl-nl/careers 2. https://www.avanade.com/nl-nl/blogs/be-orange 3. https://www.avanade.com/nl-nl/blogs/be-orange 4. https://nl-nl.facebook.com/AvanadeNederland",2021-03-17 18:21:58
