id,description,scrapetimesdescription
4e810fb8b64580be,"Bijna of net HBO afgestudeerd in marketing en/of communicatie en heb je een passie voor schrijven? Affiniteit met de e-mail marketing én interesse in de vastgoedwereld? Als Junior Content Marketeer / Content specialist ben jij verantwoordelijk voor het schrijven en beheren van de content in onze e-mails, website en socials. Het is een uitdagende functie waar je elke dag iets nieuws leert! Iets voor jou? Wie zijn wij? SPRYG Real Estate Academy is een ambitieuze en dynamische opleider, uitgever en eventorganisator voor de top van de Nederlandse en Belgische vastgoedmarkt. In amper 5 jaar tijd zijn we gegroeid naar 20 medewerkers en tot tweemaal toe uitgeroepen tot FD Gazelle. Ons Marketingteam zorgt ervoor dat we goed gepositioneerd staan in beide landen én dat ook blijven. Wat ga je doen? Je maakt deel uit van ons snel groeiende Marketingteam! Als junior content marketeer zorg jij ervoor dat onze (potentiële) deelnemers enthousiast worden om in te schrijven voor onze bijeenkomsten. Je schrijft inhoudelijke e-mails, webteksten, persberichten én social media berichten. Dit doe je niet alleen. Op basis van succesvolle campagnes, doelgroep analyses, marketingrapportages en een grote dosis creativiteit ga jij onder begeleiding van een senior marketeer aan de slag met het schrijven van pakkende, conversiegerichte e-mailingcampagnes, die gegarandeerd door onze doelgroepen worden geopend! Je schrijft verder goed doordachte content voor onze website, persberichten en social media, en daarnaast creëer je content voor onze periodieke SPRYG-nieuwsbrief. We sommen jouw takenpakket nog even op: · Je zorgt voor alle content in e-mail campagnes in Nederland en België. · Je zorgt voor actuele content op onze website, in social media en in onze nieuwsbrieven. · Je deelt al jouw bevindingen om een optimaal resultaat te bereiken met het team en komt met verbeterpunten. Wat vragen we van jou? · Je hebt een afgeronde HBO opleiding richting communicatie, journalistiek en/of marketing · Je hebt een uitstekende beheersing van de Nederlandse taal, zowel mondeling als schriftelijk · Je hebt al 1 jaar werkervaring met het schrijven van teksten en het creëren van content en/of e-mail marketing · Je hebt affiniteit met, of interesse in de vastgoedmarkt (Business-to-Business) · Je werkt gestructureerd en nauwkeurig · Je voelt je thuis in een team · Je maakt je snel nieuwe onderwerpen eigen en legt makkelijk verbanden op basis van nieuwe en bestaande kennis · Je bent enthousiast, creatief, proactief, communicatief, flexibel en vindingrijk · Je presteert goed onder druk en houdt je aan deadlines · Je denkt graag mee en kunt goed omgaan met het ontvangen én geven van feedback · Je bent – bij voorkeur – woonachtig in de omgeving van Delft · Pré: Je hebt ervaring met het Adobe Photoshop/Indesign/Illustrator pakket Wat krijg je van ons? · Een uitdagende functie in een jong, gedreven en enthousiast team van 20 personen · Een dynamische werkomgeving in Delft · Ruimte voor eigen initiatief · Gevarieerde opleidingsmogelijkheden · Een passend salaris op basis van kennis en ervaring · Pensioenregeling · Mogelijkheid tot thuiswerken Als kennis- en netwerkplatform voor vastgoedprofessionals werken we mee aan de gezamenlijke ambitie om een duurzame, leefbare bebouwde omgeving te realiseren. Daarbij vinden wij het bevorderen van diversiteit en participatie van groot belang. Wij ontwikkelen en ondersteunen een werkomgeving waarin iedereen welkom is, ongeacht geslacht, burgerlijke staat, ras, huidskleur, nationale of etnische afkomst, sociale of economische achtergrond, handicap, geloof, seksuele geaardheid of leeftijd. Heb je een HBO marketing & communicatie achtergrond of opleiding en ben je net afgestudeerd of nog aan het afstuderen? Heb je al ervaring met content marketing of als content marketeer of copywriter/tekstschrijver en ben je op zoek naar een parttime job van 32-36 uur bij een leuke dynamische uitgever/event organisator in Delft? Dan ben jij dé copywriter of tekstschrijver die wij zoeken! Herken jij jezelf in bovenstaande omschrijving en kun je niet wachten om aan de slag te gaan bij SPRYG Real Estate Academy? Neem dan contact met ons op! We horen graag met motivatie waarom je voor deze functie kiest en waarom je voor ons wilt werken. Uiteraard ontvangen we ook graag jouw CV. Ga naar https://spryg.com/vacatures/junior-content-marketeer of klik op de button Solliciteer. Parttime uren: 32 tot 36 uur per week Opleiding: HBO (Aanbevolen) Deze vacature is zeer geschikt voor mensen met al wat ervaring in content marketing als content marketeer, copywriter, tekstschrijver, en content specialist. Soort dienstverband: Fulltime, Parttime, Tijdelijk, Bepaalde tijd Parttime uren: 32-36 per week Soort dienstverband: Fulltime, Parttime Aanvullende betalingen: Overuren uitbetaald Vakantiegeld Arbeidsvoorwaarden: Budget voor professionele ontwikkeling Pensioen Reiskostenvergoeding Werkschema: Dagdienst Ervaring: relevant werk: 1 jaar (Aanbevolen)",2021-03-16 16:04:39
7c38ebfff21fb87b,"Voor één van onze opdrachtgevers, een specialist in de E-Commerce, zijn wij op zoek naar een Affiliate Marketeer. Als Affiliate Marketeer ben jij een belangrijke schakel binnen het online marketing team en zorg jij ervoor dat campagnes van klanten optimaal benut worden. Dat houdt in dat jij online campagnes evalueert, optimaliseert en zorgt voor een optimale rendabiliteit. Ook hou jij de kosten ontwikkelingen en omzetten in de gaten en draag jij bij aan concrete verbeteringen. Ben jij commercieel en vindt jij het leuk om te onderhandelen met klanten? Dit ga je doen Initiëren van partnerships, onderhouden en verder uit bouwen; Evalueren van campagnes en, om gezamenlijk nog betere resultaten te boeken, bekijk jij waar optimalisatieslagen gemaakt kunnen worden; Ontwikkelingen van de kosten en omzetten in de gaten houden; Onderhandelen met klanten om de rendabiliteit van campagnes zo optimaal mogelijk te houden; Ontwikkelingen spotten en behoeften van de affiliates vertalen naar vernieuwingen en verbeteringen in het affiliate programma; Opvolgen van leads voor het affiliate programma en jij bent proactief in het benaderen van publishers om nieuwe samenwerkingen aan te gaan; Samen met de designers draag jij bij aan actuele en gepaste promotiematerialen; Samen met het marketing team bewaken jullie van de voortgang van binnenkomende leads en jij stuurt bij indien noodzakelijk. Wat wij vragen Wij zoeken iemand die affiniteit heeft met de E-Commerce branche, ondernemend is, van aanpakken houdt en de onderhandelingen met klanten aan durft te gaan. Hbo werk- en denk niveau; Circa 2 tot 5 jaar relevante werkervaring; Professionele beheersing van de Nederlandse taal. Wat wij bieden Fulltime (5 dagen, 40 uur per week); €2.500 - €3.000 per maand (afhankelijk van ervaring); Je werkt met een MacBook Pro van de zaak; Thuiswerken op termijn ook mogelijk, fijne werksfeer & gratis lunches; Flexibele werktijden, je start de werkdag tussen 07:30 uur en 10:00 uur; Mogelijkheid op een vaste aanstelling.",2021-03-16 16:04:42
d986ca497114c00d,"Bedrijfsomschrijving Marieke Duijts Communicatie is een bureau met een traditionele communicatieachtergrond en een online focus. Vacaturetekst Ben jij de creatieve maker van effectieve content die mij komt versterken? * Marieke Duijts Communicatie is een jong communicatiebureau met een traditionele achtergrond in het vak. De laatste jaren heb ik een sterke online focus ontwikkeld en help ik klanten met een plan dat écht werkt. Na ruim 10 jaar werkzaam te zijn geweest in de communicatie-, PR- en evenementenwereld heb ik 3 jaar geleden de stap gezet om voor mezelf te beginnen. Inmiddels is het tijd voor versterking! Wat ga je doen? We gaan samen aan de slag voor verschillende klanten in het commerciële en publieke domein. Content maken voor onder andere een interieurbeplanter, een recruiter in de zorg en een makelaar in Utrecht gaat deel uitmaken van jouw dagelijkse werkzaamheden. Je bedenkt pakkende teksten en maakt sfeerbeelden voor websites en social media kanalen van klanten. Ook richt je nieuwe contentpagina’s (SEO) in, schrijf je blogs en maak je creatieve nieuwsbrieven. Daarnaast help je bij het maken van plannen en kom je zelf met ideeën. Onze eigen website (die er nog niet is) verdient ook zeker aandacht. Pas jij bij Marieke Duijts Communicatie? Je hebt minimaal 1 jaar ervaring of een zeer relevante stage Je hebt ervaring met content en SEO Je deinst niet terug voor: WordPress, CMS, Photoshop, Canva, Google Analytics Je hebt gevoel voor klantrelaties Je bent op de hoogte van de laatste ontwikkelingen op het gebied van social media Past Marieke Duijts Communicatie bij jou? Je werkt 16 tot 32 uur per week vanuit het gloednieuwe kantoor in Houten; Doorgroeimogelijkheden in de toekomst; Veel eigen verantwoordelijkheid; Een passend salaris, gebaseerd op leeftijd en ervaring; 22 vakantiedagen op basis van een 40-urige werkweek; Reiskostenvergoeding; Een schrijfopdracht maakt onderdeel uit van de sollicitatieprocedure. Heb je vragen? Bel mij op 0611591699. Heb je interesse in deze functie? Stuur je motivatiebrief en CV naar marieke$mariekeduijts.nl Acquisitie op basis van deze vacature wordt niet op prijs gesteld! * Contractduur 7 maanden Deadline sollicitaties: 15-3-2021 Soort dienstverband: Bepaalde tijd Aanvullende betalingen: Vakantiegeld Arbeidsvoorwaarden: Extra vakantiedagen Reiskostenvergoeding Vrijdagmiddagborrel Werkschema: ma-vr Thuiswerken: Nee",2021-03-16 16:04:46
3b220a9aec41b970,"We zijn op zoek naar sprankelend talent! Voor een gaaf bedrijf in Zaandam zijn wij op zoek naar een gedreven E-commerce Marketeer. Vind je het leuk om gave content te maken, online campagnes op te zetten en de customer journey op de website te optimaliseren om zo nieuwe klanten en orders te werven? Dan ben jij de fulltime E-commerce Marketeer die wij zoeken! Aan de slag als E-commerce Marketeer in Zaandam Als E-commerce Marketeer ben je verantwoordelijk voor het realiseren van groei via online marketingkanalen zoals email, social media, affiliatie programma’s en SEO. Je houdt je bezig met het creëren van content en het optimaliseren van processen, met als doel om nieuwe klanten te werven, zowel B2B als B2C. Zo ga je bijvoorbeeld blogs en artikelen schrijven, verbeteringen aandragen voor de website en de customer journey optimaliseren. Belangrijk hierbij is dat alles draait om de klant: alles moet zo ingericht zijn dat de tevredenheid van de klant gemaximaliseerd wordt, om zo orders te realiseren. Verder is het belangrijk dat jij: Commerciële kansen registreert en achternagaat; De e-commerce strategie naleeft en verder uitbouwt; Het operationele beheer van de webwinkel op je neemt; Ads creëert ten behoeve van de acquisitie en retentie van klanten; Kortom, een super diverse functie met een uitdagend takenpakket waarin het belangrijk is dat je commercieel ingesteld bent, aandacht voor detail hebt en over uitstekende communicatieve vaardigheden beschikt! Waar zijn wij verder naar op zoek? Je hebt minimaal hbo werk- en denkniveau en hebt al werkervaring opgedaan binnen de marketing; Je bent bekend met Google Ads, Magento en Adobe Creative Cloud. Je beschikt over een kritische en scherpe blik, en kunt snel schakelen; Je hebt uitstekende kennis over web usability en accessibility, en je hebt affiniteit met e-commerce; Je kent de ins en outs van SEO, affiliate programma’s, email marketing en social media. Wat krijg je hiervoor terug? Een zeer interessante en veelzijdige allround marketingfunctie; Een salaris van €2500 tot €3500, gebaseerd op eerdere werkervaring; Veel ruimte voor persoonlijke en professionele ontwikkeling; Een baan in een prachtig kantoor, met gezellige collega’s! Waar kom je te werken? Onze opdrachtgever is gevestigd aan de rand van Zaandam, in een spiksplinternieuw pand. Het bedrijf verkoopt eigenlijk alles wat er in een dokterspraktijk, ziekenhuis of andere medische organisatie thuishoort, behalve medicijnen. Hierbij kun je denken aan behandeltafels, verbandmiddelen of bloeddrukmeters, maar ook aan speelgoed dat kinderen na hun eerste doktersbezoek meekrijgen. Het bedrijf hecht veel waarde aan een ondernemende instelling, een gezonde dosis zelfreflectie en een kritische houding. Wil jij aan de slag als E-commerce Marketeer in Zaandam? Super! Solliciteer direct via de ‘nu solliciteren’ button of stuur een berichtje per mail of via Whatsapp. Jeroen staat je graag te woord!",2021-03-16 16:04:49
a08b05e63144b6d6,"Ben jij gek op cijfers en data? Niet bang om te experimenteren tegen grote concurrenten? Ben jij innovatief en overtuigend? TOPdesk zoekt een vooruitstrevende SEA/SEO Marketeer! Solliciteer direct Wat ga jij doen als SEA/SEO Marketeer? Het TOPdesk klantbestand exponentieel laten groeien! Een van de bedrijfsdoelen van TOPdesk is groeien, fors groeien. Groeien van 4.000 internationale klanten naar 10.000 klanten in 2023. Jij begrijpt als geen ander wat voor rol een SEA/SEO Marketeer daarin heeft. Sterker nog: jij weet terwijl je dit leest al precies waarom je deze vacature zo gemakkelijk en goed kon vinden! Hoe jij dat aanpakt? Je werkt samen met (internationale) field marketeers voor het verbeteren van de ad performances en het opstellen en implementeren van een SEA strategie. Jouw collega’s uit andere branches zijn als het ware jouw klanten, want als SEA/SEO marketeer ben jij een soort ‘agent’. Jij verbetert de vindbaarheid van onze websites in zoekmachines, test advertentieteksten, landingspagina’s, display en video ads en analyseert het zoekgedrag van potentiele klanten. Je richt Google Ads campagnes in en meet de resultaten. Jouw bevindingen en best practices rapporteer jij aan internationale TOPdesk stakeholders en field marketeers. Ben jij op de hoogte van de nieuwste trends en ontwikkelingen op het gebied van SEO en SEA? Manage jij zonder problemen 11 internationale accounts? Ben jij slimmer dan concurrenten? Of kun jij niet wachten om te experimenteren met Reddit en YouTube ads? Je kunt meteen aan de slag. Waar kom je terecht? Op de internationale marketingafdeling, waarvan 27 collega’s in Nederland en nog eens 49 binnen de internationale TOPdesk branches, Jij gaat aan de slag in een van de multidisciplinaire scrumteams op het hoofdkantoor in Delft. Wie er nog meer in jouw team zitten? Marketeers, copywriters en designers. Het hoofddoel van jouw team is: businessgroei. Jij wordt daarnaast onderdeel van een grote marketing vertical. Marketeers en creatives van België tot Brazilië werken samen over 11 landsgrenzen heen aan de bouw van een sterke TOPdesk-brede marketingafdeling. Jij wordt remote ingewerkt en krijgt van TOPdesk alles wat je nodig hebt voor een goede inrichting van je home office. Daarnaast krijg jij de mogelijkheid om jaarlijks nieuwe kennis op te doen en nieuwe initiatieven te starten. Je werkt in een open en informele cultuur, waar vrijheid, vertrouwen en verantwoordelijkheid centraal staan. Ben jij de nieuwe, innovatieve SEA/SEO Marketeer? Jij hebt een afgerond HBO-/WO-diploma en aantoonbare marketingkennis Jij bent gek op data en cijfers! Jij hebt ervaring met SEA kanalen zoals Google Ads, Microsoft Ads & Adroll. Jij hebt ervaring met SEO tools zoals Google Search Console & Moz. Jij weet je weg te vinden in Google Analytics en Google Data Studio. Jij draait je hand niet om voor heldere rapportages. Jij werkt graag samen in een team. Jij beschikt over een enorm reflectievermogen. Jij overtuigt anderen zonder problemen van jouw goede zoekmachinemarketing. Je hebt ervaring met budgetmatig werken en gedeelde verantwoordelijkheid. Jij maakt jezelf goed verstaanbaar– en schrijft gemakkelijk in het Engels. Waar doe jij het voor? Werken bij een van de beste werkgevers van Nederland! Met een open en informele cultuur. En een grote focus op persoonlijke ontwikkeling. Jij krijgt een laptop en andere thuiskantoor benodigdheden. Jij krijgt de mogelijkheid om te experimenteren met nieuwe marketingkanalen. Jij gaat werken bij de marktleider in de wereld van service management. Uitstekende secundaire arbeidsvoorwaarden. En een scala aan nieuwe initiatieven die zorgen voor verbondenheid met de organisatie en de bedrijfscultuur. Solliciteren? Enthousiast geworden? Je motivatiebrief en cv ontvangen we graag via het sollicitatieformulier. Heb je nog vragen over deze functie? Neem dan contact op met Berend van Liemt via 015 270 0900. Tips voor je brief? We vinden het belangrijk dat je analytisch, leergierig en een teamplayer bent. We horen daarom graag, aan de hand van een voorbeeld, wat deze competenties voor jou betekenen. We zijn natuurlijk ook benieuwd waarom je op precies deze functie reageert en waarom je graag bij TOPdesk wilt werken.",2021-03-16 16:04:53
858818feaac87867,"Online Marketeer Fulltime |Amsterdam, NL Is fitness your passion? Or is your passion watching Netflix under the pleasure of delicious chips, but you have a great affinity with online marketing? Are you proactive and stress-resistant? Great, then we have the perfect job for you at Hidden Profits Marketing as an online marketeer in Amsterdam! Information about the role As our online marketeer, you will be busy with creating, building, and optimizing online marketing campaigns for our clients in the fitness industry. This includes for example Facebook, Instagram, and Google Ads. You will focus on generating and optimizing potential customer leads. Besides that, you will be busy optimizing your own online visibility and do competitive and keyword analysis. All of this with the use of Google programs, so basic knowledge is a pre (not mandatory)!  About the tasks Creating, building, and optimizing online marketing campaigns (including Facebook, Instagram and Google Ads) for our clients in the fitness industry Developing effective landing pages to generate as many leads as possible for our customers Designing and placing appealing promotional online advertisements to generate as many visitors as possible for the landing pages In consultation with the innovation team, devise and implement A / B tests for the further optimization of the Online Marketing Formula Target potential leads for our customers in different areas Integrate successful bidding strategies and effective keyword management Keyword and competitive analysis Requirements You can speak and write Dutch fluently, You have good English knowledge (Hidden Profits Marketing is an international organisation and the company language is English), At least one-year working experience in online marketing is preferred, You have a hands-on mentality and you have strong planning and communication skills. Mbo or bachelor degree What do we offer? Of course, you will get a chance to work in a young, professional, fun, and international company. When we are in the office, we grab a drink (or two) (or three??) together. We are a relaxed but hard-working, young team. Since we are a fitness company, when we are allowed in the office, you will get a weekly fitness program. What you choose to do with it is up to you, some of us don’t even look at it. You will follow a great program to get to know the company, and it will help you to grow individually. Of course, you do get paid, get a pension plan, and 25 vacation days (only if you promise to come back…)! What about us? The mission of Hidden Profits Marketing is to help entrepreneurs in the fitness industry grow their businesses. Since 2004 we have been generating (online) leads for our customers with innovative marketing strategies. We currently work continuously for more than 800 customers from 12 different countries. Quite big, right! Our team consists of 50 young and ambitious people and due to continuous growth, we are looking for a creative new colleague to help ourselves, and our customers reach the next level in their business. Do we still have your interest? Are you curious? Or do you basically want to start as soon as possible? Perfect! Email your application directly to jobs@hiddenprofitsmarketing.com. We will contact you as soon as possible!",2021-03-16 16:04:56
