id,description,scrapetimesdescription
79f9d0ae69daaea1,"Marketing Netherlands, Rotterdam Annelot Kroon Corporate Recruiter +31 10 243 6000 a.kroon@sana-commerce.com  Your job The Demand Generation Marketing Specialist responsibility will be to accelerate the growth of our email channel on a global level and in a cost-effective, agile way. Consequently, it is his/her responsibility to build a pipeline for growth through data-driven campaigning and experimentation in cooperation with the Corporate Marketing teams to generate new business opportunities for Sana Commerce. The Senior Demand Generation Specialist will be part of the Virtual Team Growth and report to the Corporate Marketing Manager. Besides, as part of the Corporate Team, it is his/her mission to evangelizing the growth-mindset in the global marketing operations by stimulating agile ways of working, resulting in effective and data-driven working methods. Moreover, it is his/her responsibility to keep on developing himself/herself into a T-Shaped Marketing professional who is eager to explore new growth opportunities for Sana Commerce. You will be responsible for: Strategizing and executing multi-channel campaigns from awareness down to traffic, conversion and retention to drive revenue on a global level Partner closely with sales and key business teams to create and build campaign plans, doing research and revising based on feedback. Implement campaign best practices to track, monitor, and report campaign performance. Work on new experiments, creatives and other ideas for experimentation (A/B Tests, CRO, etc.) Ensure that learnings from experiments are shared, get high visibility and are implemented in daily marketing operations. Provide regular reporting on progress towards key milestones and effectiveness of growth efforts in key markets. Partner closely with Marketing Intelligence to track and optimize campaign performance. Collaborate with Content Marketing to maintain a consistent brand voice and message throughout campaigns. Evangelizing the growth-mindset in the global marketing operations by stimulating agile ways of working. What’s in it for you? Personal development. We believe that as our company grows, our people should be able to grow with us. We value learning and development opportunities for all our employees. So from learning on the job to trainings and coaching, it’s all there. Together with your manager you are in charge of your own personal growth; Onboarding and buddy program. It’s always quite new and exciting to start your next adventure. We value a strong onboarding. You will be joining our general onboarding, will be introduced to a buddy and will get a role specific onboarding as well; Entrepreneurial environment. We are a fast-growing international scale-up organization in software. We encourage initiatives and ideas from our people. We like to accomplish things together as a team; Health and well-being. We believe that every employee should be at their best. So, we like to help a little bit with that, physically and mentally. In our offices we have fresh fruits available, we offer weekly bootcamp sessions and we offer several workshops focused on health and wellbeing for our people; Extra benefits: We offer flexible working hours, Friday afternoon drinks in our very own bar (bi-monthly themed versions of this including dinner), table tennis, monthly chair massages, Wednesdays toastie lunch and many more. Interested to learn more? Check our employee guide! What you bring along: Good understanding and hands-on knowledge of digital channels such as Search, Display or Social Media advertising, etc. Minimum of 2 years of working experience in the field of Campaign Marketing, Online Marketing, etc. Experience with agile project management Experience with tools such as Marketo, Google Suite, Social Paid Tools, etc. Strong commercial mindset Proficient in number crunching in Excel and experience with analytics tool such as Google Analytics, etc. Past working experience with international clients on the agency side or for an international company Knowledge of the B2B software industry is a plus About us It all started in 2007, with a pizza and a plan. One evening in Rotterdam, the Netherlands, five people came together over a pizza and set out to create a B2B e-commerce platform unlike any other. And Sana Commerce was born. Sana Commerce is an e-commerce platform designed to help manufacturers, distributors and wholesalers succeed by fostering lasting relationships with customers who depend on them. How? By making our customers’ SAP or Microsoft Dynamics ERP and e-commerce work as one. This unlocks total customer convenience, reliability without compromise, and constant evolution. Sana Commerce is currently powered by more than 400 employees. We all have our own expertise and specialties, from sales and marketing to project management and more. But we’re all driven by the same goal: to make our customers’ e-commerce projects a success. Our core values So, what does being a part of the Sana team mean? Below is a list of our core values — the most important beliefs we look for in new colleagues and the foundation of our company culture. They guide us in our decision making and they define Sana’s personality as an organization. Entrepreneurial. Sana exists today because a few people had a great idea and brought that idea to life. Sana continues to grow and thrive because that same entrepreneurial spirit is still strong within the company. Result driven. We’re an ambitious group here at Sana, there’s no denying that. We set tough targets and give our all to reach them. Of course, we also know that being result-driven is about more than just KPIs. It’s about creating value, tackling challenges head-on and supporting our colleagues in reaching their goals. Committed. No one said that getting 10,000 active clients by 2030 was going to be easy! We’re in it for the long haul. Through good times and bad, we stick together because we believe in our product, our promise and our people. Team spirit. We love working together, learning from each other, and celebrating success. At Sana, everyone is eager to help their colleagues and success is always a team effort. Let new adventures begin! Applying Procedure Online Assessment & Phone Interview With the assessment, we’re measuring your learning agility. Did we click? Then our recruiters would love to get to know you better. Hiring Manager Interview Meet your future manager and ask them anything about the role you’re applying for, about Sana Commerce and the culture. Business Case It’s based on real scenarios and information — you need to prepare a business case. This is done to assess the love for your future role and your skills. One of your future team members will also join this meeting. Final Interview with MT-member We close our hiring process by introducing you to a member of our management team.",2021-03-16 16:05:00
befd16d259c9349d,"Wie zijn wij Provalliance Nederland is hét grootste kappersformulehuis van de Benelux met toonaangevende merken waaronder Cosmo Hairstyling, Team Kappers en BrainWash Kappers. Onderdeel van de Franse Provalliance Group, Europees marktleider in de kappersbranche. De salons van Provalliance Nederland zijn deels franchise en deels eigen filialen. Bij Provalliance Nederland werk je in een jong, dynamisch en gedreven team waarbij jouw ontwikkeling en talenten centraal staan. Daarnaast werk je in een prachtige omgeving met uitzicht op de Erasmusbrug en op de hoek van de Witte de Withstraat in Rotterdam. Provalliance Nederland staat geen moment stil. Over het lifestyle merk Team Kappers (zie https://teamkappers.nl): Team Kappers staat licht en vol plezier in het leven. We zijn er voor iedereen die goed geknipt en gekleurd wil worden in een ongedwongen sfeer. Want lekker in je vel hoeft niet zo zwaar te zijn, niet zo duur en niet zo ingewikkeld. Bij Team Kappers is iedereen welkom, en vertrekt iedereen met een glimlach. Niet alleen omdat onze service zo mensgericht is, of de sfeer in onze salons zo huiselijk, ongedwongen en gezellig. Vooral omdat we weten dat een goede kappersbehandeling gewoon een heerlijk gevoel kan geven. Voor jou, voor jou kinderen- en voor iedereen die net al wij vindt dat het leven te leuk is om al te serieus te nemen. Lacht het leven toe! Voor je ’t weet, lacht ’t terug Functieomschrijving Als Brand Manager Team Kappers ben je verantwoordelijk voor de merkstrategie en omnichannel campagnes van de formule Team Kappers. Hiernaast zet je per campagne een strakke planning op voor het team, zodat de campagnes op het juiste moment live gaan. Vanuit de campagne marketingkalender, welke je afstemt met het formule team, draag je zorg voor een juiste doorvertaling en ‘uitrol’ van de campagnes. Je bewaakt de nodige KPI’s op jouw campagne, het ultieme resultaat. Hier zorg je voor door een complete briefing aan de betrokkenen, zodat ze pre-cies weten wat er van ze verwacht wordt. Samen met het team bedenk je sterke concepten voor omnichannel sales en branding campagnes waarmee Nederland niet meer om onze merken heen kan en iedereen de campagnes van Team Kap-pers meekrijgt. Je zorgt ervoor dat alle betrokkenen van de campagnes op de hoogte zijn en dat ie-dereen dus op tijd ontvangt wat ze nodig hebben. Je bent een ‘natuurlijk leider’ als het gaat om cam-pagnes en projecten. Ook ontbreekt het je niet aan creativiteit en ga je aan de slag met de vele content marketing campag-nes samen met het team. Met welke onderwerpen en campagnes gaan we relevanter communiceren met onze doelgroepen? Aan de hand van je doelstellingen bepaal je in welke kanalen de campagnes het beste weggezet kunnen worden. Je bent centraal contactpersoon voor directe collega’s en ex-terne partners voor de ontwikkeling van content. Taken en verantwoordelijkheden: Ontwikkelen Brand strategie en bijbehorende Marketing kalender; Ontwikkelen en uitvoeren van sterke campagne strategieën welke bijdragen aan de algehele marketingdoelstellingen van Team Kappers met inzet van alle on- en offline kanalen; Communicatie en nauwe afstemming onderhouden met de ondernemers en collega’s in de salons; Je maakt Team Kappers als merk ook digitaal klaar voor de toekomst, zodat we ook in de toe-komst relevant blijven; Je zorgt voor juiste structuur van werken, bewaakt deadlines en levert op tijd; Met jouw creativiteit zorg je voor ‘out-of-the-box’ campagne concepten, nieuwe en innova-tief leuke campagnes met inzet van mooie content gecombineerd met de juiste inzet van de (digital) marketing mix; Vervaardigen en analyseren van rapportages; Promotie van campagnes en bijbehorende content op de verschillende kanalen zodat deze zichtbaar zijn voor de juiste doelgroep; Initiëren en organiseren van content en lifestyle shoots. Wie zoeken wij? Je hebt minimaal een afgeronde HBO opleiding en hebt minimaal 2 tot 3 jaar werkervaring in een vergelijkbare rol, bij voorkeur in de beautybranche; Ervaring en sterke affiniteit met beauty; Je bent innovatief en creatief ingesteld; Je hebt uitstekende projectmanagement skills; Organisatorisch talent met een kritische blik en een sterk analytisch vermogen; Je bent klantgericht en commercieel; Je communiceert makkelijk met mensen binnen en buiten de organisatie; Flexibel en veranderingsgezind; Ervaring met het organiseren van shoots is een sterke pré; Een zeer goede beheersing van de Nederlandse taal in woord en geschrift. Wat staat daar tegenover? Een veelzijdige baan bij een internationaal bedrijf, met in Nederland meer dan 350 salons, een sterke marktpositie en ambitieuze werkomgeving waar we alles vanuit onze passie voor het kappersambacht doen. Persoonlijke aandacht voor de klant en respect voor elkaar staan hoog in het vaandel. Je kunt rekenen op een marktconform salaris en goede secundaire voorwaarden zoals een pensioenregeling en een persoonlijk budget om je haar te laten doen door de haarexperts uit de branche! #goodbyebadhairdays. Is dit jouw droombaan? Ben je enthousiast geworden over deze functie en onze organisatie? Stuur dan je CV naar jobs@provalliance.nl.",2021-03-16 16:05:03
7c1d18dfca35ac99,"OVER DE FUNCTIE In de functie van CRM Marketeer maak je onderdeel uit van het Marketing & Sales team en rapporteer je aan de Manager Online & CRM. Het team maakt onderdeel uit van de afdeling Commerce.  Als CRM Marketeer houd je je bezig met het verzamelen, verrijken en analyseren van data om gepersonaliseerde (digitale) marketing campagnes te ontwikkelen, uit te voeren en te monitoren. Hiermee draag je bij aan het vergroten van de klantwaarde met als doel een ultieme beleving voor onze bezoekers, activatie van onze doelgroep en stijging van de omzet. Je maakt hierbij o.a. gebruik van de tools binnen het Selligent Marketing Platform. OVER JOUW ROL Je houdt je bezig met het ontwikkelen van (digitale) CRM marketingcampagnes op basis van klantgegevens. Je werkt nauw samen met andere afdelingen met als doel onze bezoekers zo efficiënt en goed mogelijk te boeien en te binden.  Je bent verantwoordelijk voor het ontwikkelen, implementeren, segmenteren en optimaliseren van (geautomatiseerde) e-mailcampagnes. Je maakt daarbij optimaal gebruik van de beschikbare data en mogelijkheden in ons CRM systeem (Selligent) en bent ook bezig om deze data te verrijken. Naast dat je strategisch bent ingesteld, houd je ervan om zelf aan de knoppen te zitten en zelf nieuwe campagnes te ontwikkelen; je bent namelijk ook operationeel verantwoordelijk voor de uitvoering van alle CRM campagnes. Je slaat de brug tussen creatie, techniek en performance.  Je krijgt energie van het bedenken van creatieve oplossingen en hebt een brede interesse in film en technische ontwikkelingen op jouw vakgebied. Je zoekt voortdurend naar manieren om een betere, gepersonaliseerde bezoekersbeleving te creëren en je denkt vooruit.  Je hebt oog voor ontwikkelingen binnen het vakgebied en de doelgroep en houdt jezelf en het team scherp op dit gebied. Tevens draag je bij aan de ontwikkeling van het beleid hierover. Je bent in staat om altijd uit het oogpunt van onze bezoekers te denken met als doel het verrassen van onze bezoeker. WAT VRAGEN WIJ Minimaal HBO werk en denkniveau en 3 jaar werkervaring in een vergelijkbare functie; Ervaring in het opstellen en ontwikkelen van data-gedreven, digitale CRM campagnes (ervaring met Selligent is een pré) en met het werken in een database; Je hebt ervaring met e-mailcampagnes ontwikkelen en klantsegmentaties uitvoeren (list management); Je bent leergierig en niet bang om nieuwe technieken aan te leren en zelf dingen te ‘bouwen’; Je bent communicatief vaardig, commercieel ingesteld en creatief in concept en woord; Uitstekende kennis van Nederlands in woord en geschrift; Je bent analytisch, secuur, zelfsturend en assertief; Ervaring met SQL,HTML en Excel. WAT BIEDEN WIJ Werken voor Pathé betekent werken voor de marktleider in de bioscoopbranche. Je krijgt van ons een mooi salaris met daarnaast vakantiegeld en 25 vakantiedagen, reiskostenvergoeding en een pensioenregeling. Daarbij komt de Pathé Moviecard waarmee jij natuurlijk ook zelf naar alle films kunt mét eventueel jouw +1. Je zult deels thuis werken waarvoor wij de juiste middelen faciliteren om een goede werkplek in te richten. Daarnaast zal je het andere deel op ons hoofdkantoor werken (op een prachtige plek op de Zuidas in Amsterdam) of in één van onze theaters op de daarvoor bestemde flexplekken. Je krijgt veel flexibiliteit en ruimte om jouw tijd zelf in te delen en wordt beoordeeld aan de hand van jouw prestaties, waaraan ook de jaarlijkse bonus is gekoppeld. Verder kom je te werken in een professioneel team met heel gemotiveerde en enthousiaste collega’s. We bieden jou diverse opleidingsmogelijkheden en ruimte om jezelf verder te ontwikkelen.",2021-03-16 16:05:07
44d74c1d348d150d,"Dit wordt jouw job! Hoofdkantoor / Hengelo Algemeen Als Online Content Marketeer heb jij een onderscheidende rol in het verbinden van de buitenwereld met VIRO. Jouw communicatie spreekt aan door de juiste toon, de juiste timing en de juiste plek. Communiceren is je op het lijf geschreven. Je bent zowel een generalist als een vakspecialist. Generalist door je brede kennis van moderne communicatie. Vakspecialist door de juiste tone of voice, kanaalkeuzes en online marketingtechnieken en -tools. Jouw werkveld is met name gericht op het creëren van content voor de online wereld én deze optimaal in te zetten. Daarnaast bied je alledaagse ondersteuning bij de werkzaamheden op de afdeling. Spreekt het bovenstaande je aan? Welkom in ons team. Ambities genoeg! Wat vragen wij van jou? Een afgeronde opleiding (online) Communicatie op minimaal hbo-niveau Kennis van online marketing Relevante ervaring (meer dan 3 jaar) in soortgelijke functies Een unieke en eigentijdse schrijfstijl Je bent een teamspeler met de nodige zelfstandigheid Je weet hoofd- en bijzaken te onderscheiden, houdt overzicht en schrikt niet van deadlines Affiniteit met een technische omgeving Een proactieve houding met een can do mentaliteit Wat bieden wij jou? Hightech projecten met veel ruimte voor innovatieve en duurzame ideeën Enthousiaste, vakkundige collega’s en een open, prettige sfeer Regie over je eigen carrière via onze VIRO Academy Prima mogelijkheden en faciliteiten om thuis te werken, inclusief thuiswerkvergoeding 35 vakantiedagen Vergoeding voor het woon – werkverkeer Uitstekende pensioenvoorziening bij Nationale Nederlanden Collectieve zorgverzekering via VGZ Onze actieve personeelsvereniging zorgt voor de nodige ontspanning en voor mooie verhalen bij de koffieautomaat Online Content Marketeer Jouw afdeling Jij bent als Online Content Marketeer werkzaam op de afdeling Marketing & Communicatie, die onderdeel is van het hoofdkantoor. Het hoofdkantoor heeft een beleidsbepalende functie en faciliteert en ondersteunt tevens de vestigingen binnen VIRO. Het team Marketing & Communicatie houdt zich bezig met corporate communicatie, marketingcommunicatie, arbeidsmarktcommunicatie en interne communicatie. Je valt rechtstreeks onder de Marketing & Communicatie Manager en hebt contacten binnen de hele organisatie.",2021-03-16 16:05:10
170cbce50a9eed40,"Een feestje in je mailbox, dat kunnen we aan jou overlaten! Met jouw persoonlijke e-mails en gevoel voor timing weet je klanten aan ons te binden. Lijkt het je tof om in de wereld van digitale entertainment en e-commerce te werken? Lees dan snel verder! Jouw functie Als E-mail Marketeer ben je verantwoordelijk voor het genereren van verkeer naar onze platformen (website, mobiele website & app) via e-mail. Met jouw persoonlijke en goed getimede e-mails verleid je klanten om bij ons te blijven kopen.  Samen met onze CRM Manager bedenk je e-mailcampagnes die afgestemd zijn op de doelgroep. Op basis van koop- en klikgedrag bereik je onze klanten op het juiste moment met relevante content, persoonlijke contactmomenten en gepersonaliseerde aanbiedingen. Je bekijkt de campagneresultaten, signaleert verbeterpunten en stuurt bij waar nodig. Je vertaalt inzichten naar nieuwe ontwerpen, zodat je de volgende keer nog beter kunt inspelen op de behoeften van onze honderdduizenden nieuwsbriefabonnees. Jij bent pas tevreden als we steeds meer terugkerende klanten krijgen.  Samengevat houd je jezelf bezig met het volgende: Je ontwerpt en verstuurt persoonlijke, gesegmenteerde e-mails in meerdere talen Je bouwt e-mail templates voor terugkerende nieuwsbrieven Je brieft de content marketeers zodat zij de tekst en afbeeldingen kunnen aanleveren voor jouw nieuwsbriefontwerp Je voert A/B testen uit zodat iedere e-mail de voorgaande overtreft Je zorgt voor een gesegmenteerde aanpak per klantgroep en moment in de customer life cycle Je verhoogt de open- en klikratio en verlaagt het uitschrijfpercentage Je analyseert en evalueert campagneresultaten en verzorgt de rapportages Je wordt onderdeel van het marketing team, bestaande uit 12 collega’s verdeeld in 4 sub-teams: acquisitie, retentie, content en data. Je kunt dus veel leren van andere marketing disciplines. Jij wordt onderdeel van het retentie team, met zijn drieën zetten jullie je elke dag in voor het verhogen van de klantloyaliteit door middel van CRM, e-mail en social media marketing. Over Startselect Wij helpen consumenten het beste uit hun vrije tijd te halen door de verkoop van digitale games, in-game tegoeden, giftcards en abonnementen. Vanuit Eindhoven zijn we actief in 18 landen en vastberaden om verder uit te breiden. We werken direct samen met gerenommeerde merken zoals Google, Apple, PlayStation, Xbox, Nintendo, Activision en Netflix. Onze klanten kopen eenvoudig en veilig een code met hun favoriete betaalmethode, waarna ze deze direct op hun beeldscherm en per e-mail ontvangen. Nooit meer naar de winkel of wachten op de postbode: Start, Select, Play! Wat breng je mee? Een afgeronde HBO opleiding in marketing, media design of communicatie 1 – 3 jaar ervaring met e-mailmarketing Ervaring met HTML en CSS3 Ervaring met e-mailmarketingsoftware (wij gebruiken Clang) Je weet van aanpakken, hecht waarde aan kwaliteit en werkt secuur. Als het aan jou ligt bereiken slordigheidsfoutjes nooit de klant en groeit onze database gestaag. Heb je ook nog kennis van de Adobe designprogramma’s en/of Smarty PHP templates? Dan heb je een streepje voor! Wat krijg je van ons? Een leuke baan van 36 – 40 uur bij Europa's grootste webshop voor games en entertainment € 2.100 - € 2.500 bruto per maand, afhankelijk van je kennis en relevante werkervaring 40 top collega’s die altijd in zijn voor een potje tafelvoetbal of gamen in onze gameroom 25 verlofdagen op fulltime basis en de mogelijkheid om extra verlofdagen te kopen Pensioenregeling 8% vakantiegeld en een 13e maand Reiskostenvergoeding Flexibele werktijden en de mogelijkheid om gedeeltelijk vanuit huis te werken (ook na de coronamaatregelen) Gelegenheid voor persoonlijke en professionele ontwikkeling, aan jou om dit te benutten! Korting op onze producten, memorabele bedrijfsuitjes en gratis toegang tot Gamescom: de grootste gamebeurs ter wereld, zodra dit weer kan. Iets voor jou? Klik op de 'solliciteren' button om jezelf aan ons voor te stellen! We horen graag meer over jouw meest succesvolle e-mailcampagnes.",2021-03-16 16:05:14
