id,description,scrapetimesdescription
0f22d136b6ec7e20,"We need you! ABN AMRO is a leading Dutch bank, with an international presence across Europe, Asia Pacific, and the Americas. We are looking for skilled junior quantitative risk analysts who have a solid quantitative background and a passion for working with advanced techniques to unlock the valuable information contained within our production and historical data. Your job As a Non-Retail Credit Risk modeller, you will play a key role in ensuring that the bank makes informed, data driven decisions. Your main focus will be the development and maintenance of our Credit Risk models for professional clients covering over EUR 100 billion in exposure. These models are key to the existence of the bank as they form the basis for loan approval, pricing, performance management and regulatory capital.  In your day-to-day job you will work in multidisciplinary project teams. You closely work together with the business lines in order to ensure that the models properly reflect the business and processes. You will decide on the best quantitative methods and techniques to unlock the intelligence contained within the data. You are aware of new and existing regulatory requirements and ensure that these are properly reflected in the models. As a junior analyst you take the responsibility over parts of the model development process and are actively involved in stakeholder management.  Overall you apply your quantitative skills and experience on various data sets and business challenges, and make a positive impact for the bank and its customers. You will contribute significantly to the success of your team, which includes both junior analysts and experienced senior risk analysts who can help you to further develop your skills. About us ABN AMRO Risk Modelling is a growing, international team of more than 90 professionals. We are the centre of excellence within the bank for developing quantitative risk models, which inform the bank in its daily decisions, from pricing of deals and granting of customer credits, through to setting and monitoring of market risk limits and determining the capital requirements for the bank. About you! you have a strong quantitative education in an area such as pure mathematics, econometrics, actuarial studies, or physics. Besides that you have skills in software packages for statistical and data analysis, such as Python, SAS, R, and MATLAB you want to prove yourself in a quantitative modelling environment, and to apply your skills to derive meaningful, robust, data driven models to guide business decisions you work well within a team, and can take responsibility for making your contribution to successful delivery you fit the profile if you meet the following requirements: Quantitative academic education (Master’s Degree or PhD) in a relevant field, like econometrics, mathematics, actuarial studies or physics good knowledge of statistics, econometrics, financial mathematics, stochastic calculus or machine learning able to effectively communicate (in written and spoken English) about your analysis and results; experienced in modern programming languages (e.g. MATLAB, Python) or statistical languages (e.g. SAS, R) strong analytic skills and affinity with data analytics, (pre)processing, and data handling able to work independently and under pressure pro-active attitude and an excellent team player Our offer the opportunity to be the best you can be, work flexible hours and lots of room to grow both personally and professionally an informal multi-cultural working environment with great colleagues challenging work on complex and advanced quantitative problems the opportunity to pro-actively work on your vitality and fitness a competitive salary a supplementary benefit budget of 11%, which you can spend on additional fringe benefits a personal development budget of EUR 1.000 per year an annual public transportation pass or travel budget, depending on the function a solid pension plan Interested? Please submit your application online. We request you to upload your grades with your resume.  We are looking forward to hear from you!",3/13/2021 21:19
b286789425f4beda,"The CRM grid is working on the transformation of the CRM platform in ABN AMRO into a new platform with Microsoft Dynamics. Next to this development the CRM grid will lead the transition for the current integrated application for Clients Assessment on Sustainability (CASY) within the Credits domain into a standalone environment within Grid CRM. As part of a larger team you convert opportunities for CASY into concrete solutions. Work on achieving your goals and develop yourself professionally and personally. Tell us your story. Your job You are end-to-end responsible for the development and implementation of a standalone environment for all corporate clients that will be one data source for sustainability with various functionalities e.g. assess clients during the client journey; maintain sustainability risk adherence; flexible to change and log changes for assurance and internally hosted client dashboards. This environment must be linked to the development of the NextGen CRM platform Microsoft Dynamics, which roll out has started in November 2020. If this standalone environment is established the next stage is a go-to environment for client related data on sustainability as a complete client facing online platform with other functionalities e.g. assess clients on their sustainability performance; fee-based propositions and integration with other processes e.g. KYC.It is your responsibility to control potential risks and pro-actively engage regulations associated with this product and help to translate this into policy and products. You also make sure all product and decision engines are documented and aligned with other departments, like Credit Risk, Legal, Compliance and IT. You give input for strategic advice processes: from problem analysis, identification of solution directions to implementation thereof. Projects have an IT component, in which you team up with engineers to build better products. You formulate and refine the requirements, testing results and supporting implementation. Working environment The CRM Grid wants to create CRM as a Service as a fundamental and essential enabler to secure a continuously evolving future proof ABN AMRO service model. The core purpose is to create an awesome customer and employee experience across all channels, seamlessly through optimal use of data, relevant customer insights must be provided. We work with a team of 60 ambitious colleagues (Business and IT) who share a passion for CRM. In our team we face a new challenge. Sustainability is the strategic pillar for ABN AMRO and carries a bank wide impact. In particular, ABN AMRO must be able to adhere to the sustainability policy for lending. In turn the bank should be able to conduct a strategic dialogue with all our clients and position ourselves as a bank that accelerate the sustainability shift. To support this vital initiative a new platform will be created for Clients Assessment on Sustainability (CASY) to conduct a strategic dialogue with all our clients, (small) lending and credit.  Goals for the platform are: Being able to assess input from our clients and benchmark as per our expectations Being able to provide insight to business for their progress on targets Monitor and follow-up on actions agreed during dialogues Your profile You are an energetic person with a passion for the combination of thinking and doing. Being a business developer in our Grid is a broad function with elements of products, processes and consultancy. At the same time new products must fit together well and meet the future needs and wishes of our customer. We ask you for precision, creativity, empathy and broad knowledge of sustainability. With these competencies you know how to create the best environment for our business and the customer. You present your ideas in a convincing and concise way with impact. You also know how to manage your stakeholders and with your social skills you quickly obtain insight into the various interests within an organization. Do you think you fit in with us?  Check your profile: Hbo/Bachelor level of working and thinking Five or more years’ relevant work experience within an agile work environment Demonstrable experience as a business developer Scrum certifications for scrum master or certificates for business analyst/developer - Specific competencies for this role: -Change orientated, -Analytical, -Client focused, -Entrepreneurial, -Collaborative Interested? Are you interested? Then apply online for this vacancy. For more information, contact Hao Hu, Product Owner CASY at 06-11497899 or Margriet Heijne, Product Owner MSD at 06-22927760. We would like to meet you!  Note: you are in de possession of a Dutch working permit.",3/13/2021 21:19
f7707f879c8fc8de,"About Our Client Our client is a large and ambitious global botteler with A-Brands as clients. You will be part of the small yet ambitious and new data management team. Job Description The Enterprise Data Analyst plays an important part of abovementioned journey. (S)He reports into the Enterprise Data Management Lead who is accountable to drive data harmonization across Europe. The Enterprise Data Management Lead report into the ICT Director, which reports into the CFO Europe. The Enterprise Data Management Team plays an important cross-functional role both from a business process angle, as well as from an organizational angle towards their business units. Therefore, the team closely interacts with the European process manager, business process experts, the central IT team, as well as the enterprise data management community connecting all their business units. The Enterprise Data Analyst has an important role in organizing Enterprise Data Management across Europe (Data Governance, Processes (MDM), etc.); but as a main activity (s)he will be part of the multi-year business and IT transformation program within the master data work stream. Main areas in this stream are related to data harmonization, migration and design (strongly S/4 HANA related, but also related to other satellite applications). The team is relatively new and in combination with our business and IT transformation journey, there are limitless possibilities to take ownership, drive initiatives and work independently on various data domains, projects and more. Bring in relevant experience, combined with an entrepreneurial mindset to build and grow enterprise data management capabilities. Responsibilities: Vary across all angles of Enterprise Data Management supporting the Enterprise Data Management Lead in the following: Detailed as-is analysis in our legacy SAP and other non-SAP ERP systems Design to-be (master) data concept with respect to S/4 HANA Initiate, define and executes data harmonization (concerning data profiling, data analysis, data harmonization, data cleansing and data migration) concerning all strategic initiatives. Design, implement and work with our MDM platform (Syniti Knowledge Platform) (varying from data analysis, data migration and master data management Ability to understand and translate business, data and system requirements in our new Enterprise DataManagement setup (both from an organization and process angle as well as the data and IT angle). Further design and implement Enterprise Data Management across Refresco Europe; concerning, Enterprise Data Governance and Processes, Enterprise Data Standards, Quality and Reporting using industry standard methodologies and frameworks. Detailed support in understanding our current IT landscape (SAP, non-SAP ERP, etc.) related to data configuration, maintenance and usage Detailed support in designing the S/4 HANA template - master data concepts - including all accompanying activities related to data harmonization and migration Implement and work our MDM Solution (Syniti Knowledge Platform) and any other supportive toolsets needed (E.g. SQL Server, Qlik, etc.) Further develop Enterprise Data Management from all angles and strengthen the capabilities within Refresco Europe Advocate Enterprise Data Management across Europe, create sponsorship and be recognized as value creator in this domain Ensure that all business process, data and IT requirements are embedded in our future enterprise data organization, processes and IT architecture Proactively support the business and IT in all enterprise data related initiatives, varying from data analysis, support in validation and cleansing, etc Foster communication and teamwork within and across organizational boundaries Challengin role within a relatively small and growing team Working on the latest SAP 4HANA technology related to MDM The Successful Applicant Bachelor or Masters degree 5+ years experience in a similar role such as: Business Analyst, Data Analyst, Master data management role etc. Good understanding of SAP (both ECC and S/4 HANA) from both a business process and/or (master) data angle (e.g. business partners (vendors/customers), materials (raw, packaging, semi-finished and finished goods), BOM and recipes, etc.) Abilities with building solutions from scratch Good understanding of end-to-end business processes in connection with SAP Data analytics capabilities, varying from: SQL, Python and/or various analytics/MDM solutions (preferably Syniti Knowledge Platform) Experience in aligning business needs and convincing stakeholders of goals and vision You are eager to work in an informal and entrepreneurial environment in a fast growing company; You have a strong analytical skillset combined with a problem solving mentality; You are used to working under the pressure of a deadline and get things done; You are a self-starter, who is able to work independently as well as in a team You are fluent in English. What's on Offer Working as an Enterprise Data Analyst, based in Rotterdam where you will work for a global organisation within a small yet fast growing and innovative team. They offer a nice salary package + bonus. In case you have got any questions related to the role and or salary package, feel free to reach out for me: Name: Ricardo Nasser Phone / Whatsapp: +316 22 41 27 37 Client Industry: Manufacturing and Production *Note: please only apply if you do have an EU working permit*",3/13/2021 21:19
db9f7937705193da,"De Business Data Analyst bij BMW Group Nederland ontwerpt voorspellende strategische modellen en/of algoritmes op basis waarvan de business haar doelstellingen realiseert. Wil jij het verschil maken als het gaat om het verzamelen, asessen en prepareren van data(sets)? Lees dan eens verder, want deze fulltime baan in Rijswijk kan dan van jou zijn! Mis deze baan niet, solliciteer snel want volgende week vinden de gesprekken al plaats! De functie De Business Data Analyst bij BMW Group Nederland vertaalt de business vraagstukken (zoals salesresultaten, marketingdata over conversie, personalisatie, optimalisatie en forecasting als ook financiële cijfers) naar voorspellende strategische modellen of algoritmes op basis waarvan de business haar doelstellingen realiseert: méér auto’s verkopen tegen de juiste marge. Je bouwt concrete dashboards en modellen met Tableau en Python. Je bent eveneens verantwoordelijk voor de exploitatie van nieuwe datasets en technieken. Kortom: Je voorspelt welke acties de business moet nemen om de verkoopdoelstellingen effectiever en efficiënter te halen. Hiermee verbeter je ook de klantbediening en/of commerciële klant/markt benadering In deze rol maak jij het verschil, als het gaat om het verzamelen, asessen en prepareren van data(sets). Je visualiseert data-inzichten, op basis van hypothesen vanuit de business, als ook op basis van eigen ideeën. Natuurlijk werk je samen met een data-engineer. Je bent ook een Business Consultant die vervolgvragen beantwoordt vanuit de directie en business over de werking en validatie van het resultaat. Je geeft trainingen en technisch/inhoudelijke ondersteuning, met name op het gebied van Tableau. Je bent sparring partner richting Directie Nederland en BMW AG (Duitsland) op het gebied van nieuwe datatechnieken en GPM (granular performance management). Je maakt deel uit van het Market Intelligence Team. Jouw profiel De Business Data Analyst is iemand die vragen stelt, in oplossingen denkt, assertief en integer is. Wij zoeken een gemotiveerde en resultaatgerichte persoonlijkheid die drive en overtuigingskracht heeft. Jouw analytische vaardigheden stellen jouw in staat een visie op de juiste wijze te vertalen en tot uitvoer te brengen. Je krijgt dingen voor elkaar! Je bent in staat om nieuwe inzichten en/of modellen vanuit de beschikbare data statistisch te modelleren. Je communiceert makkelijk in verschillende situaties naar verschillende personen. Het is belangrijk dat je jouw visie goed kunt overbrengen naar stakeholders. Dit doe je op een enthousiaste en overtuigende manier. Natuurlijk stem je dit af op verschillende situaties en gesprekspartners. Jouw enthousiaste werkinstelling werkt aanstekelijk. Hiermee motiveer je ook anderen. Je hebt de gave anderen van jouw ideeën te overtuigen en je behandelt mensen op de manier waarop je zelf behandeld wilt worden. In deze baan is het belangrijk dat je goed onder druk kunt werken. Verder breng je met je mee: HBO+ | WO Werk- en denkniveau; achtergrond in een sterk kwantitatieve richting bijvoorbeeld econometrie, (toegepaste) wiskunde of natuurkunde; Ervaring met Tableau en Python (of vergelijkbaar), statistiek, modelbouw en optimalisatie; Tenminste 2 jaar werkervaring in een vergelijkbare functie; Je hebt kennis van de business domeinen zoals Marketing, Operations of Finance; Je kunt uitstekende communiceren in het Nederlands en Engels in woord en geschrift; Kan je ook Duits dan is dat een voordeel. Bedrijfsprofiel BMW Group Nederland zit middenin een groots modellenoffensief, terwijl ze tegelijkertijd zeer ambitieuze duurzaamheidsdoelstellingen nastreeft. Premium en duurzaamheid zijn immers onafscheidelijk. Het BMW Group portfolio bevat volledig elektrische modellen, vele plug-in hybrides én zeer efficiënte verbrandingsmotoren met de laagst mogelijke CO2-uitstoot. Zo hebben onze klanten zélf de keuze. Deze boeiende mix van vooruitgang en optimisme vindt haar weg richting de wereldwijde markten. Met name de Nederlandse, waar BMW Group Nederland met de merken BMW, MINI en BMW Motorrad al jaren marktleider is in het (premium)segment. Wij zijn een onderdeel van de wereldwijd opererende BMW Group in München en verantwoordelijk voor de verkoop en marketing van BMW, BMW Motorrad en MINI in Nederland. Onze marktpositie wordt verder versterkt door de nauwe samenwerking met het BMW/MINI dealernetwerk en BMW Group dochterondernemingen BMW Financial Services en Alphabet. Binnen de organisatie werken vele specialismen samen aan ambitieuze doelstellingen en processen. Er is een uitstekende samenwerking tussen de teams in een bedrijf waar iedereen de passie deelt voor onze begeerlijke twee- en vierwielers. Het aanbod De Business Data Analyst treedt direct fulltime in dienst bij BMW Group Nederland in Rijswijk. Je kan rekenen op: Salaris tussen €3.500 en €4.500 afhankelijk van kennis en ervaring; 24 vakantiedagen en 6 adv-dagen; Een persoonlijke bonus op basis van behaalde persoonlijke doelstellingen en ontwikkeling; Een company-bonus op basis van behaalde organisatie- en persoonlijke doelstellingen; 8% vakantietoeslag; Een collectieve pensioenregeling (DC regeling); Reiskostenvergoeding; Aantrekkelijke BMW, MINI en BMW Motorrad regelingen. Ben jij de Business Data Analyst die wij zoeken? Wij ontvangen graag jouw CV. Wil je eerst meer informatie? Dat kan: bel over deze vacature met Kasia Lamens, Recruitment Consultant Key Accounts, telefoon 06-25080695.  Het sollicitatieproces Lees meer op onze website over het sollicitatieproces bij Exact.  Exactpi Referentienummer: 3156.",3/13/2021 21:19
2bdf7897f757a1d1,"NN Life & Pension is looking for finance talents! For our reporting and valuations team we are recruiting Senior Financial Analysts. A salary depending on your knowledge and experience: salary between € 3.566 - € 6.009 based on 36 hours. Senior Financial Analyst You will be senior member of one of our Liability Reporting teams within NN Life & Pension. These teams are under the umbrella of the Finance Transformation & Reporting department that consists of 6 teams that work in close cooperation. We are responsible for the financial and regulatory reporting of liabilities and the execution of significant change programs such as the implementation of IFRS 17. As a Senior Financial Analyst your main responsibility is to create and analyse top-notch IFRS & SII liability figures, evaluate new business contribution and explain the results to our internal and external stakeholders. You will support your peers in their development and you have strong ability to content wise coach your team members. Your impact as a Senior Financial Analyst at NN One of your key challenges is to drive our rapidly changing environment. The new IFRS 17 standards expose us to a key change in the reporting landscape. Strategic changes in the business require revolutionary engineering in our financial processes. Pension buy-outs and reinsurance improve our competitive advantage where your crucial role is inevitable. Who you are As Financial Analyst you have a diverse set of skills: You have a high learning agility and you can easily adapt and absorb new information in a changing environment You have excellent analytical skills, combined with good communication skills in English You are change minded and always looking for improvement You like to take ownership and proactively like to achieve the best results You have deep technical experience in the field of reporting and/or actuarial sciences You like to coach junior team members and help them to understand financial processes and results Master’s degree in a quantitative field (e.g. econometrics, actuarial sciences, mathematics, finance) At least 5 years relevant working experience in Finance and/or Risk departments Initiative mindset and passion about improvement and automation Your responsibilities As a specialist in your field of expertise, you like to achieve excellent results: You have a deep understanding of the financial results of an insurance company You are able to provide clear explanations of the results to our stakeholders, including senior management You ensure timely and quality delivery of the financial results You drive changes proactively with new ideas and you are looking for improvements in the data flow landscape You are able to engage with a great variety of stakeholders, such as actuarial function holder, head office finance, auditors, etc. Your colleagues About the team: The Liability Reporting teams consist of professionals in econometrics, quantitative, controlling, actuarial fields. We closely work together with other departments at NN and communicate with several stakeholders such as external auditors. From the projects ongoing in respect of financial transformation currently the largest one is IFRS 17, the new financial accounting regime for insurance contracts.  About NN We help people care for what matters most to them. The world in which we live may change, but what really matters to people remains the same. Family, friends, love, health, home and of course work. You help to make our services more personal and relevant. As an organisation we can really make a difference with all our brands: Nationale-Nederlanden, NN Investment Partners, ABN AMRO Verzekeringen, Movir, AZL, BeFrank, Zicht and OHRA. Continue developing It is important to us that you continue to develop yourself. We give you the space and the confidence to grow in your career as well as a person. We help you with: Plenty of training and learning opportunities in our Learning & Development Centre A large (international) network of colleagues who are keen to share their knowledge with you The autonomy to set out your own development path Employee Benefits You are more than a colleague and we understand that very well at NN. You have different roles in life and that involves choices. We give you the opportunity to select the employee benefits that are important to you and that match your personal situation. This includes buying additional leave and flexible working hours. Your holiday allowance and 13th month are paid with your salary monthly, so there is no need to wait.  Because of coronavirus, all NN colleagues are currently working from home fully digitally. It is currently not yet clear when we can return to the office. The official location for this job is Rotterdam.  Will you be our new colleague? If you are enthusiastic about this vacancy and think that you would be a good fit for the team at NN, we would like to invite you to apply. We are very keen to find out who you are, what motivates you and what you can contribute to this role at NN.  Apply now Questions about the application procedure? Then please mail recruiter Danitscha Mahadew via danitscha.mahadew@nn.nl Just to be Clear, because we Care and Commit This is a permanent position. A candidate will receive a NN contract and we are not open to interim/ freelance assignments,- candidates or an introduction of profiles by any type of agency. Thank you for your interest and understanding!",3/13/2021 21:19
