id,description,scrapetimesdescription
f922c552501f87d8,"At Ahold Delhaize, we want to grow. That is only possible if you grow with us. That is why you can go in all directions with us career-wise and in your personal development. While we work together to build our brand and your career, you can count on:  A permanent contract and a gross base salary up to €50-60k, plus bonus. 25,5 vacation days and 19,5 extra (work-reduction) days off, with the option of having the extra days off paid out A laptop and phone Flexible working hours An excellent pension plan with an employee contribution of 6.2% Reimbursement for travel expenses to and from Zaandam A 10%-discount on your groceries at our Albert Heijn stores up to €300 per year",3/13/2021 18:48
3a2e46330be8e90e,"Wie zijn wij? Wij zijn de partner op het gebied van financiële dienstverlening en risicomanagement. We zijn een innovatieve, resultaatgerichte en dynamische organisatie die de ambitie heeft om een toppositie in de verzekeringsmarkt en financiële dienstverlening te bemachtigen. Inmiddels werken wij met ruim 700 collega’s elke dag samen om onze klanten te kunnen voorzien van de zekerheid waar zij behoefte aan hebben. Wat ga je doen? Samen met jouw team ben je medeverantwoordelijk voor het ontwikkelen en up-to-date houden van een veilig, flexibel en schaalbaar data platform. Dit doe je door: samen met de data engineers koppel je verschillende bronnen aan het Heilbron Data Platform en zorgt voor een oplossing conform de architectuur van het platform; je bent eigenaar van het Business Objecten Model en voert hier de regie op; je maakt analyses over de bestaande inrichting en volwassenheid van de datamanagementprocessen en brengt prioriteiten en knelpunten in kaart. Als Informatie Analist ben je verantwoordelijk voor het vertalen van business requirements naar informatie producten en doe je de benodigde aanpassingen in o.a. de architectuur, objectrelaties en bronontsluiting. Jouw passie ligt in het specificeren van de informatiebehoefte in de organisatie. Met behulp van productcompositie, procesmodellering, business objectmodellering en diverse vormen van datamodellering achterhaal jij de samenstellende componenten en de daaruit voorkomende gegevenselementen en breng jij deze in kaart. De informatiebehoefte haal je op middels ontwerpsessies die jij organiseert en begeleidt. De terugkoppeling verzorg je middels mock-ups of paper prototyping in validatiesessies. Doordat jij betrokken bent bij de veranderingen in de organisatie en kennis hebt over de informatiebehoefte weet jij de juiste koppelingen te leggen en de gevolgen voor het data landschap te overzien. Je vertaalt benodigde inzichten en nieuwe processen vanuit de business naar functionele eisen voor het KPI Dashboard en beschrijft deze in user stories. Wie ben jij? Jij bent gek op data en wil samen met het team bouwen aan een veilig, flexibel en schaalbaar data platform. Energie krijg je doordat je midden in de business staat en door jouw sterke analytische vaardigheden achterhaal je de vraag achter de vraag. Je hebt, bij voorkeur, een IT-gerelateerd diploma. Je hebt ervaring op het gebied van SSIS, MS SSAS, SQL en ETL tooling en kennis van technische en functionele datamodellering. Beheersing van de Nederlandse taal op minimaal B2 niveau is een vereiste. Wat bieden wij jou? Een uitdagende baan voor minimaal 32 uur per week, met verantwoordelijkheid en vrijheid in een groeiende en resultaatgerichte organisatie; Een marktconform salaris, dat onder meer afhankelijk is van je opleiding en werkervaring; Een goede pensioenregeling; 26 vakantiedagen (o.b.v. een fulltime dienstverband) en tijd om deze ook daadwerkelijk op te nemen; Personeelskorting bij het afsluiten van je eigen verzekeringen; Ruimte voor nieuwe initiatieven en ideeën; Uitgebreide opleidingsmogelijkheden; Een goede werksfeer, welke wordt omgeschreven als: transparant, informeel, hard werken maar humor én gezellig op z’n tijd; Actieve en gezellige personeelsfeesten (wanneer dit weer mogelijk is). Ben je enthousiast geworden? Ben je enthousiast geworden en wil je samen met ons de markt voor je winnen? Solliciteer dan nu voor deze functie en stuur ons jouw cv en een krachtige motivatie. Wil je meer informatie naar aanleiding van deze vacature? Dan kan je contact opnemen met Jeroen Luigjes, op het telefoonnummer 06-82773002. Wie weet zien wij elkaar dan binnenkort! Ps. Ga je bij ons werken? Dan voeren wij een pre-employmentscreening uit. Dit betekent dat wij onder andere een verklaring omtrent goed gedrag (VOG) van je vragen. Acquisitie naar aanleiding van deze vacature wordt niet op prijs gesteld.  Functiecategorië: IT Opleidingsniveau: HBO Aantal uren: NTB Locatie: Doetinchem of Leusden",3/13/2021 18:48
3216fb5f07def9bc,"For 70 years, Charles River employees have worked together to assist in the discovery, development and safe manufacture of new drug therapies. When you join our family, you will have a significant impact on the health and well-being of people across the globe. Whether your background is in life sciences, finance, IT, sales or another area, your skills will play an important role in the work we perform. In return, we’ll help you build a career that you can feel passionate about. Job Summary We are seeking a Quality Assurance Auditor for our Safety Assesment site located Den Bosch.  Do you have several years of experience as a GLP QA Auditor or are you employed in an OECD GLP environment, e.g. in a laboratory as Senior Analyst / Biotechnician or Study Director? Do you also have a keen eye for quality? If that's the case, we have a vacancy - stipulated below - that is aligned with your profile:  Job Summary Conducts quality assurance audits on challenging multi-phase non- clinical studies within an OECD GLP lab environment. Responsible for process and facility audits to ensure regulatory compliance. We are seeking a Quality Assurance Auditor within a group of 18 QA staff for our Safety Assessment site Charles River location Den Bosch/Schaijk.  Job profile: Performs audits of protocols, in-life critical phases; raw data and final reports to assure compliance with Good Laboratory Practice Regulations (GLP) and Standard Operating Procedures (SOP); Delivers advise to Charles River staff (including management and study directors) on issues relating to GLP compliance; Performs or leads process and facility audits and reviews corresponding regulatory documentation to ensure compliance; Assists in vendor and subcontractor audits; Assists or host sponsor and regulatory agency site audits; Harmonizing and improving quality processes; Provides training for Charles River QA and lab staff to leverage their knowledge and understanding of GLP compliance and other relevant quality systems. Provide recommendations for improvements in auditing of quality systems based on extensive knowledge and understanding of regulations and quality principles.  Job Qualifications The following are the minimum requirements related to the Quality Assurance Auditor position: A bachelor’s degree in a scientific discipline; Experience with GLP or a comparable quality system; 2-4 years of auditing experience Strong knowledge of Dutch and English; Good communication and advisory skills; Work as a team member; Accurate and quality minded. Quickly in learning software programs.  We offer: A challenging and independent position in a dynamic environment; The possibility to develop further in a global team; Good primary and secondary working conditions; An open company culture with an informal atmosphere. About Safety Assessment Charles River is committed to helping our partners expedite their preclinical drug development with exceptional safety assessment services, state-of-the-art facilities and expert regulatory guidance. From individual specialty toxicology and IND enabling studies to tailored packages and total laboratory support, our deeply experienced team can design and execute programs that anticipate challenges and avoid roadblocks for a smooth, efficient journey to market. Each year approximately 300 investigational new drug (IND) programs are conducted in our Safety Assessment facilities.",3/13/2021 18:48
1f909ad6fd9ee578,"Ben jij de ambitieuze technisch data-analist met passie voor data gerelateerde vraagstukken? Word jij uitgedaagd door het automatiseren van bedrijfsprocessen en het bedenken van slimme scripts. En wil jij een actieve bijdrage leveren aan het realiseren van verrassende en innovatieve oplossingen? Dan is deze functie de juiste uitdaging voor jou! Proces en techniek Als technisch data-analist ligt je focus op het begrijpen van (bedrijfs)processen en om hiervoor pragmatische en innovatieve automatiseringsoplossingen te bedenken. Je werkt zelfstandig en in teamverband projectmatig zowel ten behoeve van het interne proces binnen SoliTrust als voor de bedrijfsprocessen van klanten. Jouw profiel Uitgedaagd door technische puzzels en op de hoogte willen blijven van de nieuwste technieken Kennis van programmeertalen of bereid om deze te leren (Java, PHP, C++, Python) Kennis van databases, database-systemen en SQL Sterk analytisch en probleemoplossend vermogen Een afgeronde bachelor of master in Informatica, Wiskunde of een ander vergelijkbare studie Ons aanbod Je krijgt een uitdagende functie binnen ons jonge en ambitieuze team. Je wordt gestimuleerd nieuwe technieken en innovaties toe te passen. We bieden marktconforme primaire en secundaire arbeidsvoorwaarden. Ook bieden we de mogelijkheid tot het volgen van opleidingen. Interesse? Wil je meer weten of kennismaken? Neem contact op met Ernst Albers bereikbaar via 06-86899789 of ernst.albers@solitrust.nl.",3/13/2021 18:48
f26211bdd9027644,"Voor onze opdrachtgever met werklocatie in Nuth zijn wij op zoek naar een Data analist. Het betreft een leuke, afwisselende maar ook zeer uitdagende functie. Onze opdrachtgever is gespecialiseerd in innovatieve supply chain solutions en after sales servicemanagement. De juiste dienstverlening staat centraal bij Dynagroup. Wat zijn je werkzaamheden: In deze functie ben je verantwoordelijk voor het verzamelen van diverse data, je gaat analyses maken en rapportages draaien. Denk hierbij bijvoorbeeld aan het analyseren van het aantal reparaties aan één specifiek product in een bepaalde maand. Onze klant draagt er onder andere zorg voor dat kapotte GSM toestellen gerepareerd worden. In de rol als data analist ga je in kaart brengen welke onderdelen het vaakst stuk gaan (en wat je dus het meest op voorraad moet hebben). Ook kijk je welke toestellen bijvoorbeeld nauwelijks meer voor reparatie komen en waar bijvoorbeeld voorraad van teruggestuurd kan worden worden. Je bent zelf niet verantwoordelijk voor de inkoop maar je staat wel in nauw contact met je collega's. In deze functie zorg je er dus voor dat je collega's van de reparatie hun werk kunnen doen en dat het proces goed blijft doorlopen. Komt er een nieuw product op de markt dan ga je kijken welke reparaties/ storingen je zou kunnen verwachten. Je bent dus bezig met de trends in de markt. In deze functie heb je ook de verantwoordelijkheid om facturen te controleren om te checken of er geen dubbele facturaties zijn gedaan bijvoorbeeld. Je overige werkzaamheden: Je draagt zorg voor de maandafsluiting; Je bent verantwoordelijk voor de financiële flow van processen binnen de organisatie; Je gaat de interne processen in kaart brengen en kijken waar processen verbeterd kunnen worden; Samen met de IT afdeling ga je nieuwe processen implementeren; In deze functie analyseer je veel en rapporteer je je bevindingen aan de leidinggevende. Functie eisen Eisen: Je bent voor zowel de interne als extere klant een belangrijke overlegpartner; Je bent prestatiegericht en je hebt affiniteit met aftersales. Je hebt een groot verantwoordelijkheidsgevoel; Je bent gemotiveerd en je wilt graag de klanttevredenheid vergroten; Je drijfveer is het verbeteren van processen; Je beschikt over: HBO-werk en -denkniveau. Voorbeeld van gevraagde opleiding is Commerciële/ Bedrijfs Economie, Business Administration of (Technische) bedrijfskunde. Kennis van SQL Arbeidsvoorwaarden: Onze opdrachtgever is voornemens om je direct in vaste dienst nemen. Bij Dynagroup beschikken ze over mooie primaire en secundaire arbeidsvoorwaarden zoals een leuk salaris, pensioen maar ook reiskosten. Daarnaast heb je 25 vakantiedagen bij een fulltime dienstverband van 40 uur. Dynagroup heeft aandacht voor haar medewerkers, dit houdt in dat er diverse groeimogelijkheden binnen de organisatie zijn. Net afgestudeerd? Ook dan vragen wij je te solliciteren! We bespreken graag de mogelijkheden met je. Locatie Nuth Uren per week 40 uur Werktijden dagdienst Salaris €2.200,- per week Contact Edmée Peters Kloosterraderstraat 20, 6461 CD Kerkrade Telefoonnummer: 045-5639800 E-mailadres: career@wiertz.com",3/13/2021 18:49
0f8f83e41c557288,"Jij wordt blij van het gehele traject als data analist. Je gaat aan de slag met het inventariseren van de behoefte tot en het bouwen, testen en in productie van de gewenste dashboards/rapportages. Om dit te realiseren ga je met de klant in gesprek om de behoefte aan stuurinformatie te inventariseren. Deze behoeftes vertaal je met behulp van de applicaties Jedox en Power BI.  Jij wordt blij van het gehele traject als data analist. Je gaat aan de slag met het inventariseren van de behoefte tot en het bouwen, testen en in productie van de gewenste dashboards/rapportages. Om dit te realiseren ga je met de klant in gesprek om de behoefte aan stuurinformatie te inventariseren. Deze behoeftes vertaal je met behulp van de applicaties Jedox en Power BI.  Jouw takenpakket; Je vertaalt data naar stuurinformatie in samenwerking met de interne klant; Je ontwikkelt met behulp van een BI tool rapportages en/of dashboards; Je vertaalt data naar informatie door middel van ETL; Je richt kubussen en dimensies in met bijbehorende rekenregels (OLAP); Je begeleidt junior data analisten Jij gaat werken op de afdeling informatiemanagement, hier werk je met 12 collega’s samen. Je komt in een jong en enthousiast team, waar er hard gewerkt wordt, maar lachen ook heel belangrijk is. Je hebt dan ook een goed gevoel voor humor! Een baan bij de Beste Werkgever! VolkerRail is namelijk wederom verkozen tot Beste Werkgever, 2019-2020! We hebben het volste vertrouwen in jou als nieuwe collega, dus we bieden je graag direct een contract voor onbepaalde tijd! Bij een aantrekkelijk werkgever hoort natuurlijk ook een aantrekkelijk salaris! We bieden jou een salaris van €2600,- tot €4500,- bruto per periode van 4 weken, afhankelijk van je opleidingsniveau, kennis en ervaring. Dit betekent dus dat je 13 keer per jaar betaald krijgt én daar komt ook nog vakantiegeld bij!; Om er voor te zorgen dat jij je werk veilig kunt uitvoeren heb je recht op maar liefst 25 vakantiedagen plus nog eens 18 roostervrije dagen. Deze kun je gebruiken om goed tot rust te komen; Goed uitgerust en nog tijd om te sporten? Maak dan gebruik van de bedrijfsfitnessregeling van VolkerWessels; Om jouw vakmanschap nog verder te laten groeien krijg je genoeg ruimte en vrijheid voor eigen inbreng. Daar horen goede opleiding- en ontwikkelingsmogelijkheden uiteraard bij, Jouw loopbaan is jouw verantwoordelijkheid, dus pak die kans!; Vernieuwen vinden we binnen VolkerRail heel belangrijk; bij goede ideeën kun je je aanmelden voor slimmer verbetertrajecten, waarbij je met de juiste begeleiding jouw verbetering kan uitwerken en implementeren; Als je wil mag je deelnemen aan onze collectieve zorgverzekering. Handig want je krijgt korting; Je denkt er vast nog niet over na, dus dat doen wij voor je: je krijgt van ons een uitstekende pensioenregeling van – hoe kan het ook anders – het pensioenfonds Rail&OV; En natuurlijk ligt er een telefoon en laptop voor je klaar op je eerste werkdag. Bij VolkerRail werken wij samen. Het team waarin jij gaat werken, bestaat momenteel uit 2 data analisten, maar we zijn op korte termijn van plan om het team flink uit te breiden. Een deel van jouw werk zal bestaan uit het helpen en bij staan van junior data analisten. Naast het begeleiden van collega’s is het mogelijk om via externe partijen opleidingen te volgen.  Naast je directe collega’s, heb je binnen VolkerRail nog 1200 collega’s en binnen VolkerWessels zelfs, internationaal, 16.000 collega’s! Herken jij jezelf in deze omschrijving? Dan komen wij graag met jou in contact!  Je beschikt over hbo of wo werkniveau en je hebt minimaal 5 jaar ervaring als data analist en ervaring met het opleiden van collega's. Jij hebt kennis van één of meerdere van de volgende programmeertalen; PHP, Java, Python of R. Ook heb je ruime ervaring met SQL en kennis van ETL en OLAP. Daarnaast heb je ervaring met één of meerdere BI tools, zoals Power BI, Jedox, Cognos, Qlik, Tableau. Het is een pré als je ervaring hebt met datawarehouse.  Je bent een energiek en proactief persoon met het vermogen om je in de klanten te verplaatsen. Je hebt een analytische denkwijze en je bent communicatief sterk en hebt vanzelfsprekend affiniteit met data en oog voor detail. Daarnaast beschik je over sterke sociale vaardigheden die je helpen om de klantbehoefte goed te vertalen naar een concreet product. Je bent pragmatisch, zelfstandig, creatief en gaat uitdagingen niet uit de weg. Natuurlijk vindt je het leuk om met data aan de slag te gaan en je kan dit ook in samenhang met programmeertalen. Ook ben jij kritisch en kijk je continu naar mogelijkheden om jezelf, het werk en de organisatie verder te verbeteren; Herken jij jezelf in dit profiel? Dan drinken wij graag een kop koffie met jou! Heb je vragen, wil je meer weten? Dan kun je contact opnemen met Martine Bom, Recruiter, via vacature@volkerrail.nl of op telefoonnummer: +31 6 50060409. Direct een whatsappbericht sturen? Klik dan hier!  Direct solliciteren kan uiteraard ook. Klik op de sollicitatielink en stuur je CV met een motivatie.  Een online assessment maakt onderdeel uit van de selectieprocedure. Een pre-employment screening kan onderdeel uitmaken van de selectieprocedure.  Bureaus, wij proberen het graag eerst zelf!  #LI-MB1",3/13/2021 18:49
a7a292140ba7bd8d,"Hoe maak jij onze klanten blij? Bij bol.com is het altijd druk. In piekperiodes worden er tot wel 500.000 bestellingen per dag geplaatst. Om die goed en snel te verwerken, moeten we de capaciteit van ons logistieke netwerk slim benutten. Dit doen we bijvoorbeeld door bestellingen door het ene of juist het andere warehouse uit te laten leveren, zodat we meer of minder mensen hoeven in te zetten. Zelfs proactieve maatregelen zijn mogelijk, zoals het aanpassen van de levertijd op ons winkelplatform. Om deze sturing te faciliteren, verzorgt ons team inzichten, aanbevelingen en verbeterde automatisering van processen. Maar welke tools en processen moeten we verder verbeteren om te zorgen dat onze systemen de juiste beslissingen nemen? In hoeverre kunnen we capaciteitsmanagement beslissingen ‘outsourcen’ aan zelflerende algoritmen? Wat je doet als Business Analist Capacity Management Je bedenkt hoe we het logistieke netwerk van bol.com beter aan kunnen sturen. Je werkt requirements uit; wat is er nodig om deze ambities te bereiken? Je breekt grote projecten op in stukken (we kunnen niet alles in één keer doen...) Je vraagt kritisch door om juiste scoping te bepalen. Waarom is iets nodig? Wat is nu echt nodig? Wat levert nu het meeste waarde op? Je trekt intensief op met data scientists en Scrumteams. Je begeleidt de implementatie van nieuwe tooling en algoritmen Als Business Analist Capacity Management ben je onderdeel van een team dat werkt aan het verbeteren van de logistiek van bol.com. Je hebt eigen onderwerpen waarvoor je verantwoordelijk bent, maar je staat er niet alleen voor. Je werkt samen met een leuk en enthousiast team. Ook denk je mee over de lange termijn. Waar willen we over een jaar staan? En hoe kan IT en data science helpen die doelen te bereiken? Voorbeelden van thema’s waar we nu aan werken zijn het verdelen van de voorraad over verschillende locaties op basis van advanced analytics en voorspellen van dagvolumes op basis van predictive modelling. Een vraag die wij als team bijvoorbeeld beantwoorden: wanneer passen we (automatisch) levertijdinformatie van ‘vandaag in huis’ aan naar ‘morgen geleverd’? De mix van strategisch denkwerk en operationele optimalisaties maakt deze rol aantrekkelijk voor (startende) business analisten die verder kijken dan hun neus vandaag lang is en analytische skills koppelen aan procesmatig inzicht. 3 redenen waarom dit (n)iets voor jou is Omdat je een technische of IT gerelateerde Master hebt afgerond, analytisch sterk bent en conceptueel na kunt denken. Omdat je graag complexe problemen oplost en het liefst al wat relevante werkervaring meeneemt. Omdat je tot pragmatische oplossingen kunt komen en snapt hoe grote datasets alleen iets waard zijn als je er grote inzichten uit haalt Niet omdat je graag in je eentje de hele dag aan een Excel model werkt Niet omdat je er niet van overtuigd bent dat algoritmen de juiste beslissingen kunnen nemen Niet omdat je kritischer bent op anderen dan op je eigen prestaties Hier kom je terecht Als Business Analist Capacity Management ben je onderdeel van het Capacity Management team. Dat bestaat uit 12 collega’s met een academische achtergrond. De setting is open, informeel, scherp op de inhoud, nuchter en innovatief. Bol.com gelooft in zelforganiserende teams, samen successen vieren en data-gedreven pionieren. Onze kracht is samenwerken op basis van gelijkwaardigheid en elkaar continu verbeteren. Solo kom je ver. Samen kom je verder! Wat je krijgt Wat je krijgt Wat je nog meer krijgt Een blauwe landing Nieuwe collega's krijgen bij bol.com een warm welkom, zodat jij je zo goed en snel mogelijk thuis voelt bij ons. Tijdens jouw introductieprogramma bol.com & ik, nemen we je helemaal mee in de bol.com wereld! Geld enzo.... Werken bij bol.com is uitdagend en daar zetten we uiteraard iets tegenover. Naast salaris, ontvang je ook een jaarlijkse prestatiegerichte bonus, vakantiegeld, 29 vakantiedagen, woon-en werkverkeer regelingen, aanvullende premievrije verzekeringen en meer. Jouw sollicitatieprocedure Je solliciteert We bekijken je sollicitatie zorgvuldig en binnen 2 weken weet je of we je uitnodigen voor een gesprek. Eerste contact We bellen om het eerste gesprek in te plannen. Prangende vragen kun je dan al meteen stellen. In het ‘echt’ ontmoeten Dit eerste gesprek zien we als een kennismaking. We leren elkaar beter kennen en ontdekken of we goed bij elkaar passen. Het vervolggesprek Smaakt het naar meer? Dan gaan we in het tweede gesprek de inhoud in. Hiervoor vul je eerst een online assessment in met persoonlijkheidsvragenlijst, capaciteitentest en een case. Wij lichten de functie en het team toe. Wederzijdse liefde Twee gesprekken zijn vaak genoeg om een goed beeld te krijgen. En als onze liefde wederzijds is, dan begint jouw carrière bij bol.com. :) Nog vragen? Neem dan contact op met Marvin Ensing Recruiter marvinensing@bol.com",3/13/2021 18:49
