id,description,scrapetimesdescription
7d0c94b42e27dd66,"Functieomschrijving Excel, SQL en Tableau kenners opgelet! Voor het Europese kantoor van Nissan in Amsterdam kan jij aan de slag als Business Intelligence analist. In de rol van Business Intelligence analist ben jij, met jouw internationale team, er verantwoordelijk voor dat grote hoeveelheden data gestructureerd gaan terugkomen in heldere dashboards en worksheets. Als Business Intelligence analist word je betrokken bij het brainstormen over hoe deze dashboards te bouwen; wat moet er voor wie en op welke manier aan data terugkomen? En niet alleen voor Nederland, maar voor heel Europa. Vervolgens ga jij prototypes maken van deze dashboards. Tevreden? Dan ga je deze dashboards testen bij een selectie medewerkers. Nog steeds tevreden? Dan zie je jouw dashboards terug bij kantoren door heel Europa. Concreet: Je gaat prototype dashboards bouwen die er voor zorgen dat grote hoeveelheden data voor verschillende afdelingen, in verschillende landen, inzichtelijk worden. Een stadium daarvoor zal je ook meedenken over wat deze dashboards kunnen doen; naast het bouwen denk je dus ook mee over de inhoud. Je zal veel communiceren met verschillende stakeholders over wat de perfecte manier is om data zo te gebruiken dat iedereen binnen het bedrijf er op een betere manier mee om kan gaan. Stakeholders hierbij zijn IT, marketing, product management en sales. Arbeidsvoorwaarden Prachtige werkervaring op de aftersales afdeling van een internationaal aansprekende naam. Een bruto salaris afhankelijk van kennis en ervaring, maar tussen €2200,- en €2600,- per maand op fulltime basis. Reiskosten worden uiteraard vergoed. Er is een dertiende maand. Functie eisen Je gaat aan de slag in een analytische functies waarbij verschillende programma’s worden gebruikt. Belangrijk is daarom dat je op professioneel niveau kan werken met Excel en SQL en dat je een basiskennis hebt van Tableau en Visual basics. De functie wordt uitgevoerd op wo/hbo niveau en het gaat je zeker helpen wanneer je een opleiding volgt / hebt gevolgd in de richting van dataverwerking, bedrijfskunde of waar veel data in verwerkt wordt. Omdat je aan de slag gaat in een internationaal bedrijf is een professionele beheersing van de Engelse taal een vereiste. Het eerste contract zal tot 31 maart zijn, waarna een vervolg besproken wordt. Interessant of heb je een vraag? Bel ons op 020-6124945 of stuurt een mailtje naar amsterdam@justinrecruitment.nl",3/13/2021 21:20
9872b0484695f638,"Bedrijfsomschrijving Als Business Analist ga je samen met 15 collega's, onderverdeeld in een Development en Operations team, werken aan het centraliseren van grote hoeveelheden informatie. Denk hierbij aan uiteenlopende (inhouse ontwikkelde) webportalen, verschillende System-to-System koppelingen en Webservices om alle informatie uit grote overheid-en semi-overheidsinstanties centraal beschikbaar te stellen voor diverse organisaties. Zo is deze organisatie onder ander bezig met het bouwen van een platform waar organisaties als de Belastingdienst, KvK en RDW informatie aan leveren om deze informatie vervolgens in één opslag beschikbaar te stellen. Gezien de grote hoeveelheden berichtuitwisselingen en persoonlijke gegevens is het het belangrijk dat alles goed beveiligd wordt en staat security hoog in het vaandel. Het originele platform is ontworpen in Delphi en wordt momenteel omgezet naar Java, zodoende zijn er twee ontwikkelstraten. Het nieuwe platform wordt door een partner ontwikkeld, daardoor is het belangrijk dat er goed wordt samengewerkt tussen deze verschillende ontwikkelstraten, hier kom jij als Business Analist om de hoek kijken. Binnen deze uitdagende rol als Business Analist kom je te werken in een Scrum team wat is opgebouwd uit ontwikkelaars, testers, architecten en consultants. Hiervoor schakel je met uiteenlopende stakeholders (zowel intern als extern) om requirements in kaart te brengen, vertaal je deze naar functioneel ontwerpen, werk je deze samen met de Architect en Developers uit naar een Technisch Ontwerp en vervolgens naar User Stories die gedurende een twee-wekelijkse sprint opgepakt kunnen worden. Gezien je werkt aan verschillende interne projecten houd je de kwaliteit en voortgang nauw in de gaten en coördineer je de uitvoering. Deze organisatie heeft een commercieel belang, maar werkt veel samen in overheidsprogramma's waardoor je over brede kennis moet beschikken en kennis of ervaring met overheidsstandaarden een pré is.  Functieomschrijving Ben jij een ervaren Business Analist met een technische achtergrond en wil jij je graag aan de slag bij een organisatie die zich inzet als verzamelpunt voor gegevens om de overheid en semi-overheid te helpen? Ben jij een waardige sparringspartner voor software ontwikkelaars, testers, architecten, product owners en heb je ervaring met grote hoeveelheden berichtuitwisselingen? Lees dan nu verder! Je taken zullen onder andere bestaan uit: in kaart brengen van requirements (zowel op technisch als procesmatig niveau) vanuit de business, organisatie en/of klanten; analyseren en uitwerken van processen; opzetten van specificaties en User Stories; functioneel ontwerpen van diverse oplossingen waar grote hoeveelheden data- en berichtenstromen (Webservices / API's) centraal staan; opstellen van het technisch ontwerp in samenwerking en overleg met Architect, Developers en Testers; begeleiden en coördineren van uitvoering; meewerken aan diverse projecten die inhouse ontwikkeld worden; rapporteren van voortgang en kwaliteit.  Functie-eisen Als Business Analist beschik je over; een afgeronde HBO of WO opleiding (bij voorkeur richting IT of bedrijfskunde); uitstekende communicatieve vaardigheden en ben je analytisch sterk; vaardig in het schakelen met uiteenlopende stakeholders (intern en extern); minimaal 3 jaar ervaring met het in kaart brengen van requirements, uitwerken van processen, opzetten van functioneel ontwerpen en opzetten van User Stories; ervaring met Agile/Scrum werkwijze. Pré; een technische achtergrond (bij voorkeur binnen software development); ervaring met berichtuitwisseling, koppelingen, API’s en/of Webservices; kennis en ervaring opgedaan binnen overheid/semi-overheid sector en met overheidsstandaarden.  Arbeidsvoorwaarden Flexibele werktijden; Thuiswerkmogelijkheden; Opleidingsmogelijkheden; Goede pensioenregeling. Contactgegevens Jasper Both Zuidelijk Halfrond 11 2801DD GOUDA  Telefoon: +31182756504 Email: j.both@isense.nl",3/13/2021 21:20
a1c646a79f442cfa,"Analist Biochemie Location: Leiden, South Holland Contact: Nicol Heijtbrink Job type: Permanent Contact phone: +31 (0)20 406 97 50 Industry: Pharmaceutical , Life Sciences, Clinical Research, Contract Testing Labs Contact email: nicol_heijtbrink@oxfordcorp.com Ben jij op zoek naar de volgende stap in je carrière? We zijn op zoek naar biochemisch analisten ten behoeve van kwaliteitscontrole op farmaceutische producten. Heb je ervaring met ELISA, PCR, HPLC en andere biochemische laboratoriumtechnieken, solliciteer dan direct!  Functieomschrijving Voor het biochemisch QC-laboratorium van een van onze opdrachtgevers zoeken wij een analist die zich bezighoudt met de analyse van farmaceutische producten zoals eiwitten, antilichamen en vaccins. Je zult werken met diverse gespecialiseerde assays. (o.a. ELISA, SDS, SEC, TOC, Karl fisher, HPLC / UPLC). Verantwoordelijkheden Hands-on laboratorium assays uitvoeren volgens vaststaande protocollen; Analyse van verkregen analytische data; Werken en rapporteren volgens GMP-richtlijnen; Meedenken in verbeterprocessen op het laboratorium Profiel Afgeronde opleiding in een biochemische richting; Werkervaring onder GMP is een grote pre; Je houdt van aanpakken en voert graag analyses uit middels ELISA, HPLC en andere technieken; Ervaring met het interpreteren van data; Aantoonbare ervaring met biochemische assays; Je hebt een achtergrond in de immunologie; Goede beheersing van de Nederlandse en Engelse taal in woord en geschrift; Goede communicatieve vaardigheden; Arbeidsvoorwaarden Dienstverband: detachering via Oxford Global Resources Salarisindicatie: van €2000,- tot €3000,- bruto per maand naar gelang van ervaring Werktijden: full time 40 uur per week, in dagdienst; Vakantiedagen: 25; Standplaats: Regio Leiden Vacaturenummer: 15799 Oxford Global Resources is het grootste recruitmentbureau binnen de vakgebieden Science, Engineering en IT. Al onze recruiters hebben zelf een relevante achtergrond binnen deze gebieden en helpen je graag bij het vinden van de perfecte baan in ons uitgebreide netwerk. Als gespecialiseerde partij hebben wij een groot aanbod aan laboratorium vacatures op het gebied van Quality Control (QC) en Research &Development (R&D) binnen diverse sectoren, waaronder de Farmaceutische industrie, Biotechnologie, Contract Manufacturing, Contract Research, Voedingsmiddelenindustrie, Chemie, Milieu en Plantensector. Oxford is altijd op zoek naar talent met expertise op het gebied van Biotechnologie, Immunologie, Biochemie, Virologie, Microbiologie, Moleculaire Biologie, Life Science, Analytische Chemie, Fysische Chemie, Polymeerchemie, Petrochemie en Diagnostiek. Wij komen graag in contact met kandidaten die ervaring hebben met een of meerdere van de volgende technieken: USP (Upstream Processing) DSP (Downstream Processing), Bioprocesses, viruskweek, celkweek, ELISA, FACS, Western Blot, SDS-page, PCR, RT-PCR, qPCR, kloneren, sequencing, eiwit zuivering, purificatie, HPLC, UPLC, chromatografie, fysische chemie, viscositeit, smeltpunt, pourpoint, pH, XRF, GC, GC-MS, LC, LC-MS, ICP ICP-MS, AAS, UV, titraties, Karl Fisher, formuleren, steriliteit, determinaties, bioburden, environmental monitoring, LIMS, GMP, GLP, GCP, GDP, ISO17025. Vind je deze vacature interessant? Of ben jij op zoek naar een functie op MLO, HLO, BSc, WO, MSc of PhD en heb je interesse in de vacature laboratorium Assistent, Laborant, Laborant monstervoorbereiding, Analist, Technician, Assistant Scientist, Associate Scientist, Scientist, Manufacturing Specialist, Process Engineer, Validatie Engineer, QA (Quality Assurance) Officer, RA (Regulatory Affairs) Officer, Supervisor, Teamleider, Afdelingshoofd, Hoofd Laboratorium, Manager, Director, etc. Neem dan direct contact met ons op! Apply Now",3/13/2021 21:20
6f3fbc54632b9ff6,"Functieomschrijving Krijg jij ook zoveel energie van je werk op het snijvlak tussen zakelijk en maatschappelijk belang? Dan ga je in deze functie heel veel werkplezier beleven! Je hebt hier namelijk een orderportefeuille van 7.500 huurwoningen, waarbij je werkt vanuit de portefeuillestrategie, duurzaamheidsvisie en dienstverleningsvisie van deze woningcorporatie in Limburg. Jouw uitdaging ligt in de balans tussen het financiële en het maatschappelijke rendement van de complexen in jouw beheer. Geen makkelijke opdracht want het gaat om verhuur, verkoop, ontwikkeling, beheer en onderhoud, maar jij gaat die uitdaging graag aan. Jij maakt vanuit jouw expertise concrete voorstellen voor ingrepen in het vastgoed en de exploitatie hiervan. Vanuit jouw vastgoedexpertise weet jij waardevolle input te leveren voor vraagstukken met een maatschappelijke opgave. Daarnaast ben je verantwoordelijk voor de marktwaardering van het vastgoed. Uiteraard wordt je hierin gesteund door de portefeuillemanager, portefeuille- en data analist en externe taxateurs. Functie eisen Als jij altijd op de hoogte bent van de laatste ontwikkelingen in de vastgoedmarkt en een échte verbinding weet te maken met anderen, dan ben jij de persoon waar wij naar op zoek zijn. Als Assetmanager ben je resultaatgericht, creatief en initiatiefrijk. Je hebt aantoonbare kennis van de woningmarkt, vastgoedbeheer en de optimalisatie van een vastgoedportefeuille. Jouw vaste standplaats wordt Roermond. Heb jij het in je om maatschappelijke meerwaarde te creëren met een zakelijke bril op? En voldoe je aan de onderstaande voorwaarden? Wacht dan niet langer en solliciteer direct. Dit is namelijk jouw kans op een mooie nieuwe uitdaging! Je hebt minimaal een HBO diploma en een HBO+ werkniveau Je hebt minimaal drie jaar relevante werkervaring in het assetmanagement van woningportefeuilles Aantoonbare organisatorische en administratieve kwaliteiten Arbeidsvoorwaarden Deze uitdagende functie met een groot maatschappelijk belang zal je veel waardering en werkplezier opleveren. Als werkgever koesteren we onze mensen, zodat zij er elke dag weer kunnen staan voor mensen op zoek naar passende woongelegenheid. Voor de functie van Assetmanager kun je onder andere rekenen op: Een degelijk salaris in functieschaal K (€ 4.050,- tot € 5.474,- bruto per maand); Aantrekkelijke secundaire arbeidsvoorwaarden conform de cao voor Woondiensten; Flexibel werken is altijd bespreekbaar; Een gemotiveerde groep collega’s die samen de schouders eronder zet; Mogelijkheden voor persoonlijke en professionele ontwikkeling. Het gaat om een fulltime functie waarbij je uiteindelijk de vaste kern van het bedrijf gaat versterken. Continu begeleidt je voor, tijdens en na de gesprekken richting je nieuwe baan. Wij weten alles over deze vacature en het bedrijf. Wij zorgen ervoor dat je goed voorbereid de sollicitatieprocedure in gaat. Welke vragen zijn handig om te stellen? Welke dresscode hanteren ze? Welke vragen kan ik zelf verwachten? Wij weten het allemaal en helpen je om alles uit het gesprek te halen. Info over het bedrijf Deze woningcorporatie heeft we één hoofddoel: Een thuis voor iedereen. Deze belofte maken we samen waar door het ondersteunen van mensen die hulp nodig hebben in het voorzien van hun huisvesting. Wij geloven dat mensen in hun kracht staan als ze zelf de regie hebben. Daarom geven wij de regie steeds meer terug aan de bewoners, zodat ze zelf een fijne woonplek kunnen creëren. Wij helpen ze daarbij en zijn vooral dankbaar dat we dit op zo’n grote schaal mogen doen.",3/13/2021 21:20
9d4741746659d3ce,"The position As a Data analyst and e-commerce specialist you will have a broad responsibility because you are going to make sure that this international fashion company has insight into all its e-commerce activities. The data you are going to analyze will be used to improve the e-commerce process; from your new employer to all retailpartners, national and international. The Data analyst and e-commerce specialist is going to work in an international team where the spoken language is English. In normal times you will work from the Amsterdam office, but you will be in contact with international colleagues on a daily basis. The positon of data analyst and e-commerce specialist summarized: You will analyze data sets and convert these to clear reports. You will present these reports to concerning managers. Using this data you will improve the efficiency in the e-commerce process. When you get the hang of it, you will also start using your data for forecasting inventory for key accounts. You will be in contact with internal- and external stakeholders like IT, customer service, accountmanagers and retail partners to constantly improve and optime processes. What are the benefits of working as a Data analyst and E-commerce specialist A 7 month contract at first directly at the company You will be paid well, according to knowledge and experience Travel expenses are being reimbursed, max €145,- a month 25 payed holidays Working on office hours van 09.00 am - 17.30 pm This company wants you to be healthy so you can join their fitness plan There is a pension plan and a health insurance plan that you can join 1 fashion item a year for free and a lot of others with discount What are we looking for in a Data analyst and E-commerce specialist We are looking for somebody who has 1-3 years relevant and recent working experience in analyzing data and maintaining data sets. It is a plus when you also have relevant experience in e-commerce. The position is on bachelor level. You can work with Excel on a professional level and you have a fluent command of the English language. As a person you are a strong communicator, analytical and somebody who thinks in solutions. If you have any question, or if you are interested just send us an email or click the big application button!",3/13/2021 21:21
236910e1296a0b87,"Ben jij een specialist met Excel en heb je een passie voor het analyseren van data? Ben jij per direct beschikbaar en op zoek naar een fulltime baan voor de komende vier maanden? Lees dan snel verder voor de gehele vacature van Business Support Medewerker! Als Business Support Medewerker, bij een logistiek bedrijf in Amsterdam, heb jij een gevarieerde functie. Jij houdt je voornamelijk bezig met inventory management, customer service en planning. Vanuit de klant ben jij het eerste aanspreekpunt voor vragen en problemen. Hiernaast ga je de administratie bijhouden en de fysieke voorraad van verfpotten controleren. Jij zorgt ervoor dat de Material Master Data correct wordt ingevoerd in de systemen en ABC Analysis. Als Administratief/Business Support Medewerker krijg jij onderstaande taken toegewezen: Jij bewaakt het gehele klant-leveringsproces in het systeem; Jij informeer de klant proactief van eventuele veranderingen; Jij houdt je bezig met het afhandelen en registreren van klachten; Jij gaat de (bestaande) procesdocumentatie actualiseren, opleveren en borgen. Hebben wij jouw interesse gewekt? Lees dan snel verder!  Het bedrijf is gevestigd in Amsterdam Westpoort en beschikt over een magazijn waar verf tijdelijk wordt opgeslagen en gereed wordt gemaakt voor verzending. Binnen het bedrijf heerst een informele werksfeer, waarbij klanttevredenheid en samenwerking centraal staan. Het bedrijf is voor deze functie op zoek naar een tijdelijke kandidaat voor in eerste instantie 4 maanden met kans op verlenging.  Wij zijn op zoek naar een bevlogen persoon die goed zelfstandig en nauwkeurig kan werken en daarnaast het team kan motiveren en stimuleren om de gewenste resultaten te behalen. De ideale kandidaat heeft een flexibele instelling en kan goed schakelen tussen de verschillende werkzaamheden in een hectische omgeving. MBO werk- en denkniveau; Jij hebt ervaring binnen met logistieke branche; Jij hebt doorzettingsvermogen en jij bent stressbestendig; Je beheerst de Nederlandse en Engelse taal in woord en geschrift; Jij bent onmiddellijk beschikbaar voor een tijdelijke functie ( 4 maanden ).  Een salaris van €2944,- bruto per maand; Reiskostenvergoeding (maximaal €6,42 per dag); Fulltime werk voor 4 maanden; Een functie waar jij al snel kan beginnen; Tijdelijk werk;",3/13/2021 21:21
228e20029940ac67,"We need you! ABN AMRO is a leading Dutch bank, with an international presence across Europe, Asia Pacific, and the Americas. We are looking for skilled quantitative regulatory modelling analysts who have a solid quantitative background complemented with a thorough understanding of the regulatory requirements underlying the internal models for credit risk. Your job As a quantitative regulatory modelling analyst you will translate current and proposed regulatory requirements such as EBA Guidelines on PD and LGD estimation into instructions a credit risk modeller can use in developing regulatory compliant IRB models. Furthermore, the team is also responsible for the quality assurance of initiatives within the bank which affect the modelling process. For example reviewing Basel IV requirements, reviewing the application of modelling guidelines to model developments and instructing the modelling department.  In your day-to-day job you will work in multidisciplinary project teams. You closely work together with modellers, policy department and the business in order to ensure that the models properly reflect the regulation, the business and processes. You will work-out frameworks which describe the suitable quantitative methods and techniques and qualitative requirements for the respective IRB models.  As a medior analyst you will take responsibility on different tasks related to credit risk modelling techniques, building regulatory frameworks and among other activities. Moreover, as a medior you will be actively involved in stakeholder management of both internal and external parties including the DNB and ECB. ABN Amro will make sure you receive the right guidance from senior and Management to build a proper career path. Overall you apply your quantitative skills and experience to make a positive impact for the bank and its customers. You will contribute significantly to the success of your team, which includes both junior, medior and senior risk analysts. Your working environment ABN AMRO Risk Modelling is a growing, international team of more than 90 professionals. We are the centre of excellence within the bank for developing quantitative risk models, which inform the bank in its daily decisions, from pricing of deals and granting of customer credits, through to setting and monitoring of market risk limits and determining the capital requirements for the bank.  The risk modelling department plays a key role in ensuring that the bank makes informed, data driven decisions. The main focus is the development and maintenance of our Credit Risk models which cover a large part of the balance sheet. These models are key to the existence of the bank as they form the basis for loan approval, pricing, performance management and regulatory capital. Your profile Minimum of 3-4 years of work experience in quantitative analysis within risk modelling in banking and finance Quantitative academic education (Master’s Degree or PhD) in a relevant field, like econometrics, mathematics, actuarial studies or physics Very good knowledge of statistics, econometrics, financial mathematics, stochastic calculus Well understanding on regulatory requirements regarding internal models for credit risk - internal ratings based approach (IRB) - such as CRR, relevant EBA Regulatory technical standards and EBA Guidelines. Good skills in software packages for statistical and data analysis, such as Python, SAS, R, and MATLAB Excellent communication skills (verbal and written) in English Able to work independently and under pressure Pro-active a “can do” mentality as well as collaborative attitude Team player and goal oriented profile What we offer Multicultural working environment with great colleagues from different nationalities Challenging work on complex and advanced quantitative problems Attractive package (depending on your level of seniority you are allocated to the according salary scale) Flexible and fun working environment Wide range of training opportunities Career development and the possibility to gain experience in different areas of risk modelling, in other business areas of the bank, or in one of our international locations Interested? Please submit your application online. In case you have any questions regarding this position; please get in touch with Mireia Gozalbo (Mireia.Gozalbo.Querol@nl.abnamro.com) responsible for Quality Assurance & Regulatory Compliance within Risk Data Analytics Department.  We are looking forward to hear from you!",3/13/2021 21:21
