id,description,scrapetimesdescription
db9f7937705193da,"De Business Data Analyst bij BMW Group Nederland ontwerpt voorspellende strategische modellen en/of algoritmes op basis waarvan de business haar doelstellingen realiseert. Wil jij het verschil maken als het gaat om het verzamelen, asessen en prepareren van data(sets)? Lees dan eens verder, want deze fulltime baan in Rijswijk kan dan van jou zijn! Mis deze baan niet, solliciteer snel want volgende week vinden de gesprekken al plaats! De functie De Business Data Analyst bij BMW Group Nederland vertaalt de business vraagstukken (zoals salesresultaten, marketingdata over conversie, personalisatie, optimalisatie en forecasting als ook financiële cijfers) naar voorspellende strategische modellen of algoritmes op basis waarvan de business haar doelstellingen realiseert: méér auto’s verkopen tegen de juiste marge. Je bouwt concrete dashboards en modellen met Tableau en Python. Je bent eveneens verantwoordelijk voor de exploitatie van nieuwe datasets en technieken. Kortom: Je voorspelt welke acties de business moet nemen om de verkoopdoelstellingen effectiever en efficiënter te halen. Hiermee verbeter je ook de klantbediening en/of commerciële klant/markt benadering In deze rol maak jij het verschil, als het gaat om het verzamelen, asessen en prepareren van data(sets). Je visualiseert data-inzichten, op basis van hypothesen vanuit de business, als ook op basis van eigen ideeën. Natuurlijk werk je samen met een data-engineer. Je bent ook een Business Consultant die vervolgvragen beantwoordt vanuit de directie en business over de werking en validatie van het resultaat. Je geeft trainingen en technisch/inhoudelijke ondersteuning, met name op het gebied van Tableau. Je bent sparring partner richting Directie Nederland en BMW AG (Duitsland) op het gebied van nieuwe datatechnieken en GPM (granular performance management). Je maakt deel uit van het Market Intelligence Team. Jouw profiel De Business Data Analyst is iemand die vragen stelt, in oplossingen denkt, assertief en integer is. Wij zoeken een gemotiveerde en resultaatgerichte persoonlijkheid die drive en overtuigingskracht heeft. Jouw analytische vaardigheden stellen jouw in staat een visie op de juiste wijze te vertalen en tot uitvoer te brengen. Je krijgt dingen voor elkaar! Je bent in staat om nieuwe inzichten en/of modellen vanuit de beschikbare data statistisch te modelleren. Je communiceert makkelijk in verschillende situaties naar verschillende personen. Het is belangrijk dat je jouw visie goed kunt overbrengen naar stakeholders. Dit doe je op een enthousiaste en overtuigende manier. Natuurlijk stem je dit af op verschillende situaties en gesprekspartners. Jouw enthousiaste werkinstelling werkt aanstekelijk. Hiermee motiveer je ook anderen. Je hebt de gave anderen van jouw ideeën te overtuigen en je behandelt mensen op de manier waarop je zelf behandeld wilt worden. In deze baan is het belangrijk dat je goed onder druk kunt werken. Verder breng je met je mee: HBO+ | WO Werk- en denkniveau; achtergrond in een sterk kwantitatieve richting bijvoorbeeld econometrie, (toegepaste) wiskunde of natuurkunde; Ervaring met Tableau en Python (of vergelijkbaar), statistiek, modelbouw en optimalisatie; Tenminste 2 jaar werkervaring in een vergelijkbare functie; Je hebt kennis van de business domeinen zoals Marketing, Operations of Finance; Je kunt uitstekende communiceren in het Nederlands en Engels in woord en geschrift; Kan je ook Duits dan is dat een voordeel. Bedrijfsprofiel BMW Group Nederland zit middenin een groots modellenoffensief, terwijl ze tegelijkertijd zeer ambitieuze duurzaamheidsdoelstellingen nastreeft. Premium en duurzaamheid zijn immers onafscheidelijk. Het BMW Group portfolio bevat volledig elektrische modellen, vele plug-in hybrides én zeer efficiënte verbrandingsmotoren met de laagst mogelijke CO2-uitstoot. Zo hebben onze klanten zélf de keuze. Deze boeiende mix van vooruitgang en optimisme vindt haar weg richting de wereldwijde markten. Met name de Nederlandse, waar BMW Group Nederland met de merken BMW, MINI en BMW Motorrad al jaren marktleider is in het (premium)segment. Wij zijn een onderdeel van de wereldwijd opererende BMW Group in München en verantwoordelijk voor de verkoop en marketing van BMW, BMW Motorrad en MINI in Nederland. Onze marktpositie wordt verder versterkt door de nauwe samenwerking met het BMW/MINI dealernetwerk en BMW Group dochterondernemingen BMW Financial Services en Alphabet. Binnen de organisatie werken vele specialismen samen aan ambitieuze doelstellingen en processen. Er is een uitstekende samenwerking tussen de teams in een bedrijf waar iedereen de passie deelt voor onze begeerlijke twee- en vierwielers. Het aanbod De Business Data Analyst treedt direct fulltime in dienst bij BMW Group Nederland in Rijswijk. Je kan rekenen op: Salaris tussen €3.500 en €4.500 afhankelijk van kennis en ervaring; 24 vakantiedagen en 6 adv-dagen; Een persoonlijke bonus op basis van behaalde persoonlijke doelstellingen en ontwikkeling; Een company-bonus op basis van behaalde organisatie- en persoonlijke doelstellingen; 8% vakantietoeslag; Een collectieve pensioenregeling (DC regeling); Reiskostenvergoeding; Aantrekkelijke BMW, MINI en BMW Motorrad regelingen. Ben jij de Business Data Analyst die wij zoeken? Wij ontvangen graag jouw CV. Wil je eerst meer informatie? Dat kan: bel over deze vacature met Kasia Lamens, Recruitment Consultant Key Accounts, telefoon 06-25080695.  Het sollicitatieproces Lees meer op onze website over het sollicitatieproces bij Exact.  Exactpi Referentienummer: 3156.",3/13/2021 21:22
7d0c94b42e27dd66,"Functieomschrijving Excel, SQL en Tableau kenners opgelet! Voor het Europese kantoor van Nissan in Amsterdam kan jij aan de slag als Business Intelligence analist. In de rol van Business Intelligence analist ben jij, met jouw internationale team, er verantwoordelijk voor dat grote hoeveelheden data gestructureerd gaan terugkomen in heldere dashboards en worksheets. Als Business Intelligence analist word je betrokken bij het brainstormen over hoe deze dashboards te bouwen; wat moet er voor wie en op welke manier aan data terugkomen? En niet alleen voor Nederland, maar voor heel Europa. Vervolgens ga jij prototypes maken van deze dashboards. Tevreden? Dan ga je deze dashboards testen bij een selectie medewerkers. Nog steeds tevreden? Dan zie je jouw dashboards terug bij kantoren door heel Europa. Concreet: Je gaat prototype dashboards bouwen die er voor zorgen dat grote hoeveelheden data voor verschillende afdelingen, in verschillende landen, inzichtelijk worden. Een stadium daarvoor zal je ook meedenken over wat deze dashboards kunnen doen; naast het bouwen denk je dus ook mee over de inhoud. Je zal veel communiceren met verschillende stakeholders over wat de perfecte manier is om data zo te gebruiken dat iedereen binnen het bedrijf er op een betere manier mee om kan gaan. Stakeholders hierbij zijn IT, marketing, product management en sales. Arbeidsvoorwaarden Prachtige werkervaring op de aftersales afdeling van een internationaal aansprekende naam. Een bruto salaris afhankelijk van kennis en ervaring, maar tussen €2200,- en €2600,- per maand op fulltime basis. Reiskosten worden uiteraard vergoed. Er is een dertiende maand. Functie eisen Je gaat aan de slag in een analytische functies waarbij verschillende programma’s worden gebruikt. Belangrijk is daarom dat je op professioneel niveau kan werken met Excel en SQL en dat je een basiskennis hebt van Tableau en Visual basics. De functie wordt uitgevoerd op wo/hbo niveau en het gaat je zeker helpen wanneer je een opleiding volgt / hebt gevolgd in de richting van dataverwerking, bedrijfskunde of waar veel data in verwerkt wordt. Omdat je aan de slag gaat in een internationaal bedrijf is een professionele beheersing van de Engelse taal een vereiste. Het eerste contract zal tot 31 maart zijn, waarna een vervolg besproken wordt. Interessant of heb je een vraag? Bel ons op 020-6124945 of stuurt een mailtje naar amsterdam@justinrecruitment.nl",3/13/2021 21:22
a404f55f450958d3,"Bedrijfsomschrijving  Wie zijn wij? Ons team bestaat uit 50 finance trainees, Olaf van IJsselmuiden (Commercieel manager), Denise van de Beek (Sales consultant), Yves Martens (Sales consultant), David Ibink (Sales consultant), Juriën Buitendijk (Sales consultant), Monica d'Aumerie (Recruitment consultant). We zijn een jong, energiek en informeel team met veel persoonlijke aandacht voor elkaar.  Wij vinden binnen ons team de volgende topics belangrijk: transparantie, flexibiliteit, verbinding, durven fouten te maken, daadkracht, veerkracht en deskundigheid. Hier willen we elkaar en ook jou als trainee op willen blijven uitdagen.  Yacht trainees Finance is gevestigd op ons hoofdkantoor in Diemen (Amsterdam Zuid-Oost) en in Rotterdam. Een fijne bruisende werkplek van waaruit we verschillende evenementen organiseren. Momenteel werken we vanuit huis  Functieomschrijving  Het Yacht Finance Traineeship is driejarig vakgericht multicompany traineeship. Binnen finance start en ontwikel je jezelf als trainee in verschillende finance functies binnen Control en Business Analyse. Binnen Analyse kun je ervoor kiezen om je te focussen op een loopbaan als Business- en Financial analist, waarbij jij jouw financiële expertise in praktijk gaat brengen in een adviserende rol.  Waar je dit gaat doen? Als Finance trainee voer je tenminste drie opdrachten uit bij verschillende aansprekende bedrijven, zoals Philips, Palo Alto Networks, Rabobank, Douwe Egberts en het UWV. Zo kun jij jezelf ontwikkelen tot een vakspecialist, maar ook jouw ideale omgeving ontdekken. Onze opdrachtgevers zijn gevestigd in omgeving van Utrecht, Rotterdam en Amsterdam  Aan de slag als business analist: Als business analist werk je mee aan verschillende vraagstukken, zoals het doorvoeren van kostenbesparingen of investeringen. Het is als business analist jouw specialisatie om data uit de business te verzamelen, te ordenen en analyseren. Plus om deze weer te geven in rapportages en te presenteren. Ook kan het zijn dat er aan jou wordt gevraagd om deze data te visualiseren in een dashboard. Als business analist wil je dit leren of heb je al eerder een dashboard gemaakt. Kortom, als Finance trainee ben je tijdens een opdracht als business analist de specialist in het maken van cijfermatige analyses en voorzie je de business van belangrijke inzichten.  Functie-eisen  Solliciteren als Finance trainee? Dit vragen we van jou: Je bent een leergierige young professional die beschikt over een HBO/WO diploma in een financiële richting Je spreekt vloeiend Nederlands (ons ontwikkelprogramma is volledig in het Nederlands!) Je hebt affiniteit met cijfers, werkt hier graag mee, ziet hierin verbanden en vind het leuk om deze te visualiseren Je hebt bij voorkeur al een mooie stage gelopen of ander interessant (bestuur-/ vrijwilligers-) werk gedaan Je bent positief ingesteld en kijkt ernaar uit jezelf nog beter te leren kennen middels ons ontwikkelingsprogramma Je vindt het leuk om zelf actief sturing te geven aan zijn carrière. Dit betekent dat je actief meewerkt aan het vinden van een mooie trainee opdracht. (Beter) leren netwerken vind je een mooie uitdaging  Arbeidsvoorwaarden  Het Yacht traineeship biedt goede arbeidsvoorwaarden met een marktconform. Je bonus is gekoppeld aan je ontwikkeling en jaarlijkse beoordeling. Je kunt rekenen op 25 vakantiedagen! Daarnaast start je elke 12 weken een nieuwe cursus met trainingsdagen, intervisie en coaching.  Om kans te maken op het traineeship of een uitdagende startersfunctie bij één van onze opdrachtgevers dien je een aantal stappen te doorlopen: - Online assessment (competentie- cultuur- capaciteitentest) Persoonlijk interview met een talentconsultant van Yacht Persoonlijk interview met de opdrachtgever In ons traineeship starten doorlopend nieuwe trainees. Er is dus geen deadline om te solliciteren. Contactgegevens Monica d' Aumerie  Email: monica.d.aumerie@yacht.nl",3/13/2021 21:22
a80cb9da64e9b651,"About Our Client Our client is a international company located in Rotterdam. Job Description Steering sales and stock planning process across functions and ensuring alignment with company targets (in collaboration with all relevant departments); Autonomous project management to improve forecasting methodology and the demand planning process in the BENELUX region; Coordinating with international teams to find, prioritize and execute improvements in the current demand planning tool; Improvement of order parameters and other data inputs to the system through process development and increased awareness in the organization Design and execution of category based replenishment strategies for improved availability Retail International The Successful Applicant Required level of study: bachelors or higher 4+ years of experience in demand planning, supply chain management or procurement; Strong analytical skills and strategic insight; Strong communication skills; You are resourceful and you have the ability to make things your own in a fast way; English is a must, Dutch is a plus What's on Offer Good salary International company",3/13/2021 21:22
28355cf0dc131971,"Durf jij het aan, werken binnen Risk Management en dan ook nog specifiek voor een 100% dochter van ABN AMRO, namelijk ALFAM? Je werk Je werkt binnen het modelling team dat bestaat uit +/- 3 fte binnen ALFAM en daarnaast met vele stakeholders binnen ABN AMRO.  Je taken en verantwoordelijkheden zijn onder andere:  Het ontwikkelen, reviewen en valideren van modellen binnen de geldende richtlijnen. - Het optrekken met diverse stakeholders (business, Risk, COO, IT, MV, externe leveranciers van data en/of software) en het toelichten van de werking en toepassing van modellen aan in- en externe toezichthouders zoals CRM, Business, Risk, ECB, DNB etc. Het monitoren van modellen, zodat de kwaliteit van de modellen optimaal is en er bij eventuele verminderde performance snel ingegrepen kan worden. Het overleggen met de business om te inventariseren of de modellen nog naar tevredenheid functioneren. - Het proactief uitvoeren van analyses met als doel het verbeteren van modellen en processen en het aandragen van initiatieven gericht op optimalisatie van het ontwikkel- en onderhoudsproces van modellen. Werkomgeving ALFAM Consumer Credit (ongeveer 250 medewerkers) is toonaangevend marktleider en specialist in verantwoord lenen. Via professionele partners helpen wij mensen hun dromen te realiseren door ze verantwoord geld te lenen. ALFAM is gevestigd in Bunnik en biedt consumptieve kredieten en financial lease aan via de labels ABN AMRO, DEFAM, ACN en GreenLoans. Als één van de grootste financieringsmaatschappijen van Nederland en 100% dochter van ABN AMRO dragen wij actief bij aan een gezonde en verantwoorde leenmarkt. Om dit mogelijk te maken verwachten wij van onze medewerkers dat hun kennis up-to-date is en dat zij dat waarmaken door daadkracht. Je werkomgeving biedt ruimte om ambities waar te maken, is persoonlijk, ondernemend en altijd verantwoord! Bij ALFAM kom je terecht in een gedreven en ambitieuze werkomgeving. Korte communicatielijnen, resultaatgerichtheid en commercialiteit kenmerken de organisatie. Verantwoordelijkheid nemen voor eigen handelen vinden we belangrijk!  Binnen ALFAM is er een 2e lijns onderdeel waar Credit Risk, Modelling Risk en andere riskactiviteiten zijn ondergebracht. De meeste werkdagen zul je dan ook in Bunnik zijn, de andere dagen bij ABN AMRO Bank in Amsterdam als de Corona maatregelen zijn opgeheven. Er wordt dan ook van je verwacht dat je behalve kennis en ervaring deelt, ook een bijdrage levert aan de visie en strategie van Risk binnen ALFAM én de bank. Je profiel Je bent vastberaden en combineert graag denken met doen. Je bent analytisch ijzersterk. Je weet complexe materie goed over te brengen en je bent organisatiesensitief. Je beschikt over een sterke drive om je eigen kennis continu op peil te houden en je wilt ook actief een bijdrage leveren om het vakgebied verder te ontwikkelen en te vernieuwen. Bij alles wat je doet staat onze klant centraal.  Denk je dat je bij ons past?  Check je profiel: Academische master opleiding bij voorkeur gevolgd door een promotie op het gebied van econometrie, wiskundige, informatica, natuurkunde of equivalente opleidingen. Meer dan 8 jaar werkervaring en gedegen kennis van de organisatie, bankproducten, processen en risicomanagement en betrokken wet- en regelgeving. Gedegen kennis van statistische modellering en econometrische methoden, eventueel aangevuld met data science Ervaring met geavanceerde statistische technieken, zoals Bayesiaanse modellering, Monte Carlo, neurale netwerken, beslissingsbomen, etc. Ervaring met statistisch programmeren (bijv. Python, R) en database bewerkingen (SQL, etc), bij voorkeur ervaring met Cognos Ervaring in database, datamodellering, datavoorbereiding en datakwaliteitscontrole Sterke analytische en probleemoplossende vaardigheden Goede communicatie- en presentatievaardigheden, kan complexe zaken eenvoudig uitleggen Ondernemend, zelfstandig en overtuigend Gedreven, zelfkritisch en handelt zelfverzekerd Is coördinator binnen werkgroep/projecten/multidisciplinaire teams Wij bieden Medewerkers van ALFAM zijn in dienst bij ABN AMRO Bank. De bank biedt jou een omgeving waarin je verantwoordelijkheid draagt en het verschil kan maken. Werk dat impact heeft op grote groepen mensen. We dagen je elke dag uit om het beste uit jezelf te halen, waarbij je zelf bepaalt hoe hoog je de lat legt en waardoor je kunt uitgroeien tot de professional die jij wilt zijn.  Je krijgt bij ons een uitstekende werk-privébalans met ruimte om zelf je tijd in te delen en je werkdag vorm te geven. Je krijgt de mogelijkheid om, naast jezelf, ook de bank en de maatschappij verder te helpen. Dat kan in je dagelijks werk, door te werken aan je persoonlijke ontwikkeling, maar kan ook door bijvoorbeeld vrijwilligerswerk te doen. Interesse? Ben je geïnteresseerd? Reageer dan nu online op deze vacature. Neem voor meer informatie contact op met Maarten Burgers, CFRO, 06-51677992, maarten.burgers@alfam.nl. Ik maak graag kennis met je!",3/13/2021 21:22
ef94ee349cff8191,"Functieomschrijving Data Analist - Functie omschrijving  Voor een online warehouse in de buurt van Utrecht zijn wij met spoed op zoek naar een data analist. Jouw werkzaamheden bij dit bedrijf: Je ondersteunt in het analyseren en optimaliseren van alle processen en koppelingen die lopen of nog ingericht worden om te komen tot een optimale performance van de applicaties; Je werkt nauw samen met alle betrokkenen binnen Sales, E-commerce, het Central Warehouse, Sales/Sales Support en Customer Service; Je draagt zorg voor het inrichten, beheren en monitoren van de diverse koppelingen (EDI, webservices e.d.); Je doet kennis op om toekomstig ook een rol te spelen in het beheer van de applicaties binnen de organisatie; Tot slot ben je in staat om verbeterprojecten te initiëren, uit te voeren en te implementeren.  Data Analist - Bedrijfsprofiel Het betreft een online warehouse. Het bedrijf heeft een vestiging in de buurt van Utrecht en in Duitsland. Tot de klantenkring behoren zowel de particulieren als de grote winkelketens (denk aan de Bijenkorf en de Hema). Om deze klanten beter van dienst te zijn is er naast de ontwikkeling van de producten ook hard gewerkt om de IT architecturen aan te passen aan de veranderende markt. In de afgelopen jaren is er sterk geïnvesteerd in het applicatie landschap. Zo is er onder andere een nieuw ERP, WMS, BI, Webshops, PDM en een PIM gekomen. Dit tezamen met de implementatie van een Enterprise Service Bus oplossing geeft ze de mogelijkheid om ook met het gebruik van systemen een nauwere band met de klant te creëren. Om dit proces nog efficiënter in te richten zijn ze nu op zoek naar uitbreiding van het team. Samen met twee andere collega's ben je verantwoordelijk voor de applicaties, het verwerken van data en het inrichten van processen.  Op de werkvloer heerst een informele en gezellige sfeer. Het is van oudsher een familiebedrijf en dat voel je. Plezier in je werk hebben vinden ze ontzettend belangrijk en je kan altijd terecht bij je collega's voor vragen. Ook jouw persoonlijke en professionele ontwikkeling vinden ze belangrijk. Een cursus of training volgen? Dat kan hier zeker, je zal alleen zelf met het initiatief moeten komen!  Data Analist - Salarisindicatie  Wat zit er voor jou in als data analist bij dit bedrijf? Een uitstekend starterssalaris tussen de €2300 en €2600; Goede secundaire arbeidsvoorwaarden; De ruimte om je te ontwikkelen op zowel persoonlijk als professioneel vlak; Gedreven en gezellige collega's om je heen.  Data Analist - Functie eisen  Wie ben jij? Jij hebt een HBO bedrijfskundige informatica of technische bedrijfskunde/ICT diploma op zak (of soortgelijk); Jij hebt tijdens je studie ervaring opgedaan met het opstellen van dashboards; Jij hebt kennis van SQL, SSIS, webservices en mapping software; Jij beheerst naast de Nederlandse taal ook de Engelse taal uitstekend (bij voorkeur ook nog de Duitse taal). Als persoon ben jij: zelfstandig, analytisch, communicatief vaardig, initiatiefrijk en proactief.  Herken jij jezelf in bovenstaande? Dan ben jij de data analist die wij zoeken. Solliciteer vandaag nog en begin snel aan jouw droombaan!  Solliciteren tijdens #corona? Bij ons kan je kiezen uit een online gesprek of een persoonlijk gesprek (met inachtneming van de RIVM-richtlijnen).  Jelling is gespecialiseerd in vacatures voor Data Analisten. Kijk voor meer informatie en vacatures op  Jelling IT Professionals streeft naar gelijke kansen op de arbeidsmarkt voor iedereen. Wij selecteren niet op geslacht, leeftijd, afkomst, etc. en nodigen daarom iedereen die zich herkent in bovenstaand profiel van harte uit om te solliciteren.  Functie-eisen  Taalvaardigheid Vereist: Nederlands  Bedrijfsomschrijving Jelling is gespecialiseerd in arbeidsbemiddeling voor IT'ers en beschikt altijd over een aantrekkelijk aanbod van IT-vacatures. Of je nu een vaste baan zoekt of op detacheringsbasis een kijkje wilt nemen in de keuken van verschillende bedrijven: wij hebben altijd een vacature die bij je past. Als talentvol IT'er brengen we je snel in contact met interessante werkgevers en vacatures. Jouw wensen, ambities en mogelijkheden staan voorop, waardoor je verzekerd bent van een perfecte match.  Salarisinformatie Bruto € 2.300 - € 2.600 p/m",3/13/2021 21:22
6b3a8ad49954d99a,"You are the expert who models and implements the risk systems of ABN AMRO Clearing. As a modelling expert, you will be responsible for data quality, modelling, validation, implementation and testing of the risk systems. You will present our models in the risk committees and to our regulators. What do you see when you envision the next step? Work on achieving your goals and develop yourself professionally and personally. Tell us your story. We want to hear it! Your job You will investigate risk models and propose amendments to the risk systems, for which you will write the functional specifications. The risk models have to be back-tested and validated. You will be responsible for the design and implementation of regulatory capital models. The IT risk team will use your functional specifications as input for the implementation in the systems and you will test the amendments and deliver test reports. You will keep all the functional documentations up to date. You will be responsible for successful participations in Fire Drills, organized by Clearing Houses several times a year. You validate our risk models by providing Model Validation and the risk committees clear descriptions of our models and back -testing results. You will be responsible for keeping our models regulatory compliant. Working environment You will be working in the Quantitative Risk Management team in Amsterdam and closely co-operate with our risk managers around the world. You will participate in a team of quantitative and IT risk professionals responsible for the development of the risk systems. Your profile You are a risk professional who work accurate and finish projects in time. You are able to explain complex mathematical problems to an audience without quantitative background. Your ambition is to deliver accurate risk numbers, keeping practical alternatives in mind. You are a team player, with very good co-ordination and stake holder management skills. You have the skills to inspire and coach your team members and bring the team to a higher level.  Check your profile  Master in (financial) mathematics/econometrics. Structured and accurate way of working, good communication skills, verbally as in writing.  Excellent co-ordinating and medior level stake holder management skills. Good knowledge of financial markets and products. Minimal 5 years experience in derivative pricing and risk models. An expert in derivative pricing. Experience with statistical packages, like R and Python. Excellent team player, who can motivate and coach other colleages. We are offering We are offering Opportunity to improve your knowledge about derivative products and risk models. The opportunity to be the best you can be, work flexible hours and lots of room to grow both personally and professionally The opportunity to pro-actively work on your vitality and fitness A supplementary benefit budget of 11%, which you can spend on additional fringe benefits A personal development budget of EUR 1.000 per year An annual public transportation pass or travel budget, depending on the function A solid pension plan Interested? Does this sounds like something you’d be interested in? Send us your application as soon as possible. To find out more, contact Brian Doelkahar brian.doelkahar@abnamroclearing.com.We look forward meeting you.",3/13/2021 21:22
