id,description,scrapetimesdescription
6552112c439e9506,"De functie Wat ga je doen en waar draag je aan bij? Als Product Manager/Product Owner heb je een strategische visie. Deze visie, samen met de doelstellingen van Waternet, vertaal jij naar een roadmap en de productvisie voor de digitale transformatie binnen de Solution Digitale Workplace waarvoor jij je inzet. Je bent eigenaar van de roadmap en de (product)visie die hierbij hoort draag je op een heldere en realistische wijze uit naar de scrumteams van DWP en de rest van de organisatie. Jij bent verantwoordelijk voor het prioriteren van de Features/ Productbacklog voor de Solution Digital Workplace. Daarnaast ben je verantwoordelijk voor het stakeholdermanagement. Jij bent het aanspreekpunt met betrekking tot de wensen en verwachtingen die leven ten opzichte van het product dat je levert. Als Product Manager/Product Owner heb je een strategische visie. Deze visie, samen met de doelstellingen van Waternet, vertaal jij naar een roadmap en de productvisie voor de digitale transformatie binnen de Solution Digital Workplace waarvoor jij je inzet. Je bent eigenaar van de roadmap en de (product)visie die hierbij hoort draag je op een heldere en realistische wijze uit naar de scrumteams van DWP en de rest van de organisatie. Je houdt de (technologische) ontwikkelen op landelijk, maartschappelijk en politiek niveau bij en vertaalt dit, samen met de business en Teams, naar werkbare oplossingen voor jouw Product. Je bent continue bezig met het door ontwikkelen van de roadmap van de digitale werkplek. Jij bent verantwoordelijk voor het prioriteren van de features/ Product backlog voor de Solution Digital Workplace en het stakeholdermanagement. Jij bent het aanspreekpunt met betrekking tot de wensen en verwachtingen die leven ten opzichte van het product dat je levert. Met jouw technisch inzicht waarborg je de opgeleverde functionaliteit in relatie staat tot de gestelde doelen van Waternet. Vanuit deze rol volg je de ontwikkelingen in de markt op de voet en maak je de vertaling voor Waternet. Daarbij word je ondersteund door de solution architect en werk je nauw samen met de Business analist, de Information security officer en de Scrummaster. Alle features en producten die jij oplevert als Product Manager/Productowner voldoen aan de regels rondom Compliance, Security en Privacy. Samen met de Agile Teams reflecteer je aan het einde van een 3MC naar wat er gepland en daadwerkelijk opgeleverd is. Daarbij worden ook verbeterpunten geïmplementeerd. Je monitort de backlogs en output met Azure Devops (Agile tooling) Je versterkt de verandering door onder andere regelmatige retrospectives te organiseren en audits en review te ondersteunen. Je bent het ‘visitekaartje’ van jouw productlijn. Tijdens o.a. demo`s en PI-dagen ben jij het gezicht en laat jij zien wat de opgeleverde producten zijn. Hierbij creëer je ook draagvlak bij de stakeholders. Je bent een verbinder en zoekt de samenwerking op. En je bent open en transparant en je kan met iedereen een gesprek aangaan, je kan luisteren en doorvragen. Je werkt op dagelijkse basis samen met het teams om producten op te leveren die (het meest) waardevol zijn en bijdragen aan de vastgestelde strategische thema`s dan wel over de vastgestelde producten. Je houdt de Business Owners en de stakeholders hiervan op de hoogte. Jij legt verantwoording af aan de solution manager Je dagelijkse werkzaamheden bestaan uit: Je werkt op dagelijkse basis samen met het teams om producten op te leveren die (het meest) waardevol zijn en bijdragen aan de vastgestelde strategische thema`s dan wel over de vastgestelde producten. Je houdt de Business Owners en de stakeholders hiervan op de hoogte. De digitaliseringsorganisatie van Waternet is onderverdeeld in Domeinen en IT Solutions. Er zijn 4 domeinen waarin IT en Business samen werken: Medewerker, Klant, Data en Assets. De IT-organisatie van Waternet is onderverdeeld in 3 Solutions: Cloud, Digital Workplace en Internet of Things. Binnen de gehele digitalisering wordt Agile gewerkt. Dit is zowel Scrum als Kanban. De Solution Digital Workplace is verantwoordelijk voor het leveren van de digitale werkplek aan alle (circa 2000) medewerkers van Waternet. Hieronder valt ook de mobiele telefonie. De Solution bestaat uit 3 teams waar jij de Product manager/Product Owner van bent namelijk: Customer Service, Support en Desktop. Het team Customer Service is er om vragen van collega’s te kunnen behandelen in de tweede lijn. Het team Customer Support is o.a. verantwoordelijk voor alle decentrale hardware binnen Waternet. Daarnaast leveren zij ook de dienstverlening rondom mobiele telefonie. Het team Customer Desktop is verantwoordelijk voor het leveren van de VDI-werkplek, mobile device management, het packagen van applicaties en de 3e lijns servicedeskvragen. De Solution Digital Workplace (DWP) bestaat uit ongeveer 40 collega's samen met de Business Analist, Scrummaster, Solution architect en Solution manager. Functie eisen In het bezit van een HBO/WO opleiding; In de afgelopen 7 jaar minimaal 5 jaar relevante ervaring als PM/PO-er en je hebt vernieuwende trajecten begeleid; In de afgelopen 7 jaar minimaal 5 jaar ervaring met IT en grootschalige digitale transformatie; In de afgelopen 7 jaar minimaal 5 jaar ervaring met Agile/Scrum werkwijze; Minimaal 5 jaar kennis van virtuele en gemanagede werkplekken; Tenminste 5 jaar kennis van networking- en server infrastructuur; Minimaal 5 jaar kennis van Cloud leveranciers zoals Microsoft/AWS/ Google; Tenminste 5 jaar kennis van Microsoft technologie; Kennis en ervaring op het gebied van het toepassen van security maatregelen en hardening. Over Matchd Matchd bemiddelt voor tijdelijke en vaste vacatures, voornamelijk binnen de overheid. Wij werken samen met Freelancers, ZZP’ers, detacheringsbureaus en sollicitanten die open staan voor een tijdelijk loondienstverband met flexibele uren. Je krijgt van ons altijd een terugkoppeling. Na de sluitingsdatum beoordelen wij elke sollicitatie en geven een terugkoppeling. Heb je geen terugkoppeling ontvangen? Laat het ons direct weten, dan is er écht iets misgegaan en zullen we er alles aan doen om dit te herstellen.",3/13/2021 21:24
2a5b1e8e04be4220,"Wij hebben verschillende Business & IT vacatures openstaan bij onze opdrachtgevers in regio Eindhoven. Meld je aan voor deze vacature om op de hoogte te blijven van de vacatures die bij jouw profielschets passen! Wat ga je doen? De opdrachtgevers zoeken naar functies als, Business Analist, Big Data Engineer, Data Analist en DevOps Engineer. Er zijn mogelijkheden door heel Noord-Brabant. Wij bellen je zodra we een passende uitdaging voor je hebben. Waar precies weten we nog niet, maar één ding is zeker: je kan je oneindig ontwikkelen binnen een mooie organisatie. Let op!: Dit is geen uitzendvacature. Het houden projecten in voor langere tijd, met als doel overname door de opdrachtgever. Wat wij bieden Een open samenwerking in het vinden van de juiste match; Een uitdagende baan bij een van onze opdrachtgevers; Een marktconform salaris (40 u/pw) o.b.v. Jouw kennis en ervaring; Kans om te leren en ontwikkelen binnen een organisatie. Wat wij vragen: Minimaal een hbo-diploma; In de richting van IT; Ervaring met development/programmeren (bijv. Python/Java/etc.) Je bent leergierig en flexibel; Goede beheersing van de Nederlandse taal (C1). Solliciteren Ben jij de perfecte kandidaat voor deze vacature en voldoe je aan de eisen? Klik dan op de knop 'Solliciteer direct!' en we nemen zo snel mogelijk contact met je op!",3/13/2021 21:24
f80ba965fb75d3fe,"Power BI Consultant Eindhoven, North Brabant Market Rate Voor een van onze klanten zijn we op zoek naar een Power BI consultant om hun snel groeiende team te versterken. Als BI consultant word je van A tot Z betrokken bij bij vraagstukken vanuit klanten. In deze rol vertaal je management informatie tot bruibare rapportages en dashboards op basis van Power BI. Verder bouw je aan en onderhoudt je data uit verschillende bronnen, zodat er voldaan wordt aan de vraagstukken vanuit de klant. Ook ben je altijd up-to-date van de laatste ontwikkelingen binnen Power BI. Een uitdagende functie binnen een informele, professionele werkomgeving binnen een enthousiast team, waarin je jezelf ook verder kunt ontwikkelen. Binnen de organisatie zijn er veel mogelijkheden om door te groeien in de richting van bijvoorbeeld Analist of Enigineer. De organisatie is een van de snelst groeiende consultancies binnen hun vakgebied en loopt graag voor op de ontwikkelingen binnen de markt. Wat breng jij mee? Afgeronde HBO opleiding, bij voorkeur in de richting van Business Analytics, Business Intelligence of Bedrijfskundige Informatica. Enige jaren aantoonbare werkervaring in een soortgelijke functie. Met Microsoft Certificeringen op het gebied van Data- Analytics of Engineering, sta je voor. Affiniteit met/kennis van Databases SQL en No SQL, zijn een harde eis. Kennis van Data Lake en Data Warehouse technieken en ontwerp is een pre! Je beschikt over uitstekende mondelinge en schriftelijke communicatieve vaardigheden. Neem voor meer informatie contact op via chloe@systemsaccountants.com",3/13/2021 21:24
c6d60f18410af548,"Associate Scientist - LC / GC Location: Bergen op Zoom, North Brabant Contact: Pascal Lagendijk Job type: Permanent Contact phone: +31 (0)20 406 97 50 Industry: Pharmaceutical , Life Sciences, Biotechnology Contact email: pascal_lagendijk@oxfordcorp.com Heb jij zowel ervaring met HPLC/UPLC/LC-MS/GC-MS als methode ontwikkeling? Heb je daarnaast ervaring met troubleshooting en is routine niet je ding? Wil je als specialist in een breed lab aan de slag en niet bang om out-of-the-box te denken? Dit is je kans! Samenvatting Dit is een uitdagende vacature voor een analist met werkervaring met instrumentele technieken (HPLC, LC-MS, GC, ICP-MS, etc). Deze rol focust op methode ontwikkeling, troubleshooting en het robuust maken van nieuwe methoden. Je traint en begeleid andere medewerkers/gebruikers en draagt op deze manier bij aan de verdere professionalisering van dit laboratorium. Onze klant is een internationaal bedrijf en dit laboratorium geldt als een van de referentie laboratoria voor een groot deel van de wereld. De methoden en technieken die hier ontwikkeld worden worden door de hele wereld gebruikt en dit laboratorium verzorgt ook de troubleshooting op samples vanuit diverse locaties. Functieomschrijving Methodeontwikkeling met LC, GC, Massaspectrometrie en andere instrumentele technieken Troubleshooting op bestaande analyses en problemen die vanuit QC gemeld zijn Schrijven van voorschriften Interpreteren van data Trainen/begeleiden van laboranten/analisten bij het gebruik van apparatuur en nieuwe methodes Profiel Afgeronde HLO of MSc opleiding in de chemische richting Minimaal 2 jaar werkervaring in een chemisch laboratorium met minimaal 1 van de genoemde chromatografische technieken Ervaring met methode ontwikkeling en troubleshooting Je communiceert helder en direct kan gestructureerd motiveren waarom optimalisatie stappen nodig/gedaan zijn Je bent pro-actief, leergierig en krijgt energie van de uitdaging in de baan Arbeidsvoorwaarden Dienstverband: Tijdelijk voor een periode van 1 jaar met kans op verlenging Salarisindicatie: Van ca €2600,- tot €3000,- bruto per maand Werktijden: fulltime Standplaats: Regio Bergen op Zoom Vacaturenummer 15410 Apply Now",3/13/2021 21:24
0c18a6ebac172ff8,"Associate Scientist - Data Systems (GMP/LIMS) Location: Leiden Contact: Nicol Heijtbrink Job type: Temp to Perm Contact phone: +31 (0)20 406 97 50 Industry: Pharmaceutical , Life Sciences, Biotechnology Contact email: nicol_heijtbrink@oxfordcorp.com Challenging position at Janssen Vaccines & Prevention for an Associate Scientist in the data systems team. Job Description At this site our client develops best-in-class vaccines for some of the world's most life-threatening infectious diseases. They have built a dedicated, world-class, multi-functional team across a variety of disciplines to develop a promising vaccines pipeline. The Quality Control Development (QCD) labs group is part of the Analytical Development (AD) Department It consists of 6 sub-teams (Raw-Materials, Sample Management, Cell Culture, Microbiology, Release & Stability and Data Systems) and is responsible for release and stability (R&S) testing as well as the corresponding reporting of virus and antibody products for use in clinical trials and the analytical support of the pilot plant activities.  The department is searching for for a suitable candidate to reinforce the Data Systems team as an Associate Scientist with main focus on implementing and administrating Smart QC ( a non-GMP lab resource planning tool) and BSI systems (digital inventory management system). Responsibilities You are part of QC implementation team, performing parameter and assay mapping into Smart QC together with assay & eLIMS SMEs; Writing procedures, perform testing, train users; Troubleshooting and maintain the system as SME and Site Key User; Setting up master data such as storage locations, label templates, etc; Acts as SME for Quality during regulatory inspections, internal and external GMP-audits; Ensuring compliance with quality standards (GMP) and production schedules; Assisting in eLIMS configuration and review; Requirements BSc / MSc in the biomedical field or equivalent; must: 2-3 years of experience witht eLIMS (specificallyt setting up lims for clinical trials / data reporting); Strong affinity with digital systems; Experience with quality and laboratory systems such as cGMP, SAP and LIMS are strong advantages; Experience with project management is an advantage; Valid Dutch work permit is a must; You are a quick learner who takes initiativ e& responsibility; You have a flexible mindset and are able to take action in a sometimes chaotic an fast-moving environment; Benefits Contract: 1 year through Oxford Global Resources, realistic long term perspective; Salary: €3000,- till €3600,- gross monthly based on level of experience; Hours full-time preferred 32h discussable; Location: initially 100% remote, with sporadic on site; presence, however after Covid more onsite presence in Leiden is required; Startdate: as soon as possible; Vacancy number: 17208; Oxford Global Resources is the largest recruitment agency within the fields of Science, Engineering and IT. All our recruiters have a relevant background within these fields and can help you find the perfect job through our extensive network. As a specialist company we have a wide range of laboratory vacancies in Quality Control (QC) and Research & Development (R&D) within various sectors, including Pharmaceuticals, Biotechnology, Contract Manufacturing, Contract Research, Food Industry, Chemicals, Environment and Plants. Oxford is always looking for talent with expertise in Biotechnology, Immunology, Biochemistry, Virology, Microbiology, Molecular Biology, Life Science, Analytical Chemistry, Physical Chemistry, Polymer Chemistry, Petrochemistry and Diagnostics. We are keen to meet candidates who have experience in one or more of the following techniques: USP (Upstream Processing) DSP (Downstream Processing), Bioprocesses, virus culture, cell culture, ELISA, FACS, Western Blot, SDS-page, PCR, RT-PCR, qPCR, cloning, sequencing, protein purification, purification, HPLC, UPLC, chromatography, physical chemistry, viscosity, melting point, pourpoint, pH, XRF, GC, GC-MS, LC, LC-MS, ICP ICP-MS, AAS, UV, titrations, Karl Fisher, formulation, sterility, determinations, bioburden, environmental monitoring, LIMS, GMP, GLP, GCP, GDP, ISO17025. Do you find this vacancy interesting? Or are you looking for a position at MLA, HLO, BSc, WO, MSc or PhD and are you interested in the vacancy laboratory Assistant, Laboratory Assistant, Sample Preparation Laboratory Assistant, Analyst, Technician, Assistant Scientist, Associate Scientist, Scientist, Manufacturing Specialist, Process Engineer, Validation Engineer, QA (Quality Assurance) Officer, RA (Regulatory Affairs) Officer, Supervisor, Team Leader, Department Head, Laboratory Manager, Manager, Director, etc. Please contact us directly! Apply Now",3/13/2021 21:24
50c5c1e66ad61e2c,"About Our Client Our client is the leading manufactures of innovative hearing care solutions. As a dynamic and global organization they are present in over 90 countries like the UK, USA, Canada, Brazil, Australia, New Zealand and multiple European Countries. With 3.400 stores around the world the organization ranks amongst the biggest retail companies. From their Global IT Support Centre based in Rotterdam they are currently running one of the largest transformations for their Retail IT Landscape. This transformation is the roll out of Dynamics 365 as a centralized solution to support future growth. Job Description You will leverage existing IT solutions and champion the roll-out of new IT solutions to bring additional value to our Group Companies. Focusing on the ongoing support, optimization and automation of existing business processes. This includes supporting ongoing process and changes within the operations (marketing) domain across our global businesses. You will act globally as the Retail Process Specialist for Marketing workstream for their Audiological Care business. Working closely with the Stream Lead and internal stakeholders across business domains (sales, customer contact centre, operations and finance), functional domains (architecture team, RUN, CORP IT, Group Companies) and external development partners. In this role you will engage across multiple projects in the capacity of Retail Process Specialist (Beyond-RMS), or project lead/consultant (group company projects). An overview of the tasks and responsibilities can be found below: Global project engagements. Active participation in full project life-cycle incl. requirements gathering, build, testing, pilot, deployment and post project phases regarding MS Dynamics 365. Take ownership of the successful implementation of business requirements for global projects across their group companies, with a primary focus on the global roll-out of Beyond. Expert in the new Marketing processes and how to apply in the new system solution. Collaborate with SME, SPoCs, key users, and Retail RPO in the Marketing domain for process design. Gather and write functional requirements, analyse need and challenge the IT solution from a process support standpoint. Work with technical architects to ensure business solutions meet architectural principals and are aligned with global architectural concepts. Design and Communicate high-level process and application solutions across organizational hierarchies. Test the IT solution and validate the processes. Support the deployment of the solution by means of preparing and execute training, facilitate key user testing sessions and provide go-live support. Ensure appropriate process related documentation is in place. Contribute to global continuous improvement initiatives in the operations domain. Identify, escalate and follow up on risks affecting operations performance, data quality and/or system integrity. Working in a dynamic and international environment Being part of an organisation that is in the middle of a transformation The Successful Applicant In possession of at least a Bachelor's degree; 5+ Years of experience as a business analyst or a similar role; Excellent communication skills (English as well as Dutch); Experience in at least one full project lifecycle for a successful implementation; Experience and knowledge of Microsoft Dynamics 365 or AX; Experience with working in international organizations or Retail industry would be a plus Excellent in stakeholder management and the ability to listen and influence stakeholders on all levels Competences: Strong analytical mindset; Well-structured; Self-started; Results oriented; Team player; Empathy; Able to work under pressure; Strong affinity with IT; Problem solving skills; Ability to work autonomously on complex topics; Enjoy diving into complex scenarios to gain an thorough understanding of pros, cons, and trade-offs without 'drowning' in the details What's on Offer A challenging and full-time position with the chance to be a part of one of the largest Global retail organizations and roll out the Processes/Systems for the new IT landscape. This in combination with a full comprehensive benefits package.",3/13/2021 21:24
0694c2b2966e0661,"Wat ga je doen? Binnen het traineeship Data Analist ga jij voor de Gemeente Lelystad uiteenlopende projecten draaien om de gemeente en haar inwoners van dienst te zijn! Elke dag werk jij aan projecten om data inzichtelijk te maken, pak jij je rol als adviseur op dit gebied en zet jij jouw skills op het gebied van data-analyse in om antwoord te geven op vraagstukken vanuit de gemeente. Als jij een baan wilt waarin afwisseling en projectmatig werken centraal staan, je sterk bent in data-analyse en jij ook persoonlijke ontwikkeling ontzettend belangrijk vindt, dan is dit een baan voor jou! Wie zijn wij? Innovatief en dynamisch, dat is de Gemeente Lelystad. Niet voor niets, want de wereld verandert snel. Decentralisaties, fusies, digitalisering en ga zo maar door en dat alles is een politiek-bestuurlijke context. Binnen de Gemeente Lelystad krijg jij de kans om de gemeente in de breedste zin van het woord te leren kennen, en jouw persoonlijke kwaliteiten en talenten tot hun recht te laten komen! Modis Tech Academy gaat jou daar binnen het traineeship Data Analist bij helpen! Hoe ziet een dag er binnen jouw traineeship Data Analist eruit? In de weekstart met je team, wordt een nieuw binnengekomen project voorgelegd. Naast de twee projecten waar jij al verantwoordelijk voor bent, hebt nog een paar uurtjes beschikbaar. Het sociaal domein heeft altijd je interesse gehad, dus wanneer jij hoort dat er behoefte is aan meer inzichtelijkheid in de data omtrent de WMO-aanvragen, toon jij je belangstelling! Die is voor jou! De rest van de ochtend heb jij geblokt voor jouw project ‘bestemmingsplan coffeeshop’, waar je enkele weken geleden mee gestart bent. Ontzettend complex, want er zijn veel belangen en regels rondom de locatiekeuze. Eerder heb jij je verdiept in de wet- en regelgeving. Vandaag ben jij samen met een collega in de data gedoken om ook vanuit hier informatie te verkrijgen. Volgende week staat een vergadering met stakeholders en dan zal jij jouw adviezen presenteren. Erg spannend, maar de ruimte en verantwoordelijkheid die je krijgt vind jij heerlijk. Een intervisie met jouw mede-trainees geeft jouw middag invulling. Fijn, want je bent in het project van vanochtend tegen wat dingen aangelopen die je direct als casus kan inbrengen. Zo maken jullie gebruik van elkaars expertise. Wat heb je nodig om binnen het traineeship Data Analist succesvol te zijn? Een afgeronde WO-opleiding waarin je ervaring hebt opgedaan met dataverweking, -analyse of kwantitatief onderzoek. Affiniteit met de publieke sector Een brede interesse om uiteenlopende vraagstukken op te pakken Wat bieden wij jou? Direct veel verantwoordelijkheid en vrijheid om de projecten op te pakken die passen bij jouw interesses en ambities Een 2-jarig traject waarin jij begeleiding & trainingen krijgt om uit te blinken in jouw rol Direct een vast contract voor 36 uur per week Een laptop, telefoon, passend salaris en óók in de toekomst nog mogelijkheid tot thuiswerken What’s next? Solliciteer via onderstaand formulier of via onze website en wij nemen z.s.m. contact met je op. Als je nog meer informatie wil, hoor ik graag van je via lotte.coblens@modis.com",3/13/2021 21:24
89d2845b0ccb1fc7,"About Our Client Our client is an international organisation in the industry segment with multiple locations across Europe, including an office in the Netherlands, in the bigger Rotterdam area. Job Description In this role you will be analysing various information and large data sets with the goal of providing reports of market trends based on collected data and sharing meaningful insights with senior-level management; the goal is to support and advise in decision making. Through a data-driven, pro-active approach, you identify opportunities for the business Generate reports and provide analysis of commercial and sales figures; additional reports regarding segments, supplier information, industry and competitors Collecting, updating, cleaning and processing data in the CRM and IT systems Evaluating possibilities to make continuous improvement and generate efficiency Support specific company projects You will work on international scale, reporting to C-level stakeholders; main working language is English Consultative role combining analytical, commercial and strategic responsibilies Location: combination working from home + office (Rotterdam area) The Successful Applicant Minimum of WO/Master's level degree (University level) Minimum of 3-5 years of similar experience in business intelligence, market analytics with links to sales/commerce Fluency in English is required (additional languages are of an advantage) Experience and knowledge of using ERP and CRM systems Expert in MS Excel, ideally in combination with other similar tools What's on Offer Market-conform primary and secondary benefits including base salary and a bonus. You will have the opportunity and flexibility to work from home. in combination with sufficient freedom and high level of Independence. The organisation you will be part of is financially healthy and offers multiple long-term growth perspectives.",3/13/2021 21:24
