id,description,scrapetimesdescription
77376501cb2641c6,"Data Scientist Organisatie Het bedrijf verzorgt de distributie van energie in een derde van Nederland.  Let op! Er kan gevraagd worden om een geldige VOG (Verklaring Omtrent Gedrag). De kosten voor de aanvraag van een VOG zijn voor de kandidaten zelf. Een screening kan onderdeel van de procedure zijn. Achtergrond opdracht Tbv een project zijn we opzoek naar Data Scientist met PO skills: De nieuwe projectnormen voor GV/R&N zijn gericht op het plannen en calculeren van individuele projecten, waarbij rekening wordt gehouden met de projectomstandigheden. De bestaande methodiek voor normen tav budgettering en strategische planning bestaan uit een set aan gemiddelde normen die een beperkte aansluiting hebben met de nieuwe projectnormen. Dit geeft een aantal bestaande problemen in de Aanleg keten (niet uitputtend):Er is een gat tussen huidige jaarplan en de realiteit voor Aanleg. Dit bedrag stijgt ieder jaar. Gevolgen van prijsverschillen tussen jaarplannen en plan vs realisatie zijn nauwelijks te analyseren De maakbaarheid van het werkpakket is lastig in te schatten > Er is een noodzaak om te komen tot een verbeterde set aan verwachtingswaarden voor tactisch / strategische planning  We zijn hierbij opzoek naar iemand die zowel een stukje sturing (PO) als inhoud (data scientist) op zich kan nemen. PO rol: (30%) Methodiek conceptueel bedenken en uitleggen/uitdragen (kennis van statistische toepassingen) Afstemming hierover met omgeving, zowel naar onderliggend productbeheer als met Planning en AM Backlog vullen en prioriteren van eigen team en regelen dat R&A juiste data beschikbaar stelt  Data scientist / analist (70%): Statistische modellen ontwikkelen in R Data ophalen, koppelen en manipuleren Resultaten van analyses helder presenteren en op basis daarvan inhoudelijke vervolgstappen bepalen met stakeholders  Opdracht informatie Interesse? Stuur ons dan uiterlijk 15 maart 2021, voor 14.00 uur je recente CV + motivatie voor deze rol, samen met je beschikbaarheid/geplande vakanties en je all-in uurtarief excl. BTW.  De locatie van de uit te voeren werkzaamheden kan i.v.m. COVID-19 afwijken.  Bijzonderheden Duur van de opdracht 6 maanden Startdatum z.s.m. Locatie Arnhem Branche Energie Uren per week 36 e-CF Competenties Change Support Aanvraagnummer 29618",3/13/2021 18:51
b4552e0068f9a9de,"Studyportals has disrupted the way universities all around the world recruit international students.  In 2020, our websites received ca. 37 million unique users. Students around the world use our platform, searching for their best matching education. At the same time, we help educators to diversify their (international) student population. This makes us the most popular study choice platform worldwide.  As Sales Operations Analyst, you will be analytical and commercially aware, able to support a variety of operational projects and programs and bring along several years of experience that enable you to operate individually and proactively support our commercial strategy. You have experience in ad operations, data analysis or related roles, with excellent spreadsheet skills and experience using Google Ad Manager. Allowing you to pave your own path to success here with quite some freedom. You will be part of the Universit  Apply Now at Mustakbil.com  This job was originally posted on Mustakbil.com",3/13/2021 18:51
0daf8fcae2f931c7,"Company Description At Varrlyn we believe that if it is possible, it will be done. If it is not possible, Varrlyn will look for ways to do it anyway. Turning impossible questions into possible solutions, that is what makes us different.  Our people breathe, dream and live dealing rooms. We have extensive experience in IT system implementations and application support for different financial markets applications. Varrlyn has a proven track record: we have worked for financial institutions in Amsterdam, Brussels, London, Paris, New York, Frankfurt and Sydney. We will help you improve your cost efficiency, simplify your application architecture, optimize the time to market, increase straight through processing and comply with financial regulations. In short: You do the deal, we'll do the project! Varrlyn is a consulting firm which was founded in 2010 and is based in The Netherlands.  Job Description On behalf of the Value Stream Service Assets at our client, we are looking for a Business Analyst. In this role, As a Business Analyst team member you have outstanding analytical skills and an eye for detail. You have a proactive attitude and are a natural bridge builder. You have strong persuasive powers, know how to challenge stakeholders on subject matters, and you are able to adequately manage expectations. You have a willingness to develop or enhance your t-shaped skills.  Qualifications Hard-skills: At least a higher professional degree, preferably in Business Administration, Information Sciences or a comparable qualification, or experience in working on a level comparable with a higher professional degree; At least 2 years of experience with business and information analysis and data modelling; Knowledge of Asset Management in particular Accounting (products and processes); Proven ability to work closely with the business and translate business needs into functional specifications for technology; Highly developed communication skills in English (at least C1 level); Experience with Agile working is a plus.  Soft-skills: As a Business Analyst you are a specialist in requirements gathering. You think in terms of solutions, and are service minded. You identify and define business needs and produce adequate solutions for meeting them; are involved in the process to make sure that implementation meets the requirements; assess your clients’ requests in terms of feasibility and propose solutions; fulfill a consultancy as well as a specialized role in your field of expertise.  Additional Information Location: HLN, first remote",3/13/2021 18:51
dfab59e95ad9b5b0,"Stel je eens voor… dat jij als Analist Beleggingsfondsen mede verantwoordelijk bent voor het beheren van de aandelen-, beleggings- en mandaatfondsen bij Rabobank. Op basis van jouw grondige analyses weten we de beste fondsen te selecteren, die passen binnen onze doelstelling van volledig duurzaam beleggen. Als expert voor bellegingsfondsen heb je een goed beeld van wat er wordt aangeboden, welke spelers er zijn en met welke strategieën. Ook ben je bekend met de vele assetmanagers in binnen- en buitenland. Jouw analyse onderbouw je met inzichten uit diverse bronnen en je kunt deze goed uitleggen aan collega’s en relaties. Het belang van een goede fondsselectie is erg groot. Hiervoor werk je nauw samen met andere leden binnen het team Funds & Sustainability en met onze externe platformpartner. Uiteindelijk beleggen we voor onze relaties grote bedragen in de beste assetmanagers die jij mede hebt gekozen. De resultaten van jouw keuzes zijn daarom ook goed onderbouwd, meetbaar en inzichtelijk voor iedereen. In jouw werk als Analist Beleggingsfondsen onderhoud je vele contacten; je werkt samen met je naaste collega’s en hebt veelal dagelijks contact met de marktpartijen. Je schrijft en presenteert regelmatig over je bevindingen voor de adviseurs en vermogensbeheerders in het land. Impact creëren Verantwoordelijk voor de sourcing, selectie, screening en evaluatie van assetmanagers en asset strategieën; Voorbereiden en uitvoeren van RFI’s & RFP’s samen met externe partijen; Interviewen en bezoeken van assetmanagers; Analyseren van kwalitatieve en kwantitatieve data, investeringsstrategieën en ESG-integratie; Uitvoeren van een verantwoordelijk investeringsonderzoek met focus op rendement, risico’s en duurzaamheid; Doen van aanbevelingen aan het investeringscomité; Monitoren van trends en ontwikkelingen in de markt op het gebied van fondsen en duurzaamheid; Uitvoeren van een due diligence op voorgestelde investeringsoplossingen, mandaten en fondsen; Onderhouden van een breed internationaal netwerk van assetmanagers; Met elkaar Samenwerken is de manier waarop we werken. Ons team Beleggings Competence bundelt de krachten voor haar kernactiviteit, het doen van beleggingsanalyses en deze uitdragen, naast het beheer van het vermogen van onze relaties in centrale vermogensbeheerconcepten. Dit doen we vanuit onze visie en beleid op duurzaam beleggen. Onze taak is het de tientallen miljarden euro’s van onze relaties te beleggen en hen van up-to-date beleggingsadvies te voorzien. Daarnaast staan we opgesteld voor de beleggingsstrategie, de portefeuilleconstructie, het assortiment van alle soorten beleggingstitels en tooling voor risicomanagement en doelbeleggen binnen Rabobank. Wij verzorgen publicaties voor collega adviseurs en beheerders in het land en ook voor onze relaties via de beleggen app en internet. Met jou erbij als Analyst Fundmanagement & Sustainability staat de teller van het team op 17 collega’s waaronder: Rishma Moennasing, Lead Funds & Sustainability: “In mijn functie spreek ik vermogensbeheerders die wereldwijd zijn gevestigd en die allemaal een interessante visie op duurzaam beleggen en trends in de markt hebben. Heel inspirerend wanneer je een passie voor beleggen hebt.” Met jouw talenten Natuurlijk ben jij sterk analytisch, verbindend en een goede netwerker. Juist die eigenschappen maken jou tot een succesvolle Analist Beleggingsfondsen, zeker in combinatie met:  Afgeronde HBO- of WO-studie, liefst in een economische of financiële richting; Bij voorkeur een afgeronde CFA opleiding of de bereidheid deze te volgen; Ervaring met beleggingsfondsen en managerselectie bij een bank, verzekeraar, pensioenfonds of assetmanager; Kennis van ESG integratie binnen aandelenfondsen; Uitstekende kennis van de Nederlandse taal in woord & geschrift; Servicegerichte instelling; Onafhankelijk en onderbouwd oordelen; Overtuigingskracht; Communicatiekracht. Bij de Rabobank Dat de Rabobank een financiële dienstverlener is voor meer dan 8,5 miljoen klanten in 40 landen, wist je vast al. Weet je ook dat we met elkaar werken aan een betere wereld? Dit doen we op 101 manieren, zoals:  ‘Met de Rabobank Foundation stimuleren we organisaties die sociaal ondernemen. Mensen met een afstand tot de arbeidsmarkt krijgen zo de kansen die ze verdienen om volwaardig mee te draaien in onze maatschappij.’ ‘Nadenken over de toekomst doen we continu. We investeren 3,8 miljard euro in duurzame energieopwekking, zodat generaties na ons in een schonere wereld kunnen leven.’ ‘Wij delen graag onze kennis over duurzame, financiële oplossingen. Zo geven we bijvoorbeeld een korting aan zakelijke klanten die een duurzaam keurmerk voeren.’ Wil jij dit ook? De beste versie van jezelf worden? Wij helpen je er graag bij door jouw ontwikkeling centraal te stellen en te investeren in een omgeving waarin je blijft leren. We geven je de ruimte om te innoveren en ondernemen. Zo bieden we je volop groeikansen en helpen je verwachtingen te overtreffen en het goede buitengewoon goed te doen, zodat je kan groeien als professional. Daarbovenop kan je bij ons (o.b.v. een 36-urige werkweek) ook rekenen op: een brutomaandsalaris tussen € 3.200,- en € 5.300,-, afhankelijk van opleiding en ervaring; een dertiende maand en vakantiegeld; een Employee Benefit Budget (9% van je maandinkomen). Hoe jij dit budget inzet, is aan jou. Denk bijvoorbeeld aan het kopen van extra vakantiedagen, een extra storting in je pensioen of zelfs het maandelijks laten uitbetalen van dit budget; een persoonlijk budget, dat je kunt besteden aan activiteiten gericht op jouw ontwikkeling en loopbaan; flexibiliteit in werktijden en locatieonafhankelijk werken; 100% vergoeding van woon- werkverkeer als je met ov reist! Toch met auto of motor? Kies dan voor een woon- werkverkeervergoeding;een pensioenregeling waar je zelf maar 3,5% aan bijdraagt. Laten we kennismaken Ben jij hem/haar? Onze nieuwe collega die de Rabobank wil versterken als Analist Beleggingsfondsen? En zo het verschil wil maken voor jezelf, onze klanten én de maatschappij? We ontvangen graag jouw sollicitatie op deze vacature in Utrecht. Handig om te weten: Solliciteren kan tot en met 21 maart 2021. Reageer via de “Solliciteer nu” button. Als je vragen hebt over de inhoud van de vacature, kan je die stellen aan Rishma Moennasing, Lead Funds & Sustainability via Rishma.Moennasing@rabobank.nl. Marija Hoksbergen, recruiter beantwoordt met plezier vragen over de sollicitatieprocedure via marija.hoksbergen@rabobank.nl. De selectieprocedure bestaat uit meerdere gesprekken, waaronder een casusbespreking en eventueel een assessment. Screening is onderdeel van de sollicitatieprocedure. We toetsen op basis van de screening procedures die binnen de Rabobank gelden of nieuwe medewerkers voldoende betrouwbaar zijn om werkzaamheden bij de Rabobank te verrichten. Jouw privacy is belangrijk voor ons. Mocht je hier meer over willen weten, klik dan op deze link. Iedereen is anders, en juist de verschillen in mensen helpen ons om een nog betere bank te zijn. Daarom zijn we zijn benieuwd naar wie jíj bent!",3/13/2021 18:51
73a85516c45c054d,"NN Life & Pension is looking for finance talents! For our reporting and valuations teams we are recruiting Junior Financial Analysts. A salary depending on your knowledge and experience: salary between € 2.650 – € 4.379 based on 36 hours. Junior Financial Analyst You will be a junior member of one of our Liability Reporting teams within NN Life & Pension. These teams are under the umbrella of the Finance Transformation & Reporting department that consists of 6 teams that work in close cooperation. We are responsible for the financial and regulatory reporting of liabilities and the execution of significant change programs such as the implementation of IFRS 17. As a Junior Financial Analyst your main responsibility is to create and analyse top-notch IFRS & SII liability figures, evaluate new business contribution and explain the results to our internal and external stakeholders. You will bring your talent and new energy to the team and drive our momentum. Your impact as a Junior Financial Analyst at NN One of your key challenges is to drive our rapidly changing environment. The new IFRS 17 standards expose us to a key change in the reporting landscape. Strategic changes in the business require revolutionary engineering in our financial processes. Pension buy-outs and reinsurance improve our competitive advantage where your crucial role is inevitable.  Who you are As Financial Analyst you have a diverse set of skills: You have a high learning agility and you can easily adapt and absorb new information in a changing environment You have excellent analytical skills, combined with good communication skills in English You are change minded and always looking for improvement You like to take ownership and proactively like to achieve the best results Master’s degree in a quantitative field (e.g. econometrics, actuarial sciences, mathematics, finance) <5 years relevant working experience in Finance and/or Risk departments Initiative mindset and passion about improvement and automation Your responsibilities As a specialist in your field of expertise, you like to achieve excellent results: You have a deep understanding of the financial results of an insurance company You are able to provide clear explanations of the results to our stakeholders, including senior management You ensure timely and quality delivery of the financial results You drive changes proactively with new ideas and you are looking for improvements in the data flow landscape You are able to engage with a great variety of stakeholders, such as actuarial function holder, head office finance, auditors, etc.  Your colleagues The Liability Reporting teams consist of professionals in econometrics, quantitative, controlling, actuarial fields. We closely work together with other departments at NN and communicate with several stakeholders such as external auditors. From the projects ongoing in respect of financial transformation currently the largest one is IFRS 17, the new financial accounting regime for insurance contracts.  About NN We help people care for what matters most to them. The world in which we live may change, but what really matters to people remains the same. Family, friends, love, health, home and of course work. You help to make our services more personal and relevant. As an organisation we can really make a difference with all our brands: Nationale-Nederlanden, NN Investment Partners, ABN AMRO Verzekeringen, Movir, AZL, BeFrank, Zicht and OHRA. Continue Developing It is important to us that you continue to develop yourself. We give you the space and the confidence to grow in your career as well as a person. We help you with: Plenty of training and learning opportunities in our Learning & Development Centre A large (international) network of colleagues who are keen to share their knowledge with you The autonomy to set out your own development path Employee benefits You are more than a colleague and we understand that very well at NN. You have different roles in life and that involves choices. We give you the opportunity to select the employee benefits that are important to you and that match your personal situation. This includes buying additional leave and flexible working hours. Your holiday allowance and 13th month are paid with your salary monthly, so there is no need to wait.  Because of coronavirus, all NN colleagues are currently working from home fully digitally. It is currently not yet clear when we can return to the office. The official location for this job is The Hague. Will you be our new colleague? If you are enthusiastic about this vacancy and think that you would be a good fit for the team at NN, we would like to invite you to apply. We are very keen to find out who you are, what motivates you and what you can contribute to this role at NN. Do you have any questions about the procedure. Then please mail recruiter Danitscha Mahadew via danitscha.mahadew@nn.nl Just to be Clear, because we Care and Commit This is a permanent position. A candidate will receive a NN contract and we are not open to interim/ freelance assignments,- candidates or an introduction of profiles by any type of agency. Thank you for your interest and understanding!",3/13/2021 18:51
1156a9b47e285d46,"Wij zoeken jou als Data Analyst bij Transavia Ben jij de Data Analyst die ons van “actionable” insights weet te voorzien? Als Data Analyst ben je de expert die voorziet in de informatiebehoefte binnen een bepaald strategisch domein. Je kent de business processen en de databronnen die de relevante processen beschrijven. Je draait je hand er niet voor om data te modeleren, onderzoeken op te zetten, en dashboards te bouwen over bijvoorbeeld onze klanten, kanalen, vluchten of andere delen van de operatie. En daarmee sta jij aan de basis van verbeterde en/of nieuwe processen en proposities. Samen met data engineers bouw je aan het data- en informatiefundament van Transavia, om een hoge kwaliteit van inzichten en informatieproducten te waarborgen.  Wat ga je doen? Als Data Analyst ben je op dagelijkse basis verantwoordelijk voor het verkrijgen van inzichten die direct in actie om te zetten zijn. Je voorziet de stakeholders in de juiste analyses en inzichten. Je helpt hen bij het identificeren van de Key Performance Indicators (KPI’s), en jij bent de persoon die alles weet over de KPI’s binnen jouw domein. Je maakt deze meetbaar, en interpreteert deze (trends) om tot concrete beslissingen en acties te komen. Je voorziet actief (gevraagd en ongevraagd) in inzichten en tooling die bijdragen aan de uitvoer van de strategie en het maken van betere keuzes binnen jouw domein, zoals een monitor van klanttevredenheid of een kostenmodel voor verstoringen; Je bent in staat om daar de juiste inhoud en vorm bij te kiezen qua databron, analyse en presentatie (rapportage, dashboard, of een andere vorm) welke je zelf ontwikkelt en indien nodig continu optimaliseert; Je kiest continu voor de juiste balans tussen het beheer van de bestaande dashboards en reporting voor de dagelijkse business, en nieuwe (strategische) vraagstukken die tot andere inzichten en invalshoeken leiden; Je stelt de business in staat om zelf meer data gedreven te werken, maar neemt ook een pro-actieve advies rol op je.  Waar ga je aan de slag? Vanuit het centrale Strategy, Data & Intelligence (SDI) team ben jij een belangrijke link tussen business en analytics, en begeleid je Transavia naar een meer datagedreven cultuur. Dit centrale team leidt de transformatie naar het datagedreven werken, adviseert afdelingen aan de hand van informatie en inzichten en bouwt aan data- en AI-oplossingen voor klanten en medewerkers van Transavia. Je werkt nauw samen met de rest van het team (bestaande uit Analytics Translators, consultants, data analysts, data scientists en data engineers), en de stakeholders binnen jouw domein. Welk domein dat is staat nog open; dit zal (een deel van) het Operations (waaronder crew planning, ground services en integrale planning), Corporate (waaronder HR, organizational development en sustainability) of Commercial (waaronder revenue management en sales) domein betreffen. Tevens onderhoud je nauwe samenwerking met onze collega’s van Transavia Frankrijk.  Wie ben jij? Je bent ‘wendbaar’, ofwel continu veranderingsbereid. Dit hebben we nodig om steeds beter te worden in wat we doen en mee te bewegen met de continu veranderende wereld om ons heen. Daarnaast ben je daadkrachtig, bevlogen, verantwoordelijk, vriendelijk, en je hebt dat “tikkeltje lef”. Jij hebt een HBO- of WO-diploma en/of ervaring opgedaan als (Data/Business) Analyst, (Onderzoeks) Consultant of in een vergelijkbare rol; Je bent beschikbaar voor minimaal 32 uur per week; Je beheerst de Nederlandse en Engelse taal in woord en geschrift.  Als Data Analyst heb je kennis van: het vertalen van business doelstellingen en ideeën in informatieproduct use cases het doorgronden van business processen en informatiebehoefte en het toetsen van informatiebehoefte aan business doelstellingen het uitvoeren van de verschillende fases in de ontwikkeling van rapportages en dashboards, van experimenteren tot en met het in productie en beheer nemen van business intelligence oplossingen het beheren van data, het onderzoeken van de betekenis van data en het genereren van inzichten uit data met behulp van BI tooling zoals PowerBI en SQL het uitleggen van datavraagstukken aan een non-expert publiek de complexiteit, mogelijkheden en onmogelijkheden van informatieproducten vanuit het perspectief van data analyse, science en engineering.  Wat kun je van ons verwachten? Werken voor dé nummer 1 budgetluchtvaartmaatschappij; Veel ruimte en initiatieven voor persoonlijke ontwikkeling; (afhankelijk van salaris) een eindejaarsuitkering; Vriendelijke & bevlogen collega’s; Last but not least; ben je reislustig, dan is onze IPB regeling (tegen mooie tarieven vliegen indien plaats beschikbaar) zeker de moeite waard! Afhankelijk van ervaring wordt deze vacature geschaald in functiegroep 8 of 9. Dit betekent dat wij op basis van kennis en ervaring een aanbieding doen tussen de 2.592,- en 4.519,- euro bruto per maand op basis van een fulltime dienstverband.  Over Transavia Ons motto is: ‘We make low cost feel good.’ We zetten daarbij graag een stap extra voor onze passagiers en voor elkaar. De sfeer in de organisatie kenmerkt zich door bevlogen medewerkers met een groen hart! Elke dag werken we met elkaar samen om een gemeenschappelijk doel te behalen: een memorabele klantbeleving. Als zelfstandige airline binnen de AIR FRANCE-KLM Groep verzorgen wij al 50 jaar lijndiensten en chartervluchten naar meer dan 100 bestemmingen in Europa en Noord-Afrika. Bij Transavia werken gemiddeld 2500 collega’s: 230 bij de Technische Dienst, 600 vliegers, 1300 cabin attendants en 370 kantoormedewerkers. Transavia is een dynamische organisatie (never a dull moment) die continu probeert bij te blijven in een veranderende luchtvaartwereld. Wil jij graag werken in een omgeving met enthousiaste daadkrachtig collega’s die oog hebben voor elkaar? Krijg je energie van verandering en vernieuwing en voel jij je het prettigst in een omgeving waar je regisseur bent van je eigen werk? Dan komen we graag met jou in contact.  Wil je solliciteren? Ben jij de Data Analyst die wij zoeken en kom je onze vloot fulltime versterken? Solliciteer dan direct via onderstaande button. Heb je vragen over deze vacature? Neem dan contact op met Noëll Wever, Lead Strategy, Data & intelligence via noell.wever@transavia.com Zij komt graag met je in contact! Jouw sollicitatieprocedure  Je solliciteert op de vacature! Binnen twee weken bekijken wij je sollicitatie en hoor je of wij je uitnodigen voor een gesprek. Eerste contact: Wij bellen je om kennis te maken en een afspraak in te plannen. Het eerste gesprek: er volgt een eerste (digitaal) gesprek met een teamleider en een collega uit het team. Is er een match? Dan volgt het tweede gesprek dat zich meer richt op de inhoud. Is de match compleet? Dan doen we je met veel plezier een voorstel en begint jouw reis bij Transavia! Wel moet je wegens (luchtvaart)veiligheidseisen eerst een screening doorlopen en maakt een antecedentenonderzoek deel uit van de procedure.  Werk je bij een bureau en wil je een kandidaat voorstellen voor deze vacature als Data Analyst bij Transavia? Bedankt, maar hier gaan we niet op in. We werven onze nieuwe collega graag zelf.",3/13/2021 18:51
