id,description,scrapetimesdescription
ba6bf89a4d2b86fb,"Wat ga je doen Als research analist ben je betrokken bij het onderzoek naar minimale restziekte bij chronische lymfatische leukemie. Leukemie is een heterogene ziekte waarbij er tijdens de cel aanmaak een differentiatie stop is opgetreden met daarbij een sterke cel proliferatie. Hierdoor vindt er een ophoping van jonge niet-functionele leukemische cellen plaats in de lymfklieren en in het bloed. De leukemische cellen die overblijven na chemotherapie noemen we minimale restziekte (minimal residual disease) oftewel MRD. We detecteren deze MRD cellen met behulp van multicolor flowcytometrie. De hoeveelheid MRD die achterblijft na chemotherapie is een maat voor de respons op de behandelingen daarmee een goede parameter voor het testen van nieuwe behandelingen. Daarnaast meten we vooraf aan de chemotherapie behandeling de mutatiestatus van de CLL cellen m.b.v. een moleculaire techniek. Onze laboratoria zijn allen ISO15189 gecertificeerd. Jouw activiteiten: Je werkt samen met een team van analisten uit o.a. diagnostiek en hebt contact met aanvragers in andere ziekenhuizen. Je voert m.b.v. moleculaire technieken de Mutatiestatus uit. Je detecteert MRD met behulp van multicolor flowcytometrie en analyseert de resultaten en administreert deze data nauwkeurig in onze database. Je geeft de uitslag door aan hematologen indien nodig. Wat we van je verwachten Je hebt een HLO diploma, of MLO met aantoonbare werkervaring. Ervaring met flowcytometrie is gewenst maar geen must. Je bent nauwkeurig en zorgvuldig en functioneert goed binnen een team maar kan ook zelfstandig werken. Je kunt goed communiceren en feedback geven en ontvangen. Wij zoeken een gedreven en collegiale research analist die in staat is om zelfstandig complexe flow cytometrische bepalingen uit te voeren. Ervaring met moleculaire technieken is een pré. Je hebt een analytische en oplossingsgerichte instelling. Je kunt goed geprotocolleerd werken en volgens eisen die aan certificering worden gesteld.  Waar ga je werken Het Laboratorium Speciële Hematologie is een klein (7-8 medewerkers), zelfstandig laboratorium Het Laboratorium Speciële Hematologie werkt nauw samen met de afdeling Klinische Hematologie van de Divisie Inwendige Specialismen. Op termijn gaat het laboratorium samen met het Hematologisch Laboratorium van het VUmc en, in verband met de concentratie van de oncologische zorg op deze locatie, daar ook gesitueerd worden. Naast dat je bijdraagt aan het klinisch onderzoek binnen de hemato-oncologie, behoren werkzaamheden binnen de diagnostiek ook tot de mogelijkheden. Meer weten over werken bij AMR? Kijk op https://werkenbijamc.nl/werken-bij-amr/. Wat we je bieden Wij bieden je ruime gelegenheid tot ontplooiing, verdieping en verbreding, extra scholing en een plek om te groeien! Werken bij Amsterdam UMC betekent werken in een inspirerende en professionele omgeving waar ontwikkeling, in alle opzichten, wordt gestimuleerd. Het salaris ligt tussen € 2.422,- en € 3.280,- bruto per maand op basis van 36 uur (schaal 7 CAO UMC). Wij bieden een contract voor 12 maanden. Naast uitstekende bereikbaarheid met het OV, zijn er voor medewerkers ook parkeerplaatsen beschikbaar. Pensioen wordt opgebouwd bij Be Frank. Kijk voor een overzicht van al onze andere arbeidsvoorwaarden op https://werkenbijamc.nl/arbeidsvoorwaarden-amr/ Amsterdam UMC heeft een open cultuur. Dit betekent dat wij hopen dat iedereen zich welkom voelt bij onze organisatie en dat wij streven naar het bieden van gelijke kansen aan iedereen. Wij nodigen dan ook alle geïnteresseerden van harte uit om te reageren op deze vacature. Laten we kennis maken Wil je direct solliciteren? Gebruik dan de knop ‘solliciteren’ op deze pagina. Wil je eerst meer informatie? Neem dan gerust contact op met Johan Dobber (Hoofdanalist Laboratorium Speciële Hematologie), via j.a.dobber@amsterdamumc.nl. Wij zien uit naar onze kennismaking! Een screening en/of medische onderzoek kunnen onderdeel uitmaken van de selectieprocedure. Toegang tot DigiD is hiervoor noodzakelijk. LET OP: In verband met de bestuurlijke fusie tussen AMC en VUmc, geldt voor deze vacature dat medewerkers van AMC én VUmc plaatsnemen in de selectiecommissie. Door jouw sollicitatie te versturen, ga je ermee akkoord dat jouw CV en Motivatiebrief door AMC ook gedeeld worden met (de bij de behandeling van deze vacature betrokken medewerkers van) VUmc en zij dus inzage hebben in de door jou opgestuurde persoonsgegevens.",3/13/2021 18:52
18b44ac5582ae6c1,"Functieomschrijving ‘Als consultant lever ik een actieve bijdrage aan succesvolle implementaties bij de gemeenten. Daarnaast leid ik medewerkers van de klant op en begeleid ze tegelijkertijd op het gebied van onze applicaties.’ Jouw verantwoordelijkheden Je levert een actieve bijdrage aan succesvolle implementaties bij gemeenten; Met jouw leuke persoonlijkheid leid je de medewerkers van de klant op en begeleidt ze tegelijkertijd op het gebied van onze applicaties; Je levert een actieve bijdrage in ons team van consultants en projectmanagers om ons services aanbod bij gemeenten verder te ontwikkelen en te professionaliseren; Wanneer je tegen complexe zaken aanloopt, vorm je met jouw servicedesk collega’s een team en draaien jullie creatieve breinen op volle toeren om tot een oplossing te komen; Bij vragen en meldingen/wensen met betrekking tot onze innovatie oplossingen en applicaties ben jij het aanspreekpunt voor de gebruikers bij gemeenten; Klantvragen afhandelen die zowel technisch als functioneel inhoudelijk van aard zijn. Rosa de Heus, Manager Services ‘Onze klanten werken met de meest innovatieve software-oplossingen. Maar software is niets zonder maximale inzet van support en consultancy om het voor de klant ook écht te laten werken. Wat je hiervoor terug krijgt? Zeer tevreden klanten, optimale ondersteuning, ruimte om je te ontwikkelen en een superteam van collega’s!’ Wat vragen we van jou? Een enthousiaste IT Consultant met een afgeronde HBO/WO opleiding en 0-2 jaar werkervaring; Toegewijd, Ondernemend en Vooruitstrevend, de kernwaarden van ons bedrijf; Je hebt affiniteit met het toepassen van ICT oplossingen binnen het gemeentelijk domein in het algemeen en met administratieve processen; Met jouw creatief oplossingsvermogen is elk obstakel een uitdaging die je graag aangaat en stress komt daarbij niet voor in jouw woordenboek; Communicatieve ster, een goede luisteraar en een rasechte analist; Positief ingesteld waardoor jij een ideale teamplayer bent met goede interpersoonlijke vaardigheden. Dit bieden wij jou Een werkplek door heel Nederland met als standplaats ’s-Hertogenbosch; Voldoende opleidingsmogelijkheden en doorgroeimogelijkheden; Vakantiegeld, want wij gunnen onze harde medewerkers natuurlijk een hele fijne vakantie en 26 vakantiedagen om het op te maken (op voorwaarde dat je terugkomt); Flexibele werktijden; Goede arbeidsvoorwaarden, waaronder een zeer uitgebreid pakket aan secundaire voorwaarden; Een laptop (incl. accessoires), telefoon (budget) en abonnement; Een uitdagende functie waarin je zowel zelfstandig als in teamverband werkt en waar eigen inbreng zeer gewaardeerd wordt. In een innovatieve en motiverende omgeving met ‘creative minds’ die op dynamische wijze invulling geven aan hun werkdag. Over PinkRoccade Local Government en de business unit Informatievoorziening PinkRoccade Local Government is een Vooruitdenker, een partner die goed zicht heeft op de ontwikkelingen van morgen en deze vandaag weet toe te passen. Wij hebben passie voor de lokale overheid. Samen met onze klanten willen we er voor zorgen dat ze klaar zijn voor de veranderingen van morgen en zich kunnen richten op hun primaire taken, namelijk dienstverlening voor de inwoners. De business unit Informatievoorziening biedt gespecialiseerde software en ondersteuning waarmee onze klanten hun kerntaak rondom het beheren en ontsluiten van data efficiënt, betrouwbaar en volgens wettelijke kaders invullen. In co-creatie met klanten ontwikkelen wij informatie- en kennisgerichte oplossingen waarmee de klant in staat is beleid te vormen en uit te voeren. Wij nemen de complexiteit van het beheer uit handen en leveren informatie aan die direct bruikbaar is. Wij zijn ervan overtuigd dat het inspelen op en slim toepassen van technische ontwikkelingen de sleutel tot succes zijn! Ben jij die gedreven Consultant? Vertel ons in een motivatiebrief (of video) waarom jij de waardevolle toevoeging bent voor ons succesvol bedrijf! Vergeet je CV niet toe te voegen en de naam van de vacature te vermelden. Toch nog vragen over de vacature of sollicitatieprocedure? Neem dan contact op met onze HR Adviseur: Fenna de Ridder via +31 (0)88 1101 500",3/13/2021 18:53
9a337d85980565a2,"Heb je er altijd al eens achter willen komen hoe het is om binnen Compliance bij een bank of andere (financiële) instelling te werken? Ben je onlangs (of bijna) HBO of WO afgestudeerd en ben je op zoek naar een mooie start van je carrière? Met ons Traineeship Compliance bieden wij jou als Young Professional de kans om binnen een toonaangevende en dynamische omgeving jezelf te ontwikkelen tot Compliance Professional. Kortom, ben jij gemotiveerd om aan de slag te gaan als Junior Consultant bij een van de leukste bedrijven van de randstad? Twijfel dan niet en lees dan snel de rest van onze vacature! Wat ga je doen? Als Compliance Consultant voer je onderzoek uit naar klanten van financiële/bancaire instellingen. Je voert risico analyses uit en probeert door middel van deskresearch en gesprekken met de klant eventuele integriteits- en bancaire risico’s te signaleren. Daarnaast doe jij als consultant voorstellen ten aanzien van beheermaatregelen of deze risico’s af te wenden en je bevindingen rapporteren in een klantrapport. Bij Dux Talents staat ontwikkeling centraal en krijg je daarom ook maandelijks uitdagende trainingen om je te ontwikkelen en te ontplooien tot een volwaardige Compliance Officer, Fraudespecialist, KYC analist of CDD analist. Wat bieden wij? Een kans om ervaring op te doen bij (inter)nationale top bedrijven; Salaris dat met je meegroeit; Uitdagende opdrachten en projecten; Vakinhoudelijke trainingen om je te blijven ontwikkelen; Kansen en groei, we zijn een jonge club en stimuleren ondernemerschap; Aandacht voor persoonlijke- én professionele ontwikkeling. Wij zien dit als een kernwaarde!  Wat verwachten wij van jou als Consultant? Een (bijna) afgeronde hbo of wo-diploma, bij voorkeur in de richting Bedrijfskunde, Rechten, Criminologie of Economie; Maximaal drie jaar werkervaring; Je bent ambitieus, communicatief sterk en hebt een positieve instelling; Je krijgt energie van de combinatie doen & denken, werk kunnen verzetten en verbeteringen aan durven dragen Je hebt een goede beheersing van de Nederlandse- en Engelse taal. Over Dux Talents In een hechte club van jonge mensen werken wij dagelijks aan verschillende projecten en vraagstukken met een grote impact. Wij geven onze talenten de kans om zichzelf te onderscheiden en ontwikkelen op zowel persoonlijk als professioneel vlak door de juiste uitdagende mix van werkgevers, opdrachten, adviseurs en trainingen. Dit geeft Dux Talents een unieke plek in de markt. Wij zijn een erg informele en platte organisatie met gemotiveerde collega's die van gezelligheid houden. Buiten de goede work-life balance om zorgen wij voor een hoop leuke uitjes en borrels om de start van je carrière onvergetelijk te maken!  Binnen Dux Talents zijn op basis van je ontwikkeling en functioneren ook enorm veel doorgroeimogelijkheden. Geïnteresseerd of heb je vragen? Dan spreken wij graag eens af bij ons op kantoor, of in een van onze favoriete horecagelegenheden, voor een goed gesprek en nog betere koffie (thee mag natuurlijk ook).",3/13/2021 18:53
fd895a666e4d8b08,"Waarom werken bij FENOR Energie in Heerenveen? FENOR is opgericht in 2012 en sinds die dag gegroeid tot een energieleverancier op de energiemarkt waarbij het de service levert die klanten verwachten. Inmiddels bestaat het team uit professionals met ervaring in de energiesector. We zijn niet te groot en niet te klein, maar precies goed! We combineren flexibiliteit en benaderbaarheid van een kleine organisatie met de expertise en slagkracht van een grote organisatie.  Iedereen heeft zo zijn eigen redenen om voor FENOR te werken. De persoonlijke uitdaging, het persoonlijke doel, de sfeer of de arbeidsvoorwaarden. Het doel wat ons verbindt is dat je een bijdrage kan leveren aan een slimmer, schoner en duurzamer Nederland. Dat wil jij toch ook?  Samen met ambitieuze collega’s zorg jij er dagelijks voor dat we weer een stapje dichterbij komen om ons doel te bereiken. Ik ben benieuwd naar jouw keuze!  Wie ben je? Je bent een energiek en proactief persoon die toe is aan een nieuwe uitdaging in de energiesector. Daarnaast heb je ervaring met het opstellen van rapportages en kan je duidelijke inzichten bieden. Je bent niet alleen zelfstandig, maar ook in staat om collega’s te challengen om doelen te bereiken.  Wat ga je doen? Als Data analist help jij ons met het realiseren van onze ambities. Met jouw data-driven mindset help jij jouw collega’s met de juiste data en genereer je waardevolle inzichten. Jij ziet uit de data de verbanden en vertaalt deze naar kansen die bijdragen aan de optimalisatie.  Verantwoordelijkheden  Je analyseert interessante trends in de data en weet dit te vertalen naar de dashboards; Je bent (mede)verantwoordelijk voor tijdige en volledige rapportages die worden gebruikt als stuurinformatie; Je rapporteert aan de Business controller; En draagt bij aan het automatiseren van de rapportages en analyses.  Wat breng je mee?  HBO niveau, een hands-on mentaliteit en analytisch sterk; Ervaring met het opzetten en werken met databases; Goede beheersing van SQL; Ervaring met BI tools en dashboards; Kennis van Linux is een pré; Uitstekende beheersing van de Nederlandse taal in woord en geschrift; Woonachtig in Heerenveen (of nabije omgeving); Beschikbaarheid van 32-40 uur per week; Enkele steekwoorden: proactief, analytisch, projectmatig, zelfstandig en oplossingsgericht.  Wat hebben we je te bieden?  Marktconform salaris Informele werksfeer; Jong en ambitieus team; Direct bij ons in dienst; Personeelsuitjes met gezellige borrels (zodra het weer mogelijk is).  Zie jij jezelf al als onze nieuwe Data analist? Reageer dan snel en stuur jouw motivatie en CV per mail naar vacature@fenor.nl t.a.v. Stijn Joustra",3/13/2021 18:53
837a5b4257d758c5,"Jouw nieuwe baan en werkplek Do you want to make big impact, work for over 10 international brands within Ahold Delhaize (e.g. Albert Heijn, Bol.com. Delhaize, Stop & Shop and Food Lion) and work within our newly formed European Data Science & Analytics team? Then we are looking for you.  Within Ahold Delhaize we are looking for a Principal Data Scientist Forecasting and a Principal Data Scientist Personalization & Relevance. As you being the expert in one of these domains you will work closely together with our data science and analytics teams from our brands (Albert Heijn, Delhaize, Etos etc.) and the regional US team. We seek mutual opportunities, work together on implementing state-of-the-art data solutions and help them taking data science and analytics to a higher level. You are an expert in identifying, implementing and improving data solutions driving sustainable value for our customers and businesses. You participate in the cross functional scrum teams with the lead brand and you have a strong vision on data solutions. As Principal Data Scientist you will create impact at scale, as we want to scale and leverage these solutions across the brands.  In this European team we are organized around three domains within data science: forecasting, search and personalization & relevance. In the team you will be working with data scientists, data analysts, data governance experts, experimentation experts and ML engineers. Examples of products you will be working on are developing customer demand forecasting models for our e-Commerce businesses, workforce planning models for our distribution centers and replenishment models for our stores.  Next to this, you will also set up and lead the global data science community with this domain. You will build connections with the data scientists across Ahold Delhaize who are working on models and solutions, such that knowledge, best practices and algorithms can be shared. This community of practice will be enhancing transparency, collaboration and developing together.  As our Principal Data Scientist you are the most important Data Science go to person within your domain. You collaborate with various levels in our company; from data scientist up to senior leadership. To do so, you’re a pragmatic scientist who still likes getting his/her hands dirty. As you are the expert within Forecasting you will spread your knowledge across our company. In this way you will improve numerous products and the experiences of millions of customers every single day.   ?As Principal Data Scientist at Ahold Delhaize you: Act as thought leader on Forecasting or Personalization & Relevance to our colleagues and external stakeholders. Collaborate & inspire our business in identifying, understanding and prioritizing business needs into data science solutions. You understand what it takes to develop a model, industrialize the model and improve it via experimentation. Provide input on future development and possibilities to support strategic (mid- to long term) planning of data science. You understand the importance of fairness and ethical use of AI. Build a network of relevant people to gain excess to cutting edge data methodologies and share knowledge and best practices within personalization and relevance. Explore new data science solutions for our brands and keep developing business driven data science solutions. Have a strong focus on creating value. Coach/mentor a team of data scientists and lead our community of practice. Have a pragmatic mindset; you understand the larger data science picture, the spot on the horizon, but also have a very pragmatic approach to this. ? Your Office.? As Principal Data Scientist you will work at and across Ahold Delhaize where approximately 370,000 employees worldwide serve over 50 million customers a week. Locally, you’ll be working with 1,500 colleagues in Zaandam, the Netherlands. We improve and innovate every day, supporting our trusted local brands and reinforcing our role as a leader in retail and e-commerce.  You will be joining the newly formed Data Science & Analytics team. In this team we deliver scalable data products and building bridges between the different data science & analytics teams from our brands.  Covid-19 Our main priority continues to be the health and safety of our employees and customers. Due to the Covid-19 pandemic, this position will be remote until further notice. We will continue monitor the circumstances and when we feel comfortable, this position will return to our Headquarters in Zaandam, where you will have the opportunity to collaborate face-to-face with a talented and diverse group of colleagues. This also means that all job interviews for this position will take place via video calls. Dit bieden we jou At Ahold Delhaize we want to grow. That is only possible if you grow with us. That is why you get access to best in class guidance and inspiring training, to shape your own development and career. As we work together to build on our brand as well as your career, you can count on (based on 40 hours per week): a gross yearly salary up to € 90K + 8% vacation pay, so you can enjoy a well-deserved rest. a bonus on top of your salary. a very good pension plan with a personal contribution of 6.2%. 20 vacation days. A budget choice which you can decide whether you spend it on extra days (+12,5 days), discounts or pay-outs. the possibility to attend training courses at our expense.? attractive discounts on various insurance policies. a laptop and telephone. 10% discount on your grocery shopping in our Albert Heijn stores, up to € 300 per year. flexible working hours and the possibility to work from home. a travel allowance for traveling to and from Zaandam, when we return to office. A new role in a new team, where you can add a lot of value. Dit breng je mee At Ahold Delhaize, you'll be working for one of the world's biggest retailers, and we know you are bursting with the ambition to keep up with us. You supplement this ambition with: a Master in Data Science, Mathematics, Econometrics, A.I., Computer Science or other relevant (technical) studies. If no relevant study, demonstrably relevant experience and results; 7+ years of experiencing in designing and building end-to-end AI/ML solutions on cloud infrastructure - Azure is preferred; practical knowledge of orchestrating production ML pipelines with CI/CD flows; being a power-user of open-source eco-system of algorithms and tools for forecasting or personalization & Relevance; great communication skills; you explain complex matter in an easy and enthusiastic way to business stakeholders and connect (to) people; deep knowledge of sequence modeling including statistical models like- ARIMA, classical models like - LGBM, state of the art models like- Transformers, LSTM, Neural networks; For the forecasting domain: experience with CPG industry demand forecast/ models like online demand forecast for web shops, replenishment algorithms at different labels of granularity – SKU level, store level, warehouse level and supplier level; For the personalization & relevance domain: good experience with CPG industry relevant personalization models like promotion personalization, search personalization, contextual cross-sell; advanced statistical knowledge of hypothesis testing, A/B testing, ANOVA, correlations, similarity measures, factors of variations, different probability distributions. experience working with both continuous, categorical and nominal data as input to models. several examples of successfully implemented data science projects.  Apply.? Do you want to play an active role in changing the food retail landscape as we know it? Then hop onboard and join us on our expedition. Apply now via the button on this page. We ask you not to send a standard motivation letter, but to formulate an answer to the following questions: Why would you like to work for Ahold Delhaize? Why do you think you will be successful in this position and what kind of technical skills do you bring with you for this role? What is one of your personal strengths and one skill you wish to improve or develop?  Want to learn more first, before you apply? Caroline Fluit, hiring manager and Micha Lekawael, Talent Acquisition Partner are happy to tell you everything about this vacancy via caroline.fluit@aholddelhaize.com or micha.lekawael@ah.nl  WO Senior Data-science NLD-Zaandam, Provincialeweg 11 Je gaat werken bij",3/13/2021 18:53
