id,description,scrapetimesdescription
539e4f37b7a17198,"Functieomschrijving ""In mijn werk pas ik kwantitatieve methoden en technieken toe op bedrijfskundige vragen. Een (beperkte) hoeveelheid programmeerwerk, het zien van mogelijkheden en nadenken over ‘de vraag achter de vraag’ horen erbij. Een lange adem is vereist want onze projecten variëren van weken tot jaren."" Karel Lindveld business analist bij de Belastingdienst. Binnen de centrale administratieve processen (CAP) van de Belastingdienst is een team van verbetercoaches en kwantitatief business analisten werkzaam dat managers ondersteunt met onder meer bedrijfsrapportages, waarin de kwantitatief business analisten zichtbaar maken wat nú relevant en actueel is voor hun bedrijfsvoering en in de toekomst mogelijk gaat zijn! Door het heel diverse én massale karakter van deze processen heeft het team te maken met omvangrijke datastromen die worden geanalyseerd om complexe besturings- en besluitvormingsvraagstukken te helpen oplossen. In jouw rol van kwantitatief business analist draag jij hieraan bij door de data- en informatiebehoefte en processen in kaart te brengen om vervolgens de juiste methode te bepalen om (statistische) analyses uit te kunnen voeren of waar nodig prototypes of productietools te ontwerpen en bouwen. Zo verschaf je inzicht in en geef je vorm aan verbetering, planning en sturing van die processen. De focus van je werkzaamheden ligt dan ook in het uitvoeren van vernieuwende (en veelal eenmalige) analyses en tools. Je werkt nauw samen met stakeholders en met business partners die vanuit de techniek betrokken zijn bij systemen, data- en analyse-tooling: jouw contacten variëren van senior business managers tot ITspecialisten. Als medewerker van de Belastingdienst krijg je altijd volop de ruimte om jezelf voortdurend (vakinhoudelijk) te ontwikkelen en maatschappelijke trends en bewegingen te volgen. Bijvoorbeeld door deel te nemen aan bijeenkomsten, conferenties of seminars. En dat geldt dan natuurlijk ook en misschien wel met name voor jou als business analist omdat die samen met ons op weg moet gaan naar de Belastingdienst van de toekomst. Word jij de nieuwe collega van Karel of wil je liever eerst eens praten over jouw, misschien wel toekomstige werkzaamheden? Neem dan contact met Nort Geurts of Karel Lindveld.  Functie-eisen Je hebt een wo-diploma (toegepaste) wiskunde, natuurkunde, econometrie of bedrijfsinformatica. Je hebt kennis van en ervaring met het extraheren van data uit grootschalige relationele databanken. Je hebt kennis van en ervaring met datamodellering en statistische methodologie, zoals forecasting, hypothesetests, voorspellende modellen en met het opmaken van experimentele ontwerpen. Je bent vaardig in het programmeren in SAS of in vergelijkbare tooling, zoals SPSS of MATLAB. Als je ervaring hebt met SAS-producten (bijvoorbeeld Base, Enterprise Guide, Miner) is dat een pre. Jouw competenties? netwerken omgevingsbewustzijn organisatiesensitiviteit overtuigingskracht resultaatgerichtheid Herken jij jezelf ook hierin? Je hebt oog voor detail en tegelijkertijd kun je denken in grote lijnen. Je stelt hoge eisen aan resultaatgerichtheid en dienstverlening en je wil hobbels op de weg doen verdwijnen. Je bent helder in je aanpak en de daaruit voortvloeiende adviezen. Uiteraard stem je jouw werkzaamheden af met directe collega's, maar je neemt ook zelf initiatief. Én je hecht belang aan persoonlijke ontwikkeling en het op de hoogte blijven van datgene wat er speelt binnen jouw vakgebied. Je bent een teamspeler met goede communicatieve vaardigheden. Arbeidsvoorwaarden Salarisniveau schaal 12 Salarisomschrijving In beginsel kan inschaling in de naast lagere salarisschaal plaatsvinden. Bij aanwezigheid van relevante kennis, ervaring of om arbeidsmarktoverwegingen kan inschaling op een hogere positie in de desbetreffende salarisschaal plaatsvinden. Ook bestaat de mogelijkheid om in bijzondere gevallen waarin de aanwezige kennis en/of ervaring dit rechtvaardigt, direct in de bij de functie behorende salarisschaal in te schalen. Maandsalaris Min €3.842,- - €5.710,- (bruto) Dienstverband Tijdelijke aanstelling / Arbeidsovereenkomst voor bepaalde tijd met uitzicht op onbepaalde tijd Minimum aantal uren per week 32 Maximum aantal uren per week 36  Naast salaris ontvang je ook een individueel keuzebudget (IKB). Jouw IKB bestaat uit geld (IKB-budget) en tijd (IKB-uren). Het IKB geeft je de mogelijkheid om naar eigen keuze een deel van je IKB-budget te laten uitbetalen op de door jou gekozen tijdstippen. Én je hebt de mogelijkheid om je IKB-budget deels om te zetten in verlof of andersom. Ook kun je het IKB-budget besteden aan een fiscaal-vriendelijk doel, zoals bijvoorbeeld een fiets, bedrijfsfitness of vakliteratuur.  De Rijksoverheid hecht sterk aan persoonlijke groei en loopbaanontwikkeling en biedt daarvoor tal van mogelijkheden. Tot de secundaire arbeidsvoorwaarden behoren onder meer studiefaciliteiten, ouderschapsverlof en een vergoeding woon-werkverkeer.  Wij verwachten van onze werknemers dat ze integer zijn en we vragen aan nieuwe medewerkers een Verklaring Omtrent Gedrag (VOG). Als deze niet kan worden overlegd, volgt geen arbeidsovereenkomst of wordt de arbeidsovereenkomst na uiterlijk 3 maanden beëindigd wanneer duidelijk is dat geen VOG overgelegd kan worden.  De afdeling - Directie Centrale Administratieve Processen  De Directie Centrale Administratieve Processen (CAP) is verantwoordelijk voor een soepele en foutloze ontvangst, verwerking en verzending van (fiscale) gegevens van en aan burgers en bedrijven door het leveren van (fiscale) producten en gegevensdiensten. CAP is ook verantwoordelijk voor de betaalfunctie en de sturing van de massale productieprocessen (regiefunctie voor massale verwerking en beheersing). En om dit goed in te kunnen vullen, is CAP verantwoordelijk voor de integrale productieplanning en productiebeheersing. Bijzonderheden  Voor interne sollicitanten is deze vacature vijf werkdagen eerder zichtbaar dan voor externe sollicitanten. Na de sluitingsdatum worden alle sollicitanten in één keer beoordeeld, wat betekent dat de interne sollicitant dus niet beschikt over een voorrangspositie, tenzij er sprake is van gelijke geschiktheid.  We ontvangen je brief en cv graag in een Word- of PDF-bestand. Als je een beroep doet op een voorrangspositie, stuur dan ook een kopie van die kennisgeving mee.  Onze selectieprocedure voor deze functie ziet er als volgt uit: Allereerst wordt beoordeeld of een voorrangskandidaat binnen de Rijksoverheid in aanmerking komt voor deze functie. Daarna wordt beoordeeld of jouw cv en motivatiebrief voldoen aan de gestelde functie-eisen. Op 19 april 2021 vinden de selectiegesprekken plaats. Onderaan deze vacature vind je meer uitleg over de stappen die je doorloopt in de sollicitatieprocedure.  De voorkeur gaat uit naar kandidaten die het meest aansluiten bij het opgestelde profiel. Dit heeft betrekking op zowel de genoemde opleiding(en) als werkervaringseisen. Vermeld deze daarom duidelijk in je cv.  Medewerkers van de Belastingdienst die korter dan drie jaar in hun huidige functie werkzaam zijn of bezig zijn met een startopleiding of inwerktraject verzoeken we om in hun motivatiebrief duidelijk aan te geven wat de reden is om binnen de termijn van drie jaar te solliciteren.  De Belastingdienst zet zich in om medewerkers in dienst te nemen die onder de doelgroep van de Wet banenafspraak vallen. Val je in deze doelgroep en sta je in het doelgroepenregister? Dan nodigen we ook jou uit om te reageren! Samen met jou kijken we of en hoe je eventueel invulling kunt geven aan deze functie. Meer weten? Klik dan hier!  Een (online) voorselectietest en/of een assessment kan deel uit maken van de sollicitatieprocedure, evenals het maken van een casus, het opvragen van referenties en (online) screening, bijvoorbeeld via databanken, (zoekmachines) en sociale netwerken.  Jouw sollicitatie wordt alleen in behandeling genomen als je met de sollicitatie-button reageert en je cv en motivatiebrief zijn bijgesloten. Na sluitingsdatum is het niet meer mogelijk om je sollicitatie in behandeling te nemen. Houd er rekening mee dat het solliciteren technische problemen met zich mee kan brengen. Wacht hiermee dus niet tot het laatste moment.",3/13/2021 18:49
146d7a919f94b8e7,"Hoe maak jij onze klanten blij? Bol.com verandert retail om het dagelijks leven van miljoenen mensen makkelijker te maken. Dat doen we samen met 40.000 zakelijke partners op ons ‘retail tech platform’. Maar we kopen ook zelf in, om een volledig assortiment tegen scherpe prijzen te verkopen op het platform. Dat doen we vanuit ons organisatieonderdeel voor eigen inkoop: ‘retailer 1’ – nog altijd de eerste, grootste en meest ervaren Retailer op het bol.com-platform. De eigen inkoop groeit en ontwikkelt zich nog altijd sterk, en blijft belangrijk voor het bol.com-platform om klanten elke dag goed te kunnen bedienen. Als (Senior) Commercial Analist help je die ambitie te realiseren. Jij geeft de prijsstrategie vorm van één of meerdere grote bol.com categorieën. Op basis van grote hoeveelheden data bepaal jij hoe we én een scherpe prijs kunnen voeren, maar ook nog een goede marge kunnen maken. Je beheerst de analytische ‘truc’ maar ziet ook de strategische context en neemt (senior) stakeholders mee in jouw richting. Wat je doet als Senior Commercial Analist Je geeft richting aan de retailstrategie van één of meerdere grote bol.com categorieën. Daarbij kijk je naar het prijsniveau, marge maar ook naar assortimentskeuzes Je coacht junior teamleden in het uitvoeren van de pricing- en assortimentstrategie van andere categorieën binnen jouw cluster (Electronics & Entertainment, FMCG & Books, Lifestyle & Living) Je analyseert commerciële drivers (sales/marktaandeel, prijsniveau, marge) en vertaalt die naar krachtige inzichten en adviezen Je neemt de leiding op een strategisch onderwerp binnen Retail Excellence (op het gebied van pricing, marge, assortiment, data/dashboarding) en coacht collega’s op de uitvoering van de onderliggende projecten Je schakelt met (senior) stakeholders binnen bol.com over Retailer1 overstijgende projecten (platform strategie, promotie strategie, way-of-working) Als Senior Commercial Analist lever je een analytische én adviserende bijdrage aan het opvoeren van de Retailer 1 in- en verkoopmotor. Een transparante en internationale online retailmarkt vraagt om een intelligente strategie en snel schakelen. Jij bepaalt samen met de inkopers en de merchandisers welke prijsstrategie we volgen. Daarbij ben je niet vies van details, maar probeer je toch vooral dingen te automatiseren en schaalbaar aan te pakken. In het zog van de prijsstrategie ontwikkel je een duidelijke visie op het assortiment. Daarbij kijk je naar welke artikelen we voeren maar ook naar buying tactics waardoor we scherp geprijsd én winstgevend zijn. Buiten de scope van je categorie geef je als Senior Commercial Analist richting aan een groot thema binnen de afdeling. Samen met een groep collega’s bestuur je projecten die overstijgend ervoor gaan zorgen dat bol.com winnend blijft. Zo zijn we continu op zoek naar slimmere en snellere pricing strategieën. Ook willen we slimmer en meer geautomatiseerd inkopen waarbij we op basis van data niet alleen precies genoeg inkopen, maar tegen de juiste prijs. Bovendien zijn we de aanjagers van data gedreven werken. Samen met collega’s ontwikkel je dashboards en tooling waardoor we snellere en betere keuzes kunnen maken. Om in deze rol succesvol te zijn, dien je sterke analytische skills en goed commercieel inzicht aan communicatieve vaardigheden en overtuigingskracht te koppelen. Je hebt een pragmatische instelling ten opzichte van verbeteringen of oplossingen: ‘testen, evalueren en door’. Bovendien is het, hoe graag je ook met data worstelt, geen positie voor een solist. Je draait mee in meerdere en wisselende teams, waarbij je optrekt met Buyers en Supply Chain Excellence Specialisten. Afhankelijk van je ervaring lever je bovendien een (steeds grotere) bijdrage aan expertise ontwikkeling – bijvoorbeeld op het gebied van SQL, Google Big Query en Google DataStudio – en kun je jezelf ontwikkelen op het gebied van innovatie, project- of people management. Als Senior Commercial Analist fungeer je bovendien als coach voor je junior collega’s: op inhoud en op het proces. Je bent onderdeel van het Retail Excellence team (~ 20 collega’s die elkaar graag van feedback voorzien) en rapporteer je aan je teamlead en de Head of Retail Excellence. Andere belangrijke stakeholders zijn je clusterdirector, IT/innovatie-, finance en merchandising. 3 redenen waarom dit (n)iets voor jou is Wel, als je een WO Master hebt afgerond, zoals Econometrie, Economie of (Technische) Bedrijfskunde. Of als je een Technische Master combineert met een gezonde dosis commercieel vernuft Wel, als je analytische tools beheerst. Kennis van SQL, Python en/of Google DataStudio zijn een pré. Wel, als je al wat ervaring hebt op het snijvlak van data en (commerciële) strategie Niet, als je analyses als eindproduct beschouwt – wat collega’s ermee doen, is niet aan jou Niet, als je helemaal bent uitgeleerd en uitontwikkeld – klaar! Niet, als je meteen het bijltje erbij neergooit als je briljante idee in schoonheid sterft Hier kom je terecht Bij hét online retail tech platform van Nederland en België. Een platform waar 11 miljoen klanten kiezen uit meer dan 20 miljoen artikelen. En een platform dat zo’n 30.000 zakelijke partners helpt succesvol te ondernemen. Maar vooral een platform dat nooit ‘af’ is, want bol.com verandert retail al sinds 1999. En dat blijven we doen. Samen met onze klanten, partners en ruim 2.000 collega’s. En hopelijk samen met jou. Want samen veranderen we retail om het dagelijks leven makkelijker te maken. Elke dag opnieuw. Als Senior Commercial Analist werk je in een informeel, data-gedreven team. Maar wel een team dat inzichten als startschot ziet. Inzichten zijn mooi. Impact maken mooier. Daar gaan we dus helemaal voor. Waar vermoeden we verbeterkansen? Hoe bewijzen we de meerwaarde van nieuwe processen of tooling? We willen ons retail tech platform elke dag een beetje beter maken! Anderzijds springen we vaak in het projectmatige diepe. Bijvoorbeeld door kleine successen oneindig ver op te schalen en samen met IT naar productie te brengen. Wat je krijgt Jouw sollicitatieprocedure Je solliciteert We bekijken je sollicitatie zorgvuldig en binnen 2 weken laten we je weten of we je uitnodigen voor een gesprek Eerste contact We bellen om het eerste gesprek in te plannen. Prangende vragen kun je dan al meteen stellen. Ook nodigen we je uit voor ons online assessment met een persoonlijkheidsvragenlijst en capaciteitentest. Als de scores beneden onze norm blijken te zijn, is dat helaas voor ons reden om het gesprek af te zeggen. Het eerste gesprek Dit eerste gesprek gaan we kijken of er een inhoudelijke match is met de functie en een klik met het team en bol.com. Het vervolggesprek Het tweede gesprek richt zich op de competenties van de functie. Eventueel kan een case onderdeel zijn van de procedure. Wederzijdse match Twee gesprekken zijn vaak genoeg om een goed beeld te krijgen. En als we beiden enthousiast zijn dan doen wij je graag een aanbod bestaande uit een passend salaris en onze arbeidsvoorwaarden. Daarna begint jouw carrière bij bol.com. :) Nog vragen? Neem dan contact op met Jisk Vermeulen Recruiter jvermeulen@bol.com",3/13/2021 18:50
52debe4f9f9d522d,"Functieomschrijving Ben je analytisch sterk, leergierig en technisch onderlegd én heb je affiniteit met ICT? Eljakim IT bv is per direct op zoek naar een helpdesk medewerker (m/v). Eljakim IT is een softwarebedrijf uit Utrecht. Veel van onze projecten hebben een maatschappelijke betekenis. We zoeken creatieve oplossingen voor technische uitdagingen. Vanuit het kantoor in Utrecht ontwikkelen we al sinds 1996 software voor de overheid en non-profitorganisaties in onderwijs, zorg en welzijn. Eljakim IT kent een aantal standaard applicaties maar hecht ook veel waarde aan innoverende, uitdagende projecten en maatwerk. Bij Eljakim IT bv streven we kwaliteit na, ook als het gaat om onze bedrijfsvoering en hoe we omgaan met gevoelige informatie. In de rol als helpdesk medewerker laat jij zien hoe wij dit doen. Je staat direct in contact met de klant (eerstelijns helpdesk). Zo help je bijvoorbeeld klanten door informatie uit databases op te leveren. We zijn op zoek naar een gedreven persoon met oog voor kwaliteit. Eisen: HBO/WO-denkniveau Analytisch en sociaal sterk Kennis van/affiniteit met databases Complexe procedures eigen kunnen maken Leergierig Uitstekende lees- en schrijfvaardigheid Nederlands en Engels Woonachtig omgeving Utrecht Wij bieden: Een creatieve en ambitieuze werkomgeving Flexibele en ambitieuze collega’s Veel vrijheid voor eigen initiatief Marktconform salaris en secundaire arbeidsvoorwaarden Veel ruimte voor persoonlijke groei Een kans om onderdeel te zijn van een bedrijf dat aan maatschappelijk relevante en innovatieve technologieën werk. Soort dienstverband: Fulltime, Parttime, Onbepaalde tijd Soort dienstverband: Fulltime, Parttime, Onbepaalde tijd Opleiding: HBO (Aanbevolen) Taal: Engels (Aanbevolen) Nederlands (Vereist) Thuiswerken: Tijdelijk vanwege COVID-19 Voorzorgsmaatregelen tegen het coronavirus: Op afstand solliciteren Er gelden richtlijnen voor social distancing Virtuele vergaderingen",3/13/2021 18:50
3455d423462c047d,"Hoe lever jij een bijdrage?  Binnen Aegon zijn we gestart met een traject waarin het huidige relatiedata domein vernieuwd wordt. Op dit moment is ons team bezig met de implementatie van de DataHub ter introductie van het Golden relatie record. Door te zorgen voor continue stabiliteit van de diverse applicaties binnen het relatiedata domein. Je neemt verantwoordelijkheid, lost incidenten en problemen op. Dit doe soms zelfstandig, maar ook heel vaak in samenwerking met andere teams. Je hebt dus goede kennis van de business processen in een relatiedomein, de daar gebruikte applicaties en vindt het leuk om te blijven vernieuwen.  Op welke afdeling werk je?  Bij Aegon voelen we ons verantwoordelijk voor de financiële bewustwording van mensen. We bieden begrijpelijke oplossingen waardoor onze klanten zelf bewuste keuzes kunnen maken voor een gezonde financiële toekomst. Om succesvol te zijn in een snel veranderende wereld wil Aegon een toonaangevende speler zijn op het gebied van e-commerce en intelligence. In rap tempo passen we onze bestaande infrastructuur aan om klanten fundamenteel beter te bedienen. Ons bedrijfsonderdeel Business Information Services (BIS) is de spil in dit proces. Binnen BIS zetten we state-of-the-art information technologie in om de datastroom uit nieuwe applicaties te transformeren naar concrete, innovatieve toepassingen binnen Aegon. ESS Data & Relatie werkt voor alle Value streams binnen Aegon. ESS Data & Relatie biedt de ruggengraat voor alle (relatie) data om analytics en fact-based keuzes te maken voor ondersteuning aan de opgestelde business strategie. Hoe ziet het team eruit?  Het Customer Data Management team is verantwoordelijk voor de relatiedata in het Aegon Klant Overzicht Systeem (AKOS) en SalesForce. Vanuit diverse bronsystemen ontvangen wij relatiedata en dat brengen wij terug naar een klantbeeld. Ondertussen zetten wij grote stappen om een Golden Relatie Record te realiseren, dit doen wij door te werken aan de implementatie van de DataHub. Het team werkt Agile in sprints van twee weken aan continue verbeteringen.  Wat ga je doen?  Als Informatie Analist van de relatiedata applicaties: Heb je goed inzicht in de behoeften van de business, d.w.z. gebruikers van de diverse applicaties Maak je de vertaalslag naar processen en geautomatiseerde systemen, en zoek je naar creatieve innovatieve oplossingen tegen concurrerende kosten Zorg je ervoor dat de diverse applicaties altijd beschikbaar zijn wanneer de business dit vereist Analyseer je problemen (terugkerende incidenten) en kom je met verbeteracties en voorstellen Test je nieuwe functionaliteiten en releases voordat ze in beheer genomen worden Draag je zorg voor de diverse integraties met andere applicaties Doe je regelmatig checks op gebied van privacy, security, risk en compliance om ervoor te zorgen dat de applicaties ‘in control’ zijn volgens Aegon standaarden. Werk je mee aan het door ontwikkelen van de individuele applicaties (life cycle management) en de relatiedata platform als geheel Lever je een bijdrage aan de ontwikkeling en volwassenheid van het team Werk je continue aan je eigen professionele ontwikkeling   Ontwikkeling  Omdat de wereld snel verandert is het belangrijk dat het team en jij zelf continu werken aan persoonlijke en expertise ontwikkeling. Samen met je team bepaal je op welke wijze kennis en vaardigheden in het team in voldoende mate aanwezig zijn en blijven. Van jou wordt verwacht dat je je in de breedte ontwikkelt en daarnaast specialiseert. Dit zijn de kennis gebieden die wij hierbij onderscheiden: Business Value Optimization Business Analysis Architecture & Design Programming Continuous Delivery Test Specification Infrastructure Engineering Security, Risk & Compliance  Wat neem je mee? Je hebt minimaal een HBO werk- en denkniveau 5 jaar relevante werkervaring Je hebt kennis van en ervaring met Agile en Scrum Je hebt ervaring met relatiedata Je hebt ervaring met (business) requirement analyse en de vertaling hiervan naar een functioneel en/of technisch ontwerp, rekening houdend met non-functional requirements en kosten Je bent klantgericht, analytisch sterk, initiatiefrijk en beschikt over een goed probleemoplossend vermogen Je hebt kennis en ervaring met een of meer van de bovengenoemde kennisgebieden Je hebt affiniteit met Microservices architectuur, business proces management tooling en object georiënteerde ontwikkelmethoden. Je bent communicatief sterk op diverse niveaus, zowel mondeling als schriftelijk (Engels is een must) Je bent flexibel en vindt het leuk om aan nieuwe zaken te werken Je bent proactief op zoek naar kansen om iedere dag jezelf en het team verder te ontwikkelen Je bruist van ambitie en wil meewerken aan de transformatie van ons tot een toonaangevende, klantgerichte organisatie in financiële dienstverlening.   Arbeidsvoorwaarden  Wij bieden je een boeiende functie, waarin je zelfstandig en op professionele wijze te werk gaat in een ambitieuze en dynamische organisatie. Groei en ontwikkeling vinden wij belangrijk, daarom investeren we veel in onze medewerkers in de vorm van ontwikkelings- en doorgroeimogelijkheden. In ruil voor jouw betrokkenheid en inzet bieden wij je een uitgebreid pakket aan uitstekende primaire en secundaire arbeidsvoorwaarden, zoals:  Een bruto maandsalaris op basis van 40 uur van maximaal 6200. Daar bovenop ontvang je een vaste 13e maand en vakantievergoeding in de vorm van een maandelijks flexbudget van 16,7% van je maandsalaris. Goede werk/privé balans met minimaal 27 vakantiedagen. Een passende reiskostenvergoeding. Uitstekende pensioenregeling en korting op Aegon producten.   Interesse  Spreekt deze rol jou aan? Wij ontvangen dan graag jouw CV en motivatie via ons sollicitatie formulier op deze website. Een online assessment kan onderdeel uitmaken van het selectie proces. Voor meer informatie over de sollicitatieprocedure kun je contact opnemen met Max Krajenbrink, telefoonnummer 06-48564163. #LI-MK1",3/13/2021 18:50
